[I 2025-07-30 20:13:07,564] Trial 153 finished with value: 0.0015247080009430647 and parameters: {'width_NN_heal': 64, 'width_NN_state': 8, 'depth_NN_heal': 4, 'depth_NN_state': 2, 'mode_heal': 64, 'mode_state': 64, 'blocks_heal': 4, 'blocks_state': 4, 'lift_act_state': None, 'block_act_state': <built-in function gelu>, 'lift_act_heal': None, 'block_act_heal': <built-in function gelu>, 'width_heal': 32, 'width_state': 64, 'lr': 0.005, 'padding_heal': 9, 'padding_state': 18, 'optimizer': 'adam'}. Best is trial 101 with value: 0.0012072300305590034.
[I 2025-07-30 20:13:14,734] Trial 154 finished with value: 0.0013702085707336664 and parameters: {'width_NN_heal': 64, 'width_NN_state': 8, 'depth_NN_heal': 4, 'depth_NN_state': 2, 'mode_heal': 64, 'mode_state': 64, 'blocks_heal': 4, 'blocks_state': 4, 'lift_act_state': None, 'block_act_state': <built-in function gelu>, 'lift_act_heal': None, 'block_act_heal': <built-in function gelu>, 'width_heal': 32, 'width_state': 64, 'lr': 0.005, 'padding_heal': 9, 'padding_state': 18, 'optimizer': 'adam'}. Best is trial 101 with value: 0.0012072300305590034.
[I 2025-07-30 20:13:22,102] Trial 155 finished with value: 0.0014296903973445296 and parameters: {'width_NN_heal': 64, 'width_NN_state': 8, 'depth_NN_heal': 4, 'depth_NN_state': 2, 'mode_heal': 64, 'mode_state': 64, 'blocks_heal': 4, 'blocks_state': 4, 'lift_act_state': None, 'block_act_state': <built-in function gelu>, 'lift_act_heal': None, 'block_act_heal': <built-in function gelu>, 'width_heal': 32, 'width_state': 64, 'lr': 0.005, 'padding_heal': 9, 'padding_state': 18, 'optimizer': 'adam'}. Best is trial 101 with value: 0.0012072300305590034.
[I 2025-07-30 20:13:29,355] Trial 156 finished with value: 0.0015966091305017471 and parameters: {'width_NN_heal': 64, 'width_NN_state': 8, 'depth_NN_heal': 4, 'depth_NN_state': 2, 'mode_heal': 64, 'mode_state': 64, 'blocks_heal': 4, 'blocks_state': 4, 'lift_act_state': None, 'block_act_state': <built-in function gelu>, 'lift_act_heal': None, 'block_act_heal': <built-in function gelu>, 'width_heal': 32, 'width_state': 64, 'lr': 0.005, 'padding_heal': 9, 'padding_state': 18, 'optimizer': 'adam'}. Best is trial 101 with value: 0.0012072300305590034.
[I 2025-07-30 20:13:36,486] Trial 157 finished with value: 0.011794434860348701 and parameters: {'width_NN_heal': 64, 'width_NN_state': 8, 'depth_NN_heal': 4, 'depth_NN_state': 2, 'mode_heal': 64, 'mode_state': 64, 'blocks_heal': 4, 'blocks_state': 4, 'lift_act_state': None, 'block_act_state': None, 'lift_act_heal': None, 'block_act_heal': <built-in function gelu>, 'width_heal': 64, 'width_state': 64, 'lr': 0.005, 'padding_heal': 9, 'padding_state': 18, 'optimizer': 'adam'}. Best is trial 101 with value: 0.0012072300305590034.
[I 2025-07-30 20:13:46,090] Trial 158 finished with value: 0.0021666015964001417 and parameters: {'width_NN_heal': 64, 'width_NN_state': 8, 'depth_NN_heal': 4, 'depth_NN_state': 2, 'mode_heal': 64, 'mode_state': 64, 'blocks_heal': 4, 'blocks_state': 8, 'lift_act_state': None, 'block_act_state': <built-in function gelu>, 'lift_act_heal': None, 'block_act_heal': <built-in function gelu>, 'width_heal': 32, 'width_state': 64, 'lr': 0.005, 'padding_heal': 9, 'padding_state': 18, 'optimizer': 'adam'}. Best is trial 101 with value: 0.0012072300305590034.
[I 2025-07-30 20:13:53,300] Trial 159 finished with value: 0.0015605251537635922 and parameters: {'width_NN_heal': 128, 'width_NN_state': 8, 'depth_NN_heal': 4, 'depth_NN_state': 2, 'mode_heal': 64, 'mode_state': 64, 'blocks_heal': 4, 'blocks_state': 4, 'lift_act_state': None, 'block_act_state': <built-in function gelu>, 'lift_act_heal': None, 'block_act_heal': <built-in function gelu>, 'width_heal': 32, 'width_state': 64, 'lr': 0.005, 'padding_heal': 9, 'padding_state': 18, 'optimizer': 'adam'}. Best is trial 101 with value: 0.0012072300305590034.
[I 2025-07-30 20:14:00,497] Trial 160 finished with value: 0.0013375697890296578 and parameters: {'width_NN_heal': 64, 'width_NN_state': 8, 'depth_NN_heal': 4, 'depth_NN_state': 2, 'mode_heal': 64, 'mode_state': 64, 'blocks_heal': 4, 'blocks_state': 4, 'lift_act_state': None, 'block_act_state': <built-in function gelu>, 'lift_act_heal': None, 'block_act_heal': <built-in function gelu>, 'width_heal': 32, 'width_state': 64, 'lr': 0.005, 'padding_heal': 9, 'padding_state': 18, 'optimizer': 'adam'}. Best is trial 101 with value: 0.0012072300305590034.
[I 2025-07-30 20:14:07,231] Trial 161 finished with value: 0.001738848048262298 and parameters: {'width_NN_heal': 64, 'width_NN_state': 8, 'depth_NN_heal': 1, 'depth_NN_state': 2, 'mode_heal': 64, 'mode_state': 64, 'blocks_heal': 4, 'blocks_state': 4, 'lift_act_state': None, 'block_act_state': <built-in function gelu>, 'lift_act_heal': None, 'block_act_heal': <built-in function gelu>, 'width_heal': 32, 'width_state': 64, 'lr': 0.005, 'padding_heal': 9, 'padding_state': 18, 'optimizer': 'adam'}. Best is trial 101 with value: 0.0012072300305590034.
[I 2025-07-30 20:14:13,954] Trial 162 finished with value: 0.0013908367836847901 and parameters: {'width_NN_heal': 64, 'width_NN_state': 8, 'depth_NN_heal': 1, 'depth_NN_state': 2, 'mode_heal': 64, 'mode_state': 64, 'blocks_heal': 4, 'blocks_state': 4, 'lift_act_state': None, 'block_act_state': <built-in function gelu>, 'lift_act_heal': None, 'block_act_heal': <built-in function gelu>, 'width_heal': 32, 'width_state': 64, 'lr': 0.005, 'padding_heal': 9, 'padding_state': 18, 'optimizer': 'adam'}. Best is trial 101 with value: 0.0012072300305590034.
[I 2025-07-30 20:14:20,679] Trial 163 finished with value: 0.001424501882866025 and parameters: {'width_NN_heal': 64, 'width_NN_state': 8, 'depth_NN_heal': 1, 'depth_NN_state': 2, 'mode_heal': 64, 'mode_state': 64, 'blocks_heal': 4, 'blocks_state': 4, 'lift_act_state': None, 'block_act_state': <built-in function gelu>, 'lift_act_heal': None, 'block_act_heal': <built-in function gelu>, 'width_heal': 32, 'width_state': 64, 'lr': 0.005, 'padding_heal': 9, 'padding_state': 18, 'optimizer': 'adam'}. Best is trial 101 with value: 0.0012072300305590034.
[I 2025-07-30 20:14:27,445] Trial 164 finished with value: 0.0011818198254331946 and parameters: {'width_NN_heal': 64, 'width_NN_state': 8, 'depth_NN_heal': 1, 'depth_NN_state': 2, 'mode_heal': 64, 'mode_state': 64, 'blocks_heal': 4, 'blocks_state': 4, 'lift_act_state': None, 'block_act_state': <built-in function gelu>, 'lift_act_heal': None, 'block_act_heal': <built-in function gelu>, 'width_heal': 32, 'width_state': 64, 'lr': 0.005, 'padding_heal': 9, 'padding_state': 18, 'optimizer': 'adam'}. Best is trial 164 with value: 0.0011818198254331946.
[I 2025-07-30 20:14:34,180] Trial 165 finished with value: 0.0014138523256406188 and parameters: {'width_NN_heal': 64, 'width_NN_state': 8, 'depth_NN_heal': 1, 'depth_NN_state': 2, 'mode_heal': 64, 'mode_state': 64, 'blocks_heal': 4, 'blocks_state': 4, 'lift_act_state': None, 'block_act_state': <built-in function gelu>, 'lift_act_heal': None, 'block_act_heal': <function tanh at 0x7f8c12ab8cc0>, 'width_heal': 32, 'width_state': 64, 'lr': 0.005, 'padding_heal': 9, 'padding_state': 18, 'optimizer': 'adam'}. Best is trial 164 with value: 0.0011818198254331946.
[I 2025-07-30 20:14:40,909] Trial 166 finished with value: 0.0023906456772238016 and parameters: {'width_NN_heal': 64, 'width_NN_state': 8, 'depth_NN_heal': 1, 'depth_NN_state': 2, 'mode_heal': 64, 'mode_state': 64, 'blocks_heal': 4, 'blocks_state': 4, 'lift_act_state': None, 'block_act_state': <built-in function gelu>, 'lift_act_heal': None, 'block_act_heal': <built-in function gelu>, 'width_heal': 32, 'width_state': 64, 'lr': 0.001, 'padding_heal': 9, 'padding_state': 18, 'optimizer': 'adam'}. Best is trial 164 with value: 0.0011818198254331946.
[I 2025-07-30 20:14:47,654] Trial 167 finished with value: 0.0017440356314182281 and parameters: {'width_NN_heal': 64, 'width_NN_state': 8, 'depth_NN_heal': 1, 'depth_NN_state': 2, 'mode_heal': 64, 'mode_state': 64, 'blocks_heal': 4, 'blocks_state': 4, 'lift_act_state': None, 'block_act_state': <built-in function gelu>, 'lift_act_heal': None, 'block_act_heal': <built-in function gelu>, 'width_heal': 32, 'width_state': 64, 'lr': 0.005, 'padding_heal': 9, 'padding_state': 18, 'optimizer': 'adam'}. Best is trial 164 with value: 0.0011818198254331946.
[I 2025-07-30 20:14:54,436] Trial 168 finished with value: 0.0012369457399472594 and parameters: {'width_NN_heal': 64, 'width_NN_state': 8, 'depth_NN_heal': 1, 'depth_NN_state': 2, 'mode_heal': 64, 'mode_state': 64, 'blocks_heal': 4, 'blocks_state': 4, 'lift_act_state': None, 'block_act_state': <built-in function gelu>, 'lift_act_heal': <built-in function gelu>, 'block_act_heal': <built-in function gelu>, 'width_heal': 32, 'width_state': 64, 'lr': 0.005, 'padding_heal': 9, 'padding_state': 18, 'optimizer': 'adam'}. Best is trial 164 with value: 0.0011818198254331946.
[I 2025-07-30 20:15:01,457] Trial 169 finished with value: 0.007331876549869776 and parameters: {'width_NN_heal': 64, 'width_NN_state': 8, 'depth_NN_heal': 4, 'depth_NN_state': 1, 'mode_heal': 64, 'mode_state': 64, 'blocks_heal': 4, 'blocks_state': 4, 'lift_act_state': None, 'block_act_state': <built-in function gelu>, 'lift_act_heal': <built-in function gelu>, 'block_act_heal': <built-in function gelu>, 'width_heal': 4, 'width_state': 64, 'lr': 0.005, 'padding_heal': 18, 'padding_state': 0, 'optimizer': 'adam'}. Best is trial 164 with value: 0.0011818198254331946.
[I 2025-07-30 20:15:08,230] Trial 170 finished with value: 0.0011995896929875016 and parameters: {'width_NN_heal': 64, 'width_NN_state': 8, 'depth_NN_heal': 1, 'depth_NN_state': 2, 'mode_heal': 12, 'mode_state': 64, 'blocks_heal': 4, 'blocks_state': 4, 'lift_act_state': None, 'block_act_state': <built-in function gelu>, 'lift_act_heal': <built-in function gelu>, 'block_act_heal': <built-in function gelu>, 'width_heal': 32, 'width_state': 4, 'lr': 0.005, 'padding_heal': 9, 'padding_state': 18, 'optimizer': 'adam'}. Best is trial 164 with value: 0.0011818198254331946.
[I 2025-07-30 20:15:15,004] Trial 171 finished with value: 0.0015603244537487626 and parameters: {'width_NN_heal': 64, 'width_NN_state': 8, 'depth_NN_heal': 1, 'depth_NN_state': 2, 'mode_heal': 12, 'mode_state': 64, 'blocks_heal': 4, 'blocks_state': 4, 'lift_act_state': None, 'block_act_state': <built-in function gelu>, 'lift_act_heal': <built-in function gelu>, 'block_act_heal': <built-in function gelu>, 'width_heal': 32, 'width_state': 4, 'lr': 0.005, 'padding_heal': 9, 'padding_state': 18, 'optimizer': 'adam'}. Best is trial 164 with value: 0.0011818198254331946.
[I 2025-07-30 20:15:21,779] Trial 172 finished with value: 0.001545641920529306 and parameters: {'width_NN_heal': 64, 'width_NN_state': 8, 'depth_NN_heal': 1, 'depth_NN_state': 2, 'mode_heal': 12, 'mode_state': 64, 'blocks_heal': 4, 'blocks_state': 4, 'lift_act_state': None, 'block_act_state': <built-in function gelu>, 'lift_act_heal': <built-in function gelu>, 'block_act_heal': <built-in function gelu>, 'width_heal': 32, 'width_state': 4, 'lr': 0.005, 'padding_heal': 9, 'padding_state': 18, 'optimizer': 'adam'}. Best is trial 164 with value: 0.0011818198254331946.
[I 2025-07-30 20:15:28,561] Trial 173 finished with value: 0.001448350609280169 and parameters: {'width_NN_heal': 64, 'width_NN_state': 8, 'depth_NN_heal': 1, 'depth_NN_state': 2, 'mode_heal': 12, 'mode_state': 64, 'blocks_heal': 4, 'blocks_state': 4, 'lift_act_state': None, 'block_act_state': <built-in function gelu>, 'lift_act_heal': <built-in function gelu>, 'block_act_heal': <built-in function gelu>, 'width_heal': 32, 'width_state': 4, 'lr': 0.005, 'padding_heal': 9, 'padding_state': 18, 'optimizer': 'adam'}. Best is trial 164 with value: 0.0011818198254331946.
[I 2025-07-30 20:15:35,339] Trial 174 finished with value: 0.0016072056023404002 and parameters: {'width_NN_heal': 64, 'width_NN_state': 8, 'depth_NN_heal': 1, 'depth_NN_state': 2, 'mode_heal': 12, 'mode_state': 64, 'blocks_heal': 4, 'blocks_state': 4, 'lift_act_state': None, 'block_act_state': <built-in function gelu>, 'lift_act_heal': <built-in function gelu>, 'block_act_heal': <built-in function gelu>, 'width_heal': 32, 'width_state': 4, 'lr': 0.005, 'padding_heal': 9, 'padding_state': 18, 'optimizer': 'adam'}. Best is trial 164 with value: 0.0011818198254331946.
[I 2025-07-30 20:15:41,951] Trial 175 finished with value: 0.0013334574177861214 and parameters: {'width_NN_heal': 64, 'width_NN_state': 8, 'depth_NN_heal': 1, 'depth_NN_state': 1, 'mode_heal': 12, 'mode_state': 64, 'blocks_heal': 4, 'blocks_state': 4, 'lift_act_state': None, 'block_act_state': <built-in function gelu>, 'lift_act_heal': <built-in function gelu>, 'block_act_heal': <built-in function gelu>, 'width_heal': 32, 'width_state': 4, 'lr': 0.005, 'padding_heal': 9, 'padding_state': 18, 'optimizer': 'adam'}. Best is trial 164 with value: 0.0011818198254331946.
[I 2025-07-30 20:15:48,729] Trial 176 finished with value: 0.0016133335884660482 and parameters: {'width_NN_heal': 64, 'width_NN_state': 8, 'depth_NN_heal': 1, 'depth_NN_state': 2, 'mode_heal': 12, 'mode_state': 64, 'blocks_heal': 4, 'blocks_state': 4, 'lift_act_state': None, 'block_act_state': <built-in function gelu>, 'lift_act_heal': <built-in function gelu>, 'block_act_heal': <built-in function gelu>, 'width_heal': 32, 'width_state': 64, 'lr': 0.01, 'padding_heal': 9, 'padding_state': 18, 'optimizer': 'adam'}. Best is trial 164 with value: 0.0011818198254331946.
[I 2025-07-30 20:15:57,635] Trial 177 finished with value: 0.0014164180029183626 and parameters: {'width_NN_heal': 64, 'width_NN_state': 8, 'depth_NN_heal': 1, 'depth_NN_state': 1, 'mode_heal': 64, 'mode_state': 64, 'blocks_heal': 8, 'blocks_state': 4, 'lift_act_state': None, 'block_act_state': <built-in function gelu>, 'lift_act_heal': <built-in function gelu>, 'block_act_heal': <built-in function gelu>, 'width_heal': 32, 'width_state': 64, 'lr': 0.005, 'padding_heal': 9, 'padding_state': 18, 'optimizer': 'adam'}. Best is trial 164 with value: 0.0011818198254331946.
[I 2025-07-30 20:16:04,385] Trial 178 finished with value: 0.0018769983435049653 and parameters: {'width_NN_heal': 64, 'width_NN_state': 8, 'depth_NN_heal': 1, 'depth_NN_state': 2, 'mode_heal': 12, 'mode_state': 32, 'blocks_heal': 4, 'blocks_state': 4, 'lift_act_state': None, 'block_act_state': <built-in function gelu>, 'lift_act_heal': <built-in function gelu>, 'block_act_heal': <built-in function gelu>, 'width_heal': 32, 'width_state': 64, 'lr': 0.005, 'padding_heal': 9, 'padding_state': 18, 'optimizer': 'adam'}. Best is trial 164 with value: 0.0011818198254331946.
[I 2025-07-30 20:16:11,012] Trial 179 finished with value: 0.001547061139717698 and parameters: {'width_NN_heal': 64, 'width_NN_state': 8, 'depth_NN_heal': 1, 'depth_NN_state': 1, 'mode_heal': 64, 'mode_state': 64, 'blocks_heal': 4, 'blocks_state': 4, 'lift_act_state': None, 'block_act_state': <built-in function gelu>, 'lift_act_heal': <function tanh at 0x7f8c12ab8cc0>, 'block_act_heal': <built-in function gelu>, 'width_heal': 32, 'width_state': 64, 'lr': 0.005, 'padding_heal': 9, 'padding_state': 18, 'optimizer': 'adam'}. Best is trial 164 with value: 0.0011818198254331946.
[I 2025-07-30 20:16:17,776] Trial 180 finished with value: 0.0024730584118515253 and parameters: {'width_NN_heal': 64, 'width_NN_state': 8, 'depth_NN_heal': 1, 'depth_NN_state': 2, 'mode_heal': 12, 'mode_state': 12, 'blocks_heal': 4, 'blocks_state': 4, 'lift_act_state': None, 'block_act_state': <function tanh at 0x7f8c12ab8cc0>, 'lift_act_heal': <built-in function gelu>, 'block_act_heal': <built-in function gelu>, 'width_heal': 32, 'width_state': 64, 'lr': 0.005, 'padding_heal': 9, 'padding_state': 18, 'optimizer': 'adam'}. Best is trial 164 with value: 0.0011818198254331946.
[I 2025-07-30 20:16:24,514] Trial 181 finished with value: 0.0012362939305603504 and parameters: {'width_NN_heal': 64, 'width_NN_state': 8, 'depth_NN_heal': 1, 'depth_NN_state': 2, 'mode_heal': 64, 'mode_state': 64, 'blocks_heal': 4, 'blocks_state': 4, 'lift_act_state': None, 'block_act_state': <built-in function gelu>, 'lift_act_heal': None, 'block_act_heal': <built-in function gelu>, 'width_heal': 32, 'width_state': 64, 'lr': 0.005, 'padding_heal': 9, 'padding_state': 18, 'optimizer': 'adam'}. Best is trial 164 with value: 0.0011818198254331946.
[I 2025-07-30 20:16:31,245] Trial 182 finished with value: 0.0013769095530733466 and parameters: {'width_NN_heal': 64, 'width_NN_state': 8, 'depth_NN_heal': 1, 'depth_NN_state': 2, 'mode_heal': 64, 'mode_state': 64, 'blocks_heal': 4, 'blocks_state': 4, 'lift_act_state': None, 'block_act_state': <built-in function gelu>, 'lift_act_heal': None, 'block_act_heal': <built-in function gelu>, 'width_heal': 32, 'width_state': 64, 'lr': 0.005, 'padding_heal': 9, 'padding_state': 18, 'optimizer': 'adam'}. Best is trial 164 with value: 0.0011818198254331946.
[I 2025-07-30 20:16:38,000] Trial 183 finished with value: 0.0013994065811857581 and parameters: {'width_NN_heal': 64, 'width_NN_state': 8, 'depth_NN_heal': 1, 'depth_NN_state': 2, 'mode_heal': 64, 'mode_state': 64, 'blocks_heal': 4, 'blocks_state': 4, 'lift_act_state': None, 'block_act_state': <built-in function gelu>, 'lift_act_heal': None, 'block_act_heal': <built-in function gelu>, 'width_heal': 32, 'width_state': 64, 'lr': 0.005, 'padding_heal': 9, 'padding_state': 18, 'optimizer': 'adam'}. Best is trial 164 with value: 0.0011818198254331946.
[I 2025-07-30 20:16:44,741] Trial 184 finished with value: 0.0014686048962175846 and parameters: {'width_NN_heal': 64, 'width_NN_state': 8, 'depth_NN_heal': 1, 'depth_NN_state': 2, 'mode_heal': 64, 'mode_state': 64, 'blocks_heal': 4, 'blocks_state': 4, 'lift_act_state': None, 'block_act_state': <built-in function gelu>, 'lift_act_heal': None, 'block_act_heal': <built-in function gelu>, 'width_heal': 32, 'width_state': 64, 'lr': 0.005, 'padding_heal': 9, 'padding_state': 18, 'optimizer': 'adam'}. Best is trial 164 with value: 0.0011818198254331946.
[I 2025-07-30 20:16:51,569] Trial 185 finished with value: 0.0013668312458321452 and parameters: {'width_NN_heal': 64, 'width_NN_state': 8, 'depth_NN_heal': 1, 'depth_NN_state': 2, 'mode_heal': 64, 'mode_state': 64, 'blocks_heal': 4, 'blocks_state': 4, 'lift_act_state': None, 'block_act_state': <built-in function gelu>, 'lift_act_heal': None, 'block_act_heal': <built-in function gelu>, 'width_heal': 32, 'width_state': 64, 'lr': 0.005, 'padding_heal': 9, 'padding_state': 18, 'optimizer': 'adam'}. Best is trial 164 with value: 0.0011818198254331946.
[I 2025-07-30 20:17:00,748] Trial 186 finished with value: 0.0014086224837228656 and parameters: {'width_NN_heal': 64, 'width_NN_state': 8, 'depth_NN_heal': 1, 'depth_NN_state': 1, 'mode_heal': 64, 'mode_state': 64, 'blocks_heal': 8, 'blocks_state': 4, 'lift_act_state': None, 'block_act_state': <built-in function gelu>, 'lift_act_heal': None, 'block_act_heal': <built-in function gelu>, 'width_heal': 32, 'width_state': 64, 'lr': 0.005, 'padding_heal': 0, 'padding_state': 18, 'optimizer': 'adam'}. Best is trial 164 with value: 0.0011818198254331946.
[I 2025-07-30 20:17:10,229] Trial 187 finished with value: 0.002819386078044772 and parameters: {'width_NN_heal': 64, 'width_NN_state': 8, 'depth_NN_heal': 1, 'depth_NN_state': 2, 'mode_heal': 12, 'mode_state': 64, 'blocks_heal': 4, 'blocks_state': 8, 'lift_act_state': None, 'block_act_state': <built-in function gelu>, 'lift_act_heal': None, 'block_act_heal': <built-in function gelu>, 'width_heal': 32, 'width_state': 64, 'lr': 0.005, 'padding_heal': 9, 'padding_state': 18, 'optimizer': 'adam'}. Best is trial 164 with value: 0.0011818198254331946.
[I 2025-07-30 20:17:16,835] Trial 188 finished with value: 0.0013421158073469996 and parameters: {'width_NN_heal': 64, 'width_NN_state': 8, 'depth_NN_heal': 1, 'depth_NN_state': 1, 'mode_heal': 64, 'mode_state': 64, 'blocks_heal': 4, 'blocks_state': 4, 'lift_act_state': None, 'block_act_state': <built-in function gelu>, 'lift_act_heal': None, 'block_act_heal': <built-in function gelu>, 'width_heal': 64, 'width_state': 64, 'lr': 0.005, 'padding_heal': 9, 'padding_state': 18, 'optimizer': 'adam'}. Best is trial 164 with value: 0.0011818198254331946.
[I 2025-07-30 20:17:24,094] Trial 189 finished with value: 0.004593880847096443 and parameters: {'width_NN_heal': 128, 'width_NN_state': 8, 'depth_NN_heal': 4, 'depth_NN_state': 2, 'mode_heal': 12, 'mode_state': 64, 'blocks_heal': 4, 'blocks_state': 4, 'lift_act_state': <function tanh at 0x7f8c12ab8cc0>, 'block_act_state': None, 'lift_act_heal': None, 'block_act_heal': <function tanh at 0x7f8c12ab8cc0>, 'width_heal': 32, 'width_state': 64, 'lr': 0.005, 'padding_heal': 9, 'padding_state': 18, 'optimizer': 'adam'}. Best is trial 164 with value: 0.0011818198254331946.
[I 2025-07-30 20:17:30,711] Trial 190 finished with value: 0.0014718781458213925 and parameters: {'width_NN_heal': 64, 'width_NN_state': 128, 'depth_NN_heal': 1, 'depth_NN_state': 1, 'mode_heal': 64, 'mode_state': 64, 'blocks_heal': 4, 'blocks_state': 4, 'lift_act_state': None, 'block_act_state': <built-in function gelu>, 'lift_act_heal': <built-in function gelu>, 'block_act_heal': <built-in function gelu>, 'width_heal': 32, 'width_state': 64, 'lr': 0.005, 'padding_heal': 9, 'padding_state': 18, 'optimizer': 'adam'}. Best is trial 164 with value: 0.0011818198254331946.
[I 2025-07-30 20:17:37,464] Trial 191 finished with value: 0.0017084863502532244 and parameters: {'width_NN_heal': 64, 'width_NN_state': 8, 'depth_NN_heal': 1, 'depth_NN_state': 2, 'mode_heal': 64, 'mode_state': 64, 'blocks_heal': 4, 'blocks_state': 4, 'lift_act_state': None, 'block_act_state': <built-in function gelu>, 'lift_act_heal': None, 'block_act_heal': <built-in function gelu>, 'width_heal': 32, 'width_state': 64, 'lr': 0.005, 'padding_heal': 9, 'padding_state': 18, 'optimizer': 'adam'}. Best is trial 164 with value: 0.0011818198254331946.
