[I 2025-07-30 20:33:02,049] Trial 146 finished with value: 0.0017216576961800456 and parameters: {'width_NN_heal': 128, 'width_NN_state': 512, 'depth_NN_heal': 4, 'depth_NN_state': 1, 'mode_heal': 64, 'mode_state': 64, 'blocks_heal': 4, 'blocks_state': 8, 'lift_act_state': None, 'block_act_state': <built-in function gelu>, 'lift_act_heal': <function tanh at 0x7f55138b8cc0>, 'block_act_heal': None, 'width_heal': 64, 'width_state': 4, 'lr': 0.001, 'padding_heal': 18, 'padding_state': 9, 'optimizer': 'lbfgs'}. Best is trial 138 with value: 0.0014254398411139846.
[I 2025-07-30 20:33:04,631] Trial 147 finished with value: 0.010882223024964333 and parameters: {'width_NN_heal': 128, 'width_NN_state': 512, 'depth_NN_heal': 2, 'depth_NN_state': 1, 'mode_heal': 32, 'mode_state': 64, 'blocks_heal': 4, 'blocks_state': 1, 'lift_act_state': None, 'block_act_state': <built-in function gelu>, 'lift_act_heal': <function tanh at 0x7f55138b8cc0>, 'block_act_heal': None, 'width_heal': 4, 'width_state': 64, 'lr': 0.001, 'padding_heal': 18, 'padding_state': 9, 'optimizer': 'lbfgs'}. Best is trial 138 with value: 0.0014254398411139846.
[I 2025-07-30 20:33:09,590] Trial 148 finished with value: 0.0015301087405532598 and parameters: {'width_NN_heal': 128, 'width_NN_state': 512, 'depth_NN_heal': 4, 'depth_NN_state': 1, 'mode_heal': 64, 'mode_state': 64, 'blocks_heal': 4, 'blocks_state': 8, 'lift_act_state': None, 'block_act_state': <built-in function gelu>, 'lift_act_heal': <function tanh at 0x7f55138b8cc0>, 'block_act_heal': None, 'width_heal': 64, 'width_state': 4, 'lr': 0.001, 'padding_heal': 18, 'padding_state': 9, 'optimizer': 'lbfgs'}. Best is trial 138 with value: 0.0014254398411139846.
[I 2025-07-30 20:33:14,548] Trial 149 finished with value: 0.0015901660080999136 and parameters: {'width_NN_heal': 128, 'width_NN_state': 512, 'depth_NN_heal': 4, 'depth_NN_state': 1, 'mode_heal': 64, 'mode_state': 64, 'blocks_heal': 4, 'blocks_state': 8, 'lift_act_state': None, 'block_act_state': <built-in function gelu>, 'lift_act_heal': <function tanh at 0x7f55138b8cc0>, 'block_act_heal': None, 'width_heal': 64, 'width_state': 4, 'lr': 0.001, 'padding_heal': 18, 'padding_state': 9, 'optimizer': 'lbfgs'}. Best is trial 138 with value: 0.0014254398411139846.
[I 2025-07-30 20:33:19,503] Trial 150 finished with value: 0.0015770082827657461 and parameters: {'width_NN_heal': 128, 'width_NN_state': 512, 'depth_NN_heal': 4, 'depth_NN_state': 1, 'mode_heal': 64, 'mode_state': 64, 'blocks_heal': 4, 'blocks_state': 8, 'lift_act_state': None, 'block_act_state': <built-in function gelu>, 'lift_act_heal': <function tanh at 0x7f55138b8cc0>, 'block_act_heal': None, 'width_heal': 64, 'width_state': 4, 'lr': 0.001, 'padding_heal': 18, 'padding_state': 9, 'optimizer': 'lbfgs'}. Best is trial 138 with value: 0.0014254398411139846.
[I 2025-07-30 20:33:24,465] Trial 151 finished with value: 0.0018731746822595596 and parameters: {'width_NN_heal': 128, 'width_NN_state': 512, 'depth_NN_heal': 4, 'depth_NN_state': 1, 'mode_heal': 64, 'mode_state': 64, 'blocks_heal': 4, 'blocks_state': 8, 'lift_act_state': None, 'block_act_state': <built-in function gelu>, 'lift_act_heal': <function tanh at 0x7f55138b8cc0>, 'block_act_heal': None, 'width_heal': 64, 'width_state': 4, 'lr': 0.001, 'padding_heal': 18, 'padding_state': 9, 'optimizer': 'lbfgs'}. Best is trial 138 with value: 0.0014254398411139846.
[I 2025-07-30 20:33:29,425] Trial 152 finished with value: 0.0018869800260290504 and parameters: {'width_NN_heal': 128, 'width_NN_state': 512, 'depth_NN_heal': 4, 'depth_NN_state': 1, 'mode_heal': 64, 'mode_state': 64, 'blocks_heal': 4, 'blocks_state': 8, 'lift_act_state': None, 'block_act_state': <built-in function gelu>, 'lift_act_heal': <function tanh at 0x7f55138b8cc0>, 'block_act_heal': None, 'width_heal': 64, 'width_state': 4, 'lr': 0.001, 'padding_heal': 18, 'padding_state': 9, 'optimizer': 'lbfgs'}. Best is trial 138 with value: 0.0014254398411139846.
[I 2025-07-30 20:33:34,383] Trial 153 finished with value: 0.0015452849911525846 and parameters: {'width_NN_heal': 128, 'width_NN_state': 512, 'depth_NN_heal': 4, 'depth_NN_state': 1, 'mode_heal': 64, 'mode_state': 64, 'blocks_heal': 4, 'blocks_state': 8, 'lift_act_state': None, 'block_act_state': <built-in function gelu>, 'lift_act_heal': <function tanh at 0x7f55138b8cc0>, 'block_act_heal': None, 'width_heal': 64, 'width_state': 4, 'lr': 0.001, 'padding_heal': 18, 'padding_state': 9, 'optimizer': 'lbfgs'}. Best is trial 138 with value: 0.0014254398411139846.
[I 2025-07-30 20:33:39,343] Trial 154 finished with value: 0.0018003621371462941 and parameters: {'width_NN_heal': 128, 'width_NN_state': 512, 'depth_NN_heal': 4, 'depth_NN_state': 1, 'mode_heal': 64, 'mode_state': 64, 'blocks_heal': 4, 'blocks_state': 8, 'lift_act_state': None, 'block_act_state': <built-in function gelu>, 'lift_act_heal': <function tanh at 0x7f55138b8cc0>, 'block_act_heal': None, 'width_heal': 64, 'width_state': 4, 'lr': 0.001, 'padding_heal': 18, 'padding_state': 9, 'optimizer': 'lbfgs'}. Best is trial 138 with value: 0.0014254398411139846.
[I 2025-07-30 20:33:44,303] Trial 155 finished with value: 0.0014871852472424507 and parameters: {'width_NN_heal': 128, 'width_NN_state': 512, 'depth_NN_heal': 4, 'depth_NN_state': 1, 'mode_heal': 64, 'mode_state': 64, 'blocks_heal': 4, 'blocks_state': 8, 'lift_act_state': None, 'block_act_state': <built-in function gelu>, 'lift_act_heal': <function tanh at 0x7f55138b8cc0>, 'block_act_heal': None, 'width_heal': 64, 'width_state': 4, 'lr': 0.001, 'padding_heal': 18, 'padding_state': 9, 'optimizer': 'lbfgs'}. Best is trial 138 with value: 0.0014254398411139846.
[I 2025-07-30 20:33:49,261] Trial 156 finished with value: 0.0013996975030750036 and parameters: {'width_NN_heal': 128, 'width_NN_state': 512, 'depth_NN_heal': 4, 'depth_NN_state': 1, 'mode_heal': 64, 'mode_state': 64, 'blocks_heal': 4, 'blocks_state': 8, 'lift_act_state': None, 'block_act_state': <built-in function gelu>, 'lift_act_heal': <function tanh at 0x7f55138b8cc0>, 'block_act_heal': None, 'width_heal': 64, 'width_state': 4, 'lr': 0.001, 'padding_heal': 18, 'padding_state': 9, 'optimizer': 'lbfgs'}. Best is trial 156 with value: 0.0013996975030750036.
[I 2025-07-30 20:33:54,255] Trial 157 finished with value: 0.002006515394896269 and parameters: {'width_NN_heal': 128, 'width_NN_state': 512, 'depth_NN_heal': 4, 'depth_NN_state': 1, 'mode_heal': 64, 'mode_state': 64, 'blocks_heal': 4, 'blocks_state': 8, 'lift_act_state': None, 'block_act_state': <built-in function gelu>, 'lift_act_heal': <function tanh at 0x7f55138b8cc0>, 'block_act_heal': <function tanh at 0x7f55138b8cc0>, 'width_heal': 64, 'width_state': 4, 'lr': 0.001, 'padding_heal': 18, 'padding_state': 9, 'optimizer': 'lbfgs'}. Best is trial 156 with value: 0.0013996975030750036.
[I 2025-07-30 20:33:59,214] Trial 158 finished with value: 0.0020173629745841026 and parameters: {'width_NN_heal': 128, 'width_NN_state': 8, 'depth_NN_heal': 4, 'depth_NN_state': 1, 'mode_heal': 64, 'mode_state': 64, 'blocks_heal': 4, 'blocks_state': 8, 'lift_act_state': None, 'block_act_state': <built-in function gelu>, 'lift_act_heal': <function tanh at 0x7f55138b8cc0>, 'block_act_heal': None, 'width_heal': 64, 'width_state': 4, 'lr': 0.001, 'padding_heal': 18, 'padding_state': 9, 'optimizer': 'lbfgs'}. Best is trial 156 with value: 0.0013996975030750036.
[I 2025-07-30 20:34:04,080] Trial 159 finished with value: 0.0016176055651158094 and parameters: {'width_NN_heal': 128, 'width_NN_state': 512, 'depth_NN_heal': 4, 'depth_NN_state': 1, 'mode_heal': 64, 'mode_state': 64, 'blocks_heal': 4, 'blocks_state': 8, 'lift_act_state': None, 'block_act_state': <built-in function gelu>, 'lift_act_heal': None, 'block_act_heal': None, 'width_heal': 64, 'width_state': 4, 'lr': 0.001, 'padding_heal': 18, 'padding_state': 9, 'optimizer': 'lbfgs'}. Best is trial 156 with value: 0.0013996975030750036.
[I 2025-07-30 20:34:08,875] Trial 160 finished with value: 0.013783935457468033 and parameters: {'width_NN_heal': 128, 'width_NN_state': 512, 'depth_NN_heal': 4, 'depth_NN_state': 1, 'mode_heal': 64, 'mode_state': 64, 'blocks_heal': 4, 'blocks_state': 8, 'lift_act_state': None, 'block_act_state': None, 'lift_act_heal': None, 'block_act_heal': None, 'width_heal': 64, 'width_state': 4, 'lr': 0.001, 'padding_heal': 18, 'padding_state': 9, 'optimizer': 'lbfgs'}. Best is trial 156 with value: 0.0013996975030750036.
[I 2025-07-30 20:34:13,747] Trial 161 finished with value: 0.0018461243016645312 and parameters: {'width_NN_heal': 128, 'width_NN_state': 512, 'depth_NN_heal': 4, 'depth_NN_state': 1, 'mode_heal': 64, 'mode_state': 64, 'blocks_heal': 4, 'blocks_state': 8, 'lift_act_state': None, 'block_act_state': <built-in function gelu>, 'lift_act_heal': None, 'block_act_heal': None, 'width_heal': 64, 'width_state': 4, 'lr': 0.001, 'padding_heal': 18, 'padding_state': 9, 'optimizer': 'lbfgs'}. Best is trial 156 with value: 0.0013996975030750036.
[I 2025-07-30 20:34:18,615] Trial 162 finished with value: 0.001624716678634286 and parameters: {'width_NN_heal': 128, 'width_NN_state': 512, 'depth_NN_heal': 4, 'depth_NN_state': 1, 'mode_heal': 64, 'mode_state': 64, 'blocks_heal': 4, 'blocks_state': 8, 'lift_act_state': None, 'block_act_state': <built-in function gelu>, 'lift_act_heal': None, 'block_act_heal': None, 'width_heal': 64, 'width_state': 4, 'lr': 0.001, 'padding_heal': 18, 'padding_state': 9, 'optimizer': 'lbfgs'}. Best is trial 156 with value: 0.0013996975030750036.
[I 2025-07-30 20:34:23,486] Trial 163 finished with value: 0.0015736897476017475 and parameters: {'width_NN_heal': 128, 'width_NN_state': 512, 'depth_NN_heal': 4, 'depth_NN_state': 1, 'mode_heal': 64, 'mode_state': 64, 'blocks_heal': 4, 'blocks_state': 8, 'lift_act_state': None, 'block_act_state': <built-in function gelu>, 'lift_act_heal': None, 'block_act_heal': None, 'width_heal': 64, 'width_state': 4, 'lr': 0.001, 'padding_heal': 18, 'padding_state': 9, 'optimizer': 'lbfgs'}. Best is trial 156 with value: 0.0013996975030750036.
[I 2025-07-30 20:34:28,359] Trial 164 finished with value: 0.0017873519100248814 and parameters: {'width_NN_heal': 128, 'width_NN_state': 512, 'depth_NN_heal': 4, 'depth_NN_state': 1, 'mode_heal': 64, 'mode_state': 64, 'blocks_heal': 4, 'blocks_state': 8, 'lift_act_state': None, 'block_act_state': <built-in function gelu>, 'lift_act_heal': None, 'block_act_heal': None, 'width_heal': 64, 'width_state': 4, 'lr': 0.001, 'padding_heal': 18, 'padding_state': 9, 'optimizer': 'lbfgs'}. Best is trial 156 with value: 0.0013996975030750036.
[I 2025-07-30 20:34:33,238] Trial 165 finished with value: 0.0016857326263561845 and parameters: {'width_NN_heal': 128, 'width_NN_state': 512, 'depth_NN_heal': 4, 'depth_NN_state': 1, 'mode_heal': 64, 'mode_state': 64, 'blocks_heal': 4, 'blocks_state': 8, 'lift_act_state': None, 'block_act_state': <built-in function gelu>, 'lift_act_heal': None, 'block_act_heal': None, 'width_heal': 64, 'width_state': 4, 'lr': 0.001, 'padding_heal': 18, 'padding_state': 9, 'optimizer': 'lbfgs'}. Best is trial 156 with value: 0.0013996975030750036.
[I 2025-07-30 20:34:36,908] Trial 166 finished with value: 0.0016382541507482529 and parameters: {'width_NN_heal': 128, 'width_NN_state': 512, 'depth_NN_heal': 4, 'depth_NN_state': 1, 'mode_heal': 64, 'mode_state': 64, 'blocks_heal': 4, 'blocks_state': 4, 'lift_act_state': None, 'block_act_state': <built-in function gelu>, 'lift_act_heal': None, 'block_act_heal': None, 'width_heal': 64, 'width_state': 4, 'lr': 0.001, 'padding_heal': 18, 'padding_state': 9, 'optimizer': 'lbfgs'}. Best is trial 156 with value: 0.0013996975030750036.
[I 2025-07-30 20:34:40,577] Trial 167 finished with value: 0.0016419792082160711 and parameters: {'width_NN_heal': 128, 'width_NN_state': 512, 'depth_NN_heal': 4, 'depth_NN_state': 1, 'mode_heal': 64, 'mode_state': 64, 'blocks_heal': 4, 'blocks_state': 4, 'lift_act_state': None, 'block_act_state': <built-in function gelu>, 'lift_act_heal': None, 'block_act_heal': None, 'width_heal': 64, 'width_state': 4, 'lr': 0.001, 'padding_heal': 18, 'padding_state': 9, 'optimizer': 'lbfgs'}. Best is trial 156 with value: 0.0013996975030750036.
[I 2025-07-30 20:34:44,247] Trial 168 finished with value: 0.0016969628632068634 and parameters: {'width_NN_heal': 128, 'width_NN_state': 512, 'depth_NN_heal': 4, 'depth_NN_state': 1, 'mode_heal': 64, 'mode_state': 64, 'blocks_heal': 4, 'blocks_state': 4, 'lift_act_state': None, 'block_act_state': <built-in function gelu>, 'lift_act_heal': None, 'block_act_heal': None, 'width_heal': 64, 'width_state': 4, 'lr': 0.001, 'padding_heal': 18, 'padding_state': 9, 'optimizer': 'lbfgs'}. Best is trial 156 with value: 0.0013996975030750036.
[I 2025-07-30 20:34:47,765] Trial 169 finished with value: 0.003686339594423771 and parameters: {'width_NN_heal': 128, 'width_NN_state': 512, 'depth_NN_heal': 2, 'depth_NN_state': 1, 'mode_heal': 64, 'mode_state': 64, 'blocks_heal': 4, 'blocks_state': 4, 'lift_act_state': None, 'block_act_state': <function tanh at 0x7f55138b8cc0>, 'lift_act_heal': None, 'block_act_heal': None, 'width_heal': 64, 'width_state': 64, 'lr': 0.001, 'padding_heal': 18, 'padding_state': 9, 'optimizer': 'lbfgs'}. Best is trial 156 with value: 0.0013996975030750036.
[I 2025-07-30 20:34:51,327] Trial 170 finished with value: 0.005930852610617876 and parameters: {'width_NN_heal': 128, 'width_NN_state': 512, 'depth_NN_heal': 4, 'depth_NN_state': 1, 'mode_heal': 64, 'mode_state': 64, 'blocks_heal': 4, 'blocks_state': 4, 'lift_act_state': None, 'block_act_state': <built-in function gelu>, 'lift_act_heal': None, 'block_act_heal': None, 'width_heal': 4, 'width_state': 4, 'lr': 0.001, 'padding_heal': 18, 'padding_state': 9, 'optimizer': 'lbfgs'}. Best is trial 156 with value: 0.0013996975030750036.
[I 2025-07-30 20:34:55,003] Trial 171 finished with value: 0.0016408973606303334 and parameters: {'width_NN_heal': 128, 'width_NN_state': 512, 'depth_NN_heal': 4, 'depth_NN_state': 1, 'mode_heal': 64, 'mode_state': 64, 'blocks_heal': 4, 'blocks_state': 4, 'lift_act_state': None, 'block_act_state': <built-in function gelu>, 'lift_act_heal': None, 'block_act_heal': None, 'width_heal': 64, 'width_state': 4, 'lr': 0.001, 'padding_heal': 18, 'padding_state': 9, 'optimizer': 'lbfgs'}. Best is trial 156 with value: 0.0013996975030750036.
[I 2025-07-30 20:34:58,675] Trial 172 finished with value: 0.001639324938878417 and parameters: {'width_NN_heal': 128, 'width_NN_state': 512, 'depth_NN_heal': 4, 'depth_NN_state': 1, 'mode_heal': 64, 'mode_state': 64, 'blocks_heal': 4, 'blocks_state': 4, 'lift_act_state': None, 'block_act_state': <built-in function gelu>, 'lift_act_heal': None, 'block_act_heal': None, 'width_heal': 64, 'width_state': 4, 'lr': 0.001, 'padding_heal': 18, 'padding_state': 9, 'optimizer': 'lbfgs'}. Best is trial 156 with value: 0.0013996975030750036.
[I 2025-07-30 20:35:02,348] Trial 173 finished with value: 0.001583802280947566 and parameters: {'width_NN_heal': 128, 'width_NN_state': 512, 'depth_NN_heal': 4, 'depth_NN_state': 1, 'mode_heal': 64, 'mode_state': 64, 'blocks_heal': 4, 'blocks_state': 4, 'lift_act_state': None, 'block_act_state': <built-in function gelu>, 'lift_act_heal': None, 'block_act_heal': None, 'width_heal': 64, 'width_state': 4, 'lr': 0.001, 'padding_heal': 18, 'padding_state': 9, 'optimizer': 'lbfgs'}. Best is trial 156 with value: 0.0013996975030750036.
[I 2025-07-30 20:35:06,022] Trial 174 finished with value: 0.001652101636864245 and parameters: {'width_NN_heal': 128, 'width_NN_state': 512, 'depth_NN_heal': 4, 'depth_NN_state': 1, 'mode_heal': 64, 'mode_state': 64, 'blocks_heal': 4, 'blocks_state': 4, 'lift_act_state': None, 'block_act_state': <built-in function gelu>, 'lift_act_heal': None, 'block_act_heal': None, 'width_heal': 64, 'width_state': 4, 'lr': 0.001, 'padding_heal': 18, 'padding_state': 9, 'optimizer': 'lbfgs'}. Best is trial 156 with value: 0.0013996975030750036.
[I 2025-07-30 20:35:09,696] Trial 175 finished with value: 0.0016033492283895612 and parameters: {'width_NN_heal': 128, 'width_NN_state': 512, 'depth_NN_heal': 4, 'depth_NN_state': 1, 'mode_heal': 64, 'mode_state': 64, 'blocks_heal': 4, 'blocks_state': 4, 'lift_act_state': None, 'block_act_state': <built-in function gelu>, 'lift_act_heal': None, 'block_act_heal': None, 'width_heal': 64, 'width_state': 4, 'lr': 0.001, 'padding_heal': 18, 'padding_state': 9, 'optimizer': 'lbfgs'}. Best is trial 156 with value: 0.0013996975030750036.
[I 2025-07-30 20:35:13,361] Trial 176 finished with value: 0.0016841080505400896 and parameters: {'width_NN_heal': 128, 'width_NN_state': 512, 'depth_NN_heal': 4, 'depth_NN_state': 1, 'mode_heal': 32, 'mode_state': 64, 'blocks_heal': 4, 'blocks_state': 4, 'lift_act_state': None, 'block_act_state': <built-in function gelu>, 'lift_act_heal': None, 'block_act_heal': None, 'width_heal': 64, 'width_state': 4, 'lr': 0.001, 'padding_heal': 18, 'padding_state': 9, 'optimizer': 'lbfgs'}. Best is trial 156 with value: 0.0013996975030750036.
[I 2025-07-30 20:35:17,035] Trial 177 finished with value: 0.0016070716083049774 and parameters: {'width_NN_heal': 128, 'width_NN_state': 512, 'depth_NN_heal': 4, 'depth_NN_state': 1, 'mode_heal': 64, 'mode_state': 64, 'blocks_heal': 4, 'blocks_state': 4, 'lift_act_state': None, 'block_act_state': <built-in function gelu>, 'lift_act_heal': None, 'block_act_heal': None, 'width_heal': 64, 'width_state': 4, 'lr': 0.001, 'padding_heal': 18, 'padding_state': 9, 'optimizer': 'lbfgs'}. Best is trial 156 with value: 0.0013996975030750036.
[I 2025-07-30 20:35:20,710] Trial 178 finished with value: 0.0016694882651790977 and parameters: {'width_NN_heal': 128, 'width_NN_state': 512, 'depth_NN_heal': 4, 'depth_NN_state': 1, 'mode_heal': 64, 'mode_state': 64, 'blocks_heal': 4, 'blocks_state': 4, 'lift_act_state': None, 'block_act_state': <built-in function gelu>, 'lift_act_heal': None, 'block_act_heal': None, 'width_heal': 64, 'width_state': 4, 'lr': 0.001, 'padding_heal': 18, 'padding_state': 9, 'optimizer': 'lbfgs'}. Best is trial 156 with value: 0.0013996975030750036.
[I 2025-07-30 20:35:24,388] Trial 179 finished with value: 0.001600475050508976 and parameters: {'width_NN_heal': 128, 'width_NN_state': 512, 'depth_NN_heal': 4, 'depth_NN_state': 1, 'mode_heal': 64, 'mode_state': 64, 'blocks_heal': 4, 'blocks_state': 4, 'lift_act_state': None, 'block_act_state': <built-in function gelu>, 'lift_act_heal': None, 'block_act_heal': None, 'width_heal': 64, 'width_state': 4, 'lr': 0.001, 'padding_heal': 18, 'padding_state': 9, 'optimizer': 'lbfgs'}. Best is trial 156 with value: 0.0013996975030750036.
[I 2025-07-30 20:35:28,065] Trial 180 finished with value: 0.001570860855281353 and parameters: {'width_NN_heal': 128, 'width_NN_state': 512, 'depth_NN_heal': 4, 'depth_NN_state': 1, 'mode_heal': 64, 'mode_state': 64, 'blocks_heal': 4, 'blocks_state': 4, 'lift_act_state': None, 'block_act_state': <built-in function gelu>, 'lift_act_heal': None, 'block_act_heal': None, 'width_heal': 64, 'width_state': 4, 'lr': 0.001, 'padding_heal': 18, 'padding_state': 9, 'optimizer': 'lbfgs'}. Best is trial 156 with value: 0.0013996975030750036.
[I 2025-07-30 20:35:31,743] Trial 181 finished with value: 0.0015792585909366608 and parameters: {'width_NN_heal': 128, 'width_NN_state': 512, 'depth_NN_heal': 4, 'depth_NN_state': 1, 'mode_heal': 64, 'mode_state': 64, 'blocks_heal': 4, 'blocks_state': 4, 'lift_act_state': None, 'block_act_state': <built-in function gelu>, 'lift_act_heal': None, 'block_act_heal': None, 'width_heal': 64, 'width_state': 4, 'lr': 0.001, 'padding_heal': 18, 'padding_state': 9, 'optimizer': 'lbfgs'}. Best is trial 156 with value: 0.0013996975030750036.
[I 2025-07-30 20:35:35,421] Trial 182 finished with value: 0.0015978302108123899 and parameters: {'width_NN_heal': 128, 'width_NN_state': 512, 'depth_NN_heal': 4, 'depth_NN_state': 1, 'mode_heal': 64, 'mode_state': 64, 'blocks_heal': 4, 'blocks_state': 4, 'lift_act_state': None, 'block_act_state': <built-in function gelu>, 'lift_act_heal': None, 'block_act_heal': None, 'width_heal': 64, 'width_state': 4, 'lr': 0.001, 'padding_heal': 18, 'padding_state': 9, 'optimizer': 'lbfgs'}. Best is trial 156 with value: 0.0013996975030750036.
[I 2025-07-30 20:35:39,101] Trial 183 finished with value: 0.001654846011660993 and parameters: {'width_NN_heal': 128, 'width_NN_state': 512, 'depth_NN_heal': 4, 'depth_NN_state': 1, 'mode_heal': 64, 'mode_state': 64, 'blocks_heal': 4, 'blocks_state': 4, 'lift_act_state': None, 'block_act_state': <built-in function gelu>, 'lift_act_heal': None, 'block_act_heal': None, 'width_heal': 64, 'width_state': 4, 'lr': 0.001, 'padding_heal': 18, 'padding_state': 9, 'optimizer': 'lbfgs'}. Best is trial 156 with value: 0.0013996975030750036.
[I 2025-07-30 20:35:42,779] Trial 184 finished with value: 0.0016620410606265068 and parameters: {'width_NN_heal': 128, 'width_NN_state': 512, 'depth_NN_heal': 4, 'depth_NN_state': 1, 'mode_heal': 64, 'mode_state': 64, 'blocks_heal': 4, 'blocks_state': 4, 'lift_act_state': None, 'block_act_state': <built-in function gelu>, 'lift_act_heal': None, 'block_act_heal': None, 'width_heal': 64, 'width_state': 4, 'lr': 0.001, 'padding_heal': 18, 'padding_state': 9, 'optimizer': 'lbfgs'}. Best is trial 156 with value: 0.0013996975030750036.
[I 2025-07-30 20:35:46,455] Trial 185 finished with value: 0.001524384948424995 and parameters: {'width_NN_heal': 128, 'width_NN_state': 512, 'depth_NN_heal': 4, 'depth_NN_state': 1, 'mode_heal': 64, 'mode_state': 64, 'blocks_heal': 4, 'blocks_state': 4, 'lift_act_state': None, 'block_act_state': <built-in function gelu>, 'lift_act_heal': None, 'block_act_heal': None, 'width_heal': 64, 'width_state': 4, 'lr': 0.001, 'padding_heal': 18, 'padding_state': 9, 'optimizer': 'lbfgs'}. Best is trial 156 with value: 0.0013996975030750036.
