[I 2025-07-30 20:04:07,777] Trial 75 finished with value: 0.001450988813303411 and parameters: {'width_NN_heal': 8, 'width_NN_state': 128, 'depth_NN_heal': 1, 'depth_NN_state': 1, 'mode_heal': 12, 'mode_state': 64, 'blocks_heal': 8, 'blocks_state': 4, 'lift_act_state': <function tanh at 0x7f8c12ab8cc0>, 'block_act_state': <built-in function gelu>, 'lift_act_heal': None, 'block_act_heal': None, 'width_heal': 32, 'width_state': 64, 'lr': 0.005, 'padding_heal': 9, 'padding_state': 18, 'optimizer': 'adam'}. Best is trial 65 with value: 0.0012612235732376575.
[I 2025-07-30 20:04:16,542] Trial 76 finished with value: 0.00149342545773834 and parameters: {'width_NN_heal': 8, 'width_NN_state': 128, 'depth_NN_heal': 1, 'depth_NN_state': 1, 'mode_heal': 12, 'mode_state': 64, 'blocks_heal': 8, 'blocks_state': 4, 'lift_act_state': <function tanh at 0x7f8c12ab8cc0>, 'block_act_state': <built-in function gelu>, 'lift_act_heal': <function tanh at 0x7f8c12ab8cc0>, 'block_act_heal': None, 'width_heal': 32, 'width_state': 64, 'lr': 0.005, 'padding_heal': 9, 'padding_state': 18, 'optimizer': 'adam'}. Best is trial 65 with value: 0.0012612235732376575.
[I 2025-07-30 20:04:25,012] Trial 77 finished with value: 0.002582310466095805 and parameters: {'width_NN_heal': 8, 'width_NN_state': 128, 'depth_NN_heal': 1, 'depth_NN_state': 1, 'mode_heal': 12, 'mode_state': 64, 'blocks_heal': 8, 'blocks_state': 4, 'lift_act_state': <function tanh at 0x7f8c12ab8cc0>, 'block_act_state': <built-in function gelu>, 'lift_act_heal': None, 'block_act_heal': None, 'width_heal': 4, 'width_state': 64, 'lr': 0.005, 'padding_heal': 9, 'padding_state': 18, 'optimizer': 'adam'}. Best is trial 65 with value: 0.0012612235732376575.
[I 2025-07-30 20:04:33,633] Trial 78 finished with value: 0.0016276398673653603 and parameters: {'width_NN_heal': 8, 'width_NN_state': 128, 'depth_NN_heal': 1, 'depth_NN_state': 1, 'mode_heal': 12, 'mode_state': 64, 'blocks_heal': 8, 'blocks_state': 4, 'lift_act_state': <function tanh at 0x7f8c12ab8cc0>, 'block_act_state': <built-in function gelu>, 'lift_act_heal': None, 'block_act_heal': None, 'width_heal': 32, 'width_state': 64, 'lr': 0.005, 'padding_heal': 9, 'padding_state': 18, 'optimizer': 'adam'}. Best is trial 65 with value: 0.0012612235732376575.
[I 2025-07-30 20:04:42,272] Trial 79 finished with value: 0.0031834980472922325 and parameters: {'width_NN_heal': 8, 'width_NN_state': 128, 'depth_NN_heal': 1, 'depth_NN_state': 1, 'mode_heal': 12, 'mode_state': 64, 'blocks_heal': 8, 'blocks_state': 4, 'lift_act_state': <function tanh at 0x7f8c12ab8cc0>, 'block_act_state': <function tanh at 0x7f8c12ab8cc0>, 'lift_act_heal': None, 'block_act_heal': None, 'width_heal': 32, 'width_state': 64, 'lr': 0.001, 'padding_heal': 9, 'padding_state': 18, 'optimizer': 'adam'}. Best is trial 65 with value: 0.0012612235732376575.
[I 2025-07-30 20:04:50,914] Trial 80 finished with value: 0.0013980643125250936 and parameters: {'width_NN_heal': 8, 'width_NN_state': 128, 'depth_NN_heal': 1, 'depth_NN_state': 1, 'mode_heal': 12, 'mode_state': 64, 'blocks_heal': 8, 'blocks_state': 4, 'lift_act_state': <function tanh at 0x7f8c12ab8cc0>, 'block_act_state': <built-in function gelu>, 'lift_act_heal': None, 'block_act_heal': None, 'width_heal': 32, 'width_state': 64, 'lr': 0.005, 'padding_heal': 9, 'padding_state': 18, 'optimizer': 'adam'}. Best is trial 65 with value: 0.0012612235732376575.
[I 2025-07-30 20:04:59,565] Trial 81 finished with value: 0.001599002629518509 and parameters: {'width_NN_heal': 8, 'width_NN_state': 128, 'depth_NN_heal': 1, 'depth_NN_state': 1, 'mode_heal': 12, 'mode_state': 64, 'blocks_heal': 8, 'blocks_state': 4, 'lift_act_state': <function tanh at 0x7f8c12ab8cc0>, 'block_act_state': <built-in function gelu>, 'lift_act_heal': None, 'block_act_heal': None, 'width_heal': 32, 'width_state': 64, 'lr': 0.005, 'padding_heal': 9, 'padding_state': 18, 'optimizer': 'adam'}. Best is trial 65 with value: 0.0012612235732376575.
[I 2025-07-30 20:05:08,218] Trial 82 finished with value: 0.0015860922867432237 and parameters: {'width_NN_heal': 8, 'width_NN_state': 128, 'depth_NN_heal': 1, 'depth_NN_state': 1, 'mode_heal': 12, 'mode_state': 64, 'blocks_heal': 8, 'blocks_state': 4, 'lift_act_state': <function tanh at 0x7f8c12ab8cc0>, 'block_act_state': <built-in function gelu>, 'lift_act_heal': None, 'block_act_heal': None, 'width_heal': 32, 'width_state': 64, 'lr': 0.005, 'padding_heal': 9, 'padding_state': 18, 'optimizer': 'adam'}. Best is trial 65 with value: 0.0012612235732376575.
[I 2025-07-30 20:05:16,889] Trial 83 finished with value: 0.0014536234084516764 and parameters: {'width_NN_heal': 8, 'width_NN_state': 128, 'depth_NN_heal': 1, 'depth_NN_state': 1, 'mode_heal': 12, 'mode_state': 64, 'blocks_heal': 8, 'blocks_state': 4, 'lift_act_state': <function tanh at 0x7f8c12ab8cc0>, 'block_act_state': <built-in function gelu>, 'lift_act_heal': None, 'block_act_heal': None, 'width_heal': 32, 'width_state': 64, 'lr': 0.005, 'padding_heal': 9, 'padding_state': 18, 'optimizer': 'adam'}. Best is trial 65 with value: 0.0012612235732376575.
[I 2025-07-30 20:05:25,557] Trial 84 finished with value: 0.0015660685021430254 and parameters: {'width_NN_heal': 8, 'width_NN_state': 128, 'depth_NN_heal': 1, 'depth_NN_state': 1, 'mode_heal': 12, 'mode_state': 64, 'blocks_heal': 8, 'blocks_state': 4, 'lift_act_state': <function tanh at 0x7f8c12ab8cc0>, 'block_act_state': <built-in function gelu>, 'lift_act_heal': None, 'block_act_heal': None, 'width_heal': 32, 'width_state': 64, 'lr': 0.005, 'padding_heal': 9, 'padding_state': 18, 'optimizer': 'adam'}. Best is trial 65 with value: 0.0012612235732376575.
[I 2025-07-30 20:05:32,130] Trial 85 finished with value: 0.0013792149256914854 and parameters: {'width_NN_heal': 64, 'width_NN_state': 128, 'depth_NN_heal': 1, 'depth_NN_state': 1, 'mode_heal': 12, 'mode_state': 64, 'blocks_heal': 4, 'blocks_state': 4, 'lift_act_state': <function tanh at 0x7f8c12ab8cc0>, 'block_act_state': <built-in function gelu>, 'lift_act_heal': None, 'block_act_heal': <built-in function gelu>, 'width_heal': 32, 'width_state': 64, 'lr': 0.005, 'padding_heal': 9, 'padding_state': 18, 'optimizer': 'adam'}. Best is trial 65 with value: 0.0012612235732376575.
[I 2025-07-30 20:05:38,765] Trial 86 finished with value: 0.0016865987563505769 and parameters: {'width_NN_heal': 64, 'width_NN_state': 128, 'depth_NN_heal': 1, 'depth_NN_state': 1, 'mode_heal': 12, 'mode_state': 64, 'blocks_heal': 4, 'blocks_state': 4, 'lift_act_state': <function tanh at 0x7f8c12ab8cc0>, 'block_act_state': <built-in function gelu>, 'lift_act_heal': <built-in function gelu>, 'block_act_heal': <built-in function gelu>, 'width_heal': 64, 'width_state': 64, 'lr': 0.005, 'padding_heal': 9, 'padding_state': 18, 'optimizer': 'adam'}. Best is trial 65 with value: 0.0012612235732376575.
[I 2025-07-30 20:05:45,261] Trial 87 finished with value: 0.0029220052529126406 and parameters: {'width_NN_heal': 64, 'width_NN_state': 128, 'depth_NN_heal': 1, 'depth_NN_state': 1, 'mode_heal': 12, 'mode_state': 32, 'blocks_heal': 4, 'blocks_state': 4, 'lift_act_state': <function tanh at 0x7f8c12ab8cc0>, 'block_act_state': None, 'lift_act_heal': None, 'block_act_heal': <built-in function gelu>, 'width_heal': 32, 'width_state': 64, 'lr': 0.005, 'padding_heal': 9, 'padding_state': 18, 'optimizer': 'adam'}. Best is trial 65 with value: 0.0012612235732376575.
[I 2025-07-30 20:05:51,776] Trial 88 finished with value: 0.0012526344507932663 and parameters: {'width_NN_heal': 64, 'width_NN_state': 8, 'depth_NN_heal': 1, 'depth_NN_state': 1, 'mode_heal': 12, 'mode_state': 64, 'blocks_heal': 4, 'blocks_state': 4, 'lift_act_state': None, 'block_act_state': <built-in function gelu>, 'lift_act_heal': None, 'block_act_heal': <built-in function gelu>, 'width_heal': 32, 'width_state': 64, 'lr': 0.005, 'padding_heal': 9, 'padding_state': 18, 'optimizer': 'adam'}. Best is trial 88 with value: 0.0012526344507932663.
[I 2025-07-30 20:05:58,193] Trial 89 finished with value: 0.0072931647300720215 and parameters: {'width_NN_heal': 64, 'width_NN_state': 8, 'depth_NN_heal': 1, 'depth_NN_state': 1, 'mode_heal': 12, 'mode_state': 64, 'blocks_heal': 4, 'blocks_state': 4, 'lift_act_state': None, 'block_act_state': <built-in function gelu>, 'lift_act_heal': None, 'block_act_heal': <built-in function gelu>, 'width_heal': 32, 'width_state': 64, 'lr': 0.005, 'padding_heal': 9, 'padding_state': 0, 'optimizer': 'adam'}. Best is trial 88 with value: 0.0012526344507932663.
[I 2025-07-30 20:06:04,794] Trial 90 finished with value: 0.0035319749731570482 and parameters: {'width_NN_heal': 64, 'width_NN_state': 8, 'depth_NN_heal': 1, 'depth_NN_state': 2, 'mode_heal': 64, 'mode_state': 64, 'blocks_heal': 4, 'blocks_state': 4, 'lift_act_state': None, 'block_act_state': <built-in function gelu>, 'lift_act_heal': <function tanh at 0x7f8c12ab8cc0>, 'block_act_heal': <built-in function gelu>, 'width_heal': 4, 'width_state': 64, 'lr': 0.005, 'padding_heal': 9, 'padding_state': 18, 'optimizer': 'adam'}. Best is trial 88 with value: 0.0012526344507932663.
[I 2025-07-30 20:06:11,315] Trial 91 finished with value: 0.0013447817182168365 and parameters: {'width_NN_heal': 64, 'width_NN_state': 8, 'depth_NN_heal': 1, 'depth_NN_state': 1, 'mode_heal': 12, 'mode_state': 64, 'blocks_heal': 4, 'blocks_state': 4, 'lift_act_state': None, 'block_act_state': <built-in function gelu>, 'lift_act_heal': None, 'block_act_heal': <built-in function gelu>, 'width_heal': 32, 'width_state': 64, 'lr': 0.005, 'padding_heal': 9, 'padding_state': 18, 'optimizer': 'adam'}. Best is trial 88 with value: 0.0012526344507932663.
[I 2025-07-30 20:06:17,843] Trial 92 finished with value: 0.001246958621777594 and parameters: {'width_NN_heal': 64, 'width_NN_state': 8, 'depth_NN_heal': 1, 'depth_NN_state': 1, 'mode_heal': 12, 'mode_state': 64, 'blocks_heal': 4, 'blocks_state': 4, 'lift_act_state': None, 'block_act_state': <built-in function gelu>, 'lift_act_heal': None, 'block_act_heal': <built-in function gelu>, 'width_heal': 32, 'width_state': 64, 'lr': 0.005, 'padding_heal': 9, 'padding_state': 18, 'optimizer': 'adam'}. Best is trial 92 with value: 0.001246958621777594.
[I 2025-07-30 20:06:24,369] Trial 93 finished with value: 0.0016208658926188946 and parameters: {'width_NN_heal': 64, 'width_NN_state': 8, 'depth_NN_heal': 1, 'depth_NN_state': 1, 'mode_heal': 12, 'mode_state': 64, 'blocks_heal': 4, 'blocks_state': 4, 'lift_act_state': None, 'block_act_state': <built-in function gelu>, 'lift_act_heal': None, 'block_act_heal': <built-in function gelu>, 'width_heal': 32, 'width_state': 64, 'lr': 0.005, 'padding_heal': 9, 'padding_state': 18, 'optimizer': 'adam'}. Best is trial 92 with value: 0.001246958621777594.
[I 2025-07-30 20:06:30,895] Trial 94 finished with value: 0.0015093430411070585 and parameters: {'width_NN_heal': 64, 'width_NN_state': 8, 'depth_NN_heal': 1, 'depth_NN_state': 1, 'mode_heal': 12, 'mode_state': 64, 'blocks_heal': 4, 'blocks_state': 4, 'lift_act_state': None, 'block_act_state': <built-in function gelu>, 'lift_act_heal': None, 'block_act_heal': <built-in function gelu>, 'width_heal': 32, 'width_state': 64, 'lr': 0.005, 'padding_heal': 9, 'padding_state': 18, 'optimizer': 'adam'}. Best is trial 92 with value: 0.001246958621777594.
[I 2025-07-30 20:06:37,419] Trial 95 finished with value: 0.0013735279208049178 and parameters: {'width_NN_heal': 64, 'width_NN_state': 8, 'depth_NN_heal': 1, 'depth_NN_state': 1, 'mode_heal': 12, 'mode_state': 64, 'blocks_heal': 4, 'blocks_state': 4, 'lift_act_state': None, 'block_act_state': <built-in function gelu>, 'lift_act_heal': None, 'block_act_heal': <built-in function gelu>, 'width_heal': 32, 'width_state': 64, 'lr': 0.005, 'padding_heal': 9, 'padding_state': 18, 'optimizer': 'adam'}. Best is trial 92 with value: 0.001246958621777594.
[I 2025-07-30 20:06:44,419] Trial 96 finished with value: 0.0027530412189662457 and parameters: {'width_NN_heal': 64, 'width_NN_state': 8, 'depth_NN_heal': 4, 'depth_NN_state': 1, 'mode_heal': 12, 'mode_state': 64, 'blocks_heal': 4, 'blocks_state': 4, 'lift_act_state': None, 'block_act_state': <built-in function gelu>, 'lift_act_heal': None, 'block_act_heal': <built-in function gelu>, 'width_heal': 32, 'width_state': 64, 'lr': 0.001, 'padding_heal': 9, 'padding_state': 18, 'optimizer': 'adam'}. Best is trial 92 with value: 0.001246958621777594.
[I 2025-07-30 20:06:50,948] Trial 97 finished with value: 0.0014747434761375189 and parameters: {'width_NN_heal': 64, 'width_NN_state': 8, 'depth_NN_heal': 1, 'depth_NN_state': 1, 'mode_heal': 12, 'mode_state': 64, 'blocks_heal': 4, 'blocks_state': 4, 'lift_act_state': None, 'block_act_state': <built-in function gelu>, 'lift_act_heal': None, 'block_act_heal': <built-in function gelu>, 'width_heal': 32, 'width_state': 64, 'lr': 0.005, 'padding_heal': 9, 'padding_state': 18, 'optimizer': 'adam'}. Best is trial 92 with value: 0.001246958621777594.
[I 2025-07-30 20:06:57,485] Trial 98 finished with value: 0.0026183114387094975 and parameters: {'width_NN_heal': 64, 'width_NN_state': 8, 'depth_NN_heal': 1, 'depth_NN_state': 1, 'mode_heal': 12, 'mode_state': 64, 'blocks_heal': 4, 'blocks_state': 4, 'lift_act_state': None, 'block_act_state': <function tanh at 0x7f8c12ab8cc0>, 'lift_act_heal': None, 'block_act_heal': <built-in function gelu>, 'width_heal': 32, 'width_state': 64, 'lr': 0.005, 'padding_heal': 9, 'padding_state': 18, 'optimizer': 'adam'}. Best is trial 92 with value: 0.001246958621777594.
[I 2025-07-30 20:07:04,039] Trial 99 finished with value: 0.0015152472769841552 and parameters: {'width_NN_heal': 64, 'width_NN_state': 8, 'depth_NN_heal': 1, 'depth_NN_state': 1, 'mode_heal': 12, 'mode_state': 32, 'blocks_heal': 4, 'blocks_state': 4, 'lift_act_state': None, 'block_act_state': <built-in function gelu>, 'lift_act_heal': None, 'block_act_heal': <built-in function gelu>, 'width_heal': 32, 'width_state': 64, 'lr': 0.005, 'padding_heal': 9, 'padding_state': 18, 'optimizer': 'adam'}. Best is trial 92 with value: 0.001246958621777594.
[I 2025-07-30 20:07:10,499] Trial 100 finished with value: 0.007664233446121216 and parameters: {'width_NN_heal': 64, 'width_NN_state': 8, 'depth_NN_heal': 1, 'depth_NN_state': 1, 'mode_heal': 12, 'mode_state': 64, 'blocks_heal': 4, 'blocks_state': 4, 'lift_act_state': None, 'block_act_state': <built-in function gelu>, 'lift_act_heal': None, 'block_act_heal': <built-in function gelu>, 'width_heal': 32, 'width_state': 64, 'lr': 0.005, 'padding_heal': 9, 'padding_state': 0, 'optimizer': 'adam'}. Best is trial 92 with value: 0.001246958621777594.
[I 2025-07-30 20:07:17,060] Trial 101 finished with value: 0.0012072300305590034 and parameters: {'width_NN_heal': 64, 'width_NN_state': 8, 'depth_NN_heal': 1, 'depth_NN_state': 1, 'mode_heal': 12, 'mode_state': 64, 'blocks_heal': 4, 'blocks_state': 4, 'lift_act_state': None, 'block_act_state': <built-in function gelu>, 'lift_act_heal': None, 'block_act_heal': <built-in function gelu>, 'width_heal': 32, 'width_state': 64, 'lr': 0.005, 'padding_heal': 9, 'padding_state': 18, 'optimizer': 'adam'}. Best is trial 101 with value: 0.0012072300305590034.
[I 2025-07-30 20:07:23,595] Trial 102 finished with value: 0.0012354615610092878 and parameters: {'width_NN_heal': 64, 'width_NN_state': 8, 'depth_NN_heal': 1, 'depth_NN_state': 1, 'mode_heal': 12, 'mode_state': 64, 'blocks_heal': 4, 'blocks_state': 4, 'lift_act_state': None, 'block_act_state': <built-in function gelu>, 'lift_act_heal': None, 'block_act_heal': <built-in function gelu>, 'width_heal': 32, 'width_state': 64, 'lr': 0.005, 'padding_heal': 9, 'padding_state': 18, 'optimizer': 'adam'}. Best is trial 101 with value: 0.0012072300305590034.
[I 2025-07-30 20:07:30,278] Trial 103 finished with value: 0.0014192783273756504 and parameters: {'width_NN_heal': 64, 'width_NN_state': 8, 'depth_NN_heal': 1, 'depth_NN_state': 1, 'mode_heal': 12, 'mode_state': 64, 'blocks_heal': 4, 'blocks_state': 4, 'lift_act_state': None, 'block_act_state': <built-in function gelu>, 'lift_act_heal': None, 'block_act_heal': <built-in function gelu>, 'width_heal': 32, 'width_state': 64, 'lr': 0.005, 'padding_heal': 9, 'padding_state': 18, 'optimizer': 'adam'}. Best is trial 101 with value: 0.0012072300305590034.
[I 2025-07-30 20:07:36,957] Trial 104 finished with value: 0.0012156746815890074 and parameters: {'width_NN_heal': 64, 'width_NN_state': 8, 'depth_NN_heal': 1, 'depth_NN_state': 1, 'mode_heal': 12, 'mode_state': 64, 'blocks_heal': 4, 'blocks_state': 4, 'lift_act_state': None, 'block_act_state': <built-in function gelu>, 'lift_act_heal': None, 'block_act_heal': <built-in function gelu>, 'width_heal': 32, 'width_state': 64, 'lr': 0.005, 'padding_heal': 9, 'padding_state': 18, 'optimizer': 'adam'}. Best is trial 101 with value: 0.0012072300305590034.
[I 2025-07-30 20:07:43,697] Trial 105 finished with value: 0.0013983504613861442 and parameters: {'width_NN_heal': 64, 'width_NN_state': 8, 'depth_NN_heal': 1, 'depth_NN_state': 2, 'mode_heal': 64, 'mode_state': 64, 'blocks_heal': 4, 'blocks_state': 4, 'lift_act_state': None, 'block_act_state': <built-in function gelu>, 'lift_act_heal': None, 'block_act_heal': <built-in function gelu>, 'width_heal': 32, 'width_state': 64, 'lr': 0.005, 'padding_heal': 9, 'padding_state': 18, 'optimizer': 'adam'}. Best is trial 101 with value: 0.0012072300305590034.
[I 2025-07-30 20:07:50,316] Trial 106 finished with value: 0.0014937268570065498 and parameters: {'width_NN_heal': 64, 'width_NN_state': 8, 'depth_NN_heal': 1, 'depth_NN_state': 1, 'mode_heal': 12, 'mode_state': 64, 'blocks_heal': 4, 'blocks_state': 4, 'lift_act_state': None, 'block_act_state': <built-in function gelu>, 'lift_act_heal': <built-in function gelu>, 'block_act_heal': <built-in function gelu>, 'width_heal': 32, 'width_state': 64, 'lr': 0.005, 'padding_heal': 9, 'padding_state': 18, 'optimizer': 'adam'}. Best is trial 101 with value: 0.0012072300305590034.
[I 2025-07-30 20:07:56,915] Trial 107 finished with value: 0.010703092440962791 and parameters: {'width_NN_heal': 64, 'width_NN_state': 8, 'depth_NN_heal': 1, 'depth_NN_state': 1, 'mode_heal': 12, 'mode_state': 64, 'blocks_heal': 4, 'blocks_state': 4, 'lift_act_state': None, 'block_act_state': None, 'lift_act_heal': None, 'block_act_heal': <built-in function gelu>, 'width_heal': 64, 'width_state': 64, 'lr': 0.005, 'padding_heal': 18, 'padding_state': 18, 'optimizer': 'adam'}. Best is trial 101 with value: 0.0012072300305590034.
[I 2025-07-30 20:08:03,946] Trial 108 finished with value: 0.001478416845202446 and parameters: {'width_NN_heal': 64, 'width_NN_state': 8, 'depth_NN_heal': 4, 'depth_NN_state': 1, 'mode_heal': 12, 'mode_state': 64, 'blocks_heal': 4, 'blocks_state': 4, 'lift_act_state': None, 'block_act_state': <built-in function gelu>, 'lift_act_heal': None, 'block_act_heal': <built-in function gelu>, 'width_heal': 32, 'width_state': 64, 'lr': 0.005, 'padding_heal': 9, 'padding_state': 18, 'optimizer': 'adam'}. Best is trial 101 with value: 0.0012072300305590034.
[I 2025-07-30 20:08:10,512] Trial 109 finished with value: 0.0013721317518502474 and parameters: {'width_NN_heal': 64, 'width_NN_state': 8, 'depth_NN_heal': 1, 'depth_NN_state': 1, 'mode_heal': 12, 'mode_state': 64, 'blocks_heal': 4, 'blocks_state': 4, 'lift_act_state': None, 'block_act_state': <built-in function gelu>, 'lift_act_heal': None, 'block_act_heal': <built-in function gelu>, 'width_heal': 32, 'width_state': 64, 'lr': 0.005, 'padding_heal': 9, 'padding_state': 18, 'optimizer': 'adam'}. Best is trial 101 with value: 0.0012072300305590034.
[I 2025-07-30 20:08:16,946] Trial 110 finished with value: 0.013308522291481495 and parameters: {'width_NN_heal': 64, 'width_NN_state': 8, 'depth_NN_heal': 1, 'depth_NN_state': 1, 'mode_heal': 12, 'mode_state': 64, 'blocks_heal': 4, 'blocks_state': 4, 'lift_act_state': None, 'block_act_state': <built-in function gelu>, 'lift_act_heal': None, 'block_act_heal': <built-in function gelu>, 'width_heal': 4, 'width_state': 64, 'lr': 0.001, 'padding_heal': 9, 'padding_state': 18, 'optimizer': 'adam'}. Best is trial 101 with value: 0.0012072300305590034.
[I 2025-07-30 20:08:23,507] Trial 111 finished with value: 0.0013734924141317606 and parameters: {'width_NN_heal': 64, 'width_NN_state': 8, 'depth_NN_heal': 1, 'depth_NN_state': 1, 'mode_heal': 12, 'mode_state': 64, 'blocks_heal': 4, 'blocks_state': 4, 'lift_act_state': None, 'block_act_state': <built-in function gelu>, 'lift_act_heal': None, 'block_act_heal': <built-in function gelu>, 'width_heal': 32, 'width_state': 64, 'lr': 0.005, 'padding_heal': 9, 'padding_state': 18, 'optimizer': 'adam'}. Best is trial 101 with value: 0.0012072300305590034.
[I 2025-07-30 20:08:30,066] Trial 112 finished with value: 0.0014456402277573943 and parameters: {'width_NN_heal': 64, 'width_NN_state': 8, 'depth_NN_heal': 1, 'depth_NN_state': 1, 'mode_heal': 12, 'mode_state': 64, 'blocks_heal': 4, 'blocks_state': 4, 'lift_act_state': None, 'block_act_state': <built-in function gelu>, 'lift_act_heal': None, 'block_act_heal': <built-in function gelu>, 'width_heal': 32, 'width_state': 64, 'lr': 0.005, 'padding_heal': 9, 'padding_state': 18, 'optimizer': 'adam'}. Best is trial 101 with value: 0.0012072300305590034.
[I 2025-07-30 20:08:36,637] Trial 113 finished with value: 0.0013568702852353454 and parameters: {'width_NN_heal': 64, 'width_NN_state': 8, 'depth_NN_heal': 1, 'depth_NN_state': 1, 'mode_heal': 12, 'mode_state': 64, 'blocks_heal': 4, 'blocks_state': 4, 'lift_act_state': None, 'block_act_state': <built-in function gelu>, 'lift_act_heal': None, 'block_act_heal': <built-in function gelu>, 'width_heal': 32, 'width_state': 64, 'lr': 0.005, 'padding_heal': 9, 'padding_state': 18, 'optimizer': 'adam'}. Best is trial 101 with value: 0.0012072300305590034.
