[I 2025-07-30 20:08:43,202] Trial 114 finished with value: 0.0013945980463176966 and parameters: {'width_NN_heal': 64, 'width_NN_state': 8, 'depth_NN_heal': 1, 'depth_NN_state': 1, 'mode_heal': 12, 'mode_state': 64, 'blocks_heal': 4, 'blocks_state': 4, 'lift_act_state': None, 'block_act_state': <built-in function gelu>, 'lift_act_heal': None, 'block_act_heal': <built-in function gelu>, 'width_heal': 32, 'width_state': 64, 'lr': 0.005, 'padding_heal': 9, 'padding_state': 18, 'optimizer': 'adam'}. Best is trial 101 with value: 0.0012072300305590034.
[I 2025-07-30 20:08:49,826] Trial 115 finished with value: 0.001391563331708312 and parameters: {'width_NN_heal': 64, 'width_NN_state': 8, 'depth_NN_heal': 1, 'depth_NN_state': 1, 'mode_heal': 12, 'mode_state': 64, 'blocks_heal': 4, 'blocks_state': 4, 'lift_act_state': None, 'block_act_state': <built-in function gelu>, 'lift_act_heal': None, 'block_act_heal': <built-in function gelu>, 'width_heal': 32, 'width_state': 64, 'lr': 0.005, 'padding_heal': 9, 'padding_state': 18, 'optimizer': 'adam'}. Best is trial 101 with value: 0.0012072300305590034.
[I 2025-07-30 20:08:56,456] Trial 116 finished with value: 0.0013912443537265062 and parameters: {'width_NN_heal': 64, 'width_NN_state': 8, 'depth_NN_heal': 1, 'depth_NN_state': 1, 'mode_heal': 12, 'mode_state': 64, 'blocks_heal': 4, 'blocks_state': 4, 'lift_act_state': None, 'block_act_state': <built-in function gelu>, 'lift_act_heal': <function tanh at 0x7f8c12ab8cc0>, 'block_act_heal': <built-in function gelu>, 'width_heal': 32, 'width_state': 64, 'lr': 0.005, 'padding_heal': 9, 'padding_state': 18, 'optimizer': 'adam'}. Best is trial 101 with value: 0.0012072300305590034.
[I 2025-07-30 20:09:03,251] Trial 117 finished with value: 0.0015566266374662519 and parameters: {'width_NN_heal': 64, 'width_NN_state': 8, 'depth_NN_heal': 1, 'depth_NN_state': 1, 'mode_heal': 12, 'mode_state': 64, 'blocks_heal': 4, 'blocks_state': 4, 'lift_act_state': None, 'block_act_state': <built-in function gelu>, 'lift_act_heal': None, 'block_act_heal': <built-in function gelu>, 'width_heal': 32, 'width_state': 64, 'lr': 0.005, 'padding_heal': 9, 'padding_state': 18, 'optimizer': 'adam'}. Best is trial 101 with value: 0.0012072300305590034.
[I 2025-07-30 20:09:09,896] Trial 118 finished with value: 0.0014190571382641792 and parameters: {'width_NN_heal': 64, 'width_NN_state': 8, 'depth_NN_heal': 1, 'depth_NN_state': 1, 'mode_heal': 12, 'mode_state': 64, 'blocks_heal': 4, 'blocks_state': 4, 'lift_act_state': None, 'block_act_state': <built-in function gelu>, 'lift_act_heal': None, 'block_act_heal': <built-in function gelu>, 'width_heal': 32, 'width_state': 64, 'lr': 0.005, 'padding_heal': 18, 'padding_state': 18, 'optimizer': 'adam'}. Best is trial 101 with value: 0.0012072300305590034.
[I 2025-07-30 20:09:16,326] Trial 119 finished with value: 0.0064742909744381905 and parameters: {'width_NN_heal': 64, 'width_NN_state': 8, 'depth_NN_heal': 1, 'depth_NN_state': 1, 'mode_heal': 12, 'mode_state': 32, 'blocks_heal': 4, 'blocks_state': 4, 'lift_act_state': None, 'block_act_state': <function tanh at 0x7f8c12ab8cc0>, 'lift_act_heal': None, 'block_act_heal': <built-in function gelu>, 'width_heal': 32, 'width_state': 64, 'lr': 0.005, 'padding_heal': 9, 'padding_state': 0, 'optimizer': 'adam'}. Best is trial 101 with value: 0.0012072300305590034.
[I 2025-07-30 20:09:23,051] Trial 120 finished with value: 0.0013688496546819806 and parameters: {'width_NN_heal': 64, 'width_NN_state': 8, 'depth_NN_heal': 1, 'depth_NN_state': 2, 'mode_heal': 64, 'mode_state': 64, 'blocks_heal': 4, 'blocks_state': 4, 'lift_act_state': None, 'block_act_state': <built-in function gelu>, 'lift_act_heal': None, 'block_act_heal': <built-in function gelu>, 'width_heal': 32, 'width_state': 64, 'lr': 0.005, 'padding_heal': 9, 'padding_state': 18, 'optimizer': 'adam'}. Best is trial 101 with value: 0.0012072300305590034.
[I 2025-07-30 20:09:29,798] Trial 121 finished with value: 0.0017848927527666092 and parameters: {'width_NN_heal': 64, 'width_NN_state': 8, 'depth_NN_heal': 1, 'depth_NN_state': 2, 'mode_heal': 64, 'mode_state': 64, 'blocks_heal': 4, 'blocks_state': 4, 'lift_act_state': None, 'block_act_state': <built-in function gelu>, 'lift_act_heal': None, 'block_act_heal': <built-in function gelu>, 'width_heal': 32, 'width_state': 64, 'lr': 0.005, 'padding_heal': 9, 'padding_state': 18, 'optimizer': 'adam'}. Best is trial 101 with value: 0.0012072300305590034.
[I 2025-07-30 20:09:36,525] Trial 122 finished with value: 0.0012532065156847239 and parameters: {'width_NN_heal': 64, 'width_NN_state': 8, 'depth_NN_heal': 1, 'depth_NN_state': 2, 'mode_heal': 64, 'mode_state': 64, 'blocks_heal': 4, 'blocks_state': 4, 'lift_act_state': None, 'block_act_state': <built-in function gelu>, 'lift_act_heal': None, 'block_act_heal': <built-in function gelu>, 'width_heal': 32, 'width_state': 64, 'lr': 0.005, 'padding_heal': 9, 'padding_state': 18, 'optimizer': 'adam'}. Best is trial 101 with value: 0.0012072300305590034.
[I 2025-07-30 20:09:43,247] Trial 123 finished with value: 0.0012269243597984314 and parameters: {'width_NN_heal': 64, 'width_NN_state': 8, 'depth_NN_heal': 1, 'depth_NN_state': 2, 'mode_heal': 64, 'mode_state': 64, 'blocks_heal': 4, 'blocks_state': 4, 'lift_act_state': None, 'block_act_state': <built-in function gelu>, 'lift_act_heal': None, 'block_act_heal': <built-in function gelu>, 'width_heal': 32, 'width_state': 64, 'lr': 0.005, 'padding_heal': 9, 'padding_state': 18, 'optimizer': 'adam'}. Best is trial 101 with value: 0.0012072300305590034.
[I 2025-07-30 20:09:49,976] Trial 124 finished with value: 0.0014208120992407203 and parameters: {'width_NN_heal': 64, 'width_NN_state': 8, 'depth_NN_heal': 1, 'depth_NN_state': 2, 'mode_heal': 64, 'mode_state': 64, 'blocks_heal': 4, 'blocks_state': 4, 'lift_act_state': None, 'block_act_state': <built-in function gelu>, 'lift_act_heal': None, 'block_act_heal': <built-in function gelu>, 'width_heal': 32, 'width_state': 64, 'lr': 0.005, 'padding_heal': 9, 'padding_state': 18, 'optimizer': 'adam'}. Best is trial 101 with value: 0.0012072300305590034.
[I 2025-07-30 20:09:56,717] Trial 125 finished with value: 0.0013151036109775305 and parameters: {'width_NN_heal': 64, 'width_NN_state': 8, 'depth_NN_heal': 1, 'depth_NN_state': 2, 'mode_heal': 64, 'mode_state': 64, 'blocks_heal': 4, 'blocks_state': 4, 'lift_act_state': None, 'block_act_state': <built-in function gelu>, 'lift_act_heal': None, 'block_act_heal': <built-in function gelu>, 'width_heal': 32, 'width_state': 64, 'lr': 0.005, 'padding_heal': 9, 'padding_state': 18, 'optimizer': 'adam'}. Best is trial 101 with value: 0.0012072300305590034.
[I 2025-07-30 20:10:03,677] Trial 126 finished with value: 0.0015750359743833542 and parameters: {'width_NN_heal': 64, 'width_NN_state': 8, 'depth_NN_heal': 1, 'depth_NN_state': 2, 'mode_heal': 64, 'mode_state': 12, 'blocks_heal': 4, 'blocks_state': 4, 'lift_act_state': None, 'block_act_state': <built-in function gelu>, 'lift_act_heal': None, 'block_act_heal': <built-in function gelu>, 'width_heal': 32, 'width_state': 4, 'lr': 0.005, 'padding_heal': 9, 'padding_state': 18, 'optimizer': 'adam'}. Best is trial 101 with value: 0.0012072300305590034.
[I 2025-07-30 20:10:10,481] Trial 127 finished with value: 0.001219073194079101 and parameters: {'width_NN_heal': 64, 'width_NN_state': 8, 'depth_NN_heal': 1, 'depth_NN_state': 2, 'mode_heal': 64, 'mode_state': 64, 'blocks_heal': 4, 'blocks_state': 4, 'lift_act_state': None, 'block_act_state': <built-in function gelu>, 'lift_act_heal': <built-in function gelu>, 'block_act_heal': <built-in function gelu>, 'width_heal': 32, 'width_state': 64, 'lr': 0.005, 'padding_heal': 9, 'padding_state': 18, 'optimizer': 'adam'}. Best is trial 101 with value: 0.0012072300305590034.
[I 2025-07-30 20:10:17,846] Trial 128 finished with value: 0.0014432045863941312 and parameters: {'width_NN_heal': 64, 'width_NN_state': 8, 'depth_NN_heal': 4, 'depth_NN_state': 2, 'mode_heal': 64, 'mode_state': 64, 'blocks_heal': 4, 'blocks_state': 4, 'lift_act_state': None, 'block_act_state': <built-in function gelu>, 'lift_act_heal': <built-in function gelu>, 'block_act_heal': <built-in function gelu>, 'width_heal': 64, 'width_state': 64, 'lr': 0.005, 'padding_heal': 9, 'padding_state': 18, 'optimizer': 'adam'}. Best is trial 101 with value: 0.0012072300305590034.
[I 2025-07-30 20:10:24,542] Trial 129 finished with value: 0.010833554901182652 and parameters: {'width_NN_heal': 64, 'width_NN_state': 8, 'depth_NN_heal': 1, 'depth_NN_state': 2, 'mode_heal': 64, 'mode_state': 64, 'blocks_heal': 4, 'blocks_state': 4, 'lift_act_state': None, 'block_act_state': None, 'lift_act_heal': <built-in function gelu>, 'block_act_heal': <built-in function gelu>, 'width_heal': 32, 'width_state': 64, 'lr': 0.005, 'padding_heal': 9, 'padding_state': 18, 'optimizer': 'adam'}. Best is trial 101 with value: 0.0012072300305590034.
[I 2025-07-30 20:10:31,344] Trial 130 finished with value: 0.0014128719922155142 and parameters: {'width_NN_heal': 64, 'width_NN_state': 8, 'depth_NN_heal': 1, 'depth_NN_state': 2, 'mode_heal': 64, 'mode_state': 64, 'blocks_heal': 4, 'blocks_state': 4, 'lift_act_state': None, 'block_act_state': <built-in function gelu>, 'lift_act_heal': <built-in function gelu>, 'block_act_heal': <built-in function gelu>, 'width_heal': 32, 'width_state': 64, 'lr': 0.005, 'padding_heal': 9, 'padding_state': 18, 'optimizer': 'adam'}. Best is trial 101 with value: 0.0012072300305590034.
[I 2025-07-30 20:10:38,254] Trial 131 finished with value: 0.0015043760649859905 and parameters: {'width_NN_heal': 64, 'width_NN_state': 8, 'depth_NN_heal': 1, 'depth_NN_state': 2, 'mode_heal': 64, 'mode_state': 64, 'blocks_heal': 4, 'blocks_state': 4, 'lift_act_state': None, 'block_act_state': <built-in function gelu>, 'lift_act_heal': <built-in function gelu>, 'block_act_heal': <built-in function gelu>, 'width_heal': 32, 'width_state': 64, 'lr': 0.005, 'padding_heal': 9, 'padding_state': 18, 'optimizer': 'adam'}. Best is trial 101 with value: 0.0012072300305590034.
[I 2025-07-30 20:10:45,015] Trial 132 finished with value: 0.0014485871652141213 and parameters: {'width_NN_heal': 64, 'width_NN_state': 8, 'depth_NN_heal': 1, 'depth_NN_state': 2, 'mode_heal': 64, 'mode_state': 64, 'blocks_heal': 4, 'blocks_state': 4, 'lift_act_state': None, 'block_act_state': <built-in function gelu>, 'lift_act_heal': <built-in function gelu>, 'block_act_heal': <built-in function gelu>, 'width_heal': 32, 'width_state': 64, 'lr': 0.005, 'padding_heal': 9, 'padding_state': 18, 'optimizer': 'adam'}. Best is trial 101 with value: 0.0012072300305590034.
[I 2025-07-30 20:10:51,705] Trial 133 finished with value: 0.0012826843885704875 and parameters: {'width_NN_heal': 64, 'width_NN_state': 8, 'depth_NN_heal': 1, 'depth_NN_state': 2, 'mode_heal': 64, 'mode_state': 64, 'blocks_heal': 4, 'blocks_state': 4, 'lift_act_state': None, 'block_act_state': <built-in function gelu>, 'lift_act_heal': None, 'block_act_heal': <built-in function gelu>, 'width_heal': 32, 'width_state': 64, 'lr': 0.005, 'padding_heal': 9, 'padding_state': 18, 'optimizer': 'adam'}. Best is trial 101 with value: 0.0012072300305590034.
[I 2025-07-30 20:10:58,389] Trial 134 finished with value: 0.00139381003100425 and parameters: {'width_NN_heal': 64, 'width_NN_state': 8, 'depth_NN_heal': 1, 'depth_NN_state': 2, 'mode_heal': 64, 'mode_state': 64, 'blocks_heal': 4, 'blocks_state': 4, 'lift_act_state': None, 'block_act_state': <built-in function gelu>, 'lift_act_heal': None, 'block_act_heal': <built-in function gelu>, 'width_heal': 32, 'width_state': 64, 'lr': 0.005, 'padding_heal': 9, 'padding_state': 18, 'optimizer': 'adam'}. Best is trial 101 with value: 0.0012072300305590034.
[I 2025-07-30 20:11:05,076] Trial 135 finished with value: 0.0014038020744919777 and parameters: {'width_NN_heal': 64, 'width_NN_state': 8, 'depth_NN_heal': 1, 'depth_NN_state': 2, 'mode_heal': 64, 'mode_state': 64, 'blocks_heal': 4, 'blocks_state': 4, 'lift_act_state': None, 'block_act_state': <built-in function gelu>, 'lift_act_heal': None, 'block_act_heal': <built-in function gelu>, 'width_heal': 32, 'width_state': 64, 'lr': 0.005, 'padding_heal': 9, 'padding_state': 18, 'optimizer': 'adam'}. Best is trial 101 with value: 0.0012072300305590034.
[I 2025-07-30 20:11:11,764] Trial 136 finished with value: 0.0013657649978995323 and parameters: {'width_NN_heal': 64, 'width_NN_state': 8, 'depth_NN_heal': 1, 'depth_NN_state': 2, 'mode_heal': 64, 'mode_state': 64, 'blocks_heal': 4, 'blocks_state': 4, 'lift_act_state': None, 'block_act_state': <built-in function gelu>, 'lift_act_heal': None, 'block_act_heal': <built-in function gelu>, 'width_heal': 32, 'width_state': 64, 'lr': 0.005, 'padding_heal': 9, 'padding_state': 18, 'optimizer': 'adam'}. Best is trial 101 with value: 0.0012072300305590034.
[I 2025-07-30 20:11:18,451] Trial 137 finished with value: 0.001438755076378584 and parameters: {'width_NN_heal': 64, 'width_NN_state': 8, 'depth_NN_heal': 1, 'depth_NN_state': 2, 'mode_heal': 64, 'mode_state': 64, 'blocks_heal': 4, 'blocks_state': 4, 'lift_act_state': None, 'block_act_state': <built-in function gelu>, 'lift_act_heal': None, 'block_act_heal': <built-in function gelu>, 'width_heal': 32, 'width_state': 64, 'lr': 0.005, 'padding_heal': 9, 'padding_state': 18, 'optimizer': 'adam'}. Best is trial 101 with value: 0.0012072300305590034.
[I 2025-07-30 20:11:25,049] Trial 138 finished with value: 0.007096326444298029 and parameters: {'width_NN_heal': 64, 'width_NN_state': 8, 'depth_NN_heal': 1, 'depth_NN_state': 2, 'mode_heal': 64, 'mode_state': 64, 'blocks_heal': 4, 'blocks_state': 4, 'lift_act_state': None, 'block_act_state': <built-in function gelu>, 'lift_act_heal': <function tanh at 0x7f8c12ab8cc0>, 'block_act_heal': <built-in function gelu>, 'width_heal': 4, 'width_state': 64, 'lr': 0.001, 'padding_heal': 9, 'padding_state': 18, 'optimizer': 'adam'}. Best is trial 101 with value: 0.0012072300305590034.
[I 2025-07-30 20:11:31,735] Trial 139 finished with value: 0.0012988622765988111 and parameters: {'width_NN_heal': 64, 'width_NN_state': 8, 'depth_NN_heal': 1, 'depth_NN_state': 2, 'mode_heal': 64, 'mode_state': 64, 'blocks_heal': 4, 'blocks_state': 4, 'lift_act_state': None, 'block_act_state': <built-in function gelu>, 'lift_act_heal': None, 'block_act_heal': <built-in function gelu>, 'width_heal': 32, 'width_state': 64, 'lr': 0.005, 'padding_heal': 9, 'padding_state': 18, 'optimizer': 'adam'}. Best is trial 101 with value: 0.0012072300305590034.
[I 2025-07-30 20:11:38,417] Trial 140 finished with value: 0.0015617252793163061 and parameters: {'width_NN_heal': 64, 'width_NN_state': 8, 'depth_NN_heal': 1, 'depth_NN_state': 2, 'mode_heal': 64, 'mode_state': 64, 'blocks_heal': 4, 'blocks_state': 4, 'lift_act_state': None, 'block_act_state': <built-in function gelu>, 'lift_act_heal': None, 'block_act_heal': <built-in function gelu>, 'width_heal': 32, 'width_state': 64, 'lr': 0.005, 'padding_heal': 9, 'padding_state': 18, 'optimizer': 'adam'}. Best is trial 101 with value: 0.0012072300305590034.
[I 2025-07-30 20:11:45,096] Trial 141 finished with value: 0.0012424476444721222 and parameters: {'width_NN_heal': 64, 'width_NN_state': 8, 'depth_NN_heal': 1, 'depth_NN_state': 2, 'mode_heal': 64, 'mode_state': 64, 'blocks_heal': 4, 'blocks_state': 4, 'lift_act_state': None, 'block_act_state': <built-in function gelu>, 'lift_act_heal': None, 'block_act_heal': <built-in function gelu>, 'width_heal': 32, 'width_state': 64, 'lr': 0.005, 'padding_heal': 9, 'padding_state': 18, 'optimizer': 'adam'}. Best is trial 101 with value: 0.0012072300305590034.
[I 2025-07-30 20:11:51,778] Trial 142 finished with value: 0.0014216790441423655 and parameters: {'width_NN_heal': 64, 'width_NN_state': 8, 'depth_NN_heal': 1, 'depth_NN_state': 2, 'mode_heal': 64, 'mode_state': 64, 'blocks_heal': 4, 'blocks_state': 4, 'lift_act_state': None, 'block_act_state': <built-in function gelu>, 'lift_act_heal': None, 'block_act_heal': <built-in function gelu>, 'width_heal': 32, 'width_state': 64, 'lr': 0.005, 'padding_heal': 9, 'padding_state': 18, 'optimizer': 'adam'}. Best is trial 101 with value: 0.0012072300305590034.
[I 2025-07-30 20:11:58,457] Trial 143 finished with value: 0.0013118835631757975 and parameters: {'width_NN_heal': 64, 'width_NN_state': 8, 'depth_NN_heal': 1, 'depth_NN_state': 2, 'mode_heal': 64, 'mode_state': 64, 'blocks_heal': 4, 'blocks_state': 4, 'lift_act_state': None, 'block_act_state': <built-in function gelu>, 'lift_act_heal': None, 'block_act_heal': <built-in function gelu>, 'width_heal': 32, 'width_state': 64, 'lr': 0.005, 'padding_heal': 9, 'padding_state': 18, 'optimizer': 'adam'}. Best is trial 101 with value: 0.0012072300305590034.
[I 2025-07-30 20:12:05,139] Trial 144 finished with value: 0.0015886989422142506 and parameters: {'width_NN_heal': 64, 'width_NN_state': 8, 'depth_NN_heal': 1, 'depth_NN_state': 2, 'mode_heal': 64, 'mode_state': 64, 'blocks_heal': 4, 'blocks_state': 4, 'lift_act_state': None, 'block_act_state': <built-in function gelu>, 'lift_act_heal': None, 'block_act_heal': <built-in function gelu>, 'width_heal': 32, 'width_state': 64, 'lr': 0.005, 'padding_heal': 9, 'padding_state': 18, 'optimizer': 'adam'}. Best is trial 101 with value: 0.0012072300305590034.
[I 2025-07-30 20:12:11,819] Trial 145 finished with value: 0.001535801449790597 and parameters: {'width_NN_heal': 128, 'width_NN_state': 8, 'depth_NN_heal': 1, 'depth_NN_state': 2, 'mode_heal': 64, 'mode_state': 64, 'blocks_heal': 4, 'blocks_state': 4, 'lift_act_state': None, 'block_act_state': <built-in function gelu>, 'lift_act_heal': None, 'block_act_heal': <built-in function gelu>, 'width_heal': 32, 'width_state': 64, 'lr': 0.005, 'padding_heal': 9, 'padding_state': 18, 'optimizer': 'adam'}. Best is trial 101 with value: 0.0012072300305590034.
[I 2025-07-30 20:12:18,498] Trial 146 finished with value: 0.007454593665897846 and parameters: {'width_NN_heal': 64, 'width_NN_state': 8, 'depth_NN_heal': 1, 'depth_NN_state': 2, 'mode_heal': 64, 'mode_state': 64, 'blocks_heal': 4, 'blocks_state': 4, 'lift_act_state': None, 'block_act_state': <built-in function gelu>, 'lift_act_heal': None, 'block_act_heal': <built-in function gelu>, 'width_heal': 32, 'width_state': 64, 'lr': 0.005, 'padding_heal': 18, 'padding_state': 0, 'optimizer': 'adam'}. Best is trial 101 with value: 0.0012072300305590034.
[I 2025-07-30 20:12:25,195] Trial 147 finished with value: 0.0031270624604076147 and parameters: {'width_NN_heal': 64, 'width_NN_state': 8, 'depth_NN_heal': 1, 'depth_NN_state': 2, 'mode_heal': 64, 'mode_state': 64, 'blocks_heal': 4, 'blocks_state': 4, 'lift_act_state': None, 'block_act_state': <function tanh at 0x7f8c12ab8cc0>, 'lift_act_heal': None, 'block_act_heal': <function tanh at 0x7f8c12ab8cc0>, 'width_heal': 32, 'width_state': 4, 'lr': 0.01, 'padding_heal': 9, 'padding_state': 18, 'optimizer': 'adam'}. Best is trial 101 with value: 0.0012072300305590034.
[I 2025-07-30 20:12:31,903] Trial 148 finished with value: 0.001394239952787757 and parameters: {'width_NN_heal': 64, 'width_NN_state': 8, 'depth_NN_heal': 1, 'depth_NN_state': 2, 'mode_heal': 64, 'mode_state': 32, 'blocks_heal': 4, 'blocks_state': 4, 'lift_act_state': None, 'block_act_state': <built-in function gelu>, 'lift_act_heal': <built-in function gelu>, 'block_act_heal': <built-in function gelu>, 'width_heal': 32, 'width_state': 64, 'lr': 0.005, 'padding_heal': 9, 'padding_state': 18, 'optimizer': 'adam'}. Best is trial 101 with value: 0.0012072300305590034.
[I 2025-07-30 20:12:38,565] Trial 149 finished with value: 0.0016867656959220767 and parameters: {'width_NN_heal': 64, 'width_NN_state': 8, 'depth_NN_heal': 1, 'depth_NN_state': 2, 'mode_heal': 64, 'mode_state': 12, 'blocks_heal': 4, 'blocks_state': 4, 'lift_act_state': None, 'block_act_state': <built-in function gelu>, 'lift_act_heal': None, 'block_act_heal': <built-in function gelu>, 'width_heal': 32, 'width_state': 64, 'lr': 0.005, 'padding_heal': 9, 'padding_state': 18, 'optimizer': 'adam'}. Best is trial 101 with value: 0.0012072300305590034.
[I 2025-07-30 20:12:45,853] Trial 150 finished with value: 0.0012839031405746937 and parameters: {'width_NN_heal': 64, 'width_NN_state': 8, 'depth_NN_heal': 4, 'depth_NN_state': 2, 'mode_heal': 64, 'mode_state': 64, 'blocks_heal': 4, 'blocks_state': 4, 'lift_act_state': None, 'block_act_state': <built-in function gelu>, 'lift_act_heal': None, 'block_act_heal': <built-in function gelu>, 'width_heal': 32, 'width_state': 64, 'lr': 0.005, 'padding_heal': 9, 'padding_state': 18, 'optimizer': 'adam'}. Best is trial 101 with value: 0.0012072300305590034.
[I 2025-07-30 20:12:53,103] Trial 151 finished with value: 0.0012378408573567867 and parameters: {'width_NN_heal': 64, 'width_NN_state': 8, 'depth_NN_heal': 4, 'depth_NN_state': 2, 'mode_heal': 64, 'mode_state': 64, 'blocks_heal': 4, 'blocks_state': 4, 'lift_act_state': None, 'block_act_state': <built-in function gelu>, 'lift_act_heal': None, 'block_act_heal': <built-in function gelu>, 'width_heal': 32, 'width_state': 64, 'lr': 0.005, 'padding_heal': 9, 'padding_state': 18, 'optimizer': 'adam'}. Best is trial 101 with value: 0.0012072300305590034.
[I 2025-07-30 20:13:00,349] Trial 152 finished with value: 0.001536891795694828 and parameters: {'width_NN_heal': 64, 'width_NN_state': 8, 'depth_NN_heal': 4, 'depth_NN_state': 2, 'mode_heal': 64, 'mode_state': 64, 'blocks_heal': 4, 'blocks_state': 4, 'lift_act_state': None, 'block_act_state': <built-in function gelu>, 'lift_act_heal': None, 'block_act_heal': <built-in function gelu>, 'width_heal': 32, 'width_state': 64, 'lr': 0.005, 'padding_heal': 9, 'padding_state': 18, 'optimizer': 'adam'}. Best is trial 101 with value: 0.0012072300305590034.
