[I 2025-07-30 20:29:44,548] Trial 109 finished with value: 0.009211515076458454 and parameters: {'width_NN_heal': 128, 'width_NN_state': 512, 'depth_NN_heal': 4, 'depth_NN_state': 1, 'mode_heal': 64, 'mode_state': 12, 'blocks_heal': 4, 'blocks_state': 8, 'lift_act_state': None, 'block_act_state': <built-in function gelu>, 'lift_act_heal': None, 'block_act_heal': None, 'width_heal': 64, 'width_state': 64, 'lr': 0.005, 'padding_heal': 9, 'padding_state': 0, 'optimizer': 'adam'}. Best is trial 76 with value: 0.0017377050826326013.
[I 2025-07-30 20:29:48,608] Trial 110 finished with value: 0.005581471137702465 and parameters: {'width_NN_heal': 128, 'width_NN_state': 512, 'depth_NN_heal': 4, 'depth_NN_state': 1, 'mode_heal': 64, 'mode_state': 12, 'blocks_heal': 1, 'blocks_state': 8, 'lift_act_state': <built-in function gelu>, 'block_act_state': <built-in function gelu>, 'lift_act_heal': <function tanh at 0x7f55138b8cc0>, 'block_act_heal': None, 'width_heal': 64, 'width_state': 4, 'lr': 0.005, 'padding_heal': 18, 'padding_state': 32, 'optimizer': 'adam'}. Best is trial 76 with value: 0.0017377050826326013.
[I 2025-07-30 20:29:56,802] Trial 111 finished with value: 0.003849730594083667 and parameters: {'width_NN_heal': 8, 'width_NN_state': 512, 'depth_NN_heal': 4, 'depth_NN_state': 4, 'mode_heal': 64, 'mode_state': 12, 'blocks_heal': 8, 'blocks_state': 8, 'lift_act_state': <built-in function gelu>, 'block_act_state': <built-in function gelu>, 'lift_act_heal': <built-in function gelu>, 'block_act_heal': <built-in function gelu>, 'width_heal': 64, 'width_state': 4, 'lr': 0.005, 'padding_heal': 18, 'padding_state': 32, 'optimizer': 'adam'}. Best is trial 76 with value: 0.0017377050826326013.
[I 2025-07-30 20:30:04,998] Trial 112 finished with value: 0.005209476687014103 and parameters: {'width_NN_heal': 8, 'width_NN_state': 512, 'depth_NN_heal': 4, 'depth_NN_state': 4, 'mode_heal': 64, 'mode_state': 12, 'blocks_heal': 8, 'blocks_state': 8, 'lift_act_state': <built-in function gelu>, 'block_act_state': <built-in function gelu>, 'lift_act_heal': <built-in function gelu>, 'block_act_heal': <built-in function gelu>, 'width_heal': 64, 'width_state': 4, 'lr': 0.005, 'padding_heal': 18, 'padding_state': 32, 'optimizer': 'adam'}. Best is trial 76 with value: 0.0017377050826326013.
[I 2025-07-30 20:30:13,194] Trial 113 finished with value: 0.004339187406003475 and parameters: {'width_NN_heal': 8, 'width_NN_state': 512, 'depth_NN_heal': 4, 'depth_NN_state': 4, 'mode_heal': 64, 'mode_state': 12, 'blocks_heal': 8, 'blocks_state': 8, 'lift_act_state': <built-in function gelu>, 'block_act_state': <built-in function gelu>, 'lift_act_heal': <built-in function gelu>, 'block_act_heal': <built-in function gelu>, 'width_heal': 64, 'width_state': 4, 'lr': 0.005, 'padding_heal': 18, 'padding_state': 32, 'optimizer': 'adam'}. Best is trial 76 with value: 0.0017377050826326013.
[I 2025-07-30 20:30:21,389] Trial 114 finished with value: 0.00242231204174459 and parameters: {'width_NN_heal': 8, 'width_NN_state': 512, 'depth_NN_heal': 4, 'depth_NN_state': 4, 'mode_heal': 64, 'mode_state': 12, 'blocks_heal': 8, 'blocks_state': 8, 'lift_act_state': <built-in function gelu>, 'block_act_state': <built-in function gelu>, 'lift_act_heal': <built-in function gelu>, 'block_act_heal': <built-in function gelu>, 'width_heal': 64, 'width_state': 4, 'lr': 0.005, 'padding_heal': 18, 'padding_state': 32, 'optimizer': 'adam'}. Best is trial 76 with value: 0.0017377050826326013.
[I 2025-07-30 20:30:29,586] Trial 115 finished with value: 0.0027563951443880796 and parameters: {'width_NN_heal': 8, 'width_NN_state': 512, 'depth_NN_heal': 4, 'depth_NN_state': 4, 'mode_heal': 64, 'mode_state': 12, 'blocks_heal': 8, 'blocks_state': 8, 'lift_act_state': <built-in function gelu>, 'block_act_state': <built-in function gelu>, 'lift_act_heal': <built-in function gelu>, 'block_act_heal': <built-in function gelu>, 'width_heal': 64, 'width_state': 4, 'lr': 0.005, 'padding_heal': 18, 'padding_state': 32, 'optimizer': 'adam'}. Best is trial 76 with value: 0.0017377050826326013.
[I 2025-07-30 20:30:33,129] Trial 116 finished with value: 0.003744083223864436 and parameters: {'width_NN_heal': 128, 'width_NN_state': 512, 'depth_NN_heal': 4, 'depth_NN_state': 2, 'mode_heal': 64, 'mode_state': 12, 'blocks_heal': 1, 'blocks_state': 1, 'lift_act_state': <built-in function gelu>, 'block_act_state': <built-in function gelu>, 'lift_act_heal': <function tanh at 0x7f55138b8cc0>, 'block_act_heal': None, 'width_heal': 128, 'width_state': 4, 'lr': 0.005, 'padding_heal': 9, 'padding_state': 32, 'optimizer': 'adam'}. Best is trial 76 with value: 0.0017377050826326013.
[I 2025-07-30 20:30:40,222] Trial 117 finished with value: 0.0036187695804983377 and parameters: {'width_NN_heal': 8, 'width_NN_state': 512, 'depth_NN_heal': 4, 'depth_NN_state': 4, 'mode_heal': 64, 'mode_state': 12, 'blocks_heal': 8, 'blocks_state': 8, 'lift_act_state': <built-in function gelu>, 'block_act_state': <built-in function gelu>, 'lift_act_heal': <built-in function gelu>, 'block_act_heal': <built-in function gelu>, 'width_heal': 64, 'width_state': 4, 'lr': 0.005, 'padding_heal': 0, 'padding_state': 18, 'optimizer': 'adam'}. Best is trial 76 with value: 0.0017377050826326013.
[I 2025-07-30 20:30:44,284] Trial 118 finished with value: 0.0020413147285580635 and parameters: {'width_NN_heal': 128, 'width_NN_state': 512, 'depth_NN_heal': 4, 'depth_NN_state': 1, 'mode_heal': 64, 'mode_state': 12, 'blocks_heal': 1, 'blocks_state': 8, 'lift_act_state': <built-in function gelu>, 'block_act_state': <built-in function gelu>, 'lift_act_heal': <function tanh at 0x7f55138b8cc0>, 'block_act_heal': None, 'width_heal': 64, 'width_state': 4, 'lr': 0.005, 'padding_heal': 9, 'padding_state': 32, 'optimizer': 'lbfgs'}. Best is trial 76 with value: 0.0017377050826326013.
[I 2025-07-30 20:30:48,455] Trial 119 finished with value: 0.002388246590271592 and parameters: {'width_NN_heal': 128, 'width_NN_state': 512, 'depth_NN_heal': 4, 'depth_NN_state': 1, 'mode_heal': 64, 'mode_state': 64, 'blocks_heal': 1, 'blocks_state': 8, 'lift_act_state': <built-in function gelu>, 'block_act_state': <built-in function gelu>, 'lift_act_heal': <function tanh at 0x7f55138b8cc0>, 'block_act_heal': None, 'width_heal': 64, 'width_state': 4, 'lr': 0.005, 'padding_heal': 32, 'padding_state': 32, 'optimizer': 'lbfgs'}. Best is trial 76 with value: 0.0017377050826326013.
[I 2025-07-30 20:30:53,407] Trial 120 finished with value: 0.0015850707422941923 and parameters: {'width_NN_heal': 128, 'width_NN_state': 512, 'depth_NN_heal': 4, 'depth_NN_state': 1, 'mode_heal': 64, 'mode_state': 64, 'blocks_heal': 4, 'blocks_state': 8, 'lift_act_state': <built-in function gelu>, 'block_act_state': <built-in function gelu>, 'lift_act_heal': <function tanh at 0x7f55138b8cc0>, 'block_act_heal': None, 'width_heal': 64, 'width_state': 4, 'lr': 0.001, 'padding_heal': 18, 'padding_state': 9, 'optimizer': 'lbfgs'}. Best is trial 120 with value: 0.0015850707422941923.
[I 2025-07-30 20:30:58,362] Trial 121 finished with value: 0.0020717584993690252 and parameters: {'width_NN_heal': 128, 'width_NN_state': 512, 'depth_NN_heal': 4, 'depth_NN_state': 1, 'mode_heal': 64, 'mode_state': 64, 'blocks_heal': 4, 'blocks_state': 8, 'lift_act_state': <built-in function gelu>, 'block_act_state': <built-in function gelu>, 'lift_act_heal': <function tanh at 0x7f55138b8cc0>, 'block_act_heal': None, 'width_heal': 64, 'width_state': 4, 'lr': 0.001, 'padding_heal': 18, 'padding_state': 9, 'optimizer': 'lbfgs'}. Best is trial 120 with value: 0.0015850707422941923.
[I 2025-07-30 20:31:03,318] Trial 122 finished with value: 0.0016669275937601924 and parameters: {'width_NN_heal': 128, 'width_NN_state': 512, 'depth_NN_heal': 4, 'depth_NN_state': 1, 'mode_heal': 64, 'mode_state': 64, 'blocks_heal': 4, 'blocks_state': 8, 'lift_act_state': <built-in function gelu>, 'block_act_state': <built-in function gelu>, 'lift_act_heal': <function tanh at 0x7f55138b8cc0>, 'block_act_heal': None, 'width_heal': 64, 'width_state': 4, 'lr': 0.001, 'padding_heal': 18, 'padding_state': 9, 'optimizer': 'lbfgs'}. Best is trial 120 with value: 0.0015850707422941923.
[I 2025-07-30 20:31:08,274] Trial 123 finished with value: 0.0018546917708590627 and parameters: {'width_NN_heal': 128, 'width_NN_state': 512, 'depth_NN_heal': 4, 'depth_NN_state': 1, 'mode_heal': 64, 'mode_state': 64, 'blocks_heal': 4, 'blocks_state': 8, 'lift_act_state': <built-in function gelu>, 'block_act_state': <built-in function gelu>, 'lift_act_heal': <function tanh at 0x7f55138b8cc0>, 'block_act_heal': None, 'width_heal': 64, 'width_state': 4, 'lr': 0.001, 'padding_heal': 18, 'padding_state': 9, 'optimizer': 'lbfgs'}. Best is trial 120 with value: 0.0015850707422941923.
[I 2025-07-30 20:31:13,230] Trial 124 finished with value: 0.001832689973525703 and parameters: {'width_NN_heal': 128, 'width_NN_state': 512, 'depth_NN_heal': 4, 'depth_NN_state': 1, 'mode_heal': 64, 'mode_state': 64, 'blocks_heal': 4, 'blocks_state': 8, 'lift_act_state': <built-in function gelu>, 'block_act_state': <built-in function gelu>, 'lift_act_heal': <function tanh at 0x7f55138b8cc0>, 'block_act_heal': None, 'width_heal': 64, 'width_state': 4, 'lr': 0.001, 'padding_heal': 18, 'padding_state': 9, 'optimizer': 'lbfgs'}. Best is trial 120 with value: 0.0015850707422941923.
[I 2025-07-30 20:31:18,190] Trial 125 finished with value: 0.0021446500904858112 and parameters: {'width_NN_heal': 128, 'width_NN_state': 512, 'depth_NN_heal': 4, 'depth_NN_state': 1, 'mode_heal': 64, 'mode_state': 64, 'blocks_heal': 4, 'blocks_state': 8, 'lift_act_state': <built-in function gelu>, 'block_act_state': <built-in function gelu>, 'lift_act_heal': <function tanh at 0x7f55138b8cc0>, 'block_act_heal': None, 'width_heal': 64, 'width_state': 4, 'lr': 0.001, 'padding_heal': 18, 'padding_state': 9, 'optimizer': 'lbfgs'}. Best is trial 120 with value: 0.0015850707422941923.
[I 2025-07-30 20:31:23,189] Trial 126 finished with value: 0.0018614904256537557 and parameters: {'width_NN_heal': 128, 'width_NN_state': 512, 'depth_NN_heal': 4, 'depth_NN_state': 1, 'mode_heal': 64, 'mode_state': 64, 'blocks_heal': 4, 'blocks_state': 8, 'lift_act_state': <built-in function gelu>, 'block_act_state': <built-in function gelu>, 'lift_act_heal': <function tanh at 0x7f55138b8cc0>, 'block_act_heal': None, 'width_heal': 64, 'width_state': 4, 'lr': 0.001, 'padding_heal': 18, 'padding_state': 9, 'optimizer': 'lbfgs'}. Best is trial 120 with value: 0.0015850707422941923.
[I 2025-07-30 20:31:28,186] Trial 127 finished with value: 0.0023440674412995577 and parameters: {'width_NN_heal': 128, 'width_NN_state': 512, 'depth_NN_heal': 4, 'depth_NN_state': 1, 'mode_heal': 64, 'mode_state': 64, 'blocks_heal': 4, 'blocks_state': 8, 'lift_act_state': <built-in function gelu>, 'block_act_state': <built-in function gelu>, 'lift_act_heal': <function tanh at 0x7f55138b8cc0>, 'block_act_heal': None, 'width_heal': 64, 'width_state': 4, 'lr': 0.001, 'padding_heal': 18, 'padding_state': 9, 'optimizer': 'lbfgs'}. Best is trial 120 with value: 0.0015850707422941923.
[I 2025-07-30 20:31:33,377] Trial 128 finished with value: 0.0020515453070402145 and parameters: {'width_NN_heal': 128, 'width_NN_state': 512, 'depth_NN_heal': 4, 'depth_NN_state': 1, 'mode_heal': 64, 'mode_state': 64, 'blocks_heal': 4, 'blocks_state': 8, 'lift_act_state': <built-in function gelu>, 'block_act_state': <built-in function gelu>, 'lift_act_heal': <function tanh at 0x7f55138b8cc0>, 'block_act_heal': None, 'width_heal': 64, 'width_state': 4, 'lr': 0.001, 'padding_heal': 18, 'padding_state': 9, 'optimizer': 'lbfgs'}. Best is trial 120 with value: 0.0015850707422941923.
[I 2025-07-30 20:31:38,403] Trial 129 finished with value: 0.002494451589882374 and parameters: {'width_NN_heal': 128, 'width_NN_state': 8, 'depth_NN_heal': 4, 'depth_NN_state': 1, 'mode_heal': 64, 'mode_state': 64, 'blocks_heal': 4, 'blocks_state': 8, 'lift_act_state': <built-in function gelu>, 'block_act_state': <built-in function gelu>, 'lift_act_heal': <function tanh at 0x7f55138b8cc0>, 'block_act_heal': None, 'width_heal': 64, 'width_state': 4, 'lr': 0.001, 'padding_heal': 18, 'padding_state': 9, 'optimizer': 'lbfgs'}. Best is trial 120 with value: 0.0015850707422941923.
[I 2025-07-30 20:31:42,143] Trial 130 finished with value: 0.004864177666604519 and parameters: {'width_NN_heal': 128, 'width_NN_state': 512, 'depth_NN_heal': 4, 'depth_NN_state': 1, 'mode_heal': 64, 'mode_state': 64, 'blocks_heal': 4, 'blocks_state': 4, 'lift_act_state': <function tanh at 0x7f55138b8cc0>, 'block_act_state': None, 'lift_act_heal': <function tanh at 0x7f55138b8cc0>, 'block_act_heal': None, 'width_heal': 64, 'width_state': 4, 'lr': 0.001, 'padding_heal': 18, 'padding_state': 9, 'optimizer': 'lbfgs'}. Best is trial 120 with value: 0.0015850707422941923.
[I 2025-07-30 20:31:47,185] Trial 131 finished with value: 0.0016418066807091236 and parameters: {'width_NN_heal': 128, 'width_NN_state': 512, 'depth_NN_heal': 4, 'depth_NN_state': 1, 'mode_heal': 64, 'mode_state': 64, 'blocks_heal': 4, 'blocks_state': 8, 'lift_act_state': <built-in function gelu>, 'block_act_state': <built-in function gelu>, 'lift_act_heal': <function tanh at 0x7f55138b8cc0>, 'block_act_heal': None, 'width_heal': 64, 'width_state': 4, 'lr': 0.001, 'padding_heal': 18, 'padding_state': 9, 'optimizer': 'lbfgs'}. Best is trial 120 with value: 0.0015850707422941923.
[I 2025-07-30 20:31:52,218] Trial 132 finished with value: 0.0023179512936621904 and parameters: {'width_NN_heal': 128, 'width_NN_state': 512, 'depth_NN_heal': 4, 'depth_NN_state': 1, 'mode_heal': 64, 'mode_state': 64, 'blocks_heal': 4, 'blocks_state': 8, 'lift_act_state': <built-in function gelu>, 'block_act_state': <built-in function gelu>, 'lift_act_heal': <function tanh at 0x7f55138b8cc0>, 'block_act_heal': None, 'width_heal': 64, 'width_state': 4, 'lr': 0.001, 'padding_heal': 18, 'padding_state': 9, 'optimizer': 'lbfgs'}. Best is trial 120 with value: 0.0015850707422941923.
[I 2025-07-30 20:31:57,230] Trial 133 finished with value: 0.0022365283221006393 and parameters: {'width_NN_heal': 128, 'width_NN_state': 512, 'depth_NN_heal': 4, 'depth_NN_state': 1, 'mode_heal': 64, 'mode_state': 64, 'blocks_heal': 4, 'blocks_state': 8, 'lift_act_state': <built-in function gelu>, 'block_act_state': <built-in function gelu>, 'lift_act_heal': <function tanh at 0x7f55138b8cc0>, 'block_act_heal': None, 'width_heal': 64, 'width_state': 4, 'lr': 0.001, 'padding_heal': 18, 'padding_state': 9, 'optimizer': 'lbfgs'}. Best is trial 120 with value: 0.0015850707422941923.
[I 2025-07-30 20:32:02,387] Trial 134 finished with value: 0.00165334262419492 and parameters: {'width_NN_heal': 128, 'width_NN_state': 512, 'depth_NN_heal': 4, 'depth_NN_state': 1, 'mode_heal': 64, 'mode_state': 64, 'blocks_heal': 4, 'blocks_state': 8, 'lift_act_state': <built-in function gelu>, 'block_act_state': <built-in function gelu>, 'lift_act_heal': <function tanh at 0x7f55138b8cc0>, 'block_act_heal': None, 'width_heal': 64, 'width_state': 4, 'lr': 0.001, 'padding_heal': 18, 'padding_state': 9, 'optimizer': 'lbfgs'}. Best is trial 120 with value: 0.0015850707422941923.
[I 2025-07-30 20:32:07,422] Trial 135 finished with value: 0.0016138474456965923 and parameters: {'width_NN_heal': 128, 'width_NN_state': 512, 'depth_NN_heal': 4, 'depth_NN_state': 1, 'mode_heal': 64, 'mode_state': 64, 'blocks_heal': 4, 'blocks_state': 8, 'lift_act_state': <built-in function gelu>, 'block_act_state': <built-in function gelu>, 'lift_act_heal': <function tanh at 0x7f55138b8cc0>, 'block_act_heal': None, 'width_heal': 64, 'width_state': 4, 'lr': 0.001, 'padding_heal': 18, 'padding_state': 9, 'optimizer': 'lbfgs'}. Best is trial 120 with value: 0.0015850707422941923.
[I 2025-07-30 20:32:12,459] Trial 136 finished with value: 0.001785386586561799 and parameters: {'width_NN_heal': 128, 'width_NN_state': 512, 'depth_NN_heal': 4, 'depth_NN_state': 1, 'mode_heal': 64, 'mode_state': 64, 'blocks_heal': 4, 'blocks_state': 8, 'lift_act_state': <built-in function gelu>, 'block_act_state': <built-in function gelu>, 'lift_act_heal': <function tanh at 0x7f55138b8cc0>, 'block_act_heal': None, 'width_heal': 64, 'width_state': 4, 'lr': 0.001, 'padding_heal': 18, 'padding_state': 9, 'optimizer': 'lbfgs'}. Best is trial 120 with value: 0.0015850707422941923.
[I 2025-07-30 20:32:17,434] Trial 137 finished with value: 0.0024406425654888153 and parameters: {'width_NN_heal': 128, 'width_NN_state': 512, 'depth_NN_heal': 4, 'depth_NN_state': 1, 'mode_heal': 64, 'mode_state': 64, 'blocks_heal': 4, 'blocks_state': 8, 'lift_act_state': <built-in function gelu>, 'block_act_state': <function tanh at 0x7f55138b8cc0>, 'lift_act_heal': <function tanh at 0x7f55138b8cc0>, 'block_act_heal': None, 'width_heal': 64, 'width_state': 4, 'lr': 0.001, 'padding_heal': 18, 'padding_state': 9, 'optimizer': 'lbfgs'}. Best is trial 120 with value: 0.0015850707422941923.
[I 2025-07-30 20:32:22,388] Trial 138 finished with value: 0.0014254398411139846 and parameters: {'width_NN_heal': 128, 'width_NN_state': 512, 'depth_NN_heal': 4, 'depth_NN_state': 1, 'mode_heal': 64, 'mode_state': 64, 'blocks_heal': 4, 'blocks_state': 8, 'lift_act_state': None, 'block_act_state': <built-in function gelu>, 'lift_act_heal': <function tanh at 0x7f55138b8cc0>, 'block_act_heal': None, 'width_heal': 64, 'width_state': 4, 'lr': 0.001, 'padding_heal': 18, 'padding_state': 9, 'optimizer': 'lbfgs'}. Best is trial 138 with value: 0.0014254398411139846.
[I 2025-07-30 20:32:27,346] Trial 139 finished with value: 0.0017545727314427495 and parameters: {'width_NN_heal': 128, 'width_NN_state': 512, 'depth_NN_heal': 4, 'depth_NN_state': 1, 'mode_heal': 64, 'mode_state': 64, 'blocks_heal': 4, 'blocks_state': 8, 'lift_act_state': None, 'block_act_state': <built-in function gelu>, 'lift_act_heal': <function tanh at 0x7f55138b8cc0>, 'block_act_heal': None, 'width_heal': 64, 'width_state': 4, 'lr': 0.001, 'padding_heal': 18, 'padding_state': 9, 'optimizer': 'lbfgs'}. Best is trial 138 with value: 0.0014254398411139846.
[I 2025-07-30 20:32:32,301] Trial 140 finished with value: 0.0020034874323755503 and parameters: {'width_NN_heal': 128, 'width_NN_state': 512, 'depth_NN_heal': 4, 'depth_NN_state': 1, 'mode_heal': 64, 'mode_state': 64, 'blocks_heal': 4, 'blocks_state': 8, 'lift_act_state': None, 'block_act_state': <built-in function gelu>, 'lift_act_heal': <function tanh at 0x7f55138b8cc0>, 'block_act_heal': None, 'width_heal': 64, 'width_state': 4, 'lr': 0.001, 'padding_heal': 18, 'padding_state': 9, 'optimizer': 'lbfgs'}. Best is trial 138 with value: 0.0014254398411139846.
[I 2025-07-30 20:32:37,261] Trial 141 finished with value: 0.0014848503051325679 and parameters: {'width_NN_heal': 128, 'width_NN_state': 512, 'depth_NN_heal': 4, 'depth_NN_state': 1, 'mode_heal': 64, 'mode_state': 64, 'blocks_heal': 4, 'blocks_state': 8, 'lift_act_state': None, 'block_act_state': <built-in function gelu>, 'lift_act_heal': <function tanh at 0x7f55138b8cc0>, 'block_act_heal': None, 'width_heal': 64, 'width_state': 4, 'lr': 0.001, 'padding_heal': 18, 'padding_state': 9, 'optimizer': 'lbfgs'}. Best is trial 138 with value: 0.0014254398411139846.
[I 2025-07-30 20:32:42,219] Trial 142 finished with value: 0.0017453015316277742 and parameters: {'width_NN_heal': 128, 'width_NN_state': 512, 'depth_NN_heal': 4, 'depth_NN_state': 1, 'mode_heal': 64, 'mode_state': 64, 'blocks_heal': 4, 'blocks_state': 8, 'lift_act_state': None, 'block_act_state': <built-in function gelu>, 'lift_act_heal': <function tanh at 0x7f55138b8cc0>, 'block_act_heal': None, 'width_heal': 64, 'width_state': 4, 'lr': 0.001, 'padding_heal': 18, 'padding_state': 9, 'optimizer': 'lbfgs'}. Best is trial 138 with value: 0.0014254398411139846.
[I 2025-07-30 20:32:47,174] Trial 143 finished with value: 0.0015986651415005326 and parameters: {'width_NN_heal': 128, 'width_NN_state': 512, 'depth_NN_heal': 4, 'depth_NN_state': 1, 'mode_heal': 64, 'mode_state': 64, 'blocks_heal': 4, 'blocks_state': 8, 'lift_act_state': None, 'block_act_state': <built-in function gelu>, 'lift_act_heal': <function tanh at 0x7f55138b8cc0>, 'block_act_heal': None, 'width_heal': 64, 'width_state': 4, 'lr': 0.001, 'padding_heal': 18, 'padding_state': 9, 'optimizer': 'lbfgs'}. Best is trial 138 with value: 0.0014254398411139846.
[I 2025-07-30 20:32:52,129] Trial 144 finished with value: 0.0017984297592192888 and parameters: {'width_NN_heal': 128, 'width_NN_state': 512, 'depth_NN_heal': 4, 'depth_NN_state': 1, 'mode_heal': 64, 'mode_state': 64, 'blocks_heal': 4, 'blocks_state': 8, 'lift_act_state': None, 'block_act_state': <built-in function gelu>, 'lift_act_heal': <function tanh at 0x7f55138b8cc0>, 'block_act_heal': None, 'width_heal': 64, 'width_state': 4, 'lr': 0.001, 'padding_heal': 18, 'padding_state': 9, 'optimizer': 'lbfgs'}. Best is trial 138 with value: 0.0014254398411139846.
[I 2025-07-30 20:32:57,090] Trial 145 finished with value: 0.0015862894942983985 and parameters: {'width_NN_heal': 128, 'width_NN_state': 512, 'depth_NN_heal': 4, 'depth_NN_state': 1, 'mode_heal': 64, 'mode_state': 64, 'blocks_heal': 4, 'blocks_state': 8, 'lift_act_state': None, 'block_act_state': <built-in function gelu>, 'lift_act_heal': <function tanh at 0x7f55138b8cc0>, 'block_act_heal': None, 'width_heal': 64, 'width_state': 4, 'lr': 0.001, 'padding_heal': 18, 'padding_state': 9, 'optimizer': 'lbfgs'}. Best is trial 138 with value: 0.0014254398411139846.
