[I 2025-07-30 20:17:44,341] Trial 192 finished with value: 0.001251131878234446 and parameters: {'width_NN_heal': 64, 'width_NN_state': 8, 'depth_NN_heal': 1, 'depth_NN_state': 2, 'mode_heal': 64, 'mode_state': 64, 'blocks_heal': 4, 'blocks_state': 4, 'lift_act_state': None, 'block_act_state': <built-in function gelu>, 'lift_act_heal': None, 'block_act_heal': <built-in function gelu>, 'width_heal': 32, 'width_state': 64, 'lr': 0.005, 'padding_heal': 9, 'padding_state': 18, 'optimizer': 'adam'}. Best is trial 164 with value: 0.0011818198254331946.
[I 2025-07-30 20:17:51,086] Trial 193 finished with value: 0.0013476344756782055 and parameters: {'width_NN_heal': 64, 'width_NN_state': 8, 'depth_NN_heal': 1, 'depth_NN_state': 2, 'mode_heal': 64, 'mode_state': 64, 'blocks_heal': 4, 'blocks_state': 4, 'lift_act_state': None, 'block_act_state': <built-in function gelu>, 'lift_act_heal': None, 'block_act_heal': <built-in function gelu>, 'width_heal': 32, 'width_state': 64, 'lr': 0.005, 'padding_heal': 9, 'padding_state': 18, 'optimizer': 'adam'}. Best is trial 164 with value: 0.0011818198254331946.
[I 2025-07-30 20:17:57,791] Trial 194 finished with value: 0.0013494115555658937 and parameters: {'width_NN_heal': 64, 'width_NN_state': 8, 'depth_NN_heal': 1, 'depth_NN_state': 2, 'mode_heal': 64, 'mode_state': 64, 'blocks_heal': 4, 'blocks_state': 4, 'lift_act_state': None, 'block_act_state': <built-in function gelu>, 'lift_act_heal': None, 'block_act_heal': <built-in function gelu>, 'width_heal': 32, 'width_state': 64, 'lr': 0.005, 'padding_heal': 9, 'padding_state': 18, 'optimizer': 'adam'}. Best is trial 164 with value: 0.0011818198254331946.
[I 2025-07-30 20:18:04,491] Trial 195 finished with value: 0.0011671138927340508 and parameters: {'width_NN_heal': 64, 'width_NN_state': 8, 'depth_NN_heal': 1, 'depth_NN_state': 2, 'mode_heal': 64, 'mode_state': 64, 'blocks_heal': 4, 'blocks_state': 4, 'lift_act_state': None, 'block_act_state': <built-in function gelu>, 'lift_act_heal': None, 'block_act_heal': <built-in function gelu>, 'width_heal': 32, 'width_state': 64, 'lr': 0.005, 'padding_heal': 9, 'padding_state': 18, 'optimizer': 'adam'}. Best is trial 195 with value: 0.0011671138927340508.
[I 2025-07-30 20:18:11,195] Trial 196 finished with value: 0.0014738846803084016 and parameters: {'width_NN_heal': 64, 'width_NN_state': 8, 'depth_NN_heal': 1, 'depth_NN_state': 2, 'mode_heal': 64, 'mode_state': 64, 'blocks_heal': 4, 'blocks_state': 4, 'lift_act_state': None, 'block_act_state': <built-in function gelu>, 'lift_act_heal': None, 'block_act_heal': <built-in function gelu>, 'width_heal': 32, 'width_state': 64, 'lr': 0.005, 'padding_heal': 9, 'padding_state': 18, 'optimizer': 'adam'}. Best is trial 195 with value: 0.0011671138927340508.
[I 2025-07-30 20:18:17,890] Trial 197 finished with value: 0.0013194575440138578 and parameters: {'width_NN_heal': 64, 'width_NN_state': 8, 'depth_NN_heal': 1, 'depth_NN_state': 2, 'mode_heal': 64, 'mode_state': 64, 'blocks_heal': 4, 'blocks_state': 4, 'lift_act_state': None, 'block_act_state': <built-in function gelu>, 'lift_act_heal': None, 'block_act_heal': <built-in function gelu>, 'width_heal': 32, 'width_state': 4, 'lr': 0.005, 'padding_heal': 0, 'padding_state': 18, 'optimizer': 'adam'}. Best is trial 195 with value: 0.0011671138927340508.
[I 2025-07-30 20:18:24,595] Trial 198 finished with value: 0.0014160588616505265 and parameters: {'width_NN_heal': 64, 'width_NN_state': 8, 'depth_NN_heal': 1, 'depth_NN_state': 2, 'mode_heal': 64, 'mode_state': 64, 'blocks_heal': 4, 'blocks_state': 4, 'lift_act_state': None, 'block_act_state': <built-in function gelu>, 'lift_act_heal': None, 'block_act_heal': <built-in function gelu>, 'width_heal': 32, 'width_state': 64, 'lr': 0.005, 'padding_heal': 9, 'padding_state': 18, 'optimizer': 'adam'}. Best is trial 195 with value: 0.0011671138927340508.
[I 2025-07-30 20:18:31,297] Trial 199 finished with value: 0.003046788740903139 and parameters: {'width_NN_heal': 64, 'width_NN_state': 8, 'depth_NN_heal': 1, 'depth_NN_state': 2, 'mode_heal': 64, 'mode_state': 64, 'blocks_heal': 4, 'blocks_state': 4, 'lift_act_state': None, 'block_act_state': <built-in function gelu>, 'lift_act_heal': None, 'block_act_heal': <built-in function gelu>, 'width_heal': 32, 'width_state': 64, 'lr': 0.001, 'padding_heal': 9, 'padding_state': 18, 'optimizer': 'adam'}. Best is trial 195 with value: 0.0011671138927340508.
Best trial:
FrozenTrial(number=195, state=1, values=[0.0011671138927340508], datetime_start=datetime.datetime(2025, 7, 30, 20, 17, 57, 791581), datetime_complete=datetime.datetime(2025, 7, 30, 20, 18, 4, 491059), params={'width_NN_heal': 64, 'width_NN_state': 8, 'depth_NN_heal': 1, 'depth_NN_state': 2, 'mode_heal': 64, 'mode_state': 64, 'blocks_heal': 4, 'blocks_state': 4, 'lift_act_state': None, 'block_act_state': <built-in function gelu>, 'lift_act_heal': None, 'block_act_heal': <built-in function gelu>, 'width_heal': 32, 'width_state': 64, 'lr': 0.005, 'padding_heal': 9, 'padding_state': 18, 'optimizer': 'adam'}, user_attrs={}, system_attrs={}, intermediate_values={}, distributions={'width_NN_heal': CategoricalDistribution(choices=(8, 64, 128)), 'width_NN_state': CategoricalDistribution(choices=(8, 64, 128)), 'depth_NN_heal': CategoricalDistribution(choices=(1, 2, 4)), 'depth_NN_state': CategoricalDistribution(choices=(1, 2, 4)), 'mode_heal': CategoricalDistribution(choices=(12, 32, 64)), 'mode_state': CategoricalDistribution(choices=(12, 32, 64)), 'blocks_heal': CategoricalDistribution(choices=(1, 4, 8)), 'blocks_state': CategoricalDistribution(choices=(1, 4, 8)), 'lift_act_state': CategoricalDistribution(choices=(None, <function tanh at 0x7f8c12ab8cc0>, <built-in function gelu>)), 'block_act_state': CategoricalDistribution(choices=(None, <function tanh at 0x7f8c12ab8cc0>, <built-in function gelu>)), 'lift_act_heal': CategoricalDistribution(choices=(None, <function tanh at 0x7f8c12ab8cc0>, <built-in function gelu>)), 'block_act_heal': CategoricalDistribution(choices=(None, <function tanh at 0x7f8c12ab8cc0>, <built-in function gelu>)), 'width_heal': CategoricalDistribution(choices=(4, 32, 64)), 'width_state': CategoricalDistribution(choices=(4, 32, 64)), 'lr': CategoricalDistribution(choices=(0.005, 0.001, 0.01)), 'padding_heal': CategoricalDistribution(choices=(0, 9, 18)), 'padding_state': CategoricalDistribution(choices=(0, 9, 18)), 'optimizer': CategoricalDistribution(choices=('adam', 'lbfgs'))}, trial_id=195, value=None)
