[I 2025-07-30 20:42:45,466] Trial 299 finished with value: 0.0014769741101190448 and parameters: {'width_NN_heal': 128, 'width_NN_state': 512, 'depth_NN_heal': 2, 'depth_NN_state': 1, 'mode_heal': 12, 'mode_state': 64, 'blocks_heal': 4, 'blocks_state': 4, 'lift_act_state': None, 'block_act_state': <built-in function gelu>, 'lift_act_heal': None, 'block_act_heal': <function tanh at 0x7f55138b8cc0>, 'width_heal': 64, 'width_state': 64, 'lr': 0.001, 'padding_heal': 32, 'padding_state': 18, 'optimizer': 'lbfgs'}. Best is trial 267 with value: 0.0013575004413723946.
Best trial:
FrozenTrial(number=267, state=1, values=[0.0013575004413723946], datetime_start=datetime.datetime(2025, 7, 30, 20, 40, 46, 693847), datetime_complete=datetime.datetime(2025, 7, 30, 20, 40, 50, 275193), params={'width_NN_heal': 128, 'width_NN_state': 512, 'depth_NN_heal': 2, 'depth_NN_state': 1, 'mode_heal': 12, 'mode_state': 64, 'blocks_heal': 4, 'blocks_state': 4, 'lift_act_state': None, 'block_act_state': <built-in function gelu>, 'lift_act_heal': None, 'block_act_heal': <function tanh at 0x7f55138b8cc0>, 'width_heal': 64, 'width_state': 64, 'lr': 0.001, 'padding_heal': 32, 'padding_state': 18, 'optimizer': 'lbfgs'}, user_attrs={}, system_attrs={}, intermediate_values={}, distributions={'width_NN_heal': CategoricalDistribution(choices=(8, 128, 512)), 'width_NN_state': CategoricalDistribution(choices=(8, 128, 512)), 'depth_NN_heal': CategoricalDistribution(choices=(1, 2, 4)), 'depth_NN_state': CategoricalDistribution(choices=(1, 2, 4)), 'mode_heal': CategoricalDistribution(choices=(12, 32, 64)), 'mode_state': CategoricalDistribution(choices=(12, 32, 64)), 'blocks_heal': CategoricalDistribution(choices=(1, 4, 8)), 'blocks_state': CategoricalDistribution(choices=(1, 4, 8)), 'lift_act_state': CategoricalDistribution(choices=(None, <function tanh at 0x7f55138b8cc0>, <built-in function gelu>)), 'block_act_state': CategoricalDistribution(choices=(None, <function tanh at 0x7f55138b8cc0>, <built-in function gelu>)), 'lift_act_heal': CategoricalDistribution(choices=(None, <function tanh at 0x7f55138b8cc0>, <built-in function gelu>)), 'block_act_heal': CategoricalDistribution(choices=(None, <function tanh at 0x7f55138b8cc0>, <built-in function gelu>)), 'width_heal': CategoricalDistribution(choices=(4, 64, 128)), 'width_state': CategoricalDistribution(choices=(4, 64, 128)), 'lr': CategoricalDistribution(choices=(0.005, 0.001, 0.01)), 'padding_heal': CategoricalDistribution(choices=(0, 9, 18, 32)), 'padding_state': CategoricalDistribution(choices=(0, 9, 18, 32)), 'optimizer': CategoricalDistribution(choices=('adam', 'lbfgs'))}, trial_id=267, value=None)
