[I 2025-07-30 20:35:50,167] Trial 186 finished with value: 0.001578754629008472 and parameters: {'width_NN_heal': 128, 'width_NN_state': 512, 'depth_NN_heal': 4, 'depth_NN_state': 1, 'mode_heal': 64, 'mode_state': 64, 'blocks_heal': 4, 'blocks_state': 4, 'lift_act_state': None, 'block_act_state': <built-in function gelu>, 'lift_act_heal': None, 'block_act_heal': <function tanh at 0x7f55138b8cc0>, 'width_heal': 64, 'width_state': 4, 'lr': 0.001, 'padding_heal': 18, 'padding_state': 9, 'optimizer': 'lbfgs'}. Best is trial 156 with value: 0.0013996975030750036.
[I 2025-07-30 20:35:53,884] Trial 187 finished with value: 0.001549402717500925 and parameters: {'width_NN_heal': 128, 'width_NN_state': 512, 'depth_NN_heal': 4, 'depth_NN_state': 1, 'mode_heal': 64, 'mode_state': 64, 'blocks_heal': 4, 'blocks_state': 4, 'lift_act_state': None, 'block_act_state': <built-in function gelu>, 'lift_act_heal': None, 'block_act_heal': <function tanh at 0x7f55138b8cc0>, 'width_heal': 64, 'width_state': 4, 'lr': 0.001, 'padding_heal': 18, 'padding_state': 9, 'optimizer': 'lbfgs'}. Best is trial 156 with value: 0.0013996975030750036.
[I 2025-07-30 20:35:57,602] Trial 188 finished with value: 0.003805474378168583 and parameters: {'width_NN_heal': 128, 'width_NN_state': 8, 'depth_NN_heal': 4, 'depth_NN_state': 1, 'mode_heal': 64, 'mode_state': 64, 'blocks_heal': 4, 'blocks_state': 4, 'lift_act_state': None, 'block_act_state': <built-in function gelu>, 'lift_act_heal': None, 'block_act_heal': <function tanh at 0x7f55138b8cc0>, 'width_heal': 64, 'width_state': 4, 'lr': 0.001, 'padding_heal': 18, 'padding_state': 9, 'optimizer': 'lbfgs'}. Best is trial 156 with value: 0.0013996975030750036.
[I 2025-07-30 20:36:01,319] Trial 189 finished with value: 0.0015519169392064214 and parameters: {'width_NN_heal': 128, 'width_NN_state': 512, 'depth_NN_heal': 4, 'depth_NN_state': 1, 'mode_heal': 64, 'mode_state': 64, 'blocks_heal': 4, 'blocks_state': 4, 'lift_act_state': None, 'block_act_state': <built-in function gelu>, 'lift_act_heal': None, 'block_act_heal': <function tanh at 0x7f55138b8cc0>, 'width_heal': 64, 'width_state': 4, 'lr': 0.001, 'padding_heal': 18, 'padding_state': 9, 'optimizer': 'lbfgs'}. Best is trial 156 with value: 0.0013996975030750036.
[I 2025-07-30 20:36:05,035] Trial 190 finished with value: 0.001559490105137229 and parameters: {'width_NN_heal': 128, 'width_NN_state': 512, 'depth_NN_heal': 4, 'depth_NN_state': 1, 'mode_heal': 64, 'mode_state': 64, 'blocks_heal': 4, 'blocks_state': 4, 'lift_act_state': None, 'block_act_state': <built-in function gelu>, 'lift_act_heal': None, 'block_act_heal': <function tanh at 0x7f55138b8cc0>, 'width_heal': 64, 'width_state': 4, 'lr': 0.001, 'padding_heal': 18, 'padding_state': 9, 'optimizer': 'lbfgs'}. Best is trial 156 with value: 0.0013996975030750036.
[I 2025-07-30 20:36:08,753] Trial 191 finished with value: 0.0016589025035500526 and parameters: {'width_NN_heal': 128, 'width_NN_state': 512, 'depth_NN_heal': 4, 'depth_NN_state': 1, 'mode_heal': 64, 'mode_state': 64, 'blocks_heal': 4, 'blocks_state': 4, 'lift_act_state': None, 'block_act_state': <built-in function gelu>, 'lift_act_heal': None, 'block_act_heal': <function tanh at 0x7f55138b8cc0>, 'width_heal': 64, 'width_state': 4, 'lr': 0.001, 'padding_heal': 18, 'padding_state': 9, 'optimizer': 'lbfgs'}. Best is trial 156 with value: 0.0013996975030750036.
[I 2025-07-30 20:36:12,469] Trial 192 finished with value: 0.0016603979747742414 and parameters: {'width_NN_heal': 128, 'width_NN_state': 512, 'depth_NN_heal': 4, 'depth_NN_state': 1, 'mode_heal': 64, 'mode_state': 64, 'blocks_heal': 4, 'blocks_state': 4, 'lift_act_state': None, 'block_act_state': <built-in function gelu>, 'lift_act_heal': None, 'block_act_heal': <function tanh at 0x7f55138b8cc0>, 'width_heal': 64, 'width_state': 4, 'lr': 0.001, 'padding_heal': 18, 'padding_state': 9, 'optimizer': 'lbfgs'}. Best is trial 156 with value: 0.0013996975030750036.
[I 2025-07-30 20:36:16,187] Trial 193 finished with value: 0.0015760862734168768 and parameters: {'width_NN_heal': 128, 'width_NN_state': 512, 'depth_NN_heal': 4, 'depth_NN_state': 1, 'mode_heal': 64, 'mode_state': 64, 'blocks_heal': 4, 'blocks_state': 4, 'lift_act_state': None, 'block_act_state': <built-in function gelu>, 'lift_act_heal': None, 'block_act_heal': <function tanh at 0x7f55138b8cc0>, 'width_heal': 64, 'width_state': 4, 'lr': 0.001, 'padding_heal': 18, 'padding_state': 9, 'optimizer': 'lbfgs'}. Best is trial 156 with value: 0.0013996975030750036.
[I 2025-07-30 20:36:19,903] Trial 194 finished with value: 0.0015930425142869353 and parameters: {'width_NN_heal': 128, 'width_NN_state': 512, 'depth_NN_heal': 4, 'depth_NN_state': 1, 'mode_heal': 64, 'mode_state': 64, 'blocks_heal': 4, 'blocks_state': 4, 'lift_act_state': None, 'block_act_state': <built-in function gelu>, 'lift_act_heal': None, 'block_act_heal': <function tanh at 0x7f55138b8cc0>, 'width_heal': 64, 'width_state': 4, 'lr': 0.001, 'padding_heal': 18, 'padding_state': 9, 'optimizer': 'lbfgs'}. Best is trial 156 with value: 0.0013996975030750036.
[I 2025-07-30 20:36:23,621] Trial 195 finished with value: 0.0015958111034706235 and parameters: {'width_NN_heal': 128, 'width_NN_state': 512, 'depth_NN_heal': 4, 'depth_NN_state': 1, 'mode_heal': 64, 'mode_state': 64, 'blocks_heal': 4, 'blocks_state': 4, 'lift_act_state': None, 'block_act_state': <built-in function gelu>, 'lift_act_heal': None, 'block_act_heal': <function tanh at 0x7f55138b8cc0>, 'width_heal': 64, 'width_state': 4, 'lr': 0.001, 'padding_heal': 18, 'padding_state': 9, 'optimizer': 'lbfgs'}. Best is trial 156 with value: 0.0013996975030750036.
[I 2025-07-30 20:36:27,339] Trial 196 finished with value: 0.001652193022891879 and parameters: {'width_NN_heal': 128, 'width_NN_state': 512, 'depth_NN_heal': 4, 'depth_NN_state': 1, 'mode_heal': 64, 'mode_state': 64, 'blocks_heal': 4, 'blocks_state': 4, 'lift_act_state': None, 'block_act_state': <built-in function gelu>, 'lift_act_heal': None, 'block_act_heal': <function tanh at 0x7f55138b8cc0>, 'width_heal': 64, 'width_state': 4, 'lr': 0.001, 'padding_heal': 18, 'padding_state': 9, 'optimizer': 'lbfgs'}. Best is trial 156 with value: 0.0013996975030750036.
[I 2025-07-30 20:36:31,071] Trial 197 finished with value: 0.001577830407768488 and parameters: {'width_NN_heal': 128, 'width_NN_state': 512, 'depth_NN_heal': 4, 'depth_NN_state': 1, 'mode_heal': 64, 'mode_state': 64, 'blocks_heal': 4, 'blocks_state': 4, 'lift_act_state': None, 'block_act_state': <built-in function gelu>, 'lift_act_heal': None, 'block_act_heal': <function tanh at 0x7f55138b8cc0>, 'width_heal': 64, 'width_state': 4, 'lr': 0.001, 'padding_heal': 18, 'padding_state': 9, 'optimizer': 'lbfgs'}. Best is trial 156 with value: 0.0013996975030750036.
[I 2025-07-30 20:36:34,754] Trial 198 finished with value: 0.010302221402525902 and parameters: {'width_NN_heal': 128, 'width_NN_state': 512, 'depth_NN_heal': 4, 'depth_NN_state': 1, 'mode_heal': 64, 'mode_state': 64, 'blocks_heal': 4, 'blocks_state': 4, 'lift_act_state': None, 'block_act_state': None, 'lift_act_heal': None, 'block_act_heal': <function tanh at 0x7f55138b8cc0>, 'width_heal': 64, 'width_state': 4, 'lr': 0.001, 'padding_heal': 18, 'padding_state': 9, 'optimizer': 'lbfgs'}. Best is trial 156 with value: 0.0013996975030750036.
[I 2025-07-30 20:36:38,472] Trial 199 finished with value: 0.0015760684618726373 and parameters: {'width_NN_heal': 128, 'width_NN_state': 512, 'depth_NN_heal': 4, 'depth_NN_state': 1, 'mode_heal': 64, 'mode_state': 64, 'blocks_heal': 4, 'blocks_state': 4, 'lift_act_state': None, 'block_act_state': <built-in function gelu>, 'lift_act_heal': None, 'block_act_heal': <function tanh at 0x7f55138b8cc0>, 'width_heal': 64, 'width_state': 4, 'lr': 0.001, 'padding_heal': 18, 'padding_state': 9, 'optimizer': 'lbfgs'}. Best is trial 156 with value: 0.0013996975030750036.
[I 2025-07-30 20:36:42,192] Trial 200 finished with value: 0.0016123540699481964 and parameters: {'width_NN_heal': 128, 'width_NN_state': 512, 'depth_NN_heal': 4, 'depth_NN_state': 1, 'mode_heal': 64, 'mode_state': 64, 'blocks_heal': 4, 'blocks_state': 4, 'lift_act_state': None, 'block_act_state': <built-in function gelu>, 'lift_act_heal': None, 'block_act_heal': <function tanh at 0x7f55138b8cc0>, 'width_heal': 64, 'width_state': 4, 'lr': 0.001, 'padding_heal': 18, 'padding_state': 9, 'optimizer': 'lbfgs'}. Best is trial 156 with value: 0.0013996975030750036.
[I 2025-07-30 20:36:45,911] Trial 201 finished with value: 0.0015662029618397355 and parameters: {'width_NN_heal': 128, 'width_NN_state': 512, 'depth_NN_heal': 4, 'depth_NN_state': 1, 'mode_heal': 64, 'mode_state': 64, 'blocks_heal': 4, 'blocks_state': 4, 'lift_act_state': None, 'block_act_state': <built-in function gelu>, 'lift_act_heal': None, 'block_act_heal': <function tanh at 0x7f55138b8cc0>, 'width_heal': 64, 'width_state': 4, 'lr': 0.001, 'padding_heal': 18, 'padding_state': 9, 'optimizer': 'lbfgs'}. Best is trial 156 with value: 0.0013996975030750036.
[I 2025-07-30 20:36:49,632] Trial 202 finished with value: 0.0017380520002916455 and parameters: {'width_NN_heal': 128, 'width_NN_state': 512, 'depth_NN_heal': 4, 'depth_NN_state': 1, 'mode_heal': 64, 'mode_state': 64, 'blocks_heal': 4, 'blocks_state': 4, 'lift_act_state': None, 'block_act_state': <built-in function gelu>, 'lift_act_heal': None, 'block_act_heal': <function tanh at 0x7f55138b8cc0>, 'width_heal': 64, 'width_state': 4, 'lr': 0.001, 'padding_heal': 18, 'padding_state': 9, 'optimizer': 'lbfgs'}. Best is trial 156 with value: 0.0013996975030750036.
[I 2025-07-30 20:36:53,354] Trial 203 finished with value: 0.00169101741630584 and parameters: {'width_NN_heal': 128, 'width_NN_state': 512, 'depth_NN_heal': 4, 'depth_NN_state': 1, 'mode_heal': 64, 'mode_state': 64, 'blocks_heal': 4, 'blocks_state': 4, 'lift_act_state': None, 'block_act_state': <built-in function gelu>, 'lift_act_heal': None, 'block_act_heal': <function tanh at 0x7f55138b8cc0>, 'width_heal': 64, 'width_state': 4, 'lr': 0.001, 'padding_heal': 18, 'padding_state': 9, 'optimizer': 'lbfgs'}. Best is trial 156 with value: 0.0013996975030750036.
[I 2025-07-30 20:36:57,076] Trial 204 finished with value: 0.0016798321157693863 and parameters: {'width_NN_heal': 128, 'width_NN_state': 512, 'depth_NN_heal': 4, 'depth_NN_state': 1, 'mode_heal': 64, 'mode_state': 64, 'blocks_heal': 4, 'blocks_state': 4, 'lift_act_state': None, 'block_act_state': <built-in function gelu>, 'lift_act_heal': None, 'block_act_heal': <function tanh at 0x7f55138b8cc0>, 'width_heal': 64, 'width_state': 4, 'lr': 0.001, 'padding_heal': 18, 'padding_state': 9, 'optimizer': 'lbfgs'}. Best is trial 156 with value: 0.0013996975030750036.
[I 2025-07-30 20:37:00,794] Trial 205 finished with value: 0.0016161547973752022 and parameters: {'width_NN_heal': 128, 'width_NN_state': 512, 'depth_NN_heal': 4, 'depth_NN_state': 1, 'mode_heal': 64, 'mode_state': 64, 'blocks_heal': 4, 'blocks_state': 4, 'lift_act_state': None, 'block_act_state': <built-in function gelu>, 'lift_act_heal': None, 'block_act_heal': <function tanh at 0x7f55138b8cc0>, 'width_heal': 64, 'width_state': 4, 'lr': 0.001, 'padding_heal': 18, 'padding_state': 9, 'optimizer': 'lbfgs'}. Best is trial 156 with value: 0.0013996975030750036.
[I 2025-07-30 20:37:04,361] Trial 206 finished with value: 0.0030487743206322193 and parameters: {'width_NN_heal': 128, 'width_NN_state': 512, 'depth_NN_heal': 2, 'depth_NN_state': 1, 'mode_heal': 64, 'mode_state': 64, 'blocks_heal': 4, 'blocks_state': 4, 'lift_act_state': None, 'block_act_state': <function tanh at 0x7f55138b8cc0>, 'lift_act_heal': None, 'block_act_heal': <function tanh at 0x7f55138b8cc0>, 'width_heal': 64, 'width_state': 4, 'lr': 0.001, 'padding_heal': 18, 'padding_state': 9, 'optimizer': 'lbfgs'}. Best is trial 156 with value: 0.0013996975030750036.
[I 2025-07-30 20:37:08,080] Trial 207 finished with value: 0.0017432880122214556 and parameters: {'width_NN_heal': 128, 'width_NN_state': 512, 'depth_NN_heal': 4, 'depth_NN_state': 1, 'mode_heal': 64, 'mode_state': 64, 'blocks_heal': 4, 'blocks_state': 4, 'lift_act_state': None, 'block_act_state': <built-in function gelu>, 'lift_act_heal': None, 'block_act_heal': <function tanh at 0x7f55138b8cc0>, 'width_heal': 64, 'width_state': 64, 'lr': 0.001, 'padding_heal': 18, 'padding_state': 9, 'optimizer': 'lbfgs'}. Best is trial 156 with value: 0.0013996975030750036.
[I 2025-07-30 20:37:11,675] Trial 208 finished with value: 0.007846510037779808 and parameters: {'width_NN_heal': 128, 'width_NN_state': 512, 'depth_NN_heal': 4, 'depth_NN_state': 1, 'mode_heal': 64, 'mode_state': 64, 'blocks_heal': 4, 'blocks_state': 4, 'lift_act_state': None, 'block_act_state': <built-in function gelu>, 'lift_act_heal': None, 'block_act_heal': <function tanh at 0x7f55138b8cc0>, 'width_heal': 4, 'width_state': 4, 'lr': 0.001, 'padding_heal': 18, 'padding_state': 0, 'optimizer': 'lbfgs'}. Best is trial 156 with value: 0.0013996975030750036.
[I 2025-07-30 20:37:15,384] Trial 209 finished with value: 0.0016458930913358927 and parameters: {'width_NN_heal': 128, 'width_NN_state': 512, 'depth_NN_heal': 4, 'depth_NN_state': 1, 'mode_heal': 32, 'mode_state': 64, 'blocks_heal': 4, 'blocks_state': 4, 'lift_act_state': None, 'block_act_state': <built-in function gelu>, 'lift_act_heal': None, 'block_act_heal': <function tanh at 0x7f55138b8cc0>, 'width_heal': 64, 'width_state': 4, 'lr': 0.001, 'padding_heal': 18, 'padding_state': 9, 'optimizer': 'lbfgs'}. Best is trial 156 with value: 0.0013996975030750036.
[I 2025-07-30 20:37:19,097] Trial 210 finished with value: 0.001921887043863535 and parameters: {'width_NN_heal': 128, 'width_NN_state': 512, 'depth_NN_heal': 4, 'depth_NN_state': 1, 'mode_heal': 64, 'mode_state': 32, 'blocks_heal': 4, 'blocks_state': 4, 'lift_act_state': None, 'block_act_state': <built-in function gelu>, 'lift_act_heal': None, 'block_act_heal': <function tanh at 0x7f55138b8cc0>, 'width_heal': 64, 'width_state': 4, 'lr': 0.001, 'padding_heal': 18, 'padding_state': 9, 'optimizer': 'lbfgs'}. Best is trial 156 with value: 0.0013996975030750036.
[I 2025-07-30 20:37:22,816] Trial 211 finished with value: 0.0016844721976667643 and parameters: {'width_NN_heal': 128, 'width_NN_state': 512, 'depth_NN_heal': 4, 'depth_NN_state': 1, 'mode_heal': 64, 'mode_state': 64, 'blocks_heal': 4, 'blocks_state': 4, 'lift_act_state': None, 'block_act_state': <built-in function gelu>, 'lift_act_heal': None, 'block_act_heal': <function tanh at 0x7f55138b8cc0>, 'width_heal': 64, 'width_state': 4, 'lr': 0.001, 'padding_heal': 18, 'padding_state': 9, 'optimizer': 'lbfgs'}. Best is trial 156 with value: 0.0013996975030750036.
[I 2025-07-30 20:37:26,539] Trial 212 finished with value: 0.001566526829265058 and parameters: {'width_NN_heal': 128, 'width_NN_state': 512, 'depth_NN_heal': 4, 'depth_NN_state': 1, 'mode_heal': 64, 'mode_state': 64, 'blocks_heal': 4, 'blocks_state': 4, 'lift_act_state': None, 'block_act_state': <built-in function gelu>, 'lift_act_heal': None, 'block_act_heal': <function tanh at 0x7f55138b8cc0>, 'width_heal': 64, 'width_state': 4, 'lr': 0.001, 'padding_heal': 18, 'padding_state': 9, 'optimizer': 'lbfgs'}. Best is trial 156 with value: 0.0013996975030750036.
[I 2025-07-30 20:37:30,256] Trial 213 finished with value: 0.0015784769784659147 and parameters: {'width_NN_heal': 128, 'width_NN_state': 512, 'depth_NN_heal': 4, 'depth_NN_state': 1, 'mode_heal': 64, 'mode_state': 64, 'blocks_heal': 4, 'blocks_state': 4, 'lift_act_state': None, 'block_act_state': <built-in function gelu>, 'lift_act_heal': None, 'block_act_heal': <function tanh at 0x7f55138b8cc0>, 'width_heal': 64, 'width_state': 4, 'lr': 0.001, 'padding_heal': 18, 'padding_state': 9, 'optimizer': 'lbfgs'}. Best is trial 156 with value: 0.0013996975030750036.
[I 2025-07-30 20:37:33,976] Trial 214 finished with value: 0.0015840501291677356 and parameters: {'width_NN_heal': 128, 'width_NN_state': 512, 'depth_NN_heal': 4, 'depth_NN_state': 1, 'mode_heal': 64, 'mode_state': 64, 'blocks_heal': 4, 'blocks_state': 4, 'lift_act_state': None, 'block_act_state': <built-in function gelu>, 'lift_act_heal': None, 'block_act_heal': <function tanh at 0x7f55138b8cc0>, 'width_heal': 64, 'width_state': 4, 'lr': 0.001, 'padding_heal': 18, 'padding_state': 9, 'optimizer': 'lbfgs'}. Best is trial 156 with value: 0.0013996975030750036.
[I 2025-07-30 20:37:37,733] Trial 215 finished with value: 0.0014134779339656234 and parameters: {'width_NN_heal': 128, 'width_NN_state': 512, 'depth_NN_heal': 4, 'depth_NN_state': 1, 'mode_heal': 64, 'mode_state': 64, 'blocks_heal': 4, 'blocks_state': 4, 'lift_act_state': None, 'block_act_state': <built-in function gelu>, 'lift_act_heal': None, 'block_act_heal': <function tanh at 0x7f55138b8cc0>, 'width_heal': 64, 'width_state': 4, 'lr': 0.001, 'padding_heal': 18, 'padding_state': 18, 'optimizer': 'lbfgs'}. Best is trial 156 with value: 0.0013996975030750036.
[I 2025-07-30 20:37:41,493] Trial 216 finished with value: 0.0013921743957325816 and parameters: {'width_NN_heal': 128, 'width_NN_state': 512, 'depth_NN_heal': 4, 'depth_NN_state': 1, 'mode_heal': 64, 'mode_state': 64, 'blocks_heal': 4, 'blocks_state': 4, 'lift_act_state': None, 'block_act_state': <built-in function gelu>, 'lift_act_heal': None, 'block_act_heal': <function tanh at 0x7f55138b8cc0>, 'width_heal': 64, 'width_state': 4, 'lr': 0.001, 'padding_heal': 18, 'padding_state': 18, 'optimizer': 'lbfgs'}. Best is trial 216 with value: 0.0013921743957325816.
[I 2025-07-30 20:37:45,252] Trial 217 finished with value: 0.0015315127093344927 and parameters: {'width_NN_heal': 128, 'width_NN_state': 512, 'depth_NN_heal': 4, 'depth_NN_state': 1, 'mode_heal': 64, 'mode_state': 64, 'blocks_heal': 4, 'blocks_state': 4, 'lift_act_state': None, 'block_act_state': <built-in function gelu>, 'lift_act_heal': None, 'block_act_heal': <function tanh at 0x7f55138b8cc0>, 'width_heal': 64, 'width_state': 4, 'lr': 0.001, 'padding_heal': 18, 'padding_state': 18, 'optimizer': 'lbfgs'}. Best is trial 216 with value: 0.0013921743957325816.
[I 2025-07-30 20:37:49,012] Trial 218 finished with value: 0.0015065333573147655 and parameters: {'width_NN_heal': 128, 'width_NN_state': 512, 'depth_NN_heal': 4, 'depth_NN_state': 1, 'mode_heal': 64, 'mode_state': 64, 'blocks_heal': 4, 'blocks_state': 4, 'lift_act_state': None, 'block_act_state': <built-in function gelu>, 'lift_act_heal': None, 'block_act_heal': <function tanh at 0x7f55138b8cc0>, 'width_heal': 64, 'width_state': 4, 'lr': 0.001, 'padding_heal': 18, 'padding_state': 18, 'optimizer': 'lbfgs'}. Best is trial 216 with value: 0.0013921743957325816.
[I 2025-07-30 20:37:52,772] Trial 219 finished with value: 0.0014664112823083997 and parameters: {'width_NN_heal': 128, 'width_NN_state': 512, 'depth_NN_heal': 4, 'depth_NN_state': 1, 'mode_heal': 64, 'mode_state': 64, 'blocks_heal': 4, 'blocks_state': 4, 'lift_act_state': None, 'block_act_state': <built-in function gelu>, 'lift_act_heal': None, 'block_act_heal': <function tanh at 0x7f55138b8cc0>, 'width_heal': 64, 'width_state': 4, 'lr': 0.001, 'padding_heal': 18, 'padding_state': 18, 'optimizer': 'lbfgs'}. Best is trial 216 with value: 0.0013921743957325816.
[I 2025-07-30 20:37:56,535] Trial 220 finished with value: 0.001511856447905302 and parameters: {'width_NN_heal': 128, 'width_NN_state': 512, 'depth_NN_heal': 4, 'depth_NN_state': 1, 'mode_heal': 64, 'mode_state': 64, 'blocks_heal': 4, 'blocks_state': 4, 'lift_act_state': None, 'block_act_state': <built-in function gelu>, 'lift_act_heal': None, 'block_act_heal': <function tanh at 0x7f55138b8cc0>, 'width_heal': 64, 'width_state': 4, 'lr': 0.001, 'padding_heal': 18, 'padding_state': 18, 'optimizer': 'lbfgs'}. Best is trial 216 with value: 0.0013921743957325816.
[I 2025-07-30 20:38:00,296] Trial 221 finished with value: 0.001526343054138124 and parameters: {'width_NN_heal': 128, 'width_NN_state': 512, 'depth_NN_heal': 4, 'depth_NN_state': 1, 'mode_heal': 64, 'mode_state': 64, 'blocks_heal': 4, 'blocks_state': 4, 'lift_act_state': None, 'block_act_state': <built-in function gelu>, 'lift_act_heal': None, 'block_act_heal': <function tanh at 0x7f55138b8cc0>, 'width_heal': 64, 'width_state': 4, 'lr': 0.001, 'padding_heal': 18, 'padding_state': 18, 'optimizer': 'lbfgs'}. Best is trial 216 with value: 0.0013921743957325816.
[I 2025-07-30 20:38:04,058] Trial 222 finished with value: 0.0015645388048142195 and parameters: {'width_NN_heal': 128, 'width_NN_state': 512, 'depth_NN_heal': 4, 'depth_NN_state': 1, 'mode_heal': 64, 'mode_state': 64, 'blocks_heal': 4, 'blocks_state': 4, 'lift_act_state': None, 'block_act_state': <built-in function gelu>, 'lift_act_heal': None, 'block_act_heal': <function tanh at 0x7f55138b8cc0>, 'width_heal': 64, 'width_state': 4, 'lr': 0.001, 'padding_heal': 18, 'padding_state': 18, 'optimizer': 'lbfgs'}. Best is trial 216 with value: 0.0013921743957325816.
[I 2025-07-30 20:38:07,817] Trial 223 finished with value: 0.001570539316162467 and parameters: {'width_NN_heal': 128, 'width_NN_state': 512, 'depth_NN_heal': 4, 'depth_NN_state': 1, 'mode_heal': 64, 'mode_state': 64, 'blocks_heal': 4, 'blocks_state': 4, 'lift_act_state': None, 'block_act_state': <built-in function gelu>, 'lift_act_heal': None, 'block_act_heal': <function tanh at 0x7f55138b8cc0>, 'width_heal': 64, 'width_state': 4, 'lr': 0.001, 'padding_heal': 18, 'padding_state': 18, 'optimizer': 'lbfgs'}. Best is trial 216 with value: 0.0013921743957325816.
