[I 2025-07-30 23:59:55,691] Trial 2202 finished with value: 0.0010954048484563828 and parameters: {'width_NN_heal': 324, 'width_NN_state': 239, 'depth_NN_heal': 2, 'depth_NN_state': 3, 'mode_heal': 60, 'mode_state': 64, 'blocks_heal': 7, 'blocks_state': 3, 'lift_act_state': <built-in function gelu>, 'block_act_state': <built-in function gelu>, 'lift_act_heal': <built-in function gelu>, 'block_act_heal': None, 'width_heal': 37, 'width_state': 100, 'lr': 0.0020459182416846904, 'padding_heal': 6, 'padding_state': 17, 'optimizer_type': 'lbfgs'}. Best is trial 1511 with value: 0.0009640019852668047.
[I 2025-07-31 00:00:00,885] Trial 2203 finished with value: 0.001050687162205577 and parameters: {'width_NN_heal': 432, 'width_NN_state': 275, 'depth_NN_heal': 2, 'depth_NN_state': 3, 'mode_heal': 56, 'mode_state': 56, 'blocks_heal': 8, 'blocks_state': 3, 'lift_act_state': <built-in function gelu>, 'block_act_state': <built-in function gelu>, 'lift_act_heal': <built-in function gelu>, 'block_act_heal': None, 'width_heal': 54, 'width_state': 105, 'lr': 0.0016832887126328126, 'padding_heal': 7, 'padding_state': 18, 'optimizer_type': 'lbfgs'}. Best is trial 1511 with value: 0.0009640019852668047.
[I 2025-07-31 00:00:05,540] Trial 2204 finished with value: 0.0011926528532058 and parameters: {'width_NN_heal': 362, 'width_NN_state': 312, 'depth_NN_heal': 1, 'depth_NN_state': 3, 'mode_heal': 64, 'mode_state': 44, 'blocks_heal': 7, 'blocks_state': 3, 'lift_act_state': <built-in function gelu>, 'block_act_state': <built-in function gelu>, 'lift_act_heal': <built-in function gelu>, 'block_act_heal': <built-in function gelu>, 'width_heal': 31, 'width_state': 25, 'lr': 0.0022147861087285273, 'padding_heal': 4, 'padding_state': 19, 'optimizer_type': 'lbfgs'}. Best is trial 1511 with value: 0.0009640019852668047.
[I 2025-07-31 00:00:10,944] Trial 2205 finished with value: 0.0011030709138140082 and parameters: {'width_NN_heal': 512, 'width_NN_state': 346, 'depth_NN_heal': 2, 'depth_NN_state': 3, 'mode_heal': 60, 'mode_state': 64, 'blocks_heal': 7, 'blocks_state': 3, 'lift_act_state': <built-in function gelu>, 'block_act_state': <built-in function gelu>, 'lift_act_heal': <built-in function gelu>, 'block_act_heal': None, 'width_heal': 66, 'width_state': 91, 'lr': 0.0018387956746080706, 'padding_heal': 1, 'padding_state': 16, 'optimizer_type': 'lbfgs'}. Best is trial 1511 with value: 0.0009640019852668047.
[I 2025-07-31 00:00:15,620] Trial 2206 finished with value: 0.0013097478076815605 and parameters: {'width_NN_heal': 410, 'width_NN_state': 279, 'depth_NN_heal': 2, 'depth_NN_state': 3, 'mode_heal': 64, 'mode_state': 64, 'blocks_heal': 7, 'blocks_state': 3, 'lift_act_state': <built-in function gelu>, 'block_act_state': <built-in function gelu>, 'lift_act_heal': None, 'block_act_heal': None, 'width_heal': 58, 'width_state': 121, 'lr': 0.0024539302952307786, 'padding_heal': 5, 'padding_state': 16, 'optimizer_type': 'lbfgs'}. Best is trial 1511 with value: 0.0009640019852668047.
[I 2025-07-31 00:00:20,667] Trial 2207 finished with value: 0.0012066626222804189 and parameters: {'width_NN_heal': 451, 'width_NN_state': 313, 'depth_NN_heal': 3, 'depth_NN_state': 3, 'mode_heal': 60, 'mode_state': 52, 'blocks_heal': 6, 'blocks_state': 3, 'lift_act_state': <built-in function gelu>, 'block_act_state': <built-in function gelu>, 'lift_act_heal': <built-in function gelu>, 'block_act_heal': None, 'width_heal': 37, 'width_state': 112, 'lr': 0.0019932870574732647, 'padding_heal': 5, 'padding_state': 17, 'optimizer_type': 'lbfgs'}. Best is trial 1511 with value: 0.0009640019852668047.
[I 2025-07-31 00:00:24,498] Trial 2208 finished with value: 0.0011066789738833904 and parameters: {'width_NN_heal': 311, 'width_NN_state': 255, 'depth_NN_heal': 2, 'depth_NN_state': 3, 'mode_heal': 60, 'mode_state': 56, 'blocks_heal': 4, 'blocks_state': 3, 'lift_act_state': <built-in function gelu>, 'block_act_state': <built-in function gelu>, 'lift_act_heal': <built-in function gelu>, 'block_act_heal': None, 'width_heal': 54, 'width_state': 97, 'lr': 0.0017496843439805897, 'padding_heal': 2, 'padding_state': 20, 'optimizer_type': 'lbfgs'}. Best is trial 1511 with value: 0.0009640019852668047.
[I 2025-07-31 00:00:30,097] Trial 2209 finished with value: 0.008303701877593994 and parameters: {'width_NN_heal': 365, 'width_NN_state': 340, 'depth_NN_heal': 2, 'depth_NN_state': 4, 'mode_heal': 64, 'mode_state': 64, 'blocks_heal': 8, 'blocks_state': 2, 'lift_act_state': <built-in function gelu>, 'block_act_state': <built-in function gelu>, 'lift_act_heal': <built-in function gelu>, 'block_act_heal': None, 'width_heal': 59, 'width_state': 105, 'lr': 0.00021534174160134302, 'padding_heal': 4, 'padding_state': 15, 'optimizer_type': 'lbfgs'}. Best is trial 1511 with value: 0.0009640019852668047.
[I 2025-07-31 00:00:34,775] Trial 2210 finished with value: 0.0012178259203210473 and parameters: {'width_NN_heal': 272, 'width_NN_state': 298, 'depth_NN_heal': 2, 'depth_NN_state': 3, 'mode_heal': 40, 'mode_state': 36, 'blocks_heal': 7, 'blocks_state': 3, 'lift_act_state': <built-in function gelu>, 'block_act_state': <built-in function gelu>, 'lift_act_heal': <built-in function gelu>, 'block_act_heal': None, 'width_heal': 35, 'width_state': 128, 'lr': 0.001973571177321458, 'padding_heal': 3, 'padding_state': 18, 'optimizer_type': 'lbfgs'}. Best is trial 1511 with value: 0.0009640019852668047.
[I 2025-07-31 00:00:39,826] Trial 2211 finished with value: 0.0014826885890215635 and parameters: {'width_NN_heal': 333, 'width_NN_state': 354, 'depth_NN_heal': 2, 'depth_NN_state': 3, 'mode_heal': 60, 'mode_state': 64, 'blocks_heal': 8, 'blocks_state': 3, 'lift_act_state': <built-in function gelu>, 'block_act_state': <built-in function gelu>, 'lift_act_heal': <built-in function gelu>, 'block_act_heal': None, 'width_heal': 64, 'width_state': 113, 'lr': 0.0022367230140842077, 'padding_heal': 5, 'padding_state': 17, 'optimizer_type': 'lbfgs'}. Best is trial 1511 with value: 0.0009640019852668047.
[I 2025-07-31 00:00:44,979] Trial 2212 finished with value: 0.0019106381805613637 and parameters: {'width_NN_heal': 476, 'width_NN_state': 322, 'depth_NN_heal': 2, 'depth_NN_state': 3, 'mode_heal': 64, 'mode_state': 56, 'blocks_heal': 7, 'blocks_state': 3, 'lift_act_state': <built-in function gelu>, 'block_act_state': <built-in function gelu>, 'lift_act_heal': <built-in function gelu>, 'block_act_heal': None, 'width_heal': 53, 'width_state': 89, 'lr': 0.0004355259538215096, 'padding_heal': 4, 'padding_state': 18, 'optimizer_type': 'lbfgs'}. Best is trial 1511 with value: 0.0009640019852668047.
[I 2025-07-31 00:00:50,193] Trial 2213 finished with value: 0.0011586896143853664 and parameters: {'width_NN_heal': 398, 'width_NN_state': 264, 'depth_NN_heal': 2, 'depth_NN_state': 3, 'mode_heal': 60, 'mode_state': 64, 'blocks_heal': 7, 'blocks_state': 3, 'lift_act_state': <built-in function gelu>, 'block_act_state': <built-in function gelu>, 'lift_act_heal': <built-in function gelu>, 'block_act_heal': None, 'width_heal': 73, 'width_state': 102, 'lr': 0.0017021692231505724, 'padding_heal': 12, 'padding_state': 16, 'optimizer_type': 'lbfgs'}. Best is trial 1511 with value: 0.0009640019852668047.
[I 2025-07-31 00:00:55,067] Trial 2214 finished with value: 0.0016068319091573358 and parameters: {'width_NN_heal': 430, 'width_NN_state': 236, 'depth_NN_heal': 2, 'depth_NN_state': 2, 'mode_heal': 64, 'mode_state': 48, 'blocks_heal': 8, 'blocks_state': 3, 'lift_act_state': <function tanh at 0x7ff3611b4cc0>, 'block_act_state': <built-in function gelu>, 'lift_act_heal': <built-in function gelu>, 'block_act_heal': None, 'width_heal': 32, 'width_state': 120, 'lr': 0.0016386147910718673, 'padding_heal': 6, 'padding_state': 19, 'optimizer_type': 'lbfgs'}. Best is trial 1511 with value: 0.0009640019852668047.
[I 2025-07-31 00:01:00,133] Trial 2215 finished with value: 0.0011890024179592729 and parameters: {'width_NN_heal': 361, 'width_NN_state': 289, 'depth_NN_heal': 2, 'depth_NN_state': 3, 'mode_heal': 56, 'mode_state': 52, 'blocks_heal': 8, 'blocks_state': 3, 'lift_act_state': <built-in function gelu>, 'block_act_state': <built-in function gelu>, 'lift_act_heal': <built-in function gelu>, 'block_act_heal': None, 'width_heal': 58, 'width_state': 128, 'lr': 0.002844270488041038, 'padding_heal': 7, 'padding_state': 17, 'optimizer_type': 'lbfgs'}. Best is trial 1511 with value: 0.0009640019852668047.
[I 2025-07-31 00:01:05,064] Trial 2216 finished with value: 0.0011849713046103716 and parameters: {'width_NN_heal': 291, 'width_NN_state': 373, 'depth_NN_heal': 3, 'depth_NN_state': 3, 'mode_heal': 60, 'mode_state': 40, 'blocks_heal': 7, 'blocks_state': 3, 'lift_act_state': <built-in function gelu>, 'block_act_state': <built-in function gelu>, 'lift_act_heal': <built-in function gelu>, 'block_act_heal': None, 'width_heal': 52, 'width_state': 109, 'lr': 0.0018617981410580426, 'padding_heal': 3, 'padding_state': 18, 'optimizer_type': 'lbfgs'}. Best is trial 1511 with value: 0.0009640019852668047.
[I 2025-07-31 00:01:11,570] Trial 2217 finished with value: 0.0014851873274892569 and parameters: {'width_NN_heal': 390, 'width_NN_state': 323, 'depth_NN_heal': 5, 'depth_NN_state': 3, 'mode_heal': 64, 'mode_state': 64, 'blocks_heal': 7, 'blocks_state': 3, 'lift_act_state': <built-in function gelu>, 'block_act_state': <built-in function gelu>, 'lift_act_heal': <built-in function gelu>, 'block_act_heal': None, 'width_heal': 39, 'width_state': 97, 'lr': 0.002076021230343803, 'padding_heal': 5, 'padding_state': 14, 'optimizer_type': 'lbfgs'}. Best is trial 1511 with value: 0.0009640019852668047.
[I 2025-07-31 00:01:16,260] Trial 2218 finished with value: 0.0014716580044478178 and parameters: {'width_NN_heal': 240, 'width_NN_state': 275, 'depth_NN_heal': 2, 'depth_NN_state': 3, 'mode_heal': 64, 'mode_state': 32, 'blocks_heal': 7, 'blocks_state': 3, 'lift_act_state': <built-in function gelu>, 'block_act_state': <function tanh at 0x7ff3611b4cc0>, 'lift_act_heal': <built-in function gelu>, 'block_act_heal': None, 'width_heal': 28, 'width_state': 113, 'lr': 0.002495695538247313, 'padding_heal': 4, 'padding_state': 16, 'optimizer_type': 'lbfgs'}. Best is trial 1511 with value: 0.0009640019852668047.
[I 2025-07-31 00:01:21,494] Trial 2219 finished with value: 0.0016040579648688436 and parameters: {'width_NN_heal': 319, 'width_NN_state': 307, 'depth_NN_heal': 2, 'depth_NN_state': 3, 'mode_heal': 60, 'mode_state': 52, 'blocks_heal': 8, 'blocks_state': 4, 'lift_act_state': None, 'block_act_state': <built-in function gelu>, 'lift_act_heal': <built-in function gelu>, 'block_act_heal': None, 'width_heal': 62, 'width_state': 101, 'lr': 0.001568956256109735, 'padding_heal': 3, 'padding_state': 15, 'optimizer_type': 'adam'}. Best is trial 1511 with value: 0.0009640019852668047.
[I 2025-07-31 00:01:26,354] Trial 2220 finished with value: 0.0012634610757231712 and parameters: {'width_NN_heal': 474, 'width_NN_state': 220, 'depth_NN_heal': 2, 'depth_NN_state': 3, 'mode_heal': 64, 'mode_state': 64, 'blocks_heal': 7, 'blocks_state': 3, 'lift_act_state': <built-in function gelu>, 'block_act_state': <built-in function gelu>, 'lift_act_heal': None, 'block_act_heal': None, 'width_heal': 69, 'width_state': 92, 'lr': 0.0017137637566336614, 'padding_heal': 6, 'padding_state': 19, 'optimizer_type': 'lbfgs'}. Best is trial 1511 with value: 0.0009640019852668047.
[I 2025-07-31 00:01:31,162] Trial 2221 finished with value: 0.0012848030310124159 and parameters: {'width_NN_heal': 343, 'width_NN_state': 347, 'depth_NN_heal': 2, 'depth_NN_state': 3, 'mode_heal': 60, 'mode_state': 64, 'blocks_heal': 8, 'blocks_state': 2, 'lift_act_state': <built-in function gelu>, 'block_act_state': <built-in function gelu>, 'lift_act_heal': <built-in function gelu>, 'block_act_heal': None, 'width_heal': 56, 'width_state': 107, 'lr': 0.002290600291697433, 'padding_heal': 2, 'padding_state': 15, 'optimizer_type': 'lbfgs'}. Best is trial 1511 with value: 0.0009640019852668047.
[I 2025-07-31 00:01:36,267] Trial 2222 finished with value: 0.0033587398938834667 and parameters: {'width_NN_heal': 417, 'width_NN_state': 257, 'depth_NN_heal': 2, 'depth_NN_state': 4, 'mode_heal': 60, 'mode_state': 56, 'blocks_heal': 8, 'blocks_state': 3, 'lift_act_state': <built-in function gelu>, 'block_act_state': <built-in function gelu>, 'lift_act_heal': <built-in function gelu>, 'block_act_heal': None, 'width_heal': 35, 'width_state': 128, 'lr': 0.0019273004027763642, 'padding_heal': 4, 'padding_state': 17, 'optimizer_type': 'lbfgs'}. Best is trial 1511 with value: 0.0009640019852668047.
[I 2025-07-31 00:01:41,346] Trial 2223 finished with value: 0.002288834424689412 and parameters: {'width_NN_heal': 384, 'width_NN_state': 375, 'depth_NN_heal': 3, 'depth_NN_state': 3, 'mode_heal': 64, 'mode_state': 64, 'blocks_heal': 7, 'blocks_state': 3, 'lift_act_state': <built-in function gelu>, 'block_act_state': None, 'lift_act_heal': <built-in function gelu>, 'block_act_heal': None, 'width_heal': 30, 'width_state': 117, 'lr': 0.0015742954368497789, 'padding_heal': 7, 'padding_state': 18, 'optimizer_type': 'lbfgs'}. Best is trial 1511 with value: 0.0009640019852668047.
[I 2025-07-31 00:01:46,362] Trial 2224 finished with value: 0.0015966426581144333 and parameters: {'width_NN_heal': 204, 'width_NN_state': 287, 'depth_NN_heal': 2, 'depth_NN_state': 3, 'mode_heal': 60, 'mode_state': 36, 'blocks_heal': 8, 'blocks_state': 3, 'lift_act_state': <built-in function gelu>, 'block_act_state': <built-in function gelu>, 'lift_act_heal': <built-in function gelu>, 'block_act_heal': <built-in function gelu>, 'width_heal': 39, 'width_state': 20, 'lr': 0.0017640774458986866, 'padding_heal': 5, 'padding_state': 17, 'optimizer_type': 'lbfgs'}. Best is trial 1511 with value: 0.0009640019852668047.
[I 2025-07-31 00:01:51,607] Trial 2225 finished with value: 0.0012374046491459012 and parameters: {'width_NN_heal': 468, 'width_NN_state': 325, 'depth_NN_heal': 2, 'depth_NN_state': 3, 'mode_heal': 64, 'mode_state': 56, 'blocks_heal': 7, 'blocks_state': 3, 'lift_act_state': <built-in function gelu>, 'block_act_state': <built-in function gelu>, 'lift_act_heal': <built-in function gelu>, 'block_act_heal': None, 'width_heal': 51, 'width_state': 103, 'lr': 0.0021507117741237525, 'padding_heal': 19, 'padding_state': 16, 'optimizer_type': 'lbfgs'}. Best is trial 1511 with value: 0.0009640019852668047.
[I 2025-07-31 00:01:56,091] Trial 2226 finished with value: 0.0014285339275375009 and parameters: {'width_NN_heal': 442, 'width_NN_state': 299, 'depth_NN_heal': 1, 'depth_NN_state': 3, 'mode_heal': 60, 'mode_state': 64, 'blocks_heal': 7, 'blocks_state': 3, 'lift_act_state': <built-in function gelu>, 'block_act_state': <built-in function gelu>, 'lift_act_heal': <built-in function gelu>, 'block_act_heal': None, 'width_heal': 33, 'width_state': 88, 'lr': 0.001427637122580646, 'padding_heal': 0, 'padding_state': 16, 'optimizer_type': 'lbfgs'}. Best is trial 1511 with value: 0.0009640019852668047.
[I 2025-07-31 00:02:01,036] Trial 2227 finished with value: 0.0011626365594565868 and parameters: {'width_NN_heal': 262, 'width_NN_state': 361, 'depth_NN_heal': 2, 'depth_NN_state': 3, 'mode_heal': 60, 'mode_state': 56, 'blocks_heal': 8, 'blocks_state': 3, 'lift_act_state': <built-in function gelu>, 'block_act_state': <built-in function gelu>, 'lift_act_heal': <built-in function gelu>, 'block_act_heal': None, 'width_heal': 58, 'width_state': 22, 'lr': 0.0011311722110463266, 'padding_heal': 3, 'padding_state': 17, 'optimizer_type': 'lbfgs'}. Best is trial 1511 with value: 0.0009640019852668047.
[I 2025-07-31 00:02:05,798] Trial 2228 finished with value: 0.002787241945043206 and parameters: {'width_NN_heal': 224, 'width_NN_state': 280, 'depth_NN_heal': 2, 'depth_NN_state': 3, 'mode_heal': 64, 'mode_state': 52, 'blocks_heal': 7, 'blocks_state': 3, 'lift_act_state': <built-in function gelu>, 'block_act_state': <built-in function gelu>, 'lift_act_heal': <built-in function gelu>, 'block_act_heal': None, 'width_heal': 66, 'width_state': 112, 'lr': 0.0002909740775196332, 'padding_heal': 5, 'padding_state': 20, 'optimizer_type': 'lbfgs'}. Best is trial 1511 with value: 0.0009640019852668047.
[I 2025-07-31 00:02:10,784] Trial 2229 finished with value: 0.0010865182848647237 and parameters: {'width_NN_heal': 354, 'width_NN_state': 250, 'depth_NN_heal': 2, 'depth_NN_state': 3, 'mode_heal': 56, 'mode_state': 64, 'blocks_heal': 8, 'blocks_state': 3, 'lift_act_state': <built-in function gelu>, 'block_act_state': <built-in function gelu>, 'lift_act_heal': <built-in function gelu>, 'block_act_heal': None, 'width_heal': 52, 'width_state': 99, 'lr': 0.001599488369147608, 'padding_heal': 4, 'padding_state': 18, 'optimizer_type': 'lbfgs'}. Best is trial 1511 with value: 0.0009640019852668047.
[I 2025-07-31 00:02:15,805] Trial 2230 finished with value: 0.0011399579234421253 and parameters: {'width_NN_heal': 382, 'width_NN_state': 334, 'depth_NN_heal': 2, 'depth_NN_state': 3, 'mode_heal': 60, 'mode_state': 64, 'blocks_heal': 8, 'blocks_state': 3, 'lift_act_state': <built-in function gelu>, 'block_act_state': <built-in function gelu>, 'lift_act_heal': <built-in function gelu>, 'block_act_heal': None, 'width_heal': 37, 'width_state': 120, 'lr': 0.0026192940228386115, 'padding_heal': 10, 'padding_state': 19, 'optimizer_type': 'lbfgs'}. Best is trial 1511 with value: 0.0009640019852668047.
[I 2025-07-31 00:02:20,511] Trial 2231 finished with value: 0.00298096751794219 and parameters: {'width_NN_heal': 420, 'width_NN_state': 303, 'depth_NN_heal': 3, 'depth_NN_state': 3, 'mode_heal': 64, 'mode_state': 56, 'blocks_heal': 6, 'blocks_state': 3, 'lift_act_state': <built-in function gelu>, 'block_act_state': <built-in function gelu>, 'lift_act_heal': <built-in function gelu>, 'block_act_heal': None, 'width_heal': 7, 'width_state': 94, 'lr': 0.003193237181268592, 'padding_heal': 2, 'padding_state': 15, 'optimizer_type': 'lbfgs'}. Best is trial 1511 with value: 0.0009640019852668047.
[I 2025-07-31 00:02:25,403] Trial 2232 finished with value: 0.0012862056028097868 and parameters: {'width_NN_heal': 319, 'width_NN_state': 407, 'depth_NN_heal': 2, 'depth_NN_state': 2, 'mode_heal': 56, 'mode_state': 52, 'blocks_heal': 7, 'blocks_state': 3, 'lift_act_state': <built-in function gelu>, 'block_act_state': <built-in function gelu>, 'lift_act_heal': <built-in function gelu>, 'block_act_heal': None, 'width_heal': 77, 'width_state': 110, 'lr': 0.0018645701994857114, 'padding_heal': 4, 'padding_state': 16, 'optimizer_type': 'lbfgs'}. Best is trial 1511 with value: 0.0009640019852668047.
[I 2025-07-31 00:02:30,393] Trial 2233 finished with value: 0.0017281919717788696 and parameters: {'width_NN_heal': 512, 'width_NN_state': 384, 'depth_NN_heal': 2, 'depth_NN_state': 3, 'mode_heal': 64, 'mode_state': 64, 'blocks_heal': 7, 'blocks_state': 3, 'lift_act_state': <built-in function gelu>, 'block_act_state': <built-in function gelu>, 'lift_act_heal': <built-in function gelu>, 'block_act_heal': None, 'width_heal': 61, 'width_state': 104, 'lr': 0.0017235380500425486, 'padding_heal': 1, 'padding_state': 2, 'optimizer_type': 'lbfgs'}. Best is trial 1511 with value: 0.0009640019852668047.
[I 2025-07-31 00:02:35,370] Trial 2234 finished with value: 0.001180556253530085 and parameters: {'width_NN_heal': 283, 'width_NN_state': 328, 'depth_NN_heal': 2, 'depth_NN_state': 3, 'mode_heal': 56, 'mode_state': 64, 'blocks_heal': 7, 'blocks_state': 4, 'lift_act_state': <built-in function gelu>, 'block_act_state': <built-in function gelu>, 'lift_act_heal': <built-in function gelu>, 'block_act_heal': None, 'width_heal': 41, 'width_state': 24, 'lr': 0.0012421869435750772, 'padding_heal': 6, 'padding_state': 16, 'optimizer_type': 'lbfgs'}. Best is trial 1511 with value: 0.0009640019852668047.
[I 2025-07-31 00:02:40,293] Trial 2235 finished with value: 0.0014314576983451843 and parameters: {'width_NN_heal': 342, 'width_NN_state': 272, 'depth_NN_heal': 2, 'depth_NN_state': 3, 'mode_heal': 60, 'mode_state': 56, 'blocks_heal': 8, 'blocks_state': 3, 'lift_act_state': <function tanh at 0x7ff3611b4cc0>, 'block_act_state': <built-in function gelu>, 'lift_act_heal': None, 'block_act_heal': None, 'width_heal': 54, 'width_state': 88, 'lr': 0.0019688828403671686, 'padding_heal': 3, 'padding_state': 17, 'optimizer_type': 'lbfgs'}. Best is trial 1511 with value: 0.0009640019852668047.
[I 2025-07-31 00:02:46,614] Trial 2236 finished with value: 0.017017420381307602 and parameters: {'width_NN_heal': 23, 'width_NN_state': 355, 'depth_NN_heal': 2, 'depth_NN_state': 4, 'mode_heal': 60, 'mode_state': 64, 'blocks_heal': 7, 'blocks_state': 8, 'lift_act_state': <built-in function gelu>, 'block_act_state': <built-in function gelu>, 'lift_act_heal': <built-in function gelu>, 'block_act_heal': None, 'width_heal': 26, 'width_state': 120, 'lr': 0.001409247043401608, 'padding_heal': 5, 'padding_state': 23, 'optimizer_type': 'lbfgs'}. Best is trial 1511 with value: 0.0009640019852668047.
[I 2025-07-31 00:02:51,271] Trial 2237 finished with value: 0.0012482847087085247 and parameters: {'width_NN_heal': 384, 'width_NN_state': 307, 'depth_NN_heal': 1, 'depth_NN_state': 3, 'mode_heal': 64, 'mode_state': 64, 'blocks_heal': 5, 'blocks_state': 3, 'lift_act_state': <built-in function gelu>, 'block_act_state': <built-in function gelu>, 'lift_act_heal': <built-in function gelu>, 'block_act_heal': None, 'width_heal': 99, 'width_state': 113, 'lr': 0.002345380797409834, 'padding_heal': 4, 'padding_state': 17, 'optimizer_type': 'adam'}. Best is trial 1511 with value: 0.0009640019852668047.
