[I 2025-07-30 21:10:32,115] Trial 178 finished with value: 0.0051125576719641685 and parameters: {'width_NN_heal': 79, 'width_NN_state': 22, 'depth_NN_heal': 8, 'depth_NN_state': 6, 'mode_heal': 48, 'mode_state': 40, 'blocks_heal': 8, 'blocks_state': 5, 'lift_act_state': <function tanh at 0x7ff3611b4cc0>, 'block_act_state': None, 'lift_act_heal': <built-in function gelu>, 'block_act_heal': <built-in function gelu>, 'width_heal': 52, 'width_state': 118, 'lr': 0.0027285689742034065, 'padding_heal': 6, 'padding_state': 29, 'optimizer_type': 'adam'}. Best is trial 174 with value: 0.001268339459784329.
[I 2025-07-30 21:10:38,621] Trial 179 finished with value: 0.030743075534701347 and parameters: {'width_NN_heal': 58, 'width_NN_state': 25, 'depth_NN_heal': 8, 'depth_NN_state': 6, 'mode_heal': 44, 'mode_state': 52, 'blocks_heal': 8, 'blocks_state': 6, 'lift_act_state': <built-in function gelu>, 'block_act_state': <built-in function gelu>, 'lift_act_heal': <built-in function gelu>, 'block_act_heal': <built-in function gelu>, 'width_heal': 64, 'width_state': 96, 'lr': 0.001990756669391133, 'padding_heal': 7, 'padding_state': 28, 'optimizer_type': 'adam'}. Best is trial 174 with value: 0.001268339459784329.
[I 2025-07-30 21:10:44,932] Trial 180 finished with value: 0.0023909732699394226 and parameters: {'width_NN_heal': 53, 'width_NN_state': 29, 'depth_NN_heal': 8, 'depth_NN_state': 7, 'mode_heal': 44, 'mode_state': 52, 'blocks_heal': 8, 'blocks_state': 5, 'lift_act_state': <function tanh at 0x7ff3611b4cc0>, 'block_act_state': <built-in function gelu>, 'lift_act_heal': <built-in function gelu>, 'block_act_heal': <built-in function gelu>, 'width_heal': 20, 'width_state': 85, 'lr': 0.002472537332650154, 'padding_heal': 4, 'padding_state': 28, 'optimizer_type': 'adam'}. Best is trial 174 with value: 0.001268339459784329.
[I 2025-07-30 21:10:51,187] Trial 181 finished with value: 0.0017287349328398705 and parameters: {'width_NN_heal': 48, 'width_NN_state': 34, 'depth_NN_heal': 8, 'depth_NN_state': 6, 'mode_heal': 40, 'mode_state': 48, 'blocks_heal': 8, 'blocks_state': 5, 'lift_act_state': <function tanh at 0x7ff3611b4cc0>, 'block_act_state': <built-in function gelu>, 'lift_act_heal': <built-in function gelu>, 'block_act_heal': <built-in function gelu>, 'width_heal': 46, 'width_state': 125, 'lr': 0.00288514578590526, 'padding_heal': 8, 'padding_state': 29, 'optimizer_type': 'adam'}. Best is trial 174 with value: 0.001268339459784329.
[I 2025-07-30 21:10:57,466] Trial 182 finished with value: 0.00152862467803061 and parameters: {'width_NN_heal': 26, 'width_NN_state': 41, 'depth_NN_heal': 8, 'depth_NN_state': 6, 'mode_heal': 44, 'mode_state': 48, 'blocks_heal': 8, 'blocks_state': 5, 'lift_act_state': <function tanh at 0x7ff3611b4cc0>, 'block_act_state': <built-in function gelu>, 'lift_act_heal': <built-in function gelu>, 'block_act_heal': <built-in function gelu>, 'width_heal': 41, 'width_state': 105, 'lr': 0.0035103845294264255, 'padding_heal': 7, 'padding_state': 30, 'optimizer_type': 'adam'}. Best is trial 174 with value: 0.001268339459784329.
[I 2025-07-30 21:11:03,793] Trial 183 finished with value: 0.0014673342229798436 and parameters: {'width_NN_heal': 38, 'width_NN_state': 42, 'depth_NN_heal': 8, 'depth_NN_state': 6, 'mode_heal': 44, 'mode_state': 52, 'blocks_heal': 8, 'blocks_state': 5, 'lift_act_state': <function tanh at 0x7ff3611b4cc0>, 'block_act_state': <built-in function gelu>, 'lift_act_heal': <built-in function gelu>, 'block_act_heal': <built-in function gelu>, 'width_heal': 38, 'width_state': 106, 'lr': 0.0035090473035724575, 'padding_heal': 7, 'padding_state': 18, 'optimizer_type': 'adam'}. Best is trial 174 with value: 0.001268339459784329.
[I 2025-07-30 21:11:10,097] Trial 184 finished with value: 0.0014747915556654334 and parameters: {'width_NN_heal': 39, 'width_NN_state': 44, 'depth_NN_heal': 8, 'depth_NN_state': 6, 'mode_heal': 44, 'mode_state': 52, 'blocks_heal': 8, 'blocks_state': 5, 'lift_act_state': <function tanh at 0x7ff3611b4cc0>, 'block_act_state': <built-in function gelu>, 'lift_act_heal': <built-in function gelu>, 'block_act_heal': <built-in function gelu>, 'width_heal': 38, 'width_state': 114, 'lr': 0.003102295459510518, 'padding_heal': 7, 'padding_state': 17, 'optimizer_type': 'adam'}. Best is trial 174 with value: 0.001268339459784329.
[I 2025-07-30 21:11:16,410] Trial 185 finished with value: 0.002354081254452467 and parameters: {'width_NN_heal': 38, 'width_NN_state': 45, 'depth_NN_heal': 8, 'depth_NN_state': 6, 'mode_heal': 40, 'mode_state': 52, 'blocks_heal': 8, 'blocks_state': 5, 'lift_act_state': <function tanh at 0x7ff3611b4cc0>, 'block_act_state': <built-in function gelu>, 'lift_act_heal': <built-in function gelu>, 'block_act_heal': <built-in function gelu>, 'width_heal': 37, 'width_state': 113, 'lr': 0.003013124293099577, 'padding_heal': 7, 'padding_state': 2, 'optimizer_type': 'adam'}. Best is trial 174 with value: 0.001268339459784329.
[I 2025-07-30 21:11:22,567] Trial 186 finished with value: 0.0015029088826850057 and parameters: {'width_NN_heal': 41, 'width_NN_state': 47, 'depth_NN_heal': 8, 'depth_NN_state': 6, 'mode_heal': 44, 'mode_state': 52, 'blocks_heal': 8, 'blocks_state': 5, 'lift_act_state': <function tanh at 0x7ff3611b4cc0>, 'block_act_state': <built-in function gelu>, 'lift_act_heal': <built-in function gelu>, 'block_act_heal': <built-in function gelu>, 'width_heal': 40, 'width_state': 102, 'lr': 0.0031427754241834588, 'padding_heal': 5, 'padding_state': 18, 'optimizer_type': 'adam'}. Best is trial 174 with value: 0.001268339459784329.
[I 2025-07-30 21:11:28,771] Trial 187 finished with value: 0.0070589142851531506 and parameters: {'width_NN_heal': 33, 'width_NN_state': 47, 'depth_NN_heal': 8, 'depth_NN_state': 6, 'mode_heal': 44, 'mode_state': 52, 'blocks_heal': 8, 'blocks_state': 5, 'lift_act_state': <function tanh at 0x7ff3611b4cc0>, 'block_act_state': <built-in function gelu>, 'lift_act_heal': <built-in function gelu>, 'block_act_heal': <built-in function gelu>, 'width_heal': 38, 'width_state': 118, 'lr': 0.004149345451308586, 'padding_heal': 6, 'padding_state': 18, 'optimizer_type': 'adam'}. Best is trial 174 with value: 0.001268339459784329.
[I 2025-07-30 21:11:34,823] Trial 188 finished with value: 0.001646500895731151 and parameters: {'width_NN_heal': 44, 'width_NN_state': 43, 'depth_NN_heal': 8, 'depth_NN_state': 6, 'mode_heal': 48, 'mode_state': 52, 'blocks_heal': 8, 'blocks_state': 5, 'lift_act_state': <function tanh at 0x7ff3611b4cc0>, 'block_act_state': <built-in function gelu>, 'lift_act_heal': <built-in function gelu>, 'block_act_heal': <built-in function gelu>, 'width_heal': 36, 'width_state': 102, 'lr': 0.002657462608582737, 'padding_heal': 5, 'padding_state': 17, 'optimizer_type': 'adam'}. Best is trial 174 with value: 0.001268339459784329.
[I 2025-07-30 21:11:40,865] Trial 189 finished with value: 0.0021506038028746843 and parameters: {'width_NN_heal': 27, 'width_NN_state': 37, 'depth_NN_heal': 8, 'depth_NN_state': 6, 'mode_heal': 44, 'mode_state': 52, 'blocks_heal': 8, 'blocks_state': 5, 'lift_act_state': None, 'block_act_state': <built-in function gelu>, 'lift_act_heal': <built-in function gelu>, 'block_act_heal': <built-in function gelu>, 'width_heal': 34, 'width_state': 89, 'lr': 0.0034569539158119836, 'padding_heal': 10, 'padding_state': 19, 'optimizer_type': 'adam'}. Best is trial 174 with value: 0.001268339459784329.
[I 2025-07-30 21:11:47,133] Trial 190 finished with value: 0.002571740420535207 and parameters: {'width_NN_heal': 40, 'width_NN_state': 41, 'depth_NN_heal': 8, 'depth_NN_state': 6, 'mode_heal': 44, 'mode_state': 52, 'blocks_heal': 8, 'blocks_state': 5, 'lift_act_state': <function tanh at 0x7ff3611b4cc0>, 'block_act_state': <function tanh at 0x7ff3611b4cc0>, 'lift_act_heal': <built-in function gelu>, 'block_act_heal': <built-in function gelu>, 'width_heal': 39, 'width_state': 128, 'lr': 0.0022617646308184195, 'padding_heal': 4, 'padding_state': 16, 'optimizer_type': 'adam'}. Best is trial 174 with value: 0.001268339459784329.
[I 2025-07-30 21:11:53,265] Trial 191 finished with value: 0.0015431259525939822 and parameters: {'width_NN_heal': 41, 'width_NN_state': 35, 'depth_NN_heal': 8, 'depth_NN_state': 6, 'mode_heal': 44, 'mode_state': 52, 'blocks_heal': 8, 'blocks_state': 5, 'lift_act_state': <function tanh at 0x7ff3611b4cc0>, 'block_act_state': <built-in function gelu>, 'lift_act_heal': <built-in function gelu>, 'block_act_heal': <built-in function gelu>, 'width_heal': 40, 'width_state': 111, 'lr': 0.003106364160570621, 'padding_heal': 9, 'padding_state': 18, 'optimizer_type': 'adam'}. Best is trial 174 with value: 0.001268339459784329.
[I 2025-07-30 21:11:59,533] Trial 192 finished with value: 0.0014513558708131313 and parameters: {'width_NN_heal': 35, 'width_NN_state': 31, 'depth_NN_heal': 8, 'depth_NN_state': 6, 'mode_heal': 48, 'mode_state': 52, 'blocks_heal': 8, 'blocks_state': 5, 'lift_act_state': <function tanh at 0x7ff3611b4cc0>, 'block_act_state': <built-in function gelu>, 'lift_act_heal': <built-in function gelu>, 'block_act_heal': <built-in function gelu>, 'width_heal': 43, 'width_state': 16, 'lr': 0.0037393449965348346, 'padding_heal': 8, 'padding_state': 17, 'optimizer_type': 'adam'}. Best is trial 174 with value: 0.001268339459784329.
[I 2025-07-30 21:12:05,882] Trial 193 finished with value: 0.0016053518047556281 and parameters: {'width_NN_heal': 29, 'width_NN_state': 39, 'depth_NN_heal': 8, 'depth_NN_state': 6, 'mode_heal': 48, 'mode_state': 52, 'blocks_heal': 8, 'blocks_state': 5, 'lift_act_state': <function tanh at 0x7ff3611b4cc0>, 'block_act_state': <built-in function gelu>, 'lift_act_heal': <built-in function gelu>, 'block_act_heal': <built-in function gelu>, 'width_heal': 43, 'width_state': 15, 'lr': 0.0037260359352566373, 'padding_heal': 7, 'padding_state': 18, 'optimizer_type': 'adam'}. Best is trial 174 with value: 0.001268339459784329.
[I 2025-07-30 21:12:12,094] Trial 194 finished with value: 0.005974809639155865 and parameters: {'width_NN_heal': 35, 'width_NN_state': 31, 'depth_NN_heal': 8, 'depth_NN_state': 6, 'mode_heal': 40, 'mode_state': 52, 'blocks_heal': 8, 'blocks_state': 5, 'lift_act_state': <function tanh at 0x7ff3611b4cc0>, 'block_act_state': <built-in function gelu>, 'lift_act_heal': <built-in function gelu>, 'block_act_heal': <built-in function gelu>, 'width_heal': 44, 'width_state': 16, 'lr': 0.000488383227219812, 'padding_heal': 8, 'padding_state': 17, 'optimizer_type': 'adam'}. Best is trial 174 with value: 0.001268339459784329.
[I 2025-07-30 21:12:18,245] Trial 195 finished with value: 0.0015315887285396457 and parameters: {'width_NN_heal': 31, 'width_NN_state': 30, 'depth_NN_heal': 8, 'depth_NN_state': 6, 'mode_heal': 44, 'mode_state': 64, 'blocks_heal': 8, 'blocks_state': 5, 'lift_act_state': <function tanh at 0x7ff3611b4cc0>, 'block_act_state': <built-in function gelu>, 'lift_act_heal': <built-in function gelu>, 'block_act_heal': None, 'width_heal': 48, 'width_state': 96, 'lr': 0.0039467928472247385, 'padding_heal': 6, 'padding_state': 19, 'optimizer_type': 'adam'}. Best is trial 174 with value: 0.001268339459784329.
[I 2025-07-30 21:12:24,468] Trial 196 finished with value: 0.02224467322230339 and parameters: {'width_NN_heal': 37, 'width_NN_state': 51, 'depth_NN_heal': 8, 'depth_NN_state': 6, 'mode_heal': 48, 'mode_state': 48, 'blocks_heal': 8, 'blocks_state': 5, 'lift_act_state': <function tanh at 0x7ff3611b4cc0>, 'block_act_state': <built-in function gelu>, 'lift_act_heal': <built-in function gelu>, 'block_act_heal': <built-in function gelu>, 'width_heal': 29, 'width_state': 16, 'lr': 0.0034362463139808444, 'padding_heal': 5, 'padding_state': 18, 'optimizer_type': 'adam'}. Best is trial 174 with value: 0.001268339459784329.
[I 2025-07-30 21:12:30,724] Trial 197 finished with value: 0.0014685202622786164 and parameters: {'width_NN_heal': 49, 'width_NN_state': 32, 'depth_NN_heal': 8, 'depth_NN_state': 6, 'mode_heal': 40, 'mode_state': 56, 'blocks_heal': 8, 'blocks_state': 5, 'lift_act_state': <function tanh at 0x7ff3611b4cc0>, 'block_act_state': <built-in function gelu>, 'lift_act_heal': <built-in function gelu>, 'block_act_heal': <built-in function gelu>, 'width_heal': 37, 'width_state': 18, 'lr': 0.002944144417326709, 'padding_heal': 8, 'padding_state': 20, 'optimizer_type': 'adam'}. Best is trial 174 with value: 0.001268339459784329.
[I 2025-07-30 21:12:37,278] Trial 198 finished with value: 0.004194251261651516 and parameters: {'width_NN_heal': 49, 'width_NN_state': 32, 'depth_NN_heal': 8, 'depth_NN_state': 6, 'mode_heal': 40, 'mode_state': 56, 'blocks_heal': 8, 'blocks_state': 6, 'lift_act_state': <function tanh at 0x7ff3611b4cc0>, 'block_act_state': <built-in function gelu>, 'lift_act_heal': <built-in function gelu>, 'block_act_heal': <built-in function gelu>, 'width_heal': 37, 'width_state': 17, 'lr': 0.002891549137650987, 'padding_heal': 8, 'padding_state': 20, 'optimizer_type': 'adam'}. Best is trial 174 with value: 0.001268339459784329.
[I 2025-07-30 21:12:43,461] Trial 199 finished with value: 0.0019047334790229797 and parameters: {'width_NN_heal': 59, 'width_NN_state': 28, 'depth_NN_heal': 8, 'depth_NN_state': 5, 'mode_heal': 36, 'mode_state': 52, 'blocks_heal': 8, 'blocks_state': 5, 'lift_act_state': <function tanh at 0x7ff3611b4cc0>, 'block_act_state': <built-in function gelu>, 'lift_act_heal': <built-in function gelu>, 'block_act_heal': <built-in function gelu>, 'width_heal': 41, 'width_state': 18, 'lr': 0.003596040947226198, 'padding_heal': 10, 'padding_state': 17, 'optimizer_type': 'adam'}. Best is trial 174 with value: 0.001268339459784329.
[I 2025-07-30 21:12:49,721] Trial 200 finished with value: 0.002476454246789217 and parameters: {'width_NN_heal': 47, 'width_NN_state': 26, 'depth_NN_heal': 8, 'depth_NN_state': 6, 'mode_heal': 44, 'mode_state': 56, 'blocks_heal': 8, 'blocks_state': 5, 'lift_act_state': <function tanh at 0x7ff3611b4cc0>, 'block_act_state': <built-in function gelu>, 'lift_act_heal': <built-in function gelu>, 'block_act_heal': <built-in function gelu>, 'width_heal': 33, 'width_state': 19, 'lr': 0.0011674085477290377, 'padding_heal': 8, 'padding_state': 17, 'optimizer_type': 'adam'}. Best is trial 174 with value: 0.001268339459784329.
[I 2025-07-30 21:12:56,575] Trial 201 finished with value: 0.03074285201728344 and parameters: {'width_NN_heal': 44, 'width_NN_state': 37, 'depth_NN_heal': 8, 'depth_NN_state': 6, 'mode_heal': 44, 'mode_state': 56, 'blocks_heal': 8, 'blocks_state': 7, 'lift_act_state': <function tanh at 0x7ff3611b4cc0>, 'block_act_state': <built-in function gelu>, 'lift_act_heal': <built-in function gelu>, 'block_act_heal': <built-in function gelu>, 'width_heal': 44, 'width_state': 14, 'lr': 0.0002289887191664524, 'padding_heal': 7, 'padding_state': 16, 'optimizer_type': 'adam'}. Best is trial 174 with value: 0.001268339459784329.
[I 2025-07-30 21:13:02,803] Trial 202 finished with value: 0.001641046954318881 and parameters: {'width_NN_heal': 52, 'width_NN_state': 46, 'depth_NN_heal': 8, 'depth_NN_state': 6, 'mode_heal': 40, 'mode_state': 52, 'blocks_heal': 8, 'blocks_state': 5, 'lift_act_state': <function tanh at 0x7ff3611b4cc0>, 'block_act_state': <built-in function gelu>, 'lift_act_heal': <built-in function gelu>, 'block_act_heal': <built-in function gelu>, 'width_heal': 38, 'width_state': 103, 'lr': 0.002526586278990694, 'padding_heal': 5, 'padding_state': 15, 'optimizer_type': 'adam'}. Best is trial 174 with value: 0.001268339459784329.
[I 2025-07-30 21:13:09,022] Trial 203 finished with value: 0.0014495367649942636 and parameters: {'width_NN_heal': 56, 'width_NN_state': 32, 'depth_NN_heal': 8, 'depth_NN_state': 6, 'mode_heal': 40, 'mode_state': 56, 'blocks_heal': 8, 'blocks_state': 5, 'lift_act_state': <function tanh at 0x7ff3611b4cc0>, 'block_act_state': <built-in function gelu>, 'lift_act_heal': <built-in function gelu>, 'block_act_heal': <built-in function gelu>, 'width_heal': 31, 'width_state': 11, 'lr': 0.0030422449214888843, 'padding_heal': 9, 'padding_state': 16, 'optimizer_type': 'adam'}. Best is trial 174 with value: 0.001268339459784329.
[I 2025-07-30 21:13:15,034] Trial 204 finished with value: 0.0025871742982417345 and parameters: {'width_NN_heal': 56, 'width_NN_state': 31, 'depth_NN_heal': 8, 'depth_NN_state': 6, 'mode_heal': 40, 'mode_state': 36, 'blocks_heal': 8, 'blocks_state': 5, 'lift_act_state': <function tanh at 0x7ff3611b4cc0>, 'block_act_state': <built-in function gelu>, 'lift_act_heal': <built-in function gelu>, 'block_act_heal': <built-in function gelu>, 'width_heal': 24, 'width_state': 12, 'lr': 0.0030735010433526637, 'padding_heal': 9, 'padding_state': 15, 'optimizer_type': 'adam'}. Best is trial 174 with value: 0.001268339459784329.
[I 2025-07-30 21:13:21,274] Trial 205 finished with value: 0.0015447953483089805 and parameters: {'width_NN_heal': 63, 'width_NN_state': 35, 'depth_NN_heal': 8, 'depth_NN_state': 6, 'mode_heal': 40, 'mode_state': 56, 'blocks_heal': 8, 'blocks_state': 5, 'lift_act_state': <function tanh at 0x7ff3611b4cc0>, 'block_act_state': <built-in function gelu>, 'lift_act_heal': <built-in function gelu>, 'block_act_heal': <built-in function gelu>, 'width_heal': 31, 'width_state': 10, 'lr': 0.0027533836097644077, 'padding_heal': 8, 'padding_state': 16, 'optimizer_type': 'adam'}. Best is trial 174 with value: 0.001268339459784329.
[I 2025-07-30 21:13:27,576] Trial 206 finished with value: 0.0014352744910866022 and parameters: {'width_NN_heal': 38, 'width_NN_state': 29, 'depth_NN_heal': 8, 'depth_NN_state': 6, 'mode_heal': 44, 'mode_state': 56, 'blocks_heal': 8, 'blocks_state': 5, 'lift_act_state': <function tanh at 0x7ff3611b4cc0>, 'block_act_state': <built-in function gelu>, 'lift_act_heal': <built-in function gelu>, 'block_act_heal': <built-in function gelu>, 'width_heal': 35, 'width_state': 12, 'lr': 0.003254270552854947, 'padding_heal': 7, 'padding_state': 21, 'optimizer_type': 'adam'}. Best is trial 174 with value: 0.001268339459784329.
[I 2025-07-30 21:13:33,765] Trial 207 finished with value: 0.001686113071627915 and parameters: {'width_NN_heal': 35, 'width_NN_state': 27, 'depth_NN_heal': 8, 'depth_NN_state': 7, 'mode_heal': 36, 'mode_state': 56, 'blocks_heal': 8, 'blocks_state': 5, 'lift_act_state': <function tanh at 0x7ff3611b4cc0>, 'block_act_state': <built-in function gelu>, 'lift_act_heal': <built-in function gelu>, 'block_act_heal': <built-in function gelu>, 'width_heal': 34, 'width_state': 14, 'lr': 0.00432443973696437, 'padding_heal': 9, 'padding_state': 21, 'optimizer_type': 'lbfgs'}. Best is trial 174 with value: 0.001268339459784329.
[I 2025-07-30 21:13:40,069] Trial 208 finished with value: 0.0016671601915732026 and parameters: {'width_NN_heal': 38, 'width_NN_state': 23, 'depth_NN_heal': 8, 'depth_NN_state': 6, 'mode_heal': 48, 'mode_state': 56, 'blocks_heal': 8, 'blocks_state': 5, 'lift_act_state': <function tanh at 0x7ff3611b4cc0>, 'block_act_state': <built-in function gelu>, 'lift_act_heal': <built-in function gelu>, 'block_act_heal': <built-in function gelu>, 'width_heal': 35, 'width_state': 11, 'lr': 0.0035153068322447975, 'padding_heal': 7, 'padding_state': 15, 'optimizer_type': 'adam'}. Best is trial 174 with value: 0.001268339459784329.
[I 2025-07-30 21:13:46,372] Trial 209 finished with value: 0.0017851123120635748 and parameters: {'width_NN_heal': 51, 'width_NN_state': 29, 'depth_NN_heal': 8, 'depth_NN_state': 6, 'mode_heal': 40, 'mode_state': 56, 'blocks_heal': 8, 'blocks_state': 5, 'lift_act_state': <function tanh at 0x7ff3611b4cc0>, 'block_act_state': <built-in function gelu>, 'lift_act_heal': <built-in function gelu>, 'block_act_heal': <function tanh at 0x7ff3611b4cc0>, 'width_heal': 31, 'width_state': 10, 'lr': 0.002935105572796194, 'padding_heal': 7, 'padding_state': 20, 'optimizer_type': 'adam'}. Best is trial 174 with value: 0.001268339459784329.
[I 2025-07-30 21:13:52,626] Trial 210 finished with value: 0.0021777942311018705 and parameters: {'width_NN_heal': 76, 'width_NN_state': 33, 'depth_NN_heal': 8, 'depth_NN_state': 6, 'mode_heal': 44, 'mode_state': 40, 'blocks_heal': 8, 'blocks_state': 5, 'lift_act_state': <function tanh at 0x7ff3611b4cc0>, 'block_act_state': <built-in function gelu>, 'lift_act_heal': <function tanh at 0x7ff3611b4cc0>, 'block_act_heal': <built-in function gelu>, 'width_heal': 47, 'width_state': 12, 'lr': 0.0038696100912354275, 'padding_heal': 6, 'padding_state': 23, 'optimizer_type': 'adam'}. Best is trial 174 with value: 0.001268339459784329.
[I 2025-07-30 21:13:58,941] Trial 211 finished with value: 0.0015834623482078314 and parameters: {'width_NN_heal': 43, 'width_NN_state': 25, 'depth_NN_heal': 8, 'depth_NN_state': 6, 'mode_heal': 44, 'mode_state': 52, 'blocks_heal': 8, 'blocks_state': 5, 'lift_act_state': <function tanh at 0x7ff3611b4cc0>, 'block_act_state': <built-in function gelu>, 'lift_act_heal': <built-in function gelu>, 'block_act_heal': <built-in function gelu>, 'width_heal': 38, 'width_state': 13, 'lr': 0.0031934871142132986, 'padding_heal': 8, 'padding_state': 19, 'optimizer_type': 'adam'}. Best is trial 174 with value: 0.001268339459784329.
[I 2025-07-30 21:14:05,180] Trial 212 finished with value: 0.0015960693126544356 and parameters: {'width_NN_heal': 47, 'width_NN_state': 30, 'depth_NN_heal': 8, 'depth_NN_state': 6, 'mode_heal': 44, 'mode_state': 56, 'blocks_heal': 8, 'blocks_state': 5, 'lift_act_state': <function tanh at 0x7ff3611b4cc0>, 'block_act_state': <built-in function gelu>, 'lift_act_heal': <built-in function gelu>, 'block_act_heal': <built-in function gelu>, 'width_heal': 41, 'width_state': 11, 'lr': 0.0033442296750607757, 'padding_heal': 6, 'padding_state': 17, 'optimizer_type': 'adam'}. Best is trial 174 with value: 0.001268339459784329.
