[I 2025-07-30 21:03:20,738] Trial 107 finished with value: 0.001982493791729212 and parameters: {'width_NN_heal': 9, 'width_NN_state': 76, 'depth_NN_heal': 6, 'depth_NN_state': 3, 'mode_heal': 48, 'mode_state': 24, 'blocks_heal': 8, 'blocks_state': 4, 'lift_act_state': None, 'block_act_state': <built-in function gelu>, 'lift_act_heal': <function tanh at 0x7ff3611b4cc0>, 'block_act_heal': <built-in function gelu>, 'width_heal': 64, 'width_state': 48, 'lr': 0.002397124758831497, 'padding_heal': 17, 'padding_state': 32, 'optimizer_type': 'adam'}. Best is trial 54 with value: 0.0014391255099326372.
[I 2025-07-30 21:03:25,901] Trial 108 finished with value: 0.002185990335419774 and parameters: {'width_NN_heal': 8, 'width_NN_state': 51, 'depth_NN_heal': 7, 'depth_NN_state': 4, 'mode_heal': 56, 'mode_state': 64, 'blocks_heal': 8, 'blocks_state': 3, 'lift_act_state': <function tanh at 0x7ff3611b4cc0>, 'block_act_state': <built-in function gelu>, 'lift_act_heal': None, 'block_act_heal': <built-in function gelu>, 'width_heal': 80, 'width_state': 41, 'lr': 0.0015914616570504303, 'padding_heal': 16, 'padding_state': 31, 'optimizer_type': 'lbfgs'}. Best is trial 54 with value: 0.0014391255099326372.
[I 2025-07-30 21:03:32,000] Trial 109 finished with value: 0.001590333878993988 and parameters: {'width_NN_heal': 11, 'width_NN_state': 62, 'depth_NN_heal': 7, 'depth_NN_state': 6, 'mode_heal': 52, 'mode_state': 52, 'blocks_heal': 8, 'blocks_state': 5, 'lift_act_state': <function tanh at 0x7ff3611b4cc0>, 'block_act_state': <built-in function gelu>, 'lift_act_heal': None, 'block_act_heal': <built-in function gelu>, 'width_heal': 53, 'width_state': 32, 'lr': 0.0030480899335912346, 'padding_heal': 18, 'padding_state': 30, 'optimizer_type': 'adam'}. Best is trial 54 with value: 0.0014391255099326372.
[I 2025-07-30 21:03:37,927] Trial 110 finished with value: 0.0016208398155868053 and parameters: {'width_NN_heal': 14, 'width_NN_state': 63, 'depth_NN_heal': 7, 'depth_NN_state': 5, 'mode_heal': 52, 'mode_state': 52, 'blocks_heal': 8, 'blocks_state': 5, 'lift_act_state': <function tanh at 0x7ff3611b4cc0>, 'block_act_state': <built-in function gelu>, 'lift_act_heal': None, 'block_act_heal': <built-in function gelu>, 'width_heal': 55, 'width_state': 38, 'lr': 0.0022895039315671373, 'padding_heal': 18, 'padding_state': 30, 'optimizer_type': 'adam'}. Best is trial 54 with value: 0.0014391255099326372.
[I 2025-07-30 21:03:44,013] Trial 111 finished with value: 0.001461258390918374 and parameters: {'width_NN_heal': 11, 'width_NN_state': 69, 'depth_NN_heal': 7, 'depth_NN_state': 6, 'mode_heal': 60, 'mode_state': 52, 'blocks_heal': 8, 'blocks_state': 5, 'lift_act_state': <function tanh at 0x7ff3611b4cc0>, 'block_act_state': <built-in function gelu>, 'lift_act_heal': None, 'block_act_heal': <built-in function gelu>, 'width_heal': 51, 'width_state': 37, 'lr': 0.003205388522640989, 'padding_heal': 19, 'padding_state': 29, 'optimizer_type': 'adam'}. Best is trial 54 with value: 0.0014391255099326372.
[I 2025-07-30 21:03:50,082] Trial 112 finished with value: 0.0014464057749137282 and parameters: {'width_NN_heal': 11, 'width_NN_state': 43, 'depth_NN_heal': 7, 'depth_NN_state': 6, 'mode_heal': 60, 'mode_state': 52, 'blocks_heal': 8, 'blocks_state': 5, 'lift_act_state': <function tanh at 0x7ff3611b4cc0>, 'block_act_state': <built-in function gelu>, 'lift_act_heal': None, 'block_act_heal': <built-in function gelu>, 'width_heal': 43, 'width_state': 28, 'lr': 0.0031437231795103707, 'padding_heal': 14, 'padding_state': 29, 'optimizer_type': 'adam'}. Best is trial 54 with value: 0.0014391255099326372.
[I 2025-07-30 21:03:56,348] Trial 113 finished with value: 0.030740143731236458 and parameters: {'width_NN_heal': 11, 'width_NN_state': 44, 'depth_NN_heal': 6, 'depth_NN_state': 6, 'mode_heal': 56, 'mode_state': 52, 'blocks_heal': 8, 'blocks_state': 6, 'lift_act_state': <function tanh at 0x7ff3611b4cc0>, 'block_act_state': <built-in function gelu>, 'lift_act_heal': None, 'block_act_heal': <built-in function gelu>, 'width_heal': 35, 'width_state': 29, 'lr': 0.003189608968265947, 'padding_heal': 14, 'padding_state': 29, 'optimizer_type': 'adam'}. Best is trial 54 with value: 0.0014391255099326372.
[I 2025-07-30 21:04:02,329] Trial 114 finished with value: 0.0020350441336631775 and parameters: {'width_NN_heal': 13, 'width_NN_state': 30, 'depth_NN_heal': 7, 'depth_NN_state': 7, 'mode_heal': 64, 'mode_state': 48, 'blocks_heal': 8, 'blocks_state': 5, 'lift_act_state': <function tanh at 0x7ff3611b4cc0>, 'block_act_state': <built-in function gelu>, 'lift_act_heal': None, 'block_act_heal': <built-in function gelu>, 'width_heal': 44, 'width_state': 33, 'lr': 0.0029132453160089678, 'padding_heal': 13, 'padding_state': 27, 'optimizer_type': 'adam'}. Best is trial 54 with value: 0.0014391255099326372.
[I 2025-07-30 21:04:08,409] Trial 115 finished with value: 0.0015919165452942252 and parameters: {'width_NN_heal': 10, 'width_NN_state': 41, 'depth_NN_heal': 7, 'depth_NN_state': 6, 'mode_heal': 60, 'mode_state': 52, 'blocks_heal': 8, 'blocks_state': 5, 'lift_act_state': <function tanh at 0x7ff3611b4cc0>, 'block_act_state': <built-in function gelu>, 'lift_act_heal': None, 'block_act_heal': <built-in function gelu>, 'width_heal': 42, 'width_state': 32, 'lr': 0.0035721422993509077, 'padding_heal': 19, 'padding_state': 28, 'optimizer_type': 'adam'}. Best is trial 54 with value: 0.0014391255099326372.
[I 2025-07-30 21:04:14,472] Trial 116 finished with value: 0.0017144649755209684 and parameters: {'width_NN_heal': 130, 'width_NN_state': 58, 'depth_NN_heal': 7, 'depth_NN_state': 6, 'mode_heal': 52, 'mode_state': 52, 'blocks_heal': 8, 'blocks_state': 5, 'lift_act_state': <function tanh at 0x7ff3611b4cc0>, 'block_act_state': <built-in function gelu>, 'lift_act_heal': None, 'block_act_heal': <built-in function gelu>, 'width_heal': 39, 'width_state': 26, 'lr': 0.0035402045816093778, 'padding_heal': 19, 'padding_state': 29, 'optimizer_type': 'adam'}. Best is trial 54 with value: 0.0014391255099326372.
[I 2025-07-30 21:04:20,538] Trial 117 finished with value: 0.0016880212351679802 and parameters: {'width_NN_heal': 17, 'width_NN_state': 38, 'depth_NN_heal': 7, 'depth_NN_state': 6, 'mode_heal': 60, 'mode_state': 48, 'blocks_heal': 8, 'blocks_state': 5, 'lift_act_state': <function tanh at 0x7ff3611b4cc0>, 'block_act_state': <built-in function gelu>, 'lift_act_heal': <built-in function gelu>, 'block_act_heal': <function tanh at 0x7ff3611b4cc0>, 'width_heal': 36, 'width_state': 27, 'lr': 0.0035593220130995264, 'padding_heal': 17, 'padding_state': 14, 'optimizer_type': 'adam'}. Best is trial 54 with value: 0.0014391255099326372.
[I 2025-07-30 21:04:26,557] Trial 118 finished with value: 0.0020413720048964024 and parameters: {'width_NN_heal': 10, 'width_NN_state': 48, 'depth_NN_heal': 7, 'depth_NN_state': 6, 'mode_heal': 60, 'mode_state': 52, 'blocks_heal': 7, 'blocks_state': 6, 'lift_act_state': <function tanh at 0x7ff3611b4cc0>, 'block_act_state': <built-in function gelu>, 'lift_act_heal': None, 'block_act_heal': <built-in function gelu>, 'width_heal': 30, 'width_state': 24, 'lr': 0.0019000089579621958, 'padding_heal': 18, 'padding_state': 32, 'optimizer_type': 'adam'}. Best is trial 54 with value: 0.0014391255099326372.
[I 2025-07-30 21:04:32,479] Trial 119 finished with value: 0.03074224665760994 and parameters: {'width_NN_heal': 15, 'width_NN_state': 41, 'depth_NN_heal': 6, 'depth_NN_state': 6, 'mode_heal': 56, 'mode_state': 56, 'blocks_heal': 8, 'blocks_state': 5, 'lift_act_state': <built-in function gelu>, 'block_act_state': None, 'lift_act_heal': None, 'block_act_heal': <built-in function gelu>, 'width_heal': 42, 'width_state': 32, 'lr': 0.002771435887266916, 'padding_heal': 19, 'padding_state': 28, 'optimizer_type': 'adam'}. Best is trial 54 with value: 0.0014391255099326372.
[I 2025-07-30 21:04:38,167] Trial 120 finished with value: 0.0015356033109128475 and parameters: {'width_NN_heal': 13, 'width_NN_state': 85, 'depth_NN_heal': 7, 'depth_NN_state': 6, 'mode_heal': 64, 'mode_state': 48, 'blocks_heal': 7, 'blocks_state': 5, 'lift_act_state': <function tanh at 0x7ff3611b4cc0>, 'block_act_state': <built-in function gelu>, 'lift_act_heal': None, 'block_act_heal': <built-in function gelu>, 'width_heal': 47, 'width_state': 36, 'lr': 0.003202112522918881, 'padding_heal': 16, 'padding_state': 30, 'optimizer_type': 'adam'}. Best is trial 54 with value: 0.0014391255099326372.
[I 2025-07-30 21:04:43,874] Trial 121 finished with value: 0.0017018355429172516 and parameters: {'width_NN_heal': 13, 'width_NN_state': 80, 'depth_NN_heal': 7, 'depth_NN_state': 6, 'mode_heal': 64, 'mode_state': 48, 'blocks_heal': 7, 'blocks_state': 5, 'lift_act_state': <function tanh at 0x7ff3611b4cc0>, 'block_act_state': <built-in function gelu>, 'lift_act_heal': None, 'block_act_heal': <built-in function gelu>, 'width_heal': 45, 'width_state': 35, 'lr': 0.003252676502096767, 'padding_heal': 16, 'padding_state': 30, 'optimizer_type': 'adam'}. Best is trial 54 with value: 0.0014391255099326372.
[I 2025-07-30 21:04:49,673] Trial 122 finished with value: 0.0018736087949946523 and parameters: {'width_NN_heal': 11, 'width_NN_state': 61, 'depth_NN_heal': 7, 'depth_NN_state': 6, 'mode_heal': 64, 'mode_state': 52, 'blocks_heal': 7, 'blocks_state': 5, 'lift_act_state': <function tanh at 0x7ff3611b4cc0>, 'block_act_state': <built-in function gelu>, 'lift_act_heal': None, 'block_act_heal': <built-in function gelu>, 'width_heal': 49, 'width_state': 36, 'lr': 0.0030744088814312746, 'padding_heal': 11, 'padding_state': 31, 'optimizer_type': 'adam'}. Best is trial 54 with value: 0.0014391255099326372.
[I 2025-07-30 21:04:55,661] Trial 123 finished with value: 0.0015854091616347432 and parameters: {'width_NN_heal': 12, 'width_NN_state': 87, 'depth_NN_heal': 7, 'depth_NN_state': 6, 'mode_heal': 60, 'mode_state': 52, 'blocks_heal': 8, 'blocks_state': 5, 'lift_act_state': <function tanh at 0x7ff3611b4cc0>, 'block_act_state': <built-in function gelu>, 'lift_act_heal': None, 'block_act_heal': <built-in function gelu>, 'width_heal': 51, 'width_state': 31, 'lr': 0.002530403846885009, 'padding_heal': 17, 'padding_state': 30, 'optimizer_type': 'adam'}. Best is trial 54 with value: 0.0014391255099326372.
[I 2025-07-30 21:05:01,598] Trial 124 finished with value: 0.0016242142301052809 and parameters: {'width_NN_heal': 14, 'width_NN_state': 87, 'depth_NN_heal': 6, 'depth_NN_state': 6, 'mode_heal': 60, 'mode_state': 44, 'blocks_heal': 8, 'blocks_state': 5, 'lift_act_state': <function tanh at 0x7ff3611b4cc0>, 'block_act_state': <built-in function gelu>, 'lift_act_heal': None, 'block_act_heal': <built-in function gelu>, 'width_heal': 50, 'width_state': 29, 'lr': 0.002484820299397533, 'padding_heal': 18, 'padding_state': 28, 'optimizer_type': 'adam'}. Best is trial 54 with value: 0.0014391255099326372.
[I 2025-07-30 21:05:07,857] Trial 125 finished with value: 0.001923979027196765 and parameters: {'width_NN_heal': 12, 'width_NN_state': 68, 'depth_NN_heal': 7, 'depth_NN_state': 6, 'mode_heal': 56, 'mode_state': 52, 'blocks_heal': 8, 'blocks_state': 6, 'lift_act_state': <function tanh at 0x7ff3611b4cc0>, 'block_act_state': <built-in function gelu>, 'lift_act_heal': None, 'block_act_heal': <built-in function gelu>, 'width_heal': 51, 'width_state': 21, 'lr': 0.003838308945037996, 'padding_heal': 17, 'padding_state': 30, 'optimizer_type': 'adam'}. Best is trial 54 with value: 0.0014391255099326372.
[I 2025-07-30 21:05:13,583] Trial 126 finished with value: 0.03074212186038494 and parameters: {'width_NN_heal': 10, 'width_NN_state': 51, 'depth_NN_heal': 7, 'depth_NN_state': 7, 'mode_heal': 64, 'mode_state': 52, 'blocks_heal': 7, 'blocks_state': 5, 'lift_act_state': <function tanh at 0x7ff3611b4cc0>, 'block_act_state': <built-in function gelu>, 'lift_act_heal': None, 'block_act_heal': <built-in function gelu>, 'width_heal': 11, 'width_state': 38, 'lr': 0.002797553281765952, 'padding_heal': 17, 'padding_state': 29, 'optimizer_type': 'adam'}. Best is trial 54 with value: 0.0014391255099326372.
[I 2025-07-30 21:05:19,821] Trial 127 finished with value: 0.0017375093884766102 and parameters: {'width_NN_heal': 224, 'width_NN_state': 88, 'depth_NN_heal': 7, 'depth_NN_state': 6, 'mode_heal': 60, 'mode_state': 48, 'blocks_heal': 8, 'blocks_state': 5, 'lift_act_state': <function tanh at 0x7ff3611b4cc0>, 'block_act_state': <built-in function gelu>, 'lift_act_heal': None, 'block_act_heal': <built-in function gelu>, 'width_heal': 41, 'width_state': 31, 'lr': 0.0025413604290636447, 'padding_heal': 14, 'padding_state': 31, 'optimizer_type': 'adam'}. Best is trial 54 with value: 0.0014391255099326372.
[I 2025-07-30 21:05:25,405] Trial 128 finished with value: 0.0020850130822509527 and parameters: {'width_NN_heal': 69, 'width_NN_state': 133, 'depth_NN_heal': 7, 'depth_NN_state': 6, 'mode_heal': 56, 'mode_state': 56, 'blocks_heal': 7, 'blocks_state': 5, 'lift_act_state': None, 'block_act_state': <built-in function gelu>, 'lift_act_heal': None, 'block_act_heal': <built-in function gelu>, 'width_heal': 33, 'width_state': 18, 'lr': 0.0036098799386819337, 'padding_heal': 16, 'padding_state': 30, 'optimizer_type': 'adam'}. Best is trial 54 with value: 0.0014391255099326372.
[I 2025-07-30 21:05:31,958] Trial 129 finished with value: 0.0024796610232442617 and parameters: {'width_NN_heal': 12, 'width_NN_state': 31, 'depth_NN_heal': 7, 'depth_NN_state': 7, 'mode_heal': 64, 'mode_state': 52, 'blocks_heal': 8, 'blocks_state': 6, 'lift_act_state': <function tanh at 0x7ff3611b4cc0>, 'block_act_state': <function tanh at 0x7ff3611b4cc0>, 'lift_act_heal': <built-in function gelu>, 'block_act_heal': <built-in function gelu>, 'width_heal': 62, 'width_state': 25, 'lr': 0.003144036753097943, 'padding_heal': 20, 'padding_state': 29, 'optimizer_type': 'adam'}. Best is trial 54 with value: 0.0014391255099326372.
[I 2025-07-30 21:05:38,080] Trial 130 finished with value: 0.00196014903485775 and parameters: {'width_NN_heal': 14, 'width_NN_state': 102, 'depth_NN_heal': 6, 'depth_NN_state': 6, 'mode_heal': 60, 'mode_state': 52, 'blocks_heal': 8, 'blocks_state': 5, 'lift_act_state': <function tanh at 0x7ff3611b4cc0>, 'block_act_state': <built-in function gelu>, 'lift_act_heal': <function tanh at 0x7ff3611b4cc0>, 'block_act_heal': None, 'width_heal': 37, 'width_state': 42, 'lr': 0.0022872522707723646, 'padding_heal': 18, 'padding_state': 8, 'optimizer_type': 'adam'}. Best is trial 54 with value: 0.0014391255099326372.
[I 2025-07-30 21:05:44,250] Trial 131 finished with value: 0.0017574719386175275 and parameters: {'width_NN_heal': 16, 'width_NN_state': 75, 'depth_NN_heal': 7, 'depth_NN_state': 6, 'mode_heal': 60, 'mode_state': 56, 'blocks_heal': 8, 'blocks_state': 5, 'lift_act_state': <function tanh at 0x7ff3611b4cc0>, 'block_act_state': <built-in function gelu>, 'lift_act_heal': None, 'block_act_heal': <built-in function gelu>, 'width_heal': 112, 'width_state': 28, 'lr': 0.0028117813032511006, 'padding_heal': 15, 'padding_state': 32, 'optimizer_type': 'adam'}. Best is trial 54 with value: 0.0014391255099326372.
[I 2025-07-30 21:05:50,316] Trial 132 finished with value: 0.0015906158369034529 and parameters: {'width_NN_heal': 19, 'width_NN_state': 65, 'depth_NN_heal': 7, 'depth_NN_state': 6, 'mode_heal': 56, 'mode_state': 56, 'blocks_heal': 8, 'blocks_state': 5, 'lift_act_state': <function tanh at 0x7ff3611b4cc0>, 'block_act_state': <built-in function gelu>, 'lift_act_heal': None, 'block_act_heal': <built-in function gelu>, 'width_heal': 46, 'width_state': 33, 'lr': 0.0040724982208239, 'padding_heal': 16, 'padding_state': 31, 'optimizer_type': 'adam'}. Best is trial 54 with value: 0.0014391255099326372.
[I 2025-07-30 21:05:56,423] Trial 133 finished with value: 0.0017216445412486792 and parameters: {'width_NN_heal': 11, 'width_NN_state': 63, 'depth_NN_heal': 7, 'depth_NN_state': 6, 'mode_heal': 52, 'mode_state': 52, 'blocks_heal': 8, 'blocks_state': 5, 'lift_act_state': <function tanh at 0x7ff3611b4cc0>, 'block_act_state': <built-in function gelu>, 'lift_act_heal': None, 'block_act_heal': <built-in function gelu>, 'width_heal': 45, 'width_state': 35, 'lr': 0.003893585858390984, 'padding_heal': 19, 'padding_state': 31, 'optimizer_type': 'adam'}. Best is trial 54 with value: 0.0014391255099326372.
[I 2025-07-30 21:06:02,344] Trial 134 finished with value: 0.0017860388616099954 and parameters: {'width_NN_heal': 19, 'width_NN_state': 68, 'depth_NN_heal': 6, 'depth_NN_state': 6, 'mode_heal': 28, 'mode_state': 48, 'blocks_heal': 8, 'blocks_state': 5, 'lift_act_state': <function tanh at 0x7ff3611b4cc0>, 'block_act_state': <built-in function gelu>, 'lift_act_heal': None, 'block_act_heal': <built-in function gelu>, 'width_heal': 52, 'width_state': 30, 'lr': 0.0033935841263369156, 'padding_heal': 16, 'padding_state': 30, 'optimizer_type': 'adam'}. Best is trial 54 with value: 0.0014391255099326372.
[I 2025-07-30 21:06:08,459] Trial 135 finished with value: 0.0013019680045545101 and parameters: {'width_NN_heal': 13, 'width_NN_state': 79, 'depth_NN_heal': 7, 'depth_NN_state': 7, 'mode_heal': 56, 'mode_state': 56, 'blocks_heal': 8, 'blocks_state': 5, 'lift_act_state': <function tanh at 0x7ff3611b4cc0>, 'block_act_state': <built-in function gelu>, 'lift_act_heal': None, 'block_act_heal': <built-in function gelu>, 'width_heal': 46, 'width_state': 6, 'lr': 0.004550040085841239, 'padding_heal': 18, 'padding_state': 32, 'optimizer_type': 'adam'}. Best is trial 135 with value: 0.0013019680045545101.
[I 2025-07-30 21:06:12,701] Trial 136 finished with value: 0.002185601508244872 and parameters: {'width_NN_heal': 13, 'width_NN_state': 77, 'depth_NN_heal': 7, 'depth_NN_state': 7, 'mode_heal': 52, 'mode_state': 56, 'blocks_heal': 2, 'blocks_state': 5, 'lift_act_state': <function tanh at 0x7ff3611b4cc0>, 'block_act_state': <built-in function gelu>, 'lift_act_heal': None, 'block_act_heal': <built-in function gelu>, 'width_heal': 48, 'width_state': 15, 'lr': 0.004528851047900881, 'padding_heal': 17, 'padding_state': 32, 'optimizer_type': 'adam'}. Best is trial 135 with value: 0.0013019680045545101.
[I 2025-07-30 21:06:18,855] Trial 137 finished with value: 0.02705978788435459 and parameters: {'width_NN_heal': 15, 'width_NN_state': 116, 'depth_NN_heal': 7, 'depth_NN_state': 8, 'mode_heal': 56, 'mode_state': 56, 'blocks_heal': 8, 'blocks_state': 5, 'lift_act_state': <function tanh at 0x7ff3611b4cc0>, 'block_act_state': <built-in function gelu>, 'lift_act_heal': None, 'block_act_heal': <built-in function gelu>, 'width_heal': 52, 'width_state': 38, 'lr': 0.0041174565710110946, 'padding_heal': 32, 'padding_state': 31, 'optimizer_type': 'adam'}. Best is trial 135 with value: 0.0013019680045545101.
[I 2025-07-30 21:06:24,654] Trial 138 finished with value: 0.016877571120858192 and parameters: {'width_NN_heal': 14, 'width_NN_state': 90, 'depth_NN_heal': 3, 'depth_NN_state': 7, 'mode_heal': 52, 'mode_state': 56, 'blocks_heal': 8, 'blocks_state': 5, 'lift_act_state': <function tanh at 0x7ff3611b4cc0>, 'block_act_state': <built-in function gelu>, 'lift_act_heal': None, 'block_act_heal': <built-in function gelu>, 'width_heal': 27, 'width_state': 8, 'lr': 0.00300490957430822, 'padding_heal': 15, 'padding_state': 32, 'optimizer_type': 'adam'}. Best is trial 135 with value: 0.0013019680045545101.
[I 2025-07-30 21:06:30,189] Trial 139 finished with value: 0.023183368146419525 and parameters: {'width_NN_heal': 12, 'width_NN_state': 81, 'depth_NN_heal': 5, 'depth_NN_state': 6, 'mode_heal': 56, 'mode_state': 56, 'blocks_heal': 7, 'blocks_state': 5, 'lift_act_state': <function tanh at 0x7ff3611b4cc0>, 'block_act_state': <built-in function gelu>, 'lift_act_heal': None, 'block_act_heal': <built-in function gelu>, 'width_heal': 46, 'width_state': 4, 'lr': 0.0019440693998915095, 'padding_heal': 18, 'padding_state': 30, 'optimizer_type': 'adam'}. Best is trial 135 with value: 0.0013019680045545101.
[I 2025-07-30 21:06:36,545] Trial 140 finished with value: 0.003538473742082715 and parameters: {'width_NN_heal': 21, 'width_NN_state': 72, 'depth_NN_heal': 7, 'depth_NN_state': 5, 'mode_heal': 52, 'mode_state': 60, 'blocks_heal': 8, 'blocks_state': 6, 'lift_act_state': <function tanh at 0x7ff3611b4cc0>, 'block_act_state': <built-in function gelu>, 'lift_act_heal': None, 'block_act_heal': <function tanh at 0x7ff3611b4cc0>, 'width_heal': 39, 'width_state': 6, 'lr': 0.0024359841519586544, 'padding_heal': 2, 'padding_state': 31, 'optimizer_type': 'adam'}. Best is trial 135 with value: 0.0013019680045545101.
[I 2025-07-30 21:06:42,568] Trial 141 finished with value: 0.0018391235498711467 and parameters: {'width_NN_heal': 10, 'width_NN_state': 58, 'depth_NN_heal': 7, 'depth_NN_state': 6, 'mode_heal': 60, 'mode_state': 48, 'blocks_heal': 8, 'blocks_state': 5, 'lift_act_state': <function tanh at 0x7ff3611b4cc0>, 'block_act_state': <built-in function gelu>, 'lift_act_heal': None, 'block_act_heal': <built-in function gelu>, 'width_heal': 41, 'width_state': 32, 'lr': 0.003392875914817112, 'padding_heal': 17, 'padding_state': 29, 'optimizer_type': 'adam'}. Best is trial 135 with value: 0.0013019680045545101.
[I 2025-07-30 21:06:48,589] Trial 142 finished with value: 0.0016652451595291495 and parameters: {'width_NN_heal': 11, 'width_NN_state': 52, 'depth_NN_heal': 7, 'depth_NN_state': 6, 'mode_heal': 56, 'mode_state': 52, 'blocks_heal': 8, 'blocks_state': 5, 'lift_act_state': <function tanh at 0x7ff3611b4cc0>, 'block_act_state': <built-in function gelu>, 'lift_act_heal': None, 'block_act_heal': <built-in function gelu>, 'width_heal': 43, 'width_state': 33, 'lr': 0.00435778061299392, 'padding_heal': 16, 'padding_state': 30, 'optimizer_type': 'adam'}. Best is trial 135 with value: 0.0013019680045545101.
