[I 2025-07-30 22:06:20,479] Trial 834 finished with value: 0.0014296043664216995 and parameters: {'width_NN_heal': 177, 'width_NN_state': 414, 'depth_NN_heal': 3, 'depth_NN_state': 3, 'mode_heal': 60, 'mode_state': 64, 'blocks_heal': 7, 'blocks_state': 3, 'lift_act_state': <built-in function gelu>, 'block_act_state': <built-in function gelu>, 'lift_act_heal': <function tanh at 0x7ff3611b4cc0>, 'block_act_heal': None, 'width_heal': 31, 'width_state': 29, 'lr': 0.0014457993538887026, 'padding_heal': 7, 'padding_state': 18, 'optimizer_type': 'lbfgs'}. Best is trial 771 with value: 0.0010052043944597244.
[I 2025-07-30 22:06:25,070] Trial 835 finished with value: 0.0013416437432169914 and parameters: {'width_NN_heal': 279, 'width_NN_state': 275, 'depth_NN_heal': 3, 'depth_NN_state': 3, 'mode_heal': 60, 'mode_state': 64, 'blocks_heal': 7, 'blocks_state': 3, 'lift_act_state': <built-in function gelu>, 'block_act_state': <built-in function gelu>, 'lift_act_heal': <function tanh at 0x7ff3611b4cc0>, 'block_act_heal': None, 'width_heal': 36, 'width_state': 25, 'lr': 0.0018932893564187524, 'padding_heal': 5, 'padding_state': 16, 'optimizer_type': 'lbfgs'}. Best is trial 771 with value: 0.0010052043944597244.
[I 2025-07-30 22:06:29,575] Trial 836 finished with value: 0.0014754771254956722 and parameters: {'width_NN_heal': 249, 'width_NN_state': 220, 'depth_NN_heal': 2, 'depth_NN_state': 3, 'mode_heal': 60, 'mode_state': 64, 'blocks_heal': 7, 'blocks_state': 3, 'lift_act_state': <built-in function gelu>, 'block_act_state': <built-in function gelu>, 'lift_act_heal': <function tanh at 0x7ff3611b4cc0>, 'block_act_heal': None, 'width_heal': 28, 'width_state': 30, 'lr': 0.0012360121863936565, 'padding_heal': 6, 'padding_state': 15, 'optimizer_type': 'lbfgs'}. Best is trial 771 with value: 0.0010052043944597244.
[I 2025-07-30 22:06:34,030] Trial 837 finished with value: 0.002303250366821885 and parameters: {'width_NN_heal': 187, 'width_NN_state': 363, 'depth_NN_heal': 3, 'depth_NN_state': 2, 'mode_heal': 60, 'mode_state': 64, 'blocks_heal': 7, 'blocks_state': 3, 'lift_act_state': None, 'block_act_state': <built-in function gelu>, 'lift_act_heal': <function tanh at 0x7ff3611b4cc0>, 'block_act_heal': None, 'width_heal': 34, 'width_state': 23, 'lr': 0.0016757180504820036, 'padding_heal': 4, 'padding_state': 17, 'optimizer_type': 'lbfgs'}. Best is trial 771 with value: 0.0010052043944597244.
[I 2025-07-30 22:06:38,841] Trial 838 finished with value: 0.0012168638641014695 and parameters: {'width_NN_heal': 210, 'width_NN_state': 294, 'depth_NN_heal': 4, 'depth_NN_state': 3, 'mode_heal': 60, 'mode_state': 64, 'blocks_heal': 7, 'blocks_state': 3, 'lift_act_state': <built-in function gelu>, 'block_act_state': <built-in function gelu>, 'lift_act_heal': <function tanh at 0x7ff3611b4cc0>, 'block_act_heal': None, 'width_heal': 31, 'width_state': 27, 'lr': 0.0015567630989002088, 'padding_heal': 7, 'padding_state': 18, 'optimizer_type': 'lbfgs'}. Best is trial 771 with value: 0.0010052043944597244.
[I 2025-07-30 22:06:43,473] Trial 839 finished with value: 0.0010902106296271086 and parameters: {'width_NN_heal': 226, 'width_NN_state': 255, 'depth_NN_heal': 3, 'depth_NN_state': 3, 'mode_heal': 60, 'mode_state': 64, 'blocks_heal': 7, 'blocks_state': 3, 'lift_act_state': <built-in function gelu>, 'block_act_state': <built-in function gelu>, 'lift_act_heal': <function tanh at 0x7ff3611b4cc0>, 'block_act_heal': None, 'width_heal': 29, 'width_state': 25, 'lr': 0.0018551313392745632, 'padding_heal': 6, 'padding_state': 17, 'optimizer_type': 'lbfgs'}. Best is trial 771 with value: 0.0010052043944597244.
[I 2025-07-30 22:06:48,126] Trial 840 finished with value: 0.0012405432062223554 and parameters: {'width_NN_heal': 241, 'width_NN_state': 238, 'depth_NN_heal': 3, 'depth_NN_state': 3, 'mode_heal': 60, 'mode_state': 64, 'blocks_heal': 7, 'blocks_state': 3, 'lift_act_state': <built-in function gelu>, 'block_act_state': <built-in function gelu>, 'lift_act_heal': <function tanh at 0x7ff3611b4cc0>, 'block_act_heal': None, 'width_heal': 29, 'width_state': 26, 'lr': 0.0018766354777185082, 'padding_heal': 5, 'padding_state': 18, 'optimizer_type': 'lbfgs'}. Best is trial 771 with value: 0.0010052043944597244.
[I 2025-07-30 22:06:52,825] Trial 841 finished with value: 0.001181412604637444 and parameters: {'width_NN_heal': 173, 'width_NN_state': 253, 'depth_NN_heal': 3, 'depth_NN_state': 3, 'mode_heal': 60, 'mode_state': 64, 'blocks_heal': 7, 'blocks_state': 3, 'lift_act_state': <built-in function gelu>, 'block_act_state': <built-in function gelu>, 'lift_act_heal': <function tanh at 0x7ff3611b4cc0>, 'block_act_heal': None, 'width_heal': 29, 'width_state': 29, 'lr': 0.0018910898505874454, 'padding_heal': 8, 'padding_state': 17, 'optimizer_type': 'lbfgs'}. Best is trial 771 with value: 0.0010052043944597244.
[I 2025-07-30 22:06:57,354] Trial 842 finished with value: 0.0012965461937710643 and parameters: {'width_NN_heal': 203, 'width_NN_state': 212, 'depth_NN_heal': 3, 'depth_NN_state': 3, 'mode_heal': 60, 'mode_state': 64, 'blocks_heal': 7, 'blocks_state': 3, 'lift_act_state': <built-in function gelu>, 'block_act_state': <built-in function gelu>, 'lift_act_heal': <function tanh at 0x7ff3611b4cc0>, 'block_act_heal': None, 'width_heal': 28, 'width_state': 27, 'lr': 0.001754300292668118, 'padding_heal': 5, 'padding_state': 15, 'optimizer_type': 'lbfgs'}. Best is trial 771 with value: 0.0010052043944597244.
[I 2025-07-30 22:07:02,024] Trial 843 finished with value: 0.0011017473880201578 and parameters: {'width_NN_heal': 265, 'width_NN_state': 227, 'depth_NN_heal': 3, 'depth_NN_state': 3, 'mode_heal': 60, 'mode_state': 64, 'blocks_heal': 7, 'blocks_state': 3, 'lift_act_state': <built-in function gelu>, 'block_act_state': <built-in function gelu>, 'lift_act_heal': <function tanh at 0x7ff3611b4cc0>, 'block_act_heal': None, 'width_heal': 31, 'width_state': 59, 'lr': 0.0019039835583285712, 'padding_heal': 4, 'padding_state': 17, 'optimizer_type': 'lbfgs'}. Best is trial 771 with value: 0.0010052043944597244.
[I 2025-07-30 22:07:07,229] Trial 844 finished with value: 0.001198990037664771 and parameters: {'width_NN_heal': 308, 'width_NN_state': 385, 'depth_NN_heal': 3, 'depth_NN_state': 3, 'mode_heal': 60, 'mode_state': 64, 'blocks_heal': 7, 'blocks_state': 3, 'lift_act_state': <built-in function gelu>, 'block_act_state': <built-in function gelu>, 'lift_act_heal': <function tanh at 0x7ff3611b4cc0>, 'block_act_heal': None, 'width_heal': 33, 'width_state': 56, 'lr': 0.001895268669729428, 'padding_heal': 6, 'padding_state': 16, 'optimizer_type': 'lbfgs'}. Best is trial 771 with value: 0.0010052043944597244.
[I 2025-07-30 22:07:11,880] Trial 845 finished with value: 0.0012579555623233318 and parameters: {'width_NN_heal': 275, 'width_NN_state': 340, 'depth_NN_heal': 3, 'depth_NN_state': 3, 'mode_heal': 60, 'mode_state': 64, 'blocks_heal': 7, 'blocks_state': 3, 'lift_act_state': <built-in function gelu>, 'block_act_state': <built-in function gelu>, 'lift_act_heal': <function tanh at 0x7ff3611b4cc0>, 'block_act_heal': None, 'width_heal': 31, 'width_state': 62, 'lr': 0.001728124872242242, 'padding_heal': 5, 'padding_state': 17, 'optimizer_type': 'lbfgs'}. Best is trial 771 with value: 0.0010052043944597244.
[I 2025-07-30 22:07:16,606] Trial 846 finished with value: 0.00117222941480577 and parameters: {'width_NN_heal': 232, 'width_NN_state': 317, 'depth_NN_heal': 3, 'depth_NN_state': 3, 'mode_heal': 60, 'mode_state': 64, 'blocks_heal': 7, 'blocks_state': 3, 'lift_act_state': <built-in function gelu>, 'block_act_state': <built-in function gelu>, 'lift_act_heal': <function tanh at 0x7ff3611b4cc0>, 'block_act_heal': None, 'width_heal': 31, 'width_state': 22, 'lr': 0.0019223155416480118, 'padding_heal': 7, 'padding_state': 18, 'optimizer_type': 'lbfgs'}. Best is trial 771 with value: 0.0010052043944597244.
[I 2025-07-30 22:07:21,285] Trial 847 finished with value: 0.0010059848427772522 and parameters: {'width_NN_heal': 262, 'width_NN_state': 258, 'depth_NN_heal': 3, 'depth_NN_state': 3, 'mode_heal': 60, 'mode_state': 64, 'blocks_heal': 7, 'blocks_state': 3, 'lift_act_state': <built-in function gelu>, 'block_act_state': <built-in function gelu>, 'lift_act_heal': <function tanh at 0x7ff3611b4cc0>, 'block_act_heal': None, 'width_heal': 32, 'width_state': 64, 'lr': 0.001647500844400152, 'padding_heal': 4, 'padding_state': 16, 'optimizer_type': 'lbfgs'}. Best is trial 771 with value: 0.0010052043944597244.
[I 2025-07-30 22:07:25,967] Trial 848 finished with value: 0.0011496427468955517 and parameters: {'width_NN_heal': 348, 'width_NN_state': 204, 'depth_NN_heal': 3, 'depth_NN_state': 3, 'mode_heal': 60, 'mode_state': 64, 'blocks_heal': 7, 'blocks_state': 3, 'lift_act_state': <built-in function gelu>, 'block_act_state': <built-in function gelu>, 'lift_act_heal': <function tanh at 0x7ff3611b4cc0>, 'block_act_heal': None, 'width_heal': 34, 'width_state': 57, 'lr': 0.001637910436952129, 'padding_heal': 6, 'padding_state': 16, 'optimizer_type': 'lbfgs'}. Best is trial 771 with value: 0.0010052043944597244.
[I 2025-07-30 22:07:30,692] Trial 849 finished with value: 0.001344109419733286 and parameters: {'width_NN_heal': 303, 'width_NN_state': 251, 'depth_NN_heal': 3, 'depth_NN_state': 3, 'mode_heal': 60, 'mode_state': 64, 'blocks_heal': 7, 'blocks_state': 3, 'lift_act_state': <built-in function gelu>, 'block_act_state': <built-in function gelu>, 'lift_act_heal': <function tanh at 0x7ff3611b4cc0>, 'block_act_heal': None, 'width_heal': 31, 'width_state': 21, 'lr': 0.001750680263249105, 'padding_heal': 9, 'padding_state': 14, 'optimizer_type': 'lbfgs'}. Best is trial 771 with value: 0.0010052043944597244.
[I 2025-07-30 22:07:35,465] Trial 850 finished with value: 0.00206672097556293 and parameters: {'width_NN_heal': 297, 'width_NN_state': 230, 'depth_NN_heal': 3, 'depth_NN_state': 3, 'mode_heal': 60, 'mode_state': 64, 'blocks_heal': 7, 'blocks_state': 3, 'lift_act_state': <built-in function gelu>, 'block_act_state': <function tanh at 0x7ff3611b4cc0>, 'lift_act_heal': <function tanh at 0x7ff3611b4cc0>, 'block_act_heal': None, 'width_heal': 33, 'width_state': 62, 'lr': 0.0016015060676388213, 'padding_heal': 10, 'padding_state': 16, 'optimizer_type': 'lbfgs'}. Best is trial 771 with value: 0.0010052043944597244.
[I 2025-07-30 22:07:40,176] Trial 851 finished with value: 0.0012054656399413943 and parameters: {'width_NN_heal': 268, 'width_NN_state': 366, 'depth_NN_heal': 3, 'depth_NN_state': 3, 'mode_heal': 60, 'mode_state': 64, 'blocks_heal': 7, 'blocks_state': 3, 'lift_act_state': <built-in function gelu>, 'block_act_state': <built-in function gelu>, 'lift_act_heal': <function tanh at 0x7ff3611b4cc0>, 'block_act_heal': None, 'width_heal': 32, 'width_state': 59, 'lr': 0.0018443138515693406, 'padding_heal': 4, 'padding_state': 15, 'optimizer_type': 'lbfgs'}. Best is trial 771 with value: 0.0010052043944597244.
[I 2025-07-30 22:07:45,534] Trial 852 finished with value: 0.0011269774986431003 and parameters: {'width_NN_heal': 274, 'width_NN_state': 460, 'depth_NN_heal': 3, 'depth_NN_state': 3, 'mode_heal': 60, 'mode_state': 64, 'blocks_heal': 7, 'blocks_state': 3, 'lift_act_state': <built-in function gelu>, 'block_act_state': <built-in function gelu>, 'lift_act_heal': <function tanh at 0x7ff3611b4cc0>, 'block_act_heal': None, 'width_heal': 35, 'width_state': 68, 'lr': 0.001567486825364877, 'padding_heal': 6, 'padding_state': 16, 'optimizer_type': 'lbfgs'}. Best is trial 771 with value: 0.0010052043944597244.
[I 2025-07-30 22:07:50,185] Trial 853 finished with value: 0.0012402650900185108 and parameters: {'width_NN_heal': 254, 'width_NN_state': 298, 'depth_NN_heal': 3, 'depth_NN_state': 3, 'mode_heal': 60, 'mode_state': 64, 'blocks_heal': 7, 'blocks_state': 3, 'lift_act_state': <built-in function gelu>, 'block_act_state': <built-in function gelu>, 'lift_act_heal': <function tanh at 0x7ff3611b4cc0>, 'block_act_heal': None, 'width_heal': 37, 'width_state': 63, 'lr': 0.0017159422383628323, 'padding_heal': 5, 'padding_state': 17, 'optimizer_type': 'lbfgs'}. Best is trial 771 with value: 0.0010052043944597244.
[I 2025-07-30 22:07:54,806] Trial 854 finished with value: 0.002743557095527649 and parameters: {'width_NN_heal': 260, 'width_NN_state': 266, 'depth_NN_heal': 3, 'depth_NN_state': 3, 'mode_heal': 60, 'mode_state': 64, 'blocks_heal': 7, 'blocks_state': 3, 'lift_act_state': <built-in function gelu>, 'block_act_state': <built-in function gelu>, 'lift_act_heal': <function tanh at 0x7ff3611b4cc0>, 'block_act_heal': None, 'width_heal': 9, 'width_state': 24, 'lr': 0.001945511884583765, 'padding_heal': 8, 'padding_state': 13, 'optimizer_type': 'lbfgs'}. Best is trial 771 with value: 0.0010052043944597244.
[I 2025-07-30 22:07:59,399] Trial 855 finished with value: 0.001328995916992426 and parameters: {'width_NN_heal': 282, 'width_NN_state': 337, 'depth_NN_heal': 3, 'depth_NN_state': 3, 'mode_heal': 60, 'mode_state': 64, 'blocks_heal': 7, 'blocks_state': 3, 'lift_act_state': <built-in function gelu>, 'block_act_state': <built-in function gelu>, 'lift_act_heal': None, 'block_act_heal': None, 'width_heal': 30, 'width_state': 60, 'lr': 0.0015199411274058033, 'padding_heal': 4, 'padding_state': 17, 'optimizer_type': 'lbfgs'}. Best is trial 771 with value: 0.0010052043944597244.
[I 2025-07-30 22:08:03,962] Trial 856 finished with value: 0.0012493333779275417 and parameters: {'width_NN_heal': 250, 'width_NN_state': 323, 'depth_NN_heal': 3, 'depth_NN_state': 3, 'mode_heal': 60, 'mode_state': 64, 'blocks_heal': 7, 'blocks_state': 3, 'lift_act_state': <built-in function gelu>, 'block_act_state': <built-in function gelu>, 'lift_act_heal': <function tanh at 0x7ff3611b4cc0>, 'block_act_heal': None, 'width_heal': 32, 'width_state': 25, 'lr': 0.001703667529626203, 'padding_heal': 5, 'padding_state': 16, 'optimizer_type': 'lbfgs'}. Best is trial 771 with value: 0.0010052043944597244.
[I 2025-07-30 22:08:08,662] Trial 857 finished with value: 0.0018673893064260483 and parameters: {'width_NN_heal': 241, 'width_NN_state': 222, 'depth_NN_heal': 3, 'depth_NN_state': 3, 'mode_heal': 60, 'mode_state': 64, 'blocks_heal': 7, 'blocks_state': 3, 'lift_act_state': <built-in function gelu>, 'block_act_state': None, 'lift_act_heal': <function tanh at 0x7ff3611b4cc0>, 'block_act_heal': None, 'width_heal': 35, 'width_state': 53, 'lr': 0.00196514018733339, 'padding_heal': 7, 'padding_state': 16, 'optimizer_type': 'lbfgs'}. Best is trial 771 with value: 0.0010052043944597244.
[I 2025-07-30 22:08:13,700] Trial 858 finished with value: 0.0011508433381095529 and parameters: {'width_NN_heal': 310, 'width_NN_state': 391, 'depth_NN_heal': 3, 'depth_NN_state': 3, 'mode_heal': 60, 'mode_state': 64, 'blocks_heal': 7, 'blocks_state': 3, 'lift_act_state': <built-in function gelu>, 'block_act_state': <built-in function gelu>, 'lift_act_heal': <function tanh at 0x7ff3611b4cc0>, 'block_act_heal': None, 'width_heal': 40, 'width_state': 50, 'lr': 0.0014192044440585576, 'padding_heal': 5, 'padding_state': 17, 'optimizer_type': 'lbfgs'}. Best is trial 771 with value: 0.0010052043944597244.
[I 2025-07-30 22:08:16,814] Trial 859 finished with value: 0.001982880989089608 and parameters: {'width_NN_heal': 264, 'width_NN_state': 254, 'depth_NN_heal': 3, 'depth_NN_state': 3, 'mode_heal': 60, 'mode_state': 44, 'blocks_heal': 1, 'blocks_state': 3, 'lift_act_state': None, 'block_act_state': <built-in function gelu>, 'lift_act_heal': <function tanh at 0x7ff3611b4cc0>, 'block_act_heal': None, 'width_heal': 30, 'width_state': 59, 'lr': 0.0018394529537401104, 'padding_heal': 4, 'padding_state': 18, 'optimizer_type': 'lbfgs'}. Best is trial 771 with value: 0.0010052043944597244.
[I 2025-07-30 22:08:21,551] Trial 860 finished with value: 0.0011250036768615246 and parameters: {'width_NN_heal': 235, 'width_NN_state': 295, 'depth_NN_heal': 3, 'depth_NN_state': 3, 'mode_heal': 60, 'mode_state': 64, 'blocks_heal': 7, 'blocks_state': 3, 'lift_act_state': <built-in function gelu>, 'block_act_state': <built-in function gelu>, 'lift_act_heal': <function tanh at 0x7ff3611b4cc0>, 'block_act_heal': None, 'width_heal': 33, 'width_state': 53, 'lr': 0.0016045848847321587, 'padding_heal': 7, 'padding_state': 15, 'optimizer_type': 'lbfgs'}. Best is trial 771 with value: 0.0010052043944597244.
[I 2025-07-30 22:08:26,124] Trial 861 finished with value: 0.0014370684511959553 and parameters: {'width_NN_heal': 282, 'width_NN_state': 344, 'depth_NN_heal': 3, 'depth_NN_state': 2, 'mode_heal': 60, 'mode_state': 64, 'blocks_heal': 7, 'blocks_state': 3, 'lift_act_state': <built-in function gelu>, 'block_act_state': <built-in function gelu>, 'lift_act_heal': <function tanh at 0x7ff3611b4cc0>, 'block_act_heal': None, 'width_heal': 29, 'width_state': 60, 'lr': 0.0017606220943781647, 'padding_heal': 6, 'padding_state': 17, 'optimizer_type': 'lbfgs'}. Best is trial 771 with value: 0.0010052043944597244.
[I 2025-07-30 22:08:30,786] Trial 862 finished with value: 0.0012256355257704854 and parameters: {'width_NN_heal': 222, 'width_NN_state': 276, 'depth_NN_heal': 3, 'depth_NN_state': 3, 'mode_heal': 60, 'mode_state': 64, 'blocks_heal': 7, 'blocks_state': 3, 'lift_act_state': <built-in function gelu>, 'block_act_state': <built-in function gelu>, 'lift_act_heal': <function tanh at 0x7ff3611b4cc0>, 'block_act_heal': None, 'width_heal': 37, 'width_state': 64, 'lr': 0.001417288109810877, 'padding_heal': 5, 'padding_state': 16, 'optimizer_type': 'lbfgs'}. Best is trial 771 with value: 0.0010052043944597244.
[I 2025-07-30 22:08:35,503] Trial 863 finished with value: 0.001052670180797577 and parameters: {'width_NN_heal': 245, 'width_NN_state': 311, 'depth_NN_heal': 3, 'depth_NN_state': 3, 'mode_heal': 60, 'mode_state': 64, 'blocks_heal': 7, 'blocks_state': 3, 'lift_act_state': <built-in function gelu>, 'block_act_state': <built-in function gelu>, 'lift_act_heal': <function tanh at 0x7ff3611b4cc0>, 'block_act_heal': None, 'width_heal': 33, 'width_state': 55, 'lr': 0.0015859585566770603, 'padding_heal': 4, 'padding_state': 18, 'optimizer_type': 'lbfgs'}. Best is trial 771 with value: 0.0010052043944597244.
[I 2025-07-30 22:08:40,306] Trial 864 finished with value: 0.001263038138858974 and parameters: {'width_NN_heal': 321, 'width_NN_state': 430, 'depth_NN_heal': 2, 'depth_NN_state': 3, 'mode_heal': 60, 'mode_state': 64, 'blocks_heal': 7, 'blocks_state': 3, 'lift_act_state': <built-in function gelu>, 'block_act_state': <built-in function gelu>, 'lift_act_heal': <function tanh at 0x7ff3611b4cc0>, 'block_act_heal': None, 'width_heal': 29, 'width_state': 56, 'lr': 0.00194840153301946, 'padding_heal': 4, 'padding_state': 15, 'optimizer_type': 'lbfgs'}. Best is trial 771 with value: 0.0010052043944597244.
[I 2025-07-30 22:08:45,204] Trial 865 finished with value: 0.0011430332669988275 and parameters: {'width_NN_heal': 272, 'width_NN_state': 368, 'depth_NN_heal': 3, 'depth_NN_state': 3, 'mode_heal': 60, 'mode_state': 64, 'blocks_heal': 7, 'blocks_state': 3, 'lift_act_state': <built-in function gelu>, 'block_act_state': <built-in function gelu>, 'lift_act_heal': <function tanh at 0x7ff3611b4cc0>, 'block_act_heal': None, 'width_heal': 35, 'width_state': 61, 'lr': 0.0016343711718034089, 'padding_heal': 4, 'padding_state': 17, 'optimizer_type': 'lbfgs'}. Best is trial 771 with value: 0.0010052043944597244.
[I 2025-07-30 22:08:49,858] Trial 866 finished with value: 0.001173918484710157 and parameters: {'width_NN_heal': 253, 'width_NN_state': 327, 'depth_NN_heal': 3, 'depth_NN_state': 3, 'mode_heal': 60, 'mode_state': 64, 'blocks_heal': 7, 'blocks_state': 3, 'lift_act_state': <built-in function gelu>, 'block_act_state': <built-in function gelu>, 'lift_act_heal': <function tanh at 0x7ff3611b4cc0>, 'block_act_heal': None, 'width_heal': 32, 'width_state': 52, 'lr': 0.001778556346066627, 'padding_heal': 4, 'padding_state': 16, 'optimizer_type': 'lbfgs'}. Best is trial 771 with value: 0.0010052043944597244.
[I 2025-07-30 22:08:54,992] Trial 867 finished with value: 0.0011705998331308365 and parameters: {'width_NN_heal': 291, 'width_NN_state': 401, 'depth_NN_heal': 3, 'depth_NN_state': 3, 'mode_heal': 60, 'mode_state': 64, 'blocks_heal': 7, 'blocks_state': 3, 'lift_act_state': <built-in function gelu>, 'block_act_state': <built-in function gelu>, 'lift_act_heal': <function tanh at 0x7ff3611b4cc0>, 'block_act_heal': None, 'width_heal': 37, 'width_state': 54, 'lr': 0.0019964247271261728, 'padding_heal': 4, 'padding_state': 18, 'optimizer_type': 'lbfgs'}. Best is trial 771 with value: 0.0010052043944597244.
[I 2025-07-30 22:09:00,933] Trial 868 finished with value: 0.016981501132249832 and parameters: {'width_NN_heal': 252, 'width_NN_state': 236, 'depth_NN_heal': 3, 'depth_NN_state': 3, 'mode_heal': 60, 'mode_state': 64, 'blocks_heal': 7, 'blocks_state': 7, 'lift_act_state': <built-in function gelu>, 'block_act_state': <built-in function gelu>, 'lift_act_heal': <function tanh at 0x7ff3611b4cc0>, 'block_act_heal': None, 'width_heal': 42, 'width_state': 67, 'lr': 0.0015626687494172582, 'padding_heal': 3, 'padding_state': 18, 'optimizer_type': 'lbfgs'}. Best is trial 771 with value: 0.0010052043944597244.
[I 2025-07-30 22:09:05,630] Trial 869 finished with value: 0.001128609525039792 and parameters: {'width_NN_heal': 240, 'width_NN_state': 353, 'depth_NN_heal': 3, 'depth_NN_state': 3, 'mode_heal': 60, 'mode_state': 64, 'blocks_heal': 7, 'blocks_state': 3, 'lift_act_state': <built-in function gelu>, 'block_act_state': <built-in function gelu>, 'lift_act_heal': <function tanh at 0x7ff3611b4cc0>, 'block_act_heal': None, 'width_heal': 31, 'width_state': 58, 'lr': 0.001844502540768536, 'padding_heal': 23, 'padding_state': 17, 'optimizer_type': 'lbfgs'}. Best is trial 771 with value: 0.0010052043944597244.
