[I 2025-07-31 00:19:50,396] Trial 2454 finished with value: 0.0014335555024445057 and parameters: {'width_NN_heal': 318, 'width_NN_state': 278, 'depth_NN_heal': 2, 'depth_NN_state': 2, 'mode_heal': 48, 'mode_state': 60, 'blocks_heal': 5, 'blocks_state': 6, 'lift_act_state': <function tanh at 0x7ff3611b4cc0>, 'block_act_state': <built-in function gelu>, 'lift_act_heal': <built-in function gelu>, 'block_act_heal': None, 'width_heal': 45, 'width_state': 94, 'lr': 0.0013842526663870658, 'padding_heal': 3, 'padding_state': 17, 'optimizer_type': 'adam'}. Best is trial 1511 with value: 0.0009640019852668047.
[I 2025-07-31 00:19:54,709] Trial 2455 finished with value: 0.0011413649190217257 and parameters: {'width_NN_heal': 374, 'width_NN_state': 331, 'depth_NN_heal': 3, 'depth_NN_state': 3, 'mode_heal': 40, 'mode_state': 60, 'blocks_heal': 4, 'blocks_state': 3, 'lift_act_state': <built-in function gelu>, 'block_act_state': <built-in function gelu>, 'lift_act_heal': <built-in function gelu>, 'block_act_heal': None, 'width_heal': 41, 'width_state': 86, 'lr': 0.0011943388953037433, 'padding_heal': 2, 'padding_state': 16, 'optimizer_type': 'adam'}. Best is trial 1511 with value: 0.0009640019852668047.
[I 2025-07-31 00:19:59,656] Trial 2456 finished with value: 0.001475383061915636 and parameters: {'width_NN_heal': 339, 'width_NN_state': 421, 'depth_NN_heal': 2, 'depth_NN_state': 3, 'mode_heal': 44, 'mode_state': 60, 'blocks_heal': 5, 'blocks_state': 3, 'lift_act_state': <built-in function gelu>, 'block_act_state': <built-in function gelu>, 'lift_act_heal': None, 'block_act_heal': <built-in function gelu>, 'width_heal': 51, 'width_state': 79, 'lr': 0.0015967046548198357, 'padding_heal': 27, 'padding_state': 20, 'optimizer_type': 'lbfgs'}. Best is trial 1511 with value: 0.0009640019852668047.
[I 2025-07-31 00:20:03,704] Trial 2457 finished with value: 0.0011521567357704043 and parameters: {'width_NN_heal': 377, 'width_NN_state': 303, 'depth_NN_heal': 2, 'depth_NN_state': 3, 'mode_heal': 56, 'mode_state': 60, 'blocks_heal': 5, 'blocks_state': 3, 'lift_act_state': <built-in function gelu>, 'block_act_state': <built-in function gelu>, 'lift_act_heal': <built-in function gelu>, 'block_act_heal': None, 'width_heal': 47, 'width_state': 95, 'lr': 0.0014393575506479637, 'padding_heal': 3, 'padding_state': 16, 'optimizer_type': 'adam'}. Best is trial 1511 with value: 0.0009640019852668047.
[I 2025-07-31 00:20:07,894] Trial 2458 finished with value: 0.0018928063800558448 and parameters: {'width_NN_heal': 291, 'width_NN_state': 370, 'depth_NN_heal': 2, 'depth_NN_state': 3, 'mode_heal': 48, 'mode_state': 60, 'blocks_heal': 6, 'blocks_state': 3, 'lift_act_state': <built-in function gelu>, 'block_act_state': <built-in function gelu>, 'lift_act_heal': <built-in function gelu>, 'block_act_heal': None, 'width_heal': 52, 'width_state': 98, 'lr': 0.0009898864969700404, 'padding_heal': 2, 'padding_state': 1, 'optimizer_type': 'adam'}. Best is trial 1511 with value: 0.0009640019852668047.
[I 2025-07-31 00:20:11,830] Trial 2459 finished with value: 0.002103308914229274 and parameters: {'width_NN_heal': 316, 'width_NN_state': 265, 'depth_NN_heal': 2, 'depth_NN_state': 3, 'mode_heal': 48, 'mode_state': 60, 'blocks_heal': 5, 'blocks_state': 3, 'lift_act_state': <built-in function gelu>, 'block_act_state': <function tanh at 0x7ff3611b4cc0>, 'lift_act_heal': <built-in function gelu>, 'block_act_heal': None, 'width_heal': 43, 'width_state': 76, 'lr': 0.0013140484668564614, 'padding_heal': 3, 'padding_state': 17, 'optimizer_type': 'adam'}. Best is trial 1511 with value: 0.0009640019852668047.
[I 2025-07-31 00:20:15,679] Trial 2460 finished with value: 0.0016188935842365026 and parameters: {'width_NN_heal': 361, 'width_NN_state': 341, 'depth_NN_heal': 2, 'depth_NN_state': 3, 'mode_heal': 52, 'mode_state': 60, 'blocks_heal': 4, 'blocks_state': 3, 'lift_act_state': None, 'block_act_state': <built-in function gelu>, 'lift_act_heal': <built-in function gelu>, 'block_act_heal': None, 'width_heal': 53, 'width_state': 89, 'lr': 0.0015735427341383686, 'padding_heal': 1, 'padding_state': 18, 'optimizer_type': 'adam'}. Best is trial 1511 with value: 0.0009640019852668047.
[I 2025-07-31 00:20:19,886] Trial 2461 finished with value: 0.001154769561253488 and parameters: {'width_NN_heal': 389, 'width_NN_state': 292, 'depth_NN_heal': 2, 'depth_NN_state': 3, 'mode_heal': 52, 'mode_state': 60, 'blocks_heal': 5, 'blocks_state': 3, 'lift_act_state': <built-in function gelu>, 'block_act_state': <built-in function gelu>, 'lift_act_heal': <built-in function gelu>, 'block_act_heal': None, 'width_heal': 48, 'width_state': 98, 'lr': 0.0014526818826380633, 'padding_heal': 3, 'padding_state': 19, 'optimizer_type': 'adam'}. Best is trial 1511 with value: 0.0009640019852668047.
[I 2025-07-31 00:20:24,599] Trial 2462 finished with value: 0.0011373610468581319 and parameters: {'width_NN_heal': 344, 'width_NN_state': 389, 'depth_NN_heal': 3, 'depth_NN_state': 3, 'mode_heal': 64, 'mode_state': 60, 'blocks_heal': 4, 'blocks_state': 3, 'lift_act_state': <built-in function gelu>, 'block_act_state': <built-in function gelu>, 'lift_act_heal': <built-in function gelu>, 'block_act_heal': None, 'width_heal': 40, 'width_state': 84, 'lr': 0.0012649169802606834, 'padding_heal': 2, 'padding_state': 17, 'optimizer_type': 'adam'}. Best is trial 1511 with value: 0.0009640019852668047.
[I 2025-07-31 00:20:28,548] Trial 2463 finished with value: 0.0012049868237227201 and parameters: {'width_NN_heal': 380, 'width_NN_state': 243, 'depth_NN_heal': 2, 'depth_NN_state': 3, 'mode_heal': 56, 'mode_state': 60, 'blocks_heal': 5, 'blocks_state': 3, 'lift_act_state': <built-in function gelu>, 'block_act_state': <built-in function gelu>, 'lift_act_heal': <built-in function gelu>, 'block_act_heal': None, 'width_heal': 45, 'width_state': 99, 'lr': 0.0011588378983035514, 'padding_heal': 3, 'padding_state': 15, 'optimizer_type': 'adam'}. Best is trial 1511 with value: 0.0009640019852668047.
[I 2025-07-31 00:20:32,664] Trial 2464 finished with value: 0.0012526637874543667 and parameters: {'width_NN_heal': 304, 'width_NN_state': 333, 'depth_NN_heal': 1, 'depth_NN_state': 3, 'mode_heal': 44, 'mode_state': 60, 'blocks_heal': 6, 'blocks_state': 3, 'lift_act_state': <built-in function gelu>, 'block_act_state': <built-in function gelu>, 'lift_act_heal': <built-in function gelu>, 'block_act_heal': None, 'width_heal': 51, 'width_state': 91, 'lr': 0.0015909616849840995, 'padding_heal': 3, 'padding_state': 16, 'optimizer_type': 'adam'}. Best is trial 1511 with value: 0.0009640019852668047.
[I 2025-07-31 00:20:36,507] Trial 2465 finished with value: 0.001724675646983087 and parameters: {'width_NN_heal': 329, 'width_NN_state': 306, 'depth_NN_heal': 2, 'depth_NN_state': 3, 'mode_heal': 52, 'mode_state': 60, 'blocks_heal': 5, 'blocks_state': 2, 'lift_act_state': <built-in function gelu>, 'block_act_state': None, 'lift_act_heal': <built-in function gelu>, 'block_act_heal': None, 'width_heal': 43, 'width_state': 102, 'lr': 0.0014042572919915894, 'padding_heal': 4, 'padding_state': 17, 'optimizer_type': 'adam'}. Best is trial 1511 with value: 0.0009640019852668047.
[I 2025-07-31 00:20:41,010] Trial 2466 finished with value: 0.00108868139795959 and parameters: {'width_NN_heal': 394, 'width_NN_state': 360, 'depth_NN_heal': 2, 'depth_NN_state': 3, 'mode_heal': 52, 'mode_state': 60, 'blocks_heal': 5, 'blocks_state': 3, 'lift_act_state': <built-in function gelu>, 'block_act_state': <built-in function gelu>, 'lift_act_heal': <built-in function gelu>, 'block_act_heal': None, 'width_heal': 54, 'width_state': 81, 'lr': 0.0016327728199976312, 'padding_heal': 2, 'padding_state': 18, 'optimizer_type': 'adam'}. Best is trial 1511 with value: 0.0009640019852668047.
[I 2025-07-31 00:20:45,135] Trial 2467 finished with value: 0.0012495552655309439 and parameters: {'width_NN_heal': 355, 'width_NN_state': 276, 'depth_NN_heal': 2, 'depth_NN_state': 3, 'mode_heal': 64, 'mode_state': 60, 'blocks_heal': 5, 'blocks_state': 3, 'lift_act_state': <built-in function gelu>, 'block_act_state': <built-in function gelu>, 'lift_act_heal': <built-in function gelu>, 'block_act_heal': None, 'width_heal': 49, 'width_state': 93, 'lr': 0.0012750162266984117, 'padding_heal': 3, 'padding_state': 19, 'optimizer_type': 'adam'}. Best is trial 1511 with value: 0.0009640019852668047.
[I 2025-07-31 00:20:49,724] Trial 2468 finished with value: 0.0011556046083569527 and parameters: {'width_NN_heal': 288, 'width_NN_state': 452, 'depth_NN_heal': 2, 'depth_NN_state': 3, 'mode_heal': 52, 'mode_state': 60, 'blocks_heal': 4, 'blocks_state': 3, 'lift_act_state': <built-in function gelu>, 'block_act_state': <built-in function gelu>, 'lift_act_heal': <built-in function gelu>, 'block_act_heal': None, 'width_heal': 39, 'width_state': 101, 'lr': 0.0014919004823368753, 'padding_heal': 1, 'padding_state': 18, 'optimizer_type': 'adam'}. Best is trial 1511 with value: 0.0009640019852668047.
[I 2025-07-31 00:20:53,937] Trial 2469 finished with value: 0.0013798130676150322 and parameters: {'width_NN_heal': 92, 'width_NN_state': 319, 'depth_NN_heal': 2, 'depth_NN_state': 3, 'mode_heal': 64, 'mode_state': 60, 'blocks_heal': 5, 'blocks_state': 4, 'lift_act_state': <built-in function gelu>, 'block_act_state': <built-in function gelu>, 'lift_act_heal': <built-in function gelu>, 'block_act_heal': None, 'width_heal': 35, 'width_state': 96, 'lr': 0.0011224546211818325, 'padding_heal': 3, 'padding_state': 17, 'optimizer_type': 'adam'}. Best is trial 1511 with value: 0.0009640019852668047.
[I 2025-07-31 00:20:58,086] Trial 2470 finished with value: 0.0012946889037266374 and parameters: {'width_NN_heal': 389, 'width_NN_state': 214, 'depth_NN_heal': 2, 'depth_NN_state': 2, 'mode_heal': 64, 'mode_state': 60, 'blocks_heal': 5, 'blocks_state': 3, 'lift_act_state': <built-in function gelu>, 'block_act_state': <built-in function gelu>, 'lift_act_heal': <built-in function gelu>, 'block_act_heal': None, 'width_heal': 46, 'width_state': 88, 'lr': 0.001615971256628016, 'padding_heal': 31, 'padding_state': 16, 'optimizer_type': 'adam'}. Best is trial 1511 with value: 0.0009640019852668047.
[I 2025-07-31 00:21:02,641] Trial 2471 finished with value: 0.0011736807646229863 and parameters: {'width_NN_heal': 355, 'width_NN_state': 404, 'depth_NN_heal': 2, 'depth_NN_state': 3, 'mode_heal': 52, 'mode_state': 60, 'blocks_heal': 4, 'blocks_state': 3, 'lift_act_state': <built-in function gelu>, 'block_act_state': <built-in function gelu>, 'lift_act_heal': <built-in function gelu>, 'block_act_heal': None, 'width_heal': 53, 'width_state': 101, 'lr': 0.0013979161217019466, 'padding_heal': 4, 'padding_state': 15, 'optimizer_type': 'adam'}. Best is trial 1511 with value: 0.0009640019852668047.
[I 2025-07-31 00:21:06,726] Trial 2472 finished with value: 0.0010536386398598552 and parameters: {'width_NN_heal': 319, 'width_NN_state': 255, 'depth_NN_heal': 3, 'depth_NN_state': 3, 'mode_heal': 64, 'mode_state': 60, 'blocks_heal': 5, 'blocks_state': 3, 'lift_act_state': <built-in function gelu>, 'block_act_state': <built-in function gelu>, 'lift_act_heal': <built-in function gelu>, 'block_act_heal': None, 'width_heal': 42, 'width_state': 74, 'lr': 0.0016795220241050796, 'padding_heal': 3, 'padding_state': 16, 'optimizer_type': 'adam'}. Best is trial 1511 with value: 0.0009640019852668047.
[I 2025-07-31 00:21:10,688] Trial 2473 finished with value: 0.00485785398632288 and parameters: {'width_NN_heal': 405, 'width_NN_state': 289, 'depth_NN_heal': 2, 'depth_NN_state': 3, 'mode_heal': 64, 'mode_state': 60, 'blocks_heal': 5, 'blocks_state': 2, 'lift_act_state': <built-in function gelu>, 'block_act_state': <built-in function gelu>, 'lift_act_heal': None, 'block_act_heal': None, 'width_heal': 49, 'width_state': 48, 'lr': 0.006188610034462054, 'padding_heal': 4, 'padding_state': 17, 'optimizer_type': 'adam'}. Best is trial 1511 with value: 0.0009640019852668047.
[I 2025-07-31 00:21:15,133] Trial 2474 finished with value: 0.0012837897520512342 and parameters: {'width_NN_heal': 374, 'width_NN_state': 353, 'depth_NN_heal': 2, 'depth_NN_state': 3, 'mode_heal': 56, 'mode_state': 60, 'blocks_heal': 6, 'blocks_state': 3, 'lift_act_state': <built-in function gelu>, 'block_act_state': <built-in function gelu>, 'lift_act_heal': <built-in function gelu>, 'block_act_heal': None, 'width_heal': 37, 'width_state': 105, 'lr': 0.0010173385671722094, 'padding_heal': 2, 'padding_state': 19, 'optimizer_type': 'adam'}. Best is trial 1511 with value: 0.0009640019852668047.
[I 2025-07-31 00:21:18,985] Trial 2475 finished with value: 0.0013088590931147337 and parameters: {'width_NN_heal': 334, 'width_NN_state': 309, 'depth_NN_heal': 2, 'depth_NN_state': 3, 'mode_heal': 64, 'mode_state': 56, 'blocks_heal': 4, 'blocks_state': 3, 'lift_act_state': <function tanh at 0x7ff3611b4cc0>, 'block_act_state': <built-in function gelu>, 'lift_act_heal': <built-in function gelu>, 'block_act_heal': None, 'width_heal': 53, 'width_state': 86, 'lr': 0.0013251170300089372, 'padding_heal': 0, 'padding_state': 18, 'optimizer_type': 'adam'}. Best is trial 1511 with value: 0.0009640019852668047.
[I 2025-07-31 00:21:22,607] Trial 2476 finished with value: 0.0011429453734308481 and parameters: {'width_NN_heal': 16, 'width_NN_state': 332, 'depth_NN_heal': 2, 'depth_NN_state': 3, 'mode_heal': 64, 'mode_state': 60, 'blocks_heal': 4, 'blocks_state': 3, 'lift_act_state': <built-in function gelu>, 'block_act_state': <built-in function gelu>, 'lift_act_heal': <built-in function gelu>, 'block_act_heal': <built-in function gelu>, 'width_heal': 34, 'width_state': 105, 'lr': 0.0015251474777029665, 'padding_heal': 4, 'padding_state': 18, 'optimizer_type': 'adam'}. Best is trial 1511 with value: 0.0009640019852668047.
[I 2025-07-31 00:21:26,853] Trial 2477 finished with value: 0.001186019042506814 and parameters: {'width_NN_heal': 277, 'width_NN_state': 278, 'depth_NN_heal': 2, 'depth_NN_state': 3, 'mode_heal': 64, 'mode_state': 60, 'blocks_heal': 6, 'blocks_state': 3, 'lift_act_state': <built-in function gelu>, 'block_act_state': <built-in function gelu>, 'lift_act_heal': <built-in function gelu>, 'block_act_heal': None, 'width_heal': 46, 'width_state': 96, 'lr': 0.001171258336414233, 'padding_heal': 4, 'padding_state': 16, 'optimizer_type': 'adam'}. Best is trial 1511 with value: 0.0009640019852668047.
[I 2025-07-31 00:21:31,739] Trial 2478 finished with value: 0.0013301121070981026 and parameters: {'width_NN_heal': 394, 'width_NN_state': 412, 'depth_NN_heal': 2, 'depth_NN_state': 3, 'mode_heal': 56, 'mode_state': 56, 'blocks_heal': 5, 'blocks_state': 4, 'lift_act_state': <built-in function gelu>, 'block_act_state': <built-in function gelu>, 'lift_act_heal': <built-in function gelu>, 'block_act_heal': None, 'width_heal': 41, 'width_state': 76, 'lr': 0.0015004842611148004, 'padding_heal': 3, 'padding_state': 12, 'optimizer_type': 'adam'}. Best is trial 1511 with value: 0.0009640019852668047.
[I 2025-07-31 00:21:36,588] Trial 2479 finished with value: 0.0016600642120465636 and parameters: {'width_NN_heal': 363, 'width_NN_state': 376, 'depth_NN_heal': 3, 'depth_NN_state': 3, 'mode_heal': 64, 'mode_state': 60, 'blocks_heal': 5, 'blocks_state': 3, 'lift_act_state': <built-in function gelu>, 'block_act_state': <function tanh at 0x7ff3611b4cc0>, 'lift_act_heal': <built-in function gelu>, 'block_act_heal': None, 'width_heal': 55, 'width_state': 106, 'lr': 0.0016935499941370463, 'padding_heal': 2, 'padding_state': 17, 'optimizer_type': 'adam'}. Best is trial 1511 with value: 0.0009640019852668047.
[I 2025-07-31 00:21:41,016] Trial 2480 finished with value: 0.0012363737914711237 and parameters: {'width_NN_heal': 415, 'width_NN_state': 316, 'depth_NN_heal': 2, 'depth_NN_state': 3, 'mode_heal': 48, 'mode_state': 60, 'blocks_heal': 5, 'blocks_state': 3, 'lift_act_state': <built-in function gelu>, 'block_act_state': <built-in function gelu>, 'lift_act_heal': <built-in function gelu>, 'block_act_heal': None, 'width_heal': 50, 'width_state': 93, 'lr': 0.0012690315901643632, 'padding_heal': 4, 'padding_state': 20, 'optimizer_type': 'adam'}. Best is trial 1511 with value: 0.0009640019852668047.
[I 2025-07-31 00:21:44,404] Trial 2481 finished with value: 0.00120093347504735 and parameters: {'width_NN_heal': 305, 'width_NN_state': 256, 'depth_NN_heal': 2, 'depth_NN_state': 3, 'mode_heal': 64, 'mode_state': 64, 'blocks_heal': 3, 'blocks_state': 3, 'lift_act_state': <built-in function gelu>, 'block_act_state': <built-in function gelu>, 'lift_act_heal': <built-in function gelu>, 'block_act_heal': None, 'width_heal': 43, 'width_state': 108, 'lr': 0.0013627765311153251, 'padding_heal': 2, 'padding_state': 16, 'optimizer_type': 'adam'}. Best is trial 1511 with value: 0.0009640019852668047.
[I 2025-07-31 00:21:48,526] Trial 2482 finished with value: 0.0016324790194630623 and parameters: {'width_NN_heal': 415, 'width_NN_state': 347, 'depth_NN_heal': 2, 'depth_NN_state': 3, 'mode_heal': 64, 'mode_state': 56, 'blocks_heal': 5, 'blocks_state': 3, 'lift_act_state': None, 'block_act_state': <built-in function gelu>, 'lift_act_heal': <built-in function gelu>, 'block_act_heal': None, 'width_heal': 39, 'width_state': 83, 'lr': 0.0016527467532717662, 'padding_heal': 3, 'padding_state': 17, 'optimizer_type': 'adam'}. Best is trial 1511 with value: 0.0009640019852668047.
[I 2025-07-31 00:21:52,592] Trial 2483 finished with value: 0.0010311942314729095 and parameters: {'width_NN_heal': 334, 'width_NN_state': 287, 'depth_NN_heal': 2, 'depth_NN_state': 3, 'mode_heal': 64, 'mode_state': 60, 'blocks_heal': 5, 'blocks_state': 3, 'lift_act_state': <built-in function gelu>, 'block_act_state': <built-in function gelu>, 'lift_act_heal': <built-in function gelu>, 'block_act_heal': None, 'width_heal': 47, 'width_state': 99, 'lr': 0.0014033784919847579, 'padding_heal': 1, 'padding_state': 19, 'optimizer_type': 'adam'}. Best is trial 1511 with value: 0.0009640019852668047.
[I 2025-07-31 00:21:56,692] Trial 2484 finished with value: 0.0013898073229938745 and parameters: {'width_NN_heal': 413, 'width_NN_state': 239, 'depth_NN_heal': 1, 'depth_NN_state': 3, 'mode_heal': 64, 'mode_state': 64, 'blocks_heal': 6, 'blocks_state': 3, 'lift_act_state': <built-in function gelu>, 'block_act_state': <built-in function gelu>, 'lift_act_heal': <built-in function gelu>, 'block_act_heal': None, 'width_heal': 46, 'width_state': 88, 'lr': 0.0011872695967034119, 'padding_heal': 0, 'padding_state': 20, 'optimizer_type': 'adam'}. Best is trial 1511 with value: 0.0009640019852668047.
[I 2025-07-31 00:22:00,661] Trial 2485 finished with value: 0.0013982643140479922 and parameters: {'width_NN_heal': 381, 'width_NN_state': 262, 'depth_NN_heal': 2, 'depth_NN_state': 3, 'mode_heal': 64, 'mode_state': 60, 'blocks_heal': 5, 'blocks_state': 3, 'lift_act_state': <built-in function gelu>, 'block_act_state': <built-in function gelu>, 'lift_act_heal': <built-in function gelu>, 'block_act_heal': None, 'width_heal': 45, 'width_state': 87, 'lr': 0.0010776814660794429, 'padding_heal': 0, 'padding_state': 20, 'optimizer_type': 'adam'}. Best is trial 1511 with value: 0.0009640019852668047.
[I 2025-07-31 00:22:04,496] Trial 2486 finished with value: 0.0028092500288039446 and parameters: {'width_NN_heal': 431, 'width_NN_state': 227, 'depth_NN_heal': 2, 'depth_NN_state': 2, 'mode_heal': 64, 'mode_state': 64, 'blocks_heal': 5, 'blocks_state': 3, 'lift_act_state': <built-in function gelu>, 'block_act_state': None, 'lift_act_heal': <built-in function gelu>, 'block_act_heal': None, 'width_heal': 47, 'width_state': 80, 'lr': 0.0012677576762547072, 'padding_heal': 0, 'padding_state': 20, 'optimizer_type': 'adam'}. Best is trial 1511 with value: 0.0009640019852668047.
[I 2025-07-31 00:22:08,349] Trial 2487 finished with value: 0.001348512596450746 and parameters: {'width_NN_heal': 386, 'width_NN_state': 271, 'depth_NN_heal': 2, 'depth_NN_state': 3, 'mode_heal': 64, 'mode_state': 60, 'blocks_heal': 4, 'blocks_state': 3, 'lift_act_state': <built-in function gelu>, 'block_act_state': <built-in function gelu>, 'lift_act_heal': None, 'block_act_heal': None, 'width_heal': 44, 'width_state': 93, 'lr': 0.0011487986264700888, 'padding_heal': 15, 'padding_state': 20, 'optimizer_type': 'adam'}. Best is trial 1511 with value: 0.0009640019852668047.
[I 2025-07-31 00:22:12,540] Trial 2488 finished with value: 0.0012182984501123428 and parameters: {'width_NN_heal': 416, 'width_NN_state': 271, 'depth_NN_heal': 2, 'depth_NN_state': 3, 'mode_heal': 64, 'mode_state': 60, 'blocks_heal': 5, 'blocks_state': 3, 'lift_act_state': <built-in function gelu>, 'block_act_state': <built-in function gelu>, 'lift_act_heal': <built-in function gelu>, 'block_act_heal': None, 'width_heal': 48, 'width_state': 92, 'lr': 0.0013178241007973204, 'padding_heal': 2, 'padding_state': 19, 'optimizer_type': 'adam'}. Best is trial 1511 with value: 0.0009640019852668047.
[I 2025-07-31 00:22:16,726] Trial 2489 finished with value: 0.001205803477205336 and parameters: {'width_NN_heal': 366, 'width_NN_state': 250, 'depth_NN_heal': 3, 'depth_NN_state': 3, 'mode_heal': 64, 'mode_state': 64, 'blocks_heal': 5, 'blocks_state': 3, 'lift_act_state': <built-in function gelu>, 'block_act_state': <built-in function gelu>, 'lift_act_heal': <built-in function gelu>, 'block_act_heal': None, 'width_heal': 43, 'width_state': 93, 'lr': 0.001382528443548234, 'padding_heal': 0, 'padding_state': 19, 'optimizer_type': 'adam'}. Best is trial 1511 with value: 0.0009640019852668047.
