[I 2025-07-30 23:47:47,968] Trial 2058 finished with value: 0.0013027065433561802 and parameters: {'width_NN_heal': 14, 'width_NN_state': 249, 'depth_NN_heal': 3, 'depth_NN_state': 3, 'mode_heal': 64, 'mode_state': 60, 'blocks_heal': 8, 'blocks_state': 3, 'lift_act_state': <built-in function gelu>, 'block_act_state': <built-in function gelu>, 'lift_act_heal': <built-in function gelu>, 'block_act_heal': None, 'width_heal': 35, 'width_state': 103, 'lr': 0.0016198944519536457, 'padding_heal': 3, 'padding_state': 13, 'optimizer_type': 'lbfgs'}. Best is trial 1511 with value: 0.0009640019852668047.
[I 2025-07-30 23:47:52,674] Trial 2059 finished with value: 0.0011036895448341966 and parameters: {'width_NN_heal': 384, 'width_NN_state': 334, 'depth_NN_heal': 2, 'depth_NN_state': 3, 'mode_heal': 60, 'mode_state': 64, 'blocks_heal': 7, 'blocks_state': 3, 'lift_act_state': <built-in function gelu>, 'block_act_state': <built-in function gelu>, 'lift_act_heal': <built-in function gelu>, 'block_act_heal': None, 'width_heal': 43, 'width_state': 119, 'lr': 0.0017973810251839149, 'padding_heal': 5, 'padding_state': 18, 'optimizer_type': 'lbfgs'}. Best is trial 1511 with value: 0.0009640019852668047.
[I 2025-07-30 23:47:56,732] Trial 2060 finished with value: 0.016030993312597275 and parameters: {'width_NN_heal': 327, 'width_NN_state': 479, 'depth_NN_heal': 2, 'depth_NN_state': 3, 'mode_heal': 60, 'mode_state': 60, 'blocks_heal': 2, 'blocks_state': 3, 'lift_act_state': <function tanh at 0x7ff3611b4cc0>, 'block_act_state': <built-in function gelu>, 'lift_act_heal': <built-in function gelu>, 'block_act_heal': None, 'width_heal': 31, 'width_state': 92, 'lr': 0.0020584500634534333, 'padding_heal': 3, 'padding_state': 15, 'optimizer_type': 'lbfgs'}. Best is trial 1511 with value: 0.0009640019852668047.
[I 2025-07-30 23:48:01,847] Trial 2061 finished with value: 0.0011916625080630183 and parameters: {'width_NN_heal': 432, 'width_NN_state': 269, 'depth_NN_heal': 2, 'depth_NN_state': 3, 'mode_heal': 64, 'mode_state': 36, 'blocks_heal': 8, 'blocks_state': 3, 'lift_act_state': <built-in function gelu>, 'block_act_state': <built-in function gelu>, 'lift_act_heal': <built-in function gelu>, 'block_act_heal': None, 'width_heal': 51, 'width_state': 77, 'lr': 0.0015706815201712214, 'padding_heal': 2, 'padding_state': 18, 'optimizer_type': 'lbfgs'}. Best is trial 1511 with value: 0.0009640019852668047.
[I 2025-07-30 23:48:07,285] Trial 2062 finished with value: 0.0010607517324388027 and parameters: {'width_NN_heal': 473, 'width_NN_state': 405, 'depth_NN_heal': 2, 'depth_NN_state': 3, 'mode_heal': 60, 'mode_state': 56, 'blocks_heal': 7, 'blocks_state': 3, 'lift_act_state': <built-in function gelu>, 'block_act_state': <built-in function gelu>, 'lift_act_heal': <built-in function gelu>, 'block_act_heal': None, 'width_heal': 48, 'width_state': 112, 'lr': 0.0013582673512777374, 'padding_heal': 4, 'padding_state': 17, 'optimizer_type': 'lbfgs'}. Best is trial 1511 with value: 0.0009640019852668047.
[I 2025-07-30 23:48:12,078] Trial 2063 finished with value: 0.001423569512553513 and parameters: {'width_NN_heal': 359, 'width_NN_state': 293, 'depth_NN_heal': 2, 'depth_NN_state': 3, 'mode_heal': 64, 'mode_state': 64, 'blocks_heal': 7, 'blocks_state': 3, 'lift_act_state': <built-in function gelu>, 'block_act_state': <function tanh at 0x7ff3611b4cc0>, 'lift_act_heal': <built-in function gelu>, 'block_act_heal': <built-in function gelu>, 'width_heal': 38, 'width_state': 101, 'lr': 0.0018455916846045908, 'padding_heal': 4, 'padding_state': 17, 'optimizer_type': 'lbfgs'}. Best is trial 1511 with value: 0.0009640019852668047.
[I 2025-07-30 23:48:17,269] Trial 2064 finished with value: 0.0012326074065640569 and parameters: {'width_NN_heal': 211, 'width_NN_state': 365, 'depth_NN_heal': 2, 'depth_NN_state': 3, 'mode_heal': 60, 'mode_state': 64, 'blocks_heal': 8, 'blocks_state': 3, 'lift_act_state': <built-in function gelu>, 'block_act_state': <built-in function gelu>, 'lift_act_heal': <built-in function gelu>, 'block_act_heal': None, 'width_heal': 64, 'width_state': 109, 'lr': 0.0023231114190070783, 'padding_heal': 28, 'padding_state': 15, 'optimizer_type': 'lbfgs'}. Best is trial 1511 with value: 0.0009640019852668047.
[I 2025-07-30 23:48:22,043] Trial 2065 finished with value: 0.001166950911283493 and parameters: {'width_NN_heal': 316, 'width_NN_state': 312, 'depth_NN_heal': 2, 'depth_NN_state': 3, 'mode_heal': 64, 'mode_state': 60, 'blocks_heal': 7, 'blocks_state': 3, 'lift_act_state': <built-in function gelu>, 'block_act_state': <built-in function gelu>, 'lift_act_heal': <built-in function gelu>, 'block_act_heal': None, 'width_heal': 55, 'width_state': 120, 'lr': 0.0014712378847186465, 'padding_heal': 6, 'padding_state': 16, 'optimizer_type': 'lbfgs'}. Best is trial 1511 with value: 0.0009640019852668047.
[I 2025-07-30 23:48:26,804] Trial 2066 finished with value: 0.001546418759971857 and parameters: {'width_NN_heal': 397, 'width_NN_state': 335, 'depth_NN_heal': 2, 'depth_NN_state': 3, 'mode_heal': 60, 'mode_state': 60, 'blocks_heal': 7, 'blocks_state': 3, 'lift_act_state': None, 'block_act_state': <built-in function gelu>, 'lift_act_heal': <built-in function gelu>, 'block_act_heal': None, 'width_heal': 58, 'width_state': 6, 'lr': 0.0012486058975443846, 'padding_heal': 3, 'padding_state': 18, 'optimizer_type': 'lbfgs'}. Best is trial 1511 with value: 0.0009640019852668047.
[I 2025-07-30 23:48:31,509] Trial 2067 finished with value: 0.0012817797251045704 and parameters: {'width_NN_heal': 267, 'width_NN_state': 383, 'depth_NN_heal': 2, 'depth_NN_state': 3, 'mode_heal': 60, 'mode_state': 56, 'blocks_heal': 8, 'blocks_state': 2, 'lift_act_state': <built-in function gelu>, 'block_act_state': <built-in function gelu>, 'lift_act_heal': <built-in function gelu>, 'block_act_heal': None, 'width_heal': 41, 'width_state': 94, 'lr': 0.0016803585200091348, 'padding_heal': 5, 'padding_state': 17, 'optimizer_type': 'lbfgs'}. Best is trial 1511 with value: 0.0009640019852668047.
[I 2025-07-30 23:48:35,954] Trial 2068 finished with value: 0.0014568241313099861 and parameters: {'width_NN_heal': 347, 'width_NN_state': 225, 'depth_NN_heal': 3, 'depth_NN_state': 2, 'mode_heal': 64, 'mode_state': 52, 'blocks_heal': 6, 'blocks_state': 3, 'lift_act_state': <built-in function gelu>, 'block_act_state': <built-in function gelu>, 'lift_act_heal': None, 'block_act_heal': None, 'width_heal': 46, 'width_state': 84, 'lr': 0.0020172049960433414, 'padding_heal': 4, 'padding_state': 19, 'optimizer_type': 'adam'}. Best is trial 1511 with value: 0.0009640019852668047.
[I 2025-07-30 23:48:40,737] Trial 2069 finished with value: 0.00119080301374197 and parameters: {'width_NN_heal': 440, 'width_NN_state': 267, 'depth_NN_heal': 2, 'depth_NN_state': 3, 'mode_heal': 60, 'mode_state': 64, 'blocks_heal': 7, 'blocks_state': 3, 'lift_act_state': <built-in function gelu>, 'block_act_state': <built-in function gelu>, 'lift_act_heal': <built-in function gelu>, 'block_act_heal': None, 'width_heal': 51, 'width_state': 103, 'lr': 0.0015346447573616753, 'padding_heal': 3, 'padding_state': 16, 'optimizer_type': 'lbfgs'}. Best is trial 1511 with value: 0.0009640019852668047.
[I 2025-07-30 23:48:46,057] Trial 2070 finished with value: 0.0019851599354296923 and parameters: {'width_NN_heal': 292, 'width_NN_state': 437, 'depth_NN_heal': 2, 'depth_NN_state': 3, 'mode_heal': 64, 'mode_state': 60, 'blocks_heal': 8, 'blocks_state': 3, 'lift_act_state': <built-in function gelu>, 'block_act_state': None, 'lift_act_heal': <built-in function gelu>, 'block_act_heal': None, 'width_heal': 33, 'width_state': 120, 'lr': 0.0025002043779927476, 'padding_heal': 5, 'padding_state': 18, 'optimizer_type': 'lbfgs'}. Best is trial 1511 with value: 0.0009640019852668047.
[I 2025-07-30 23:48:51,079] Trial 2071 finished with value: 0.0011444385163486004 and parameters: {'width_NN_heal': 385, 'width_NN_state': 290, 'depth_NN_heal': 2, 'depth_NN_state': 3, 'mode_heal': 60, 'mode_state': 52, 'blocks_heal': 7, 'blocks_state': 3, 'lift_act_state': <built-in function gelu>, 'block_act_state': <built-in function gelu>, 'lift_act_heal': <built-in function gelu>, 'block_act_heal': None, 'width_heal': 65, 'width_state': 111, 'lr': 0.0013431270856101357, 'padding_heal': 6, 'padding_state': 16, 'optimizer_type': 'lbfgs'}. Best is trial 1511 with value: 0.0009640019852668047.
[I 2025-07-30 23:48:56,021] Trial 2072 finished with value: 0.0012113861739635468 and parameters: {'width_NN_heal': 469, 'width_NN_state': 351, 'depth_NN_heal': 1, 'depth_NN_state': 3, 'mode_heal': 56, 'mode_state': 64, 'blocks_heal': 8, 'blocks_state': 3, 'lift_act_state': <built-in function gelu>, 'block_act_state': <built-in function gelu>, 'lift_act_heal': <built-in function gelu>, 'block_act_heal': None, 'width_heal': 43, 'width_state': 95, 'lr': 0.0018135288221991027, 'padding_heal': 4, 'padding_state': 17, 'optimizer_type': 'lbfgs'}. Best is trial 1511 with value: 0.0009640019852668047.
[I 2025-07-30 23:49:00,703] Trial 2073 finished with value: 0.0010501011274755 and parameters: {'width_NN_heal': 245, 'width_NN_state': 313, 'depth_NN_heal': 2, 'depth_NN_state': 3, 'mode_heal': 64, 'mode_state': 64, 'blocks_heal': 7, 'blocks_state': 3, 'lift_act_state': <built-in function gelu>, 'block_act_state': <built-in function gelu>, 'lift_act_heal': <built-in function gelu>, 'block_act_heal': None, 'width_heal': 36, 'width_state': 108, 'lr': 0.001659042938692766, 'padding_heal': 2, 'padding_state': 17, 'optimizer_type': 'lbfgs'}. Best is trial 1511 with value: 0.0009640019852668047.
[I 2025-07-30 23:49:05,482] Trial 2074 finished with value: 0.0015020666178315878 and parameters: {'width_NN_heal': 410, 'width_NN_state': 253, 'depth_NN_heal': 2, 'depth_NN_state': 3, 'mode_heal': 60, 'mode_state': 56, 'blocks_heal': 7, 'blocks_state': 3, 'lift_act_state': <built-in function gelu>, 'block_act_state': <built-in function gelu>, 'lift_act_heal': <built-in function gelu>, 'block_act_heal': None, 'width_heal': 57, 'width_state': 84, 'lr': 0.002190730251004373, 'padding_heal': 5, 'padding_state': 14, 'optimizer_type': 'lbfgs'}. Best is trial 1511 with value: 0.0009640019852668047.
[I 2025-07-30 23:49:11,747] Trial 2075 finished with value: 0.0013241700362414122 and parameters: {'width_NN_heal': 352, 'width_NN_state': 334, 'depth_NN_heal': 5, 'depth_NN_state': 3, 'mode_heal': 64, 'mode_state': 60, 'blocks_heal': 8, 'blocks_state': 3, 'lift_act_state': <built-in function gelu>, 'block_act_state': <built-in function gelu>, 'lift_act_heal': <built-in function gelu>, 'block_act_heal': None, 'width_heal': 53, 'width_state': 100, 'lr': 0.0014415477384969796, 'padding_heal': 1, 'padding_state': 16, 'optimizer_type': 'lbfgs'}. Best is trial 1511 with value: 0.0009640019852668047.
[I 2025-07-30 23:49:16,930] Trial 2076 finished with value: 0.0012959323357790709 and parameters: {'width_NN_heal': 313, 'width_NN_state': 281, 'depth_NN_heal': 3, 'depth_NN_state': 3, 'mode_heal': 60, 'mode_state': 64, 'blocks_heal': 8, 'blocks_state': 3, 'lift_act_state': <built-in function gelu>, 'block_act_state': <built-in function gelu>, 'lift_act_heal': <built-in function gelu>, 'block_act_heal': None, 'width_heal': 49, 'width_state': 121, 'lr': 0.0012209173128308664, 'padding_heal': 4, 'padding_state': 18, 'optimizer_type': 'lbfgs'}. Best is trial 1511 with value: 0.0009640019852668047.
[I 2025-07-30 23:49:21,973] Trial 2077 finished with value: 0.0013913374859839678 and parameters: {'width_NN_heal': 378, 'width_NN_state': 57, 'depth_NN_heal': 2, 'depth_NN_state': 3, 'mode_heal': 64, 'mode_state': 56, 'blocks_heal': 7, 'blocks_state': 4, 'lift_act_state': <built-in function gelu>, 'block_act_state': <built-in function gelu>, 'lift_act_heal': <built-in function gelu>, 'block_act_heal': None, 'width_heal': 39, 'width_state': 89, 'lr': 0.0019731821127489248, 'padding_heal': 3, 'padding_state': 15, 'optimizer_type': 'lbfgs'}. Best is trial 1511 with value: 0.0009640019852668047.
[I 2025-07-30 23:49:27,616] Trial 2078 finished with value: 0.019680244848132133 and parameters: {'width_NN_heal': 478, 'width_NN_state': 373, 'depth_NN_heal': 2, 'depth_NN_state': 3, 'mode_heal': 60, 'mode_state': 60, 'blocks_heal': 7, 'blocks_state': 3, 'lift_act_state': <built-in function gelu>, 'block_act_state': <built-in function gelu>, 'lift_act_heal': <built-in function gelu>, 'block_act_heal': None, 'width_heal': 72, 'width_state': 76, 'lr': 0.006786617852349409, 'padding_heal': 6, 'padding_state': 19, 'optimizer_type': 'lbfgs'}. Best is trial 1511 with value: 0.0009640019852668047.
[I 2025-07-30 23:49:33,207] Trial 2079 finished with value: 0.0010427901288494468 and parameters: {'width_NN_heal': 424, 'width_NN_state': 409, 'depth_NN_heal': 2, 'depth_NN_state': 3, 'mode_heal': 64, 'mode_state': 64, 'blocks_heal': 8, 'blocks_state': 3, 'lift_act_state': <built-in function gelu>, 'block_act_state': <built-in function gelu>, 'lift_act_heal': <built-in function gelu>, 'block_act_heal': None, 'width_heal': 44, 'width_state': 112, 'lr': 0.00175539920802682, 'padding_heal': 4, 'padding_state': 16, 'optimizer_type': 'lbfgs'}. Best is trial 1511 with value: 0.0009640019852668047.
[I 2025-07-30 23:49:37,968] Trial 2080 finished with value: 0.0011384888784959912 and parameters: {'width_NN_heal': 510, 'width_NN_state': 304, 'depth_NN_heal': 2, 'depth_NN_state': 3, 'mode_heal': 60, 'mode_state': 60, 'blocks_heal': 7, 'blocks_state': 3, 'lift_act_state': <built-in function gelu>, 'block_act_state': <built-in function gelu>, 'lift_act_heal': <built-in function gelu>, 'block_act_heal': None, 'width_heal': 29, 'width_state': 97, 'lr': 0.0016141566154449587, 'padding_heal': 5, 'padding_state': 17, 'optimizer_type': 'lbfgs'}. Best is trial 1511 with value: 0.0009640019852668047.
[I 2025-07-30 23:49:42,792] Trial 2081 finished with value: 0.0023101307451725006 and parameters: {'width_NN_heal': 334, 'width_NN_state': 39, 'depth_NN_heal': 2, 'depth_NN_state': 2, 'mode_heal': 56, 'mode_state': 48, 'blocks_heal': 8, 'blocks_state': 3, 'lift_act_state': <built-in function gelu>, 'block_act_state': <built-in function gelu>, 'lift_act_heal': <built-in function gelu>, 'block_act_heal': None, 'width_heal': 67, 'width_state': 105, 'lr': 0.001449475612609113, 'padding_heal': 3, 'padding_state': 16, 'optimizer_type': 'lbfgs'}. Best is trial 1511 with value: 0.0009640019852668047.
[I 2025-07-30 23:49:47,652] Trial 2082 finished with value: 0.001812619622796774 and parameters: {'width_NN_heal': 378, 'width_NN_state': 354, 'depth_NN_heal': 2, 'depth_NN_state': 3, 'mode_heal': 64, 'mode_state': 36, 'blocks_heal': 7, 'blocks_state': 3, 'lift_act_state': <function tanh at 0x7ff3611b4cc0>, 'block_act_state': <built-in function gelu>, 'lift_act_heal': None, 'block_act_heal': None, 'width_heal': 61, 'width_state': 121, 'lr': 0.0019162869615410058, 'padding_heal': 2, 'padding_state': 18, 'optimizer_type': 'lbfgs'}. Best is trial 1511 with value: 0.0009640019852668047.
[I 2025-07-30 23:49:53,183] Trial 2083 finished with value: 0.0014164160238578916 and parameters: {'width_NN_heal': 416, 'width_NN_state': 321, 'depth_NN_heal': 3, 'depth_NN_state': 3, 'mode_heal': 60, 'mode_state': 64, 'blocks_heal': 8, 'blocks_state': 3, 'lift_act_state': <built-in function gelu>, 'block_act_state': <built-in function gelu>, 'lift_act_heal': <built-in function gelu>, 'block_act_heal': <built-in function gelu>, 'width_heal': 34, 'width_state': 81, 'lr': 0.00136267313275023, 'padding_heal': 5, 'padding_state': 17, 'optimizer_type': 'lbfgs'}. Best is trial 1511 with value: 0.0009640019852668047.
[I 2025-07-30 23:49:58,312] Trial 2084 finished with value: 0.0011394823668524623 and parameters: {'width_NN_heal': 277, 'width_NN_state': 250, 'depth_NN_heal': 2, 'depth_NN_state': 3, 'mode_heal': 64, 'mode_state': 52, 'blocks_heal': 7, 'blocks_state': 4, 'lift_act_state': <built-in function gelu>, 'block_act_state': <built-in function gelu>, 'lift_act_heal': <built-in function gelu>, 'block_act_heal': None, 'width_heal': 47, 'width_state': 92, 'lr': 0.00159112612154586, 'padding_heal': 4, 'padding_state': 19, 'optimizer_type': 'lbfgs'}. Best is trial 1511 with value: 0.0009640019852668047.
[I 2025-07-30 23:50:02,956] Trial 2085 finished with value: 0.001564487349241972 and parameters: {'width_NN_heal': 225, 'width_NN_state': 512, 'depth_NN_heal': 2, 'depth_NN_state': 3, 'mode_heal': 60, 'mode_state': 60, 'blocks_heal': 4, 'blocks_state': 3, 'lift_act_state': <built-in function gelu>, 'block_act_state': <function tanh at 0x7ff3611b4cc0>, 'lift_act_heal': <built-in function gelu>, 'block_act_heal': None, 'width_heal': 53, 'width_state': 128, 'lr': 0.0012427257343921882, 'padding_heal': 6, 'padding_state': 15, 'optimizer_type': 'lbfgs'}. Best is trial 1511 with value: 0.0009640019852668047.
[I 2025-07-30 23:50:08,018] Trial 2086 finished with value: 0.001047957339324057 and parameters: {'width_NN_heal': 446, 'width_NN_state': 285, 'depth_NN_heal': 2, 'depth_NN_state': 3, 'mode_heal': 64, 'mode_state': 64, 'blocks_heal': 8, 'blocks_state': 3, 'lift_act_state': <built-in function gelu>, 'block_act_state': <built-in function gelu>, 'lift_act_heal': <built-in function gelu>, 'block_act_heal': None, 'width_heal': 41, 'width_state': 111, 'lr': 0.0023285716054851904, 'padding_heal': 3, 'padding_state': 17, 'optimizer_type': 'lbfgs'}. Best is trial 1511 with value: 0.0009640019852668047.
[I 2025-07-30 23:50:13,011] Trial 2087 finished with value: 0.001273340079933405 and parameters: {'width_NN_heal': 301, 'width_NN_state': 445, 'depth_NN_heal': 2, 'depth_NN_state': 3, 'mode_heal': 60, 'mode_state': 60, 'blocks_heal': 7, 'blocks_state': 3, 'lift_act_state': <built-in function gelu>, 'block_act_state': <built-in function gelu>, 'lift_act_heal': <built-in function gelu>, 'block_act_heal': None, 'width_heal': 37, 'width_state': 101, 'lr': 0.0020808495487151034, 'padding_heal': 5, 'padding_state': 16, 'optimizer_type': 'lbfgs'}. Best is trial 1511 with value: 0.0009640019852668047.
[I 2025-07-30 23:50:17,700] Trial 2088 finished with value: 0.001967765623703599 and parameters: {'width_NN_heal': 21, 'width_NN_state': 335, 'depth_NN_heal': 2, 'depth_NN_state': 3, 'mode_heal': 64, 'mode_state': 64, 'blocks_heal': 7, 'blocks_state': 3, 'lift_act_state': None, 'block_act_state': <built-in function gelu>, 'lift_act_heal': <built-in function gelu>, 'block_act_heal': None, 'width_heal': 31, 'width_state': 88, 'lr': 0.0017704718921876196, 'padding_heal': 4, 'padding_state': 20, 'optimizer_type': 'adam'}. Best is trial 1511 with value: 0.0009640019852668047.
[I 2025-07-30 23:50:22,491] Trial 2089 finished with value: 0.0012735622003674507 and parameters: {'width_NN_heal': 357, 'width_NN_state': 395, 'depth_NN_heal': 1, 'depth_NN_state': 3, 'mode_heal': 56, 'mode_state': 56, 'blocks_heal': 7, 'blocks_state': 3, 'lift_act_state': <built-in function gelu>, 'block_act_state': <built-in function gelu>, 'lift_act_heal': <built-in function gelu>, 'block_act_heal': None, 'width_heal': 58, 'width_state': 115, 'lr': 0.0027125282203200613, 'padding_heal': 5, 'padding_state': 18, 'optimizer_type': 'lbfgs'}. Best is trial 1511 with value: 0.0009640019852668047.
[I 2025-07-30 23:50:27,540] Trial 2090 finished with value: 0.0011635589180514216 and parameters: {'width_NN_heal': 397, 'width_NN_state': 267, 'depth_NN_heal': 2, 'depth_NN_state': 3, 'mode_heal': 60, 'mode_state': 60, 'blocks_heal': 8, 'blocks_state': 3, 'lift_act_state': <built-in function gelu>, 'block_act_state': <built-in function gelu>, 'lift_act_heal': <built-in function gelu>, 'block_act_heal': None, 'width_heal': 50, 'width_state': 103, 'lr': 0.0015423726573285945, 'padding_heal': 3, 'padding_state': 17, 'optimizer_type': 'lbfgs'}. Best is trial 1511 with value: 0.0009640019852668047.
[I 2025-07-30 23:50:32,266] Trial 2091 finished with value: 0.001223851926624775 and parameters: {'width_NN_heal': 476, 'width_NN_state': 302, 'depth_NN_heal': 2, 'depth_NN_state': 3, 'mode_heal': 64, 'mode_state': 64, 'blocks_heal': 7, 'blocks_state': 2, 'lift_act_state': <built-in function gelu>, 'block_act_state': <built-in function gelu>, 'lift_act_heal': <built-in function gelu>, 'block_act_heal': None, 'width_heal': 44, 'width_state': 23, 'lr': 0.0013702289632660882, 'padding_heal': 4, 'padding_state': 19, 'optimizer_type': 'lbfgs'}. Best is trial 1511 with value: 0.0009640019852668047.
[I 2025-07-30 23:50:37,103] Trial 2092 finished with value: 0.0018342856783419847 and parameters: {'width_NN_heal': 197, 'width_NN_state': 369, 'depth_NN_heal': 3, 'depth_NN_state': 3, 'mode_heal': 60, 'mode_state': 52, 'blocks_heal': 7, 'blocks_state': 3, 'lift_act_state': <built-in function gelu>, 'block_act_state': None, 'lift_act_heal': <built-in function gelu>, 'block_act_heal': None, 'width_heal': 55, 'width_state': 115, 'lr': 0.0018848141187603428, 'padding_heal': 2, 'padding_state': 15, 'optimizer_type': 'lbfgs'}. Best is trial 1511 with value: 0.0009640019852668047.
[I 2025-07-30 23:50:42,269] Trial 2093 finished with value: 0.0011293955612927675 and parameters: {'width_NN_heal': 318, 'width_NN_state': 233, 'depth_NN_heal': 2, 'depth_NN_state': 3, 'mode_heal': 64, 'mode_state': 60, 'blocks_heal': 8, 'blocks_state': 3, 'lift_act_state': <built-in function gelu>, 'block_act_state': <built-in function gelu>, 'lift_act_heal': <built-in function gelu>, 'block_act_heal': None, 'width_heal': 77, 'width_state': 95, 'lr': 0.0017115194412092357, 'padding_heal': 4, 'padding_state': 18, 'optimizer_type': 'lbfgs'}. Best is trial 1511 with value: 0.0009640019852668047.
