[I 2025-07-31 00:14:37,760] Trial 2382 finished with value: 0.0011915744980797172 and parameters: {'width_NN_heal': 471, 'width_NN_state': 326, 'depth_NN_heal': 1, 'depth_NN_state': 3, 'mode_heal': 64, 'mode_state': 60, 'blocks_heal': 4, 'blocks_state': 3, 'lift_act_state': <built-in function gelu>, 'block_act_state': <built-in function gelu>, 'lift_act_heal': <built-in function gelu>, 'block_act_heal': None, 'width_heal': 48, 'width_state': 127, 'lr': 0.001220510336215328, 'padding_heal': 1, 'padding_state': 20, 'optimizer_type': 'lbfgs'}. Best is trial 1511 with value: 0.0009640019852668047.
[I 2025-07-31 00:14:42,146] Trial 2383 finished with value: 0.001266731764189899 and parameters: {'width_NN_heal': 477, 'width_NN_state': 335, 'depth_NN_heal': 2, 'depth_NN_state': 3, 'mode_heal': 64, 'mode_state': 60, 'blocks_heal': 4, 'blocks_state': 3, 'lift_act_state': <built-in function gelu>, 'block_act_state': <built-in function gelu>, 'lift_act_heal': <built-in function gelu>, 'block_act_heal': None, 'width_heal': 54, 'width_state': 128, 'lr': 0.0012352758306650319, 'padding_heal': 1, 'padding_state': 19, 'optimizer_type': 'lbfgs'}. Best is trial 1511 with value: 0.0009640019852668047.
[I 2025-07-31 00:14:46,596] Trial 2384 finished with value: 0.0011610261863097548 and parameters: {'width_NN_heal': 409, 'width_NN_state': 397, 'depth_NN_heal': 2, 'depth_NN_state': 3, 'mode_heal': 64, 'mode_state': 60, 'blocks_heal': 4, 'blocks_state': 2, 'lift_act_state': <built-in function gelu>, 'block_act_state': <built-in function gelu>, 'lift_act_heal': <built-in function gelu>, 'block_act_heal': None, 'width_heal': 51, 'width_state': 128, 'lr': 0.0012981645167011, 'padding_heal': 0, 'padding_state': 19, 'optimizer_type': 'lbfgs'}. Best is trial 1511 with value: 0.0009640019852668047.
[I 2025-07-31 00:14:50,924] Trial 2385 finished with value: 0.0011490262113511562 and parameters: {'width_NN_heal': 442, 'width_NN_state': 354, 'depth_NN_heal': 2, 'depth_NN_state': 3, 'mode_heal': 64, 'mode_state': 60, 'blocks_heal': 4, 'blocks_state': 3, 'lift_act_state': <built-in function gelu>, 'block_act_state': <built-in function gelu>, 'lift_act_heal': <built-in function gelu>, 'block_act_heal': None, 'width_heal': 46, 'width_state': 128, 'lr': 0.0012689160837068903, 'padding_heal': 2, 'padding_state': 20, 'optimizer_type': 'lbfgs'}. Best is trial 1511 with value: 0.0009640019852668047.
[I 2025-07-31 00:14:55,769] Trial 2386 finished with value: 0.0013460014015436172 and parameters: {'width_NN_heal': 405, 'width_NN_state': 343, 'depth_NN_heal': 3, 'depth_NN_state': 3, 'mode_heal': 64, 'mode_state': 60, 'blocks_heal': 4, 'blocks_state': 3, 'lift_act_state': <built-in function gelu>, 'block_act_state': <built-in function gelu>, 'lift_act_heal': <built-in function gelu>, 'block_act_heal': None, 'width_heal': 53, 'width_state': 113, 'lr': 0.0011591606319117966, 'padding_heal': 1, 'padding_state': 19, 'optimizer_type': 'lbfgs'}. Best is trial 1511 with value: 0.0009640019852668047.
[I 2025-07-31 00:15:00,837] Trial 2387 finished with value: 0.0010620710672810674 and parameters: {'width_NN_heal': 482, 'width_NN_state': 374, 'depth_NN_heal': 2, 'depth_NN_state': 3, 'mode_heal': 64, 'mode_state': 60, 'blocks_heal': 6, 'blocks_state': 3, 'lift_act_state': <built-in function gelu>, 'block_act_state': <built-in function gelu>, 'lift_act_heal': <built-in function gelu>, 'block_act_heal': None, 'width_heal': 57, 'width_state': 110, 'lr': 0.0011179421801411882, 'padding_heal': 2, 'padding_state': 19, 'optimizer_type': 'lbfgs'}. Best is trial 1511 with value: 0.0009640019852668047.
[I 2025-07-31 00:15:05,210] Trial 2388 finished with value: 0.0013097140472382307 and parameters: {'width_NN_heal': 410, 'width_NN_state': 340, 'depth_NN_heal': 2, 'depth_NN_state': 3, 'mode_heal': 64, 'mode_state': 60, 'blocks_heal': 4, 'blocks_state': 3, 'lift_act_state': <function tanh at 0x7ff3611b4cc0>, 'block_act_state': <built-in function gelu>, 'lift_act_heal': <built-in function gelu>, 'block_act_heal': None, 'width_heal': 50, 'width_state': 117, 'lr': 0.0013159440132649546, 'padding_heal': 2, 'padding_state': 19, 'optimizer_type': 'adam'}. Best is trial 1511 with value: 0.0009640019852668047.
[I 2025-07-31 00:15:10,063] Trial 2389 finished with value: 0.0010888134129345417 and parameters: {'width_NN_heal': 512, 'width_NN_state': 401, 'depth_NN_heal': 2, 'depth_NN_state': 3, 'mode_heal': 64, 'mode_state': 60, 'blocks_heal': 4, 'blocks_state': 3, 'lift_act_state': <built-in function gelu>, 'block_act_state': <built-in function gelu>, 'lift_act_heal': <built-in function gelu>, 'block_act_heal': None, 'width_heal': 46, 'width_state': 114, 'lr': 0.0013152773542045193, 'padding_heal': 2, 'padding_state': 20, 'optimizer_type': 'lbfgs'}. Best is trial 1511 with value: 0.0009640019852668047.
[I 2025-07-31 00:15:13,505] Trial 2390 finished with value: 0.0011899764649569988 and parameters: {'width_NN_heal': 435, 'width_NN_state': 315, 'depth_NN_heal': 2, 'depth_NN_state': 3, 'mode_heal': 64, 'mode_state': 60, 'blocks_heal': 1, 'blocks_state': 3, 'lift_act_state': <built-in function gelu>, 'block_act_state': <built-in function gelu>, 'lift_act_heal': <built-in function gelu>, 'block_act_heal': None, 'width_heal': 55, 'width_state': 109, 'lr': 0.0013199753084828859, 'padding_heal': 0, 'padding_state': 19, 'optimizer_type': 'lbfgs'}. Best is trial 1511 with value: 0.0009640019852668047.
[I 2025-07-31 00:15:17,327] Trial 2391 finished with value: 0.0014512025518342853 and parameters: {'width_NN_heal': 512, 'width_NN_state': 213, 'depth_NN_heal': 2, 'depth_NN_state': 3, 'mode_heal': 64, 'mode_state': 60, 'blocks_heal': 4, 'blocks_state': 3, 'lift_act_state': <built-in function gelu>, 'block_act_state': <built-in function gelu>, 'lift_act_heal': <built-in function gelu>, 'block_act_heal': None, 'width_heal': 48, 'width_state': 110, 'lr': 0.0013797273848392736, 'padding_heal': 1, 'padding_state': 19, 'optimizer_type': 'lbfgs'}. Best is trial 1511 with value: 0.0009640019852668047.
[I 2025-07-31 00:15:21,644] Trial 2392 finished with value: 0.0018600684124976397 and parameters: {'width_NN_heal': 388, 'width_NN_state': 359, 'depth_NN_heal': 2, 'depth_NN_state': 3, 'mode_heal': 64, 'mode_state': 60, 'blocks_heal': 4, 'blocks_state': 3, 'lift_act_state': <built-in function gelu>, 'block_act_state': <function tanh at 0x7ff3611b4cc0>, 'lift_act_heal': <built-in function gelu>, 'block_act_heal': None, 'width_heal': 56, 'width_state': 128, 'lr': 0.001129738822800164, 'padding_heal': 2, 'padding_state': 18, 'optimizer_type': 'lbfgs'}. Best is trial 1511 with value: 0.0009640019852668047.
[I 2025-07-31 00:15:26,400] Trial 2393 finished with value: 0.001410075114108622 and parameters: {'width_NN_heal': 446, 'width_NN_state': 291, 'depth_NN_heal': 3, 'depth_NN_state': 3, 'mode_heal': 64, 'mode_state': 16, 'blocks_heal': 5, 'blocks_state': 3, 'lift_act_state': <built-in function gelu>, 'block_act_state': <built-in function gelu>, 'lift_act_heal': <built-in function gelu>, 'block_act_heal': None, 'width_heal': 44, 'width_state': 117, 'lr': 0.0014078553524847009, 'padding_heal': 2, 'padding_state': 20, 'optimizer_type': 'lbfgs'}. Best is trial 1511 with value: 0.0009640019852668047.
[I 2025-07-31 00:15:30,688] Trial 2394 finished with value: 0.0014629745855927467 and parameters: {'width_NN_heal': 364, 'width_NN_state': 334, 'depth_NN_heal': 2, 'depth_NN_state': 3, 'mode_heal': 40, 'mode_state': 56, 'blocks_heal': 5, 'blocks_state': 3, 'lift_act_state': <built-in function gelu>, 'block_act_state': <built-in function gelu>, 'lift_act_heal': <built-in function gelu>, 'block_act_heal': None, 'width_heal': 52, 'width_state': 108, 'lr': 0.0010022957934890078, 'padding_heal': 1, 'padding_state': 19, 'optimizer_type': 'lbfgs'}. Best is trial 1511 with value: 0.0009640019852668047.
[I 2025-07-31 00:15:34,951] Trial 2395 finished with value: 0.0015821041306480765 and parameters: {'width_NN_heal': 423, 'width_NN_state': 421, 'depth_NN_heal': 2, 'depth_NN_state': 3, 'mode_heal': 64, 'mode_state': 60, 'blocks_heal': 3, 'blocks_state': 3, 'lift_act_state': None, 'block_act_state': <built-in function gelu>, 'lift_act_heal': <built-in function gelu>, 'block_act_heal': None, 'width_heal': 49, 'width_state': 115, 'lr': 0.0011850137438986846, 'padding_heal': 2, 'padding_state': 18, 'optimizer_type': 'lbfgs'}. Best is trial 1511 with value: 0.0009640019852668047.
[I 2025-07-31 00:15:38,979] Trial 2396 finished with value: 0.0013193243648856878 and parameters: {'width_NN_heal': 383, 'width_NN_state': 316, 'depth_NN_heal': 2, 'depth_NN_state': 3, 'mode_heal': 64, 'mode_state': 60, 'blocks_heal': 4, 'blocks_state': 3, 'lift_act_state': <built-in function gelu>, 'block_act_state': <built-in function gelu>, 'lift_act_heal': <built-in function gelu>, 'block_act_heal': None, 'width_heal': 55, 'width_state': 104, 'lr': 0.0013048816773299483, 'padding_heal': 1, 'padding_state': 18, 'optimizer_type': 'lbfgs'}. Best is trial 1511 with value: 0.0009640019852668047.
[I 2025-07-31 00:15:43,989] Trial 2397 finished with value: 0.0011709132231771946 and parameters: {'width_NN_heal': 470, 'width_NN_state': 374, 'depth_NN_heal': 2, 'depth_NN_state': 3, 'mode_heal': 64, 'mode_state': 56, 'blocks_heal': 6, 'blocks_state': 3, 'lift_act_state': <built-in function gelu>, 'block_act_state': <built-in function gelu>, 'lift_act_heal': <built-in function gelu>, 'block_act_heal': None, 'width_heal': 60, 'width_state': 120, 'lr': 0.00142826435836755, 'padding_heal': 2, 'padding_state': 19, 'optimizer_type': 'lbfgs'}. Best is trial 1511 with value: 0.0009640019852668047.
[I 2025-07-31 00:15:48,228] Trial 2398 finished with value: 0.0012727302964776754 and parameters: {'width_NN_heal': 445, 'width_NN_state': 265, 'depth_NN_heal': 2, 'depth_NN_state': 3, 'mode_heal': 64, 'mode_state': 60, 'blocks_heal': 4, 'blocks_state': 4, 'lift_act_state': <built-in function gelu>, 'block_act_state': <built-in function gelu>, 'lift_act_heal': <built-in function gelu>, 'block_act_heal': None, 'width_heal': 44, 'width_state': 107, 'lr': 0.0010201393549873605, 'padding_heal': 2, 'padding_state': 18, 'optimizer_type': 'lbfgs'}. Best is trial 1511 with value: 0.0009640019852668047.
[I 2025-07-31 00:15:52,069] Trial 2399 finished with value: 0.0012409586925059557 and parameters: {'width_NN_heal': 337, 'width_NN_state': 297, 'depth_NN_heal': 2, 'depth_NN_state': 3, 'mode_heal': 48, 'mode_state': 60, 'blocks_heal': 4, 'blocks_state': 3, 'lift_act_state': <built-in function gelu>, 'block_act_state': <built-in function gelu>, 'lift_act_heal': <built-in function gelu>, 'block_act_heal': None, 'width_heal': 51, 'width_state': 10, 'lr': 0.0013998819633786342, 'padding_heal': 2, 'padding_state': 20, 'optimizer_type': 'lbfgs'}. Best is trial 1511 with value: 0.0009640019852668047.
[I 2025-07-31 00:15:56,381] Trial 2400 finished with value: 0.0018533087568357587 and parameters: {'width_NN_heal': 390, 'width_NN_state': 337, 'depth_NN_heal': 2, 'depth_NN_state': 3, 'mode_heal': 64, 'mode_state': 56, 'blocks_heal': 5, 'blocks_state': 3, 'lift_act_state': <built-in function gelu>, 'block_act_state': None, 'lift_act_heal': <built-in function gelu>, 'block_act_heal': None, 'width_heal': 47, 'width_state': 117, 'lr': 0.0012472045650054806, 'padding_heal': 3, 'padding_state': 18, 'optimizer_type': 'lbfgs'}. Best is trial 1511 with value: 0.0009640019852668047.
[I 2025-07-31 00:16:00,854] Trial 2401 finished with value: 0.0012370939366519451 and parameters: {'width_NN_heal': 408, 'width_NN_state': 276, 'depth_NN_heal': 1, 'depth_NN_state': 3, 'mode_heal': 64, 'mode_state': 60, 'blocks_heal': 7, 'blocks_state': 3, 'lift_act_state': <built-in function gelu>, 'block_act_state': <built-in function gelu>, 'lift_act_heal': <built-in function gelu>, 'block_act_heal': None, 'width_heal': 55, 'width_state': 108, 'lr': 0.0014428672769799076, 'padding_heal': 29, 'padding_state': 19, 'optimizer_type': 'lbfgs'}. Best is trial 1511 with value: 0.0009640019852668047.
[I 2025-07-31 00:16:04,468] Trial 2402 finished with value: 0.0019440263276919723 and parameters: {'width_NN_heal': 357, 'width_NN_state': 49, 'depth_NN_heal': 2, 'depth_NN_state': 3, 'mode_heal': 64, 'mode_state': 60, 'blocks_heal': 4, 'blocks_state': 3, 'lift_act_state': <built-in function gelu>, 'block_act_state': <built-in function gelu>, 'lift_act_heal': <built-in function gelu>, 'block_act_heal': None, 'width_heal': 60, 'width_state': 119, 'lr': 0.001296097395024806, 'padding_heal': 1, 'padding_state': 18, 'optimizer_type': 'lbfgs'}. Best is trial 1511 with value: 0.0009640019852668047.
[I 2025-07-31 00:16:11,608] Trial 2403 finished with value: 0.018399987369775772 and parameters: {'width_NN_heal': 450, 'width_NN_state': 386, 'depth_NN_heal': 2, 'depth_NN_state': 7, 'mode_heal': 64, 'mode_state': 60, 'blocks_heal': 4, 'blocks_state': 3, 'lift_act_state': <built-in function gelu>, 'block_act_state': <built-in function gelu>, 'lift_act_heal': <built-in function gelu>, 'block_act_heal': None, 'width_heal': 4, 'width_state': 106, 'lr': 0.00112536252503785, 'padding_heal': 3, 'padding_state': 18, 'optimizer_type': 'lbfgs'}. Best is trial 1511 with value: 0.0009640019852668047.
[I 2025-07-31 00:16:15,185] Trial 2404 finished with value: 0.0012016243999823928 and parameters: {'width_NN_heal': 314, 'width_NN_state': 240, 'depth_NN_heal': 2, 'depth_NN_state': 3, 'mode_heal': 12, 'mode_state': 60, 'blocks_heal': 4, 'blocks_state': 3, 'lift_act_state': <built-in function gelu>, 'block_act_state': <built-in function gelu>, 'lift_act_heal': <built-in function gelu>, 'block_act_heal': None, 'width_heal': 42, 'width_state': 114, 'lr': 0.0014060344279658594, 'padding_heal': 0, 'padding_state': 18, 'optimizer_type': 'lbfgs'}. Best is trial 1511 with value: 0.0009640019852668047.
[I 2025-07-31 00:16:19,348] Trial 2405 finished with value: 0.0013047365937381983 and parameters: {'width_NN_heal': 479, 'width_NN_state': 299, 'depth_NN_heal': 2, 'depth_NN_state': 3, 'mode_heal': 64, 'mode_state': 56, 'blocks_heal': 4, 'blocks_state': 3, 'lift_act_state': <built-in function gelu>, 'block_act_state': <built-in function gelu>, 'lift_act_heal': <built-in function gelu>, 'block_act_heal': None, 'width_heal': 52, 'width_state': 120, 'lr': 0.0012289298770168224, 'padding_heal': 2, 'padding_state': 19, 'optimizer_type': 'lbfgs'}. Best is trial 1511 with value: 0.0009640019852668047.
[I 2025-07-31 00:16:24,086] Trial 2406 finished with value: 0.0025816967245191336 and parameters: {'width_NN_heal': 414, 'width_NN_state': 324, 'depth_NN_heal': 3, 'depth_NN_state': 3, 'mode_heal': 64, 'mode_state': 60, 'blocks_heal': 3, 'blocks_state': 3, 'lift_act_state': <built-in function gelu>, 'block_act_state': <built-in function gelu>, 'lift_act_heal': <built-in function gelu>, 'block_act_heal': None, 'width_heal': 63, 'width_state': 103, 'lr': 0.0015115485864725983, 'padding_heal': 3, 'padding_state': 18, 'optimizer_type': 'lbfgs'}. Best is trial 1511 with value: 0.0009640019852668047.
[I 2025-07-31 00:16:27,746] Trial 2407 finished with value: 0.003805608721449971 and parameters: {'width_NN_heal': 367, 'width_NN_state': 15, 'depth_NN_heal': 2, 'depth_NN_state': 3, 'mode_heal': 64, 'mode_state': 56, 'blocks_heal': 5, 'blocks_state': 2, 'lift_act_state': <built-in function gelu>, 'block_act_state': <built-in function gelu>, 'lift_act_heal': <built-in function gelu>, 'block_act_heal': None, 'width_heal': 46, 'width_state': 110, 'lr': 0.0013580966663796269, 'padding_heal': 2, 'padding_state': 19, 'optimizer_type': 'adam'}. Best is trial 1511 with value: 0.0009640019852668047.
[I 2025-07-31 00:16:31,269] Trial 2408 finished with value: 0.00113746989518404 and parameters: {'width_NN_heal': 41, 'width_NN_state': 363, 'depth_NN_heal': 2, 'depth_NN_state': 3, 'mode_heal': 64, 'mode_state': 60, 'blocks_heal': 3, 'blocks_state': 3, 'lift_act_state': <built-in function gelu>, 'block_act_state': <built-in function gelu>, 'lift_act_heal': <built-in function gelu>, 'block_act_heal': None, 'width_heal': 57, 'width_state': 120, 'lr': 0.001504186416795952, 'padding_heal': 3, 'padding_state': 18, 'optimizer_type': 'lbfgs'}. Best is trial 1511 with value: 0.0009640019852668047.
[I 2025-07-31 00:16:35,702] Trial 2409 finished with value: 0.0012923734029754996 and parameters: {'width_NN_heal': 337, 'width_NN_state': 434, 'depth_NN_heal': 2, 'depth_NN_state': 3, 'mode_heal': 64, 'mode_state': 56, 'blocks_heal': 4, 'blocks_state': 3, 'lift_act_state': <built-in function gelu>, 'block_act_state': <built-in function gelu>, 'lift_act_heal': None, 'block_act_heal': None, 'width_heal': 49, 'width_state': 128, 'lr': 0.0011671368265573536, 'padding_heal': 1, 'padding_state': 18, 'optimizer_type': 'lbfgs'}. Best is trial 1511 with value: 0.0009640019852668047.
[I 2025-07-31 00:16:39,528] Trial 2410 finished with value: 0.0013697282411158085 and parameters: {'width_NN_heal': 393, 'width_NN_state': 260, 'depth_NN_heal': 2, 'depth_NN_state': 3, 'mode_heal': 64, 'mode_state': 60, 'blocks_heal': 3, 'blocks_state': 3, 'lift_act_state': <function tanh at 0x7ff3611b4cc0>, 'block_act_state': <built-in function gelu>, 'lift_act_heal': <built-in function gelu>, 'block_act_heal': None, 'width_heal': 54, 'width_state': 103, 'lr': 0.0013427529424381004, 'padding_heal': 3, 'padding_state': 20, 'optimizer_type': 'lbfgs'}. Best is trial 1511 with value: 0.0009640019852668047.
[I 2025-07-31 00:16:43,407] Trial 2411 finished with value: 0.0011364601086825132 and parameters: {'width_NN_heal': 435, 'width_NN_state': 315, 'depth_NN_heal': 2, 'depth_NN_state': 3, 'mode_heal': 60, 'mode_state': 56, 'blocks_heal': 3, 'blocks_state': 3, 'lift_act_state': <built-in function gelu>, 'block_act_state': <built-in function gelu>, 'lift_act_heal': <built-in function gelu>, 'block_act_heal': None, 'width_heal': 43, 'width_state': 128, 'lr': 0.0014764790503022397, 'padding_heal': 2, 'padding_state': 19, 'optimizer_type': 'lbfgs'}. Best is trial 1511 with value: 0.0009640019852668047.
[I 2025-07-31 00:16:48,022] Trial 2412 finished with value: 0.0012682799715548754 and parameters: {'width_NN_heal': 477, 'width_NN_state': 285, 'depth_NN_heal': 3, 'depth_NN_state': 3, 'mode_heal': 64, 'mode_state': 60, 'blocks_heal': 4, 'blocks_state': 3, 'lift_act_state': <built-in function gelu>, 'block_act_state': <built-in function gelu>, 'lift_act_heal': <built-in function gelu>, 'block_act_heal': None, 'width_heal': 39, 'width_state': 114, 'lr': 0.0010397757806902776, 'padding_heal': 3, 'padding_state': 18, 'optimizer_type': 'lbfgs'}. Best is trial 1511 with value: 0.0009640019852668047.
[I 2025-07-31 00:16:52,298] Trial 2413 finished with value: 0.002120589604601264 and parameters: {'width_NN_heal': 365, 'width_NN_state': 350, 'depth_NN_heal': 2, 'depth_NN_state': 3, 'mode_heal': 60, 'mode_state': 60, 'blocks_heal': 4, 'blocks_state': 3, 'lift_act_state': <built-in function gelu>, 'block_act_state': <built-in function gelu>, 'lift_act_heal': <built-in function gelu>, 'block_act_heal': None, 'width_heal': 63, 'width_state': 108, 'lr': 0.00034908398249724353, 'padding_heal': 3, 'padding_state': 19, 'optimizer_type': 'lbfgs'}. Best is trial 1511 with value: 0.0009640019852668047.
[I 2025-07-31 00:16:57,024] Trial 2414 finished with value: 0.0010547265410423279 and parameters: {'width_NN_heal': 11, 'width_NN_state': 387, 'depth_NN_heal': 2, 'depth_NN_state': 3, 'mode_heal': 64, 'mode_state': 56, 'blocks_heal': 7, 'blocks_state': 3, 'lift_act_state': <built-in function gelu>, 'block_act_state': <built-in function gelu>, 'lift_act_heal': <built-in function gelu>, 'block_act_heal': None, 'width_heal': 57, 'width_state': 100, 'lr': 0.0012693501372299744, 'padding_heal': 2, 'padding_state': 18, 'optimizer_type': 'lbfgs'}. Best is trial 1511 with value: 0.0009640019852668047.
[I 2025-07-31 00:17:01,103] Trial 2415 finished with value: 0.0022215121425688267 and parameters: {'width_NN_heal': 300, 'width_NN_state': 332, 'depth_NN_heal': 2, 'depth_NN_state': 3, 'mode_heal': 60, 'mode_state': 60, 'blocks_heal': 4, 'blocks_state': 3, 'lift_act_state': <built-in function gelu>, 'block_act_state': <function tanh at 0x7ff3611b4cc0>, 'lift_act_heal': <built-in function gelu>, 'block_act_heal': <built-in function gelu>, 'width_heal': 51, 'width_state': 112, 'lr': 0.0014885704139481753, 'padding_heal': 3, 'padding_state': 17, 'optimizer_type': 'lbfgs'}. Best is trial 1511 with value: 0.0009640019852668047.
[I 2025-07-31 00:17:05,519] Trial 2416 finished with value: 0.0014505863655358553 and parameters: {'width_NN_heal': 404, 'width_NN_state': 300, 'depth_NN_heal': 2, 'depth_NN_state': 3, 'mode_heal': 64, 'mode_state': 60, 'blocks_heal': 5, 'blocks_state': 4, 'lift_act_state': None, 'block_act_state': <built-in function gelu>, 'lift_act_heal': <built-in function gelu>, 'block_act_heal': None, 'width_heal': 47, 'width_state': 102, 'lr': 0.0011722960212589956, 'padding_heal': 1, 'padding_state': 18, 'optimizer_type': 'lbfgs'}. Best is trial 1511 with value: 0.0009640019852668047.
[I 2025-07-31 00:17:09,393] Trial 2417 finished with value: 0.0012388539034873247 and parameters: {'width_NN_heal': 332, 'width_NN_state': 269, 'depth_NN_heal': 2, 'depth_NN_state': 3, 'mode_heal': 60, 'mode_state': 60, 'blocks_heal': 4, 'blocks_state': 3, 'lift_act_state': <built-in function gelu>, 'block_act_state': <built-in function gelu>, 'lift_act_heal': <built-in function gelu>, 'block_act_heal': None, 'width_heal': 60, 'width_state': 120, 'lr': 0.0015123620148974248, 'padding_heal': 2, 'padding_state': 17, 'optimizer_type': 'lbfgs'}. Best is trial 1511 with value: 0.0009640019852668047.
