[I 2025-07-30 21:41:03,479] Trial 521 finished with value: 0.0016602689865976572 and parameters: {'width_NN_heal': 246, 'width_NN_state': 246, 'depth_NN_heal': 4, 'depth_NN_state': 4, 'mode_heal': 60, 'mode_state': 64, 'blocks_heal': 7, 'blocks_state': 3, 'lift_act_state': <built-in function gelu>, 'block_act_state': <built-in function gelu>, 'lift_act_heal': <function tanh at 0x7ff3611b4cc0>, 'block_act_heal': <function tanh at 0x7ff3611b4cc0>, 'width_heal': 22, 'width_state': 26, 'lr': 0.002188998982459016, 'padding_heal': 5, 'padding_state': 20, 'optimizer_type': 'lbfgs'}. Best is trial 484 with value: 0.0010389797389507294.
[I 2025-07-30 21:41:09,380] Trial 522 finished with value: 0.0012587985256686807 and parameters: {'width_NN_heal': 136, 'width_NN_state': 504, 'depth_NN_heal': 4, 'depth_NN_state': 4, 'mode_heal': 60, 'mode_state': 64, 'blocks_heal': 7, 'blocks_state': 3, 'lift_act_state': <built-in function gelu>, 'block_act_state': <built-in function gelu>, 'lift_act_heal': <function tanh at 0x7ff3611b4cc0>, 'block_act_heal': <function tanh at 0x7ff3611b4cc0>, 'width_heal': 20, 'width_state': 21, 'lr': 0.0016690326385945431, 'padding_heal': 3, 'padding_state': 21, 'optimizer_type': 'lbfgs'}. Best is trial 484 with value: 0.0010389797389507294.
[I 2025-07-30 21:41:14,210] Trial 523 finished with value: 0.002075557829812169 and parameters: {'width_NN_heal': 221, 'width_NN_state': 271, 'depth_NN_heal': 4, 'depth_NN_state': 4, 'mode_heal': 60, 'mode_state': 60, 'blocks_heal': 7, 'blocks_state': 3, 'lift_act_state': <built-in function gelu>, 'block_act_state': None, 'lift_act_heal': <function tanh at 0x7ff3611b4cc0>, 'block_act_heal': <function tanh at 0x7ff3611b4cc0>, 'width_heal': 24, 'width_state': 24, 'lr': 0.00195494646733755, 'padding_heal': 2, 'padding_state': 19, 'optimizer_type': 'lbfgs'}. Best is trial 484 with value: 0.0010389797389507294.
[I 2025-07-30 21:41:19,047] Trial 524 finished with value: 0.001354607054963708 and parameters: {'width_NN_heal': 186, 'width_NN_state': 217, 'depth_NN_heal': 4, 'depth_NN_state': 4, 'mode_heal': 60, 'mode_state': 64, 'blocks_heal': 7, 'blocks_state': 3, 'lift_act_state': <built-in function gelu>, 'block_act_state': <built-in function gelu>, 'lift_act_heal': <function tanh at 0x7ff3611b4cc0>, 'block_act_heal': <function tanh at 0x7ff3611b4cc0>, 'width_heal': 19, 'width_state': 20, 'lr': 0.0025194112524392683, 'padding_heal': 4, 'padding_state': 18, 'optimizer_type': 'lbfgs'}. Best is trial 484 with value: 0.0010389797389507294.
[I 2025-07-30 21:41:23,841] Trial 525 finished with value: 0.001794234849512577 and parameters: {'width_NN_heal': 154, 'width_NN_state': 309, 'depth_NN_heal': 4, 'depth_NN_state': 4, 'mode_heal': 56, 'mode_state': 64, 'blocks_heal': 7, 'blocks_state': 3, 'lift_act_state': <built-in function gelu>, 'block_act_state': <built-in function gelu>, 'lift_act_heal': <function tanh at 0x7ff3611b4cc0>, 'block_act_heal': <function tanh at 0x7ff3611b4cc0>, 'width_heal': 21, 'width_state': 22, 'lr': 0.0021889436479685487, 'padding_heal': 3, 'padding_state': 20, 'optimizer_type': 'lbfgs'}. Best is trial 484 with value: 0.0010389797389507294.
[I 2025-07-30 21:41:29,812] Trial 526 finished with value: 0.0013774445978924632 and parameters: {'width_NN_heal': 174, 'width_NN_state': 452, 'depth_NN_heal': 5, 'depth_NN_state': 4, 'mode_heal': 60, 'mode_state': 64, 'blocks_heal': 7, 'blocks_state': 3, 'lift_act_state': <built-in function gelu>, 'block_act_state': <built-in function gelu>, 'lift_act_heal': <function tanh at 0x7ff3611b4cc0>, 'block_act_heal': <function tanh at 0x7ff3611b4cc0>, 'width_heal': 19, 'width_state': 25, 'lr': 0.0024503744424579136, 'padding_heal': 3, 'padding_state': 21, 'optimizer_type': 'lbfgs'}. Best is trial 484 with value: 0.0010389797389507294.
[I 2025-07-30 21:41:35,187] Trial 527 finished with value: 0.001391270780004561 and parameters: {'width_NN_heal': 266, 'width_NN_state': 362, 'depth_NN_heal': 4, 'depth_NN_state': 4, 'mode_heal': 60, 'mode_state': 64, 'blocks_heal': 7, 'blocks_state': 3, 'lift_act_state': <built-in function gelu>, 'block_act_state': <built-in function gelu>, 'lift_act_heal': <function tanh at 0x7ff3611b4cc0>, 'block_act_heal': <function tanh at 0x7ff3611b4cc0>, 'width_heal': 17, 'width_state': 28, 'lr': 0.002592618770140323, 'padding_heal': 2, 'padding_state': 19, 'optimizer_type': 'lbfgs'}. Best is trial 484 with value: 0.0010389797389507294.
[I 2025-07-30 21:41:39,871] Trial 528 finished with value: 0.0012427099281921983 and parameters: {'width_NN_heal': 133, 'width_NN_state': 228, 'depth_NN_heal': 3, 'depth_NN_state': 4, 'mode_heal': 64, 'mode_state': 64, 'blocks_heal': 7, 'blocks_state': 3, 'lift_act_state': <built-in function gelu>, 'block_act_state': <built-in function gelu>, 'lift_act_heal': <function tanh at 0x7ff3611b4cc0>, 'block_act_heal': <function tanh at 0x7ff3611b4cc0>, 'width_heal': 22, 'width_state': 23, 'lr': 0.002032064926093236, 'padding_heal': 5, 'padding_state': 21, 'optimizer_type': 'lbfgs'}. Best is trial 484 with value: 0.0010389797389507294.
[I 2025-07-30 21:41:44,704] Trial 529 finished with value: 0.0012800664408132434 and parameters: {'width_NN_heal': 211, 'width_NN_state': 259, 'depth_NN_heal': 5, 'depth_NN_state': 4, 'mode_heal': 60, 'mode_state': 64, 'blocks_heal': 7, 'blocks_state': 3, 'lift_act_state': <built-in function gelu>, 'block_act_state': <built-in function gelu>, 'lift_act_heal': <function tanh at 0x7ff3611b4cc0>, 'block_act_heal': <function tanh at 0x7ff3611b4cc0>, 'width_heal': 16, 'width_state': 20, 'lr': 0.0022989465730958417, 'padding_heal': 3, 'padding_state': 18, 'optimizer_type': 'lbfgs'}. Best is trial 484 with value: 0.0010389797389507294.
[I 2025-07-30 21:41:50,404] Trial 530 finished with value: 0.001407261355780065 and parameters: {'width_NN_heal': 302, 'width_NN_state': 335, 'depth_NN_heal': 5, 'depth_NN_state': 4, 'mode_heal': 64, 'mode_state': 60, 'blocks_heal': 7, 'blocks_state': 3, 'lift_act_state': <built-in function gelu>, 'block_act_state': <built-in function gelu>, 'lift_act_heal': <function tanh at 0x7ff3611b4cc0>, 'block_act_heal': <function tanh at 0x7ff3611b4cc0>, 'width_heal': 20, 'width_state': 22, 'lr': 0.0025892676485995097, 'padding_heal': 4, 'padding_state': 19, 'optimizer_type': 'lbfgs'}. Best is trial 484 with value: 0.0010389797389507294.
[I 2025-07-30 21:41:56,061] Trial 531 finished with value: 0.0014690619427710772 and parameters: {'width_NN_heal': 151, 'width_NN_state': 413, 'depth_NN_heal': 5, 'depth_NN_state': 4, 'mode_heal': 64, 'mode_state': 40, 'blocks_heal': 7, 'blocks_state': 3, 'lift_act_state': <built-in function gelu>, 'block_act_state': <built-in function gelu>, 'lift_act_heal': <function tanh at 0x7ff3611b4cc0>, 'block_act_heal': <function tanh at 0x7ff3611b4cc0>, 'width_heal': 18, 'width_state': 26, 'lr': 0.0022593199275183816, 'padding_heal': 2, 'padding_state': 20, 'optimizer_type': 'lbfgs'}. Best is trial 484 with value: 0.0010389797389507294.
[I 2025-07-30 21:42:00,872] Trial 532 finished with value: 0.0012206012615934014 and parameters: {'width_NN_heal': 183, 'width_NN_state': 288, 'depth_NN_heal': 4, 'depth_NN_state': 4, 'mode_heal': 60, 'mode_state': 64, 'blocks_heal': 7, 'blocks_state': 3, 'lift_act_state': <built-in function gelu>, 'block_act_state': <built-in function gelu>, 'lift_act_heal': <function tanh at 0x7ff3611b4cc0>, 'block_act_heal': <function tanh at 0x7ff3611b4cc0>, 'width_heal': 23, 'width_state': 30, 'lr': 0.0025658226329750193, 'padding_heal': 5, 'padding_state': 21, 'optimizer_type': 'lbfgs'}. Best is trial 484 with value: 0.0010389797389507294.
[I 2025-07-30 21:42:05,710] Trial 533 finished with value: 0.0011142281582579017 and parameters: {'width_NN_heal': 179, 'width_NN_state': 291, 'depth_NN_heal': 4, 'depth_NN_state': 4, 'mode_heal': 60, 'mode_state': 64, 'blocks_heal': 7, 'blocks_state': 3, 'lift_act_state': <built-in function gelu>, 'block_act_state': <built-in function gelu>, 'lift_act_heal': <function tanh at 0x7ff3611b4cc0>, 'block_act_heal': <function tanh at 0x7ff3611b4cc0>, 'width_heal': 26, 'width_state': 30, 'lr': 0.002405936023091152, 'padding_heal': 5, 'padding_state': 21, 'optimizer_type': 'lbfgs'}. Best is trial 484 with value: 0.0010389797389507294.
[I 2025-07-30 21:42:10,485] Trial 534 finished with value: 0.0035090206656605005 and parameters: {'width_NN_heal': 186, 'width_NN_state': 291, 'depth_NN_heal': 4, 'depth_NN_state': 4, 'mode_heal': 60, 'mode_state': 32, 'blocks_heal': 7, 'blocks_state': 3, 'lift_act_state': <built-in function gelu>, 'block_act_state': <built-in function gelu>, 'lift_act_heal': <function tanh at 0x7ff3611b4cc0>, 'block_act_heal': None, 'width_heal': 27, 'width_state': 32, 'lr': 0.0023851344442545204, 'padding_heal': 6, 'padding_state': 21, 'optimizer_type': 'lbfgs'}. Best is trial 484 with value: 0.0010389797389507294.
[I 2025-07-30 21:42:15,351] Trial 535 finished with value: 0.0011082282289862633 and parameters: {'width_NN_heal': 199, 'width_NN_state': 270, 'depth_NN_heal': 4, 'depth_NN_state': 4, 'mode_heal': 56, 'mode_state': 64, 'blocks_heal': 7, 'blocks_state': 3, 'lift_act_state': <built-in function gelu>, 'block_act_state': <built-in function gelu>, 'lift_act_heal': <function tanh at 0x7ff3611b4cc0>, 'block_act_heal': <function tanh at 0x7ff3611b4cc0>, 'width_heal': 27, 'width_state': 30, 'lr': 0.0025737329324055673, 'padding_heal': 4, 'padding_state': 21, 'optimizer_type': 'lbfgs'}. Best is trial 484 with value: 0.0010389797389507294.
[I 2025-07-30 21:42:20,133] Trial 536 finished with value: 0.0011333463480696082 and parameters: {'width_NN_heal': 174, 'width_NN_state': 310, 'depth_NN_heal': 4, 'depth_NN_state': 4, 'mode_heal': 56, 'mode_state': 64, 'blocks_heal': 7, 'blocks_state': 3, 'lift_act_state': <built-in function gelu>, 'block_act_state': <built-in function gelu>, 'lift_act_heal': <function tanh at 0x7ff3611b4cc0>, 'block_act_heal': <function tanh at 0x7ff3611b4cc0>, 'width_heal': 22, 'width_state': 31, 'lr': 0.002621959721408479, 'padding_heal': 5, 'padding_state': 21, 'optimizer_type': 'lbfgs'}. Best is trial 484 with value: 0.0010389797389507294.
[I 2025-07-30 21:42:25,717] Trial 537 finished with value: 0.002136681694537401 and parameters: {'width_NN_heal': 378, 'width_NN_state': 325, 'depth_NN_heal': 4, 'depth_NN_state': 4, 'mode_heal': 64, 'mode_state': 60, 'blocks_heal': 7, 'blocks_state': 2, 'lift_act_state': <built-in function gelu>, 'block_act_state': <built-in function gelu>, 'lift_act_heal': <function tanh at 0x7ff3611b4cc0>, 'block_act_heal': <function tanh at 0x7ff3611b4cc0>, 'width_heal': 26, 'width_state': 30, 'lr': 0.0027101252969222583, 'padding_heal': 5, 'padding_state': 21, 'optimizer_type': 'lbfgs'}. Best is trial 484 with value: 0.0010389797389507294.
[I 2025-07-30 21:42:30,592] Trial 538 finished with value: 0.0012107541551813483 and parameters: {'width_NN_heal': 166, 'width_NN_state': 274, 'depth_NN_heal': 4, 'depth_NN_state': 4, 'mode_heal': 56, 'mode_state': 64, 'blocks_heal': 7, 'blocks_state': 3, 'lift_act_state': <built-in function gelu>, 'block_act_state': <built-in function gelu>, 'lift_act_heal': <function tanh at 0x7ff3611b4cc0>, 'block_act_heal': <function tanh at 0x7ff3611b4cc0>, 'width_heal': 29, 'width_state': 34, 'lr': 0.0025747178692944596, 'padding_heal': 1, 'padding_state': 20, 'optimizer_type': 'lbfgs'}. Best is trial 484 with value: 0.0010389797389507294.
[I 2025-07-30 21:42:35,385] Trial 539 finished with value: 0.0011255362769588828 and parameters: {'width_NN_heal': 198, 'width_NN_state': 303, 'depth_NN_heal': 4, 'depth_NN_state': 4, 'mode_heal': 56, 'mode_state': 64, 'blocks_heal': 7, 'blocks_state': 3, 'lift_act_state': <built-in function gelu>, 'block_act_state': <built-in function gelu>, 'lift_act_heal': <function tanh at 0x7ff3611b4cc0>, 'block_act_heal': <function tanh at 0x7ff3611b4cc0>, 'width_heal': 28, 'width_state': 31, 'lr': 0.00248814284222976, 'padding_heal': 1, 'padding_state': 20, 'optimizer_type': 'lbfgs'}. Best is trial 484 with value: 0.0010389797389507294.
[I 2025-07-30 21:42:40,210] Trial 540 finished with value: 0.0014910573372617364 and parameters: {'width_NN_heal': 200, 'width_NN_state': 306, 'depth_NN_heal': 4, 'depth_NN_state': 4, 'mode_heal': 56, 'mode_state': 60, 'blocks_heal': 7, 'blocks_state': 3, 'lift_act_state': <built-in function gelu>, 'block_act_state': <built-in function gelu>, 'lift_act_heal': <function tanh at 0x7ff3611b4cc0>, 'block_act_heal': <function tanh at 0x7ff3611b4cc0>, 'width_heal': 28, 'width_state': 32, 'lr': 0.0023946451870399074, 'padding_heal': 1, 'padding_state': 20, 'optimizer_type': 'lbfgs'}. Best is trial 484 with value: 0.0010389797389507294.
[I 2025-07-30 21:42:45,398] Trial 541 finished with value: 0.0011863039107993245 and parameters: {'width_NN_heal': 218, 'width_NN_state': 340, 'depth_NN_heal': 4, 'depth_NN_state': 4, 'mode_heal': 56, 'mode_state': 64, 'blocks_heal': 7, 'blocks_state': 3, 'lift_act_state': <built-in function gelu>, 'block_act_state': <built-in function gelu>, 'lift_act_heal': <function tanh at 0x7ff3611b4cc0>, 'block_act_heal': <function tanh at 0x7ff3611b4cc0>, 'width_heal': 28, 'width_state': 29, 'lr': 0.0026482507060799254, 'padding_heal': 2, 'padding_state': 20, 'optimizer_type': 'lbfgs'}. Best is trial 484 with value: 0.0010389797389507294.
[I 2025-07-30 21:42:50,451] Trial 542 finished with value: 0.0017480704700574279 and parameters: {'width_NN_heal': 225, 'width_NN_state': 321, 'depth_NN_heal': 4, 'depth_NN_state': 4, 'mode_heal': 56, 'mode_state': 64, 'blocks_heal': 7, 'blocks_state': 3, 'lift_act_state': <built-in function gelu>, 'block_act_state': None, 'lift_act_heal': <function tanh at 0x7ff3611b4cc0>, 'block_act_heal': <function tanh at 0x7ff3611b4cc0>, 'width_heal': 27, 'width_state': 34, 'lr': 0.002454061050239094, 'padding_heal': 6, 'padding_state': 20, 'optimizer_type': 'lbfgs'}. Best is trial 484 with value: 0.0010389797389507294.
[I 2025-07-30 21:42:55,522] Trial 543 finished with value: 0.020074225962162018 and parameters: {'width_NN_heal': 203, 'width_NN_state': 345, 'depth_NN_heal': 4, 'depth_NN_state': 4, 'mode_heal': 56, 'mode_state': 64, 'blocks_heal': 7, 'blocks_state': 3, 'lift_act_state': <built-in function gelu>, 'block_act_state': <built-in function gelu>, 'lift_act_heal': <function tanh at 0x7ff3611b4cc0>, 'block_act_heal': <function tanh at 0x7ff3611b4cc0>, 'width_heal': 25, 'width_state': 28, 'lr': 0.0001006840180818807, 'padding_heal': 1, 'padding_state': 19, 'optimizer_type': 'lbfgs'}. Best is trial 484 with value: 0.0010389797389507294.
[I 2025-07-30 21:43:00,409] Trial 544 finished with value: 0.0015253223245963454 and parameters: {'width_NN_heal': 214, 'width_NN_state': 302, 'depth_NN_heal': 4, 'depth_NN_state': 4, 'mode_heal': 56, 'mode_state': 64, 'blocks_heal': 7, 'blocks_state': 3, 'lift_act_state': <built-in function gelu>, 'block_act_state': <built-in function gelu>, 'lift_act_heal': <function tanh at 0x7ff3611b4cc0>, 'block_act_heal': <function tanh at 0x7ff3611b4cc0>, 'width_heal': 29, 'width_state': 31, 'lr': 0.002638427253323181, 'padding_heal': 2, 'padding_state': 20, 'optimizer_type': 'lbfgs'}. Best is trial 484 with value: 0.0010389797389507294.
[I 2025-07-30 21:43:05,410] Trial 545 finished with value: 0.0012036215048283339 and parameters: {'width_NN_heal': 196, 'width_NN_state': 375, 'depth_NN_heal': 3, 'depth_NN_state': 4, 'mode_heal': 56, 'mode_state': 64, 'blocks_heal': 7, 'blocks_state': 2, 'lift_act_state': <built-in function gelu>, 'block_act_state': <built-in function gelu>, 'lift_act_heal': <function tanh at 0x7ff3611b4cc0>, 'block_act_heal': <function tanh at 0x7ff3611b4cc0>, 'width_heal': 26, 'width_state': 29, 'lr': 0.002356864596619974, 'padding_heal': 4, 'padding_state': 19, 'optimizer_type': 'lbfgs'}. Best is trial 484 with value: 0.0010389797389507294.
[I 2025-07-30 21:43:10,303] Trial 546 finished with value: 0.0016477672616019845 and parameters: {'width_NN_heal': 195, 'width_NN_state': 358, 'depth_NN_heal': 3, 'depth_NN_state': 4, 'mode_heal': 56, 'mode_state': 64, 'blocks_heal': 7, 'blocks_state': 2, 'lift_act_state': <built-in function gelu>, 'block_act_state': <built-in function gelu>, 'lift_act_heal': <function tanh at 0x7ff3611b4cc0>, 'block_act_heal': <function tanh at 0x7ff3611b4cc0>, 'width_heal': 28, 'width_state': 30, 'lr': 0.0020131239084944423, 'padding_heal': 4, 'padding_state': 19, 'optimizer_type': 'lbfgs'}. Best is trial 484 with value: 0.0010389797389507294.
[I 2025-07-30 21:43:15,166] Trial 547 finished with value: 0.0019358056597411633 and parameters: {'width_NN_heal': 231, 'width_NN_state': 382, 'depth_NN_heal': 3, 'depth_NN_state': 4, 'mode_heal': 56, 'mode_state': 64, 'blocks_heal': 7, 'blocks_state': 1, 'lift_act_state': <built-in function gelu>, 'block_act_state': <built-in function gelu>, 'lift_act_heal': <function tanh at 0x7ff3611b4cc0>, 'block_act_heal': <function tanh at 0x7ff3611b4cc0>, 'width_heal': 27, 'width_state': 37, 'lr': 0.002305822023200458, 'padding_heal': 6, 'padding_state': 19, 'optimizer_type': 'lbfgs'}. Best is trial 484 with value: 0.0010389797389507294.
[I 2025-07-30 21:43:20,169] Trial 548 finished with value: 0.001344457850791514 and parameters: {'width_NN_heal': 180, 'width_NN_state': 332, 'depth_NN_heal': 3, 'depth_NN_state': 4, 'mode_heal': 56, 'mode_state': 64, 'blocks_heal': 7, 'blocks_state': 3, 'lift_act_state': <built-in function gelu>, 'block_act_state': <built-in function gelu>, 'lift_act_heal': <function tanh at 0x7ff3611b4cc0>, 'block_act_heal': <function tanh at 0x7ff3611b4cc0>, 'width_heal': 31, 'width_state': 28, 'lr': 0.002068567817604345, 'padding_heal': 5, 'padding_state': 21, 'optimizer_type': 'lbfgs'}. Best is trial 484 with value: 0.0010389797389507294.
[I 2025-07-30 21:43:25,838] Trial 549 finished with value: 0.0012604614021256566 and parameters: {'width_NN_heal': 216, 'width_NN_state': 396, 'depth_NN_heal': 3, 'depth_NN_state': 4, 'mode_heal': 56, 'mode_state': 60, 'blocks_heal': 7, 'blocks_state': 2, 'lift_act_state': <built-in function gelu>, 'block_act_state': <built-in function gelu>, 'lift_act_heal': <function tanh at 0x7ff3611b4cc0>, 'block_act_heal': <function tanh at 0x7ff3611b4cc0>, 'width_heal': 25, 'width_state': 33, 'lr': 0.002357995972254113, 'padding_heal': 4, 'padding_state': 21, 'optimizer_type': 'lbfgs'}. Best is trial 484 with value: 0.0010389797389507294.
[I 2025-07-30 21:43:30,115] Trial 550 finished with value: 0.00202588620595634 and parameters: {'width_NN_heal': 202, 'width_NN_state': 279, 'depth_NN_heal': 4, 'depth_NN_state': 4, 'mode_heal': 56, 'mode_state': 64, 'blocks_heal': 7, 'blocks_state': 1, 'lift_act_state': <built-in function gelu>, 'block_act_state': <built-in function gelu>, 'lift_act_heal': <function tanh at 0x7ff3611b4cc0>, 'block_act_heal': <function tanh at 0x7ff3611b4cc0>, 'width_heal': 26, 'width_state': 31, 'lr': 0.002541383494404921, 'padding_heal': 5, 'padding_state': 8, 'optimizer_type': 'lbfgs'}. Best is trial 484 with value: 0.0010389797389507294.
[I 2025-07-30 21:43:34,657] Trial 551 finished with value: 0.0013324700994417071 and parameters: {'width_NN_heal': 174, 'width_NN_state': 306, 'depth_NN_heal': 4, 'depth_NN_state': 4, 'mode_heal': 56, 'mode_state': 64, 'blocks_heal': 7, 'blocks_state': 2, 'lift_act_state': <built-in function gelu>, 'block_act_state': <built-in function gelu>, 'lift_act_heal': <function tanh at 0x7ff3611b4cc0>, 'block_act_heal': <function tanh at 0x7ff3611b4cc0>, 'width_heal': 29, 'width_state': 28, 'lr': 0.0018378925564165394, 'padding_heal': 1, 'padding_state': 20, 'optimizer_type': 'lbfgs'}. Best is trial 484 with value: 0.0010389797389507294.
[I 2025-07-30 21:43:40,429] Trial 552 finished with value: 0.0021798904053866863 and parameters: {'width_NN_heal': 356, 'width_NN_state': 360, 'depth_NN_heal': 4, 'depth_NN_state': 4, 'mode_heal': 56, 'mode_state': 60, 'blocks_heal': 7, 'blocks_state': 2, 'lift_act_state': <built-in function gelu>, 'block_act_state': <built-in function gelu>, 'lift_act_heal': <function tanh at 0x7ff3611b4cc0>, 'block_act_heal': <function tanh at 0x7ff3611b4cc0>, 'width_heal': 24, 'width_state': 29, 'lr': 0.00219757071946079, 'padding_heal': 2, 'padding_state': 19, 'optimizer_type': 'lbfgs'}. Best is trial 484 with value: 0.0010389797389507294.
[I 2025-07-30 21:43:46,219] Trial 553 finished with value: 0.015919404104351997 and parameters: {'width_NN_heal': 254, 'width_NN_state': 338, 'depth_NN_heal': 4, 'depth_NN_state': 5, 'mode_heal': 52, 'mode_state': 64, 'blocks_heal': 7, 'blocks_state': 3, 'lift_act_state': <built-in function gelu>, 'block_act_state': <built-in function gelu>, 'lift_act_heal': <function tanh at 0x7ff3611b4cc0>, 'block_act_heal': <function tanh at 0x7ff3611b4cc0>, 'width_heal': 26, 'width_state': 34, 'lr': 0.0004263019608805807, 'padding_heal': 4, 'padding_state': 21, 'optimizer_type': 'lbfgs'}. Best is trial 484 with value: 0.0010389797389507294.
[I 2025-07-30 21:43:51,085] Trial 554 finished with value: 0.0011277783196419477 and parameters: {'width_NN_heal': 197, 'width_NN_state': 265, 'depth_NN_heal': 4, 'depth_NN_state': 4, 'mode_heal': 56, 'mode_state': 64, 'blocks_heal': 7, 'blocks_state': 3, 'lift_act_state': <built-in function gelu>, 'block_act_state': <built-in function gelu>, 'lift_act_heal': <function tanh at 0x7ff3611b4cc0>, 'block_act_heal': <function tanh at 0x7ff3611b4cc0>, 'width_heal': 24, 'width_state': 27, 'lr': 0.002467415641517977, 'padding_heal': 4, 'padding_state': 20, 'optimizer_type': 'lbfgs'}. Best is trial 484 with value: 0.0010389797389507294.
