[I 2025-07-30 22:03:31,742] Trial 798 finished with value: 0.0020263069309294224 and parameters: {'width_NN_heal': 211, 'width_NN_state': 357, 'depth_NN_heal': 3, 'depth_NN_state': 3, 'mode_heal': 60, 'mode_state': 64, 'blocks_heal': 7, 'blocks_state': 1, 'lift_act_state': <built-in function gelu>, 'block_act_state': <built-in function gelu>, 'lift_act_heal': <function tanh at 0x7ff3611b4cc0>, 'block_act_heal': None, 'width_heal': 33, 'width_state': 27, 'lr': 0.001190955720154571, 'padding_heal': 8, 'padding_state': 16, 'optimizer_type': 'lbfgs'}. Best is trial 771 with value: 0.0010052043944597244.
[I 2025-07-30 22:03:36,384] Trial 799 finished with value: 0.0010671167401596904 and parameters: {'width_NN_heal': 237, 'width_NN_state': 338, 'depth_NN_heal': 3, 'depth_NN_state': 3, 'mode_heal': 60, 'mode_state': 64, 'blocks_heal': 7, 'blocks_state': 3, 'lift_act_state': <built-in function gelu>, 'block_act_state': <built-in function gelu>, 'lift_act_heal': <function tanh at 0x7ff3611b4cc0>, 'block_act_heal': None, 'width_heal': 40, 'width_state': 26, 'lr': 0.001567420556562075, 'padding_heal': 8, 'padding_state': 17, 'optimizer_type': 'lbfgs'}. Best is trial 771 with value: 0.0010052043944597244.
[I 2025-07-30 22:03:41,066] Trial 800 finished with value: 0.0014558864058926702 and parameters: {'width_NN_heal': 194, 'width_NN_state': 375, 'depth_NN_heal': 3, 'depth_NN_state': 3, 'mode_heal': 60, 'mode_state': 64, 'blocks_heal': 7, 'blocks_state': 3, 'lift_act_state': <built-in function gelu>, 'block_act_state': <built-in function gelu>, 'lift_act_heal': <function tanh at 0x7ff3611b4cc0>, 'block_act_heal': None, 'width_heal': 31, 'width_state': 28, 'lr': 0.0016056863669846179, 'padding_heal': 7, 'padding_state': 17, 'optimizer_type': 'lbfgs'}. Best is trial 771 with value: 0.0010052043944597244.
[I 2025-07-30 22:03:46,210] Trial 801 finished with value: 0.0011183691676706076 and parameters: {'width_NN_heal': 252, 'width_NN_state': 411, 'depth_NN_heal': 3, 'depth_NN_state': 3, 'mode_heal': 60, 'mode_state': 64, 'blocks_heal': 7, 'blocks_state': 3, 'lift_act_state': <built-in function gelu>, 'block_act_state': <built-in function gelu>, 'lift_act_heal': <function tanh at 0x7ff3611b4cc0>, 'block_act_heal': None, 'width_heal': 41, 'width_state': 26, 'lr': 0.0017139430084774621, 'padding_heal': 9, 'padding_state': 18, 'optimizer_type': 'lbfgs'}. Best is trial 771 with value: 0.0010052043944597244.
[I 2025-07-30 22:03:50,791] Trial 802 finished with value: 0.001171435578726232 and parameters: {'width_NN_heal': 207, 'width_NN_state': 330, 'depth_NN_heal': 3, 'depth_NN_state': 2, 'mode_heal': 60, 'mode_state': 64, 'blocks_heal': 7, 'blocks_state': 3, 'lift_act_state': <built-in function gelu>, 'block_act_state': <built-in function gelu>, 'lift_act_heal': <function tanh at 0x7ff3611b4cc0>, 'block_act_heal': None, 'width_heal': 35, 'width_state': 29, 'lr': 0.0015504913277009558, 'padding_heal': 8, 'padding_state': 17, 'optimizer_type': 'lbfgs'}. Best is trial 771 with value: 0.0010052043944597244.
[I 2025-07-30 22:03:55,754] Trial 803 finished with value: 0.0012889341451227665 and parameters: {'width_NN_heal': 247, 'width_NN_state': 432, 'depth_NN_heal': 3, 'depth_NN_state': 3, 'mode_heal': 60, 'mode_state': 64, 'blocks_heal': 7, 'blocks_state': 3, 'lift_act_state': <built-in function gelu>, 'block_act_state': <built-in function gelu>, 'lift_act_heal': <function tanh at 0x7ff3611b4cc0>, 'block_act_heal': None, 'width_heal': 31, 'width_state': 25, 'lr': 0.0017701182722941093, 'padding_heal': 8, 'padding_state': 15, 'optimizer_type': 'lbfgs'}. Best is trial 771 with value: 0.0010052043944597244.
[I 2025-07-30 22:04:00,477] Trial 804 finished with value: 0.0013163337716832757 and parameters: {'width_NN_heal': 289, 'width_NN_state': 357, 'depth_NN_heal': 3, 'depth_NN_state': 3, 'mode_heal': 60, 'mode_state': 64, 'blocks_heal': 7, 'blocks_state': 3, 'lift_act_state': <built-in function gelu>, 'block_act_state': <built-in function gelu>, 'lift_act_heal': <function tanh at 0x7ff3611b4cc0>, 'block_act_heal': None, 'width_heal': 34, 'width_state': 26, 'lr': 0.0015810101556265298, 'padding_heal': 9, 'padding_state': 16, 'optimizer_type': 'lbfgs'}. Best is trial 771 with value: 0.0010052043944597244.
[I 2025-07-30 22:04:05,109] Trial 805 finished with value: 0.0019249210599809885 and parameters: {'width_NN_heal': 230, 'width_NN_state': 343, 'depth_NN_heal': 2, 'depth_NN_state': 3, 'mode_heal': 60, 'mode_state': 64, 'blocks_heal': 7, 'blocks_state': 3, 'lift_act_state': <built-in function gelu>, 'block_act_state': <function tanh at 0x7ff3611b4cc0>, 'lift_act_heal': <function tanh at 0x7ff3611b4cc0>, 'block_act_heal': None, 'width_heal': 38, 'width_state': 28, 'lr': 0.0014275872447280901, 'padding_heal': 7, 'padding_state': 16, 'optimizer_type': 'lbfgs'}. Best is trial 771 with value: 0.0010052043944597244.
[I 2025-07-30 22:04:09,958] Trial 806 finished with value: 0.0011965378653258085 and parameters: {'width_NN_heal': 190, 'width_NN_state': 387, 'depth_NN_heal': 3, 'depth_NN_state': 3, 'mode_heal': 60, 'mode_state': 64, 'blocks_heal': 7, 'blocks_state': 3, 'lift_act_state': <built-in function gelu>, 'block_act_state': <built-in function gelu>, 'lift_act_heal': <function tanh at 0x7ff3611b4cc0>, 'block_act_heal': None, 'width_heal': 33, 'width_state': 24, 'lr': 0.0017417557867296049, 'padding_heal': 8, 'padding_state': 18, 'optimizer_type': 'lbfgs'}. Best is trial 771 with value: 0.0010052043944597244.
[I 2025-07-30 22:04:14,543] Trial 807 finished with value: 0.0015151930274441838 and parameters: {'width_NN_heal': 214, 'width_NN_state': 335, 'depth_NN_heal': 2, 'depth_NN_state': 3, 'mode_heal': 60, 'mode_state': 64, 'blocks_heal': 7, 'blocks_state': 3, 'lift_act_state': <built-in function gelu>, 'block_act_state': <built-in function gelu>, 'lift_act_heal': <function tanh at 0x7ff3611b4cc0>, 'block_act_heal': None, 'width_heal': 30, 'width_state': 29, 'lr': 0.0017471868481402355, 'padding_heal': 8, 'padding_state': 17, 'optimizer_type': 'lbfgs'}. Best is trial 771 with value: 0.0010052043944597244.
[I 2025-07-30 22:04:19,288] Trial 808 finished with value: 0.0011893950868397951 and parameters: {'width_NN_heal': 259, 'width_NN_state': 377, 'depth_NN_heal': 3, 'depth_NN_state': 3, 'mode_heal': 60, 'mode_state': 64, 'blocks_heal': 7, 'blocks_state': 3, 'lift_act_state': <built-in function gelu>, 'block_act_state': <built-in function gelu>, 'lift_act_heal': <function tanh at 0x7ff3611b4cc0>, 'block_act_heal': None, 'width_heal': 36, 'width_state': 26, 'lr': 0.0014108132030565487, 'padding_heal': 9, 'padding_state': 18, 'optimizer_type': 'lbfgs'}. Best is trial 771 with value: 0.0010052043944597244.
[I 2025-07-30 22:04:23,861] Trial 809 finished with value: 0.0011766195530071855 and parameters: {'width_NN_heal': 204, 'width_NN_state': 327, 'depth_NN_heal': 3, 'depth_NN_state': 3, 'mode_heal': 60, 'mode_state': 64, 'blocks_heal': 7, 'blocks_state': 3, 'lift_act_state': <built-in function gelu>, 'block_act_state': <built-in function gelu>, 'lift_act_heal': <function tanh at 0x7ff3611b4cc0>, 'block_act_heal': None, 'width_heal': 32, 'width_state': 25, 'lr': 0.0015749066250388788, 'padding_heal': 7, 'padding_state': 17, 'optimizer_type': 'lbfgs'}. Best is trial 771 with value: 0.0010052043944597244.
[I 2025-07-30 22:04:28,446] Trial 810 finished with value: 0.0013542852830141783 and parameters: {'width_NN_heal': 237, 'width_NN_state': 353, 'depth_NN_heal': 3, 'depth_NN_state': 2, 'mode_heal': 60, 'mode_state': 64, 'blocks_heal': 7, 'blocks_state': 3, 'lift_act_state': <built-in function gelu>, 'block_act_state': <built-in function gelu>, 'lift_act_heal': <function tanh at 0x7ff3611b4cc0>, 'block_act_heal': None, 'width_heal': 35, 'width_state': 28, 'lr': 0.0018147054410319094, 'padding_heal': 8, 'padding_state': 17, 'optimizer_type': 'lbfgs'}. Best is trial 771 with value: 0.0010052043944597244.
[I 2025-07-30 22:04:33,123] Trial 811 finished with value: 0.002062876708805561 and parameters: {'width_NN_heal': 272, 'width_NN_state': 320, 'depth_NN_heal': 3, 'depth_NN_state': 3, 'mode_heal': 60, 'mode_state': 64, 'blocks_heal': 7, 'blocks_state': 3, 'lift_act_state': <built-in function gelu>, 'block_act_state': None, 'lift_act_heal': <function tanh at 0x7ff3611b4cc0>, 'block_act_heal': None, 'width_heal': 30, 'width_state': 54, 'lr': 0.0014871422773964586, 'padding_heal': 8, 'padding_state': 18, 'optimizer_type': 'lbfgs'}. Best is trial 771 with value: 0.0010052043944597244.
[I 2025-07-30 22:04:37,973] Trial 812 finished with value: 0.0013919988414272666 and parameters: {'width_NN_heal': 224, 'width_NN_state': 403, 'depth_NN_heal': 3, 'depth_NN_state': 3, 'mode_heal': 60, 'mode_state': 64, 'blocks_heal': 7, 'blocks_state': 3, 'lift_act_state': <built-in function gelu>, 'block_act_state': <built-in function gelu>, 'lift_act_heal': None, 'block_act_heal': None, 'width_heal': 33, 'width_state': 24, 'lr': 0.0013646175615848136, 'padding_heal': 8, 'padding_state': 16, 'optimizer_type': 'lbfgs'}. Best is trial 771 with value: 0.0010052043944597244.
[I 2025-07-30 22:04:42,625] Trial 813 finished with value: 0.001142709981650114 and parameters: {'width_NN_heal': 191, 'width_NN_state': 348, 'depth_NN_heal': 3, 'depth_NN_state': 3, 'mode_heal': 60, 'mode_state': 64, 'blocks_heal': 7, 'blocks_state': 3, 'lift_act_state': <built-in function gelu>, 'block_act_state': <built-in function gelu>, 'lift_act_heal': <function tanh at 0x7ff3611b4cc0>, 'block_act_heal': None, 'width_heal': 41, 'width_state': 26, 'lr': 0.0016401927936395356, 'padding_heal': 9, 'padding_state': 17, 'optimizer_type': 'lbfgs'}. Best is trial 771 with value: 0.0010052043944597244.
[I 2025-07-30 22:04:47,384] Trial 814 finished with value: 0.001199793186970055 and parameters: {'width_NN_heal': 210, 'width_NN_state': 311, 'depth_NN_heal': 3, 'depth_NN_state': 3, 'mode_heal': 60, 'mode_state': 64, 'blocks_heal': 7, 'blocks_state': 3, 'lift_act_state': <built-in function gelu>, 'block_act_state': <built-in function gelu>, 'lift_act_heal': <function tanh at 0x7ff3611b4cc0>, 'block_act_heal': None, 'width_heal': 39, 'width_state': 29, 'lr': 0.0018144223579620478, 'padding_heal': 7, 'padding_state': 16, 'optimizer_type': 'lbfgs'}. Best is trial 771 with value: 0.0010052043944597244.
[I 2025-07-30 22:04:52,318] Trial 815 finished with value: 0.0011971906060352921 and parameters: {'width_NN_heal': 248, 'width_NN_state': 380, 'depth_NN_heal': 3, 'depth_NN_state': 3, 'mode_heal': 60, 'mode_state': 64, 'blocks_heal': 7, 'blocks_state': 3, 'lift_act_state': <built-in function gelu>, 'block_act_state': <built-in function gelu>, 'lift_act_heal': <function tanh at 0x7ff3611b4cc0>, 'block_act_heal': None, 'width_heal': 42, 'width_state': 23, 'lr': 0.0015628444058074253, 'padding_heal': 7, 'padding_state': 15, 'optimizer_type': 'lbfgs'}. Best is trial 771 with value: 0.0010052043944597244.
[I 2025-07-30 22:04:58,475] Trial 816 finished with value: 0.0017567065078765154 and parameters: {'width_NN_heal': 192, 'width_NN_state': 456, 'depth_NN_heal': 3, 'depth_NN_state': 3, 'mode_heal': 60, 'mode_state': 64, 'blocks_heal': 7, 'blocks_state': 8, 'lift_act_state': None, 'block_act_state': <built-in function gelu>, 'lift_act_heal': <function tanh at 0x7ff3611b4cc0>, 'block_act_heal': None, 'width_heal': 30, 'width_state': 27, 'lr': 0.001288577558828413, 'padding_heal': 10, 'padding_state': 18, 'optimizer_type': 'lbfgs'}. Best is trial 771 with value: 0.0010052043944597244.
[I 2025-07-30 22:05:03,220] Trial 817 finished with value: 0.0013491263380274177 and parameters: {'width_NN_heal': 234, 'width_NN_state': 308, 'depth_NN_heal': 3, 'depth_NN_state': 3, 'mode_heal': 60, 'mode_state': 64, 'blocks_heal': 7, 'blocks_state': 3, 'lift_act_state': <built-in function gelu>, 'block_act_state': <built-in function gelu>, 'lift_act_heal': <function tanh at 0x7ff3611b4cc0>, 'block_act_heal': None, 'width_heal': 35, 'width_state': 24, 'lr': 0.0016927402482526958, 'padding_heal': 7, 'padding_state': 14, 'optimizer_type': 'lbfgs'}. Best is trial 771 with value: 0.0010052043944597244.
[I 2025-07-30 22:05:07,763] Trial 818 finished with value: 0.0011419265065342188 and parameters: {'width_NN_heal': 216, 'width_NN_state': 338, 'depth_NN_heal': 2, 'depth_NN_state': 3, 'mode_heal': 60, 'mode_state': 64, 'blocks_heal': 7, 'blocks_state': 3, 'lift_act_state': <built-in function gelu>, 'block_act_state': <built-in function gelu>, 'lift_act_heal': <function tanh at 0x7ff3611b4cc0>, 'block_act_heal': None, 'width_heal': 32, 'width_state': 26, 'lr': 0.0014850169385479386, 'padding_heal': 8, 'padding_state': 17, 'optimizer_type': 'lbfgs'}. Best is trial 771 with value: 0.0010052043944597244.
[I 2025-07-30 22:05:12,399] Trial 819 finished with value: 0.0012039641151204705 and parameters: {'width_NN_heal': 193, 'width_NN_state': 301, 'depth_NN_heal': 3, 'depth_NN_state': 3, 'mode_heal': 60, 'mode_state': 64, 'blocks_heal': 7, 'blocks_state': 3, 'lift_act_state': <built-in function gelu>, 'block_act_state': <built-in function gelu>, 'lift_act_heal': <function tanh at 0x7ff3611b4cc0>, 'block_act_heal': None, 'width_heal': 36, 'width_state': 29, 'lr': 0.00181514283273238, 'padding_heal': 6, 'padding_state': 18, 'optimizer_type': 'lbfgs'}. Best is trial 771 with value: 0.0010052043944597244.
[I 2025-07-30 22:05:17,144] Trial 820 finished with value: 0.001189438859000802 and parameters: {'width_NN_heal': 266, 'width_NN_state': 374, 'depth_NN_heal': 3, 'depth_NN_state': 3, 'mode_heal': 60, 'mode_state': 64, 'blocks_heal': 7, 'blocks_state': 3, 'lift_act_state': <built-in function gelu>, 'block_act_state': <built-in function gelu>, 'lift_act_heal': <function tanh at 0x7ff3611b4cc0>, 'block_act_heal': None, 'width_heal': 30, 'width_state': 21, 'lr': 0.0013707949339624734, 'padding_heal': 7, 'padding_state': 17, 'optimizer_type': 'lbfgs'}. Best is trial 771 with value: 0.0010052043944597244.
[I 2025-07-30 22:05:22,101] Trial 821 finished with value: 0.0011971050407737494 and parameters: {'width_NN_heal': 233, 'width_NN_state': 427, 'depth_NN_heal': 3, 'depth_NN_state': 3, 'mode_heal': 60, 'mode_state': 64, 'blocks_heal': 7, 'blocks_state': 3, 'lift_act_state': <built-in function gelu>, 'block_act_state': <built-in function gelu>, 'lift_act_heal': <function tanh at 0x7ff3611b4cc0>, 'block_act_heal': None, 'width_heal': 39, 'width_state': 25, 'lr': 0.001644727196619452, 'padding_heal': 9, 'padding_state': 16, 'optimizer_type': 'lbfgs'}. Best is trial 771 with value: 0.0010052043944597244.
[I 2025-07-30 22:05:26,647] Trial 822 finished with value: 0.001157357357442379 and parameters: {'width_NN_heal': 204, 'width_NN_state': 258, 'depth_NN_heal': 2, 'depth_NN_state': 3, 'mode_heal': 60, 'mode_state': 64, 'blocks_heal': 7, 'blocks_state': 3, 'lift_act_state': <built-in function gelu>, 'block_act_state': <built-in function gelu>, 'lift_act_heal': <function tanh at 0x7ff3611b4cc0>, 'block_act_heal': None, 'width_heal': 32, 'width_state': 23, 'lr': 0.001833876985892797, 'padding_heal': 6, 'padding_state': 18, 'optimizer_type': 'lbfgs'}. Best is trial 771 with value: 0.0010052043944597244.
[I 2025-07-30 22:05:31,322] Trial 823 finished with value: 0.001289251958951354 and parameters: {'width_NN_heal': 185, 'width_NN_state': 328, 'depth_NN_heal': 3, 'depth_NN_state': 3, 'mode_heal': 60, 'mode_state': 64, 'blocks_heal': 7, 'blocks_state': 3, 'lift_act_state': <built-in function gelu>, 'block_act_state': <built-in function gelu>, 'lift_act_heal': <function tanh at 0x7ff3611b4cc0>, 'block_act_heal': None, 'width_heal': 37, 'width_state': 27, 'lr': 0.0015067776957376335, 'padding_heal': 8, 'padding_state': 17, 'optimizer_type': 'lbfgs'}. Best is trial 771 with value: 0.0010052043944597244.
[I 2025-07-30 22:05:35,869] Trial 824 finished with value: 0.0011757387546822429 and parameters: {'width_NN_heal': 218, 'width_NN_state': 287, 'depth_NN_heal': 3, 'depth_NN_state': 3, 'mode_heal': 60, 'mode_state': 64, 'blocks_heal': 7, 'blocks_state': 3, 'lift_act_state': <built-in function gelu>, 'block_act_state': <built-in function gelu>, 'lift_act_heal': <function tanh at 0x7ff3611b4cc0>, 'block_act_heal': None, 'width_heal': 34, 'width_state': 29, 'lr': 0.00131439239221328, 'padding_heal': 6, 'padding_state': 16, 'optimizer_type': 'lbfgs'}. Best is trial 771 with value: 0.0010052043944597244.
[I 2025-07-30 22:05:40,476] Trial 825 finished with value: 0.001248537446372211 and parameters: {'width_NN_heal': 245, 'width_NN_state': 348, 'depth_NN_heal': 3, 'depth_NN_state': 2, 'mode_heal': 60, 'mode_state': 64, 'blocks_heal': 7, 'blocks_state': 3, 'lift_act_state': <built-in function gelu>, 'block_act_state': <built-in function gelu>, 'lift_act_heal': <function tanh at 0x7ff3611b4cc0>, 'block_act_heal': None, 'width_heal': 29, 'width_state': 24, 'lr': 0.0016248950197491321, 'padding_heal': 7, 'padding_state': 18, 'optimizer_type': 'lbfgs'}. Best is trial 771 with value: 0.0010052043944597244.
[I 2025-07-30 22:05:45,038] Trial 826 finished with value: 0.0015149476239457726 and parameters: {'width_NN_heal': 290, 'width_NN_state': 305, 'depth_NN_heal': 2, 'depth_NN_state': 3, 'mode_heal': 60, 'mode_state': 64, 'blocks_heal': 7, 'blocks_state': 3, 'lift_act_state': <built-in function gelu>, 'block_act_state': <built-in function gelu>, 'lift_act_heal': <function tanh at 0x7ff3611b4cc0>, 'block_act_heal': None, 'width_heal': 29, 'width_state': 26, 'lr': 0.0018033717009047628, 'padding_heal': 6, 'padding_state': 16, 'optimizer_type': 'lbfgs'}. Best is trial 771 with value: 0.0010052043944597244.
[I 2025-07-30 22:05:49,665] Trial 827 finished with value: 0.0019712394569069147 and parameters: {'width_NN_heal': 201, 'width_NN_state': 263, 'depth_NN_heal': 3, 'depth_NN_state': 3, 'mode_heal': 60, 'mode_state': 64, 'blocks_heal': 7, 'blocks_state': 3, 'lift_act_state': <built-in function gelu>, 'block_act_state': <function tanh at 0x7ff3611b4cc0>, 'lift_act_heal': <function tanh at 0x7ff3611b4cc0>, 'block_act_heal': None, 'width_heal': 32, 'width_state': 50, 'lr': 0.0014869201851821943, 'padding_heal': 8, 'padding_state': 17, 'optimizer_type': 'lbfgs'}. Best is trial 771 with value: 0.0010052043944597244.
[I 2025-07-30 22:05:54,658] Trial 828 finished with value: 0.0014138161204755306 and parameters: {'width_NN_heal': 320, 'width_NN_state': 323, 'depth_NN_heal': 3, 'depth_NN_state': 3, 'mode_heal': 60, 'mode_state': 64, 'blocks_heal': 7, 'blocks_state': 3, 'lift_act_state': <built-in function gelu>, 'block_act_state': <built-in function gelu>, 'lift_act_heal': <function tanh at 0x7ff3611b4cc0>, 'block_act_heal': None, 'width_heal': 37, 'width_state': 22, 'lr': 0.0016691237691475308, 'padding_heal': 11, 'padding_state': 18, 'optimizer_type': 'lbfgs'}. Best is trial 771 with value: 0.0010052043944597244.
[I 2025-07-30 22:05:57,663] Trial 829 finished with value: 0.0013244118308648467 and parameters: {'width_NN_heal': 181, 'width_NN_state': 367, 'depth_NN_heal': 1, 'depth_NN_state': 3, 'mode_heal': 60, 'mode_state': 40, 'blocks_heal': 2, 'blocks_state': 3, 'lift_act_state': <built-in function gelu>, 'block_act_state': <built-in function gelu>, 'lift_act_heal': <function tanh at 0x7ff3611b4cc0>, 'block_act_heal': None, 'width_heal': 34, 'width_state': 20, 'lr': 0.0014027795957534935, 'padding_heal': 6, 'padding_state': 15, 'optimizer_type': 'lbfgs'}. Best is trial 771 with value: 0.0010052043944597244.
[I 2025-07-30 22:06:02,406] Trial 830 finished with value: 0.0011766789248213172 and parameters: {'width_NN_heal': 221, 'width_NN_state': 280, 'depth_NN_heal': 3, 'depth_NN_state': 3, 'mode_heal': 60, 'mode_state': 64, 'blocks_heal': 7, 'blocks_state': 3, 'lift_act_state': <built-in function gelu>, 'block_act_state': <built-in function gelu>, 'lift_act_heal': <function tanh at 0x7ff3611b4cc0>, 'block_act_heal': None, 'width_heal': 42, 'width_state': 28, 'lr': 0.0018278052436019427, 'padding_heal': 7, 'padding_state': 18, 'optimizer_type': 'lbfgs'}. Best is trial 771 with value: 0.0010052043944597244.
[I 2025-07-30 22:06:07,020] Trial 831 finished with value: 0.0012443654704838991 and parameters: {'width_NN_heal': 257, 'width_NN_state': 243, 'depth_NN_heal': 3, 'depth_NN_state': 3, 'mode_heal': 60, 'mode_state': 64, 'blocks_heal': 7, 'blocks_state': 3, 'lift_act_state': <built-in function gelu>, 'block_act_state': <built-in function gelu>, 'lift_act_heal': <function tanh at 0x7ff3611b4cc0>, 'block_act_heal': None, 'width_heal': 30, 'width_state': 25, 'lr': 0.0015657889015763442, 'padding_heal': 6, 'padding_state': 17, 'optimizer_type': 'lbfgs'}. Best is trial 771 with value: 0.0010052043944597244.
[I 2025-07-30 22:06:11,058] Trial 832 finished with value: 0.0021665722597390413 and parameters: {'width_NN_heal': 204, 'width_NN_state': 335, 'depth_NN_heal': 3, 'depth_NN_state': 3, 'mode_heal': 60, 'mode_state': 64, 'blocks_heal': 7, 'blocks_state': 1, 'lift_act_state': <built-in function gelu>, 'block_act_state': <built-in function gelu>, 'lift_act_heal': None, 'block_act_heal': None, 'width_heal': 33, 'width_state': 27, 'lr': 0.0013196293722661143, 'padding_heal': 6, 'padding_state': 16, 'optimizer_type': 'lbfgs'}. Best is trial 771 with value: 0.0010052043944597244.
[I 2025-07-30 22:06:15,674] Trial 833 finished with value: 0.0021695010364055634 and parameters: {'width_NN_heal': 229, 'width_NN_state': 307, 'depth_NN_heal': 3, 'depth_NN_state': 3, 'mode_heal': 60, 'mode_state': 20, 'blocks_heal': 7, 'blocks_state': 3, 'lift_act_state': <built-in function gelu>, 'block_act_state': None, 'lift_act_heal': <function tanh at 0x7ff3611b4cc0>, 'block_act_heal': None, 'width_heal': 39, 'width_state': 23, 'lr': 0.001732030906503001, 'padding_heal': 5, 'padding_state': 17, 'optimizer_type': 'lbfgs'}. Best is trial 771 with value: 0.0010052043944597244.
