[I 2025-07-30 23:26:31,083] Trial 1806 finished with value: 0.0013911197893321514 and parameters: {'width_NN_heal': 409, 'width_NN_state': 440, 'depth_NN_heal': 2, 'depth_NN_state': 3, 'mode_heal': 64, 'mode_state': 24, 'blocks_heal': 8, 'blocks_state': 3, 'lift_act_state': <built-in function gelu>, 'block_act_state': <built-in function gelu>, 'lift_act_heal': <built-in function gelu>, 'block_act_heal': None, 'width_heal': 41, 'width_state': 121, 'lr': 0.0016236900057139526, 'padding_heal': 5, 'padding_state': 14, 'optimizer_type': 'adam'}. Best is trial 1511 with value: 0.0009640019852668047.
[I 2025-07-30 23:26:35,964] Trial 1807 finished with value: 0.00266254716552794 and parameters: {'width_NN_heal': 366, 'width_NN_state': 303, 'depth_NN_heal': 2, 'depth_NN_state': 2, 'mode_heal': 60, 'mode_state': 60, 'blocks_heal': 8, 'blocks_state': 3, 'lift_act_state': <built-in function gelu>, 'block_act_state': None, 'lift_act_heal': <built-in function gelu>, 'block_act_heal': None, 'width_heal': 45, 'width_state': 88, 'lr': 0.002328151216218642, 'padding_heal': 6, 'padding_state': 17, 'optimizer_type': 'lbfgs'}. Best is trial 1511 with value: 0.0009640019852668047.
[I 2025-07-30 23:26:41,650] Trial 1808 finished with value: 0.0018031701911240816 and parameters: {'width_NN_heal': 449, 'width_NN_state': 480, 'depth_NN_heal': 2, 'depth_NN_state': 3, 'mode_heal': 20, 'mode_state': 56, 'blocks_heal': 8, 'blocks_state': 3, 'lift_act_state': None, 'block_act_state': <built-in function gelu>, 'lift_act_heal': <built-in function gelu>, 'block_act_heal': None, 'width_heal': 52, 'width_state': 108, 'lr': 0.001955040886128238, 'padding_heal': 4, 'padding_state': 16, 'optimizer_type': 'lbfgs'}. Best is trial 1511 with value: 0.0009640019852668047.
[I 2025-07-30 23:26:46,445] Trial 1809 finished with value: 0.0012135736178606749 and parameters: {'width_NN_heal': 390, 'width_NN_state': 322, 'depth_NN_heal': 1, 'depth_NN_state': 2, 'mode_heal': 64, 'mode_state': 60, 'blocks_heal': 8, 'blocks_state': 3, 'lift_act_state': <built-in function gelu>, 'block_act_state': <built-in function gelu>, 'lift_act_heal': <built-in function gelu>, 'block_act_heal': None, 'width_heal': 39, 'width_state': 113, 'lr': 0.0013388509689371232, 'padding_heal': 32, 'padding_state': 18, 'optimizer_type': 'lbfgs'}. Best is trial 1511 with value: 0.0009640019852668047.
[I 2025-07-30 23:26:51,493] Trial 1810 finished with value: 0.0012142236810177565 and parameters: {'width_NN_heal': 329, 'width_NN_state': 248, 'depth_NN_heal': 2, 'depth_NN_state': 3, 'mode_heal': 56, 'mode_state': 52, 'blocks_heal': 8, 'blocks_state': 3, 'lift_act_state': <built-in function gelu>, 'block_act_state': <built-in function gelu>, 'lift_act_heal': <built-in function gelu>, 'block_act_heal': None, 'width_heal': 59, 'width_state': 102, 'lr': 0.001816910252179382, 'padding_heal': 7, 'padding_state': 15, 'optimizer_type': 'lbfgs'}. Best is trial 1511 with value: 0.0009640019852668047.
[I 2025-07-30 23:26:56,606] Trial 1811 finished with value: 0.0011976356618106365 and parameters: {'width_NN_heal': 429, 'width_NN_state': 376, 'depth_NN_heal': 2, 'depth_NN_state': 3, 'mode_heal': 64, 'mode_state': 56, 'blocks_heal': 8, 'blocks_state': 3, 'lift_act_state': <built-in function gelu>, 'block_act_state': <built-in function gelu>, 'lift_act_heal': <built-in function gelu>, 'block_act_heal': None, 'width_heal': 48, 'width_state': 92, 'lr': 0.0015637044022960098, 'padding_heal': 3, 'padding_state': 16, 'optimizer_type': 'lbfgs'}. Best is trial 1511 with value: 0.0009640019852668047.
[I 2025-07-30 23:27:01,655] Trial 1812 finished with value: 0.0013071504654362798 and parameters: {'width_NN_heal': 508, 'width_NN_state': 284, 'depth_NN_heal': 2, 'depth_NN_state': 3, 'mode_heal': 60, 'mode_state': 52, 'blocks_heal': 8, 'blocks_state': 2, 'lift_act_state': <built-in function gelu>, 'block_act_state': <built-in function gelu>, 'lift_act_heal': <built-in function gelu>, 'block_act_heal': None, 'width_heal': 64, 'width_state': 117, 'lr': 0.002073087485794862, 'padding_heal': 5, 'padding_state': 17, 'optimizer_type': 'lbfgs'}. Best is trial 1511 with value: 0.0009640019852668047.
[I 2025-07-30 23:27:07,081] Trial 1813 finished with value: 0.0012013564119115472 and parameters: {'width_NN_heal': 355, 'width_NN_state': 343, 'depth_NN_heal': 2, 'depth_NN_state': 3, 'mode_heal': 60, 'mode_state': 60, 'blocks_heal': 8, 'blocks_state': 4, 'lift_act_state': <built-in function gelu>, 'block_act_state': <built-in function gelu>, 'lift_act_heal': <built-in function gelu>, 'block_act_heal': None, 'width_heal': 55, 'width_state': 128, 'lr': 0.0014372703434583577, 'padding_heal': 20, 'padding_state': 18, 'optimizer_type': 'lbfgs'}. Best is trial 1511 with value: 0.0009640019852668047.
[I 2025-07-30 23:27:12,570] Trial 1814 finished with value: 0.0012679644860327244 and parameters: {'width_NN_heal': 381, 'width_NN_state': 416, 'depth_NN_heal': 2, 'depth_NN_state': 3, 'mode_heal': 60, 'mode_state': 16, 'blocks_heal': 8, 'blocks_state': 3, 'lift_act_state': <built-in function gelu>, 'block_act_state': <built-in function gelu>, 'lift_act_heal': <built-in function gelu>, 'block_act_heal': None, 'width_heal': 50, 'width_state': 108, 'lr': 0.0017303971383775712, 'padding_heal': 4, 'padding_state': 17, 'optimizer_type': 'lbfgs'}. Best is trial 1511 with value: 0.0009640019852668047.
[I 2025-07-30 23:27:17,548] Trial 1815 finished with value: 0.0031841485761106014 and parameters: {'width_NN_heal': 319, 'width_NN_state': 12, 'depth_NN_heal': 2, 'depth_NN_state': 3, 'mode_heal': 60, 'mode_state': 56, 'blocks_heal': 8, 'blocks_state': 3, 'lift_act_state': <built-in function gelu>, 'block_act_state': <built-in function gelu>, 'lift_act_heal': <built-in function gelu>, 'block_act_heal': None, 'width_heal': 44, 'width_state': 83, 'lr': 0.0015378010331956724, 'padding_heal': 7, 'padding_state': 19, 'optimizer_type': 'lbfgs'}. Best is trial 1511 with value: 0.0009640019852668047.
[I 2025-07-30 23:27:22,127] Trial 1816 finished with value: 0.0010944887762889266 and parameters: {'width_NN_heal': 442, 'width_NN_state': 299, 'depth_NN_heal': 2, 'depth_NN_state': 3, 'mode_heal': 64, 'mode_state': 56, 'blocks_heal': 6, 'blocks_state': 3, 'lift_act_state': <built-in function gelu>, 'block_act_state': <built-in function gelu>, 'lift_act_heal': <built-in function gelu>, 'block_act_heal': None, 'width_heal': 58, 'width_state': 96, 'lr': 0.002283496641561212, 'padding_heal': 5, 'padding_state': 16, 'optimizer_type': 'lbfgs'}. Best is trial 1511 with value: 0.0009640019852668047.
[I 2025-07-30 23:27:27,327] Trial 1817 finished with value: 0.0012248782441020012 and parameters: {'width_NN_heal': 512, 'width_NN_state': 267, 'depth_NN_heal': 2, 'depth_NN_state': 3, 'mode_heal': 56, 'mode_state': 60, 'blocks_heal': 8, 'blocks_state': 3, 'lift_act_state': <built-in function gelu>, 'block_act_state': <built-in function gelu>, 'lift_act_heal': <built-in function gelu>, 'block_act_heal': None, 'width_heal': 38, 'width_state': 104, 'lr': 0.002587633969201856, 'padding_heal': 25, 'padding_state': 16, 'optimizer_type': 'lbfgs'}. Best is trial 1511 with value: 0.0009640019852668047.
[I 2025-07-30 23:27:32,572] Trial 1818 finished with value: 0.001145441783592105 and parameters: {'width_NN_heal': 405, 'width_NN_state': 361, 'depth_NN_heal': 2, 'depth_NN_state': 3, 'mode_heal': 64, 'mode_state': 60, 'blocks_heal': 8, 'blocks_state': 3, 'lift_act_state': <built-in function gelu>, 'block_act_state': <built-in function gelu>, 'lift_act_heal': <built-in function gelu>, 'block_act_heal': None, 'width_heal': 52, 'width_state': 120, 'lr': 0.0018614431880225597, 'padding_heal': 4, 'padding_state': 17, 'optimizer_type': 'lbfgs'}. Best is trial 1511 with value: 0.0009640019852668047.
[I 2025-07-30 23:27:37,711] Trial 1819 finished with value: 0.0026968265883624554 and parameters: {'width_NN_heal': 353, 'width_NN_state': 328, 'depth_NN_heal': 2, 'depth_NN_state': 3, 'mode_heal': 60, 'mode_state': 60, 'blocks_heal': 8, 'blocks_state': 3, 'lift_act_state': <built-in function gelu>, 'block_act_state': <built-in function gelu>, 'lift_act_heal': None, 'block_act_heal': None, 'width_heal': 67, 'width_state': 113, 'lr': 0.0003229405050509988, 'padding_heal': 3, 'padding_state': 15, 'optimizer_type': 'lbfgs'}. Best is trial 1511 with value: 0.0009640019852668047.
[I 2025-07-30 23:27:43,131] Trial 1820 finished with value: 0.001429158728569746 and parameters: {'width_NN_heal': 408, 'width_NN_state': 390, 'depth_NN_heal': 2, 'depth_NN_state': 3, 'mode_heal': 64, 'mode_state': 36, 'blocks_heal': 8, 'blocks_state': 3, 'lift_act_state': <built-in function gelu>, 'block_act_state': <built-in function gelu>, 'lift_act_heal': <built-in function gelu>, 'block_act_heal': None, 'width_heal': 47, 'width_state': 98, 'lr': 0.0012952315219798786, 'padding_heal': 5, 'padding_state': 18, 'optimizer_type': 'lbfgs'}. Best is trial 1511 with value: 0.0009640019852668047.
[I 2025-07-30 23:27:47,993] Trial 1821 finished with value: 0.0010657268576323986 and parameters: {'width_NN_heal': 368, 'width_NN_state': 325, 'depth_NN_heal': 1, 'depth_NN_state': 3, 'mode_heal': 60, 'mode_state': 56, 'blocks_heal': 8, 'blocks_state': 3, 'lift_act_state': <built-in function gelu>, 'block_act_state': <built-in function gelu>, 'lift_act_heal': <built-in function gelu>, 'block_act_heal': None, 'width_heal': 42, 'width_state': 89, 'lr': 0.001617819074300194, 'padding_heal': 6, 'padding_state': 17, 'optimizer_type': 'lbfgs'}. Best is trial 1511 with value: 0.0009640019852668047.
[I 2025-07-30 23:27:53,107] Trial 1822 finished with value: 0.0012077033752575517 and parameters: {'width_NN_heal': 460, 'width_NN_state': 239, 'depth_NN_heal': 2, 'depth_NN_state': 3, 'mode_heal': 64, 'mode_state': 52, 'blocks_heal': 8, 'blocks_state': 3, 'lift_act_state': <built-in function gelu>, 'block_act_state': <built-in function gelu>, 'lift_act_heal': <built-in function gelu>, 'block_act_heal': None, 'width_heal': 55, 'width_state': 120, 'lr': 0.0013916650702591555, 'padding_heal': 4, 'padding_state': 16, 'optimizer_type': 'lbfgs'}. Best is trial 1511 with value: 0.0009640019852668047.
[I 2025-07-30 23:27:58,117] Trial 1823 finished with value: 0.0010460251942276955 and parameters: {'width_NN_heal': 322, 'width_NN_state': 289, 'depth_NN_heal': 2, 'depth_NN_state': 3, 'mode_heal': 60, 'mode_state': 60, 'blocks_heal': 8, 'blocks_state': 3, 'lift_act_state': <built-in function gelu>, 'block_act_state': <built-in function gelu>, 'lift_act_heal': <built-in function gelu>, 'block_act_heal': None, 'width_heal': 49, 'width_state': 4, 'lr': 0.0020607526596183572, 'padding_heal': 3, 'padding_state': 19, 'optimizer_type': 'lbfgs'}. Best is trial 1511 with value: 0.0009640019852668047.
[I 2025-07-30 23:28:03,973] Trial 1824 finished with value: 0.0024875064846128225 and parameters: {'width_NN_heal': 382, 'width_NN_state': 357, 'depth_NN_heal': 3, 'depth_NN_state': 3, 'mode_heal': 64, 'mode_state': 60, 'blocks_heal': 8, 'blocks_state': 3, 'lift_act_state': <built-in function gelu>, 'block_act_state': <function tanh at 0x7ff3611b4cc0>, 'lift_act_heal': <built-in function gelu>, 'block_act_heal': None, 'width_heal': 45, 'width_state': 109, 'lr': 0.0017044087342622304, 'padding_heal': 31, 'padding_state': 17, 'optimizer_type': 'adam'}. Best is trial 1511 with value: 0.0009640019852668047.
[I 2025-07-30 23:28:08,327] Trial 1825 finished with value: 0.0013013171264901757 and parameters: {'width_NN_heal': 343, 'width_NN_state': 266, 'depth_NN_heal': 2, 'depth_NN_state': 2, 'mode_heal': 60, 'mode_state': 56, 'blocks_heal': 6, 'blocks_state': 3, 'lift_act_state': <built-in function gelu>, 'block_act_state': <built-in function gelu>, 'lift_act_heal': <built-in function gelu>, 'block_act_heal': <built-in function gelu>, 'width_heal': 62, 'width_state': 100, 'lr': 0.0014463666052430678, 'padding_heal': 15, 'padding_state': 20, 'optimizer_type': 'lbfgs'}. Best is trial 1511 with value: 0.0009640019852668047.
[I 2025-07-30 23:28:13,401] Trial 1826 finished with value: 0.0010799954179674387 and parameters: {'width_NN_heal': 431, 'width_NN_state': 307, 'depth_NN_heal': 2, 'depth_NN_state': 3, 'mode_heal': 60, 'mode_state': 60, 'blocks_heal': 8, 'blocks_state': 3, 'lift_act_state': <built-in function gelu>, 'block_act_state': <built-in function gelu>, 'lift_act_heal': <built-in function gelu>, 'block_act_heal': None, 'width_heal': 40, 'width_state': 83, 'lr': 0.0019351397747497973, 'padding_heal': 8, 'padding_state': 18, 'optimizer_type': 'lbfgs'}. Best is trial 1511 with value: 0.0009640019852668047.
[I 2025-07-30 23:28:19,088] Trial 1827 finished with value: 0.001287907361984253 and parameters: {'width_NN_heal': 471, 'width_NN_state': 394, 'depth_NN_heal': 2, 'depth_NN_state': 3, 'mode_heal': 56, 'mode_state': 56, 'blocks_heal': 8, 'blocks_state': 4, 'lift_act_state': <built-in function gelu>, 'block_act_state': <built-in function gelu>, 'lift_act_heal': <built-in function gelu>, 'block_act_heal': None, 'width_heal': 52, 'width_state': 128, 'lr': 0.0015679719485534648, 'padding_heal': 6, 'padding_state': 15, 'optimizer_type': 'lbfgs'}. Best is trial 1511 with value: 0.0009640019852668047.
[I 2025-07-30 23:28:23,904] Trial 1828 finished with value: 0.0021718135103583336 and parameters: {'width_NN_heal': 309, 'width_NN_state': 332, 'depth_NN_heal': 2, 'depth_NN_state': 3, 'mode_heal': 64, 'mode_state': 60, 'blocks_heal': 8, 'blocks_state': 3, 'lift_act_state': <built-in function gelu>, 'block_act_state': <built-in function gelu>, 'lift_act_heal': <built-in function gelu>, 'block_act_heal': None, 'width_heal': 8, 'width_state': 106, 'lr': 0.0017696396213137142, 'padding_heal': 3, 'padding_state': 16, 'optimizer_type': 'lbfgs'}. Best is trial 1511 with value: 0.0009640019852668047.
[I 2025-07-30 23:28:30,938] Trial 1829 finished with value: 0.024826863780617714 and parameters: {'width_NN_heal': 414, 'width_NN_state': 429, 'depth_NN_heal': 5, 'depth_NN_state': 3, 'mode_heal': 64, 'mode_state': 56, 'blocks_heal': 8, 'blocks_state': 3, 'lift_act_state': None, 'block_act_state': None, 'lift_act_heal': <built-in function gelu>, 'block_act_heal': None, 'width_heal': 43, 'width_state': 116, 'lr': 0.0002584234763102345, 'padding_heal': 5, 'padding_state': 18, 'optimizer_type': 'lbfgs'}. Best is trial 1511 with value: 0.0009640019852668047.
[I 2025-07-30 23:28:35,969] Trial 1830 finished with value: 0.0010108451824635267 and parameters: {'width_NN_heal': 9, 'width_NN_state': 284, 'depth_NN_heal': 2, 'depth_NN_state': 3, 'mode_heal': 60, 'mode_state': 52, 'blocks_heal': 8, 'blocks_state': 3, 'lift_act_state': <built-in function gelu>, 'block_act_state': <built-in function gelu>, 'lift_act_heal': <built-in function gelu>, 'block_act_heal': None, 'width_heal': 37, 'width_state': 94, 'lr': 0.0013107878910860664, 'padding_heal': 4, 'padding_state': 17, 'optimizer_type': 'lbfgs'}. Best is trial 1511 with value: 0.0009640019852668047.
[I 2025-07-30 23:28:41,012] Trial 1831 finished with value: 0.001178660779260099 and parameters: {'width_NN_heal': 17, 'width_NN_state': 313, 'depth_NN_heal': 2, 'depth_NN_state': 3, 'mode_heal': 60, 'mode_state': 52, 'blocks_heal': 8, 'blocks_state': 3, 'lift_act_state': <built-in function gelu>, 'block_act_state': <built-in function gelu>, 'lift_act_heal': <built-in function gelu>, 'block_act_heal': None, 'width_heal': 36, 'width_state': 84, 'lr': 0.0012475472687983027, 'padding_heal': 4, 'padding_state': 19, 'optimizer_type': 'lbfgs'}. Best is trial 1511 with value: 0.0009640019852668047.
[I 2025-07-30 23:28:46,016] Trial 1832 finished with value: 0.0011857884237542748 and parameters: {'width_NN_heal': 26, 'width_NN_state': 356, 'depth_NN_heal': 2, 'depth_NN_state': 3, 'mode_heal': 56, 'mode_state': 52, 'blocks_heal': 8, 'blocks_state': 3, 'lift_act_state': <built-in function gelu>, 'block_act_state': <built-in function gelu>, 'lift_act_heal': <built-in function gelu>, 'block_act_heal': None, 'width_heal': 35, 'width_state': 86, 'lr': 0.001319190796268442, 'padding_heal': 3, 'padding_state': 18, 'optimizer_type': 'lbfgs'}. Best is trial 1511 with value: 0.0009640019852668047.
[I 2025-07-30 23:28:51,515] Trial 1833 finished with value: 0.0014045232674106956 and parameters: {'width_NN_heal': 476, 'width_NN_state': 294, 'depth_NN_heal': 3, 'depth_NN_state': 3, 'mode_heal': 64, 'mode_state': 52, 'blocks_heal': 8, 'blocks_state': 3, 'lift_act_state': <built-in function gelu>, 'block_act_state': <built-in function gelu>, 'lift_act_heal': None, 'block_act_heal': None, 'width_heal': 38, 'width_state': 90, 'lr': 0.0013540697817133272, 'padding_heal': 4, 'padding_state': 19, 'optimizer_type': 'lbfgs'}. Best is trial 1511 with value: 0.0009640019852668047.
[I 2025-07-30 23:28:54,679] Trial 1834 finished with value: 0.0011986312456429005 and parameters: {'width_NN_heal': 8, 'width_NN_state': 322, 'depth_NN_heal': 2, 'depth_NN_state': 3, 'mode_heal': 60, 'mode_state': 52, 'blocks_heal': 2, 'blocks_state': 3, 'lift_act_state': <built-in function gelu>, 'block_act_state': <built-in function gelu>, 'lift_act_heal': <built-in function gelu>, 'block_act_heal': None, 'width_heal': 36, 'width_state': 92, 'lr': 0.001269988006388216, 'padding_heal': 4, 'padding_state': 18, 'optimizer_type': 'lbfgs'}. Best is trial 1511 with value: 0.0009640019852668047.
[I 2025-07-30 23:28:59,044] Trial 1835 finished with value: 0.0012249123537912965 and parameters: {'width_NN_heal': 31, 'width_NN_state': 340, 'depth_NN_heal': 2, 'depth_NN_state': 3, 'mode_heal': 44, 'mode_state': 52, 'blocks_heal': 6, 'blocks_state': 3, 'lift_act_state': <built-in function gelu>, 'block_act_state': <built-in function gelu>, 'lift_act_heal': <built-in function gelu>, 'block_act_heal': None, 'width_heal': 38, 'width_state': 83, 'lr': 0.0012606673750791247, 'padding_heal': 3, 'padding_state': 17, 'optimizer_type': 'lbfgs'}. Best is trial 1511 with value: 0.0009640019852668047.
[I 2025-07-30 23:29:03,058] Trial 1836 finished with value: 0.00269061210565269 and parameters: {'width_NN_heal': 24, 'width_NN_state': 43, 'depth_NN_heal': 2, 'depth_NN_state': 3, 'mode_heal': 64, 'mode_state': 52, 'blocks_heal': 5, 'blocks_state': 3, 'lift_act_state': <built-in function gelu>, 'block_act_state': <built-in function gelu>, 'lift_act_heal': <built-in function gelu>, 'block_act_heal': None, 'width_heal': 34, 'width_state': 11, 'lr': 0.0012524447529287904, 'padding_heal': 3, 'padding_state': 18, 'optimizer_type': 'lbfgs'}. Best is trial 1511 with value: 0.0009640019852668047.
[I 2025-07-30 23:29:08,121] Trial 1837 finished with value: 0.001191017683595419 and parameters: {'width_NN_heal': 475, 'width_NN_state': 296, 'depth_NN_heal': 2, 'depth_NN_state': 3, 'mode_heal': 60, 'mode_state': 52, 'blocks_heal': 8, 'blocks_state': 3, 'lift_act_state': <built-in function gelu>, 'block_act_state': <built-in function gelu>, 'lift_act_heal': <built-in function gelu>, 'block_act_heal': None, 'width_heal': 35, 'width_state': 90, 'lr': 0.001333725689211596, 'padding_heal': 4, 'padding_state': 17, 'optimizer_type': 'lbfgs'}. Best is trial 1511 with value: 0.0009640019852668047.
[I 2025-07-30 23:29:13,076] Trial 1838 finished with value: 0.0011641891906037927 and parameters: {'width_NN_heal': 34, 'width_NN_state': 381, 'depth_NN_heal': 2, 'depth_NN_state': 3, 'mode_heal': 64, 'mode_state': 52, 'blocks_heal': 8, 'blocks_state': 3, 'lift_act_state': <built-in function gelu>, 'block_act_state': <built-in function gelu>, 'lift_act_heal': <built-in function gelu>, 'block_act_heal': None, 'width_heal': 34, 'width_state': 95, 'lr': 0.001404947899707096, 'padding_heal': 4, 'padding_state': 19, 'optimizer_type': 'lbfgs'}. Best is trial 1511 with value: 0.0009640019852668047.
[I 2025-07-30 23:29:18,938] Trial 1839 finished with value: 0.0019396321149542928 and parameters: {'width_NN_heal': 30, 'width_NN_state': 357, 'depth_NN_heal': 3, 'depth_NN_state': 3, 'mode_heal': 60, 'mode_state': 52, 'blocks_heal': 8, 'blocks_state': 6, 'lift_act_state': <built-in function gelu>, 'block_act_state': <built-in function gelu>, 'lift_act_heal': <built-in function gelu>, 'block_act_heal': None, 'width_heal': 36, 'width_state': 86, 'lr': 0.0012780509505391099, 'padding_heal': 3, 'padding_state': 17, 'optimizer_type': 'lbfgs'}. Best is trial 1511 with value: 0.0009640019852668047.
[I 2025-07-30 23:29:23,517] Trial 1840 finished with value: 0.0014421528903767467 and parameters: {'width_NN_heal': 9, 'width_NN_state': 321, 'depth_NN_heal': 1, 'depth_NN_state': 3, 'mode_heal': 60, 'mode_state': 52, 'blocks_heal': 8, 'blocks_state': 2, 'lift_act_state': <built-in function gelu>, 'block_act_state': <built-in function gelu>, 'lift_act_heal': <built-in function gelu>, 'block_act_heal': None, 'width_heal': 32, 'width_state': 96, 'lr': 0.0014514252136807473, 'padding_heal': 4, 'padding_state': 18, 'optimizer_type': 'lbfgs'}. Best is trial 1511 with value: 0.0009640019852668047.
[I 2025-07-30 23:29:28,536] Trial 1841 finished with value: 0.001106747891753912 and parameters: {'width_NN_heal': 430, 'width_NN_state': 284, 'depth_NN_heal': 2, 'depth_NN_state': 3, 'mode_heal': 64, 'mode_state': 52, 'blocks_heal': 8, 'blocks_state': 3, 'lift_act_state': <built-in function gelu>, 'block_act_state': <built-in function gelu>, 'lift_act_heal': <built-in function gelu>, 'block_act_heal': None, 'width_heal': 38, 'width_state': 83, 'lr': 0.002467155713544182, 'padding_heal': 4, 'padding_state': 17, 'optimizer_type': 'lbfgs'}. Best is trial 1511 with value: 0.0009640019852668047.
