[I 2025-07-31 00:22:20,891] Trial 2490 finished with value: 0.0013354754773899913 and parameters: {'width_NN_heal': 445, 'width_NN_state': 279, 'depth_NN_heal': 2, 'depth_NN_state': 3, 'mode_heal': 64, 'mode_state': 56, 'blocks_heal': 5, 'blocks_state': 3, 'lift_act_state': <built-in function gelu>, 'block_act_state': <built-in function gelu>, 'lift_act_heal': <built-in function gelu>, 'block_act_heal': None, 'width_heal': 47, 'width_state': 87, 'lr': 0.0014612614532286323, 'padding_heal': 1, 'padding_state': 20, 'optimizer_type': 'adam'}. Best is trial 1511 with value: 0.0009640019852668047.
[I 2025-07-31 00:22:24,797] Trial 2491 finished with value: 0.00153899856377393 and parameters: {'width_NN_heal': 379, 'width_NN_state': 242, 'depth_NN_heal': 2, 'depth_NN_state': 3, 'mode_heal': 64, 'mode_state': 20, 'blocks_heal': 5, 'blocks_state': 3, 'lift_act_state': <built-in function gelu>, 'block_act_state': <built-in function gelu>, 'lift_act_heal': <built-in function gelu>, 'block_act_heal': None, 'width_heal': 43, 'width_state': 83, 'lr': 0.001259107379367249, 'padding_heal': 0, 'padding_state': 20, 'optimizer_type': 'adam'}. Best is trial 1511 with value: 0.0009640019852668047.
[I 2025-07-31 00:22:29,168] Trial 2492 finished with value: 0.0011379366042092443 and parameters: {'width_NN_heal': 470, 'width_NN_state': 288, 'depth_NN_heal': 2, 'depth_NN_state': 3, 'mode_heal': 64, 'mode_state': 64, 'blocks_heal': 5, 'blocks_state': 3, 'lift_act_state': <built-in function gelu>, 'block_act_state': <built-in function gelu>, 'lift_act_heal': <built-in function gelu>, 'block_act_heal': None, 'width_heal': 47, 'width_state': 97, 'lr': 0.001564683170181512, 'padding_heal': 1, 'padding_state': 19, 'optimizer_type': 'adam'}. Best is trial 1511 with value: 0.0009640019852668047.
[I 2025-07-31 00:22:33,199] Trial 2493 finished with value: 0.0032428153790533543 and parameters: {'width_NN_heal': 404, 'width_NN_state': 9, 'depth_NN_heal': 2, 'depth_NN_state': 3, 'mode_heal': 64, 'mode_state': 60, 'blocks_heal': 5, 'blocks_state': 3, 'lift_act_state': <built-in function gelu>, 'block_act_state': <built-in function gelu>, 'lift_act_heal': <built-in function gelu>, 'block_act_heal': None, 'width_heal': 49, 'width_state': 91, 'lr': 0.0017054715490796145, 'padding_heal': 1, 'padding_state': 19, 'optimizer_type': 'adam'}. Best is trial 1511 with value: 0.0009640019852668047.
[I 2025-07-31 00:22:37,321] Trial 2494 finished with value: 0.0011969964252784848 and parameters: {'width_NN_heal': 355, 'width_NN_state': 291, 'depth_NN_heal': 2, 'depth_NN_state': 3, 'mode_heal': 64, 'mode_state': 64, 'blocks_heal': 5, 'blocks_state': 3, 'lift_act_state': <built-in function gelu>, 'block_act_state': <built-in function gelu>, 'lift_act_heal': <built-in function gelu>, 'block_act_heal': None, 'width_heal': 50, 'width_state': 80, 'lr': 0.0010812549881736723, 'padding_heal': 1, 'padding_state': 19, 'optimizer_type': 'adam'}. Best is trial 1511 with value: 0.0009640019852668047.
[I 2025-07-31 00:22:41,924] Trial 2495 finished with value: 0.0011504285503178835 and parameters: {'width_NN_heal': 443, 'width_NN_state': 262, 'depth_NN_heal': 3, 'depth_NN_state': 3, 'mode_heal': 64, 'mode_state': 60, 'blocks_heal': 5, 'blocks_state': 3, 'lift_act_state': <built-in function gelu>, 'block_act_state': <built-in function gelu>, 'lift_act_heal': <function tanh at 0x7ff3611b4cc0>, 'block_act_heal': None, 'width_heal': 50, 'width_state': 98, 'lr': 0.0014771895034179565, 'padding_heal': 0, 'padding_state': 20, 'optimizer_type': 'adam'}. Best is trial 1511 with value: 0.0009640019852668047.
[I 2025-07-31 00:22:45,954] Trial 2496 finished with value: 0.0014091694029048085 and parameters: {'width_NN_heal': 386, 'width_NN_state': 227, 'depth_NN_heal': 2, 'depth_NN_state': 3, 'mode_heal': 64, 'mode_state': 56, 'blocks_heal': 5, 'blocks_state': 3, 'lift_act_state': <built-in function gelu>, 'block_act_state': <built-in function gelu>, 'lift_act_heal': <built-in function gelu>, 'block_act_heal': None, 'width_heal': 41, 'width_state': 98, 'lr': 0.0009908343043828658, 'padding_heal': 1, 'padding_state': 19, 'optimizer_type': 'adam'}. Best is trial 1511 with value: 0.0009640019852668047.
[I 2025-07-31 00:22:49,843] Trial 2497 finished with value: 0.0013920215424150229 and parameters: {'width_NN_heal': 353, 'width_NN_state': 292, 'depth_NN_heal': 1, 'depth_NN_state': 3, 'mode_heal': 64, 'mode_state': 64, 'blocks_heal': 5, 'blocks_state': 3, 'lift_act_state': <function tanh at 0x7ff3611b4cc0>, 'block_act_state': <built-in function gelu>, 'lift_act_heal': <built-in function gelu>, 'block_act_heal': None, 'width_heal': 46, 'width_state': 74, 'lr': 0.0012191404796192179, 'padding_heal': 1, 'padding_state': 19, 'optimizer_type': 'adam'}. Best is trial 1511 with value: 0.0009640019852668047.
[I 2025-07-31 00:22:54,000] Trial 2498 finished with value: 0.001154332421720028 and parameters: {'width_NN_heal': 432, 'width_NN_state': 252, 'depth_NN_heal': 2, 'depth_NN_state': 3, 'mode_heal': 44, 'mode_state': 60, 'blocks_heal': 5, 'blocks_state': 3, 'lift_act_state': <built-in function gelu>, 'block_act_state': <built-in function gelu>, 'lift_act_heal': <function tanh at 0x7ff3611b4cc0>, 'block_act_heal': <built-in function gelu>, 'width_heal': 43, 'width_state': 91, 'lr': 0.0013700960921237402, 'padding_heal': 2, 'padding_state': 20, 'optimizer_type': 'adam'}. Best is trial 1511 with value: 0.0009640019852668047.
[I 2025-07-31 00:22:58,176] Trial 2499 finished with value: 0.0011803004890680313 and parameters: {'width_NN_heal': 412, 'width_NN_state': 294, 'depth_NN_heal': 2, 'depth_NN_state': 3, 'mode_heal': 64, 'mode_state': 56, 'blocks_heal': 5, 'blocks_state': 3, 'lift_act_state': <built-in function gelu>, 'block_act_state': <built-in function gelu>, 'lift_act_heal': <built-in function gelu>, 'block_act_heal': None, 'width_heal': 44, 'width_state': 84, 'lr': 0.0016581887936289532, 'padding_heal': 0, 'padding_state': 19, 'optimizer_type': 'adam'}. Best is trial 1511 with value: 0.0009640019852668047.
Best trial:
FrozenTrial(number=1511, state=1, values=[0.0009640019852668047], datetime_start=datetime.datetime(2025, 7, 30, 23, 0, 14, 296232), datetime_complete=datetime.datetime(2025, 7, 30, 23, 0, 19, 253809), params={'width_NN_heal': 406, 'width_NN_state': 283, 'depth_NN_heal': 2, 'depth_NN_state': 3, 'mode_heal': 60, 'mode_state': 56, 'blocks_heal': 8, 'blocks_state': 3, 'lift_act_state': <built-in function gelu>, 'block_act_state': <built-in function gelu>, 'lift_act_heal': <built-in function gelu>, 'block_act_heal': None, 'width_heal': 46, 'width_state': 109, 'lr': 0.0017813397998222417, 'padding_heal': 1, 'padding_state': 17, 'optimizer_type': 'lbfgs'}, user_attrs={}, system_attrs={}, intermediate_values={}, distributions={'width_NN_heal': IntDistribution(high=512, log=True, low=8, step=1), 'width_NN_state': IntDistribution(high=512, log=True, low=8, step=1), 'depth_NN_heal': IntDistribution(high=8, log=False, low=1, step=1), 'depth_NN_state': IntDistribution(high=8, log=False, low=1, step=1), 'mode_heal': IntDistribution(high=64, log=False, low=12, step=4), 'mode_state': IntDistribution(high=64, log=False, low=12, step=4), 'blocks_heal': IntDistribution(high=8, log=False, low=1, step=1), 'blocks_state': IntDistribution(high=8, log=False, low=1, step=1), 'lift_act_state': CategoricalDistribution(choices=(None, <function tanh at 0x7ff3611b4cc0>, <built-in function gelu>)), 'block_act_state': CategoricalDistribution(choices=(None, <function tanh at 0x7ff3611b4cc0>, <built-in function gelu>)), 'lift_act_heal': CategoricalDistribution(choices=(None, <function tanh at 0x7ff3611b4cc0>, <built-in function gelu>)), 'block_act_heal': CategoricalDistribution(choices=(None, <function tanh at 0x7ff3611b4cc0>, <built-in function gelu>)), 'width_heal': IntDistribution(high=128, log=True, low=4, step=1), 'width_state': IntDistribution(high=128, log=True, low=4, step=1), 'lr': FloatDistribution(high=0.01, log=True, low=0.0001, step=None), 'padding_heal': IntDistribution(high=32, log=False, low=0, step=1), 'padding_state': IntDistribution(high=32, log=False, low=0, step=1), 'optimizer_type': CategoricalDistribution(choices=('adam', 'lbfgs'))}, trial_id=1511, value=None)
