[I 2025-07-30 21:00:11,984] Trial 71 finished with value: 0.0018308258149772882 and parameters: {'width_NN_heal': 13, 'width_NN_state': 11, 'depth_NN_heal': 8, 'depth_NN_state': 5, 'mode_heal': 12, 'mode_state': 60, 'blocks_heal': 8, 'blocks_state': 3, 'lift_act_state': <function tanh at 0x7ff3611b4cc0>, 'block_act_state': <built-in function gelu>, 'lift_act_heal': <built-in function gelu>, 'block_act_heal': <built-in function gelu>, 'width_heal': 91, 'width_state': 54, 'lr': 0.006926870326314468, 'padding_heal': 25, 'padding_state': 28, 'optimizer_type': 'adam'}. Best is trial 54 with value: 0.0014391255099326372.
[I 2025-07-30 21:00:17,173] Trial 72 finished with value: 0.004231435712426901 and parameters: {'width_NN_heal': 96, 'width_NN_state': 29, 'depth_NN_heal': 8, 'depth_NN_state': 4, 'mode_heal': 16, 'mode_state': 64, 'blocks_heal': 8, 'blocks_state': 3, 'lift_act_state': <function tanh at 0x7ff3611b4cc0>, 'block_act_state': <built-in function gelu>, 'lift_act_heal': None, 'block_act_heal': <built-in function gelu>, 'width_heal': 4, 'width_state': 65, 'lr': 0.005642201221476283, 'padding_heal': 22, 'padding_state': 31, 'optimizer_type': 'adam'}. Best is trial 54 with value: 0.0014391255099326372.
[I 2025-07-30 21:00:22,161] Trial 73 finished with value: 0.0018472153460606933 and parameters: {'width_NN_heal': 10, 'width_NN_state': 18, 'depth_NN_heal': 8, 'depth_NN_state': 4, 'mode_heal': 32, 'mode_state': 64, 'blocks_heal': 8, 'blocks_state': 2, 'lift_act_state': <function tanh at 0x7ff3611b4cc0>, 'block_act_state': <built-in function gelu>, 'lift_act_heal': None, 'block_act_heal': <built-in function gelu>, 'width_heal': 60, 'width_state': 83, 'lr': 0.004354813065239226, 'padding_heal': 16, 'padding_state': 24, 'optimizer_type': 'adam'}. Best is trial 54 with value: 0.0014391255099326372.
[I 2025-07-30 21:00:27,628] Trial 74 finished with value: 0.0027699994388967752 and parameters: {'width_NN_heal': 15, 'width_NN_state': 13, 'depth_NN_heal': 7, 'depth_NN_state': 6, 'mode_heal': 16, 'mode_state': 56, 'blocks_heal': 8, 'blocks_state': 3, 'lift_act_state': <function tanh at 0x7ff3611b4cc0>, 'block_act_state': <built-in function gelu>, 'lift_act_heal': <function tanh at 0x7ff3611b4cc0>, 'block_act_heal': <built-in function gelu>, 'width_heal': 76, 'width_state': 49, 'lr': 0.0013525745990315967, 'padding_heal': 18, 'padding_state': 26, 'optimizer_type': 'adam'}. Best is trial 54 with value: 0.0014391255099326372.
[I 2025-07-30 21:00:32,362] Trial 75 finished with value: 0.0017586209578439593 and parameters: {'width_NN_heal': 8, 'width_NN_state': 16, 'depth_NN_heal': 8, 'depth_NN_state': 6, 'mode_heal': 12, 'mode_state': 60, 'blocks_heal': 7, 'blocks_state': 2, 'lift_act_state': <function tanh at 0x7ff3611b4cc0>, 'block_act_state': <built-in function gelu>, 'lift_act_heal': None, 'block_act_heal': <built-in function gelu>, 'width_heal': 101, 'width_state': 31, 'lr': 0.0033204582147219747, 'padding_heal': 30, 'padding_state': 30, 'optimizer_type': 'adam'}. Best is trial 54 with value: 0.0014391255099326372.
[I 2025-07-30 21:00:37,543] Trial 76 finished with value: 0.030744925141334534 and parameters: {'width_NN_heal': 12, 'width_NN_state': 9, 'depth_NN_heal': 8, 'depth_NN_state': 5, 'mode_heal': 12, 'mode_state': 64, 'blocks_heal': 6, 'blocks_state': 4, 'lift_act_state': <function tanh at 0x7ff3611b4cc0>, 'block_act_state': <built-in function gelu>, 'lift_act_heal': <built-in function gelu>, 'block_act_heal': <built-in function gelu>, 'width_heal': 23, 'width_state': 72, 'lr': 0.0001003159054466188, 'padding_heal': 20, 'padding_state': 29, 'optimizer_type': 'adam'}. Best is trial 54 with value: 0.0014391255099326372.
[I 2025-07-30 21:00:42,514] Trial 77 finished with value: 0.017095768824219704 and parameters: {'width_NN_heal': 23, 'width_NN_state': 55, 'depth_NN_heal': 7, 'depth_NN_state': 3, 'mode_heal': 36, 'mode_state': 60, 'blocks_heal': 7, 'blocks_state': 3, 'lift_act_state': <function tanh at 0x7ff3611b4cc0>, 'block_act_state': <built-in function gelu>, 'lift_act_heal': None, 'block_act_heal': <built-in function gelu>, 'width_heal': 114, 'width_state': 55, 'lr': 0.007972482870793034, 'padding_heal': 26, 'padding_state': 31, 'optimizer_type': 'adam'}. Best is trial 54 with value: 0.0014391255099326372.
[I 2025-07-30 21:00:48,207] Trial 78 finished with value: 0.002032169606536627 and parameters: {'width_NN_heal': 29, 'width_NN_state': 21, 'depth_NN_heal': 8, 'depth_NN_state': 5, 'mode_heal': 16, 'mode_state': 56, 'blocks_heal': 8, 'blocks_state': 4, 'lift_act_state': <function tanh at 0x7ff3611b4cc0>, 'block_act_state': <built-in function gelu>, 'lift_act_heal': None, 'block_act_heal': <built-in function gelu>, 'width_heal': 89, 'width_state': 62, 'lr': 0.005579888629618743, 'padding_heal': 14, 'padding_state': 27, 'optimizer_type': 'adam'}. Best is trial 54 with value: 0.0014391255099326372.
[I 2025-07-30 21:00:53,479] Trial 79 finished with value: 0.002451400039717555 and parameters: {'width_NN_heal': 10, 'width_NN_state': 41, 'depth_NN_heal': 7, 'depth_NN_state': 4, 'mode_heal': 44, 'mode_state': 52, 'blocks_heal': 8, 'blocks_state': 3, 'lift_act_state': <built-in function gelu>, 'block_act_state': None, 'lift_act_heal': None, 'block_act_heal': <built-in function gelu>, 'width_heal': 38, 'width_state': 40, 'lr': 0.008519495165995511, 'padding_heal': 28, 'padding_state': 32, 'optimizer_type': 'adam'}. Best is trial 54 with value: 0.0014391255099326372.
[I 2025-07-30 21:00:57,966] Trial 80 finished with value: 0.004999273456633091 and parameters: {'width_NN_heal': 18, 'width_NN_state': 123, 'depth_NN_heal': 6, 'depth_NN_state': 3, 'mode_heal': 12, 'mode_state': 36, 'blocks_heal': 7, 'blocks_state': 2, 'lift_act_state': <function tanh at 0x7ff3611b4cc0>, 'block_act_state': <built-in function gelu>, 'lift_act_heal': None, 'block_act_heal': <function tanh at 0x7ff3611b4cc0>, 'width_heal': 31, 'width_state': 77, 'lr': 0.00035275335686941946, 'padding_heal': 22, 'padding_state': 28, 'optimizer_type': 'adam'}. Best is trial 54 with value: 0.0014391255099326372.
[I 2025-07-30 21:01:02,859] Trial 81 finished with value: 0.0021084060426801443 and parameters: {'width_NN_heal': 14, 'width_NN_state': 9, 'depth_NN_heal': 8, 'depth_NN_state': 4, 'mode_heal': 16, 'mode_state': 56, 'blocks_heal': 6, 'blocks_state': 4, 'lift_act_state': <function tanh at 0x7ff3611b4cc0>, 'block_act_state': <built-in function gelu>, 'lift_act_heal': None, 'block_act_heal': <built-in function gelu>, 'width_heal': 59, 'width_state': 66, 'lr': 0.004057513887728022, 'padding_heal': 24, 'padding_state': 32, 'optimizer_type': 'adam'}. Best is trial 54 with value: 0.0014391255099326372.
[I 2025-07-30 21:01:07,795] Trial 82 finished with value: 0.002345539629459381 and parameters: {'width_NN_heal': 20, 'width_NN_state': 10, 'depth_NN_heal': 8, 'depth_NN_state': 4, 'mode_heal': 16, 'mode_state': 44, 'blocks_heal': 6, 'blocks_state': 4, 'lift_act_state': <function tanh at 0x7ff3611b4cc0>, 'block_act_state': <built-in function gelu>, 'lift_act_heal': None, 'block_act_heal': <built-in function gelu>, 'width_heal': 65, 'width_state': 49, 'lr': 0.004672969300806897, 'padding_heal': 23, 'padding_state': 30, 'optimizer_type': 'adam'}. Best is trial 54 with value: 0.0014391255099326372.
[I 2025-07-30 21:01:12,761] Trial 83 finished with value: 0.0018300646916031837 and parameters: {'width_NN_heal': 11, 'width_NN_state': 73, 'depth_NN_heal': 8, 'depth_NN_state': 4, 'mode_heal': 12, 'mode_state': 60, 'blocks_heal': 6, 'blocks_state': 4, 'lift_act_state': <function tanh at 0x7ff3611b4cc0>, 'block_act_state': <built-in function gelu>, 'lift_act_heal': None, 'block_act_heal': <built-in function gelu>, 'width_heal': 56, 'width_state': 118, 'lr': 0.006912644477568557, 'padding_heal': 23, 'padding_state': 32, 'optimizer_type': 'adam'}. Best is trial 54 with value: 0.0014391255099326372.
[I 2025-07-30 21:01:17,573] Trial 84 finished with value: 0.002648798981681466 and parameters: {'width_NN_heal': 25, 'width_NN_state': 8, 'depth_NN_heal': 8, 'depth_NN_state': 5, 'mode_heal': 64, 'mode_state': 56, 'blocks_heal': 6, 'blocks_state': 3, 'lift_act_state': <function tanh at 0x7ff3611b4cc0>, 'block_act_state': <built-in function gelu>, 'lift_act_heal': None, 'block_act_heal': <built-in function gelu>, 'width_heal': 47, 'width_state': 102, 'lr': 0.003016093934990209, 'padding_heal': 19, 'padding_state': 31, 'optimizer_type': 'adam'}. Best is trial 54 with value: 0.0014391255099326372.
[I 2025-07-30 21:01:23,191] Trial 85 finished with value: 0.016866540536284447 and parameters: {'width_NN_heal': 9, 'width_NN_state': 11, 'depth_NN_heal': 8, 'depth_NN_state': 7, 'mode_heal': 16, 'mode_state': 60, 'blocks_heal': 7, 'blocks_state': 4, 'lift_act_state': <function tanh at 0x7ff3611b4cc0>, 'block_act_state': <built-in function gelu>, 'lift_act_heal': None, 'block_act_heal': <built-in function gelu>, 'width_heal': 115, 'width_state': 69, 'lr': 0.003816167949365117, 'padding_heal': 21, 'padding_state': 30, 'optimizer_type': 'adam'}. Best is trial 54 with value: 0.0014391255099326372.
[I 2025-07-30 21:01:28,100] Trial 86 finished with value: 0.00179276242852211 and parameters: {'width_NN_heal': 13, 'width_NN_state': 13, 'depth_NN_heal': 7, 'depth_NN_state': 4, 'mode_heal': 20, 'mode_state': 32, 'blocks_heal': 5, 'blocks_state': 5, 'lift_act_state': <function tanh at 0x7ff3611b4cc0>, 'block_act_state': <built-in function gelu>, 'lift_act_heal': None, 'block_act_heal': <built-in function gelu>, 'width_heal': 35, 'width_state': 87, 'lr': 0.005341963721036169, 'padding_heal': 20, 'padding_state': 29, 'optimizer_type': 'adam'}. Best is trial 54 with value: 0.0014391255099326372.
[I 2025-07-30 21:01:33,571] Trial 87 finished with value: 0.0022375313565135 and parameters: {'width_NN_heal': 16, 'width_NN_state': 9, 'depth_NN_heal': 8, 'depth_NN_state': 6, 'mode_heal': 12, 'mode_state': 64, 'blocks_heal': 8, 'blocks_state': 3, 'lift_act_state': <function tanh at 0x7ff3611b4cc0>, 'block_act_state': <function tanh at 0x7ff3611b4cc0>, 'lift_act_heal': <function tanh at 0x7ff3611b4cc0>, 'block_act_heal': <built-in function gelu>, 'width_heal': 79, 'width_state': 46, 'lr': 0.00430738448334803, 'padding_heal': 25, 'padding_state': 25, 'optimizer_type': 'adam'}. Best is trial 54 with value: 0.0014391255099326372.
[I 2025-07-30 21:01:39,099] Trial 88 finished with value: 0.00205479864962399 and parameters: {'width_NN_heal': 23, 'width_NN_state': 16, 'depth_NN_heal': 8, 'depth_NN_state': 5, 'mode_heal': 60, 'mode_state': 48, 'blocks_heal': 8, 'blocks_state': 4, 'lift_act_state': None, 'block_act_state': <built-in function gelu>, 'lift_act_heal': None, 'block_act_heal': <built-in function gelu>, 'width_heal': 68, 'width_state': 56, 'lr': 0.006467241852209656, 'padding_heal': 27, 'padding_state': 31, 'optimizer_type': 'adam'}. Best is trial 54 with value: 0.0014391255099326372.
[I 2025-07-30 21:01:43,981] Trial 89 finished with value: 0.00209038145840168 and parameters: {'width_NN_heal': 12, 'width_NN_state': 114, 'depth_NN_heal': 7, 'depth_NN_state': 3, 'mode_heal': 24, 'mode_state': 56, 'blocks_heal': 7, 'blocks_state': 3, 'lift_act_state': <function tanh at 0x7ff3611b4cc0>, 'block_act_state': <built-in function gelu>, 'lift_act_heal': <built-in function gelu>, 'block_act_heal': <built-in function gelu>, 'width_heal': 97, 'width_state': 95, 'lr': 0.007577190393993487, 'padding_heal': 28, 'padding_state': 28, 'optimizer_type': 'adam'}. Best is trial 54 with value: 0.0014391255099326372.
[I 2025-07-30 21:01:48,994] Trial 90 finished with value: 0.003677089000120759 and parameters: {'width_NN_heal': 18, 'width_NN_state': 10, 'depth_NN_heal': 8, 'depth_NN_state': 6, 'mode_heal': 16, 'mode_state': 60, 'blocks_heal': 8, 'blocks_state': 2, 'lift_act_state': <function tanh at 0x7ff3611b4cc0>, 'block_act_state': <built-in function gelu>, 'lift_act_heal': None, 'block_act_heal': <built-in function gelu>, 'width_heal': 16, 'width_state': 61, 'lr': 0.002622055777152567, 'padding_heal': 17, 'padding_state': 32, 'optimizer_type': 'adam'}. Best is trial 54 with value: 0.0014391255099326372.
[I 2025-07-30 21:01:54,230] Trial 91 finished with value: 0.0018063320312649012 and parameters: {'width_NN_heal': 14, 'width_NN_state': 10, 'depth_NN_heal': 8, 'depth_NN_state': 4, 'mode_heal': 12, 'mode_state': 64, 'blocks_heal': 8, 'blocks_state': 3, 'lift_act_state': <function tanh at 0x7ff3611b4cc0>, 'block_act_state': <built-in function gelu>, 'lift_act_heal': None, 'block_act_heal': <built-in function gelu>, 'width_heal': 126, 'width_state': 51, 'lr': 0.005913391614361799, 'padding_heal': 24, 'padding_state': 28, 'optimizer_type': 'adam'}. Best is trial 54 with value: 0.0014391255099326372.
[I 2025-07-30 21:01:59,204] Trial 92 finished with value: 0.0017793583683669567 and parameters: {'width_NN_heal': 11, 'width_NN_state': 13, 'depth_NN_heal': 8, 'depth_NN_state': 1, 'mode_heal': 12, 'mode_state': 64, 'blocks_heal': 8, 'blocks_state': 3, 'lift_act_state': <function tanh at 0x7ff3611b4cc0>, 'block_act_state': <built-in function gelu>, 'lift_act_heal': None, 'block_act_heal': <built-in function gelu>, 'width_heal': 121, 'width_state': 35, 'lr': 0.004961216727423383, 'padding_heal': 26, 'padding_state': 30, 'optimizer_type': 'adam'}. Best is trial 54 with value: 0.0014391255099326372.
[I 2025-07-30 21:02:04,434] Trial 93 finished with value: 0.0015782949049025774 and parameters: {'width_NN_heal': 12, 'width_NN_state': 12, 'depth_NN_heal': 8, 'depth_NN_state': 4, 'mode_heal': 12, 'mode_state': 64, 'blocks_heal': 8, 'blocks_state': 3, 'lift_act_state': <function tanh at 0x7ff3611b4cc0>, 'block_act_state': <built-in function gelu>, 'lift_act_heal': None, 'block_act_heal': <built-in function gelu>, 'width_heal': 109, 'width_state': 75, 'lr': 0.009176661340724118, 'padding_heal': 25, 'padding_state': 31, 'optimizer_type': 'adam'}. Best is trial 54 with value: 0.0014391255099326372.
[I 2025-07-30 21:02:09,643] Trial 94 finished with value: 0.0022574204485863447 and parameters: {'width_NN_heal': 8, 'width_NN_state': 12, 'depth_NN_heal': 8, 'depth_NN_state': 4, 'mode_heal': 16, 'mode_state': 60, 'blocks_heal': 8, 'blocks_state': 3, 'lift_act_state': <function tanh at 0x7ff3611b4cc0>, 'block_act_state': <built-in function gelu>, 'lift_act_heal': None, 'block_act_heal': <built-in function gelu>, 'width_heal': 107, 'width_state': 75, 'lr': 0.008461290966473045, 'padding_heal': 25, 'padding_state': 31, 'optimizer_type': 'adam'}. Best is trial 54 with value: 0.0014391255099326372.
[I 2025-07-30 21:02:14,553] Trial 95 finished with value: 0.0018322403775528073 and parameters: {'width_NN_heal': 16, 'width_NN_state': 11, 'depth_NN_heal': 8, 'depth_NN_state': 4, 'mode_heal': 20, 'mode_state': 64, 'blocks_heal': 7, 'blocks_state': 3, 'lift_act_state': <function tanh at 0x7ff3611b4cc0>, 'block_act_state': <built-in function gelu>, 'lift_act_heal': None, 'block_act_heal': <built-in function gelu>, 'width_heal': 92, 'width_state': 82, 'lr': 0.009393085917325971, 'padding_heal': 21, 'padding_state': 32, 'optimizer_type': 'adam'}. Best is trial 54 with value: 0.0014391255099326372.
[I 2025-07-30 21:02:21,333] Trial 96 finished with value: 0.002439286792650819 and parameters: {'width_NN_heal': 10, 'width_NN_state': 9, 'depth_NN_heal': 7, 'depth_NN_state': 4, 'mode_heal': 32, 'mode_state': 60, 'blocks_heal': 8, 'blocks_state': 8, 'lift_act_state': <function tanh at 0x7ff3611b4cc0>, 'block_act_state': <built-in function gelu>, 'lift_act_heal': None, 'block_act_heal': <built-in function gelu>, 'width_heal': 85, 'width_state': 65, 'lr': 0.007323498924171904, 'padding_heal': 23, 'padding_state': 31, 'optimizer_type': 'adam'}. Best is trial 54 with value: 0.0014391255099326372.
[I 2025-07-30 21:02:25,544] Trial 97 finished with value: 0.0018225793028250337 and parameters: {'width_NN_heal': 12, 'width_NN_state': 8, 'depth_NN_heal': 8, 'depth_NN_state': 3, 'mode_heal': 12, 'mode_state': 64, 'blocks_heal': 4, 'blocks_state': 4, 'lift_act_state': <function tanh at 0x7ff3611b4cc0>, 'block_act_state': <built-in function gelu>, 'lift_act_heal': None, 'block_act_heal': <function tanh at 0x7ff3611b4cc0>, 'width_heal': 42, 'width_state': 112, 'lr': 0.006527635502209261, 'padding_heal': 25, 'padding_state': 29, 'optimizer_type': 'adam'}. Best is trial 54 with value: 0.0014391255099326372.
[I 2025-07-30 21:02:32,014] Trial 98 finished with value: 27.855867385864258 and parameters: {'width_NN_heal': 497, 'width_NN_state': 15, 'depth_NN_heal': 4, 'depth_NN_state': 6, 'mode_heal': 64, 'mode_state': 56, 'blocks_heal': 7, 'blocks_state': 2, 'lift_act_state': <built-in function gelu>, 'block_act_state': None, 'lift_act_heal': None, 'block_act_heal': <built-in function gelu>, 'width_heal': 100, 'width_state': 71, 'lr': 0.009301213905511797, 'padding_heal': 22, 'padding_state': 30, 'optimizer_type': 'adam'}. Best is trial 54 with value: 0.0014391255099326372.
[I 2025-07-30 21:02:37,434] Trial 99 finished with value: 0.0015992303378880024 and parameters: {'width_NN_heal': 9, 'width_NN_state': 96, 'depth_NN_heal': 7, 'depth_NN_state': 4, 'mode_heal': 60, 'mode_state': 60, 'blocks_heal': 8, 'blocks_state': 4, 'lift_act_state': <function tanh at 0x7ff3611b4cc0>, 'block_act_state': <built-in function gelu>, 'lift_act_heal': None, 'block_act_heal': <built-in function gelu>, 'width_heal': 56, 'width_state': 57, 'lr': 0.002148584200252422, 'padding_heal': 15, 'padding_state': 27, 'optimizer_type': 'adam'}. Best is trial 54 with value: 0.0014391255099326372.
[I 2025-07-30 21:02:42,916] Trial 100 finished with value: 0.0018202144419774413 and parameters: {'width_NN_heal': 10, 'width_NN_state': 94, 'depth_NN_heal': 7, 'depth_NN_state': 5, 'mode_heal': 56, 'mode_state': 60, 'blocks_heal': 8, 'blocks_state': 3, 'lift_act_state': <function tanh at 0x7ff3611b4cc0>, 'block_act_state': <built-in function gelu>, 'lift_act_heal': <built-in function gelu>, 'block_act_heal': <built-in function gelu>, 'width_heal': 47, 'width_state': 128, 'lr': 0.001781684623800968, 'padding_heal': 14, 'padding_state': 26, 'optimizer_type': 'lbfgs'}. Best is trial 54 with value: 0.0014391255099326372.
[I 2025-07-30 21:02:48,350] Trial 101 finished with value: 0.002121314173564315 and parameters: {'width_NN_heal': 9, 'width_NN_state': 108, 'depth_NN_heal': 8, 'depth_NN_state': 4, 'mode_heal': 60, 'mode_state': 60, 'blocks_heal': 8, 'blocks_state': 4, 'lift_act_state': <function tanh at 0x7ff3611b4cc0>, 'block_act_state': <built-in function gelu>, 'lift_act_heal': None, 'block_act_heal': <built-in function gelu>, 'width_heal': 56, 'width_state': 58, 'lr': 0.0007554091709407518, 'padding_heal': 15, 'padding_state': 27, 'optimizer_type': 'adam'}. Best is trial 54 with value: 0.0014391255099326372.
[I 2025-07-30 21:02:54,004] Trial 102 finished with value: 0.0019102819496765733 and parameters: {'width_NN_heal': 11, 'width_NN_state': 82, 'depth_NN_heal': 5, 'depth_NN_state': 4, 'mode_heal': 60, 'mode_state': 64, 'blocks_heal': 8, 'blocks_state': 5, 'lift_act_state': <function tanh at 0x7ff3611b4cc0>, 'block_act_state': <built-in function gelu>, 'lift_act_heal': None, 'block_act_heal': <built-in function gelu>, 'width_heal': 70, 'width_state': 91, 'lr': 0.0020970653613102417, 'padding_heal': 13, 'padding_state': 29, 'optimizer_type': 'adam'}. Best is trial 54 with value: 0.0014391255099326372.
[I 2025-07-30 21:02:59,647] Trial 103 finished with value: 0.001574942609295249 and parameters: {'width_NN_heal': 13, 'width_NN_state': 70, 'depth_NN_heal': 8, 'depth_NN_state': 4, 'mode_heal': 56, 'mode_state': 56, 'blocks_heal': 8, 'blocks_state': 4, 'lift_act_state': <function tanh at 0x7ff3611b4cc0>, 'block_act_state': <built-in function gelu>, 'lift_act_heal': None, 'block_act_heal': <built-in function gelu>, 'width_heal': 50, 'width_state': 41, 'lr': 0.0032369247509702426, 'padding_heal': 16, 'padding_state': 31, 'optimizer_type': 'adam'}. Best is trial 54 with value: 0.0014391255099326372.
[I 2025-07-30 21:03:04,818] Trial 104 finished with value: 0.0014572241343557835 and parameters: {'width_NN_heal': 14, 'width_NN_state': 68, 'depth_NN_heal': 7, 'depth_NN_state': 4, 'mode_heal': 56, 'mode_state': 64, 'blocks_heal': 8, 'blocks_state': 3, 'lift_act_state': <function tanh at 0x7ff3611b4cc0>, 'block_act_state': <built-in function gelu>, 'lift_act_heal': None, 'block_act_heal': <built-in function gelu>, 'width_heal': 80, 'width_state': 53, 'lr': 0.0025947481138366172, 'padding_heal': 16, 'padding_state': 30, 'optimizer_type': 'adam'}. Best is trial 54 with value: 0.0014391255099326372.
[I 2025-07-30 21:03:10,279] Trial 105 finished with value: 0.0017469857120886445 and parameters: {'width_NN_heal': 15, 'width_NN_state': 68, 'depth_NN_heal': 6, 'depth_NN_state': 4, 'mode_heal': 56, 'mode_state': 56, 'blocks_heal': 8, 'blocks_state': 4, 'lift_act_state': <function tanh at 0x7ff3611b4cc0>, 'block_act_state': <built-in function gelu>, 'lift_act_heal': None, 'block_act_heal': <built-in function gelu>, 'width_heal': 49, 'width_state': 44, 'lr': 0.0027078805114351084, 'padding_heal': 16, 'padding_state': 31, 'optimizer_type': 'adam'}. Best is trial 54 with value: 0.0014391255099326372.
[I 2025-07-30 21:03:15,465] Trial 106 finished with value: 0.002992648631334305 and parameters: {'width_NN_heal': 12, 'width_NN_state': 56, 'depth_NN_heal': 7, 'depth_NN_state': 2, 'mode_heal': 56, 'mode_state': 60, 'blocks_heal': 8, 'blocks_state': 4, 'lift_act_state': <function tanh at 0x7ff3611b4cc0>, 'block_act_state': <function tanh at 0x7ff3611b4cc0>, 'lift_act_heal': None, 'block_act_heal': <built-in function gelu>, 'width_heal': 40, 'width_state': 54, 'lr': 0.0021447835675461745, 'padding_heal': 15, 'padding_state': 30, 'optimizer_type': 'adam'}. Best is trial 54 with value: 0.0014391255099326372.
