[I 2025-07-30 23:32:45,764] Trial 1878 finished with value: 0.0011024794075638056 and parameters: {'width_NN_heal': 512, 'width_NN_state': 318, 'depth_NN_heal': 2, 'depth_NN_state': 3, 'mode_heal': 60, 'mode_state': 60, 'blocks_heal': 8, 'blocks_state': 3, 'lift_act_state': <built-in function gelu>, 'block_act_state': <built-in function gelu>, 'lift_act_heal': <built-in function gelu>, 'block_act_heal': None, 'width_heal': 79, 'width_state': 99, 'lr': 0.0011917280109491426, 'padding_heal': 3, 'padding_state': 17, 'optimizer_type': 'lbfgs'}. Best is trial 1511 with value: 0.0009640019852668047.
[I 2025-07-30 23:32:51,472] Trial 1879 finished with value: 0.00118659355212003 and parameters: {'width_NN_heal': 468, 'width_NN_state': 400, 'depth_NN_heal': 2, 'depth_NN_state': 3, 'mode_heal': 60, 'mode_state': 60, 'blocks_heal': 8, 'blocks_state': 4, 'lift_act_state': <built-in function gelu>, 'block_act_state': <built-in function gelu>, 'lift_act_heal': <built-in function gelu>, 'block_act_heal': None, 'width_heal': 35, 'width_state': 106, 'lr': 0.0014855307022607095, 'padding_heal': 4, 'padding_state': 15, 'optimizer_type': 'lbfgs'}. Best is trial 1511 with value: 0.0009640019852668047.
[I 2025-07-30 23:32:56,588] Trial 1880 finished with value: 0.0011500758118927479 and parameters: {'width_NN_heal': 474, 'width_NN_state': 301, 'depth_NN_heal': 2, 'depth_NN_state': 3, 'mode_heal': 56, 'mode_state': 60, 'blocks_heal': 8, 'blocks_state': 3, 'lift_act_state': <built-in function gelu>, 'block_act_state': <built-in function gelu>, 'lift_act_heal': <built-in function gelu>, 'block_act_heal': None, 'width_heal': 58, 'width_state': 81, 'lr': 0.0013947401519791933, 'padding_heal': 2, 'padding_state': 17, 'optimizer_type': 'lbfgs'}. Best is trial 1511 with value: 0.0009640019852668047.
[I 2025-07-30 23:33:01,674] Trial 1881 finished with value: 0.0012133556883782148 and parameters: {'width_NN_heal': 450, 'width_NN_state': 341, 'depth_NN_heal': 2, 'depth_NN_state': 3, 'mode_heal': 64, 'mode_state': 48, 'blocks_heal': 8, 'blocks_state': 3, 'lift_act_state': <built-in function gelu>, 'block_act_state': <built-in function gelu>, 'lift_act_heal': <built-in function gelu>, 'block_act_heal': None, 'width_heal': 33, 'width_state': 19, 'lr': 0.0012789647831242985, 'padding_heal': 4, 'padding_state': 16, 'optimizer_type': 'adam'}. Best is trial 1511 with value: 0.0009640019852668047.
[I 2025-07-30 23:33:07,595] Trial 1882 finished with value: 0.007366937585175037 and parameters: {'width_NN_heal': 480, 'width_NN_state': 432, 'depth_NN_heal': 3, 'depth_NN_state': 3, 'mode_heal': 60, 'mode_state': 60, 'blocks_heal': 8, 'blocks_state': 3, 'lift_act_state': <built-in function gelu>, 'block_act_state': <built-in function gelu>, 'lift_act_heal': <built-in function gelu>, 'block_act_heal': <built-in function gelu>, 'width_heal': 39, 'width_state': 96, 'lr': 0.001561770143154417, 'padding_heal': 3, 'padding_state': 0, 'optimizer_type': 'lbfgs'}. Best is trial 1511 with value: 0.0009640019852668047.
[I 2025-07-30 23:33:13,743] Trial 1883 finished with value: 0.0011544403387233615 and parameters: {'width_NN_heal': 450, 'width_NN_state': 510, 'depth_NN_heal': 2, 'depth_NN_state': 3, 'mode_heal': 64, 'mode_state': 60, 'blocks_heal': 8, 'blocks_state': 3, 'lift_act_state': <built-in function gelu>, 'block_act_state': <built-in function gelu>, 'lift_act_heal': <built-in function gelu>, 'block_act_heal': None, 'width_heal': 64, 'width_state': 103, 'lr': 0.0015964872115867435, 'padding_heal': 2, 'padding_state': 17, 'optimizer_type': 'lbfgs'}. Best is trial 1511 with value: 0.0009640019852668047.
[I 2025-07-30 23:33:17,421] Trial 1884 finished with value: 0.0011429351288825274 and parameters: {'width_NN_heal': 441, 'width_NN_state': 284, 'depth_NN_heal': 2, 'depth_NN_state': 3, 'mode_heal': 60, 'mode_state': 60, 'blocks_heal': 2, 'blocks_state': 3, 'lift_act_state': <built-in function gelu>, 'block_act_state': <built-in function gelu>, 'lift_act_heal': <built-in function gelu>, 'block_act_heal': None, 'width_heal': 37, 'width_state': 87, 'lr': 0.001365639953387754, 'padding_heal': 4, 'padding_state': 20, 'optimizer_type': 'lbfgs'}. Best is trial 1511 with value: 0.0009640019852668047.
[I 2025-07-30 23:33:21,719] Trial 1885 finished with value: 0.0012212555157020688 and parameters: {'width_NN_heal': 255, 'width_NN_state': 327, 'depth_NN_heal': 2, 'depth_NN_state': 3, 'mode_heal': 56, 'mode_state': 36, 'blocks_heal': 6, 'blocks_state': 3, 'lift_act_state': <built-in function gelu>, 'block_act_state': <built-in function gelu>, 'lift_act_heal': None, 'block_act_heal': None, 'width_heal': 60, 'width_state': 103, 'lr': 0.0011814327268677342, 'padding_heal': 3, 'padding_state': 16, 'optimizer_type': 'lbfgs'}. Best is trial 1511 with value: 0.0009640019852668047.
[I 2025-07-30 23:33:26,870] Trial 1886 finished with value: 0.001119030173867941 and parameters: {'width_NN_heal': 435, 'width_NN_state': 375, 'depth_NN_heal': 2, 'depth_NN_state': 3, 'mode_heal': 64, 'mode_state': 60, 'blocks_heal': 8, 'blocks_state': 3, 'lift_act_state': <built-in function gelu>, 'block_act_state': <built-in function gelu>, 'lift_act_heal': <built-in function gelu>, 'block_act_heal': None, 'width_heal': 39, 'width_state': 92, 'lr': 0.0014743111489190063, 'padding_heal': 4, 'padding_state': 15, 'optimizer_type': 'lbfgs'}. Best is trial 1511 with value: 0.0009640019852668047.
[I 2025-07-30 23:33:32,347] Trial 1887 finished with value: 0.0011085595469921827 and parameters: {'width_NN_heal': 512, 'width_NN_state': 306, 'depth_NN_heal': 2, 'depth_NN_state': 3, 'mode_heal': 60, 'mode_state': 60, 'blocks_heal': 8, 'blocks_state': 3, 'lift_act_state': <built-in function gelu>, 'block_act_state': <built-in function gelu>, 'lift_act_heal': <built-in function gelu>, 'block_act_heal': None, 'width_heal': 69, 'width_state': 97, 'lr': 0.0016040718619046424, 'padding_heal': 3, 'padding_state': 18, 'optimizer_type': 'lbfgs'}. Best is trial 1511 with value: 0.0009640019852668047.
[I 2025-07-30 23:33:37,407] Trial 1888 finished with value: 0.001918387832120061 and parameters: {'width_NN_heal': 15, 'width_NN_state': 338, 'depth_NN_heal': 2, 'depth_NN_state': 3, 'mode_heal': 64, 'mode_state': 60, 'blocks_heal': 8, 'blocks_state': 3, 'lift_act_state': <built-in function gelu>, 'block_act_state': <function tanh at 0x7ff3611b4cc0>, 'lift_act_heal': <built-in function gelu>, 'block_act_heal': None, 'width_heal': 59, 'width_state': 78, 'lr': 0.0012861994352720695, 'padding_heal': 4, 'padding_state': 17, 'optimizer_type': 'lbfgs'}. Best is trial 1511 with value: 0.0009640019852668047.
[I 2025-07-30 23:33:42,288] Trial 1889 finished with value: 0.0013209781609475613 and parameters: {'width_NN_heal': 13, 'width_NN_state': 412, 'depth_NN_heal': 1, 'depth_NN_state': 2, 'mode_heal': 60, 'mode_state': 60, 'blocks_heal': 8, 'blocks_state': 3, 'lift_act_state': <built-in function gelu>, 'block_act_state': <built-in function gelu>, 'lift_act_heal': <built-in function gelu>, 'block_act_heal': None, 'width_heal': 33, 'width_state': 104, 'lr': 0.0014139286150126112, 'padding_heal': 4, 'padding_state': 19, 'optimizer_type': 'lbfgs'}. Best is trial 1511 with value: 0.0009640019852668047.
[I 2025-07-30 23:33:47,346] Trial 1890 finished with value: 0.001099756103940308 and parameters: {'width_NN_heal': 287, 'width_NN_state': 283, 'depth_NN_heal': 2, 'depth_NN_state': 3, 'mode_heal': 60, 'mode_state': 60, 'blocks_heal': 8, 'blocks_state': 3, 'lift_act_state': <built-in function gelu>, 'block_act_state': <built-in function gelu>, 'lift_act_heal': <built-in function gelu>, 'block_act_heal': None, 'width_heal': 42, 'width_state': 87, 'lr': 0.0015734317294699778, 'padding_heal': 2, 'padding_state': 16, 'optimizer_type': 'lbfgs'}. Best is trial 1511 with value: 0.0009640019852668047.
[I 2025-07-30 23:33:52,607] Trial 1891 finished with value: 0.004594588186591864 and parameters: {'width_NN_heal': 509, 'width_NN_state': 14, 'depth_NN_heal': 3, 'depth_NN_state': 3, 'mode_heal': 64, 'mode_state': 60, 'blocks_heal': 8, 'blocks_state': 3, 'lift_act_state': <built-in function gelu>, 'block_act_state': <built-in function gelu>, 'lift_act_heal': <built-in function gelu>, 'block_act_heal': None, 'width_heal': 32, 'width_state': 108, 'lr': 0.0011714001806240597, 'padding_heal': 3, 'padding_state': 17, 'optimizer_type': 'lbfgs'}. Best is trial 1511 with value: 0.0009640019852668047.
[I 2025-07-30 23:33:57,523] Trial 1892 finished with value: 0.0010981418890878558 and parameters: {'width_NN_heal': 438, 'width_NN_state': 348, 'depth_NN_heal': 2, 'depth_NN_state': 3, 'mode_heal': 60, 'mode_state': 60, 'blocks_heal': 7, 'blocks_state': 3, 'lift_act_state': <built-in function gelu>, 'block_act_state': <built-in function gelu>, 'lift_act_heal': <built-in function gelu>, 'block_act_heal': None, 'width_heal': 36, 'width_state': 97, 'lr': 0.0013645610467839814, 'padding_heal': 4, 'padding_state': 18, 'optimizer_type': 'lbfgs'}. Best is trial 1511 with value: 0.0009640019852668047.
[I 2025-07-30 23:34:02,478] Trial 1893 finished with value: 0.00123753456864506 and parameters: {'width_NN_heal': 466, 'width_NN_state': 312, 'depth_NN_heal': 2, 'depth_NN_state': 3, 'mode_heal': 64, 'mode_state': 60, 'blocks_heal': 5, 'blocks_state': 3, 'lift_act_state': <built-in function gelu>, 'block_act_state': <built-in function gelu>, 'lift_act_heal': <built-in function gelu>, 'block_act_heal': None, 'width_heal': 75, 'width_state': 107, 'lr': 0.001634197310035257, 'padding_heal': 4, 'padding_state': 17, 'optimizer_type': 'lbfgs'}. Best is trial 1511 with value: 0.0009640019852668047.
[I 2025-07-30 23:34:06,680] Trial 1894 finished with value: 0.0024309069849550724 and parameters: {'width_NN_heal': 305, 'width_NN_state': 364, 'depth_NN_heal': 2, 'depth_NN_state': 3, 'mode_heal': 60, 'mode_state': 36, 'blocks_heal': 6, 'blocks_state': 2, 'lift_act_state': None, 'block_act_state': <built-in function gelu>, 'lift_act_heal': <built-in function gelu>, 'block_act_heal': None, 'width_heal': 57, 'width_state': 86, 'lr': 0.0014984969430723112, 'padding_heal': 2, 'padding_state': 16, 'optimizer_type': 'lbfgs'}. Best is trial 1511 with value: 0.0009640019852668047.
[I 2025-07-30 23:34:12,131] Trial 1895 finished with value: 0.0013561652740463614 and parameters: {'width_NN_heal': 423, 'width_NN_state': 276, 'depth_NN_heal': 2, 'depth_NN_state': 3, 'mode_heal': 64, 'mode_state': 48, 'blocks_heal': 8, 'blocks_state': 3, 'lift_act_state': <built-in function gelu>, 'block_act_state': <built-in function gelu>, 'lift_act_heal': <built-in function gelu>, 'block_act_heal': None, 'width_heal': 62, 'width_state': 99, 'lr': 0.0013002628825693578, 'padding_heal': 29, 'padding_state': 14, 'optimizer_type': 'lbfgs'}. Best is trial 1511 with value: 0.0009640019852668047.
[I 2025-07-30 23:34:17,263] Trial 1896 finished with value: 0.002209784695878625 and parameters: {'width_NN_heal': 322, 'width_NN_state': 451, 'depth_NN_heal': 2, 'depth_NN_state': 3, 'mode_heal': 56, 'mode_state': 60, 'blocks_heal': 7, 'blocks_state': 3, 'lift_act_state': <built-in function gelu>, 'block_act_state': None, 'lift_act_heal': <built-in function gelu>, 'block_act_heal': None, 'width_heal': 41, 'width_state': 81, 'lr': 0.001693302926995209, 'padding_heal': 3, 'padding_state': 15, 'optimizer_type': 'lbfgs'}. Best is trial 1511 with value: 0.0009640019852668047.
[I 2025-07-30 23:34:22,355] Trial 1897 finished with value: 0.0011875018244609237 and parameters: {'width_NN_heal': 10, 'width_NN_state': 386, 'depth_NN_heal': 2, 'depth_NN_state': 3, 'mode_heal': 60, 'mode_state': 60, 'blocks_heal': 8, 'blocks_state': 3, 'lift_act_state': <built-in function gelu>, 'block_act_state': <built-in function gelu>, 'lift_act_heal': <built-in function gelu>, 'block_act_heal': None, 'width_heal': 56, 'width_state': 92, 'lr': 0.0014913709983410673, 'padding_heal': 4, 'padding_state': 18, 'optimizer_type': 'lbfgs'}. Best is trial 1511 with value: 0.0009640019852668047.
[I 2025-07-30 23:34:27,494] Trial 1898 finished with value: 0.0013270138297230005 and parameters: {'width_NN_heal': 272, 'width_NN_state': 317, 'depth_NN_heal': 3, 'depth_NN_state': 3, 'mode_heal': 64, 'mode_state': 60, 'blocks_heal': 7, 'blocks_state': 4, 'lift_act_state': <built-in function gelu>, 'block_act_state': <built-in function gelu>, 'lift_act_heal': <built-in function gelu>, 'block_act_heal': None, 'width_heal': 38, 'width_state': 107, 'lr': 0.0016827944495430883, 'padding_heal': 4, 'padding_state': 16, 'optimizer_type': 'lbfgs'}. Best is trial 1511 with value: 0.0009640019852668047.
[I 2025-07-30 23:34:32,492] Trial 1899 finished with value: 0.0013902391074225307 and parameters: {'width_NN_heal': 475, 'width_NN_state': 291, 'depth_NN_heal': 2, 'depth_NN_state': 3, 'mode_heal': 60, 'mode_state': 40, 'blocks_heal': 7, 'blocks_state': 3, 'lift_act_state': <built-in function gelu>, 'block_act_state': <built-in function gelu>, 'lift_act_heal': None, 'block_act_heal': None, 'width_heal': 66, 'width_state': 111, 'lr': 0.0011818576547065233, 'padding_heal': 3, 'padding_state': 19, 'optimizer_type': 'lbfgs'}. Best is trial 1511 with value: 0.0009640019852668047.
[I 2025-07-30 23:34:37,568] Trial 1900 finished with value: 0.0014525706646963954 and parameters: {'width_NN_heal': 420, 'width_NN_state': 351, 'depth_NN_heal': 2, 'depth_NN_state': 3, 'mode_heal': 64, 'mode_state': 48, 'blocks_heal': 8, 'blocks_state': 3, 'lift_act_state': <built-in function gelu>, 'block_act_state': <built-in function gelu>, 'lift_act_heal': <built-in function gelu>, 'block_act_heal': None, 'width_heal': 35, 'width_state': 79, 'lr': 0.001408820237631952, 'padding_heal': 4, 'padding_state': 17, 'optimizer_type': 'adam'}. Best is trial 1511 with value: 0.0009640019852668047.
[I 2025-07-30 23:34:42,738] Trial 1901 finished with value: 0.0012468055356293917 and parameters: {'width_NN_heal': 441, 'width_NN_state': 405, 'depth_NN_heal': 2, 'depth_NN_state': 3, 'mode_heal': 60, 'mode_state': 60, 'blocks_heal': 7, 'blocks_state': 3, 'lift_act_state': <built-in function gelu>, 'block_act_state': <built-in function gelu>, 'lift_act_heal': <built-in function gelu>, 'block_act_heal': None, 'width_heal': 42, 'width_state': 101, 'lr': 0.002420939860131003, 'padding_heal': 2, 'padding_state': 15, 'optimizer_type': 'lbfgs'}. Best is trial 1511 with value: 0.0009640019852668047.
[I 2025-07-30 23:34:47,525] Trial 1902 finished with value: 0.0015098012518137693 and parameters: {'width_NN_heal': 29, 'width_NN_state': 272, 'depth_NN_heal': 2, 'depth_NN_state': 3, 'mode_heal': 60, 'mode_state': 52, 'blocks_heal': 8, 'blocks_state': 2, 'lift_act_state': <built-in function gelu>, 'block_act_state': <built-in function gelu>, 'lift_act_heal': <built-in function gelu>, 'block_act_heal': <built-in function gelu>, 'width_heal': 59, 'width_state': 93, 'lr': 0.0015441846315407321, 'padding_heal': 3, 'padding_state': 18, 'optimizer_type': 'lbfgs'}. Best is trial 1511 with value: 0.0009640019852668047.
[I 2025-07-30 23:34:52,126] Trial 1903 finished with value: 0.0012689229333773255 and parameters: {'width_NN_heal': 326, 'width_NN_state': 320, 'depth_NN_heal': 1, 'depth_NN_state': 3, 'mode_heal': 64, 'mode_state': 60, 'blocks_heal': 7, 'blocks_state': 3, 'lift_act_state': <built-in function gelu>, 'block_act_state': <built-in function gelu>, 'lift_act_heal': <built-in function gelu>, 'block_act_heal': None, 'width_heal': 56, 'width_state': 107, 'lr': 0.0012820622507662709, 'padding_heal': 4, 'padding_state': 17, 'optimizer_type': 'lbfgs'}. Best is trial 1511 with value: 0.0009640019852668047.
[I 2025-07-30 23:34:57,228] Trial 1904 finished with value: 0.0013737038243561983 and parameters: {'width_NN_heal': 376, 'width_NN_state': 62, 'depth_NN_heal': 2, 'depth_NN_state': 3, 'mode_heal': 60, 'mode_state': 60, 'blocks_heal': 8, 'blocks_state': 3, 'lift_act_state': <built-in function gelu>, 'block_act_state': <built-in function gelu>, 'lift_act_heal': <built-in function gelu>, 'block_act_heal': None, 'width_heal': 84, 'width_state': 87, 'lr': 0.0016444922793880702, 'padding_heal': 2, 'padding_state': 16, 'optimizer_type': 'lbfgs'}. Best is trial 1511 with value: 0.0009640019852668047.
[I 2025-07-30 23:35:03,764] Trial 1905 finished with value: 0.0014306569937616587 and parameters: {'width_NN_heal': 402, 'width_NN_state': 371, 'depth_NN_heal': 5, 'depth_NN_state': 3, 'mode_heal': 56, 'mode_state': 52, 'blocks_heal': 7, 'blocks_state': 3, 'lift_act_state': <built-in function gelu>, 'block_act_state': <built-in function gelu>, 'lift_act_heal': <built-in function gelu>, 'block_act_heal': None, 'width_heal': 39, 'width_state': 113, 'lr': 0.0014078616633098275, 'padding_heal': 5, 'padding_state': 18, 'optimizer_type': 'lbfgs'}. Best is trial 1511 with value: 0.0009640019852668047.
[I 2025-07-30 23:35:08,740] Trial 1906 finished with value: 0.0012198026524856687 and parameters: {'width_NN_heal': 279, 'width_NN_state': 302, 'depth_NN_heal': 2, 'depth_NN_state': 3, 'mode_heal': 24, 'mode_state': 60, 'blocks_heal': 8, 'blocks_state': 3, 'lift_act_state': <built-in function gelu>, 'block_act_state': <built-in function gelu>, 'lift_act_heal': <built-in function gelu>, 'block_act_heal': None, 'width_heal': 63, 'width_state': 101, 'lr': 0.0017782292219430114, 'padding_heal': 3, 'padding_state': 17, 'optimizer_type': 'lbfgs'}. Best is trial 1511 with value: 0.0009640019852668047.
[I 2025-07-30 23:35:13,533] Trial 1907 finished with value: 0.001266957144252956 and parameters: {'width_NN_heal': 461, 'width_NN_state': 343, 'depth_NN_heal': 2, 'depth_NN_state': 3, 'mode_heal': 64, 'mode_state': 32, 'blocks_heal': 7, 'blocks_state': 3, 'lift_act_state': <built-in function gelu>, 'block_act_state': <built-in function gelu>, 'lift_act_heal': <built-in function gelu>, 'block_act_heal': None, 'width_heal': 32, 'width_state': 5, 'lr': 0.0015055259855731502, 'padding_heal': 4, 'padding_state': 19, 'optimizer_type': 'lbfgs'}. Best is trial 1511 with value: 0.0009640019852668047.
[I 2025-07-30 23:35:18,142] Trial 1908 finished with value: 0.0011468133889138699 and parameters: {'width_NN_heal': 353, 'width_NN_state': 272, 'depth_NN_heal': 2, 'depth_NN_state': 2, 'mode_heal': 60, 'mode_state': 60, 'blocks_heal': 7, 'blocks_state': 3, 'lift_act_state': <built-in function gelu>, 'block_act_state': <built-in function gelu>, 'lift_act_heal': <built-in function gelu>, 'block_act_heal': None, 'width_heal': 54, 'width_state': 114, 'lr': 0.0019462066358627251, 'padding_heal': 5, 'padding_state': 16, 'optimizer_type': 'lbfgs'}. Best is trial 1511 with value: 0.0009640019852668047.
[I 2025-07-30 23:35:23,801] Trial 1909 finished with value: 0.0011930534383282065 and parameters: {'width_NN_heal': 412, 'width_NN_state': 321, 'depth_NN_heal': 3, 'depth_NN_state': 3, 'mode_heal': 64, 'mode_state': 48, 'blocks_heal': 8, 'blocks_state': 3, 'lift_act_state': <built-in function gelu>, 'block_act_state': <built-in function gelu>, 'lift_act_heal': <built-in function gelu>, 'block_act_heal': None, 'width_heal': 42, 'width_state': 95, 'lr': 0.0011380099077499923, 'padding_heal': 4, 'padding_state': 17, 'optimizer_type': 'lbfgs'}. Best is trial 1511 with value: 0.0009640019852668047.
[I 2025-07-30 23:35:29,308] Trial 1910 finished with value: 0.0022490080446004868 and parameters: {'width_NN_heal': 511, 'width_NN_state': 440, 'depth_NN_heal': 2, 'depth_NN_state': 3, 'mode_heal': 60, 'mode_state': 60, 'blocks_heal': 7, 'blocks_state': 3, 'lift_act_state': <built-in function gelu>, 'block_act_state': <function tanh at 0x7ff3611b4cc0>, 'lift_act_heal': <built-in function gelu>, 'block_act_heal': None, 'width_heal': 36, 'width_state': 106, 'lr': 0.0013288549832036639, 'padding_heal': 16, 'padding_state': 15, 'optimizer_type': 'lbfgs'}. Best is trial 1511 with value: 0.0009640019852668047.
[I 2025-07-30 23:35:34,213] Trial 1911 finished with value: 0.0011782582150772214 and parameters: {'width_NN_heal': 305, 'width_NN_state': 295, 'depth_NN_heal': 2, 'depth_NN_state': 3, 'mode_heal': 64, 'mode_state': 36, 'blocks_heal': 8, 'blocks_state': 3, 'lift_act_state': <built-in function gelu>, 'block_act_state': <built-in function gelu>, 'lift_act_heal': <built-in function gelu>, 'block_act_heal': None, 'width_heal': 44, 'width_state': 79, 'lr': 0.0017141585118250684, 'padding_heal': 3, 'padding_state': 16, 'optimizer_type': 'lbfgs'}. Best is trial 1511 with value: 0.0009640019852668047.
[I 2025-07-30 23:35:39,712] Trial 1912 finished with value: 0.0012402902357280254 and parameters: {'width_NN_heal': 380, 'width_NN_state': 385, 'depth_NN_heal': 2, 'depth_NN_state': 3, 'mode_heal': 56, 'mode_state': 60, 'blocks_heal': 7, 'blocks_state': 3, 'lift_act_state': <built-in function gelu>, 'block_act_state': <built-in function gelu>, 'lift_act_heal': <built-in function gelu>, 'block_act_heal': None, 'width_heal': 69, 'width_state': 90, 'lr': 0.002108911109461853, 'padding_heal': 5, 'padding_state': 18, 'optimizer_type': 'lbfgs'}. Best is trial 1511 with value: 0.0009640019852668047.
[I 2025-07-30 23:35:44,758] Trial 1913 finished with value: 0.0020009384024888277 and parameters: {'width_NN_heal': 442, 'width_NN_state': 338, 'depth_NN_heal': 2, 'depth_NN_state': 3, 'mode_heal': 64, 'mode_state': 60, 'blocks_heal': 8, 'blocks_state': 3, 'lift_act_state': None, 'block_act_state': <built-in function gelu>, 'lift_act_heal': None, 'block_act_heal': None, 'width_heal': 52, 'width_state': 21, 'lr': 0.0026742946978535083, 'padding_heal': 4, 'padding_state': 19, 'optimizer_type': 'lbfgs'}. Best is trial 1511 with value: 0.0009640019852668047.
