[I 2025-07-30 21:46:43,344] Trial 589 finished with value: 0.00238108541816473 and parameters: {'width_NN_heal': 142, 'width_NN_state': 301, 'depth_NN_heal': 4, 'depth_NN_state': 5, 'mode_heal': 56, 'mode_state': 60, 'blocks_heal': 7, 'blocks_state': 3, 'lift_act_state': <built-in function gelu>, 'block_act_state': <built-in function gelu>, 'lift_act_heal': <function tanh at 0x7ff3611b4cc0>, 'block_act_heal': <function tanh at 0x7ff3611b4cc0>, 'width_heal': 22, 'width_state': 33, 'lr': 0.0023039755084096544, 'padding_heal': 3, 'padding_state': 21, 'optimizer_type': 'lbfgs'}. Best is trial 484 with value: 0.0010389797389507294.
[I 2025-07-30 21:46:48,289] Trial 590 finished with value: 0.0014933833153918386 and parameters: {'width_NN_heal': 126, 'width_NN_state': 215, 'depth_NN_heal': 4, 'depth_NN_state': 5, 'mode_heal': 56, 'mode_state': 60, 'blocks_heal': 7, 'blocks_state': 3, 'lift_act_state': <built-in function gelu>, 'block_act_state': <built-in function gelu>, 'lift_act_heal': <function tanh at 0x7ff3611b4cc0>, 'block_act_heal': <function tanh at 0x7ff3611b4cc0>, 'width_heal': 27, 'width_state': 38, 'lr': 0.0025446422299788083, 'padding_heal': 6, 'padding_state': 21, 'optimizer_type': 'lbfgs'}. Best is trial 484 with value: 0.0010389797389507294.
[I 2025-07-30 21:46:53,675] Trial 591 finished with value: 0.016161423176527023 and parameters: {'width_NN_heal': 176, 'width_NN_state': 276, 'depth_NN_heal': 4, 'depth_NN_state': 5, 'mode_heal': 52, 'mode_state': 60, 'blocks_heal': 7, 'blocks_state': 3, 'lift_act_state': <built-in function gelu>, 'block_act_state': <built-in function gelu>, 'lift_act_heal': <function tanh at 0x7ff3611b4cc0>, 'block_act_heal': <function tanh at 0x7ff3611b4cc0>, 'width_heal': 31, 'width_state': 36, 'lr': 0.0021135902122518106, 'padding_heal': 4, 'padding_state': 19, 'optimizer_type': 'lbfgs'}. Best is trial 484 with value: 0.0010389797389507294.
[I 2025-07-30 21:46:58,559] Trial 592 finished with value: 0.001603144803084433 and parameters: {'width_NN_heal': 195, 'width_NN_state': 241, 'depth_NN_heal': 4, 'depth_NN_state': 5, 'mode_heal': 56, 'mode_state': 60, 'blocks_heal': 7, 'blocks_state': 3, 'lift_act_state': <built-in function gelu>, 'block_act_state': <built-in function gelu>, 'lift_act_heal': <function tanh at 0x7ff3611b4cc0>, 'block_act_heal': <function tanh at 0x7ff3611b4cc0>, 'width_heal': 28, 'width_state': 32, 'lr': 0.00237272186511296, 'padding_heal': 3, 'padding_state': 20, 'optimizer_type': 'lbfgs'}. Best is trial 484 with value: 0.0010389797389507294.
[I 2025-07-30 21:47:03,972] Trial 593 finished with value: 0.01619734987616539 and parameters: {'width_NN_heal': 163, 'width_NN_state': 334, 'depth_NN_heal': 4, 'depth_NN_state': 5, 'mode_heal': 56, 'mode_state': 60, 'blocks_heal': 7, 'blocks_state': 3, 'lift_act_state': <built-in function gelu>, 'block_act_state': <built-in function gelu>, 'lift_act_heal': <function tanh at 0x7ff3611b4cc0>, 'block_act_heal': <function tanh at 0x7ff3611b4cc0>, 'width_heal': 23, 'width_state': 34, 'lr': 0.002522406800466465, 'padding_heal': 1, 'padding_state': 22, 'optimizer_type': 'lbfgs'}. Best is trial 484 with value: 0.0010389797389507294.
[I 2025-07-30 21:47:09,184] Trial 594 finished with value: 0.0014356437604874372 and parameters: {'width_NN_heal': 212, 'width_NN_state': 285, 'depth_NN_heal': 4, 'depth_NN_state': 5, 'mode_heal': 56, 'mode_state': 60, 'blocks_heal': 7, 'blocks_state': 3, 'lift_act_state': <built-in function gelu>, 'block_act_state': <built-in function gelu>, 'lift_act_heal': <function tanh at 0x7ff3611b4cc0>, 'block_act_heal': <function tanh at 0x7ff3611b4cc0>, 'width_heal': 25, 'width_state': 30, 'lr': 0.00228085861494906, 'padding_heal': 6, 'padding_state': 21, 'optimizer_type': 'lbfgs'}. Best is trial 484 with value: 0.0010389797389507294.
[I 2025-07-30 21:47:14,121] Trial 595 finished with value: 0.0013265146408230066 and parameters: {'width_NN_heal': 142, 'width_NN_state': 253, 'depth_NN_heal': 4, 'depth_NN_state': 5, 'mode_heal': 56, 'mode_state': 60, 'blocks_heal': 7, 'blocks_state': 3, 'lift_act_state': <built-in function gelu>, 'block_act_state': <built-in function gelu>, 'lift_act_heal': <function tanh at 0x7ff3611b4cc0>, 'block_act_heal': <function tanh at 0x7ff3611b4cc0>, 'width_heal': 15, 'width_state': 37, 'lr': 0.0026209406315678106, 'padding_heal': 3, 'padding_state': 20, 'optimizer_type': 'lbfgs'}. Best is trial 484 with value: 0.0010389797389507294.
[I 2025-07-30 21:47:19,186] Trial 596 finished with value: 0.0011337005998939276 and parameters: {'width_NN_heal': 122, 'width_NN_state': 316, 'depth_NN_heal': 4, 'depth_NN_state': 5, 'mode_heal': 56, 'mode_state': 60, 'blocks_heal': 7, 'blocks_state': 3, 'lift_act_state': <built-in function gelu>, 'block_act_state': <built-in function gelu>, 'lift_act_heal': <function tanh at 0x7ff3611b4cc0>, 'block_act_heal': <function tanh at 0x7ff3611b4cc0>, 'width_heal': 22, 'width_state': 31, 'lr': 0.001789213971526669, 'padding_heal': 4, 'padding_state': 20, 'optimizer_type': 'lbfgs'}. Best is trial 484 with value: 0.0010389797389507294.
[I 2025-07-30 21:47:24,153] Trial 597 finished with value: 0.0013934747548773885 and parameters: {'width_NN_heal': 120, 'width_NN_state': 320, 'depth_NN_heal': 4, 'depth_NN_state': 5, 'mode_heal': 56, 'mode_state': 60, 'blocks_heal': 7, 'blocks_state': 3, 'lift_act_state': <built-in function gelu>, 'block_act_state': <built-in function gelu>, 'lift_act_heal': <function tanh at 0x7ff3611b4cc0>, 'block_act_heal': <function tanh at 0x7ff3611b4cc0>, 'width_heal': 24, 'width_state': 30, 'lr': 0.0017916277612055583, 'padding_heal': 5, 'padding_state': 19, 'optimizer_type': 'lbfgs'}. Best is trial 484 with value: 0.0010389797389507294.
[I 2025-07-30 21:47:29,510] Trial 598 finished with value: 0.0012266074772924185 and parameters: {'width_NN_heal': 112, 'width_NN_state': 357, 'depth_NN_heal': 4, 'depth_NN_state': 5, 'mode_heal': 52, 'mode_state': 60, 'blocks_heal': 7, 'blocks_state': 3, 'lift_act_state': <built-in function gelu>, 'block_act_state': <built-in function gelu>, 'lift_act_heal': <function tanh at 0x7ff3611b4cc0>, 'block_act_heal': None, 'width_heal': 22, 'width_state': 33, 'lr': 0.002002039836292424, 'padding_heal': 4, 'padding_state': 22, 'optimizer_type': 'lbfgs'}. Best is trial 484 with value: 0.0010389797389507294.
[I 2025-07-30 21:47:35,020] Trial 599 finished with value: 0.014720745384693146 and parameters: {'width_NN_heal': 186, 'width_NN_state': 326, 'depth_NN_heal': 4, 'depth_NN_state': 5, 'mode_heal': 56, 'mode_state': 60, 'blocks_heal': 7, 'blocks_state': 3, 'lift_act_state': <built-in function gelu>, 'block_act_state': <built-in function gelu>, 'lift_act_heal': <function tanh at 0x7ff3611b4cc0>, 'block_act_heal': <function tanh at 0x7ff3611b4cc0>, 'width_heal': 26, 'width_state': 31, 'lr': 0.0021694432271666085, 'padding_heal': 4, 'padding_state': 21, 'optimizer_type': 'lbfgs'}. Best is trial 484 with value: 0.0010389797389507294.
[I 2025-07-30 21:47:40,283] Trial 600 finished with value: 0.0015106144128367305 and parameters: {'width_NN_heal': 230, 'width_NN_state': 296, 'depth_NN_heal': 4, 'depth_NN_state': 5, 'mode_heal': 56, 'mode_state': 60, 'blocks_heal': 7, 'blocks_state': 3, 'lift_act_state': <built-in function gelu>, 'block_act_state': <built-in function gelu>, 'lift_act_heal': <function tanh at 0x7ff3611b4cc0>, 'block_act_heal': <function tanh at 0x7ff3611b4cc0>, 'width_heal': 22, 'width_state': 34, 'lr': 0.0017269595787323387, 'padding_heal': 5, 'padding_state': 19, 'optimizer_type': 'lbfgs'}. Best is trial 484 with value: 0.0010389797389507294.
[I 2025-07-30 21:47:46,029] Trial 601 finished with value: 0.0013248603790998459 and parameters: {'width_NN_heal': 129, 'width_NN_state': 380, 'depth_NN_heal': 4, 'depth_NN_state': 5, 'mode_heal': 56, 'mode_state': 60, 'blocks_heal': 7, 'blocks_state': 3, 'lift_act_state': <built-in function gelu>, 'block_act_state': <built-in function gelu>, 'lift_act_heal': <function tanh at 0x7ff3611b4cc0>, 'block_act_heal': <function tanh at 0x7ff3611b4cc0>, 'width_heal': 30, 'width_state': 32, 'lr': 0.001971807243030538, 'padding_heal': 6, 'padding_state': 20, 'optimizer_type': 'lbfgs'}. Best is trial 484 with value: 0.0010389797389507294.
[I 2025-07-30 21:47:50,866] Trial 602 finished with value: 0.0013731287326663733 and parameters: {'width_NN_heal': 205, 'width_NN_state': 228, 'depth_NN_heal': 4, 'depth_NN_state': 5, 'mode_heal': 52, 'mode_state': 60, 'blocks_heal': 7, 'blocks_state': 3, 'lift_act_state': <built-in function gelu>, 'block_act_state': <built-in function gelu>, 'lift_act_heal': <function tanh at 0x7ff3611b4cc0>, 'block_act_heal': <function tanh at 0x7ff3611b4cc0>, 'width_heal': 24, 'width_state': 36, 'lr': 0.002199415927221239, 'padding_heal': 0, 'padding_state': 21, 'optimizer_type': 'lbfgs'}. Best is trial 484 with value: 0.0010389797389507294.
[I 2025-07-30 21:47:56,512] Trial 603 finished with value: 0.0023969835601747036 and parameters: {'width_NN_heal': 176, 'width_NN_state': 339, 'depth_NN_heal': 4, 'depth_NN_state': 5, 'mode_heal': 56, 'mode_state': 60, 'blocks_heal': 7, 'blocks_state': 3, 'lift_act_state': <built-in function gelu>, 'block_act_state': <built-in function gelu>, 'lift_act_heal': <function tanh at 0x7ff3611b4cc0>, 'block_act_heal': <function tanh at 0x7ff3611b4cc0>, 'width_heal': 28, 'width_state': 29, 'lr': 0.00237112313763355, 'padding_heal': 5, 'padding_state': 22, 'optimizer_type': 'lbfgs'}. Best is trial 484 with value: 0.0010389797389507294.
[I 2025-07-30 21:48:01,580] Trial 604 finished with value: 0.015752408653497696 and parameters: {'width_NN_heal': 163, 'width_NN_state': 296, 'depth_NN_heal': 4, 'depth_NN_state': 5, 'mode_heal': 56, 'mode_state': 60, 'blocks_heal': 7, 'blocks_state': 3, 'lift_act_state': <built-in function gelu>, 'block_act_state': <built-in function gelu>, 'lift_act_heal': <function tanh at 0x7ff3611b4cc0>, 'block_act_heal': <function tanh at 0x7ff3611b4cc0>, 'width_heal': 21, 'width_state': 42, 'lr': 0.0010919791830657432, 'padding_heal': 5, 'padding_state': 21, 'optimizer_type': 'lbfgs'}. Best is trial 484 with value: 0.0010389797389507294.
[I 2025-07-30 21:48:07,198] Trial 605 finished with value: 0.0017573900986462831 and parameters: {'width_NN_heal': 152, 'width_NN_state': 366, 'depth_NN_heal': 4, 'depth_NN_state': 5, 'mode_heal': 52, 'mode_state': 64, 'blocks_heal': 7, 'blocks_state': 3, 'lift_act_state': <built-in function gelu>, 'block_act_state': <built-in function gelu>, 'lift_act_heal': <function tanh at 0x7ff3611b4cc0>, 'block_act_heal': <function tanh at 0x7ff3611b4cc0>, 'width_heal': 23, 'width_state': 4, 'lr': 0.002024605792780334, 'padding_heal': 4, 'padding_state': 20, 'optimizer_type': 'lbfgs'}. Best is trial 484 with value: 0.0010389797389507294.
[I 2025-07-30 21:48:12,269] Trial 606 finished with value: 0.0016792848473414779 and parameters: {'width_NN_heal': 193, 'width_NN_state': 278, 'depth_NN_heal': 4, 'depth_NN_state': 5, 'mode_heal': 56, 'mode_state': 60, 'blocks_heal': 7, 'blocks_state': 3, 'lift_act_state': <built-in function gelu>, 'block_act_state': <built-in function gelu>, 'lift_act_heal': <function tanh at 0x7ff3611b4cc0>, 'block_act_heal': <function tanh at 0x7ff3611b4cc0>, 'width_heal': 26, 'width_state': 38, 'lr': 0.0024381287194158944, 'padding_heal': 1, 'padding_state': 19, 'optimizer_type': 'lbfgs'}. Best is trial 484 with value: 0.0010389797389507294.
[I 2025-07-30 21:48:17,180] Trial 607 finished with value: 0.0034078846219927073 and parameters: {'width_NN_heal': 125, 'width_NN_state': 211, 'depth_NN_heal': 4, 'depth_NN_state': 5, 'mode_heal': 56, 'mode_state': 64, 'blocks_heal': 7, 'blocks_state': 3, 'lift_act_state': <built-in function gelu>, 'block_act_state': None, 'lift_act_heal': <function tanh at 0x7ff3611b4cc0>, 'block_act_heal': <function tanh at 0x7ff3611b4cc0>, 'width_heal': 21, 'width_state': 35, 'lr': 0.001583457966196935, 'padding_heal': 6, 'padding_state': 18, 'optimizer_type': 'lbfgs'}. Best is trial 484 with value: 0.0010389797389507294.
[I 2025-07-30 21:48:23,438] Trial 608 finished with value: 0.001444976544007659 and parameters: {'width_NN_heal': 116, 'width_NN_state': 408, 'depth_NN_heal': 4, 'depth_NN_state': 5, 'mode_heal': 56, 'mode_state': 60, 'blocks_heal': 7, 'blocks_state': 3, 'lift_act_state': <built-in function gelu>, 'block_act_state': <built-in function gelu>, 'lift_act_heal': <function tanh at 0x7ff3611b4cc0>, 'block_act_heal': <function tanh at 0x7ff3611b4cc0>, 'width_heal': 22, 'width_state': 30, 'lr': 0.0014131412454431167, 'padding_heal': 3, 'padding_state': 20, 'optimizer_type': 'lbfgs'}. Best is trial 484 with value: 0.0010389797389507294.
[I 2025-07-30 21:48:28,667] Trial 609 finished with value: 0.004708432592451572 and parameters: {'width_NN_heal': 224, 'width_NN_state': 310, 'depth_NN_heal': 4, 'depth_NN_state': 5, 'mode_heal': 56, 'mode_state': 64, 'blocks_heal': 7, 'blocks_state': 3, 'lift_act_state': <built-in function gelu>, 'block_act_state': <built-in function gelu>, 'lift_act_heal': <function tanh at 0x7ff3611b4cc0>, 'block_act_heal': <function tanh at 0x7ff3611b4cc0>, 'width_heal': 14, 'width_state': 32, 'lr': 0.0018149534341553762, 'padding_heal': 5, 'padding_state': 22, 'optimizer_type': 'lbfgs'}. Best is trial 484 with value: 0.0010389797389507294.
[I 2025-07-30 21:48:33,596] Trial 610 finished with value: 0.0013369466178119183 and parameters: {'width_NN_heal': 171, 'width_NN_state': 256, 'depth_NN_heal': 4, 'depth_NN_state': 5, 'mode_heal': 60, 'mode_state': 64, 'blocks_heal': 7, 'blocks_state': 3, 'lift_act_state': <built-in function gelu>, 'block_act_state': <built-in function gelu>, 'lift_act_heal': <function tanh at 0x7ff3611b4cc0>, 'block_act_heal': <function tanh at 0x7ff3611b4cc0>, 'width_heal': 24, 'width_state': 29, 'lr': 0.0022836635731187, 'padding_heal': 4, 'padding_state': 21, 'optimizer_type': 'lbfgs'}. Best is trial 484 with value: 0.0010389797389507294.
[I 2025-07-30 21:48:38,588] Trial 611 finished with value: 0.0012935290578752756 and parameters: {'width_NN_heal': 147, 'width_NN_state': 230, 'depth_NN_heal': 4, 'depth_NN_state': 5, 'mode_heal': 52, 'mode_state': 64, 'blocks_heal': 7, 'blocks_state': 3, 'lift_act_state': <built-in function gelu>, 'block_act_state': <built-in function gelu>, 'lift_act_heal': <function tanh at 0x7ff3611b4cc0>, 'block_act_heal': <function tanh at 0x7ff3611b4cc0>, 'width_heal': 26, 'width_state': 27, 'lr': 0.0026560148078690177, 'padding_heal': 4, 'padding_state': 19, 'optimizer_type': 'lbfgs'}. Best is trial 484 with value: 0.0010389797389507294.
[I 2025-07-30 21:48:44,182] Trial 612 finished with value: 0.016112985089421272 and parameters: {'width_NN_heal': 206, 'width_NN_state': 346, 'depth_NN_heal': 4, 'depth_NN_state': 5, 'mode_heal': 56, 'mode_state': 64, 'blocks_heal': 7, 'blocks_state': 3, 'lift_act_state': <built-in function gelu>, 'block_act_state': <built-in function gelu>, 'lift_act_heal': <function tanh at 0x7ff3611b4cc0>, 'block_act_heal': <function tanh at 0x7ff3611b4cc0>, 'width_heal': 28, 'width_state': 34, 'lr': 0.002102578580254431, 'padding_heal': 3, 'padding_state': 21, 'optimizer_type': 'lbfgs'}. Best is trial 484 with value: 0.0010389797389507294.
[I 2025-07-30 21:48:49,106] Trial 613 finished with value: 0.016193144023418427 and parameters: {'width_NN_heal': 129, 'width_NN_state': 287, 'depth_NN_heal': 4, 'depth_NN_state': 5, 'mode_heal': 56, 'mode_state': 64, 'blocks_heal': 7, 'blocks_state': 3, 'lift_act_state': <built-in function gelu>, 'block_act_state': <built-in function gelu>, 'lift_act_heal': <function tanh at 0x7ff3611b4cc0>, 'block_act_heal': <function tanh at 0x7ff3611b4cc0>, 'width_heal': 21, 'width_state': 40, 'lr': 0.0009599756211501783, 'padding_heal': 5, 'padding_state': 20, 'optimizer_type': 'lbfgs'}. Best is trial 484 with value: 0.0010389797389507294.
[I 2025-07-30 21:48:54,484] Trial 614 finished with value: 0.001174704171717167 and parameters: {'width_NN_heal': 183, 'width_NN_state': 324, 'depth_NN_heal': 4, 'depth_NN_state': 5, 'mode_heal': 60, 'mode_state': 60, 'blocks_heal': 7, 'blocks_state': 3, 'lift_act_state': <built-in function gelu>, 'block_act_state': <built-in function gelu>, 'lift_act_heal': <function tanh at 0x7ff3611b4cc0>, 'block_act_heal': <function tanh at 0x7ff3611b4cc0>, 'width_heal': 23, 'width_state': 36, 'lr': 0.0024670940846888505, 'padding_heal': 1, 'padding_state': 18, 'optimizer_type': 'lbfgs'}. Best is trial 484 with value: 0.0010389797389507294.
[I 2025-07-30 21:48:59,365] Trial 615 finished with value: 0.004059872590005398 and parameters: {'width_NN_heal': 160, 'width_NN_state': 265, 'depth_NN_heal': 4, 'depth_NN_state': 5, 'mode_heal': 60, 'mode_state': 64, 'blocks_heal': 7, 'blocks_state': 3, 'lift_act_state': None, 'block_act_state': <built-in function gelu>, 'lift_act_heal': <function tanh at 0x7ff3611b4cc0>, 'block_act_heal': <function tanh at 0x7ff3611b4cc0>, 'width_heal': 25, 'width_state': 31, 'lr': 0.002721889227929119, 'padding_heal': 6, 'padding_state': 4, 'optimizer_type': 'lbfgs'}. Best is trial 484 with value: 0.0010389797389507294.
[I 2025-07-30 21:49:04,286] Trial 616 finished with value: 0.017180072143673897 and parameters: {'width_NN_heal': 235, 'width_NN_state': 246, 'depth_NN_heal': 4, 'depth_NN_state': 5, 'mode_heal': 60, 'mode_state': 60, 'blocks_heal': 7, 'blocks_state': 3, 'lift_act_state': <built-in function gelu>, 'block_act_state': <built-in function gelu>, 'lift_act_heal': <function tanh at 0x7ff3611b4cc0>, 'block_act_heal': <function tanh at 0x7ff3611b4cc0>, 'width_heal': 17, 'width_state': 45, 'lr': 0.0003691076504562928, 'padding_heal': 3, 'padding_state': 21, 'optimizer_type': 'lbfgs'}. Best is trial 484 with value: 0.0010389797389507294.
[I 2025-07-30 21:49:09,288] Trial 617 finished with value: 0.0013073643203824759 and parameters: {'width_NN_heal': 193, 'width_NN_state': 208, 'depth_NN_heal': 4, 'depth_NN_state': 5, 'mode_heal': 56, 'mode_state': 64, 'blocks_heal': 7, 'blocks_state': 3, 'lift_act_state': <built-in function gelu>, 'block_act_state': <built-in function gelu>, 'lift_act_heal': <function tanh at 0x7ff3611b4cc0>, 'block_act_heal': <function tanh at 0x7ff3611b4cc0>, 'width_heal': 30, 'width_state': 25, 'lr': 0.002987953605598667, 'padding_heal': 4, 'padding_state': 20, 'optimizer_type': 'lbfgs'}. Best is trial 484 with value: 0.0010389797389507294.
[I 2025-07-30 21:49:14,279] Trial 618 finished with value: 0.0022457430604845285 and parameters: {'width_NN_heal': 138, 'width_NN_state': 286, 'depth_NN_heal': 4, 'depth_NN_state': 5, 'mode_heal': 60, 'mode_state': 64, 'blocks_heal': 7, 'blocks_state': 3, 'lift_act_state': <built-in function gelu>, 'block_act_state': <built-in function gelu>, 'lift_act_heal': <function tanh at 0x7ff3611b4cc0>, 'block_act_heal': <function tanh at 0x7ff3611b4cc0>, 'width_heal': 21, 'width_state': 27, 'lr': 0.0021062279051728525, 'padding_heal': 2, 'padding_state': 22, 'optimizer_type': 'lbfgs'}. Best is trial 484 with value: 0.0010389797389507294.
[I 2025-07-30 21:49:19,255] Trial 619 finished with value: 0.0012615753803402185 and parameters: {'width_NN_heal': 109, 'width_NN_state': 311, 'depth_NN_heal': 4, 'depth_NN_state': 5, 'mode_heal': 56, 'mode_state': 60, 'blocks_heal': 7, 'blocks_state': 3, 'lift_act_state': <built-in function gelu>, 'block_act_state': <built-in function gelu>, 'lift_act_heal': <function tanh at 0x7ff3611b4cc0>, 'block_act_heal': <function tanh at 0x7ff3611b4cc0>, 'width_heal': 27, 'width_state': 33, 'lr': 0.002397015416515619, 'padding_heal': 3, 'padding_state': 22, 'optimizer_type': 'lbfgs'}. Best is trial 484 with value: 0.0010389797389507294.
[I 2025-07-30 21:49:24,912] Trial 620 finished with value: 0.0067066615447402 and parameters: {'width_NN_heal': 215, 'width_NN_state': 394, 'depth_NN_heal': 4, 'depth_NN_state': 5, 'mode_heal': 56, 'mode_state': 64, 'blocks_heal': 7, 'blocks_state': 3, 'lift_act_state': <built-in function gelu>, 'block_act_state': <built-in function gelu>, 'lift_act_heal': <function tanh at 0x7ff3611b4cc0>, 'block_act_heal': <function tanh at 0x7ff3611b4cc0>, 'width_heal': 16, 'width_state': 39, 'lr': 0.002677098566595613, 'padding_heal': 5, 'padding_state': 1, 'optimizer_type': 'lbfgs'}. Best is trial 484 with value: 0.0010389797389507294.
[I 2025-07-30 21:49:29,815] Trial 621 finished with value: 0.016658976674079895 and parameters: {'width_NN_heal': 151, 'width_NN_state': 232, 'depth_NN_heal': 4, 'depth_NN_state': 5, 'mode_heal': 60, 'mode_state': 64, 'blocks_heal': 7, 'blocks_state': 3, 'lift_act_state': <built-in function gelu>, 'block_act_state': <built-in function gelu>, 'lift_act_heal': <function tanh at 0x7ff3611b4cc0>, 'block_act_heal': None, 'width_heal': 23, 'width_state': 36, 'lr': 0.0012415064831376996, 'padding_heal': 4, 'padding_state': 20, 'optimizer_type': 'lbfgs'}. Best is trial 484 with value: 0.0010389797389507294.
[I 2025-07-30 21:49:34,871] Trial 622 finished with value: 0.0014095426304265857 and parameters: {'width_NN_heal': 171, 'width_NN_state': 277, 'depth_NN_heal': 5, 'depth_NN_state': 5, 'mode_heal': 56, 'mode_state': 60, 'blocks_heal': 7, 'blocks_state': 3, 'lift_act_state': <built-in function gelu>, 'block_act_state': <built-in function gelu>, 'lift_act_heal': <function tanh at 0x7ff3611b4cc0>, 'block_act_heal': <function tanh at 0x7ff3611b4cc0>, 'width_heal': 25, 'width_state': 29, 'lr': 0.0022246994133594085, 'padding_heal': 0, 'padding_state': 9, 'optimizer_type': 'lbfgs'}. Best is trial 484 with value: 0.0010389797389507294.
