[I 2025-07-30 21:43:55,924] Trial 555 finished with value: 0.0012195482850074768 and parameters: {'width_NN_heal': 222, 'width_NN_state': 262, 'depth_NN_heal': 4, 'depth_NN_state': 4, 'mode_heal': 56, 'mode_state': 64, 'blocks_heal': 7, 'blocks_state': 3, 'lift_act_state': <built-in function gelu>, 'block_act_state': <built-in function gelu>, 'lift_act_heal': <function tanh at 0x7ff3611b4cc0>, 'block_act_heal': <function tanh at 0x7ff3611b4cc0>, 'width_heal': 24, 'width_state': 27, 'lr': 0.002628966997838543, 'padding_heal': 2, 'padding_state': 20, 'optimizer_type': 'lbfgs'}. Best is trial 484 with value: 0.0010389797389507294.
[I 2025-07-30 21:44:00,679] Trial 556 finished with value: 0.0017738249152898788 and parameters: {'width_NN_heal': 180, 'width_NN_state': 275, 'depth_NN_heal': 4, 'depth_NN_state': 4, 'mode_heal': 52, 'mode_state': 64, 'blocks_heal': 7, 'blocks_state': 3, 'lift_act_state': <built-in function gelu>, 'block_act_state': <built-in function gelu>, 'lift_act_heal': <function tanh at 0x7ff3611b4cc0>, 'block_act_heal': None, 'width_heal': 23, 'width_state': 31, 'lr': 0.0027898559116429893, 'padding_heal': 5, 'padding_state': 21, 'optimizer_type': 'lbfgs'}. Best is trial 484 with value: 0.0010389797389507294.
[I 2025-07-30 21:44:05,497] Trial 557 finished with value: 0.0012646634131669998 and parameters: {'width_NN_heal': 156, 'width_NN_state': 257, 'depth_NN_heal': 4, 'depth_NN_state': 4, 'mode_heal': 56, 'mode_state': 64, 'blocks_heal': 7, 'blocks_state': 3, 'lift_act_state': <built-in function gelu>, 'block_act_state': <built-in function gelu>, 'lift_act_heal': <function tanh at 0x7ff3611b4cc0>, 'block_act_heal': <function tanh at 0x7ff3611b4cc0>, 'width_heal': 24, 'width_state': 26, 'lr': 0.0025085720992890784, 'padding_heal': 6, 'padding_state': 20, 'optimizer_type': 'lbfgs'}. Best is trial 484 with value: 0.0010389797389507294.
[I 2025-07-30 21:44:10,329] Trial 558 finished with value: 0.0013326873304322362 and parameters: {'width_NN_heal': 194, 'width_NN_state': 298, 'depth_NN_heal': 4, 'depth_NN_state': 4, 'mode_heal': 56, 'mode_state': 60, 'blocks_heal': 7, 'blocks_state': 3, 'lift_act_state': <built-in function gelu>, 'block_act_state': <built-in function gelu>, 'lift_act_heal': <function tanh at 0x7ff3611b4cc0>, 'block_act_heal': <function tanh at 0x7ff3611b4cc0>, 'width_heal': 23, 'width_state': 27, 'lr': 0.002117289690513965, 'padding_heal': 2, 'padding_state': 21, 'optimizer_type': 'lbfgs'}. Best is trial 484 with value: 0.0010389797389507294.
[I 2025-07-30 21:44:15,185] Trial 559 finished with value: 0.0011512937489897013 and parameters: {'width_NN_heal': 124, 'width_NN_state': 249, 'depth_NN_heal': 4, 'depth_NN_state': 4, 'mode_heal': 56, 'mode_state': 60, 'blocks_heal': 7, 'blocks_state': 3, 'lift_act_state': <built-in function gelu>, 'block_act_state': <built-in function gelu>, 'lift_act_heal': <function tanh at 0x7ff3611b4cc0>, 'block_act_heal': <function tanh at 0x7ff3611b4cc0>, 'width_heal': 25, 'width_state': 36, 'lr': 0.002706547489218013, 'padding_heal': 1, 'padding_state': 20, 'optimizer_type': 'lbfgs'}. Best is trial 484 with value: 0.0010389797389507294.
[I 2025-07-30 21:44:19,998] Trial 560 finished with value: 0.00164992141071707 and parameters: {'width_NN_heal': 124, 'width_NN_state': 279, 'depth_NN_heal': 4, 'depth_NN_state': 4, 'mode_heal': 56, 'mode_state': 60, 'blocks_heal': 7, 'blocks_state': 3, 'lift_act_state': <built-in function gelu>, 'block_act_state': <built-in function gelu>, 'lift_act_heal': <function tanh at 0x7ff3611b4cc0>, 'block_act_heal': <function tanh at 0x7ff3611b4cc0>, 'width_heal': 31, 'width_state': 40, 'lr': 0.002774405391756074, 'padding_heal': 0, 'padding_state': 21, 'optimizer_type': 'lbfgs'}. Best is trial 484 with value: 0.0010389797389507294.
[I 2025-07-30 21:44:24,913] Trial 561 finished with value: 0.0012017234694212675 and parameters: {'width_NN_heal': 245, 'width_NN_state': 320, 'depth_NN_heal': 4, 'depth_NN_state': 4, 'mode_heal': 56, 'mode_state': 60, 'blocks_heal': 7, 'blocks_state': 3, 'lift_act_state': <built-in function gelu>, 'block_act_state': <built-in function gelu>, 'lift_act_heal': <function tanh at 0x7ff3611b4cc0>, 'block_act_heal': <function tanh at 0x7ff3611b4cc0>, 'width_heal': 28, 'width_state': 35, 'lr': 0.0023321915208395837, 'padding_heal': 1, 'padding_state': 20, 'optimizer_type': 'lbfgs'}. Best is trial 484 with value: 0.0010389797389507294.
[I 2025-07-30 21:44:29,864] Trial 562 finished with value: 0.0011606198968365788 and parameters: {'width_NN_heal': 120, 'width_NN_state': 241, 'depth_NN_heal': 4, 'depth_NN_state': 5, 'mode_heal': 56, 'mode_state': 60, 'blocks_heal': 7, 'blocks_state': 3, 'lift_act_state': <built-in function gelu>, 'block_act_state': <built-in function gelu>, 'lift_act_heal': <function tanh at 0x7ff3611b4cc0>, 'block_act_heal': <function tanh at 0x7ff3611b4cc0>, 'width_heal': 25, 'width_state': 36, 'lr': 0.002767415900677979, 'padding_heal': 4, 'padding_state': 21, 'optimizer_type': 'lbfgs'}. Best is trial 484 with value: 0.0010389797389507294.
[I 2025-07-30 21:44:34,867] Trial 563 finished with value: 0.001143179484643042 and parameters: {'width_NN_heal': 120, 'width_NN_state': 303, 'depth_NN_heal': 4, 'depth_NN_state': 5, 'mode_heal': 56, 'mode_state': 60, 'blocks_heal': 7, 'blocks_state': 3, 'lift_act_state': <built-in function gelu>, 'block_act_state': <built-in function gelu>, 'lift_act_heal': <function tanh at 0x7ff3611b4cc0>, 'block_act_heal': <function tanh at 0x7ff3611b4cc0>, 'width_heal': 25, 'width_state': 37, 'lr': 0.0028734382705720585, 'padding_heal': 6, 'padding_state': 21, 'optimizer_type': 'lbfgs'}. Best is trial 484 with value: 0.0010389797389507294.
[I 2025-07-30 21:44:39,684] Trial 564 finished with value: 0.0055691273882985115 and parameters: {'width_NN_heal': 119, 'width_NN_state': 292, 'depth_NN_heal': 4, 'depth_NN_state': 4, 'mode_heal': 52, 'mode_state': 60, 'blocks_heal': 7, 'blocks_state': 3, 'lift_act_state': <built-in function gelu>, 'block_act_state': None, 'lift_act_heal': <function tanh at 0x7ff3611b4cc0>, 'block_act_heal': <function tanh at 0x7ff3611b4cc0>, 'width_heal': 27, 'width_state': 38, 'lr': 0.002763817866595703, 'padding_heal': 5, 'padding_state': 21, 'optimizer_type': 'lbfgs'}. Best is trial 484 with value: 0.0010389797389507294.
[I 2025-07-30 21:44:45,733] Trial 565 finished with value: 0.001346347271464765 and parameters: {'width_NN_heal': 449, 'width_NN_state': 244, 'depth_NN_heal': 4, 'depth_NN_state': 5, 'mode_heal': 52, 'mode_state': 60, 'blocks_heal': 7, 'blocks_state': 3, 'lift_act_state': <built-in function gelu>, 'block_act_state': <built-in function gelu>, 'lift_act_heal': <function tanh at 0x7ff3611b4cc0>, 'block_act_heal': <function tanh at 0x7ff3611b4cc0>, 'width_heal': 30, 'width_state': 37, 'lr': 0.002859814409158644, 'padding_heal': 6, 'padding_state': 21, 'optimizer_type': 'lbfgs'}. Best is trial 484 with value: 0.0010389797389507294.
[I 2025-07-30 21:44:50,702] Trial 566 finished with value: 0.0029014567844569683 and parameters: {'width_NN_heal': 115, 'width_NN_state': 274, 'depth_NN_heal': 4, 'depth_NN_state': 5, 'mode_heal': 56, 'mode_state': 60, 'blocks_heal': 7, 'blocks_state': 3, 'lift_act_state': <built-in function gelu>, 'block_act_state': <built-in function gelu>, 'lift_act_heal': <function tanh at 0x7ff3611b4cc0>, 'block_act_heal': <function tanh at 0x7ff3611b4cc0>, 'width_heal': 29, 'width_state': 43, 'lr': 0.0027672724341635258, 'padding_heal': 6, 'padding_state': 20, 'optimizer_type': 'lbfgs'}. Best is trial 484 with value: 0.0010389797389507294.
[I 2025-07-30 21:44:55,794] Trial 567 finished with value: 0.0011298195458948612 and parameters: {'width_NN_heal': 128, 'width_NN_state': 314, 'depth_NN_heal': 4, 'depth_NN_state': 5, 'mode_heal': 56, 'mode_state': 60, 'blocks_heal': 7, 'blocks_state': 3, 'lift_act_state': <built-in function gelu>, 'block_act_state': <built-in function gelu>, 'lift_act_heal': <function tanh at 0x7ff3611b4cc0>, 'block_act_heal': <function tanh at 0x7ff3611b4cc0>, 'width_heal': 26, 'width_state': 36, 'lr': 0.00277109395382597, 'padding_heal': 5, 'padding_state': 18, 'optimizer_type': 'lbfgs'}. Best is trial 484 with value: 0.0010389797389507294.
[I 2025-07-30 21:45:00,755] Trial 568 finished with value: 0.0015015479875728488 and parameters: {'width_NN_heal': 128, 'width_NN_state': 301, 'depth_NN_heal': 4, 'depth_NN_state': 5, 'mode_heal': 56, 'mode_state': 60, 'blocks_heal': 7, 'blocks_state': 3, 'lift_act_state': <built-in function gelu>, 'block_act_state': <built-in function gelu>, 'lift_act_heal': <function tanh at 0x7ff3611b4cc0>, 'block_act_heal': <function tanh at 0x7ff3611b4cc0>, 'width_heal': 25, 'width_state': 39, 'lr': 0.0028007705431273926, 'padding_heal': 5, 'padding_state': 18, 'optimizer_type': 'lbfgs'}. Best is trial 484 with value: 0.0010389797389507294.
[I 2025-07-30 21:45:05,621] Trial 569 finished with value: 0.0021585894282907248 and parameters: {'width_NN_heal': 119, 'width_NN_state': 241, 'depth_NN_heal': 4, 'depth_NN_state': 5, 'mode_heal': 56, 'mode_state': 60, 'blocks_heal': 7, 'blocks_state': 3, 'lift_act_state': <built-in function gelu>, 'block_act_state': <built-in function gelu>, 'lift_act_heal': <function tanh at 0x7ff3611b4cc0>, 'block_act_heal': <function tanh at 0x7ff3611b4cc0>, 'width_heal': 24, 'width_state': 35, 'lr': 0.0025280827639035555, 'padding_heal': 5, 'padding_state': 18, 'optimizer_type': 'lbfgs'}. Best is trial 484 with value: 0.0010389797389507294.
[I 2025-07-30 21:45:10,601] Trial 570 finished with value: 0.0024031493812799454 and parameters: {'width_NN_heal': 132, 'width_NN_state': 269, 'depth_NN_heal': 4, 'depth_NN_state': 5, 'mode_heal': 56, 'mode_state': 16, 'blocks_heal': 7, 'blocks_state': 3, 'lift_act_state': <built-in function gelu>, 'block_act_state': <built-in function gelu>, 'lift_act_heal': <function tanh at 0x7ff3611b4cc0>, 'block_act_heal': <function tanh at 0x7ff3611b4cc0>, 'width_heal': 26, 'width_state': 37, 'lr': 0.002793905819325412, 'padding_heal': 6, 'padding_state': 19, 'optimizer_type': 'lbfgs'}. Best is trial 484 with value: 0.0010389797389507294.
[I 2025-07-30 21:45:15,545] Trial 571 finished with value: 0.0161481574177742 and parameters: {'width_NN_heal': 123, 'width_NN_state': 291, 'depth_NN_heal': 4, 'depth_NN_state': 5, 'mode_heal': 56, 'mode_state': 60, 'blocks_heal': 7, 'blocks_state': 3, 'lift_act_state': <built-in function gelu>, 'block_act_state': <built-in function gelu>, 'lift_act_heal': <function tanh at 0x7ff3611b4cc0>, 'block_act_heal': <function tanh at 0x7ff3611b4cc0>, 'width_heal': 25, 'width_state': 33, 'lr': 0.002919679889966367, 'padding_heal': 5, 'padding_state': 19, 'optimizer_type': 'lbfgs'}. Best is trial 484 with value: 0.0010389797389507294.
[I 2025-07-30 21:45:20,653] Trial 572 finished with value: 0.0017640490550547838 and parameters: {'width_NN_heal': 136, 'width_NN_state': 311, 'depth_NN_heal': 4, 'depth_NN_state': 5, 'mode_heal': 56, 'mode_state': 60, 'blocks_heal': 7, 'blocks_state': 3, 'lift_act_state': <built-in function gelu>, 'block_act_state': <built-in function gelu>, 'lift_act_heal': <function tanh at 0x7ff3611b4cc0>, 'block_act_heal': <function tanh at 0x7ff3611b4cc0>, 'width_heal': 24, 'width_state': 36, 'lr': 0.0024993099142635736, 'padding_heal': 4, 'padding_state': 19, 'optimizer_type': 'lbfgs'}. Best is trial 484 with value: 0.0010389797389507294.
[I 2025-07-30 21:45:25,582] Trial 573 finished with value: 0.001774211646988988 and parameters: {'width_NN_heal': 119, 'width_NN_state': 255, 'depth_NN_heal': 4, 'depth_NN_state': 5, 'mode_heal': 56, 'mode_state': 60, 'blocks_heal': 7, 'blocks_state': 3, 'lift_act_state': <built-in function gelu>, 'block_act_state': <built-in function gelu>, 'lift_act_heal': <function tanh at 0x7ff3611b4cc0>, 'block_act_heal': <function tanh at 0x7ff3611b4cc0>, 'width_heal': 27, 'width_state': 41, 'lr': 0.0028490222340447307, 'padding_heal': 5, 'padding_state': 21, 'optimizer_type': 'lbfgs'}. Best is trial 484 with value: 0.0010389797389507294.
[I 2025-07-30 21:45:30,516] Trial 574 finished with value: 0.016914380714297295 and parameters: {'width_NN_heal': 113, 'width_NN_state': 274, 'depth_NN_heal': 4, 'depth_NN_state': 5, 'mode_heal': 52, 'mode_state': 60, 'blocks_heal': 7, 'blocks_state': 3, 'lift_act_state': <built-in function gelu>, 'block_act_state': <built-in function gelu>, 'lift_act_heal': <function tanh at 0x7ff3611b4cc0>, 'block_act_heal': <function tanh at 0x7ff3611b4cc0>, 'width_heal': 23, 'width_state': 33, 'lr': 0.0005793767330894553, 'padding_heal': 6, 'padding_state': 18, 'optimizer_type': 'lbfgs'}. Best is trial 484 with value: 0.0010389797389507294.
[I 2025-07-30 21:45:35,474] Trial 575 finished with value: 0.001108969678170979 and parameters: {'width_NN_heal': 137, 'width_NN_state': 238, 'depth_NN_heal': 4, 'depth_NN_state': 5, 'mode_heal': 56, 'mode_state': 60, 'blocks_heal': 7, 'blocks_state': 3, 'lift_act_state': <built-in function gelu>, 'block_act_state': <built-in function gelu>, 'lift_act_heal': <function tanh at 0x7ff3611b4cc0>, 'block_act_heal': <function tanh at 0x7ff3611b4cc0>, 'width_heal': 25, 'width_state': 36, 'lr': 0.0025738935706845194, 'padding_heal': 4, 'padding_state': 21, 'optimizer_type': 'lbfgs'}. Best is trial 484 with value: 0.0010389797389507294.
[I 2025-07-30 21:45:40,427] Trial 576 finished with value: 0.0011758027831092477 and parameters: {'width_NN_heal': 135, 'width_NN_state': 240, 'depth_NN_heal': 4, 'depth_NN_state': 5, 'mode_heal': 56, 'mode_state': 60, 'blocks_heal': 7, 'blocks_state': 3, 'lift_act_state': <built-in function gelu>, 'block_act_state': <built-in function gelu>, 'lift_act_heal': <function tanh at 0x7ff3611b4cc0>, 'block_act_heal': <function tanh at 0x7ff3611b4cc0>, 'width_heal': 25, 'width_state': 39, 'lr': 0.0028982825114857386, 'padding_heal': 4, 'padding_state': 21, 'optimizer_type': 'lbfgs'}. Best is trial 484 with value: 0.0010389797389507294.
[I 2025-07-30 21:45:45,383] Trial 577 finished with value: 0.0014387298142537475 and parameters: {'width_NN_heal': 138, 'width_NN_state': 240, 'depth_NN_heal': 4, 'depth_NN_state': 5, 'mode_heal': 52, 'mode_state': 60, 'blocks_heal': 7, 'blocks_state': 3, 'lift_act_state': <built-in function gelu>, 'block_act_state': <built-in function gelu>, 'lift_act_heal': <function tanh at 0x7ff3611b4cc0>, 'block_act_heal': <function tanh at 0x7ff3611b4cc0>, 'width_heal': 26, 'width_state': 39, 'lr': 0.0026416721978650077, 'padding_heal': 4, 'padding_state': 21, 'optimizer_type': 'lbfgs'}. Best is trial 484 with value: 0.0010389797389507294.
[I 2025-07-30 21:45:48,880] Trial 578 finished with value: 0.0015227183466777205 and parameters: {'width_NN_heal': 135, 'width_NN_state': 238, 'depth_NN_heal': 4, 'depth_NN_state': 5, 'mode_heal': 56, 'mode_state': 60, 'blocks_heal': 2, 'blocks_state': 3, 'lift_act_state': <built-in function gelu>, 'block_act_state': <built-in function gelu>, 'lift_act_heal': <function tanh at 0x7ff3611b4cc0>, 'block_act_heal': <function tanh at 0x7ff3611b4cc0>, 'width_heal': 25, 'width_state': 36, 'lr': 0.0029301615150228886, 'padding_heal': 4, 'padding_state': 22, 'optimizer_type': 'lbfgs'}. Best is trial 484 with value: 0.0010389797389507294.
[I 2025-07-30 21:45:53,788] Trial 579 finished with value: 0.018206611275672913 and parameters: {'width_NN_heal': 171, 'width_NN_state': 227, 'depth_NN_heal': 4, 'depth_NN_state': 5, 'mode_heal': 56, 'mode_state': 60, 'blocks_heal': 7, 'blocks_state': 3, 'lift_act_state': <built-in function gelu>, 'block_act_state': <built-in function gelu>, 'lift_act_heal': <function tanh at 0x7ff3611b4cc0>, 'block_act_heal': None, 'width_heal': 26, 'width_state': 41, 'lr': 0.00022789887826732066, 'padding_heal': 4, 'padding_state': 21, 'optimizer_type': 'lbfgs'}. Best is trial 484 with value: 0.0010389797389507294.
[I 2025-07-30 21:45:58,758] Trial 580 finished with value: 0.0015481229638680816 and parameters: {'width_NN_heal': 126, 'width_NN_state': 259, 'depth_NN_heal': 4, 'depth_NN_state': 5, 'mode_heal': 52, 'mode_state': 60, 'blocks_heal': 7, 'blocks_state': 3, 'lift_act_state': <built-in function gelu>, 'block_act_state': <built-in function gelu>, 'lift_act_heal': <function tanh at 0x7ff3611b4cc0>, 'block_act_heal': <function tanh at 0x7ff3611b4cc0>, 'width_heal': 28, 'width_state': 44, 'lr': 0.002924852747069042, 'padding_heal': 4, 'padding_state': 20, 'optimizer_type': 'lbfgs'}. Best is trial 484 with value: 0.0010389797389507294.
[I 2025-07-30 21:46:03,754] Trial 581 finished with value: 0.0021622697822749615 and parameters: {'width_NN_heal': 145, 'width_NN_state': 290, 'depth_NN_heal': 4, 'depth_NN_state': 5, 'mode_heal': 56, 'mode_state': 60, 'blocks_heal': 7, 'blocks_state': 3, 'lift_act_state': <built-in function gelu>, 'block_act_state': <built-in function gelu>, 'lift_act_heal': <function tanh at 0x7ff3611b4cc0>, 'block_act_heal': <function tanh at 0x7ff3611b4cc0>, 'width_heal': 24, 'width_state': 39, 'lr': 0.0026025076447211077, 'padding_heal': 5, 'padding_state': 22, 'optimizer_type': 'lbfgs'}. Best is trial 484 with value: 0.0010389797389507294.
[I 2025-07-30 21:46:07,841] Trial 582 finished with value: 0.0014348459662869573 and parameters: {'width_NN_heal': 164, 'width_NN_state': 317, 'depth_NN_heal': 4, 'depth_NN_state': 5, 'mode_heal': 56, 'mode_state': 60, 'blocks_heal': 1, 'blocks_state': 3, 'lift_act_state': <built-in function gelu>, 'block_act_state': <built-in function gelu>, 'lift_act_heal': <function tanh at 0x7ff3611b4cc0>, 'block_act_heal': <function tanh at 0x7ff3611b4cc0>, 'width_heal': 29, 'width_state': 35, 'lr': 0.0029227944865986228, 'padding_heal': 3, 'padding_state': 21, 'optimizer_type': 'lbfgs'}. Best is trial 484 with value: 0.0010389797389507294.
[I 2025-07-30 21:46:12,804] Trial 583 finished with value: 0.0012349095195531845 and parameters: {'width_NN_heal': 154, 'width_NN_state': 248, 'depth_NN_heal': 4, 'depth_NN_state': 5, 'mode_heal': 56, 'mode_state': 60, 'blocks_heal': 7, 'blocks_state': 3, 'lift_act_state': <built-in function gelu>, 'block_act_state': <built-in function gelu>, 'lift_act_heal': <function tanh at 0x7ff3611b4cc0>, 'block_act_heal': <function tanh at 0x7ff3611b4cc0>, 'width_heal': 25, 'width_state': 32, 'lr': 0.00235577907642945, 'padding_heal': 4, 'padding_state': 20, 'optimizer_type': 'lbfgs'}. Best is trial 484 with value: 0.0010389797389507294.
[I 2025-07-30 21:46:17,948] Trial 584 finished with value: 0.0013861835468560457 and parameters: {'width_NN_heal': 188, 'width_NN_state': 273, 'depth_NN_heal': 4, 'depth_NN_state': 5, 'mode_heal': 56, 'mode_state': 60, 'blocks_heal': 7, 'blocks_state': 3, 'lift_act_state': <built-in function gelu>, 'block_act_state': <built-in function gelu>, 'lift_act_heal': <function tanh at 0x7ff3611b4cc0>, 'block_act_heal': <function tanh at 0x7ff3611b4cc0>, 'width_heal': 23, 'width_state': 41, 'lr': 0.0026346428564919563, 'padding_heal': 5, 'padding_state': 22, 'optimizer_type': 'lbfgs'}. Best is trial 484 with value: 0.0010389797389507294.
[I 2025-07-30 21:46:22,909] Trial 585 finished with value: 0.0011418983340263367 and parameters: {'width_NN_heal': 136, 'width_NN_state': 232, 'depth_NN_heal': 4, 'depth_NN_state': 5, 'mode_heal': 56, 'mode_state': 60, 'blocks_heal': 7, 'blocks_state': 3, 'lift_act_state': <built-in function gelu>, 'block_act_state': <built-in function gelu>, 'lift_act_heal': <function tanh at 0x7ff3611b4cc0>, 'block_act_heal': <function tanh at 0x7ff3611b4cc0>, 'width_heal': 28, 'width_state': 36, 'lr': 0.0022874939038979676, 'padding_heal': 4, 'padding_state': 21, 'optimizer_type': 'lbfgs'}. Best is trial 484 with value: 0.0010389797389507294.
[I 2025-07-30 21:46:27,869] Trial 586 finished with value: 0.0017511270707473159 and parameters: {'width_NN_heal': 175, 'width_NN_state': 218, 'depth_NN_heal': 4, 'depth_NN_state': 5, 'mode_heal': 52, 'mode_state': 60, 'blocks_heal': 7, 'blocks_state': 3, 'lift_act_state': <built-in function gelu>, 'block_act_state': None, 'lift_act_heal': <function tanh at 0x7ff3611b4cc0>, 'block_act_heal': <function tanh at 0x7ff3611b4cc0>, 'width_heal': 27, 'width_state': 36, 'lr': 0.0019155639728722746, 'padding_heal': 3, 'padding_state': 20, 'optimizer_type': 'lbfgs'}. Best is trial 484 with value: 0.0010389797389507294.
[I 2025-07-30 21:46:33,243] Trial 587 finished with value: 0.001471104333177209 and parameters: {'width_NN_heal': 203, 'width_NN_state': 310, 'depth_NN_heal': 4, 'depth_NN_state': 5, 'mode_heal': 56, 'mode_state': 60, 'blocks_heal': 7, 'blocks_state': 3, 'lift_act_state': <built-in function gelu>, 'block_act_state': <built-in function gelu>, 'lift_act_heal': <function tanh at 0x7ff3611b4cc0>, 'block_act_heal': <function tanh at 0x7ff3611b4cc0>, 'width_heal': 32, 'width_state': 34, 'lr': 0.00222253817815401, 'padding_heal': 4, 'padding_state': 20, 'optimizer_type': 'lbfgs'}. Best is trial 484 with value: 0.0010389797389507294.
[I 2025-07-30 21:46:38,408] Trial 588 finished with value: 0.0012901064474135637 and parameters: {'width_NN_heal': 156, 'width_NN_state': 265, 'depth_NN_heal': 4, 'depth_NN_state': 5, 'mode_heal': 56, 'mode_state': 60, 'blocks_heal': 7, 'blocks_state': 3, 'lift_act_state': <built-in function gelu>, 'block_act_state': <built-in function gelu>, 'lift_act_heal': <function tanh at 0x7ff3611b4cc0>, 'block_act_heal': <function tanh at 0x7ff3611b4cc0>, 'width_heal': 30, 'width_state': 31, 'lr': 0.0020139966982105086, 'padding_heal': 5, 'padding_state': 22, 'optimizer_type': 'lbfgs'}. Best is trial 484 with value: 0.0010389797389507294.
