[I 2025-07-30 22:40:19,368] Trial 1266 finished with value: 0.0012236820766702294 and parameters: {'width_NN_heal': 210, 'width_NN_state': 324, 'depth_NN_heal': 2, 'depth_NN_state': 2, 'mode_heal': 56, 'mode_state': 64, 'blocks_heal': 7, 'blocks_state': 6, 'lift_act_state': <built-in function gelu>, 'block_act_state': <built-in function gelu>, 'lift_act_heal': <built-in function gelu>, 'block_act_heal': None, 'width_heal': 63, 'width_state': 86, 'lr': 0.0015976922453930997, 'padding_heal': 5, 'padding_state': 17, 'optimizer_type': 'lbfgs'}. Best is trial 1091 with value: 0.0009798490209504962.
[I 2025-07-30 22:40:24,024] Trial 1267 finished with value: 0.0014253853587433696 and parameters: {'width_NN_heal': 399, 'width_NN_state': 287, 'depth_NN_heal': 2, 'depth_NN_state': 3, 'mode_heal': 60, 'mode_state': 60, 'blocks_heal': 7, 'blocks_state': 3, 'lift_act_state': <built-in function gelu>, 'block_act_state': <built-in function gelu>, 'lift_act_heal': <function tanh at 0x7ff3611b4cc0>, 'block_act_heal': None, 'width_heal': 41, 'width_state': 65, 'lr': 0.0014674769110946022, 'padding_heal': 4, 'padding_state': 16, 'optimizer_type': 'lbfgs'}. Best is trial 1091 with value: 0.0009798490209504962.
[I 2025-07-30 22:40:28,691] Trial 1268 finished with value: 0.001065799966454506 and parameters: {'width_NN_heal': 423, 'width_NN_state': 311, 'depth_NN_heal': 2, 'depth_NN_state': 3, 'mode_heal': 56, 'mode_state': 64, 'blocks_heal': 7, 'blocks_state': 3, 'lift_act_state': <built-in function gelu>, 'block_act_state': <built-in function gelu>, 'lift_act_heal': <function tanh at 0x7ff3611b4cc0>, 'block_act_heal': None, 'width_heal': 44, 'width_state': 69, 'lr': 0.0017746389871194541, 'padding_heal': 4, 'padding_state': 17, 'optimizer_type': 'lbfgs'}. Best is trial 1091 with value: 0.0009798490209504962.
[I 2025-07-30 22:40:33,490] Trial 1269 finished with value: 0.0034543201327323914 and parameters: {'width_NN_heal': 477, 'width_NN_state': 319, 'depth_NN_heal': 2, 'depth_NN_state': 3, 'mode_heal': 52, 'mode_state': 64, 'blocks_heal': 7, 'blocks_state': 3, 'lift_act_state': <built-in function gelu>, 'block_act_state': <built-in function gelu>, 'lift_act_heal': <function tanh at 0x7ff3611b4cc0>, 'block_act_heal': None, 'width_heal': 46, 'width_state': 66, 'lr': 0.00024926237996920377, 'padding_heal': 4, 'padding_state': 17, 'optimizer_type': 'lbfgs'}. Best is trial 1091 with value: 0.0009798490209504962.
[I 2025-07-30 22:40:38,385] Trial 1270 finished with value: 0.0014641962479799986 and parameters: {'width_NN_heal': 467, 'width_NN_state': 334, 'depth_NN_heal': 2, 'depth_NN_state': 3, 'mode_heal': 56, 'mode_state': 64, 'blocks_heal': 7, 'blocks_state': 3, 'lift_act_state': <built-in function gelu>, 'block_act_state': <function tanh at 0x7ff3611b4cc0>, 'lift_act_heal': <function tanh at 0x7ff3611b4cc0>, 'block_act_heal': None, 'width_heal': 48, 'width_state': 61, 'lr': 0.001891119280411322, 'padding_heal': 4, 'padding_state': 15, 'optimizer_type': 'lbfgs'}. Best is trial 1091 with value: 0.0009798490209504962.
[I 2025-07-30 22:40:43,139] Trial 1271 finished with value: 0.00122352025937289 and parameters: {'width_NN_heal': 419, 'width_NN_state': 316, 'depth_NN_heal': 2, 'depth_NN_state': 3, 'mode_heal': 56, 'mode_state': 64, 'blocks_heal': 7, 'blocks_state': 3, 'lift_act_state': <built-in function gelu>, 'block_act_state': <built-in function gelu>, 'lift_act_heal': <function tanh at 0x7ff3611b4cc0>, 'block_act_heal': None, 'width_heal': 44, 'width_state': 69, 'lr': 0.0016802152113627145, 'padding_heal': 4, 'padding_state': 17, 'optimizer_type': 'lbfgs'}. Best is trial 1091 with value: 0.0009798490209504962.
[I 2025-07-30 22:40:47,678] Trial 1272 finished with value: 0.0011445264099165797 and parameters: {'width_NN_heal': 439, 'width_NN_state': 334, 'depth_NN_heal': 2, 'depth_NN_state': 3, 'mode_heal': 56, 'mode_state': 64, 'blocks_heal': 6, 'blocks_state': 3, 'lift_act_state': <built-in function gelu>, 'block_act_state': <built-in function gelu>, 'lift_act_heal': <function tanh at 0x7ff3611b4cc0>, 'block_act_heal': None, 'width_heal': 46, 'width_state': 71, 'lr': 0.0017809340907899154, 'padding_heal': 3, 'padding_state': 17, 'optimizer_type': 'lbfgs'}. Best is trial 1091 with value: 0.0009798490209504962.
[I 2025-07-30 22:40:52,487] Trial 1273 finished with value: 0.0013127083657309413 and parameters: {'width_NN_heal': 474, 'width_NN_state': 302, 'depth_NN_heal': 2, 'depth_NN_state': 3, 'mode_heal': 56, 'mode_state': 64, 'blocks_heal': 7, 'blocks_state': 3, 'lift_act_state': <built-in function gelu>, 'block_act_state': <built-in function gelu>, 'lift_act_heal': <function tanh at 0x7ff3611b4cc0>, 'block_act_heal': None, 'width_heal': 49, 'width_state': 64, 'lr': 0.001964037093315526, 'padding_heal': 4, 'padding_state': 16, 'optimizer_type': 'lbfgs'}. Best is trial 1091 with value: 0.0009798490209504962.
[I 2025-07-30 22:40:57,339] Trial 1274 finished with value: 0.0011164412135258317 and parameters: {'width_NN_heal': 404, 'width_NN_state': 347, 'depth_NN_heal': 2, 'depth_NN_state': 3, 'mode_heal': 56, 'mode_state': 60, 'blocks_heal': 7, 'blocks_state': 3, 'lift_act_state': <built-in function gelu>, 'block_act_state': <built-in function gelu>, 'lift_act_heal': <function tanh at 0x7ff3611b4cc0>, 'block_act_heal': None, 'width_heal': 43, 'width_state': 58, 'lr': 0.001736377614399031, 'padding_heal': 4, 'padding_state': 17, 'optimizer_type': 'lbfgs'}. Best is trial 1091 with value: 0.0009798490209504962.
[I 2025-07-30 22:41:02,021] Trial 1275 finished with value: 0.0014975854428485036 and parameters: {'width_NN_heal': 448, 'width_NN_state': 302, 'depth_NN_heal': 2, 'depth_NN_state': 3, 'mode_heal': 56, 'mode_state': 64, 'blocks_heal': 7, 'blocks_state': 3, 'lift_act_state': <built-in function gelu>, 'block_act_state': <built-in function gelu>, 'lift_act_heal': <function tanh at 0x7ff3611b4cc0>, 'block_act_heal': None, 'width_heal': 45, 'width_state': 76, 'lr': 0.0006993262046828682, 'padding_heal': 3, 'padding_state': 16, 'optimizer_type': 'lbfgs'}. Best is trial 1091 with value: 0.0009798490209504962.
[I 2025-07-30 22:41:05,032] Trial 1276 finished with value: 0.003355031833052635 and parameters: {'width_NN_heal': 384, 'width_NN_state': 272, 'depth_NN_heal': 2, 'depth_NN_state': 3, 'mode_heal': 52, 'mode_state': 64, 'blocks_heal': 2, 'blocks_state': 1, 'lift_act_state': <built-in function gelu>, 'block_act_state': <built-in function gelu>, 'lift_act_heal': <function tanh at 0x7ff3611b4cc0>, 'block_act_heal': None, 'width_heal': 43, 'width_state': 71, 'lr': 0.008054423501084684, 'padding_heal': 2, 'padding_state': 17, 'optimizer_type': 'lbfgs'}. Best is trial 1091 with value: 0.0009798490209504962.
[I 2025-07-30 22:41:10,132] Trial 1277 finished with value: 0.002108122454956174 and parameters: {'width_NN_heal': 422, 'width_NN_state': 327, 'depth_NN_heal': 2, 'depth_NN_state': 3, 'mode_heal': 56, 'mode_state': 64, 'blocks_heal': 8, 'blocks_state': 3, 'lift_act_state': <built-in function gelu>, 'block_act_state': None, 'lift_act_heal': <function tanh at 0x7ff3611b4cc0>, 'block_act_heal': None, 'width_heal': 53, 'width_state': 75, 'lr': 0.0018160970018838067, 'padding_heal': 4, 'padding_state': 15, 'optimizer_type': 'lbfgs'}. Best is trial 1091 with value: 0.0009798490209504962.
[I 2025-07-30 22:41:14,831] Trial 1278 finished with value: 0.0011829246068373322 and parameters: {'width_NN_heal': 358, 'width_NN_state': 358, 'depth_NN_heal': 2, 'depth_NN_state': 3, 'mode_heal': 52, 'mode_state': 60, 'blocks_heal': 7, 'blocks_state': 3, 'lift_act_state': <built-in function gelu>, 'block_act_state': <built-in function gelu>, 'lift_act_heal': <function tanh at 0x7ff3611b4cc0>, 'block_act_heal': None, 'width_heal': 51, 'width_state': 68, 'lr': 0.001910599335492984, 'padding_heal': 3, 'padding_state': 17, 'optimizer_type': 'lbfgs'}. Best is trial 1091 with value: 0.0009798490209504962.
[I 2025-07-30 22:41:19,539] Trial 1279 finished with value: 0.0012140808394178748 and parameters: {'width_NN_heal': 388, 'width_NN_state': 305, 'depth_NN_heal': 2, 'depth_NN_state': 3, 'mode_heal': 56, 'mode_state': 64, 'blocks_heal': 7, 'blocks_state': 3, 'lift_act_state': <built-in function gelu>, 'block_act_state': <built-in function gelu>, 'lift_act_heal': <function tanh at 0x7ff3611b4cc0>, 'block_act_heal': None, 'width_heal': 41, 'width_state': 80, 'lr': 0.0012933015233345438, 'padding_heal': 4, 'padding_state': 18, 'optimizer_type': 'lbfgs'}. Best is trial 1091 with value: 0.0009798490209504962.
[I 2025-07-30 22:41:23,887] Trial 1280 finished with value: 0.001229919958859682 and parameters: {'width_NN_heal': 431, 'width_NN_state': 258, 'depth_NN_heal': 1, 'depth_NN_state': 2, 'mode_heal': 56, 'mode_state': 64, 'blocks_heal': 7, 'blocks_state': 3, 'lift_act_state': <built-in function gelu>, 'block_act_state': <built-in function gelu>, 'lift_act_heal': <function tanh at 0x7ff3611b4cc0>, 'block_act_heal': None, 'width_heal': 48, 'width_state': 68, 'lr': 0.0019806086311523075, 'padding_heal': 3, 'padding_state': 16, 'optimizer_type': 'lbfgs'}. Best is trial 1091 with value: 0.0009798490209504962.
[I 2025-07-30 22:41:28,256] Trial 1281 finished with value: 0.0022980119101703167 and parameters: {'width_NN_heal': 510, 'width_NN_state': 283, 'depth_NN_heal': 2, 'depth_NN_state': 3, 'mode_heal': 56, 'mode_state': 64, 'blocks_heal': 7, 'blocks_state': 2, 'lift_act_state': None, 'block_act_state': <built-in function gelu>, 'lift_act_heal': None, 'block_act_heal': None, 'width_heal': 58, 'width_state': 63, 'lr': 0.0012256591127125177, 'padding_heal': 5, 'padding_state': 16, 'optimizer_type': 'lbfgs'}. Best is trial 1091 with value: 0.0009798490209504962.
[I 2025-07-30 22:41:32,908] Trial 1282 finished with value: 0.0013044436927884817 and parameters: {'width_NN_heal': 382, 'width_NN_state': 331, 'depth_NN_heal': 2, 'depth_NN_state': 3, 'mode_heal': 56, 'mode_state': 64, 'blocks_heal': 7, 'blocks_state': 3, 'lift_act_state': <built-in function gelu>, 'block_act_state': <built-in function gelu>, 'lift_act_heal': <function tanh at 0x7ff3611b4cc0>, 'block_act_heal': None, 'width_heal': 45, 'width_state': 56, 'lr': 0.0013699767269835861, 'padding_heal': 2, 'padding_state': 18, 'optimizer_type': 'lbfgs'}. Best is trial 1091 with value: 0.0009798490209504962.
[I 2025-07-30 22:41:37,687] Trial 1283 finished with value: 0.002925946842879057 and parameters: {'width_NN_heal': 416, 'width_NN_state': 246, 'depth_NN_heal': 2, 'depth_NN_state': 3, 'mode_heal': 56, 'mode_state': 60, 'blocks_heal': 7, 'blocks_state': 3, 'lift_act_state': <built-in function gelu>, 'block_act_state': <built-in function gelu>, 'lift_act_heal': <function tanh at 0x7ff3611b4cc0>, 'block_act_heal': None, 'width_heal': 41, 'width_state': 75, 'lr': 0.00037583615666477376, 'padding_heal': 11, 'padding_state': 17, 'optimizer_type': 'lbfgs'}. Best is trial 1091 with value: 0.0009798490209504962.
[I 2025-07-30 22:41:42,511] Trial 1284 finished with value: 0.0012225746177136898 and parameters: {'width_NN_heal': 347, 'width_NN_state': 385, 'depth_NN_heal': 2, 'depth_NN_state': 3, 'mode_heal': 56, 'mode_state': 64, 'blocks_heal': 6, 'blocks_state': 3, 'lift_act_state': <built-in function gelu>, 'block_act_state': <built-in function gelu>, 'lift_act_heal': <function tanh at 0x7ff3611b4cc0>, 'block_act_heal': None, 'width_heal': 49, 'width_state': 84, 'lr': 0.0015113864124706876, 'padding_heal': 4, 'padding_state': 17, 'optimizer_type': 'lbfgs'}. Best is trial 1091 with value: 0.0009798490209504962.
[I 2025-07-30 22:41:47,005] Trial 1285 finished with value: 0.0013044539373368025 and parameters: {'width_NN_heal': 462, 'width_NN_state': 312, 'depth_NN_heal': 2, 'depth_NN_state': 3, 'mode_heal': 56, 'mode_state': 60, 'blocks_heal': 7, 'blocks_state': 2, 'lift_act_state': <built-in function gelu>, 'block_act_state': <built-in function gelu>, 'lift_act_heal': <function tanh at 0x7ff3611b4cc0>, 'block_act_heal': None, 'width_heal': 41, 'width_state': 61, 'lr': 0.00161161122109244, 'padding_heal': 3, 'padding_state': 18, 'optimizer_type': 'lbfgs'}. Best is trial 1091 with value: 0.0009798490209504962.
[I 2025-07-30 22:41:51,581] Trial 1286 finished with value: 0.0013312646187841892 and parameters: {'width_NN_heal': 364, 'width_NN_state': 286, 'depth_NN_heal': 2, 'depth_NN_state': 3, 'mode_heal': 56, 'mode_state': 64, 'blocks_heal': 7, 'blocks_state': 3, 'lift_act_state': <built-in function gelu>, 'block_act_state': <built-in function gelu>, 'lift_act_heal': <function tanh at 0x7ff3611b4cc0>, 'block_act_heal': None, 'width_heal': 44, 'width_state': 73, 'lr': 0.0011883638772245135, 'padding_heal': 1, 'padding_state': 10, 'optimizer_type': 'lbfgs'}. Best is trial 1091 with value: 0.0009798490209504962.
[I 2025-07-30 22:41:56,205] Trial 1287 finished with value: 0.0015577952144667506 and parameters: {'width_NN_heal': 394, 'width_NN_state': 64, 'depth_NN_heal': 2, 'depth_NN_state': 3, 'mode_heal': 56, 'mode_state': 64, 'blocks_heal': 7, 'blocks_state': 3, 'lift_act_state': <built-in function gelu>, 'block_act_state': <built-in function gelu>, 'lift_act_heal': <function tanh at 0x7ff3611b4cc0>, 'block_act_heal': None, 'width_heal': 52, 'width_state': 80, 'lr': 0.001689126094565961, 'padding_heal': 4, 'padding_state': 15, 'optimizer_type': 'lbfgs'}. Best is trial 1091 with value: 0.0009798490209504962.
[I 2025-07-30 22:42:00,891] Trial 1288 finished with value: 0.0012039880966767669 and parameters: {'width_NN_heal': 443, 'width_NN_state': 335, 'depth_NN_heal': 2, 'depth_NN_state': 3, 'mode_heal': 56, 'mode_state': 64, 'blocks_heal': 7, 'blocks_state': 3, 'lift_act_state': <built-in function gelu>, 'block_act_state': <built-in function gelu>, 'lift_act_heal': <function tanh at 0x7ff3611b4cc0>, 'block_act_heal': None, 'width_heal': 39, 'width_state': 67, 'lr': 0.001356545983728192, 'padding_heal': 5, 'padding_state': 16, 'optimizer_type': 'lbfgs'}. Best is trial 1091 with value: 0.0009798490209504962.
[I 2025-07-30 22:42:05,594] Trial 1289 finished with value: 0.0014310349943116307 and parameters: {'width_NN_heal': 344, 'width_NN_state': 365, 'depth_NN_heal': 2, 'depth_NN_state': 3, 'mode_heal': 52, 'mode_state': 64, 'blocks_heal': 7, 'blocks_state': 3, 'lift_act_state': <built-in function gelu>, 'block_act_state': <built-in function gelu>, 'lift_act_heal': <built-in function gelu>, 'block_act_heal': None, 'width_heal': 47, 'width_state': 88, 'lr': 0.0008125637802981419, 'padding_heal': 2, 'padding_state': 17, 'optimizer_type': 'lbfgs'}. Best is trial 1091 with value: 0.0009798490209504962.
[I 2025-07-30 22:42:10,322] Trial 1290 finished with value: 0.0011694403365254402 and parameters: {'width_NN_heal': 410, 'width_NN_state': 269, 'depth_NN_heal': 2, 'depth_NN_state': 3, 'mode_heal': 56, 'mode_state': 64, 'blocks_heal': 7, 'blocks_state': 3, 'lift_act_state': <built-in function gelu>, 'block_act_state': <built-in function gelu>, 'lift_act_heal': <function tanh at 0x7ff3611b4cc0>, 'block_act_heal': None, 'width_heal': 57, 'width_state': 76, 'lr': 0.0020005491456756225, 'padding_heal': 3, 'padding_state': 19, 'optimizer_type': 'lbfgs'}. Best is trial 1091 with value: 0.0009798490209504962.
[I 2025-07-30 22:42:14,941] Trial 1291 finished with value: 0.0011737076565623283 and parameters: {'width_NN_heal': 369, 'width_NN_state': 311, 'depth_NN_heal': 2, 'depth_NN_state': 3, 'mode_heal': 52, 'mode_state': 64, 'blocks_heal': 7, 'blocks_state': 3, 'lift_act_state': <built-in function gelu>, 'block_act_state': <built-in function gelu>, 'lift_act_heal': <function tanh at 0x7ff3611b4cc0>, 'block_act_heal': None, 'width_heal': 39, 'width_state': 72, 'lr': 0.0017904735723833721, 'padding_heal': 5, 'padding_state': 18, 'optimizer_type': 'lbfgs'}. Best is trial 1091 with value: 0.0009798490209504962.
[I 2025-07-30 22:42:19,927] Trial 1292 finished with value: 0.0018688938580453396 and parameters: {'width_NN_heal': 488, 'width_NN_state': 350, 'depth_NN_heal': 2, 'depth_NN_state': 3, 'mode_heal': 60, 'mode_state': 60, 'blocks_heal': 7, 'blocks_state': 3, 'lift_act_state': <built-in function gelu>, 'block_act_state': <function tanh at 0x7ff3611b4cc0>, 'lift_act_heal': <function tanh at 0x7ff3611b4cc0>, 'block_act_heal': None, 'width_heal': 44, 'width_state': 95, 'lr': 0.0015019528697178502, 'padding_heal': 4, 'padding_state': 17, 'optimizer_type': 'lbfgs'}. Best is trial 1091 with value: 0.0009798490209504962.
[I 2025-07-30 22:42:24,923] Trial 1293 finished with value: 0.0012322096154093742 and parameters: {'width_NN_heal': 511, 'width_NN_state': 241, 'depth_NN_heal': 2, 'depth_NN_state': 3, 'mode_heal': 60, 'mode_state': 64, 'blocks_heal': 8, 'blocks_state': 3, 'lift_act_state': <built-in function gelu>, 'block_act_state': <built-in function gelu>, 'lift_act_heal': <function tanh at 0x7ff3611b4cc0>, 'block_act_heal': None, 'width_heal': 50, 'width_state': 64, 'lr': 0.0011047030588460375, 'padding_heal': 3, 'padding_state': 18, 'optimizer_type': 'lbfgs'}. Best is trial 1091 with value: 0.0009798490209504962.
[I 2025-07-30 22:42:29,898] Trial 1294 finished with value: 0.003655123757198453 and parameters: {'width_NN_heal': 335, 'width_NN_state': 17, 'depth_NN_heal': 2, 'depth_NN_state': 3, 'mode_heal': 60, 'mode_state': 64, 'blocks_heal': 7, 'blocks_state': 4, 'lift_act_state': <built-in function gelu>, 'block_act_state': <built-in function gelu>, 'lift_act_heal': <function tanh at 0x7ff3611b4cc0>, 'block_act_heal': None, 'width_heal': 43, 'width_state': 52, 'lr': 0.0012487579887384438, 'padding_heal': 2, 'padding_state': 16, 'optimizer_type': 'lbfgs'}. Best is trial 1091 with value: 0.0009798490209504962.
[I 2025-07-30 22:42:35,284] Trial 1295 finished with value: 0.001196526107378304 and parameters: {'width_NN_heal': 444, 'width_NN_state': 401, 'depth_NN_heal': 2, 'depth_NN_state': 3, 'mode_heal': 56, 'mode_state': 64, 'blocks_heal': 7, 'blocks_state': 3, 'lift_act_state': <built-in function gelu>, 'block_act_state': <built-in function gelu>, 'lift_act_heal': <function tanh at 0x7ff3611b4cc0>, 'block_act_heal': None, 'width_heal': 47, 'width_state': 78, 'lr': 0.001386938630415518, 'padding_heal': 4, 'padding_state': 18, 'optimizer_type': 'lbfgs'}. Best is trial 1091 with value: 0.0009798490209504962.
[I 2025-07-30 22:42:39,890] Trial 1296 finished with value: 0.0014800791395828128 and parameters: {'width_NN_heal': 326, 'width_NN_state': 287, 'depth_NN_heal': 2, 'depth_NN_state': 3, 'mode_heal': 60, 'mode_state': 60, 'blocks_heal': 7, 'blocks_state': 3, 'lift_act_state': <built-in function gelu>, 'block_act_state': <built-in function gelu>, 'lift_act_heal': <function tanh at 0x7ff3611b4cc0>, 'block_act_heal': None, 'width_heal': 37, 'width_state': 69, 'lr': 0.0009238128970332037, 'padding_heal': 5, 'padding_state': 17, 'optimizer_type': 'lbfgs'}. Best is trial 1091 with value: 0.0009798490209504962.
[I 2025-07-30 22:42:44,089] Trial 1297 finished with value: 0.001699236105196178 and parameters: {'width_NN_heal': 386, 'width_NN_state': 322, 'depth_NN_heal': 1, 'depth_NN_state': 3, 'mode_heal': 56, 'mode_state': 64, 'blocks_heal': 7, 'blocks_state': 2, 'lift_act_state': <built-in function gelu>, 'block_act_state': <built-in function gelu>, 'lift_act_heal': <function tanh at 0x7ff3611b4cc0>, 'block_act_heal': None, 'width_heal': 41, 'width_state': 103, 'lr': 0.0015642377407741877, 'padding_heal': 3, 'padding_state': 19, 'optimizer_type': 'lbfgs'}. Best is trial 1091 with value: 0.0009798490209504962.
[I 2025-07-30 22:42:49,258] Trial 1298 finished with value: 0.0011834462638944387 and parameters: {'width_NN_heal': 416, 'width_NN_state': 351, 'depth_NN_heal': 2, 'depth_NN_state': 3, 'mode_heal': 60, 'mode_state': 64, 'blocks_heal': 7, 'blocks_state': 3, 'lift_act_state': <built-in function gelu>, 'block_act_state': <built-in function gelu>, 'lift_act_heal': <function tanh at 0x7ff3611b4cc0>, 'block_act_heal': None, 'width_heal': 53, 'width_state': 57, 'lr': 0.0011998189574279412, 'padding_heal': 4, 'padding_state': 14, 'optimizer_type': 'lbfgs'}. Best is trial 1091 with value: 0.0009798490209504962.
[I 2025-07-30 22:42:53,918] Trial 1299 finished with value: 0.0013666505692526698 and parameters: {'width_NN_heal': 366, 'width_NN_state': 266, 'depth_NN_heal': 2, 'depth_NN_state': 3, 'mode_heal': 36, 'mode_state': 64, 'blocks_heal': 7, 'blocks_state': 3, 'lift_act_state': <built-in function gelu>, 'block_act_state': <built-in function gelu>, 'lift_act_heal': <function tanh at 0x7ff3611b4cc0>, 'block_act_heal': None, 'width_heal': 39, 'width_state': 84, 'lr': 0.0017107189403641613, 'padding_heal': 5, 'padding_state': 16, 'optimizer_type': 'lbfgs'}. Best is trial 1091 with value: 0.0009798490209504962.
[I 2025-07-30 22:42:58,495] Trial 1300 finished with value: 0.002347382251173258 and parameters: {'width_NN_heal': 336, 'width_NN_state': 300, 'depth_NN_heal': 2, 'depth_NN_state': 2, 'mode_heal': 60, 'mode_state': 64, 'blocks_heal': 7, 'blocks_state': 3, 'lift_act_state': <built-in function gelu>, 'block_act_state': None, 'lift_act_heal': <function tanh at 0x7ff3611b4cc0>, 'block_act_heal': None, 'width_heal': 45, 'width_state': 113, 'lr': 0.0019427929475154136, 'padding_heal': 3, 'padding_state': 15, 'optimizer_type': 'lbfgs'}. Best is trial 1091 with value: 0.0009798490209504962.
[I 2025-07-30 22:43:03,716] Trial 1301 finished with value: 0.0010401944164186716 and parameters: {'width_NN_heal': 458, 'width_NN_state': 373, 'depth_NN_heal': 2, 'depth_NN_state': 3, 'mode_heal': 60, 'mode_state': 60, 'blocks_heal': 7, 'blocks_state': 3, 'lift_act_state': <built-in function gelu>, 'block_act_state': <built-in function gelu>, 'lift_act_heal': <function tanh at 0x7ff3611b4cc0>, 'block_act_heal': None, 'width_heal': 48, 'width_state': 72, 'lr': 0.0014614664354745052, 'padding_heal': 4, 'padding_state': 17, 'optimizer_type': 'lbfgs'}. Best is trial 1091 with value: 0.0009798490209504962.
