[I 2025-07-30 22:31:43,773] Trial 1158 finished with value: 0.001104624243453145 and parameters: {'width_NN_heal': 286, 'width_NN_state': 457, 'depth_NN_heal': 2, 'depth_NN_state': 3, 'mode_heal': 64, 'mode_state': 60, 'blocks_heal': 7, 'blocks_state': 3, 'lift_act_state': <built-in function gelu>, 'block_act_state': <built-in function gelu>, 'lift_act_heal': <function tanh at 0x7ff3611b4cc0>, 'block_act_heal': None, 'width_heal': 57, 'width_state': 61, 'lr': 0.0009916869929150894, 'padding_heal': 2, 'padding_state': 18, 'optimizer_type': 'lbfgs'}. Best is trial 1091 with value: 0.0009798490209504962.
[I 2025-07-30 22:31:48,765] Trial 1159 finished with value: 0.001126428716816008 and parameters: {'width_NN_heal': 307, 'width_NN_state': 404, 'depth_NN_heal': 2, 'depth_NN_state': 3, 'mode_heal': 60, 'mode_state': 60, 'blocks_heal': 7, 'blocks_state': 3, 'lift_act_state': <built-in function gelu>, 'block_act_state': <built-in function gelu>, 'lift_act_heal': <function tanh at 0x7ff3611b4cc0>, 'block_act_heal': None, 'width_heal': 50, 'width_state': 64, 'lr': 0.0011165733585062042, 'padding_heal': 3, 'padding_state': 16, 'optimizer_type': 'lbfgs'}. Best is trial 1091 with value: 0.0009798490209504962.
[I 2025-07-30 22:31:53,320] Trial 1160 finished with value: 0.001300053671002388 and parameters: {'width_NN_heal': 258, 'width_NN_state': 384, 'depth_NN_heal': 2, 'depth_NN_state': 2, 'mode_heal': 64, 'mode_state': 60, 'blocks_heal': 7, 'blocks_state': 3, 'lift_act_state': <built-in function gelu>, 'block_act_state': <built-in function gelu>, 'lift_act_heal': <function tanh at 0x7ff3611b4cc0>, 'block_act_heal': None, 'width_heal': 59, 'width_state': 57, 'lr': 0.001041234495874715, 'padding_heal': 2, 'padding_state': 17, 'optimizer_type': 'lbfgs'}. Best is trial 1091 with value: 0.0009798490209504962.
[I 2025-07-30 22:31:58,083] Trial 1161 finished with value: 0.00831493642181158 and parameters: {'width_NN_heal': 272, 'width_NN_state': 443, 'depth_NN_heal': 2, 'depth_NN_state': 3, 'mode_heal': 60, 'mode_state': 60, 'blocks_heal': 7, 'blocks_state': 3, 'lift_act_state': <built-in function gelu>, 'block_act_state': <function tanh at 0x7ff3611b4cc0>, 'lift_act_heal': <function tanh at 0x7ff3611b4cc0>, 'block_act_heal': None, 'width_heal': 7, 'width_state': 65, 'lr': 0.0008793660670921471, 'padding_heal': 28, 'padding_state': 19, 'optimizer_type': 'lbfgs'}. Best is trial 1091 with value: 0.0009798490209504962.
[I 2025-07-30 22:32:02,956] Trial 1162 finished with value: 0.001184655586257577 and parameters: {'width_NN_heal': 312, 'width_NN_state': 394, 'depth_NN_heal': 2, 'depth_NN_state': 3, 'mode_heal': 64, 'mode_state': 60, 'blocks_heal': 7, 'blocks_state': 3, 'lift_act_state': <built-in function gelu>, 'block_act_state': <built-in function gelu>, 'lift_act_heal': <function tanh at 0x7ff3611b4cc0>, 'block_act_heal': None, 'width_heal': 52, 'width_state': 66, 'lr': 0.0012111510810115475, 'padding_heal': 3, 'padding_state': 16, 'optimizer_type': 'lbfgs'}. Best is trial 1091 with value: 0.0009798490209504962.
[I 2025-07-30 22:32:07,263] Trial 1163 finished with value: 0.0011974598746746778 and parameters: {'width_NN_heal': 256, 'width_NN_state': 363, 'depth_NN_heal': 2, 'depth_NN_state': 3, 'mode_heal': 64, 'mode_state': 64, 'blocks_heal': 7, 'blocks_state': 2, 'lift_act_state': <built-in function gelu>, 'block_act_state': <built-in function gelu>, 'lift_act_heal': <function tanh at 0x7ff3611b4cc0>, 'block_act_heal': None, 'width_heal': 50, 'width_state': 20, 'lr': 0.001099009220962538, 'padding_heal': 3, 'padding_state': 18, 'optimizer_type': 'lbfgs'}. Best is trial 1091 with value: 0.0009798490209504962.
[I 2025-07-30 22:32:11,860] Trial 1164 finished with value: 0.0012048069620504975 and parameters: {'width_NN_heal': 284, 'width_NN_state': 363, 'depth_NN_heal': 2, 'depth_NN_state': 3, 'mode_heal': 60, 'mode_state': 64, 'blocks_heal': 7, 'blocks_state': 3, 'lift_act_state': <built-in function gelu>, 'block_act_state': <built-in function gelu>, 'lift_act_heal': <function tanh at 0x7ff3611b4cc0>, 'block_act_heal': None, 'width_heal': 47, 'width_state': 69, 'lr': 0.0009566542516893316, 'padding_heal': 3, 'padding_state': 17, 'optimizer_type': 'lbfgs'}. Best is trial 1091 with value: 0.0009798490209504962.
[I 2025-07-30 22:32:16,670] Trial 1165 finished with value: 0.0014366820687428117 and parameters: {'width_NN_heal': 236, 'width_NN_state': 422, 'depth_NN_heal': 2, 'depth_NN_state': 3, 'mode_heal': 60, 'mode_state': 60, 'blocks_heal': 7, 'blocks_state': 2, 'lift_act_state': <built-in function gelu>, 'block_act_state': <built-in function gelu>, 'lift_act_heal': <function tanh at 0x7ff3611b4cc0>, 'block_act_heal': None, 'width_heal': 53, 'width_state': 62, 'lr': 0.001247967546869242, 'padding_heal': 2, 'padding_state': 18, 'optimizer_type': 'lbfgs'}. Best is trial 1091 with value: 0.0009798490209504962.
[I 2025-07-30 22:32:21,972] Trial 1166 finished with value: 0.0011722213821485639 and parameters: {'width_NN_heal': 330, 'width_NN_state': 482, 'depth_NN_heal': 2, 'depth_NN_state': 3, 'mode_heal': 64, 'mode_state': 64, 'blocks_heal': 7, 'blocks_state': 3, 'lift_act_state': <built-in function gelu>, 'block_act_state': <built-in function gelu>, 'lift_act_heal': <function tanh at 0x7ff3611b4cc0>, 'block_act_heal': None, 'width_heal': 49, 'width_state': 54, 'lr': 0.0011147009994951947, 'padding_heal': 3, 'padding_state': 17, 'optimizer_type': 'lbfgs'}. Best is trial 1091 with value: 0.0009798490209504962.
[I 2025-07-30 22:32:26,661] Trial 1167 finished with value: 0.001245001214556396 and parameters: {'width_NN_heal': 299, 'width_NN_state': 388, 'depth_NN_heal': 2, 'depth_NN_state': 3, 'mode_heal': 60, 'mode_state': 64, 'blocks_heal': 6, 'blocks_state': 3, 'lift_act_state': <built-in function gelu>, 'block_act_state': <built-in function gelu>, 'lift_act_heal': <function tanh at 0x7ff3611b4cc0>, 'block_act_heal': None, 'width_heal': 46, 'width_state': 101, 'lr': 0.001003580528856213, 'padding_heal': 2, 'padding_state': 18, 'optimizer_type': 'lbfgs'}. Best is trial 1091 with value: 0.0009798490209504962.
[I 2025-07-30 22:32:31,703] Trial 1168 finished with value: 0.0011533207725733519 and parameters: {'width_NN_heal': 248, 'width_NN_state': 341, 'depth_NN_heal': 2, 'depth_NN_state': 3, 'mode_heal': 60, 'mode_state': 64, 'blocks_heal': 8, 'blocks_state': 3, 'lift_act_state': <built-in function gelu>, 'block_act_state': <built-in function gelu>, 'lift_act_heal': <function tanh at 0x7ff3611b4cc0>, 'block_act_heal': None, 'width_heal': 57, 'width_state': 58, 'lr': 0.001182966452670591, 'padding_heal': 4, 'padding_state': 19, 'optimizer_type': 'lbfgs'}. Best is trial 1091 with value: 0.0009798490209504962.
[I 2025-07-30 22:32:36,119] Trial 1169 finished with value: 0.01805032417178154 and parameters: {'width_NN_heal': 331, 'width_NN_state': 373, 'depth_NN_heal': 2, 'depth_NN_state': 3, 'mode_heal': 64, 'mode_state': 64, 'blocks_heal': 7, 'blocks_state': 3, 'lift_act_state': <built-in function gelu>, 'block_act_state': <built-in function gelu>, 'lift_act_heal': <function tanh at 0x7ff3611b4cc0>, 'block_act_heal': None, 'width_heal': 4, 'width_state': 89, 'lr': 0.0012912037102536893, 'padding_heal': 3, 'padding_state': 16, 'optimizer_type': 'lbfgs'}. Best is trial 1091 with value: 0.0009798490209504962.
[I 2025-07-30 22:32:40,653] Trial 1170 finished with value: 0.0012169280089437962 and parameters: {'width_NN_heal': 280, 'width_NN_state': 335, 'depth_NN_heal': 2, 'depth_NN_state': 3, 'mode_heal': 60, 'mode_state': 64, 'blocks_heal': 7, 'blocks_state': 3, 'lift_act_state': <built-in function gelu>, 'block_act_state': <built-in function gelu>, 'lift_act_heal': <function tanh at 0x7ff3611b4cc0>, 'block_act_heal': None, 'width_heal': 48, 'width_state': 69, 'lr': 0.001203610028873788, 'padding_heal': 5, 'padding_state': 19, 'optimizer_type': 'lbfgs'}. Best is trial 1091 with value: 0.0009798490209504962.
[I 2025-07-30 22:32:45,138] Trial 1171 finished with value: 0.0034073449205607176 and parameters: {'width_NN_heal': 223, 'width_NN_state': 317, 'depth_NN_heal': 2, 'depth_NN_state': 2, 'mode_heal': 64, 'mode_state': 64, 'blocks_heal': 7, 'blocks_state': 3, 'lift_act_state': <built-in function gelu>, 'block_act_state': None, 'lift_act_heal': <function tanh at 0x7ff3611b4cc0>, 'block_act_heal': None, 'width_heal': 54, 'width_state': 21, 'lr': 0.0010281861806540735, 'padding_heal': 3, 'padding_state': 17, 'optimizer_type': 'lbfgs'}. Best is trial 1091 with value: 0.0009798490209504962.
[I 2025-07-30 22:32:49,665] Trial 1172 finished with value: 0.0013244785368442535 and parameters: {'width_NN_heal': 308, 'width_NN_state': 351, 'depth_NN_heal': 1, 'depth_NN_state': 3, 'mode_heal': 60, 'mode_state': 60, 'blocks_heal': 7, 'blocks_state': 3, 'lift_act_state': <built-in function gelu>, 'block_act_state': <built-in function gelu>, 'lift_act_heal': <function tanh at 0x7ff3611b4cc0>, 'block_act_heal': None, 'width_heal': 46, 'width_state': 100, 'lr': 0.001327826920390445, 'padding_heal': 4, 'padding_state': 15, 'optimizer_type': 'lbfgs'}. Best is trial 1091 with value: 0.0009798490209504962.
[I 2025-07-30 22:32:54,301] Trial 1173 finished with value: 0.0013830163516104221 and parameters: {'width_NN_heal': 263, 'width_NN_state': 389, 'depth_NN_heal': 2, 'depth_NN_state': 3, 'mode_heal': 64, 'mode_state': 60, 'blocks_heal': 7, 'blocks_state': 3, 'lift_act_state': <built-in function gelu>, 'block_act_state': <built-in function gelu>, 'lift_act_heal': None, 'block_act_heal': None, 'width_heal': 44, 'width_state': 79, 'lr': 0.0010953173705598122, 'padding_heal': 2, 'padding_state': 13, 'optimizer_type': 'lbfgs'}. Best is trial 1091 with value: 0.0009798490209504962.
[I 2025-07-30 22:32:59,352] Trial 1174 finished with value: 0.0011864457046613097 and parameters: {'width_NN_heal': 345, 'width_NN_state': 418, 'depth_NN_heal': 2, 'depth_NN_state': 3, 'mode_heal': 36, 'mode_state': 64, 'blocks_heal': 7, 'blocks_state': 3, 'lift_act_state': <built-in function gelu>, 'block_act_state': <built-in function gelu>, 'lift_act_heal': <function tanh at 0x7ff3611b4cc0>, 'block_act_heal': None, 'width_heal': 47, 'width_state': 86, 'lr': 0.0009202488750804978, 'padding_heal': 5, 'padding_state': 18, 'optimizer_type': 'lbfgs'}. Best is trial 1091 with value: 0.0009798490209504962.
[I 2025-07-30 22:33:04,552] Trial 1175 finished with value: 0.001211942289955914 and parameters: {'width_NN_heal': 244, 'width_NN_state': 313, 'depth_NN_heal': 5, 'depth_NN_state': 3, 'mode_heal': 60, 'mode_state': 64, 'blocks_heal': 7, 'blocks_state': 3, 'lift_act_state': <built-in function gelu>, 'block_act_state': <built-in function gelu>, 'lift_act_heal': <function tanh at 0x7ff3611b4cc0>, 'block_act_heal': None, 'width_heal': 51, 'width_state': 64, 'lr': 0.0011933694248893118, 'padding_heal': 4, 'padding_state': 17, 'optimizer_type': 'lbfgs'}. Best is trial 1091 with value: 0.0009798490209504962.
[I 2025-07-30 22:33:08,743] Trial 1176 finished with value: 0.0015330916503444314 and parameters: {'width_NN_heal': 221, 'width_NN_state': 349, 'depth_NN_heal': 2, 'depth_NN_state': 3, 'mode_heal': 64, 'mode_state': 64, 'blocks_heal': 4, 'blocks_state': 3, 'lift_act_state': None, 'block_act_state': <built-in function gelu>, 'lift_act_heal': <function tanh at 0x7ff3611b4cc0>, 'block_act_heal': None, 'width_heal': 96, 'width_state': 72, 'lr': 0.00137567924739402, 'padding_heal': 3, 'padding_state': 18, 'optimizer_type': 'lbfgs'}. Best is trial 1091 with value: 0.0009798490209504962.
[I 2025-07-30 22:33:13,363] Trial 1177 finished with value: 0.001164256944321096 and parameters: {'width_NN_heal': 18, 'width_NN_state': 324, 'depth_NN_heal': 2, 'depth_NN_state': 3, 'mode_heal': 60, 'mode_state': 36, 'blocks_heal': 7, 'blocks_state': 3, 'lift_act_state': <built-in function gelu>, 'block_act_state': <built-in function gelu>, 'lift_act_heal': <function tanh at 0x7ff3611b4cc0>, 'block_act_heal': None, 'width_heal': 43, 'width_state': 93, 'lr': 0.0012796281716256112, 'padding_heal': 4, 'padding_state': 16, 'optimizer_type': 'lbfgs'}. Best is trial 1091 with value: 0.0009798490209504962.
[I 2025-07-30 22:33:18,116] Trial 1178 finished with value: 0.0011823618551716208 and parameters: {'width_NN_heal': 285, 'width_NN_state': 371, 'depth_NN_heal': 2, 'depth_NN_state': 3, 'mode_heal': 64, 'mode_state': 64, 'blocks_heal': 7, 'blocks_state': 3, 'lift_act_state': <built-in function gelu>, 'block_act_state': <built-in function gelu>, 'lift_act_heal': <function tanh at 0x7ff3611b4cc0>, 'block_act_heal': None, 'width_heal': 50, 'width_state': 77, 'lr': 0.0007715074805924307, 'padding_heal': 5, 'padding_state': 19, 'optimizer_type': 'lbfgs'}. Best is trial 1091 with value: 0.0009798490209504962.
[I 2025-07-30 22:33:24,251] Trial 1179 finished with value: 0.017410920932888985 and parameters: {'width_NN_heal': 322, 'width_NN_state': 305, 'depth_NN_heal': 2, 'depth_NN_state': 3, 'mode_heal': 64, 'mode_state': 64, 'blocks_heal': 7, 'blocks_state': 8, 'lift_act_state': <built-in function gelu>, 'block_act_state': <built-in function gelu>, 'lift_act_heal': <function tanh at 0x7ff3611b4cc0>, 'block_act_heal': None, 'width_heal': 56, 'width_state': 67, 'lr': 0.0014684332948609513, 'padding_heal': 4, 'padding_state': 17, 'optimizer_type': 'lbfgs'}. Best is trial 1091 with value: 0.0009798490209504962.
[I 2025-07-30 22:33:28,484] Trial 1180 finished with value: 0.003458749270066619 and parameters: {'width_NN_heal': 356, 'width_NN_state': 342, 'depth_NN_heal': 2, 'depth_NN_state': 3, 'mode_heal': 60, 'mode_state': 60, 'blocks_heal': 6, 'blocks_state': 3, 'lift_act_state': <built-in function gelu>, 'block_act_state': <built-in function gelu>, 'lift_act_heal': <function tanh at 0x7ff3611b4cc0>, 'block_act_heal': None, 'width_heal': 11, 'width_state': 22, 'lr': 0.0009737955093734267, 'padding_heal': 3, 'padding_state': 16, 'optimizer_type': 'lbfgs'}. Best is trial 1091 with value: 0.0009798490209504962.
[I 2025-07-30 22:33:33,145] Trial 1181 finished with value: 0.0012628280092030764 and parameters: {'width_NN_heal': 264, 'width_NN_state': 299, 'depth_NN_heal': 2, 'depth_NN_state': 3, 'mode_heal': 60, 'mode_state': 64, 'blocks_heal': 7, 'blocks_state': 3, 'lift_act_state': <built-in function gelu>, 'block_act_state': <built-in function gelu>, 'lift_act_heal': <function tanh at 0x7ff3611b4cc0>, 'block_act_heal': None, 'width_heal': 63, 'width_state': 83, 'lr': 0.0011573563018160936, 'padding_heal': 2, 'padding_state': 18, 'optimizer_type': 'lbfgs'}. Best is trial 1091 with value: 0.0009798490209504962.
[I 2025-07-30 22:33:37,756] Trial 1182 finished with value: 0.0023995605297386646 and parameters: {'width_NN_heal': 234, 'width_NN_state': 419, 'depth_NN_heal': 2, 'depth_NN_state': 3, 'mode_heal': 64, 'mode_state': 64, 'blocks_heal': 7, 'blocks_state': 3, 'lift_act_state': <built-in function gelu>, 'block_act_state': <function tanh at 0x7ff3611b4cc0>, 'lift_act_heal': <function tanh at 0x7ff3611b4cc0>, 'block_act_heal': None, 'width_heal': 34, 'width_state': 73, 'lr': 0.0008452759684354996, 'padding_heal': 3, 'padding_state': 17, 'optimizer_type': 'lbfgs'}. Best is trial 1091 with value: 0.0009798490209504962.
[I 2025-07-30 22:33:42,129] Trial 1183 finished with value: 0.0012887058546766639 and parameters: {'width_NN_heal': 290, 'width_NN_state': 375, 'depth_NN_heal': 2, 'depth_NN_state': 3, 'mode_heal': 60, 'mode_state': 64, 'blocks_heal': 7, 'blocks_state': 2, 'lift_act_state': <built-in function gelu>, 'block_act_state': <built-in function gelu>, 'lift_act_heal': <function tanh at 0x7ff3611b4cc0>, 'block_act_heal': None, 'width_heal': 44, 'width_state': 106, 'lr': 0.0010620213214656204, 'padding_heal': 5, 'padding_state': 19, 'optimizer_type': 'lbfgs'}. Best is trial 1091 with value: 0.0009798490209504962.
[I 2025-07-30 22:33:47,250] Trial 1184 finished with value: 0.0038184351287782192 and parameters: {'width_NN_heal': 305, 'width_NN_state': 9, 'depth_NN_heal': 5, 'depth_NN_state': 3, 'mode_heal': 60, 'mode_state': 60, 'blocks_heal': 7, 'blocks_state': 3, 'lift_act_state': <built-in function gelu>, 'block_act_state': <built-in function gelu>, 'lift_act_heal': <built-in function gelu>, 'block_act_heal': None, 'width_heal': 49, 'width_state': 63, 'lr': 0.0013881647818276628, 'padding_heal': 4, 'padding_state': 20, 'optimizer_type': 'lbfgs'}. Best is trial 1091 with value: 0.0009798490209504962.
[I 2025-07-30 22:33:52,351] Trial 1185 finished with value: 0.0011277851881459355 and parameters: {'width_NN_heal': 217, 'width_NN_state': 325, 'depth_NN_heal': 2, 'depth_NN_state': 3, 'mode_heal': 64, 'mode_state': 64, 'blocks_heal': 8, 'blocks_state': 3, 'lift_act_state': <built-in function gelu>, 'block_act_state': <built-in function gelu>, 'lift_act_heal': <function tanh at 0x7ff3611b4cc0>, 'block_act_heal': None, 'width_heal': 69, 'width_state': 96, 'lr': 0.0012211915134940595, 'padding_heal': 30, 'padding_state': 18, 'optimizer_type': 'lbfgs'}. Best is trial 1091 with value: 0.0009798490209504962.
[I 2025-07-30 22:33:56,932] Trial 1186 finished with value: 0.001208928762935102 and parameters: {'width_NN_heal': 339, 'width_NN_state': 292, 'depth_NN_heal': 2, 'depth_NN_state': 3, 'mode_heal': 60, 'mode_state': 40, 'blocks_heal': 7, 'blocks_state': 3, 'lift_act_state': <built-in function gelu>, 'block_act_state': <built-in function gelu>, 'lift_act_heal': <function tanh at 0x7ff3611b4cc0>, 'block_act_heal': None, 'width_heal': 42, 'width_state': 20, 'lr': 0.0015061220741557435, 'padding_heal': 1, 'padding_state': 16, 'optimizer_type': 'lbfgs'}. Best is trial 1091 with value: 0.0009798490209504962.
[I 2025-07-30 22:34:01,443] Trial 1187 finished with value: 0.0011270749382674694 and parameters: {'width_NN_heal': 246, 'width_NN_state': 343, 'depth_NN_heal': 1, 'depth_NN_state': 3, 'mode_heal': 64, 'mode_state': 64, 'blocks_heal': 7, 'blocks_state': 3, 'lift_act_state': <built-in function gelu>, 'block_act_state': <built-in function gelu>, 'lift_act_heal': <function tanh at 0x7ff3611b4cc0>, 'block_act_heal': None, 'width_heal': 53, 'width_state': 79, 'lr': 0.0013275161224688434, 'padding_heal': 2, 'padding_state': 18, 'optimizer_type': 'lbfgs'}. Best is trial 1091 with value: 0.0009798490209504962.
[I 2025-07-30 22:34:05,972] Trial 1188 finished with value: 0.0014889034209772944 and parameters: {'width_NN_heal': 270, 'width_NN_state': 378, 'depth_NN_heal': 2, 'depth_NN_state': 3, 'mode_heal': 60, 'mode_state': 64, 'blocks_heal': 7, 'blocks_state': 3, 'lift_act_state': <built-in function gelu>, 'block_act_state': <built-in function gelu>, 'lift_act_heal': <function tanh at 0x7ff3611b4cc0>, 'block_act_heal': None, 'width_heal': 40, 'width_state': 59, 'lr': 0.0010908543319479004, 'padding_heal': 5, 'padding_state': 19, 'optimizer_type': 'lbfgs'}. Best is trial 1091 with value: 0.0009798490209504962.
[I 2025-07-30 22:34:10,236] Trial 1189 finished with value: 0.0032387711107730865 and parameters: {'width_NN_heal': 372, 'width_NN_state': 308, 'depth_NN_heal': 2, 'depth_NN_state': 3, 'mode_heal': 64, 'mode_state': 64, 'blocks_heal': 7, 'blocks_state': 2, 'lift_act_state': <built-in function gelu>, 'block_act_state': None, 'lift_act_heal': <function tanh at 0x7ff3611b4cc0>, 'block_act_heal': None, 'width_heal': 48, 'width_state': 71, 'lr': 0.001454537061473168, 'padding_heal': 3, 'padding_state': 17, 'optimizer_type': 'lbfgs'}. Best is trial 1091 with value: 0.0009798490209504962.
[I 2025-07-30 22:34:14,753] Trial 1190 finished with value: 0.001293058623559773 and parameters: {'width_NN_heal': 315, 'width_NN_state': 273, 'depth_NN_heal': 2, 'depth_NN_state': 3, 'mode_heal': 60, 'mode_state': 60, 'blocks_heal': 7, 'blocks_state': 3, 'lift_act_state': <built-in function gelu>, 'block_act_state': <built-in function gelu>, 'lift_act_heal': <function tanh at 0x7ff3611b4cc0>, 'block_act_heal': None, 'width_heal': 34, 'width_state': 55, 'lr': 0.0009509786095227375, 'padding_heal': 4, 'padding_state': 17, 'optimizer_type': 'lbfgs'}. Best is trial 1091 with value: 0.0009798490209504962.
[I 2025-07-30 22:34:19,400] Trial 1191 finished with value: 0.001473612035624683 and parameters: {'width_NN_heal': 358, 'width_NN_state': 341, 'depth_NN_heal': 2, 'depth_NN_state': 3, 'mode_heal': 64, 'mode_state': 12, 'blocks_heal': 7, 'blocks_state': 3, 'lift_act_state': <built-in function gelu>, 'block_act_state': <built-in function gelu>, 'lift_act_heal': <function tanh at 0x7ff3611b4cc0>, 'block_act_heal': None, 'width_heal': 45, 'width_state': 23, 'lr': 0.0012623108327525455, 'padding_heal': 4, 'padding_state': 15, 'optimizer_type': 'lbfgs'}. Best is trial 1091 with value: 0.0009798490209504962.
[I 2025-07-30 22:34:23,801] Trial 1192 finished with value: 0.0014053169870749116 and parameters: {'width_NN_heal': 231, 'width_NN_state': 319, 'depth_NN_heal': 2, 'depth_NN_state': 2, 'mode_heal': 60, 'mode_state': 64, 'blocks_heal': 7, 'blocks_state': 3, 'lift_act_state': <built-in function gelu>, 'block_act_state': <built-in function gelu>, 'lift_act_heal': <function tanh at 0x7ff3611b4cc0>, 'block_act_heal': None, 'width_heal': 36, 'width_state': 87, 'lr': 0.001571308493836471, 'padding_heal': 3, 'padding_state': 18, 'optimizer_type': 'lbfgs'}. Best is trial 1091 with value: 0.0009798490209504962.
[I 2025-07-30 22:34:28,625] Trial 1193 finished with value: 0.0013971955049782991 and parameters: {'width_NN_heal': 206, 'width_NN_state': 462, 'depth_NN_heal': 2, 'depth_NN_state': 3, 'mode_heal': 64, 'mode_state': 64, 'blocks_heal': 7, 'blocks_state': 3, 'lift_act_state': <built-in function gelu>, 'block_act_state': <built-in function gelu>, 'lift_act_heal': None, 'block_act_heal': None, 'width_heal': 41, 'width_state': 77, 'lr': 0.0011553026411576521, 'padding_heal': 5, 'padding_state': 17, 'optimizer_type': 'lbfgs'}. Best is trial 1091 with value: 0.0009798490209504962.
