[I 2025-07-30 21:29:33,779] Trial 385 finished with value: 0.001568520674481988 and parameters: {'width_NN_heal': 98, 'width_NN_state': 123, 'depth_NN_heal': 6, 'depth_NN_state': 3, 'mode_heal': 64, 'mode_state': 16, 'blocks_heal': 6, 'blocks_state': 4, 'lift_act_state': <function tanh at 0x7ff3611b4cc0>, 'block_act_state': <built-in function gelu>, 'lift_act_heal': <function tanh at 0x7ff3611b4cc0>, 'block_act_heal': <function tanh at 0x7ff3611b4cc0>, 'width_heal': 22, 'width_state': 19, 'lr': 0.003495372562417082, 'padding_heal': 15, 'padding_state': 22, 'optimizer_type': 'adam'}. Best is trial 295 with value: 0.0012392300413921475.
[I 2025-07-30 21:29:39,030] Trial 386 finished with value: 0.01684700883924961 and parameters: {'width_NN_heal': 78, 'width_NN_state': 195, 'depth_NN_heal': 6, 'depth_NN_state': 7, 'mode_heal': 64, 'mode_state': 60, 'blocks_heal': 6, 'blocks_state': 4, 'lift_act_state': <function tanh at 0x7ff3611b4cc0>, 'block_act_state': <built-in function gelu>, 'lift_act_heal': <function tanh at 0x7ff3611b4cc0>, 'block_act_heal': <function tanh at 0x7ff3611b4cc0>, 'width_heal': 15, 'width_state': 6, 'lr': 0.003941513309216451, 'padding_heal': 15, 'padding_state': 21, 'optimizer_type': 'adam'}. Best is trial 295 with value: 0.0012392300413921475.
[I 2025-07-30 21:29:44,069] Trial 387 finished with value: 0.001288188504986465 and parameters: {'width_NN_heal': 93, 'width_NN_state': 134, 'depth_NN_heal': 6, 'depth_NN_state': 4, 'mode_heal': 64, 'mode_state': 60, 'blocks_heal': 6, 'blocks_state': 4, 'lift_act_state': <function tanh at 0x7ff3611b4cc0>, 'block_act_state': <built-in function gelu>, 'lift_act_heal': <function tanh at 0x7ff3611b4cc0>, 'block_act_heal': <function tanh at 0x7ff3611b4cc0>, 'width_heal': 17, 'width_state': 9, 'lr': 0.004417875835616562, 'padding_heal': 20, 'padding_state': 23, 'optimizer_type': 'adam'}. Best is trial 295 with value: 0.0012392300413921475.
[I 2025-07-30 21:29:49,141] Trial 388 finished with value: 0.003702229354530573 and parameters: {'width_NN_heal': 116, 'width_NN_state': 175, 'depth_NN_heal': 6, 'depth_NN_state': 4, 'mode_heal': 64, 'mode_state': 64, 'blocks_heal': 6, 'blocks_state': 4, 'lift_act_state': <function tanh at 0x7ff3611b4cc0>, 'block_act_state': <built-in function gelu>, 'lift_act_heal': <function tanh at 0x7ff3611b4cc0>, 'block_act_heal': <function tanh at 0x7ff3611b4cc0>, 'width_heal': 19, 'width_state': 8, 'lr': 0.0035054157436266715, 'padding_heal': 19, 'padding_state': 22, 'optimizer_type': 'adam'}. Best is trial 295 with value: 0.0012392300413921475.
[I 2025-07-30 21:29:54,127] Trial 389 finished with value: 0.002742798300459981 and parameters: {'width_NN_heal': 72, 'width_NN_state': 143, 'depth_NN_heal': 6, 'depth_NN_state': 4, 'mode_heal': 64, 'mode_state': 12, 'blocks_heal': 6, 'blocks_state': 4, 'lift_act_state': <function tanh at 0x7ff3611b4cc0>, 'block_act_state': <built-in function gelu>, 'lift_act_heal': <function tanh at 0x7ff3611b4cc0>, 'block_act_heal': <function tanh at 0x7ff3611b4cc0>, 'width_heal': 16, 'width_state': 9, 'lr': 0.0038173099848912246, 'padding_heal': 20, 'padding_state': 22, 'optimizer_type': 'lbfgs'}. Best is trial 295 with value: 0.0012392300413921475.
[I 2025-07-30 21:29:59,113] Trial 390 finished with value: 0.0013782958267256618 and parameters: {'width_NN_heal': 102, 'width_NN_state': 135, 'depth_NN_heal': 6, 'depth_NN_state': 4, 'mode_heal': 64, 'mode_state': 64, 'blocks_heal': 6, 'blocks_state': 4, 'lift_act_state': <function tanh at 0x7ff3611b4cc0>, 'block_act_state': <built-in function gelu>, 'lift_act_heal': <function tanh at 0x7ff3611b4cc0>, 'block_act_heal': <function tanh at 0x7ff3611b4cc0>, 'width_heal': 18, 'width_state': 13, 'lr': 0.0044955152875140675, 'padding_heal': 3, 'padding_state': 22, 'optimizer_type': 'adam'}. Best is trial 295 with value: 0.0012392300413921475.
[I 2025-07-30 21:30:04,086] Trial 391 finished with value: 0.0023615756072103977 and parameters: {'width_NN_heal': 110, 'width_NN_state': 133, 'depth_NN_heal': 6, 'depth_NN_state': 4, 'mode_heal': 64, 'mode_state': 64, 'blocks_heal': 6, 'blocks_state': 4, 'lift_act_state': <function tanh at 0x7ff3611b4cc0>, 'block_act_state': <built-in function gelu>, 'lift_act_heal': <function tanh at 0x7ff3611b4cc0>, 'block_act_heal': <function tanh at 0x7ff3611b4cc0>, 'width_heal': 18, 'width_state': 9, 'lr': 0.004837166324854846, 'padding_heal': 20, 'padding_state': 21, 'optimizer_type': 'adam'}. Best is trial 295 with value: 0.0012392300413921475.
[I 2025-07-30 21:30:09,057] Trial 392 finished with value: 0.0014301476767286658 and parameters: {'width_NN_heal': 119, 'width_NN_state': 152, 'depth_NN_heal': 6, 'depth_NN_state': 4, 'mode_heal': 64, 'mode_state': 64, 'blocks_heal': 6, 'blocks_state': 4, 'lift_act_state': <function tanh at 0x7ff3611b4cc0>, 'block_act_state': <built-in function gelu>, 'lift_act_heal': <function tanh at 0x7ff3611b4cc0>, 'block_act_heal': <function tanh at 0x7ff3611b4cc0>, 'width_heal': 18, 'width_state': 10, 'lr': 0.004668238702580326, 'padding_heal': 21, 'padding_state': 23, 'optimizer_type': 'adam'}. Best is trial 295 with value: 0.0012392300413921475.
[I 2025-07-30 21:30:13,978] Trial 393 finished with value: 0.003030214924365282 and parameters: {'width_NN_heal': 99, 'width_NN_state': 130, 'depth_NN_heal': 6, 'depth_NN_state': 4, 'mode_heal': 64, 'mode_state': 20, 'blocks_heal': 6, 'blocks_state': 4, 'lift_act_state': <function tanh at 0x7ff3611b4cc0>, 'block_act_state': <built-in function gelu>, 'lift_act_heal': <function tanh at 0x7ff3611b4cc0>, 'block_act_heal': <function tanh at 0x7ff3611b4cc0>, 'width_heal': 16, 'width_state': 9, 'lr': 0.001264591242805792, 'padding_heal': 21, 'padding_state': 22, 'optimizer_type': 'adam'}. Best is trial 295 with value: 0.0012392300413921475.
[I 2025-07-30 21:30:18,908] Trial 394 finished with value: 0.0019868535455316305 and parameters: {'width_NN_heal': 102, 'width_NN_state': 166, 'depth_NN_heal': 5, 'depth_NN_state': 4, 'mode_heal': 56, 'mode_state': 36, 'blocks_heal': 6, 'blocks_state': 4, 'lift_act_state': <function tanh at 0x7ff3611b4cc0>, 'block_act_state': <built-in function gelu>, 'lift_act_heal': <function tanh at 0x7ff3611b4cc0>, 'block_act_heal': <function tanh at 0x7ff3611b4cc0>, 'width_heal': 17, 'width_state': 8, 'lr': 0.004272454932988226, 'padding_heal': 2, 'padding_state': 23, 'optimizer_type': 'adam'}. Best is trial 295 with value: 0.0012392300413921475.
[I 2025-07-30 21:30:23,911] Trial 395 finished with value: 0.0011172658996656537 and parameters: {'width_NN_heal': 90, 'width_NN_state': 135, 'depth_NN_heal': 6, 'depth_NN_state': 4, 'mode_heal': 64, 'mode_state': 64, 'blocks_heal': 6, 'blocks_state': 4, 'lift_act_state': <function tanh at 0x7ff3611b4cc0>, 'block_act_state': <built-in function gelu>, 'lift_act_heal': <function tanh at 0x7ff3611b4cc0>, 'block_act_heal': <function tanh at 0x7ff3611b4cc0>, 'width_heal': 17, 'width_state': 13, 'lr': 0.004169535105824954, 'padding_heal': 3, 'padding_state': 22, 'optimizer_type': 'adam'}. Best is trial 395 with value: 0.0011172658996656537.
[I 2025-07-30 21:30:28,878] Trial 396 finished with value: 0.001377871260046959 and parameters: {'width_NN_heal': 83, 'width_NN_state': 137, 'depth_NN_heal': 6, 'depth_NN_state': 4, 'mode_heal': 64, 'mode_state': 64, 'blocks_heal': 6, 'blocks_state': 4, 'lift_act_state': <function tanh at 0x7ff3611b4cc0>, 'block_act_state': <built-in function gelu>, 'lift_act_heal': <function tanh at 0x7ff3611b4cc0>, 'block_act_heal': <function tanh at 0x7ff3611b4cc0>, 'width_heal': 17, 'width_state': 13, 'lr': 0.004001336696694866, 'padding_heal': 3, 'padding_state': 22, 'optimizer_type': 'adam'}. Best is trial 395 with value: 0.0011172658996656537.
[I 2025-07-30 21:30:33,847] Trial 397 finished with value: 0.0015299475053325295 and parameters: {'width_NN_heal': 83, 'width_NN_state': 139, 'depth_NN_heal': 6, 'depth_NN_state': 4, 'mode_heal': 64, 'mode_state': 64, 'blocks_heal': 6, 'blocks_state': 4, 'lift_act_state': <function tanh at 0x7ff3611b4cc0>, 'block_act_state': <built-in function gelu>, 'lift_act_heal': <function tanh at 0x7ff3611b4cc0>, 'block_act_heal': <function tanh at 0x7ff3611b4cc0>, 'width_heal': 17, 'width_state': 13, 'lr': 0.004119430900590313, 'padding_heal': 3, 'padding_state': 22, 'optimizer_type': 'adam'}. Best is trial 395 with value: 0.0011172658996656537.
[I 2025-07-30 21:30:38,810] Trial 398 finished with value: 0.0016320666763931513 and parameters: {'width_NN_heal': 91, 'width_NN_state': 155, 'depth_NN_heal': 6, 'depth_NN_state': 4, 'mode_heal': 64, 'mode_state': 64, 'blocks_heal': 6, 'blocks_state': 4, 'lift_act_state': <built-in function gelu>, 'block_act_state': None, 'lift_act_heal': <function tanh at 0x7ff3611b4cc0>, 'block_act_heal': <function tanh at 0x7ff3611b4cc0>, 'width_heal': 19, 'width_state': 5, 'lr': 0.004543946569434682, 'padding_heal': 4, 'padding_state': 21, 'optimizer_type': 'adam'}. Best is trial 395 with value: 0.0011172658996656537.
[I 2025-07-30 21:30:43,781] Trial 399 finished with value: 0.0020209033973515034 and parameters: {'width_NN_heal': 79, 'width_NN_state': 134, 'depth_NN_heal': 6, 'depth_NN_state': 4, 'mode_heal': 64, 'mode_state': 64, 'blocks_heal': 6, 'blocks_state': 4, 'lift_act_state': <function tanh at 0x7ff3611b4cc0>, 'block_act_state': <built-in function gelu>, 'lift_act_heal': <function tanh at 0x7ff3611b4cc0>, 'block_act_heal': <function tanh at 0x7ff3611b4cc0>, 'width_heal': 17, 'width_state': 14, 'lr': 0.004938733480827854, 'padding_heal': 3, 'padding_state': 22, 'optimizer_type': 'lbfgs'}. Best is trial 395 with value: 0.0011172658996656537.
[I 2025-07-30 21:30:48,720] Trial 400 finished with value: 0.0011773492442443967 and parameters: {'width_NN_heal': 107, 'width_NN_state': 126, 'depth_NN_heal': 6, 'depth_NN_state': 4, 'mode_heal': 64, 'mode_state': 28, 'blocks_heal': 6, 'blocks_state': 4, 'lift_act_state': <function tanh at 0x7ff3611b4cc0>, 'block_act_state': <built-in function gelu>, 'lift_act_heal': <function tanh at 0x7ff3611b4cc0>, 'block_act_heal': <function tanh at 0x7ff3611b4cc0>, 'width_heal': 20, 'width_state': 12, 'lr': 0.004029308934958021, 'padding_heal': 2, 'padding_state': 21, 'optimizer_type': 'adam'}. Best is trial 395 with value: 0.0011172658996656537.
[I 2025-07-30 21:30:53,731] Trial 401 finished with value: 0.0018340437673032284 and parameters: {'width_NN_heal': 102, 'width_NN_state': 124, 'depth_NN_heal': 6, 'depth_NN_state': 4, 'mode_heal': 64, 'mode_state': 24, 'blocks_heal': 6, 'blocks_state': 4, 'lift_act_state': <function tanh at 0x7ff3611b4cc0>, 'block_act_state': <built-in function gelu>, 'lift_act_heal': <function tanh at 0x7ff3611b4cc0>, 'block_act_heal': <function tanh at 0x7ff3611b4cc0>, 'width_heal': 21, 'width_state': 12, 'lr': 0.0038439881430897514, 'padding_heal': 2, 'padding_state': 21, 'optimizer_type': 'adam'}. Best is trial 395 with value: 0.0011172658996656537.
[I 2025-07-30 21:30:58,725] Trial 402 finished with value: 0.0011330965207889676 and parameters: {'width_NN_heal': 128, 'width_NN_state': 135, 'depth_NN_heal': 6, 'depth_NN_state': 4, 'mode_heal': 64, 'mode_state': 64, 'blocks_heal': 6, 'blocks_state': 4, 'lift_act_state': <function tanh at 0x7ff3611b4cc0>, 'block_act_state': <built-in function gelu>, 'lift_act_heal': <function tanh at 0x7ff3611b4cc0>, 'block_act_heal': <function tanh at 0x7ff3611b4cc0>, 'width_heal': 19, 'width_state': 6, 'lr': 0.0038652653464234243, 'padding_heal': 2, 'padding_state': 21, 'optimizer_type': 'adam'}. Best is trial 395 with value: 0.0011172658996656537.
[I 2025-07-30 21:31:03,641] Trial 403 finished with value: 0.0016321297734975815 and parameters: {'width_NN_heal': 93, 'width_NN_state': 140, 'depth_NN_heal': 6, 'depth_NN_state': 4, 'mode_heal': 64, 'mode_state': 64, 'blocks_heal': 6, 'blocks_state': 4, 'lift_act_state': <function tanh at 0x7ff3611b4cc0>, 'block_act_state': <built-in function gelu>, 'lift_act_heal': <function tanh at 0x7ff3611b4cc0>, 'block_act_heal': <function tanh at 0x7ff3611b4cc0>, 'width_heal': 20, 'width_state': 7, 'lr': 0.0037207276666929435, 'padding_heal': 2, 'padding_state': 21, 'optimizer_type': 'adam'}. Best is trial 395 with value: 0.0011172658996656537.
[I 2025-07-30 21:31:08,768] Trial 404 finished with value: 0.002893320517614484 and parameters: {'width_NN_heal': 130, 'width_NN_state': 124, 'depth_NN_heal': 6, 'depth_NN_state': 4, 'mode_heal': 64, 'mode_state': 64, 'blocks_heal': 6, 'blocks_state': 4, 'lift_act_state': <function tanh at 0x7ff3611b4cc0>, 'block_act_state': <function tanh at 0x7ff3611b4cc0>, 'lift_act_heal': <function tanh at 0x7ff3611b4cc0>, 'block_act_heal': <function tanh at 0x7ff3611b4cc0>, 'width_heal': 18, 'width_state': 12, 'lr': 0.003509106702816623, 'padding_heal': 1, 'padding_state': 20, 'optimizer_type': 'adam'}. Best is trial 395 with value: 0.0011172658996656537.
[I 2025-07-30 21:31:14,842] Trial 405 finished with value: 0.03073756769299507 and parameters: {'width_NN_heal': 148, 'width_NN_state': 479, 'depth_NN_heal': 6, 'depth_NN_state': 4, 'mode_heal': 64, 'mode_state': 64, 'blocks_heal': 6, 'blocks_state': 4, 'lift_act_state': <function tanh at 0x7ff3611b4cc0>, 'block_act_state': <built-in function gelu>, 'lift_act_heal': <function tanh at 0x7ff3611b4cc0>, 'block_act_heal': <function tanh at 0x7ff3611b4cc0>, 'width_heal': 14, 'width_state': 6, 'lr': 0.003971621606978692, 'padding_heal': 1, 'padding_state': 21, 'optimizer_type': 'adam'}. Best is trial 395 with value: 0.0011172658996656537.
[I 2025-07-30 21:31:19,661] Trial 406 finished with value: 0.0020684050396084785 and parameters: {'width_NN_heal': 113, 'width_NN_state': 134, 'depth_NN_heal': 6, 'depth_NN_state': 4, 'mode_heal': 64, 'mode_state': 28, 'blocks_heal': 6, 'blocks_state': 4, 'lift_act_state': None, 'block_act_state': <built-in function gelu>, 'lift_act_heal': <function tanh at 0x7ff3611b4cc0>, 'block_act_heal': <function tanh at 0x7ff3611b4cc0>, 'width_heal': 16, 'width_state': 12, 'lr': 0.0010642131206572655, 'padding_heal': 3, 'padding_state': 21, 'optimizer_type': 'adam'}. Best is trial 395 with value: 0.0011172658996656537.
[I 2025-07-30 21:31:24,628] Trial 407 finished with value: 0.0016564222751185298 and parameters: {'width_NN_heal': 108, 'width_NN_state': 121, 'depth_NN_heal': 6, 'depth_NN_state': 4, 'mode_heal': 64, 'mode_state': 64, 'blocks_heal': 6, 'blocks_state': 4, 'lift_act_state': <function tanh at 0x7ff3611b4cc0>, 'block_act_state': <built-in function gelu>, 'lift_act_heal': <function tanh at 0x7ff3611b4cc0>, 'block_act_heal': <function tanh at 0x7ff3611b4cc0>, 'width_heal': 18, 'width_state': 7, 'lr': 0.0034746508344596057, 'padding_heal': 3, 'padding_state': 23, 'optimizer_type': 'adam'}. Best is trial 395 with value: 0.0011172658996656537.
[I 2025-07-30 21:31:29,563] Trial 408 finished with value: 0.001424099551513791 and parameters: {'width_NN_heal': 127, 'width_NN_state': 145, 'depth_NN_heal': 6, 'depth_NN_state': 4, 'mode_heal': 64, 'mode_state': 64, 'blocks_heal': 6, 'blocks_state': 4, 'lift_act_state': <function tanh at 0x7ff3611b4cc0>, 'block_act_state': <built-in function gelu>, 'lift_act_heal': <function tanh at 0x7ff3611b4cc0>, 'block_act_heal': None, 'width_heal': 20, 'width_state': 6, 'lr': 0.003886302041553018, 'padding_heal': 2, 'padding_state': 22, 'optimizer_type': 'lbfgs'}. Best is trial 395 with value: 0.0011172658996656537.
[I 2025-07-30 21:31:34,544] Trial 409 finished with value: 0.002122137462720275 and parameters: {'width_NN_heal': 139, 'width_NN_state': 133, 'depth_NN_heal': 6, 'depth_NN_state': 4, 'mode_heal': 64, 'mode_state': 20, 'blocks_heal': 6, 'blocks_state': 4, 'lift_act_state': <function tanh at 0x7ff3611b4cc0>, 'block_act_state': <built-in function gelu>, 'lift_act_heal': <function tanh at 0x7ff3611b4cc0>, 'block_act_heal': <function tanh at 0x7ff3611b4cc0>, 'width_heal': 17, 'width_state': 13, 'lr': 0.0016021554787101343, 'padding_heal': 1, 'padding_state': 23, 'optimizer_type': 'adam'}. Best is trial 395 with value: 0.0011172658996656537.
[I 2025-07-30 21:31:39,534] Trial 410 finished with value: 0.002119075506925583 and parameters: {'width_NN_heal': 98, 'width_NN_state': 114, 'depth_NN_heal': 6, 'depth_NN_state': 4, 'mode_heal': 64, 'mode_state': 64, 'blocks_heal': 6, 'blocks_state': 4, 'lift_act_state': <function tanh at 0x7ff3611b4cc0>, 'block_act_state': <built-in function gelu>, 'lift_act_heal': <function tanh at 0x7ff3611b4cc0>, 'block_act_heal': <function tanh at 0x7ff3611b4cc0>, 'width_heal': 19, 'width_state': 101, 'lr': 0.004490262996791702, 'padding_heal': 4, 'padding_state': 20, 'optimizer_type': 'adam'}. Best is trial 395 with value: 0.0011172658996656537.
[I 2025-07-30 21:31:44,405] Trial 411 finished with value: 0.0017668919172137976 and parameters: {'width_NN_heal': 173, 'width_NN_state': 148, 'depth_NN_heal': 5, 'depth_NN_state': 4, 'mode_heal': 64, 'mode_state': 64, 'blocks_heal': 6, 'blocks_state': 4, 'lift_act_state': <function tanh at 0x7ff3611b4cc0>, 'block_act_state': <built-in function gelu>, 'lift_act_heal': <function tanh at 0x7ff3611b4cc0>, 'block_act_heal': <function tanh at 0x7ff3611b4cc0>, 'width_heal': 15, 'width_state': 113, 'lr': 0.004988456507810979, 'padding_heal': 1, 'padding_state': 23, 'optimizer_type': 'adam'}. Best is trial 395 with value: 0.0011172658996656537.
[I 2025-07-30 21:31:49,372] Trial 412 finished with value: 0.0016916121821850538 and parameters: {'width_NN_heal': 108, 'width_NN_state': 125, 'depth_NN_heal': 6, 'depth_NN_state': 4, 'mode_heal': 64, 'mode_state': 64, 'blocks_heal': 6, 'blocks_state': 4, 'lift_act_state': <function tanh at 0x7ff3611b4cc0>, 'block_act_state': <built-in function gelu>, 'lift_act_heal': <function tanh at 0x7ff3611b4cc0>, 'block_act_heal': <function tanh at 0x7ff3611b4cc0>, 'width_heal': 16, 'width_state': 13, 'lr': 0.0036650956627761436, 'padding_heal': 2, 'padding_state': 22, 'optimizer_type': 'adam'}. Best is trial 395 with value: 0.0011172658996656537.
[I 2025-07-30 21:31:54,326] Trial 413 finished with value: 0.001882630866020918 and parameters: {'width_NN_heal': 88, 'width_NN_state': 23, 'depth_NN_heal': 6, 'depth_NN_state': 4, 'mode_heal': 64, 'mode_state': 64, 'blocks_heal': 6, 'blocks_state': 4, 'lift_act_state': <function tanh at 0x7ff3611b4cc0>, 'block_act_state': <built-in function gelu>, 'lift_act_heal': <function tanh at 0x7ff3611b4cc0>, 'block_act_heal': <function tanh at 0x7ff3611b4cc0>, 'width_heal': 18, 'width_state': 6, 'lr': 0.003289914087272167, 'padding_heal': 3, 'padding_state': 22, 'optimizer_type': 'adam'}. Best is trial 395 with value: 0.0011172658996656537.
[I 2025-07-30 21:31:59,307] Trial 414 finished with value: 0.0018174133729189634 and parameters: {'width_NN_heal': 86, 'width_NN_state': 136, 'depth_NN_heal': 6, 'depth_NN_state': 4, 'mode_heal': 60, 'mode_state': 60, 'blocks_heal': 6, 'blocks_state': 4, 'lift_act_state': <function tanh at 0x7ff3611b4cc0>, 'block_act_state': <built-in function gelu>, 'lift_act_heal': <function tanh at 0x7ff3611b4cc0>, 'block_act_heal': <function tanh at 0x7ff3611b4cc0>, 'width_heal': 19, 'width_state': 5, 'lr': 0.00415496661477448, 'padding_heal': 3, 'padding_state': 6, 'optimizer_type': 'adam'}. Best is trial 395 with value: 0.0011172658996656537.
[I 2025-07-30 21:32:04,328] Trial 415 finished with value: 0.00237833708524704 and parameters: {'width_NN_heal': 115, 'width_NN_state': 20, 'depth_NN_heal': 6, 'depth_NN_state': 4, 'mode_heal': 56, 'mode_state': 32, 'blocks_heal': 6, 'blocks_state': 4, 'lift_act_state': <function tanh at 0x7ff3611b4cc0>, 'block_act_state': <built-in function gelu>, 'lift_act_heal': <function tanh at 0x7ff3611b4cc0>, 'block_act_heal': <function tanh at 0x7ff3611b4cc0>, 'width_heal': 17, 'width_state': 11, 'lr': 0.004518884754118402, 'padding_heal': 4, 'padding_state': 21, 'optimizer_type': 'adam'}. Best is trial 395 with value: 0.0011172658996656537.
[I 2025-07-30 21:32:09,628] Trial 416 finished with value: 0.0012474264949560165 and parameters: {'width_NN_heal': 80, 'width_NN_state': 112, 'depth_NN_heal': 6, 'depth_NN_state': 4, 'mode_heal': 64, 'mode_state': 64, 'blocks_heal': 7, 'blocks_state': 4, 'lift_act_state': <function tanh at 0x7ff3611b4cc0>, 'block_act_state': <built-in function gelu>, 'lift_act_heal': <function tanh at 0x7ff3611b4cc0>, 'block_act_heal': <function tanh at 0x7ff3611b4cc0>, 'width_heal': 23, 'width_state': 16, 'lr': 0.004007286869710023, 'padding_heal': 0, 'padding_state': 23, 'optimizer_type': 'lbfgs'}. Best is trial 395 with value: 0.0011172658996656537.
[I 2025-07-30 21:32:14,620] Trial 417 finished with value: 0.0013682806165888906 and parameters: {'width_NN_heal': 79, 'width_NN_state': 113, 'depth_NN_heal': 6, 'depth_NN_state': 4, 'mode_heal': 64, 'mode_state': 24, 'blocks_heal': 7, 'blocks_state': 3, 'lift_act_state': <function tanh at 0x7ff3611b4cc0>, 'block_act_state': <built-in function gelu>, 'lift_act_heal': <function tanh at 0x7ff3611b4cc0>, 'block_act_heal': <function tanh at 0x7ff3611b4cc0>, 'width_heal': 22, 'width_state': 17, 'lr': 0.003972761630625728, 'padding_heal': 1, 'padding_state': 23, 'optimizer_type': 'lbfgs'}. Best is trial 395 with value: 0.0011172658996656537.
[I 2025-07-30 21:32:19,574] Trial 418 finished with value: 0.0017274812562391162 and parameters: {'width_NN_heal': 75, 'width_NN_state': 114, 'depth_NN_heal': 6, 'depth_NN_state': 4, 'mode_heal': 64, 'mode_state': 28, 'blocks_heal': 7, 'blocks_state': 3, 'lift_act_state': <function tanh at 0x7ff3611b4cc0>, 'block_act_state': <built-in function gelu>, 'lift_act_heal': <function tanh at 0x7ff3611b4cc0>, 'block_act_heal': <function tanh at 0x7ff3611b4cc0>, 'width_heal': 24, 'width_state': 18, 'lr': 0.00519412095769576, 'padding_heal': 0, 'padding_state': 23, 'optimizer_type': 'lbfgs'}. Best is trial 395 with value: 0.0011172658996656537.
