[I 2025-07-30 22:26:00,936] Trial 1086 finished with value: 0.0012280482333153486 and parameters: {'width_NN_heal': 491, 'width_NN_state': 414, 'depth_NN_heal': 2, 'depth_NN_state': 3, 'mode_heal': 64, 'mode_state': 64, 'blocks_heal': 7, 'blocks_state': 3, 'lift_act_state': <built-in function gelu>, 'block_act_state': <built-in function gelu>, 'lift_act_heal': <function tanh at 0x7ff3611b4cc0>, 'block_act_heal': None, 'width_heal': 55, 'width_state': 75, 'lr': 0.0008965363058935475, 'padding_heal': 4, 'padding_state': 17, 'optimizer_type': 'lbfgs'}. Best is trial 771 with value: 0.0010052043944597244.
[I 2025-07-30 22:26:05,448] Trial 1087 finished with value: 0.001192866824567318 and parameters: {'width_NN_heal': 509, 'width_NN_state': 367, 'depth_NN_heal': 1, 'depth_NN_state': 3, 'mode_heal': 64, 'mode_state': 64, 'blocks_heal': 7, 'blocks_state': 3, 'lift_act_state': <built-in function gelu>, 'block_act_state': <built-in function gelu>, 'lift_act_heal': <function tanh at 0x7ff3611b4cc0>, 'block_act_heal': None, 'width_heal': 51, 'width_state': 67, 'lr': 0.0009920614861523064, 'padding_heal': 4, 'padding_state': 17, 'optimizer_type': 'lbfgs'}. Best is trial 771 with value: 0.0010052043944597244.
[I 2025-07-30 22:26:10,093] Trial 1088 finished with value: 0.0013998529175296426 and parameters: {'width_NN_heal': 288, 'width_NN_state': 345, 'depth_NN_heal': 2, 'depth_NN_state': 3, 'mode_heal': 64, 'mode_state': 64, 'blocks_heal': 7, 'blocks_state': 3, 'lift_act_state': <built-in function gelu>, 'block_act_state': <built-in function gelu>, 'lift_act_heal': None, 'block_act_heal': None, 'width_heal': 54, 'width_state': 71, 'lr': 0.0008677455070865079, 'padding_heal': 4, 'padding_state': 16, 'optimizer_type': 'lbfgs'}. Best is trial 771 with value: 0.0010052043944597244.
[I 2025-07-30 22:26:14,979] Trial 1089 finished with value: 0.001190858194604516 and parameters: {'width_NN_heal': 317, 'width_NN_state': 381, 'depth_NN_heal': 2, 'depth_NN_state': 3, 'mode_heal': 64, 'mode_state': 64, 'blocks_heal': 7, 'blocks_state': 3, 'lift_act_state': <built-in function gelu>, 'block_act_state': <built-in function gelu>, 'lift_act_heal': <function tanh at 0x7ff3611b4cc0>, 'block_act_heal': None, 'width_heal': 59, 'width_state': 77, 'lr': 0.000963806803295432, 'padding_heal': 4, 'padding_state': 15, 'optimizer_type': 'lbfgs'}. Best is trial 771 with value: 0.0010052043944597244.
[I 2025-07-30 22:26:19,180] Trial 1090 finished with value: 0.0011698883026838303 and parameters: {'width_NN_heal': 253, 'width_NN_state': 448, 'depth_NN_heal': 2, 'depth_NN_state': 3, 'mode_heal': 64, 'mode_state': 60, 'blocks_heal': 3, 'blocks_state': 3, 'lift_act_state': <built-in function gelu>, 'block_act_state': <built-in function gelu>, 'lift_act_heal': <function tanh at 0x7ff3611b4cc0>, 'block_act_heal': None, 'width_heal': 51, 'width_state': 65, 'lr': 0.001019463727735974, 'padding_heal': 4, 'padding_state': 17, 'optimizer_type': 'lbfgs'}. Best is trial 771 with value: 0.0010052043944597244.
[I 2025-07-30 22:26:23,910] Trial 1091 finished with value: 0.0009798490209504962 and parameters: {'width_NN_heal': 369, 'width_NN_state': 338, 'depth_NN_heal': 2, 'depth_NN_state': 3, 'mode_heal': 64, 'mode_state': 64, 'blocks_heal': 7, 'blocks_state': 3, 'lift_act_state': <built-in function gelu>, 'block_act_state': <built-in function gelu>, 'lift_act_heal': <function tanh at 0x7ff3611b4cc0>, 'block_act_heal': None, 'width_heal': 49, 'width_state': 72, 'lr': 0.0015779210922059717, 'padding_heal': 4, 'padding_state': 16, 'optimizer_type': 'lbfgs'}. Best is trial 1091 with value: 0.0009798490209504962.
[I 2025-07-30 22:26:28,631] Trial 1092 finished with value: 0.0012562288902699947 and parameters: {'width_NN_heal': 379, 'width_NN_state': 349, 'depth_NN_heal': 2, 'depth_NN_state': 3, 'mode_heal': 64, 'mode_state': 64, 'blocks_heal': 7, 'blocks_state': 3, 'lift_act_state': <built-in function gelu>, 'block_act_state': <built-in function gelu>, 'lift_act_heal': <function tanh at 0x7ff3611b4cc0>, 'block_act_heal': None, 'width_heal': 55, 'width_state': 79, 'lr': 0.0007913314610881893, 'padding_heal': 3, 'padding_state': 15, 'optimizer_type': 'lbfgs'}. Best is trial 1091 with value: 0.0009798490209504962.
[I 2025-07-30 22:26:34,030] Trial 1093 finished with value: 0.001992038683965802 and parameters: {'width_NN_heal': 406, 'width_NN_state': 412, 'depth_NN_heal': 2, 'depth_NN_state': 3, 'mode_heal': 64, 'mode_state': 64, 'blocks_heal': 7, 'blocks_state': 3, 'lift_act_state': None, 'block_act_state': <built-in function gelu>, 'lift_act_heal': <function tanh at 0x7ff3611b4cc0>, 'block_act_heal': None, 'width_heal': 58, 'width_state': 75, 'lr': 0.0015490411054097316, 'padding_heal': 4, 'padding_state': 14, 'optimizer_type': 'lbfgs'}. Best is trial 1091 with value: 0.0009798490209504962.
[I 2025-07-30 22:26:38,866] Trial 1094 finished with value: 0.0011484450660645962 and parameters: {'width_NN_heal': 457, 'width_NN_state': 335, 'depth_NN_heal': 2, 'depth_NN_state': 3, 'mode_heal': 64, 'mode_state': 64, 'blocks_heal': 7, 'blocks_state': 3, 'lift_act_state': <built-in function gelu>, 'block_act_state': <built-in function gelu>, 'lift_act_heal': <function tanh at 0x7ff3611b4cc0>, 'block_act_heal': None, 'width_heal': 49, 'width_state': 80, 'lr': 0.0008690782012098756, 'padding_heal': 3, 'padding_state': 16, 'optimizer_type': 'lbfgs'}. Best is trial 1091 with value: 0.0009798490209504962.
[I 2025-07-30 22:26:43,286] Trial 1095 finished with value: 0.003115701721981168 and parameters: {'width_NN_heal': 399, 'width_NN_state': 379, 'depth_NN_heal': 2, 'depth_NN_state': 2, 'mode_heal': 64, 'mode_state': 60, 'blocks_heal': 7, 'blocks_state': 3, 'lift_act_state': <built-in function gelu>, 'block_act_state': <function tanh at 0x7ff3611b4cc0>, 'lift_act_heal': <function tanh at 0x7ff3611b4cc0>, 'block_act_heal': None, 'width_heal': 52, 'width_state': 69, 'lr': 0.0007344002491190235, 'padding_heal': 3, 'padding_state': 15, 'optimizer_type': 'lbfgs'}. Best is trial 1091 with value: 0.0009798490209504962.
[I 2025-07-30 22:26:46,931] Trial 1096 finished with value: 0.0024546862114220858 and parameters: {'width_NN_heal': 368, 'width_NN_state': 359, 'depth_NN_heal': 2, 'depth_NN_state': 3, 'mode_heal': 64, 'mode_state': 64, 'blocks_heal': 2, 'blocks_state': 3, 'lift_act_state': <built-in function gelu>, 'block_act_state': <built-in function gelu>, 'lift_act_heal': <function tanh at 0x7ff3611b4cc0>, 'block_act_heal': None, 'width_heal': 48, 'width_state': 83, 'lr': 0.000347139254289868, 'padding_heal': 4, 'padding_state': 16, 'optimizer_type': 'lbfgs'}. Best is trial 1091 with value: 0.0009798490209504962.
[I 2025-07-30 22:26:51,806] Trial 1097 finished with value: 0.0013368451036512852 and parameters: {'width_NN_heal': 446, 'width_NN_state': 327, 'depth_NN_heal': 2, 'depth_NN_state': 3, 'mode_heal': 64, 'mode_state': 60, 'blocks_heal': 7, 'blocks_state': 3, 'lift_act_state': <built-in function gelu>, 'block_act_state': <built-in function gelu>, 'lift_act_heal': <function tanh at 0x7ff3611b4cc0>, 'block_act_heal': None, 'width_heal': 50, 'width_state': 73, 'lr': 0.0015217400408251106, 'padding_heal': 4, 'padding_state': 15, 'optimizer_type': 'lbfgs'}. Best is trial 1091 with value: 0.0009798490209504962.
[I 2025-07-30 22:26:56,182] Trial 1098 finished with value: 0.0016771876253187656 and parameters: {'width_NN_heal': 347, 'width_NN_state': 320, 'depth_NN_heal': 2, 'depth_NN_state': 3, 'mode_heal': 64, 'mode_state': 64, 'blocks_heal': 7, 'blocks_state': 2, 'lift_act_state': <built-in function gelu>, 'block_act_state': <built-in function gelu>, 'lift_act_heal': <function tanh at 0x7ff3611b4cc0>, 'block_act_heal': None, 'width_heal': 53, 'width_state': 64, 'lr': 0.0008176283020979425, 'padding_heal': 3, 'padding_state': 16, 'optimizer_type': 'lbfgs'}. Best is trial 1091 with value: 0.0009798490209504962.
[I 2025-07-30 22:27:01,108] Trial 1099 finished with value: 0.0011587509652599692 and parameters: {'width_NN_heal': 413, 'width_NN_state': 366, 'depth_NN_heal': 2, 'depth_NN_state': 3, 'mode_heal': 64, 'mode_state': 64, 'blocks_heal': 7, 'blocks_state': 3, 'lift_act_state': <built-in function gelu>, 'block_act_state': <built-in function gelu>, 'lift_act_heal': <function tanh at 0x7ff3611b4cc0>, 'block_act_heal': None, 'width_heal': 47, 'width_state': 77, 'lr': 0.001535800680617293, 'padding_heal': 4, 'padding_state': 16, 'optimizer_type': 'lbfgs'}. Best is trial 1091 with value: 0.0009798490209504962.
[I 2025-07-30 22:27:05,896] Trial 1100 finished with value: 0.0011432701721787453 and parameters: {'width_NN_heal': 368, 'width_NN_state': 338, 'depth_NN_heal': 2, 'depth_NN_state': 3, 'mode_heal': 64, 'mode_state': 40, 'blocks_heal': 7, 'blocks_state': 3, 'lift_act_state': <built-in function gelu>, 'block_act_state': <built-in function gelu>, 'lift_act_heal': <function tanh at 0x7ff3611b4cc0>, 'block_act_heal': None, 'width_heal': 58, 'width_state': 84, 'lr': 0.0014166466371252403, 'padding_heal': 3, 'padding_state': 17, 'optimizer_type': 'lbfgs'}. Best is trial 1091 with value: 0.0009798490209504962.
[I 2025-07-30 22:27:11,212] Trial 1101 finished with value: 0.002104403916746378 and parameters: {'width_NN_heal': 417, 'width_NN_state': 433, 'depth_NN_heal': 2, 'depth_NN_state': 3, 'mode_heal': 64, 'mode_state': 24, 'blocks_heal': 7, 'blocks_state': 3, 'lift_act_state': <built-in function gelu>, 'block_act_state': None, 'lift_act_heal': <function tanh at 0x7ff3611b4cc0>, 'block_act_heal': None, 'width_heal': 49, 'width_state': 72, 'lr': 0.001559318224309309, 'padding_heal': 4, 'padding_state': 16, 'optimizer_type': 'lbfgs'}. Best is trial 1091 with value: 0.0009798490209504962.
[I 2025-07-30 22:27:20,475] Trial 1102 finished with value: 0.017782682552933693 and parameters: {'width_NN_heal': 470, 'width_NN_state': 392, 'depth_NN_heal': 2, 'depth_NN_state': 8, 'mode_heal': 64, 'mode_state': 64, 'blocks_heal': 7, 'blocks_state': 3, 'lift_act_state': <built-in function gelu>, 'block_act_state': <built-in function gelu>, 'lift_act_heal': <function tanh at 0x7ff3611b4cc0>, 'block_act_heal': None, 'width_heal': 62, 'width_state': 66, 'lr': 0.0010571781831976575, 'padding_heal': 3, 'padding_state': 14, 'optimizer_type': 'lbfgs'}. Best is trial 1091 with value: 0.0009798490209504962.
[I 2025-07-30 22:27:24,985] Trial 1103 finished with value: 0.0015506107592955232 and parameters: {'width_NN_heal': 362, 'width_NN_state': 315, 'depth_NN_heal': 1, 'depth_NN_state': 3, 'mode_heal': 64, 'mode_state': 28, 'blocks_heal': 7, 'blocks_state': 3, 'lift_act_state': <built-in function gelu>, 'block_act_state': <built-in function gelu>, 'lift_act_heal': <function tanh at 0x7ff3611b4cc0>, 'block_act_heal': None, 'width_heal': 51, 'width_state': 78, 'lr': 0.001396201832055149, 'padding_heal': 4, 'padding_state': 17, 'optimizer_type': 'lbfgs'}. Best is trial 1091 with value: 0.0009798490209504962.
[I 2025-07-30 22:27:29,376] Trial 1104 finished with value: 0.0014077493688091636 and parameters: {'width_NN_heal': 343, 'width_NN_state': 350, 'depth_NN_heal': 2, 'depth_NN_state': 3, 'mode_heal': 64, 'mode_state': 20, 'blocks_heal': 7, 'blocks_state': 2, 'lift_act_state': <built-in function gelu>, 'block_act_state': <built-in function gelu>, 'lift_act_heal': <function tanh at 0x7ff3611b4cc0>, 'block_act_heal': None, 'width_heal': 47, 'width_state': 86, 'lr': 0.0015933204691840964, 'padding_heal': 3, 'padding_state': 17, 'optimizer_type': 'lbfgs'}. Best is trial 1091 with value: 0.0009798490209504962.
[I 2025-07-30 22:27:34,178] Trial 1105 finished with value: 0.0013963894452899694 and parameters: {'width_NN_heal': 511, 'width_NN_state': 314, 'depth_NN_heal': 2, 'depth_NN_state': 3, 'mode_heal': 64, 'mode_state': 64, 'blocks_heal': 7, 'blocks_state': 3, 'lift_act_state': <built-in function gelu>, 'block_act_state': <built-in function gelu>, 'lift_act_heal': <function tanh at 0x7ff3611b4cc0>, 'block_act_heal': None, 'width_heal': 46, 'width_state': 72, 'lr': 0.0006128168700653985, 'padding_heal': 4, 'padding_state': 16, 'optimizer_type': 'lbfgs'}. Best is trial 1091 with value: 0.0009798490209504962.
[I 2025-07-30 22:27:38,807] Trial 1106 finished with value: 0.0014908856246620417 and parameters: {'width_NN_heal': 21, 'width_NN_state': 344, 'depth_NN_heal': 2, 'depth_NN_state': 3, 'mode_heal': 64, 'mode_state': 64, 'blocks_heal': 7, 'blocks_state': 3, 'lift_act_state': <built-in function gelu>, 'block_act_state': <built-in function gelu>, 'lift_act_heal': <function tanh at 0x7ff3611b4cc0>, 'block_act_heal': None, 'width_heal': 55, 'width_state': 78, 'lr': 0.0006882817937092733, 'padding_heal': 3, 'padding_state': 16, 'optimizer_type': 'lbfgs'}. Best is trial 1091 with value: 0.0009798490209504962.
[I 2025-07-30 22:27:43,888] Trial 1107 finished with value: 0.00116659642662853 and parameters: {'width_NN_heal': 388, 'width_NN_state': 383, 'depth_NN_heal': 2, 'depth_NN_state': 3, 'mode_heal': 64, 'mode_state': 60, 'blocks_heal': 7, 'blocks_state': 3, 'lift_act_state': <built-in function gelu>, 'block_act_state': <built-in function gelu>, 'lift_act_heal': <function tanh at 0x7ff3611b4cc0>, 'block_act_heal': None, 'width_heal': 53, 'width_state': 62, 'lr': 0.0008899204563665087, 'padding_heal': 4, 'padding_state': 17, 'optimizer_type': 'lbfgs'}. Best is trial 1091 with value: 0.0009798490209504962.
[I 2025-07-30 22:27:48,407] Trial 1108 finished with value: 0.001274550217203796 and parameters: {'width_NN_heal': 256, 'width_NN_state': 309, 'depth_NN_heal': 2, 'depth_NN_state': 2, 'mode_heal': 64, 'mode_state': 64, 'blocks_heal': 7, 'blocks_state': 3, 'lift_act_state': <built-in function gelu>, 'block_act_state': <built-in function gelu>, 'lift_act_heal': <function tanh at 0x7ff3611b4cc0>, 'block_act_heal': None, 'width_heal': 57, 'width_state': 70, 'lr': 0.0011998735556221908, 'padding_heal': 3, 'padding_state': 17, 'optimizer_type': 'lbfgs'}. Best is trial 1091 with value: 0.0009798490209504962.
[I 2025-07-30 22:27:53,255] Trial 1109 finished with value: 0.0013253215001896024 and parameters: {'width_NN_heal': 429, 'width_NN_state': 329, 'depth_NN_heal': 2, 'depth_NN_state': 3, 'mode_heal': 64, 'mode_state': 64, 'blocks_heal': 7, 'blocks_state': 3, 'lift_act_state': <built-in function gelu>, 'block_act_state': <built-in function gelu>, 'lift_act_heal': <function tanh at 0x7ff3611b4cc0>, 'block_act_heal': None, 'width_heal': 49, 'width_state': 82, 'lr': 0.0009935302919228193, 'padding_heal': 4, 'padding_state': 15, 'optimizer_type': 'lbfgs'}. Best is trial 1091 with value: 0.0009798490209504962.
[I 2025-07-30 22:27:57,925] Trial 1110 finished with value: 0.0018511222442612052 and parameters: {'width_NN_heal': 332, 'width_NN_state': 415, 'depth_NN_heal': 2, 'depth_NN_state': 3, 'mode_heal': 64, 'mode_state': 64, 'blocks_heal': 7, 'blocks_state': 1, 'lift_act_state': <built-in function gelu>, 'block_act_state': <built-in function gelu>, 'lift_act_heal': None, 'block_act_heal': None, 'width_heal': 56, 'width_state': 66, 'lr': 0.0014337889746597028, 'padding_heal': 3, 'padding_state': 17, 'optimizer_type': 'lbfgs'}. Best is trial 1091 with value: 0.0009798490209504962.
[I 2025-07-30 22:28:03,117] Trial 1111 finished with value: 0.0015279845101758838 and parameters: {'width_NN_heal': 299, 'width_NN_state': 458, 'depth_NN_heal': 2, 'depth_NN_state': 3, 'mode_heal': 64, 'mode_state': 60, 'blocks_heal': 7, 'blocks_state': 3, 'lift_act_state': <built-in function gelu>, 'block_act_state': <built-in function gelu>, 'lift_act_heal': <function tanh at 0x7ff3611b4cc0>, 'block_act_heal': None, 'width_heal': 49, 'width_state': 75, 'lr': 0.0016209475078864308, 'padding_heal': 4, 'padding_state': 15, 'optimizer_type': 'lbfgs'}. Best is trial 1091 with value: 0.0009798490209504962.
[I 2025-07-30 22:28:07,879] Trial 1112 finished with value: 0.0015870481729507446 and parameters: {'width_NN_heal': 398, 'width_NN_state': 361, 'depth_NN_heal': 2, 'depth_NN_state': 3, 'mode_heal': 64, 'mode_state': 32, 'blocks_heal': 7, 'blocks_state': 3, 'lift_act_state': <built-in function gelu>, 'block_act_state': <built-in function gelu>, 'lift_act_heal': <function tanh at 0x7ff3611b4cc0>, 'block_act_heal': None, 'width_heal': 45, 'width_state': 87, 'lr': 0.0011012589816675165, 'padding_heal': 5, 'padding_state': 16, 'optimizer_type': 'lbfgs'}. Best is trial 1091 with value: 0.0009798490209504962.
[I 2025-07-30 22:28:12,395] Trial 1113 finished with value: 0.004589848220348358 and parameters: {'width_NN_heal': 260, 'width_NN_state': 8, 'depth_NN_heal': 2, 'depth_NN_state': 3, 'mode_heal': 64, 'mode_state': 44, 'blocks_heal': 7, 'blocks_state': 3, 'lift_act_state': <built-in function gelu>, 'block_act_state': <built-in function gelu>, 'lift_act_heal': <function tanh at 0x7ff3611b4cc0>, 'block_act_heal': None, 'width_heal': 52, 'width_state': 82, 'lr': 0.001327801000865848, 'padding_heal': 5, 'padding_state': 17, 'optimizer_type': 'lbfgs'}. Best is trial 1091 with value: 0.0009798490209504962.
[I 2025-07-30 22:28:16,938] Trial 1114 finished with value: 0.004676292184740305 and parameters: {'width_NN_heal': 370, 'width_NN_state': 303, 'depth_NN_heal': 2, 'depth_NN_state': 3, 'mode_heal': 64, 'mode_state': 64, 'blocks_heal': 7, 'blocks_state': 3, 'lift_act_state': None, 'block_act_state': <built-in function gelu>, 'lift_act_heal': <function tanh at 0x7ff3611b4cc0>, 'block_act_heal': None, 'width_heal': 46, 'width_state': 69, 'lr': 0.0001118391253561309, 'padding_heal': 3, 'padding_state': 17, 'optimizer_type': 'lbfgs'}. Best is trial 1091 with value: 0.0009798490209504962.
[I 2025-07-30 22:28:21,567] Trial 1115 finished with value: 0.0010986170964315534 and parameters: {'width_NN_heal': 279, 'width_NN_state': 334, 'depth_NN_heal': 2, 'depth_NN_state': 3, 'mode_heal': 60, 'mode_state': 64, 'blocks_heal': 7, 'blocks_state': 3, 'lift_act_state': <built-in function gelu>, 'block_act_state': <built-in function gelu>, 'lift_act_heal': <function tanh at 0x7ff3611b4cc0>, 'block_act_heal': None, 'width_heal': 48, 'width_state': 74, 'lr': 0.001205521415344108, 'padding_heal': 4, 'padding_state': 16, 'optimizer_type': 'lbfgs'}. Best is trial 1091 with value: 0.0009798490209504962.
[I 2025-07-30 22:28:26,057] Trial 1116 finished with value: 0.0012246049009263515 and parameters: {'width_NN_heal': 338, 'width_NN_state': 371, 'depth_NN_heal': 1, 'depth_NN_state': 3, 'mode_heal': 64, 'mode_state': 64, 'blocks_heal': 7, 'blocks_state': 3, 'lift_act_state': <built-in function gelu>, 'block_act_state': <built-in function gelu>, 'lift_act_heal': <function tanh at 0x7ff3611b4cc0>, 'block_act_heal': None, 'width_heal': 45, 'width_state': 89, 'lr': 0.001572650849576688, 'padding_heal': 5, 'padding_state': 17, 'optimizer_type': 'lbfgs'}. Best is trial 1091 with value: 0.0009798490209504962.
[I 2025-07-30 22:28:30,824] Trial 1117 finished with value: 0.0019441377371549606 and parameters: {'width_NN_heal': 437, 'width_NN_state': 308, 'depth_NN_heal': 2, 'depth_NN_state': 3, 'mode_heal': 60, 'mode_state': 64, 'blocks_heal': 7, 'blocks_state': 3, 'lift_act_state': <built-in function gelu>, 'block_act_state': <function tanh at 0x7ff3611b4cc0>, 'lift_act_heal': <function tanh at 0x7ff3611b4cc0>, 'block_act_heal': None, 'width_heal': 51, 'width_state': 77, 'lr': 0.0014235700415517727, 'padding_heal': 3, 'padding_state': 17, 'optimizer_type': 'lbfgs'}. Best is trial 1091 with value: 0.0009798490209504962.
[I 2025-07-30 22:28:35,957] Trial 1118 finished with value: 0.0014137483667582273 and parameters: {'width_NN_heal': 469, 'width_NN_state': 335, 'depth_NN_heal': 2, 'depth_NN_state': 3, 'mode_heal': 64, 'mode_state': 64, 'blocks_heal': 7, 'blocks_state': 3, 'lift_act_state': <built-in function gelu>, 'block_act_state': <built-in function gelu>, 'lift_act_heal': <function tanh at 0x7ff3611b4cc0>, 'block_act_heal': None, 'width_heal': 60, 'width_state': 63, 'lr': 0.000835000968771716, 'padding_heal': 4, 'padding_state': 16, 'optimizer_type': 'lbfgs'}. Best is trial 1091 with value: 0.0009798490209504962.
[I 2025-07-30 22:28:40,493] Trial 1119 finished with value: 0.001456211437471211 and parameters: {'width_NN_heal': 306, 'width_NN_state': 301, 'depth_NN_heal': 2, 'depth_NN_state': 3, 'mode_heal': 60, 'mode_state': 64, 'blocks_heal': 7, 'blocks_state': 3, 'lift_act_state': <built-in function gelu>, 'block_act_state': <built-in function gelu>, 'lift_act_heal': <function tanh at 0x7ff3611b4cc0>, 'block_act_heal': None, 'width_heal': 44, 'width_state': 81, 'lr': 0.0011008358454890545, 'padding_heal': 5, 'padding_state': 7, 'optimizer_type': 'lbfgs'}. Best is trial 1091 with value: 0.0009798490209504962.
[I 2025-07-30 22:28:45,744] Trial 1120 finished with value: 0.0012137173907831311 and parameters: {'width_NN_heal': 368, 'width_NN_state': 403, 'depth_NN_heal': 2, 'depth_NN_state': 3, 'mode_heal': 64, 'mode_state': 64, 'blocks_heal': 7, 'blocks_state': 3, 'lift_act_state': <built-in function gelu>, 'block_act_state': <built-in function gelu>, 'lift_act_heal': <function tanh at 0x7ff3611b4cc0>, 'block_act_heal': None, 'width_heal': 47, 'width_state': 67, 'lr': 0.001263694618039964, 'padding_heal': 11, 'padding_state': 18, 'optimizer_type': 'lbfgs'}. Best is trial 1091 with value: 0.0009798490209504962.
[I 2025-07-30 22:28:50,229] Trial 1121 finished with value: 0.00137721945066005 and parameters: {'width_NN_heal': 248, 'width_NN_state': 356, 'depth_NN_heal': 2, 'depth_NN_state': 3, 'mode_heal': 60, 'mode_state': 64, 'blocks_heal': 7, 'blocks_state': 2, 'lift_act_state': <built-in function gelu>, 'block_act_state': <built-in function gelu>, 'lift_act_heal': <function tanh at 0x7ff3611b4cc0>, 'block_act_heal': None, 'width_heal': 51, 'width_state': 72, 'lr': 0.0014804710463420662, 'padding_heal': 4, 'padding_state': 17, 'optimizer_type': 'lbfgs'}. Best is trial 1091 with value: 0.0009798490209504962.
