[I 2025-07-30 21:06:54,739] Trial 143 finished with value: 0.030719676986336708 and parameters: {'width_NN_heal': 13, 'width_NN_state': 65, 'depth_NN_heal': 7, 'depth_NN_state': 7, 'mode_heal': 64, 'mode_state': 56, 'blocks_heal': 8, 'blocks_state': 5, 'lift_act_state': <function tanh at 0x7ff3611b4cc0>, 'block_act_state': <built-in function gelu>, 'lift_act_heal': None, 'block_act_heal': <built-in function gelu>, 'width_heal': 33, 'width_state': 22, 'lr': 0.0037973920695656897, 'padding_heal': 18, 'padding_state': 32, 'optimizer_type': 'adam'}. Best is trial 135 with value: 0.0013019680045545101.
[I 2025-07-30 21:07:00,848] Trial 144 finished with value: 0.0013991973828524351 and parameters: {'width_NN_heal': 10, 'width_NN_state': 26, 'depth_NN_heal': 7, 'depth_NN_state': 6, 'mode_heal': 60, 'mode_state': 52, 'blocks_heal': 8, 'blocks_state': 5, 'lift_act_state': <function tanh at 0x7ff3611b4cc0>, 'block_act_state': <built-in function gelu>, 'lift_act_heal': None, 'block_act_heal': <built-in function gelu>, 'width_heal': 53, 'width_state': 26, 'lr': 0.003019193991879378, 'padding_heal': 19, 'padding_state': 31, 'optimizer_type': 'adam'}. Best is trial 135 with value: 0.0013019680045545101.
[I 2025-07-30 21:07:06,904] Trial 145 finished with value: 0.0027541457675397396 and parameters: {'width_NN_heal': 12, 'width_NN_state': 20, 'depth_NN_heal': 7, 'depth_NN_state': 6, 'mode_heal': 60, 'mode_state': 56, 'blocks_heal': 8, 'blocks_state': 5, 'lift_act_state': <function tanh at 0x7ff3611b4cc0>, 'block_act_state': <built-in function gelu>, 'lift_act_heal': None, 'block_act_heal': <built-in function gelu>, 'width_heal': 61, 'width_state': 27, 'lr': 0.002639213613677988, 'padding_heal': 20, 'padding_state': 5, 'optimizer_type': 'adam'}. Best is trial 135 with value: 0.0013019680045545101.
[I 2025-07-30 21:07:13,057] Trial 146 finished with value: 0.0015165535733103752 and parameters: {'width_NN_heal': 41, 'width_NN_state': 34, 'depth_NN_heal': 8, 'depth_NN_state': 6, 'mode_heal': 56, 'mode_state': 52, 'blocks_heal': 8, 'blocks_state': 5, 'lift_act_state': <function tanh at 0x7ff3611b4cc0>, 'block_act_state': <built-in function gelu>, 'lift_act_heal': <built-in function gelu>, 'block_act_heal': <built-in function gelu>, 'width_heal': 53, 'width_state': 23, 'lr': 0.003180158873289687, 'padding_heal': 30, 'padding_state': 31, 'optimizer_type': 'adam'}. Best is trial 135 with value: 0.0013019680045545101.
[I 2025-07-30 21:07:18,777] Trial 147 finished with value: 0.03074243851006031 and parameters: {'width_NN_heal': 34, 'width_NN_state': 23, 'depth_NN_heal': 8, 'depth_NN_state': 8, 'mode_heal': 60, 'mode_state': 52, 'blocks_heal': 7, 'blocks_state': 4, 'lift_act_state': <built-in function gelu>, 'block_act_state': <built-in function gelu>, 'lift_act_heal': <built-in function gelu>, 'block_act_heal': <built-in function gelu>, 'width_heal': 52, 'width_state': 23, 'lr': 0.003006054868649854, 'padding_heal': 29, 'padding_state': 0, 'optimizer_type': 'adam'}. Best is trial 135 with value: 0.0013019680045545101.
[I 2025-07-30 21:07:25,128] Trial 148 finished with value: 0.003992878366261721 and parameters: {'width_NN_heal': 8, 'width_NN_state': 36, 'depth_NN_heal': 8, 'depth_NN_state': 5, 'mode_heal': 64, 'mode_state': 48, 'blocks_heal': 8, 'blocks_state': 6, 'lift_act_state': <function tanh at 0x7ff3611b4cc0>, 'block_act_state': None, 'lift_act_heal': <built-in function gelu>, 'block_act_heal': <built-in function gelu>, 'width_heal': 54, 'width_state': 25, 'lr': 0.002573145266367543, 'padding_heal': 30, 'padding_state': 11, 'optimizer_type': 'adam'}. Best is trial 135 with value: 0.0013019680045545101.
[I 2025-07-30 21:07:31,411] Trial 149 finished with value: 0.0014734205324202776 and parameters: {'width_NN_heal': 42, 'width_NN_state': 34, 'depth_NN_heal': 8, 'depth_NN_state': 6, 'mode_heal': 44, 'mode_state': 52, 'blocks_heal': 8, 'blocks_state': 5, 'lift_act_state': <function tanh at 0x7ff3611b4cc0>, 'block_act_state': <built-in function gelu>, 'lift_act_heal': <built-in function gelu>, 'block_act_heal': <built-in function gelu>, 'width_heal': 59, 'width_state': 20, 'lr': 0.002236104544240486, 'padding_heal': 14, 'padding_state': 31, 'optimizer_type': 'adam'}. Best is trial 135 with value: 0.0013019680045545101.
[I 2025-07-30 21:07:37,325] Trial 150 finished with value: 0.0016037060413509607 and parameters: {'width_NN_heal': 36, 'width_NN_state': 26, 'depth_NN_heal': 8, 'depth_NN_state': 6, 'mode_heal': 40, 'mode_state': 52, 'blocks_heal': 8, 'blocks_state': 4, 'lift_act_state': <function tanh at 0x7ff3611b4cc0>, 'block_act_state': <built-in function gelu>, 'lift_act_heal': <built-in function gelu>, 'block_act_heal': <built-in function gelu>, 'width_heal': 72, 'width_state': 20, 'lr': 0.0021764461280244125, 'padding_heal': 31, 'padding_state': 32, 'optimizer_type': 'adam'}. Best is trial 135 with value: 0.0013019680045545101.
[I 2025-07-30 21:07:43,346] Trial 151 finished with value: 0.010075372643768787 and parameters: {'width_NN_heal': 13, 'width_NN_state': 28, 'depth_NN_heal': 8, 'depth_NN_state': 6, 'mode_heal': 56, 'mode_state': 52, 'blocks_heal': 8, 'blocks_state': 5, 'lift_act_state': <function tanh at 0x7ff3611b4cc0>, 'block_act_state': <built-in function gelu>, 'lift_act_heal': <built-in function gelu>, 'block_act_heal': <built-in function gelu>, 'width_heal': 5, 'width_state': 28, 'lr': 0.002824055590257389, 'padding_heal': 13, 'padding_state': 31, 'optimizer_type': 'adam'}. Best is trial 135 with value: 0.0013019680045545101.
[I 2025-07-30 21:07:49,516] Trial 152 finished with value: 0.0014664001064375043 and parameters: {'width_NN_heal': 46, 'width_NN_state': 34, 'depth_NN_heal': 8, 'depth_NN_state': 6, 'mode_heal': 44, 'mode_state': 44, 'blocks_heal': 8, 'blocks_state': 5, 'lift_act_state': <function tanh at 0x7ff3611b4cc0>, 'block_act_state': <built-in function gelu>, 'lift_act_heal': <built-in function gelu>, 'block_act_heal': <built-in function gelu>, 'width_heal': 58, 'width_state': 13, 'lr': 0.0033122602312725988, 'padding_heal': 15, 'padding_state': 30, 'optimizer_type': 'adam'}. Best is trial 135 with value: 0.0013019680045545101.
[I 2025-07-30 21:07:55,754] Trial 153 finished with value: 0.0014094032812863588 and parameters: {'width_NN_heal': 50, 'width_NN_state': 33, 'depth_NN_heal': 8, 'depth_NN_state': 6, 'mode_heal': 64, 'mode_state': 48, 'blocks_heal': 8, 'blocks_state': 5, 'lift_act_state': <function tanh at 0x7ff3611b4cc0>, 'block_act_state': <built-in function gelu>, 'lift_act_heal': <built-in function gelu>, 'block_act_heal': <built-in function gelu>, 'width_heal': 59, 'width_state': 10, 'lr': 0.003280860618702962, 'padding_heal': 14, 'padding_state': 32, 'optimizer_type': 'adam'}. Best is trial 135 with value: 0.0013019680045545101.
[I 2025-07-30 21:08:02,024] Trial 154 finished with value: 0.0020841024816036224 and parameters: {'width_NN_heal': 41, 'width_NN_state': 35, 'depth_NN_heal': 8, 'depth_NN_state': 7, 'mode_heal': 40, 'mode_state': 44, 'blocks_heal': 8, 'blocks_state': 5, 'lift_act_state': <function tanh at 0x7ff3611b4cc0>, 'block_act_state': <built-in function gelu>, 'lift_act_heal': <built-in function gelu>, 'block_act_heal': <built-in function gelu>, 'width_heal': 59, 'width_state': 5, 'lr': 0.0034158741666329047, 'padding_heal': 13, 'padding_state': 32, 'optimizer_type': 'adam'}. Best is trial 135 with value: 0.0013019680045545101.
[I 2025-07-30 21:08:08,273] Trial 155 finished with value: 0.0020050364546477795 and parameters: {'width_NN_heal': 49, 'width_NN_state': 32, 'depth_NN_heal': 8, 'depth_NN_state': 6, 'mode_heal': 44, 'mode_state': 40, 'blocks_heal': 8, 'blocks_state': 5, 'lift_act_state': <function tanh at 0x7ff3611b4cc0>, 'block_act_state': <built-in function gelu>, 'lift_act_heal': <built-in function gelu>, 'block_act_heal': <built-in function gelu>, 'width_heal': 57, 'width_state': 10, 'lr': 0.0031891943222230597, 'padding_heal': 14, 'padding_state': 31, 'optimizer_type': 'adam'}. Best is trial 135 with value: 0.0013019680045545101.
[I 2025-07-30 21:08:13,797] Trial 156 finished with value: 0.0017002307577058673 and parameters: {'width_NN_heal': 58, 'width_NN_state': 39, 'depth_NN_heal': 8, 'depth_NN_state': 5, 'mode_heal': 36, 'mode_state': 44, 'blocks_heal': 7, 'blocks_state': 4, 'lift_act_state': <function tanh at 0x7ff3611b4cc0>, 'block_act_state': <built-in function gelu>, 'lift_act_heal': <built-in function gelu>, 'block_act_heal': <built-in function gelu>, 'width_heal': 64, 'width_state': 11, 'lr': 0.004769343252999252, 'padding_heal': 12, 'padding_state': 32, 'optimizer_type': 'adam'}. Best is trial 135 with value: 0.0013019680045545101.
[I 2025-07-30 21:08:19,822] Trial 157 finished with value: 0.0019658308010548353 and parameters: {'width_NN_heal': 40, 'width_NN_state': 33, 'depth_NN_heal': 8, 'depth_NN_state': 6, 'mode_heal': 44, 'mode_state': 64, 'blocks_heal': 8, 'blocks_state': 5, 'lift_act_state': None, 'block_act_state': <built-in function gelu>, 'lift_act_heal': <built-in function gelu>, 'block_act_heal': <built-in function gelu>, 'width_heal': 68, 'width_state': 6, 'lr': 0.0028293820801235385, 'padding_heal': 14, 'padding_state': 31, 'optimizer_type': 'adam'}. Best is trial 135 with value: 0.0013019680045545101.
[I 2025-07-30 21:08:26,128] Trial 158 finished with value: 0.001985647715628147 and parameters: {'width_NN_heal': 45, 'width_NN_state': 44, 'depth_NN_heal': 8, 'depth_NN_state': 6, 'mode_heal': 48, 'mode_state': 44, 'blocks_heal': 8, 'blocks_state': 5, 'lift_act_state': <function tanh at 0x7ff3611b4cc0>, 'block_act_state': <function tanh at 0x7ff3611b4cc0>, 'lift_act_heal': <built-in function gelu>, 'block_act_heal': <built-in function gelu>, 'width_heal': 120, 'width_state': 14, 'lr': 0.002328257036520437, 'padding_heal': 15, 'padding_state': 29, 'optimizer_type': 'adam'}. Best is trial 135 with value: 0.0013019680045545101.
[I 2025-07-30 21:08:32,077] Trial 159 finished with value: 0.0015999013558030128 and parameters: {'width_NN_heal': 53, 'width_NN_state': 27, 'depth_NN_heal': 8, 'depth_NN_state': 6, 'mode_heal': 32, 'mode_state': 48, 'blocks_heal': 8, 'blocks_state': 4, 'lift_act_state': <function tanh at 0x7ff3611b4cc0>, 'block_act_state': <built-in function gelu>, 'lift_act_heal': <built-in function gelu>, 'block_act_heal': <built-in function gelu>, 'width_heal': 59, 'width_state': 17, 'lr': 0.003680398908779978, 'padding_heal': 14, 'padding_state': 31, 'optimizer_type': 'adam'}. Best is trial 135 with value: 0.0013019680045545101.
[I 2025-07-30 21:08:38,142] Trial 160 finished with value: 0.0015991053078323603 and parameters: {'width_NN_heal': 43, 'width_NN_state': 24, 'depth_NN_heal': 8, 'depth_NN_state': 6, 'mode_heal': 64, 'mode_state': 48, 'blocks_heal': 8, 'blocks_state': 5, 'lift_act_state': <function tanh at 0x7ff3611b4cc0>, 'block_act_state': <built-in function gelu>, 'lift_act_heal': <built-in function gelu>, 'block_act_heal': None, 'width_heal': 48, 'width_state': 7, 'lr': 0.0032547811863816827, 'padding_heal': 30, 'padding_state': 32, 'optimizer_type': 'adam'}. Best is trial 135 with value: 0.0013019680045545101.
[I 2025-07-30 21:08:44,366] Trial 161 finished with value: 0.0015800702385604382 and parameters: {'width_NN_heal': 66, 'width_NN_state': 34, 'depth_NN_heal': 8, 'depth_NN_state': 6, 'mode_heal': 64, 'mode_state': 48, 'blocks_heal': 8, 'blocks_state': 5, 'lift_act_state': <function tanh at 0x7ff3611b4cc0>, 'block_act_state': <built-in function gelu>, 'lift_act_heal': <built-in function gelu>, 'block_act_heal': <built-in function gelu>, 'width_heal': 49, 'width_state': 13, 'lr': 0.0025696522891444193, 'padding_heal': 15, 'padding_state': 30, 'optimizer_type': 'adam'}. Best is trial 135 with value: 0.0013019680045545101.
[I 2025-07-30 21:08:50,496] Trial 162 finished with value: 0.0014186116168275476 and parameters: {'width_NN_heal': 56, 'width_NN_state': 30, 'depth_NN_heal': 8, 'depth_NN_state': 6, 'mode_heal': 64, 'mode_state': 48, 'blocks_heal': 8, 'blocks_state': 5, 'lift_act_state': <function tanh at 0x7ff3611b4cc0>, 'block_act_state': <built-in function gelu>, 'lift_act_heal': <built-in function gelu>, 'block_act_heal': <built-in function gelu>, 'width_heal': 56, 'width_state': 13, 'lr': 0.00267519004338136, 'padding_heal': 15, 'padding_state': 29, 'optimizer_type': 'adam'}. Best is trial 135 with value: 0.0013019680045545101.
[I 2025-07-30 21:08:56,607] Trial 163 finished with value: 0.0016918859910219908 and parameters: {'width_NN_heal': 61, 'width_NN_state': 30, 'depth_NN_heal': 8, 'depth_NN_state': 6, 'mode_heal': 64, 'mode_state': 44, 'blocks_heal': 8, 'blocks_state': 5, 'lift_act_state': <function tanh at 0x7ff3611b4cc0>, 'block_act_state': <built-in function gelu>, 'lift_act_heal': <built-in function gelu>, 'block_act_heal': <built-in function gelu>, 'width_heal': 56, 'width_state': 9, 'lr': 0.0017204282185931887, 'padding_heal': 15, 'padding_state': 29, 'optimizer_type': 'adam'}. Best is trial 135 with value: 0.0013019680045545101.
[I 2025-07-30 21:09:02,958] Trial 164 finished with value: 0.001873921719379723 and parameters: {'width_NN_heal': 53, 'width_NN_state': 38, 'depth_NN_heal': 8, 'depth_NN_state': 7, 'mode_heal': 64, 'mode_state': 48, 'blocks_heal': 8, 'blocks_state': 5, 'lift_act_state': <function tanh at 0x7ff3611b4cc0>, 'block_act_state': <built-in function gelu>, 'lift_act_heal': <built-in function gelu>, 'block_act_heal': <built-in function gelu>, 'width_heal': 63, 'width_state': 11, 'lr': 0.0029311054326212776, 'padding_heal': 13, 'padding_state': 31, 'optimizer_type': 'adam'}. Best is trial 135 with value: 0.0013019680045545101.
[I 2025-07-30 21:09:09,182] Trial 165 finished with value: 0.030744336545467377 and parameters: {'width_NN_heal': 54, 'width_NN_state': 18, 'depth_NN_heal': 8, 'depth_NN_state': 6, 'mode_heal': 64, 'mode_state': 48, 'blocks_heal': 8, 'blocks_state': 5, 'lift_act_state': <function tanh at 0x7ff3611b4cc0>, 'block_act_state': <built-in function gelu>, 'lift_act_heal': <built-in function gelu>, 'block_act_heal': <built-in function gelu>, 'width_heal': 76, 'width_state': 21, 'lr': 0.008547730772187368, 'padding_heal': 11, 'padding_state': 30, 'optimizer_type': 'adam'}. Best is trial 135 with value: 0.0013019680045545101.
[I 2025-07-30 21:09:15,294] Trial 166 finished with value: 0.0017952128546312451 and parameters: {'width_NN_heal': 46, 'width_NN_state': 31, 'depth_NN_heal': 8, 'depth_NN_state': 6, 'mode_heal': 36, 'mode_state': 40, 'blocks_heal': 8, 'blocks_state': 5, 'lift_act_state': <function tanh at 0x7ff3611b4cc0>, 'block_act_state': <built-in function gelu>, 'lift_act_heal': <built-in function gelu>, 'block_act_heal': <built-in function gelu>, 'width_heal': 67, 'width_state': 13, 'lr': 0.0020481922585510654, 'padding_heal': 15, 'padding_state': 32, 'optimizer_type': 'adam'}. Best is trial 135 with value: 0.0013019680045545101.
[I 2025-07-30 21:09:20,908] Trial 167 finished with value: 0.0019711912609636784 and parameters: {'width_NN_heal': 37, 'width_NN_state': 24, 'depth_NN_heal': 8, 'depth_NN_state': 6, 'mode_heal': 64, 'mode_state': 16, 'blocks_heal': 7, 'blocks_state': 4, 'lift_act_state': <function tanh at 0x7ff3611b4cc0>, 'block_act_state': <built-in function gelu>, 'lift_act_heal': <built-in function gelu>, 'block_act_heal': <built-in function gelu>, 'width_heal': 59, 'width_state': 19, 'lr': 0.009827198785204057, 'padding_heal': 16, 'padding_state': 30, 'optimizer_type': 'adam'}. Best is trial 135 with value: 0.0013019680045545101.
[I 2025-07-30 21:09:27,113] Trial 168 finished with value: 0.0014783438527956605 and parameters: {'width_NN_heal': 29, 'width_NN_state': 28, 'depth_NN_heal': 8, 'depth_NN_state': 6, 'mode_heal': 48, 'mode_state': 64, 'blocks_heal': 8, 'blocks_state': 5, 'lift_act_state': <function tanh at 0x7ff3611b4cc0>, 'block_act_state': <built-in function gelu>, 'lift_act_heal': <built-in function gelu>, 'block_act_heal': <built-in function gelu>, 'width_heal': 44, 'width_state': 103, 'lr': 0.003179405151709068, 'padding_heal': 7, 'padding_state': 28, 'optimizer_type': 'adam'}. Best is trial 135 with value: 0.0013019680045545101.
[I 2025-07-30 21:09:33,705] Trial 169 finished with value: 0.001490094349719584 and parameters: {'width_NN_heal': 29, 'width_NN_state': 35, 'depth_NN_heal': 8, 'depth_NN_state': 6, 'mode_heal': 44, 'mode_state': 44, 'blocks_heal': 8, 'blocks_state': 6, 'lift_act_state': <function tanh at 0x7ff3611b4cc0>, 'block_act_state': <built-in function gelu>, 'lift_act_heal': <built-in function gelu>, 'block_act_heal': <built-in function gelu>, 'width_heal': 45, 'width_state': 107, 'lr': 0.003102217291208808, 'padding_heal': 10, 'padding_state': 28, 'optimizer_type': 'adam'}. Best is trial 135 with value: 0.0013019680045545101.
[I 2025-07-30 21:09:40,418] Trial 170 finished with value: 0.0192728154361248 and parameters: {'width_NN_heal': 32, 'width_NN_state': 28, 'depth_NN_heal': 8, 'depth_NN_state': 6, 'mode_heal': 48, 'mode_state': 44, 'blocks_heal': 8, 'blocks_state': 6, 'lift_act_state': <function tanh at 0x7ff3611b4cc0>, 'block_act_state': <built-in function gelu>, 'lift_act_heal': <built-in function gelu>, 'block_act_heal': <function tanh at 0x7ff3611b4cc0>, 'width_heal': 45, 'width_state': 108, 'lr': 0.0028383452527458064, 'padding_heal': 9, 'padding_state': 28, 'optimizer_type': 'adam'}. Best is trial 135 with value: 0.0013019680045545101.
[I 2025-07-30 21:09:47,315] Trial 171 finished with value: 0.030743692070245743 and parameters: {'width_NN_heal': 29, 'width_NN_state': 33, 'depth_NN_heal': 8, 'depth_NN_state': 6, 'mode_heal': 44, 'mode_state': 44, 'blocks_heal': 8, 'blocks_state': 7, 'lift_act_state': <function tanh at 0x7ff3611b4cc0>, 'block_act_state': <built-in function gelu>, 'lift_act_heal': <built-in function gelu>, 'block_act_heal': <built-in function gelu>, 'width_heal': 49, 'width_state': 100, 'lr': 0.003256527158490633, 'padding_heal': 8, 'padding_state': 28, 'optimizer_type': 'adam'}. Best is trial 135 with value: 0.0013019680045545101.
[I 2025-07-30 21:09:53,984] Trial 172 finished with value: 0.0015996902948245406 and parameters: {'width_NN_heal': 43, 'width_NN_state': 37, 'depth_NN_heal': 8, 'depth_NN_state': 6, 'mode_heal': 44, 'mode_state': 48, 'blocks_heal': 8, 'blocks_state': 6, 'lift_act_state': <function tanh at 0x7ff3611b4cc0>, 'block_act_state': <built-in function gelu>, 'lift_act_heal': <built-in function gelu>, 'block_act_heal': <built-in function gelu>, 'width_heal': 43, 'width_state': 92, 'lr': 0.0037931941691263685, 'padding_heal': 6, 'padding_state': 27, 'optimizer_type': 'adam'}. Best is trial 135 with value: 0.0013019680045545101.
[I 2025-07-30 21:10:00,263] Trial 173 finished with value: 0.0013026470551267266 and parameters: {'width_NN_heal': 51, 'width_NN_state': 25, 'depth_NN_heal': 8, 'depth_NN_state': 6, 'mode_heal': 40, 'mode_state': 52, 'blocks_heal': 8, 'blocks_state': 5, 'lift_act_state': <function tanh at 0x7ff3611b4cc0>, 'block_act_state': <built-in function gelu>, 'lift_act_heal': <built-in function gelu>, 'block_act_heal': <built-in function gelu>, 'width_heal': 53, 'width_state': 116, 'lr': 0.002717079310516086, 'padding_heal': 6, 'padding_state': 29, 'optimizer_type': 'adam'}. Best is trial 135 with value: 0.0013019680045545101.
[I 2025-07-30 21:10:06,621] Trial 174 finished with value: 0.001268339459784329 and parameters: {'width_NN_heal': 56, 'width_NN_state': 26, 'depth_NN_heal': 8, 'depth_NN_state': 6, 'mode_heal': 40, 'mode_state': 52, 'blocks_heal': 8, 'blocks_state': 5, 'lift_act_state': <function tanh at 0x7ff3611b4cc0>, 'block_act_state': <built-in function gelu>, 'lift_act_heal': <built-in function gelu>, 'block_act_heal': <built-in function gelu>, 'width_heal': 55, 'width_state': 106, 'lr': 0.0023871404742174685, 'padding_heal': 6, 'padding_state': 29, 'optimizer_type': 'adam'}. Best is trial 174 with value: 0.001268339459784329.
[I 2025-07-30 21:10:12,893] Trial 175 finished with value: 0.0016156339552253485 and parameters: {'width_NN_heal': 49, 'width_NN_state': 26, 'depth_NN_heal': 8, 'depth_NN_state': 6, 'mode_heal': 40, 'mode_state': 52, 'blocks_heal': 8, 'blocks_state': 5, 'lift_act_state': <function tanh at 0x7ff3611b4cc0>, 'block_act_state': <built-in function gelu>, 'lift_act_heal': <built-in function gelu>, 'block_act_heal': <built-in function gelu>, 'width_heal': 54, 'width_state': 116, 'lr': 0.0023379152048556805, 'padding_heal': 5, 'padding_state': 27, 'optimizer_type': 'adam'}. Best is trial 174 with value: 0.001268339459784329.
[I 2025-07-30 21:10:19,762] Trial 176 finished with value: 0.030744081363081932 and parameters: {'width_NN_heal': 78, 'width_NN_state': 21, 'depth_NN_heal': 8, 'depth_NN_state': 6, 'mode_heal': 40, 'mode_state': 52, 'blocks_heal': 8, 'blocks_state': 7, 'lift_act_state': <function tanh at 0x7ff3611b4cc0>, 'block_act_state': <built-in function gelu>, 'lift_act_heal': <built-in function gelu>, 'block_act_heal': <built-in function gelu>, 'width_heal': 55, 'width_state': 108, 'lr': 0.002655795884981359, 'padding_heal': 6, 'padding_state': 29, 'optimizer_type': 'adam'}. Best is trial 174 with value: 0.001268339459784329.
[I 2025-07-30 21:10:25,953] Trial 177 finished with value: 0.0016570434672757983 and parameters: {'width_NN_heal': 65, 'width_NN_state': 28, 'depth_NN_heal': 8, 'depth_NN_state': 6, 'mode_heal': 40, 'mode_state': 52, 'blocks_heal': 8, 'blocks_state': 5, 'lift_act_state': <function tanh at 0x7ff3611b4cc0>, 'block_act_state': <built-in function gelu>, 'lift_act_heal': <built-in function gelu>, 'block_act_heal': <built-in function gelu>, 'width_heal': 60, 'width_state': 102, 'lr': 0.0022034718159680763, 'padding_heal': 3, 'padding_state': 26, 'optimizer_type': 'adam'}. Best is trial 174 with value: 0.001268339459784329.
