[I 2025-07-30 21:21:12,859] Trial 283 finished with value: 0.026764163747429848 and parameters: {'width_NN_heal': 42, 'width_NN_state': 127, 'depth_NN_heal': 8, 'depth_NN_state': 6, 'mode_heal': 40, 'mode_state': 52, 'blocks_heal': 8, 'blocks_state': 5, 'lift_act_state': <function tanh at 0x7ff3611b4cc0>, 'block_act_state': <built-in function gelu>, 'lift_act_heal': <built-in function gelu>, 'block_act_heal': <built-in function gelu>, 'width_heal': 41, 'width_state': 16, 'lr': 0.002445219337465012, 'padding_heal': 15, 'padding_state': 15, 'optimizer_type': 'lbfgs'}. Best is trial 174 with value: 0.001268339459784329.
[I 2025-07-30 21:21:18,401] Trial 284 finished with value: 0.002290485892444849 and parameters: {'width_NN_heal': 56, 'width_NN_state': 108, 'depth_NN_heal': 2, 'depth_NN_state': 6, 'mode_heal': 60, 'mode_state': 48, 'blocks_heal': 8, 'blocks_state': 5, 'lift_act_state': None, 'block_act_state': <function tanh at 0x7ff3611b4cc0>, 'lift_act_heal': <built-in function gelu>, 'block_act_heal': None, 'width_heal': 49, 'width_state': 119, 'lr': 0.0027393198588878203, 'padding_heal': 12, 'padding_state': 29, 'optimizer_type': 'adam'}. Best is trial 174 with value: 0.001268339459784329.
[I 2025-07-30 21:21:23,820] Trial 285 finished with value: 0.0016997350612655282 and parameters: {'width_NN_heal': 66, 'width_NN_state': 43, 'depth_NN_heal': 6, 'depth_NN_state': 1, 'mode_heal': 48, 'mode_state': 52, 'blocks_heal': 8, 'blocks_state': 5, 'lift_act_state': <function tanh at 0x7ff3611b4cc0>, 'block_act_state': <built-in function gelu>, 'lift_act_heal': None, 'block_act_heal': <built-in function gelu>, 'width_heal': 64, 'width_state': 11, 'lr': 0.0038810843301655715, 'padding_heal': 9, 'padding_state': 18, 'optimizer_type': 'adam'}. Best is trial 174 with value: 0.001268339459784329.
[I 2025-07-30 21:21:28,930] Trial 286 finished with value: 0.0014463792322203517 and parameters: {'width_NN_heal': 50, 'width_NN_state': 58, 'depth_NN_heal': 8, 'depth_NN_state': 4, 'mode_heal': 60, 'mode_state': 56, 'blocks_heal': 6, 'blocks_state': 4, 'lift_act_state': <function tanh at 0x7ff3611b4cc0>, 'block_act_state': <built-in function gelu>, 'lift_act_heal': <built-in function gelu>, 'block_act_heal': <built-in function gelu>, 'width_heal': 58, 'width_state': 88, 'lr': 0.0032157876865366577, 'padding_heal': 6, 'padding_state': 31, 'optimizer_type': 'adam'}. Best is trial 174 with value: 0.001268339459784329.
[I 2025-07-30 21:21:34,025] Trial 287 finished with value: 0.0014759518671780825 and parameters: {'width_NN_heal': 51, 'width_NN_state': 60, 'depth_NN_heal': 8, 'depth_NN_state': 4, 'mode_heal': 60, 'mode_state': 56, 'blocks_heal': 6, 'blocks_state': 4, 'lift_act_state': <function tanh at 0x7ff3611b4cc0>, 'block_act_state': <built-in function gelu>, 'lift_act_heal': <built-in function gelu>, 'block_act_heal': <built-in function gelu>, 'width_heal': 59, 'width_state': 86, 'lr': 0.003354056889703895, 'padding_heal': 6, 'padding_state': 32, 'optimizer_type': 'adam'}. Best is trial 174 with value: 0.001268339459784329.
[I 2025-07-30 21:21:39,261] Trial 288 finished with value: 0.0015582325868308544 and parameters: {'width_NN_heal': 55, 'width_NN_state': 25, 'depth_NN_heal': 7, 'depth_NN_state': 4, 'mode_heal': 60, 'mode_state': 60, 'blocks_heal': 7, 'blocks_state': 4, 'lift_act_state': <function tanh at 0x7ff3611b4cc0>, 'block_act_state': <built-in function gelu>, 'lift_act_heal': None, 'block_act_heal': <built-in function gelu>, 'width_heal': 55, 'width_state': 89, 'lr': 0.004635539105697471, 'padding_heal': 6, 'padding_state': 31, 'optimizer_type': 'adam'}. Best is trial 174 with value: 0.001268339459784329.
[I 2025-07-30 21:21:44,350] Trial 289 finished with value: 0.0015105559723451734 and parameters: {'width_NN_heal': 10, 'width_NN_state': 32, 'depth_NN_heal': 8, 'depth_NN_state': 4, 'mode_heal': 64, 'mode_state': 56, 'blocks_heal': 6, 'blocks_state': 4, 'lift_act_state': <function tanh at 0x7ff3611b4cc0>, 'block_act_state': <built-in function gelu>, 'lift_act_heal': <built-in function gelu>, 'block_act_heal': <built-in function gelu>, 'width_heal': 58, 'width_state': 95, 'lr': 0.002893860109189147, 'padding_heal': 16, 'padding_state': 30, 'optimizer_type': 'adam'}. Best is trial 174 with value: 0.001268339459784329.
[I 2025-07-30 21:21:49,753] Trial 290 finished with value: 0.008451352827250957 and parameters: {'width_NN_heal': 48, 'width_NN_state': 68, 'depth_NN_heal': 8, 'depth_NN_state': 4, 'mode_heal': 60, 'mode_state': 56, 'blocks_heal': 7, 'blocks_state': 4, 'lift_act_state': <function tanh at 0x7ff3611b4cc0>, 'block_act_state': <built-in function gelu>, 'lift_act_heal': <built-in function gelu>, 'block_act_heal': <built-in function gelu>, 'width_heal': 72, 'width_state': 47, 'lr': 0.0001344046669625906, 'padding_heal': 13, 'padding_state': 31, 'optimizer_type': 'adam'}. Best is trial 174 with value: 0.001268339459784329.
[I 2025-07-30 21:21:55,150] Trial 291 finished with value: 0.001617411500774324 and parameters: {'width_NN_heal': 61, 'width_NN_state': 29, 'depth_NN_heal': 8, 'depth_NN_state': 4, 'mode_heal': 56, 'mode_state': 56, 'blocks_heal': 7, 'blocks_state': 4, 'lift_act_state': <function tanh at 0x7ff3611b4cc0>, 'block_act_state': <built-in function gelu>, 'lift_act_heal': <built-in function gelu>, 'block_act_heal': <built-in function gelu>, 'width_heal': 66, 'width_state': 80, 'lr': 0.0020368947303469075, 'padding_heal': 15, 'padding_state': 30, 'optimizer_type': 'adam'}. Best is trial 174 with value: 0.001268339459784329.
[I 2025-07-30 21:22:00,014] Trial 292 finished with value: 0.001444006571546197 and parameters: {'width_NN_heal': 52, 'width_NN_state': 91, 'depth_NN_heal': 7, 'depth_NN_state': 4, 'mode_heal': 24, 'mode_state': 64, 'blocks_heal': 5, 'blocks_state': 4, 'lift_act_state': <function tanh at 0x7ff3611b4cc0>, 'block_act_state': <built-in function gelu>, 'lift_act_heal': <function tanh at 0x7ff3611b4cc0>, 'block_act_heal': <built-in function gelu>, 'width_heal': 53, 'width_state': 18, 'lr': 0.002515008568897443, 'padding_heal': 19, 'padding_state': 22, 'optimizer_type': 'adam'}. Best is trial 174 with value: 0.001268339459784329.
[I 2025-07-30 21:22:06,599] Trial 293 finished with value: 0.0016476049786433578 and parameters: {'width_NN_heal': 328, 'width_NN_state': 85, 'depth_NN_heal': 7, 'depth_NN_state': 4, 'mode_heal': 24, 'mode_state': 64, 'blocks_heal': 5, 'blocks_state': 4, 'lift_act_state': <function tanh at 0x7ff3611b4cc0>, 'block_act_state': <built-in function gelu>, 'lift_act_heal': <function tanh at 0x7ff3611b4cc0>, 'block_act_heal': <built-in function gelu>, 'width_heal': 51, 'width_state': 13, 'lr': 0.002592825061486256, 'padding_heal': 21, 'padding_state': 20, 'optimizer_type': 'adam'}. Best is trial 174 with value: 0.001268339459784329.
[I 2025-07-30 21:22:11,438] Trial 294 finished with value: 0.0015064795734360814 and parameters: {'width_NN_heal': 57, 'width_NN_state': 92, 'depth_NN_heal': 7, 'depth_NN_state': 4, 'mode_heal': 28, 'mode_state': 64, 'blocks_heal': 5, 'blocks_state': 4, 'lift_act_state': <function tanh at 0x7ff3611b4cc0>, 'block_act_state': <built-in function gelu>, 'lift_act_heal': <function tanh at 0x7ff3611b4cc0>, 'block_act_heal': <built-in function gelu>, 'width_heal': 47, 'width_state': 17, 'lr': 0.0035770318334405874, 'padding_heal': 19, 'padding_state': 20, 'optimizer_type': 'adam'}. Best is trial 174 with value: 0.001268339459784329.
[I 2025-07-30 21:22:16,507] Trial 295 finished with value: 0.0012392300413921475 and parameters: {'width_NN_heal': 51, 'width_NN_state': 80, 'depth_NN_heal': 7, 'depth_NN_state': 4, 'mode_heal': 60, 'mode_state': 64, 'blocks_heal': 6, 'blocks_state': 4, 'lift_act_state': <function tanh at 0x7ff3611b4cc0>, 'block_act_state': <built-in function gelu>, 'lift_act_heal': <function tanh at 0x7ff3611b4cc0>, 'block_act_heal': <function tanh at 0x7ff3611b4cc0>, 'width_heal': 52, 'width_state': 15, 'lr': 0.0030707627675703145, 'padding_heal': 18, 'padding_state': 22, 'optimizer_type': 'adam'}. Best is trial 295 with value: 0.0012392300413921475.
[I 2025-07-30 21:22:21,619] Trial 296 finished with value: 0.0014038156950846314 and parameters: {'width_NN_heal': 53, 'width_NN_state': 80, 'depth_NN_heal': 7, 'depth_NN_state': 4, 'mode_heal': 60, 'mode_state': 64, 'blocks_heal': 6, 'blocks_state': 4, 'lift_act_state': <function tanh at 0x7ff3611b4cc0>, 'block_act_state': <built-in function gelu>, 'lift_act_heal': <function tanh at 0x7ff3611b4cc0>, 'block_act_heal': <function tanh at 0x7ff3611b4cc0>, 'width_heal': 53, 'width_state': 14, 'lr': 0.004181427642546443, 'padding_heal': 19, 'padding_state': 22, 'optimizer_type': 'adam'}. Best is trial 295 with value: 0.0012392300413921475.
[I 2025-07-30 21:22:26,726] Trial 297 finished with value: 0.001581189688295126 and parameters: {'width_NN_heal': 74, 'width_NN_state': 77, 'depth_NN_heal': 7, 'depth_NN_state': 4, 'mode_heal': 60, 'mode_state': 64, 'blocks_heal': 6, 'blocks_state': 4, 'lift_act_state': <function tanh at 0x7ff3611b4cc0>, 'block_act_state': <built-in function gelu>, 'lift_act_heal': <function tanh at 0x7ff3611b4cc0>, 'block_act_heal': <function tanh at 0x7ff3611b4cc0>, 'width_heal': 53, 'width_state': 15, 'lr': 0.004236443166348513, 'padding_heal': 19, 'padding_state': 22, 'optimizer_type': 'adam'}. Best is trial 295 with value: 0.0012392300413921475.
[I 2025-07-30 21:22:31,815] Trial 298 finished with value: 0.0012671885779127479 and parameters: {'width_NN_heal': 51, 'width_NN_state': 92, 'depth_NN_heal': 7, 'depth_NN_state': 4, 'mode_heal': 60, 'mode_state': 64, 'blocks_heal': 6, 'blocks_state': 4, 'lift_act_state': <function tanh at 0x7ff3611b4cc0>, 'block_act_state': <built-in function gelu>, 'lift_act_heal': <function tanh at 0x7ff3611b4cc0>, 'block_act_heal': <function tanh at 0x7ff3611b4cc0>, 'width_heal': 55, 'width_state': 14, 'lr': 0.004934706204802351, 'padding_heal': 18, 'padding_state': 22, 'optimizer_type': 'adam'}. Best is trial 295 with value: 0.0012392300413921475.
[I 2025-07-30 21:22:36,903] Trial 299 finished with value: 0.0015512281097471714 and parameters: {'width_NN_heal': 54, 'width_NN_state': 97, 'depth_NN_heal': 7, 'depth_NN_state': 4, 'mode_heal': 60, 'mode_state': 64, 'blocks_heal': 6, 'blocks_state': 4, 'lift_act_state': <function tanh at 0x7ff3611b4cc0>, 'block_act_state': <built-in function gelu>, 'lift_act_heal': <function tanh at 0x7ff3611b4cc0>, 'block_act_heal': <function tanh at 0x7ff3611b4cc0>, 'width_heal': 51, 'width_state': 15, 'lr': 0.005892686334640656, 'padding_heal': 18, 'padding_state': 22, 'optimizer_type': 'adam'}. Best is trial 295 with value: 0.0012392300413921475.
[I 2025-07-30 21:22:41,966] Trial 300 finished with value: 0.01715169847011566 and parameters: {'width_NN_heal': 63, 'width_NN_state': 90, 'depth_NN_heal': 7, 'depth_NN_state': 4, 'mode_heal': 60, 'mode_state': 64, 'blocks_heal': 6, 'blocks_state': 4, 'lift_act_state': <built-in function gelu>, 'block_act_state': <built-in function gelu>, 'lift_act_heal': <function tanh at 0x7ff3611b4cc0>, 'block_act_heal': <function tanh at 0x7ff3611b4cc0>, 'width_heal': 54, 'width_state': 14, 'lr': 0.005040878971958882, 'padding_heal': 18, 'padding_state': 23, 'optimizer_type': 'adam'}. Best is trial 295 with value: 0.0012392300413921475.
[I 2025-07-30 21:22:47,047] Trial 301 finished with value: 0.002755085937678814 and parameters: {'width_NN_heal': 53, 'width_NN_state': 83, 'depth_NN_heal': 7, 'depth_NN_state': 4, 'mode_heal': 60, 'mode_state': 64, 'blocks_heal': 6, 'blocks_state': 4, 'lift_act_state': <function tanh at 0x7ff3611b4cc0>, 'block_act_state': None, 'lift_act_heal': <function tanh at 0x7ff3611b4cc0>, 'block_act_heal': <function tanh at 0x7ff3611b4cc0>, 'width_heal': 49, 'width_state': 14, 'lr': 0.004900301413229465, 'padding_heal': 19, 'padding_state': 22, 'optimizer_type': 'adam'}. Best is trial 295 with value: 0.0012392300413921475.
[I 2025-07-30 21:22:52,052] Trial 302 finished with value: 0.0017196594271808863 and parameters: {'width_NN_heal': 58, 'width_NN_state': 77, 'depth_NN_heal': 7, 'depth_NN_state': 4, 'mode_heal': 56, 'mode_state': 64, 'blocks_heal': 6, 'blocks_state': 4, 'lift_act_state': <function tanh at 0x7ff3611b4cc0>, 'block_act_state': <built-in function gelu>, 'lift_act_heal': <function tanh at 0x7ff3611b4cc0>, 'block_act_heal': <function tanh at 0x7ff3611b4cc0>, 'width_heal': 56, 'width_state': 13, 'lr': 0.004501636657521588, 'padding_heal': 19, 'padding_state': 21, 'optimizer_type': 'adam'}. Best is trial 295 with value: 0.0012392300413921475.
[I 2025-07-30 21:22:57,065] Trial 303 finished with value: 0.0014303353382274508 and parameters: {'width_NN_heal': 51, 'width_NN_state': 102, 'depth_NN_heal': 7, 'depth_NN_state': 4, 'mode_heal': 32, 'mode_state': 64, 'blocks_heal': 6, 'blocks_state': 4, 'lift_act_state': <function tanh at 0x7ff3611b4cc0>, 'block_act_state': <built-in function gelu>, 'lift_act_heal': <function tanh at 0x7ff3611b4cc0>, 'block_act_heal': <function tanh at 0x7ff3611b4cc0>, 'width_heal': 46, 'width_state': 52, 'lr': 0.0056011086585695345, 'padding_heal': 17, 'padding_state': 24, 'optimizer_type': 'adam'}. Best is trial 295 with value: 0.0012392300413921475.
[I 2025-07-30 21:23:02,121] Trial 304 finished with value: 0.001376437139697373 and parameters: {'width_NN_heal': 69, 'width_NN_state': 105, 'depth_NN_heal': 7, 'depth_NN_state': 4, 'mode_heal': 28, 'mode_state': 64, 'blocks_heal': 6, 'blocks_state': 4, 'lift_act_state': <function tanh at 0x7ff3611b4cc0>, 'block_act_state': <built-in function gelu>, 'lift_act_heal': <function tanh at 0x7ff3611b4cc0>, 'block_act_heal': <function tanh at 0x7ff3611b4cc0>, 'width_heal': 45, 'width_state': 54, 'lr': 0.005436403849137968, 'padding_heal': 17, 'padding_state': 23, 'optimizer_type': 'lbfgs'}. Best is trial 295 with value: 0.0012392300413921475.
[I 2025-07-30 21:23:07,149] Trial 305 finished with value: 0.0016162035753950477 and parameters: {'width_NN_heal': 68, 'width_NN_state': 117, 'depth_NN_heal': 7, 'depth_NN_state': 4, 'mode_heal': 24, 'mode_state': 64, 'blocks_heal': 6, 'blocks_state': 4, 'lift_act_state': <function tanh at 0x7ff3611b4cc0>, 'block_act_state': <built-in function gelu>, 'lift_act_heal': <function tanh at 0x7ff3611b4cc0>, 'block_act_heal': <function tanh at 0x7ff3611b4cc0>, 'width_heal': 45, 'width_state': 50, 'lr': 0.005603295299768423, 'padding_heal': 17, 'padding_state': 23, 'optimizer_type': 'lbfgs'}. Best is trial 295 with value: 0.0012392300413921475.
[I 2025-07-30 21:23:12,160] Trial 306 finished with value: 0.0021402169950306416 and parameters: {'width_NN_heal': 62, 'width_NN_state': 105, 'depth_NN_heal': 7, 'depth_NN_state': 4, 'mode_heal': 28, 'mode_state': 64, 'blocks_heal': 6, 'blocks_state': 4, 'lift_act_state': <function tanh at 0x7ff3611b4cc0>, 'block_act_state': <built-in function gelu>, 'lift_act_heal': <function tanh at 0x7ff3611b4cc0>, 'block_act_heal': <function tanh at 0x7ff3611b4cc0>, 'width_heal': 47, 'width_state': 52, 'lr': 0.006292045037011871, 'padding_heal': 17, 'padding_state': 24, 'optimizer_type': 'lbfgs'}. Best is trial 295 with value: 0.0012392300413921475.
[I 2025-07-30 21:23:17,150] Trial 307 finished with value: 0.002251103986054659 and parameters: {'width_NN_heal': 81, 'width_NN_state': 97, 'depth_NN_heal': 7, 'depth_NN_state': 4, 'mode_heal': 32, 'mode_state': 64, 'blocks_heal': 6, 'blocks_state': 4, 'lift_act_state': None, 'block_act_state': <built-in function gelu>, 'lift_act_heal': <function tanh at 0x7ff3611b4cc0>, 'block_act_heal': <function tanh at 0x7ff3611b4cc0>, 'width_heal': 53, 'width_state': 58, 'lr': 0.005712546426570296, 'padding_heal': 18, 'padding_state': 22, 'optimizer_type': 'lbfgs'}. Best is trial 295 with value: 0.0012392300413921475.
[I 2025-07-30 21:23:22,192] Trial 308 finished with value: 0.0018893522210419178 and parameters: {'width_NN_heal': 72, 'width_NN_state': 92, 'depth_NN_heal': 7, 'depth_NN_state': 4, 'mode_heal': 32, 'mode_state': 64, 'blocks_heal': 6, 'blocks_state': 4, 'lift_act_state': <function tanh at 0x7ff3611b4cc0>, 'block_act_state': <built-in function gelu>, 'lift_act_heal': <function tanh at 0x7ff3611b4cc0>, 'block_act_heal': <function tanh at 0x7ff3611b4cc0>, 'width_heal': 50, 'width_state': 7, 'lr': 0.0055665451277777545, 'padding_heal': 17, 'padding_state': 23, 'optimizer_type': 'lbfgs'}. Best is trial 295 with value: 0.0012392300413921475.
[I 2025-07-30 21:23:27,197] Trial 309 finished with value: 0.0035870575811713934 and parameters: {'width_NN_heal': 52, 'width_NN_state': 98, 'depth_NN_heal': 7, 'depth_NN_state': 4, 'mode_heal': 28, 'mode_state': 64, 'blocks_heal': 6, 'blocks_state': 4, 'lift_act_state': <function tanh at 0x7ff3611b4cc0>, 'block_act_state': <function tanh at 0x7ff3611b4cc0>, 'lift_act_heal': <function tanh at 0x7ff3611b4cc0>, 'block_act_heal': <function tanh at 0x7ff3611b4cc0>, 'width_heal': 22, 'width_state': 58, 'lr': 0.006698705669155363, 'padding_heal': 18, 'padding_state': 24, 'optimizer_type': 'adam'}. Best is trial 295 with value: 0.0012392300413921475.
[I 2025-07-30 21:23:32,247] Trial 310 finished with value: 0.011114990338683128 and parameters: {'width_NN_heal': 57, 'width_NN_state': 106, 'depth_NN_heal': 7, 'depth_NN_state': 4, 'mode_heal': 32, 'mode_state': 64, 'blocks_heal': 6, 'blocks_state': 4, 'lift_act_state': <function tanh at 0x7ff3611b4cc0>, 'block_act_state': <built-in function gelu>, 'lift_act_heal': <function tanh at 0x7ff3611b4cc0>, 'block_act_heal': <function tanh at 0x7ff3611b4cc0>, 'width_heal': 47, 'width_state': 53, 'lr': 0.004709172476953661, 'padding_heal': 17, 'padding_state': 22, 'optimizer_type': 'lbfgs'}. Best is trial 295 with value: 0.0012392300413921475.
[I 2025-07-30 21:23:37,198] Trial 311 finished with value: 0.002067334484308958 and parameters: {'width_NN_heal': 64, 'width_NN_state': 115, 'depth_NN_heal': 7, 'depth_NN_state': 4, 'mode_heal': 60, 'mode_state': 64, 'blocks_heal': 6, 'blocks_state': 4, 'lift_act_state': <function tanh at 0x7ff3611b4cc0>, 'block_act_state': <built-in function gelu>, 'lift_act_heal': <function tanh at 0x7ff3611b4cc0>, 'block_act_heal': <function tanh at 0x7ff3611b4cc0>, 'width_heal': 56, 'width_state': 65, 'lr': 0.005295189843232923, 'padding_heal': 17, 'padding_state': 24, 'optimizer_type': 'lbfgs'}. Best is trial 295 with value: 0.0012392300413921475.
[I 2025-07-30 21:23:42,166] Trial 312 finished with value: 0.0018532603280618787 and parameters: {'width_NN_heal': 52, 'width_NN_state': 89, 'depth_NN_heal': 6, 'depth_NN_state': 4, 'mode_heal': 24, 'mode_state': 64, 'blocks_heal': 6, 'blocks_state': 4, 'lift_act_state': <function tanh at 0x7ff3611b4cc0>, 'block_act_state': <built-in function gelu>, 'lift_act_heal': <function tanh at 0x7ff3611b4cc0>, 'block_act_heal': <function tanh at 0x7ff3611b4cc0>, 'width_heal': 44, 'width_state': 16, 'lr': 0.007129540293865408, 'padding_heal': 20, 'padding_state': 22, 'optimizer_type': 'lbfgs'}. Best is trial 295 with value: 0.0012392300413921475.
[I 2025-07-30 21:23:47,236] Trial 313 finished with value: 0.001927110948599875 and parameters: {'width_NN_heal': 49, 'width_NN_state': 82, 'depth_NN_heal': 7, 'depth_NN_state': 4, 'mode_heal': 20, 'mode_state': 64, 'blocks_heal': 6, 'blocks_state': 4, 'lift_act_state': <function tanh at 0x7ff3611b4cc0>, 'block_act_state': <built-in function gelu>, 'lift_act_heal': <function tanh at 0x7ff3611b4cc0>, 'block_act_heal': <function tanh at 0x7ff3611b4cc0>, 'width_heal': 61, 'width_state': 15, 'lr': 0.0048447867057133, 'padding_heal': 18, 'padding_state': 23, 'optimizer_type': 'adam'}. Best is trial 295 with value: 0.0012392300413921475.
[I 2025-07-30 21:23:51,962] Trial 314 finished with value: 0.0016138715436682105 and parameters: {'width_NN_heal': 60, 'width_NN_state': 108, 'depth_NN_heal': 7, 'depth_NN_state': 4, 'mode_heal': 64, 'mode_state': 60, 'blocks_heal': 5, 'blocks_state': 4, 'lift_act_state': <function tanh at 0x7ff3611b4cc0>, 'block_act_state': <built-in function gelu>, 'lift_act_heal': <function tanh at 0x7ff3611b4cc0>, 'block_act_heal': <function tanh at 0x7ff3611b4cc0>, 'width_heal': 50, 'width_state': 61, 'lr': 0.005399981519468689, 'padding_heal': 18, 'padding_state': 24, 'optimizer_type': 'adam'}. Best is trial 295 with value: 0.0012392300413921475.
[I 2025-07-30 21:23:57,014] Trial 315 finished with value: 0.0018804038409143686 and parameters: {'width_NN_heal': 55, 'width_NN_state': 144, 'depth_NN_heal': 7, 'depth_NN_state': 4, 'mode_heal': 28, 'mode_state': 64, 'blocks_heal': 6, 'blocks_state': 4, 'lift_act_state': <function tanh at 0x7ff3611b4cc0>, 'block_act_state': <built-in function gelu>, 'lift_act_heal': <function tanh at 0x7ff3611b4cc0>, 'block_act_heal': <function tanh at 0x7ff3611b4cc0>, 'width_heal': 53, 'width_state': 44, 'lr': 0.005228438441325733, 'padding_heal': 17, 'padding_state': 23, 'optimizer_type': 'adam'}. Best is trial 295 with value: 0.0012392300413921475.
[I 2025-07-30 21:24:02,109] Trial 316 finished with value: 0.0015978161245584488 and parameters: {'width_NN_heal': 70, 'width_NN_state': 76, 'depth_NN_heal': 7, 'depth_NN_state': 4, 'mode_heal': 24, 'mode_state': 60, 'blocks_heal': 6, 'blocks_state': 4, 'lift_act_state': <function tanh at 0x7ff3611b4cc0>, 'block_act_state': <built-in function gelu>, 'lift_act_heal': <function tanh at 0x7ff3611b4cc0>, 'block_act_heal': <function tanh at 0x7ff3611b4cc0>, 'width_heal': 62, 'width_state': 16, 'lr': 0.004494909004460743, 'padding_heal': 19, 'padding_state': 21, 'optimizer_type': 'adam'}. Best is trial 295 with value: 0.0012392300413921475.
