[I 2025-07-30 21:52:30,015] Trial 657 finished with value: 0.0011050106259062886 and parameters: {'width_NN_heal': 112, 'width_NN_state': 233, 'depth_NN_heal': 4, 'depth_NN_state': 4, 'mode_heal': 56, 'mode_state': 64, 'blocks_heal': 7, 'blocks_state': 3, 'lift_act_state': <built-in function gelu>, 'block_act_state': <built-in function gelu>, 'lift_act_heal': <function tanh at 0x7ff3611b4cc0>, 'block_act_heal': <function tanh at 0x7ff3611b4cc0>, 'width_heal': 30, 'width_state': 43, 'lr': 0.0018666490693720341, 'padding_heal': 7, 'padding_state': 21, 'optimizer_type': 'lbfgs'}. Best is trial 484 with value: 0.0010389797389507294.
[I 2025-07-30 21:52:34,510] Trial 658 finished with value: 0.0016709377523511648 and parameters: {'width_NN_heal': 112, 'width_NN_state': 271, 'depth_NN_heal': 3, 'depth_NN_state': 4, 'mode_heal': 56, 'mode_state': 64, 'blocks_heal': 7, 'blocks_state': 2, 'lift_act_state': <built-in function gelu>, 'block_act_state': <built-in function gelu>, 'lift_act_heal': <function tanh at 0x7ff3611b4cc0>, 'block_act_heal': <function tanh at 0x7ff3611b4cc0>, 'width_heal': 34, 'width_state': 44, 'lr': 0.001731246938592476, 'padding_heal': 7, 'padding_state': 22, 'optimizer_type': 'lbfgs'}. Best is trial 484 with value: 0.0010389797389507294.
[I 2025-07-30 21:52:39,350] Trial 659 finished with value: 0.0012928865617141128 and parameters: {'width_NN_heal': 133, 'width_NN_state': 228, 'depth_NN_heal': 4, 'depth_NN_state': 4, 'mode_heal': 56, 'mode_state': 64, 'blocks_heal': 7, 'blocks_state': 3, 'lift_act_state': <built-in function gelu>, 'block_act_state': <built-in function gelu>, 'lift_act_heal': <function tanh at 0x7ff3611b4cc0>, 'block_act_heal': <function tanh at 0x7ff3611b4cc0>, 'width_heal': 30, 'width_state': 46, 'lr': 0.0015076613483314765, 'padding_heal': 6, 'padding_state': 21, 'optimizer_type': 'lbfgs'}. Best is trial 484 with value: 0.0010389797389507294.
[I 2025-07-30 21:52:43,915] Trial 660 finished with value: 0.0013875175500288606 and parameters: {'width_NN_heal': 108, 'width_NN_state': 256, 'depth_NN_heal': 4, 'depth_NN_state': 4, 'mode_heal': 56, 'mode_state': 64, 'blocks_heal': 7, 'blocks_state': 2, 'lift_act_state': <built-in function gelu>, 'block_act_state': <built-in function gelu>, 'lift_act_heal': <function tanh at 0x7ff3611b4cc0>, 'block_act_heal': <function tanh at 0x7ff3611b4cc0>, 'width_heal': 32, 'width_state': 43, 'lr': 0.0018895177777996364, 'padding_heal': 7, 'padding_state': 20, 'optimizer_type': 'lbfgs'}. Best is trial 484 with value: 0.0010389797389507294.
[I 2025-07-30 21:52:48,609] Trial 661 finished with value: 0.0010987394489347935 and parameters: {'width_NN_heal': 133, 'width_NN_state': 326, 'depth_NN_heal': 4, 'depth_NN_state': 4, 'mode_heal': 56, 'mode_state': 64, 'blocks_heal': 7, 'blocks_state': 2, 'lift_act_state': <built-in function gelu>, 'block_act_state': <built-in function gelu>, 'lift_act_heal': <function tanh at 0x7ff3611b4cc0>, 'block_act_heal': <function tanh at 0x7ff3611b4cc0>, 'width_heal': 30, 'width_state': 48, 'lr': 0.0017927034982785288, 'padding_heal': 6, 'padding_state': 21, 'optimizer_type': 'lbfgs'}. Best is trial 484 with value: 0.0010389797389507294.
[I 2025-07-30 21:52:54,326] Trial 662 finished with value: 0.00130103447008878 and parameters: {'width_NN_heal': 146, 'width_NN_state': 396, 'depth_NN_heal': 4, 'depth_NN_state': 4, 'mode_heal': 52, 'mode_state': 64, 'blocks_heal': 7, 'blocks_state': 2, 'lift_act_state': <built-in function gelu>, 'block_act_state': <built-in function gelu>, 'lift_act_heal': <function tanh at 0x7ff3611b4cc0>, 'block_act_heal': <function tanh at 0x7ff3611b4cc0>, 'width_heal': 30, 'width_state': 46, 'lr': 0.0013728024317934393, 'padding_heal': 7, 'padding_state': 20, 'optimizer_type': 'lbfgs'}. Best is trial 484 with value: 0.0010389797389507294.
[I 2025-07-30 21:52:59,313] Trial 663 finished with value: 0.0017736987210810184 and parameters: {'width_NN_heal': 132, 'width_NN_state': 330, 'depth_NN_heal': 4, 'depth_NN_state': 4, 'mode_heal': 56, 'mode_state': 64, 'blocks_heal': 7, 'blocks_state': 2, 'lift_act_state': <built-in function gelu>, 'block_act_state': <built-in function gelu>, 'lift_act_heal': <function tanh at 0x7ff3611b4cc0>, 'block_act_heal': <function tanh at 0x7ff3611b4cc0>, 'width_heal': 34, 'width_state': 41, 'lr': 0.001737975794511907, 'padding_heal': 7, 'padding_state': 21, 'optimizer_type': 'lbfgs'}. Best is trial 484 with value: 0.0010389797389507294.
[I 2025-07-30 21:53:04,267] Trial 664 finished with value: 0.0011892877519130707 and parameters: {'width_NN_heal': 144, 'width_NN_state': 368, 'depth_NN_heal': 4, 'depth_NN_state': 4, 'mode_heal': 56, 'mode_state': 64, 'blocks_heal': 7, 'blocks_state': 2, 'lift_act_state': <built-in function gelu>, 'block_act_state': <built-in function gelu>, 'lift_act_heal': <function tanh at 0x7ff3611b4cc0>, 'block_act_heal': None, 'width_heal': 28, 'width_state': 46, 'lr': 0.001660595563930092, 'padding_heal': 6, 'padding_state': 20, 'optimizer_type': 'lbfgs'}. Best is trial 484 with value: 0.0010389797389507294.
[I 2025-07-30 21:53:08,900] Trial 665 finished with value: 0.0013605605345219374 and parameters: {'width_NN_heal': 154, 'width_NN_state': 274, 'depth_NN_heal': 4, 'depth_NN_state': 4, 'mode_heal': 56, 'mode_state': 64, 'blocks_heal': 7, 'blocks_state': 2, 'lift_act_state': <built-in function gelu>, 'block_act_state': <built-in function gelu>, 'lift_act_heal': <function tanh at 0x7ff3611b4cc0>, 'block_act_heal': <function tanh at 0x7ff3611b4cc0>, 'width_heal': 32, 'width_state': 39, 'lr': 0.001466712153036866, 'padding_heal': 6, 'padding_state': 22, 'optimizer_type': 'lbfgs'}. Best is trial 484 with value: 0.0010389797389507294.
[I 2025-07-30 21:53:13,484] Trial 666 finished with value: 0.0012359019601717591 and parameters: {'width_NN_heal': 130, 'width_NN_state': 223, 'depth_NN_heal': 4, 'depth_NN_state': 4, 'mode_heal': 56, 'mode_state': 64, 'blocks_heal': 7, 'blocks_state': 2, 'lift_act_state': <built-in function gelu>, 'block_act_state': <built-in function gelu>, 'lift_act_heal': <function tanh at 0x7ff3611b4cc0>, 'block_act_heal': <function tanh at 0x7ff3611b4cc0>, 'width_heal': 27, 'width_state': 42, 'lr': 0.001832118345639507, 'padding_heal': 6, 'padding_state': 19, 'optimizer_type': 'lbfgs'}. Best is trial 484 with value: 0.0010389797389507294.
[I 2025-07-30 21:53:18,105] Trial 667 finished with value: 0.0012421059655025601 and parameters: {'width_NN_heal': 169, 'width_NN_state': 261, 'depth_NN_heal': 4, 'depth_NN_state': 4, 'mode_heal': 56, 'mode_state': 64, 'blocks_heal': 7, 'blocks_state': 2, 'lift_act_state': <built-in function gelu>, 'block_act_state': <built-in function gelu>, 'lift_act_heal': <function tanh at 0x7ff3611b4cc0>, 'block_act_heal': <function tanh at 0x7ff3611b4cc0>, 'width_heal': 30, 'width_state': 49, 'lr': 0.001732105913040699, 'padding_heal': 7, 'padding_state': 21, 'optimizer_type': 'lbfgs'}. Best is trial 484 with value: 0.0010389797389507294.
[I 2025-07-30 21:53:22,882] Trial 668 finished with value: 0.0010739872232079506 and parameters: {'width_NN_heal': 137, 'width_NN_state': 336, 'depth_NN_heal': 4, 'depth_NN_state': 4, 'mode_heal': 56, 'mode_state': 64, 'blocks_heal': 7, 'blocks_state': 2, 'lift_act_state': <built-in function gelu>, 'block_act_state': <built-in function gelu>, 'lift_act_heal': <function tanh at 0x7ff3611b4cc0>, 'block_act_heal': <function tanh at 0x7ff3611b4cc0>, 'width_heal': 27, 'width_state': 50, 'lr': 0.001916496404773865, 'padding_heal': 6, 'padding_state': 20, 'optimizer_type': 'lbfgs'}. Best is trial 484 with value: 0.0010389797389507294.
[I 2025-07-30 21:53:27,351] Trial 669 finished with value: 0.0012465673498809338 and parameters: {'width_NN_heal': 137, 'width_NN_state': 341, 'depth_NN_heal': 4, 'depth_NN_state': 3, 'mode_heal': 52, 'mode_state': 64, 'blocks_heal': 7, 'blocks_state': 2, 'lift_act_state': <built-in function gelu>, 'block_act_state': <built-in function gelu>, 'lift_act_heal': <function tanh at 0x7ff3611b4cc0>, 'block_act_heal': <function tanh at 0x7ff3611b4cc0>, 'width_heal': 28, 'width_state': 50, 'lr': 0.0018182432472086314, 'padding_heal': 7, 'padding_state': 22, 'optimizer_type': 'lbfgs'}. Best is trial 484 with value: 0.0010389797389507294.
[I 2025-07-30 21:53:32,197] Trial 670 finished with value: 0.0016784939216449857 and parameters: {'width_NN_heal': 128, 'width_NN_state': 334, 'depth_NN_heal': 4, 'depth_NN_state': 4, 'mode_heal': 56, 'mode_state': 64, 'blocks_heal': 7, 'blocks_state': 2, 'lift_act_state': <built-in function gelu>, 'block_act_state': <function tanh at 0x7ff3611b4cc0>, 'lift_act_heal': <function tanh at 0x7ff3611b4cc0>, 'block_act_heal': <function tanh at 0x7ff3611b4cc0>, 'width_heal': 27, 'width_state': 46, 'lr': 0.001885688208286882, 'padding_heal': 7, 'padding_state': 22, 'optimizer_type': 'lbfgs'}. Best is trial 484 with value: 0.0010389797389507294.
[I 2025-07-30 21:53:37,806] Trial 671 finished with value: 0.0018466495675966144 and parameters: {'width_NN_heal': 145, 'width_NN_state': 392, 'depth_NN_heal': 4, 'depth_NN_state': 4, 'mode_heal': 56, 'mode_state': 64, 'blocks_heal': 7, 'blocks_state': 2, 'lift_act_state': <built-in function gelu>, 'block_act_state': <built-in function gelu>, 'lift_act_heal': <function tanh at 0x7ff3611b4cc0>, 'block_act_heal': <function tanh at 0x7ff3611b4cc0>, 'width_heal': 30, 'width_state': 51, 'lr': 0.0015819405244693848, 'padding_heal': 7, 'padding_state': 21, 'optimizer_type': 'lbfgs'}. Best is trial 484 with value: 0.0010389797389507294.
[I 2025-07-30 21:53:42,716] Trial 672 finished with value: 0.0028635889757424593 and parameters: {'width_NN_heal': 154, 'width_NN_state': 369, 'depth_NN_heal': 4, 'depth_NN_state': 4, 'mode_heal': 56, 'mode_state': 64, 'blocks_heal': 7, 'blocks_state': 2, 'lift_act_state': None, 'block_act_state': <built-in function gelu>, 'lift_act_heal': <function tanh at 0x7ff3611b4cc0>, 'block_act_heal': <function tanh at 0x7ff3611b4cc0>, 'width_heal': 35, 'width_state': 54, 'lr': 0.0019318042977918169, 'padding_heal': 7, 'padding_state': 20, 'optimizer_type': 'lbfgs'}. Best is trial 484 with value: 0.0010389797389507294.
[I 2025-07-30 21:53:47,236] Trial 673 finished with value: 0.0013573461910709739 and parameters: {'width_NN_heal': 131, 'width_NN_state': 312, 'depth_NN_heal': 4, 'depth_NN_state': 4, 'mode_heal': 52, 'mode_state': 64, 'blocks_heal': 7, 'blocks_state': 2, 'lift_act_state': <built-in function gelu>, 'block_act_state': <built-in function gelu>, 'lift_act_heal': <function tanh at 0x7ff3611b4cc0>, 'block_act_heal': <function tanh at 0x7ff3611b4cc0>, 'width_heal': 26, 'width_state': 39, 'lr': 0.0015090876565573717, 'padding_heal': 6, 'padding_state': 21, 'optimizer_type': 'lbfgs'}. Best is trial 484 with value: 0.0010389797389507294.
[I 2025-07-30 21:53:52,178] Trial 674 finished with value: 0.0023348808754235506 and parameters: {'width_NN_heal': 140, 'width_NN_state': 326, 'depth_NN_heal': 4, 'depth_NN_state': 4, 'mode_heal': 56, 'mode_state': 64, 'blocks_heal': 7, 'blocks_state': 2, 'lift_act_state': <built-in function gelu>, 'block_act_state': None, 'lift_act_heal': <function tanh at 0x7ff3611b4cc0>, 'block_act_heal': <function tanh at 0x7ff3611b4cc0>, 'width_heal': 32, 'width_state': 50, 'lr': 0.0012830235371016003, 'padding_heal': 7, 'padding_state': 22, 'optimizer_type': 'lbfgs'}. Best is trial 484 with value: 0.0010389797389507294.
[I 2025-07-30 21:53:55,737] Trial 675 finished with value: 0.001203411491587758 and parameters: {'width_NN_heal': 127, 'width_NN_state': 354, 'depth_NN_heal': 4, 'depth_NN_state': 4, 'mode_heal': 56, 'mode_state': 64, 'blocks_heal': 1, 'blocks_state': 2, 'lift_act_state': <built-in function gelu>, 'block_act_state': <built-in function gelu>, 'lift_act_heal': <function tanh at 0x7ff3611b4cc0>, 'block_act_heal': <function tanh at 0x7ff3611b4cc0>, 'width_heal': 29, 'width_state': 48, 'lr': 0.0016279298184465932, 'padding_heal': 6, 'padding_state': 21, 'optimizer_type': 'lbfgs'}. Best is trial 484 with value: 0.0010389797389507294.
[I 2025-07-30 21:54:00,880] Trial 676 finished with value: 0.0016141090309247375 and parameters: {'width_NN_heal': 115, 'width_NN_state': 406, 'depth_NN_heal': 4, 'depth_NN_state': 4, 'mode_heal': 56, 'mode_state': 64, 'blocks_heal': 7, 'blocks_state': 1, 'lift_act_state': <built-in function gelu>, 'block_act_state': <built-in function gelu>, 'lift_act_heal': <function tanh at 0x7ff3611b4cc0>, 'block_act_heal': <function tanh at 0x7ff3611b4cc0>, 'width_heal': 24, 'width_state': 44, 'lr': 0.0019240863860821218, 'padding_heal': 6, 'padding_state': 20, 'optimizer_type': 'lbfgs'}. Best is trial 484 with value: 0.0010389797389507294.
[I 2025-07-30 21:54:05,425] Trial 677 finished with value: 0.001325960736721754 and parameters: {'width_NN_heal': 157, 'width_NN_state': 244, 'depth_NN_heal': 4, 'depth_NN_state': 4, 'mode_heal': 56, 'mode_state': 36, 'blocks_heal': 7, 'blocks_state': 2, 'lift_act_state': <built-in function gelu>, 'block_act_state': <built-in function gelu>, 'lift_act_heal': <function tanh at 0x7ff3611b4cc0>, 'block_act_heal': <function tanh at 0x7ff3611b4cc0>, 'width_heal': 26, 'width_state': 56, 'lr': 0.0017734016504694216, 'padding_heal': 5, 'padding_state': 20, 'optimizer_type': 'lbfgs'}. Best is trial 484 with value: 0.0010389797389507294.
[I 2025-07-30 21:54:09,906] Trial 678 finished with value: 0.0012513486435636878 and parameters: {'width_NN_heal': 110, 'width_NN_state': 301, 'depth_NN_heal': 4, 'depth_NN_state': 4, 'mode_heal': 56, 'mode_state': 64, 'blocks_heal': 7, 'blocks_state': 2, 'lift_act_state': <built-in function gelu>, 'block_act_state': <built-in function gelu>, 'lift_act_heal': <function tanh at 0x7ff3611b4cc0>, 'block_act_heal': <function tanh at 0x7ff3611b4cc0>, 'width_heal': 28, 'width_state': 42, 'lr': 0.0019422971363117624, 'padding_heal': 0, 'padding_state': 21, 'optimizer_type': 'lbfgs'}. Best is trial 484 with value: 0.0010389797389507294.
[I 2025-07-30 21:54:14,490] Trial 679 finished with value: 0.0013351163361221552 and parameters: {'width_NN_heal': 101, 'width_NN_state': 326, 'depth_NN_heal': 4, 'depth_NN_state': 4, 'mode_heal': 52, 'mode_state': 64, 'blocks_heal': 7, 'blocks_state': 2, 'lift_act_state': <built-in function gelu>, 'block_act_state': <built-in function gelu>, 'lift_act_heal': <function tanh at 0x7ff3611b4cc0>, 'block_act_heal': <function tanh at 0x7ff3611b4cc0>, 'width_heal': 26, 'width_state': 32, 'lr': 0.002086912993106055, 'padding_heal': 6, 'padding_state': 22, 'optimizer_type': 'lbfgs'}. Best is trial 484 with value: 0.0010389797389507294.
[I 2025-07-30 21:54:19,009] Trial 680 finished with value: 0.0013196381041780114 and parameters: {'width_NN_heal': 145, 'width_NN_state': 292, 'depth_NN_heal': 4, 'depth_NN_state': 4, 'mode_heal': 56, 'mode_state': 64, 'blocks_heal': 7, 'blocks_state': 2, 'lift_act_state': <built-in function gelu>, 'block_act_state': <built-in function gelu>, 'lift_act_heal': <function tanh at 0x7ff3611b4cc0>, 'block_act_heal': <function tanh at 0x7ff3611b4cc0>, 'width_heal': 23, 'width_state': 30, 'lr': 0.0019906010680706284, 'padding_heal': 5, 'padding_state': 20, 'optimizer_type': 'lbfgs'}. Best is trial 484 with value: 0.0010389797389507294.
[I 2025-07-30 21:54:23,954] Trial 681 finished with value: 0.0013227862073108554 and parameters: {'width_NN_heal': 125, 'width_NN_state': 364, 'depth_NN_heal': 4, 'depth_NN_state': 4, 'mode_heal': 56, 'mode_state': 64, 'blocks_heal': 7, 'blocks_state': 2, 'lift_act_state': <built-in function gelu>, 'block_act_state': <built-in function gelu>, 'lift_act_heal': <function tanh at 0x7ff3611b4cc0>, 'block_act_heal': <function tanh at 0x7ff3611b4cc0>, 'width_heal': 31, 'width_state': 48, 'lr': 0.0016633993170997985, 'padding_heal': 7, 'padding_state': 21, 'optimizer_type': 'lbfgs'}. Best is trial 484 with value: 0.0010389797389507294.
[I 2025-07-30 21:54:28,512] Trial 682 finished with value: 0.0013099310453981161 and parameters: {'width_NN_heal': 170, 'width_NN_state': 208, 'depth_NN_heal': 4, 'depth_NN_state': 4, 'mode_heal': 56, 'mode_state': 60, 'blocks_heal': 7, 'blocks_state': 2, 'lift_act_state': <built-in function gelu>, 'block_act_state': <built-in function gelu>, 'lift_act_heal': <function tanh at 0x7ff3611b4cc0>, 'block_act_heal': <function tanh at 0x7ff3611b4cc0>, 'width_heal': 29, 'width_state': 33, 'lr': 0.0018323904734462344, 'padding_heal': 6, 'padding_state': 22, 'optimizer_type': 'lbfgs'}. Best is trial 484 with value: 0.0010389797389507294.
[I 2025-07-30 21:54:32,825] Trial 683 finished with value: 0.0018212496070191264 and parameters: {'width_NN_heal': 138, 'width_NN_state': 226, 'depth_NN_heal': 3, 'depth_NN_state': 4, 'mode_heal': 56, 'mode_state': 60, 'blocks_heal': 7, 'blocks_state': 2, 'lift_act_state': <built-in function gelu>, 'block_act_state': <built-in function gelu>, 'lift_act_heal': <function tanh at 0x7ff3611b4cc0>, 'block_act_heal': <function tanh at 0x7ff3611b4cc0>, 'width_heal': 24, 'width_state': 41, 'lr': 0.0020204856839460684, 'padding_heal': 5, 'padding_state': 21, 'optimizer_type': 'lbfgs'}. Best is trial 484 with value: 0.0010389797389507294.
[I 2025-07-30 21:54:37,313] Trial 684 finished with value: 0.0012192747090011835 and parameters: {'width_NN_heal': 157, 'width_NN_state': 271, 'depth_NN_heal': 4, 'depth_NN_state': 4, 'mode_heal': 56, 'mode_state': 64, 'blocks_heal': 7, 'blocks_state': 2, 'lift_act_state': <built-in function gelu>, 'block_act_state': <built-in function gelu>, 'lift_act_heal': <function tanh at 0x7ff3611b4cc0>, 'block_act_heal': None, 'width_heal': 27, 'width_state': 37, 'lr': 0.002250577741296737, 'padding_heal': 5, 'padding_state': 20, 'optimizer_type': 'lbfgs'}. Best is trial 484 with value: 0.0010389797389507294.
[I 2025-07-30 21:54:41,910] Trial 685 finished with value: 0.0015142762567847967 and parameters: {'width_NN_heal': 115, 'width_NN_state': 314, 'depth_NN_heal': 4, 'depth_NN_state': 4, 'mode_heal': 56, 'mode_state': 64, 'blocks_heal': 7, 'blocks_state': 2, 'lift_act_state': <built-in function gelu>, 'block_act_state': <built-in function gelu>, 'lift_act_heal': <function tanh at 0x7ff3611b4cc0>, 'block_act_heal': <function tanh at 0x7ff3611b4cc0>, 'width_heal': 23, 'width_state': 27, 'lr': 0.0021168415673733436, 'padding_heal': 7, 'padding_state': 20, 'optimizer_type': 'lbfgs'}. Best is trial 484 with value: 0.0010389797389507294.
[I 2025-07-30 21:54:46,471] Trial 686 finished with value: 0.0012331195175647736 and parameters: {'width_NN_heal': 127, 'width_NN_state': 242, 'depth_NN_heal': 4, 'depth_NN_state': 4, 'mode_heal': 52, 'mode_state': 60, 'blocks_heal': 7, 'blocks_state': 2, 'lift_act_state': <built-in function gelu>, 'block_act_state': <built-in function gelu>, 'lift_act_heal': <function tanh at 0x7ff3611b4cc0>, 'block_act_heal': <function tanh at 0x7ff3611b4cc0>, 'width_heal': 33, 'width_state': 32, 'lr': 0.0017496424991045867, 'padding_heal': 1, 'padding_state': 22, 'optimizer_type': 'lbfgs'}. Best is trial 484 with value: 0.0010389797389507294.
[I 2025-07-30 21:54:51,245] Trial 687 finished with value: 0.0015556131256744266 and parameters: {'width_NN_heal': 142, 'width_NN_state': 346, 'depth_NN_heal': 4, 'depth_NN_state': 4, 'mode_heal': 56, 'mode_state': 64, 'blocks_heal': 7, 'blocks_state': 2, 'lift_act_state': <built-in function gelu>, 'block_act_state': <built-in function gelu>, 'lift_act_heal': <function tanh at 0x7ff3611b4cc0>, 'block_act_heal': <function tanh at 0x7ff3611b4cc0>, 'width_heal': 25, 'width_state': 36, 'lr': 0.0013523344782988592, 'padding_heal': 6, 'padding_state': 21, 'optimizer_type': 'lbfgs'}. Best is trial 484 with value: 0.0010389797389507294.
[I 2025-07-30 21:54:56,727] Trial 688 finished with value: 0.0011279421159997582 and parameters: {'width_NN_heal': 182, 'width_NN_state': 406, 'depth_NN_heal': 4, 'depth_NN_state': 4, 'mode_heal': 56, 'mode_state': 64, 'blocks_heal': 7, 'blocks_state': 2, 'lift_act_state': <built-in function gelu>, 'block_act_state': <built-in function gelu>, 'lift_act_heal': <function tanh at 0x7ff3611b4cc0>, 'block_act_heal': <function tanh at 0x7ff3611b4cc0>, 'width_heal': 29, 'width_state': 29, 'lr': 0.0019941850989448075, 'padding_heal': 5, 'padding_state': 19, 'optimizer_type': 'lbfgs'}. Best is trial 484 with value: 0.0010389797389507294.
[I 2025-07-30 21:55:02,170] Trial 689 finished with value: 0.0012093378463760018 and parameters: {'width_NN_heal': 163, 'width_NN_state': 405, 'depth_NN_heal': 4, 'depth_NN_state': 4, 'mode_heal': 52, 'mode_state': 64, 'blocks_heal': 7, 'blocks_state': 2, 'lift_act_state': <built-in function gelu>, 'block_act_state': <built-in function gelu>, 'lift_act_heal': <function tanh at 0x7ff3611b4cc0>, 'block_act_heal': <function tanh at 0x7ff3611b4cc0>, 'width_heal': 31, 'width_state': 29, 'lr': 0.0018854162952927588, 'padding_heal': 5, 'padding_state': 19, 'optimizer_type': 'lbfgs'}. Best is trial 484 with value: 0.0010389797389507294.
[I 2025-07-30 21:55:07,599] Trial 690 finished with value: 0.0013586720451712608 and parameters: {'width_NN_heal': 102, 'width_NN_state': 410, 'depth_NN_heal': 4, 'depth_NN_state': 4, 'mode_heal': 56, 'mode_state': 60, 'blocks_heal': 7, 'blocks_state': 2, 'lift_act_state': <built-in function gelu>, 'block_act_state': <built-in function gelu>, 'lift_act_heal': <function tanh at 0x7ff3611b4cc0>, 'block_act_heal': <function tanh at 0x7ff3611b4cc0>, 'width_heal': 35, 'width_state': 28, 'lr': 0.0015886773232837762, 'padding_heal': 5, 'padding_state': 19, 'optimizer_type': 'lbfgs'}. Best is trial 484 with value: 0.0010389797389507294.
