[I 2025-07-30 21:35:12,178] Trial 453 finished with value: 0.0024374788627028465 and parameters: {'width_NN_heal': 187, 'width_NN_state': 202, 'depth_NN_heal': 5, 'depth_NN_state': 4, 'mode_heal': 64, 'mode_state': 64, 'blocks_heal': 7, 'blocks_state': 3, 'lift_act_state': <built-in function gelu>, 'block_act_state': None, 'lift_act_heal': <function tanh at 0x7ff3611b4cc0>, 'block_act_heal': <function tanh at 0x7ff3611b4cc0>, 'width_heal': 20, 'width_state': 16, 'lr': 0.0030376198946799847, 'padding_heal': 3, 'padding_state': 20, 'optimizer_type': 'lbfgs'}. Best is trial 395 with value: 0.0011172658996656537.
[I 2025-07-30 21:35:17,112] Trial 454 finished with value: 0.0013056083116680384 and parameters: {'width_NN_heal': 145, 'width_NN_state': 243, 'depth_NN_heal': 5, 'depth_NN_state': 4, 'mode_heal': 64, 'mode_state': 64, 'blocks_heal': 7, 'blocks_state': 3, 'lift_act_state': <built-in function gelu>, 'block_act_state': <built-in function gelu>, 'lift_act_heal': <function tanh at 0x7ff3611b4cc0>, 'block_act_heal': <function tanh at 0x7ff3611b4cc0>, 'width_heal': 21, 'width_state': 16, 'lr': 0.00309932135183942, 'padding_heal': 4, 'padding_state': 20, 'optimizer_type': 'lbfgs'}. Best is trial 395 with value: 0.0011172658996656537.
[I 2025-07-30 21:35:22,008] Trial 455 finished with value: 0.0012890228535979986 and parameters: {'width_NN_heal': 163, 'width_NN_state': 298, 'depth_NN_heal': 5, 'depth_NN_state': 4, 'mode_heal': 64, 'mode_state': 64, 'blocks_heal': 7, 'blocks_state': 3, 'lift_act_state': <built-in function gelu>, 'block_act_state': <built-in function gelu>, 'lift_act_heal': <function tanh at 0x7ff3611b4cc0>, 'block_act_heal': <function tanh at 0x7ff3611b4cc0>, 'width_heal': 19, 'width_state': 16, 'lr': 0.0030471549594193207, 'padding_heal': 4, 'padding_state': 20, 'optimizer_type': 'lbfgs'}. Best is trial 395 with value: 0.0011172658996656537.
[I 2025-07-30 21:35:26,905] Trial 456 finished with value: 0.002153741428628564 and parameters: {'width_NN_heal': 166, 'width_NN_state': 286, 'depth_NN_heal': 5, 'depth_NN_state': 4, 'mode_heal': 64, 'mode_state': 64, 'blocks_heal': 7, 'blocks_state': 3, 'lift_act_state': <built-in function gelu>, 'block_act_state': <built-in function gelu>, 'lift_act_heal': <function tanh at 0x7ff3611b4cc0>, 'block_act_heal': <function tanh at 0x7ff3611b4cc0>, 'width_heal': 21, 'width_state': 15, 'lr': 0.0031891561513341746, 'padding_heal': 4, 'padding_state': 20, 'optimizer_type': 'lbfgs'}. Best is trial 395 with value: 0.0011172658996656537.
[I 2025-07-30 21:35:31,813] Trial 457 finished with value: 0.0013225434813648462 and parameters: {'width_NN_heal': 150, 'width_NN_state': 237, 'depth_NN_heal': 5, 'depth_NN_state': 4, 'mode_heal': 64, 'mode_state': 64, 'blocks_heal': 7, 'blocks_state': 3, 'lift_act_state': <built-in function gelu>, 'block_act_state': <built-in function gelu>, 'lift_act_heal': <function tanh at 0x7ff3611b4cc0>, 'block_act_heal': <function tanh at 0x7ff3611b4cc0>, 'width_heal': 19, 'width_state': 16, 'lr': 0.0029621694232173593, 'padding_heal': 4, 'padding_state': 20, 'optimizer_type': 'lbfgs'}. Best is trial 395 with value: 0.0011172658996656537.
[I 2025-07-30 21:35:36,770] Trial 458 finished with value: 0.0012372236233204603 and parameters: {'width_NN_heal': 161, 'width_NN_state': 278, 'depth_NN_heal': 5, 'depth_NN_state': 4, 'mode_heal': 64, 'mode_state': 64, 'blocks_heal': 7, 'blocks_state': 3, 'lift_act_state': <built-in function gelu>, 'block_act_state': <built-in function gelu>, 'lift_act_heal': <function tanh at 0x7ff3611b4cc0>, 'block_act_heal': <function tanh at 0x7ff3611b4cc0>, 'width_heal': 18, 'width_state': 15, 'lr': 0.0031309082507484515, 'padding_heal': 4, 'padding_state': 19, 'optimizer_type': 'lbfgs'}. Best is trial 395 with value: 0.0011172658996656537.
[I 2025-07-30 21:35:41,688] Trial 459 finished with value: 0.0012398988474160433 and parameters: {'width_NN_heal': 163, 'width_NN_state': 268, 'depth_NN_heal': 5, 'depth_NN_state': 4, 'mode_heal': 64, 'mode_state': 64, 'blocks_heal': 7, 'blocks_state': 3, 'lift_act_state': <built-in function gelu>, 'block_act_state': <built-in function gelu>, 'lift_act_heal': <function tanh at 0x7ff3611b4cc0>, 'block_act_heal': <function tanh at 0x7ff3611b4cc0>, 'width_heal': 19, 'width_state': 15, 'lr': 0.0031434401923943842, 'padding_heal': 4, 'padding_state': 19, 'optimizer_type': 'lbfgs'}. Best is trial 395 with value: 0.0011172658996656537.
[I 2025-07-30 21:35:46,579] Trial 460 finished with value: 0.0013628096785396338 and parameters: {'width_NN_heal': 159, 'width_NN_state': 283, 'depth_NN_heal': 5, 'depth_NN_state': 4, 'mode_heal': 64, 'mode_state': 64, 'blocks_heal': 7, 'blocks_state': 3, 'lift_act_state': <built-in function gelu>, 'block_act_state': <built-in function gelu>, 'lift_act_heal': <function tanh at 0x7ff3611b4cc0>, 'block_act_heal': <function tanh at 0x7ff3611b4cc0>, 'width_heal': 18, 'width_state': 15, 'lr': 0.003103680954316319, 'padding_heal': 3, 'padding_state': 19, 'optimizer_type': 'lbfgs'}. Best is trial 395 with value: 0.0011172658996656537.
[I 2025-07-30 21:35:51,570] Trial 461 finished with value: 0.0011640562443062663 and parameters: {'width_NN_heal': 206, 'width_NN_state': 300, 'depth_NN_heal': 5, 'depth_NN_state': 4, 'mode_heal': 64, 'mode_state': 64, 'blocks_heal': 7, 'blocks_state': 3, 'lift_act_state': <built-in function gelu>, 'block_act_state': <built-in function gelu>, 'lift_act_heal': <function tanh at 0x7ff3611b4cc0>, 'block_act_heal': <function tanh at 0x7ff3611b4cc0>, 'width_heal': 19, 'width_state': 18, 'lr': 0.0028597904573517577, 'padding_heal': 3, 'padding_state': 19, 'optimizer_type': 'lbfgs'}. Best is trial 395 with value: 0.0011172658996656537.
[I 2025-07-30 21:35:56,503] Trial 462 finished with value: 0.0013719426933676004 and parameters: {'width_NN_heal': 201, 'width_NN_state': 272, 'depth_NN_heal': 5, 'depth_NN_state': 4, 'mode_heal': 64, 'mode_state': 64, 'blocks_heal': 7, 'blocks_state': 3, 'lift_act_state': <built-in function gelu>, 'block_act_state': <built-in function gelu>, 'lift_act_heal': <function tanh at 0x7ff3611b4cc0>, 'block_act_heal': <function tanh at 0x7ff3611b4cc0>, 'width_heal': 19, 'width_state': 19, 'lr': 0.003153172246271442, 'padding_heal': 4, 'padding_state': 19, 'optimizer_type': 'lbfgs'}. Best is trial 395 with value: 0.0011172658996656537.
[I 2025-07-30 21:36:01,656] Trial 463 finished with value: 0.0013854940189048648 and parameters: {'width_NN_heal': 180, 'width_NN_state': 345, 'depth_NN_heal': 5, 'depth_NN_state': 4, 'mode_heal': 64, 'mode_state': 64, 'blocks_heal': 7, 'blocks_state': 3, 'lift_act_state': <built-in function gelu>, 'block_act_state': <built-in function gelu>, 'lift_act_heal': <function tanh at 0x7ff3611b4cc0>, 'block_act_heal': <function tanh at 0x7ff3611b4cc0>, 'width_heal': 18, 'width_state': 15, 'lr': 0.0032084576702736014, 'padding_heal': 3, 'padding_state': 19, 'optimizer_type': 'lbfgs'}. Best is trial 395 with value: 0.0011172658996656537.
[I 2025-07-30 21:36:06,523] Trial 464 finished with value: 0.001318211667239666 and parameters: {'width_NN_heal': 228, 'width_NN_state': 257, 'depth_NN_heal': 5, 'depth_NN_state': 4, 'mode_heal': 64, 'mode_state': 64, 'blocks_heal': 7, 'blocks_state': 3, 'lift_act_state': <built-in function gelu>, 'block_act_state': <built-in function gelu>, 'lift_act_heal': <function tanh at 0x7ff3611b4cc0>, 'block_act_heal': <function tanh at 0x7ff3611b4cc0>, 'width_heal': 20, 'width_state': 18, 'lr': 0.0028904756183775115, 'padding_heal': 3, 'padding_state': 20, 'optimizer_type': 'lbfgs'}. Best is trial 395 with value: 0.0011172658996656537.
[I 2025-07-30 21:36:11,439] Trial 465 finished with value: 0.0011278613237664104 and parameters: {'width_NN_heal': 164, 'width_NN_state': 311, 'depth_NN_heal': 5, 'depth_NN_state': 4, 'mode_heal': 64, 'mode_state': 64, 'blocks_heal': 7, 'blocks_state': 3, 'lift_act_state': <built-in function gelu>, 'block_act_state': <built-in function gelu>, 'lift_act_heal': <function tanh at 0x7ff3611b4cc0>, 'block_act_heal': <function tanh at 0x7ff3611b4cc0>, 'width_heal': 19, 'width_state': 17, 'lr': 0.002894055403625108, 'padding_heal': 2, 'padding_state': 20, 'optimizer_type': 'lbfgs'}. Best is trial 395 with value: 0.0011172658996656537.
[I 2025-07-30 21:36:16,581] Trial 466 finished with value: 0.0012444767635315657 and parameters: {'width_NN_heal': 172, 'width_NN_state': 333, 'depth_NN_heal': 5, 'depth_NN_state': 4, 'mode_heal': 64, 'mode_state': 64, 'blocks_heal': 7, 'blocks_state': 3, 'lift_act_state': <built-in function gelu>, 'block_act_state': <built-in function gelu>, 'lift_act_heal': <function tanh at 0x7ff3611b4cc0>, 'block_act_heal': <function tanh at 0x7ff3611b4cc0>, 'width_heal': 19, 'width_state': 17, 'lr': 0.002810945884216347, 'padding_heal': 2, 'padding_state': 19, 'optimizer_type': 'lbfgs'}. Best is trial 395 with value: 0.0011172658996656537.
[I 2025-07-30 21:36:21,515] Trial 467 finished with value: 0.0014482069527730346 and parameters: {'width_NN_heal': 165, 'width_NN_state': 318, 'depth_NN_heal': 5, 'depth_NN_state': 4, 'mode_heal': 64, 'mode_state': 64, 'blocks_heal': 7, 'blocks_state': 3, 'lift_act_state': <built-in function gelu>, 'block_act_state': <built-in function gelu>, 'lift_act_heal': <function tanh at 0x7ff3611b4cc0>, 'block_act_heal': <function tanh at 0x7ff3611b4cc0>, 'width_heal': 19, 'width_state': 18, 'lr': 0.0028637498046060615, 'padding_heal': 2, 'padding_state': 19, 'optimizer_type': 'lbfgs'}. Best is trial 395 with value: 0.0011172658996656537.
[I 2025-07-30 21:36:26,430] Trial 468 finished with value: 0.0013264667941257358 and parameters: {'width_NN_heal': 192, 'width_NN_state': 314, 'depth_NN_heal': 5, 'depth_NN_state': 4, 'mode_heal': 64, 'mode_state': 64, 'blocks_heal': 7, 'blocks_state': 3, 'lift_act_state': <built-in function gelu>, 'block_act_state': <built-in function gelu>, 'lift_act_heal': <function tanh at 0x7ff3611b4cc0>, 'block_act_heal': <function tanh at 0x7ff3611b4cc0>, 'width_heal': 20, 'width_state': 17, 'lr': 0.0030342385359000885, 'padding_heal': 3, 'padding_state': 19, 'optimizer_type': 'lbfgs'}. Best is trial 395 with value: 0.0011172658996656537.
[I 2025-07-30 21:36:31,700] Trial 469 finished with value: 0.0015368801541626453 and parameters: {'width_NN_heal': 174, 'width_NN_state': 382, 'depth_NN_heal': 5, 'depth_NN_state': 4, 'mode_heal': 64, 'mode_state': 64, 'blocks_heal': 7, 'blocks_state': 3, 'lift_act_state': <built-in function gelu>, 'block_act_state': <built-in function gelu>, 'lift_act_heal': <function tanh at 0x7ff3611b4cc0>, 'block_act_heal': <function tanh at 0x7ff3611b4cc0>, 'width_heal': 16, 'width_state': 19, 'lr': 0.0029564458249735867, 'padding_heal': 2, 'padding_state': 19, 'optimizer_type': 'lbfgs'}. Best is trial 395 with value: 0.0011172658996656537.
[I 2025-07-30 21:36:36,592] Trial 470 finished with value: 0.0012632593279704452 and parameters: {'width_NN_heal': 157, 'width_NN_state': 295, 'depth_NN_heal': 5, 'depth_NN_state': 4, 'mode_heal': 64, 'mode_state': 64, 'blocks_heal': 7, 'blocks_state': 3, 'lift_act_state': <built-in function gelu>, 'block_act_state': <built-in function gelu>, 'lift_act_heal': <function tanh at 0x7ff3611b4cc0>, 'block_act_heal': <function tanh at 0x7ff3611b4cc0>, 'width_heal': 22, 'width_state': 21, 'lr': 0.0026986300144316924, 'padding_heal': 3, 'padding_state': 20, 'optimizer_type': 'lbfgs'}. Best is trial 395 with value: 0.0011172658996656537.
[I 2025-07-30 21:36:41,672] Trial 471 finished with value: 0.0013890496920794249 and parameters: {'width_NN_heal': 208, 'width_NN_state': 288, 'depth_NN_heal': 5, 'depth_NN_state': 4, 'mode_heal': 64, 'mode_state': 64, 'blocks_heal': 7, 'blocks_state': 3, 'lift_act_state': <built-in function gelu>, 'block_act_state': <built-in function gelu>, 'lift_act_heal': <function tanh at 0x7ff3611b4cc0>, 'block_act_heal': <function tanh at 0x7ff3611b4cc0>, 'width_heal': 17, 'width_state': 18, 'lr': 0.002699220730659895, 'padding_heal': 4, 'padding_state': 20, 'optimizer_type': 'lbfgs'}. Best is trial 395 with value: 0.0011172658996656537.
[I 2025-07-30 21:36:46,554] Trial 472 finished with value: 0.0013631744077429175 and parameters: {'width_NN_heal': 157, 'width_NN_state': 310, 'depth_NN_heal': 5, 'depth_NN_state': 4, 'mode_heal': 64, 'mode_state': 36, 'blocks_heal': 7, 'blocks_state': 3, 'lift_act_state': <built-in function gelu>, 'block_act_state': <built-in function gelu>, 'lift_act_heal': <function tanh at 0x7ff3611b4cc0>, 'block_act_heal': <function tanh at 0x7ff3611b4cc0>, 'width_heal': 21, 'width_state': 21, 'lr': 0.002702382718164757, 'padding_heal': 3, 'padding_state': 20, 'optimizer_type': 'lbfgs'}. Best is trial 395 with value: 0.0011172658996656537.
[I 2025-07-30 21:36:51,431] Trial 473 finished with value: 0.0011719304602593184 and parameters: {'width_NN_heal': 137, 'width_NN_state': 262, 'depth_NN_heal': 5, 'depth_NN_state': 4, 'mode_heal': 64, 'mode_state': 64, 'blocks_heal': 7, 'blocks_state': 3, 'lift_act_state': <built-in function gelu>, 'block_act_state': <built-in function gelu>, 'lift_act_heal': <function tanh at 0x7ff3611b4cc0>, 'block_act_heal': <function tanh at 0x7ff3611b4cc0>, 'width_heal': 19, 'width_state': 20, 'lr': 0.0028470280653074215, 'padding_heal': 3, 'padding_state': 20, 'optimizer_type': 'lbfgs'}. Best is trial 395 with value: 0.0011172658996656537.
[I 2025-07-30 21:36:56,361] Trial 474 finished with value: 0.001388181117363274 and parameters: {'width_NN_heal': 134, 'width_NN_state': 262, 'depth_NN_heal': 5, 'depth_NN_state': 4, 'mode_heal': 64, 'mode_state': 64, 'blocks_heal': 7, 'blocks_state': 3, 'lift_act_state': <built-in function gelu>, 'block_act_state': <built-in function gelu>, 'lift_act_heal': <function tanh at 0x7ff3611b4cc0>, 'block_act_heal': <function tanh at 0x7ff3611b4cc0>, 'width_heal': 18, 'width_state': 20, 'lr': 0.002778706911933243, 'padding_heal': 2, 'padding_state': 19, 'optimizer_type': 'lbfgs'}. Best is trial 395 with value: 0.0011172658996656537.
[I 2025-07-30 21:37:01,235] Trial 475 finished with value: 0.0012045686598867178 and parameters: {'width_NN_heal': 146, 'width_NN_state': 218, 'depth_NN_heal': 5, 'depth_NN_state': 4, 'mode_heal': 64, 'mode_state': 64, 'blocks_heal': 7, 'blocks_state': 3, 'lift_act_state': <built-in function gelu>, 'block_act_state': <built-in function gelu>, 'lift_act_heal': <function tanh at 0x7ff3611b4cc0>, 'block_act_heal': <function tanh at 0x7ff3611b4cc0>, 'width_heal': 22, 'width_state': 23, 'lr': 0.0027668703096709536, 'padding_heal': 3, 'padding_state': 20, 'optimizer_type': 'lbfgs'}. Best is trial 395 with value: 0.0011172658996656537.
[I 2025-07-30 21:37:06,155] Trial 476 finished with value: 0.0013989538419991732 and parameters: {'width_NN_heal': 145, 'width_NN_state': 216, 'depth_NN_heal': 5, 'depth_NN_state': 4, 'mode_heal': 64, 'mode_state': 64, 'blocks_heal': 7, 'blocks_state': 3, 'lift_act_state': <built-in function gelu>, 'block_act_state': <built-in function gelu>, 'lift_act_heal': <function tanh at 0x7ff3611b4cc0>, 'block_act_heal': <function tanh at 0x7ff3611b4cc0>, 'width_heal': 21, 'width_state': 22, 'lr': 0.002659540712809976, 'padding_heal': 3, 'padding_state': 19, 'optimizer_type': 'lbfgs'}. Best is trial 395 with value: 0.0011172658996656537.
[I 2025-07-30 21:37:11,015] Trial 477 finished with value: 0.00250999559648335 and parameters: {'width_NN_heal': 177, 'width_NN_state': 219, 'depth_NN_heal': 5, 'depth_NN_state': 4, 'mode_heal': 60, 'mode_state': 64, 'blocks_heal': 7, 'blocks_state': 3, 'lift_act_state': <built-in function gelu>, 'block_act_state': None, 'lift_act_heal': <function tanh at 0x7ff3611b4cc0>, 'block_act_heal': <function tanh at 0x7ff3611b4cc0>, 'width_heal': 22, 'width_state': 22, 'lr': 0.0027865726319256643, 'padding_heal': 3, 'padding_state': 20, 'optimizer_type': 'lbfgs'}. Best is trial 395 with value: 0.0011172658996656537.
[I 2025-07-30 21:37:15,926] Trial 478 finished with value: 0.0012004406889900565 and parameters: {'width_NN_heal': 154, 'width_NN_state': 256, 'depth_NN_heal': 5, 'depth_NN_state': 4, 'mode_heal': 64, 'mode_state': 64, 'blocks_heal': 7, 'blocks_state': 3, 'lift_act_state': <built-in function gelu>, 'block_act_state': <built-in function gelu>, 'lift_act_heal': <function tanh at 0x7ff3611b4cc0>, 'block_act_heal': <function tanh at 0x7ff3611b4cc0>, 'width_heal': 19, 'width_state': 21, 'lr': 0.002585386719702152, 'padding_heal': 2, 'padding_state': 20, 'optimizer_type': 'lbfgs'}. Best is trial 395 with value: 0.0011172658996656537.
[I 2025-07-30 21:37:20,736] Trial 479 finished with value: 0.001703183981589973 and parameters: {'width_NN_heal': 152, 'width_NN_state': 261, 'depth_NN_heal': 4, 'depth_NN_state': 4, 'mode_heal': 64, 'mode_state': 64, 'blocks_heal': 7, 'blocks_state': 3, 'lift_act_state': <built-in function gelu>, 'block_act_state': <built-in function gelu>, 'lift_act_heal': <function tanh at 0x7ff3611b4cc0>, 'block_act_heal': <function tanh at 0x7ff3611b4cc0>, 'width_heal': 19, 'width_state': 20, 'lr': 0.0024851971662654447, 'padding_heal': 4, 'padding_state': 20, 'optimizer_type': 'lbfgs'}. Best is trial 395 with value: 0.0011172658996656537.
[I 2025-07-30 21:37:25,624] Trial 480 finished with value: 0.0014334515435621142 and parameters: {'width_NN_heal': 141, 'width_NN_state': 253, 'depth_NN_heal': 5, 'depth_NN_state': 4, 'mode_heal': 64, 'mode_state': 64, 'blocks_heal': 7, 'blocks_state': 3, 'lift_act_state': <built-in function gelu>, 'block_act_state': <built-in function gelu>, 'lift_act_heal': <function tanh at 0x7ff3611b4cc0>, 'block_act_heal': <function tanh at 0x7ff3611b4cc0>, 'width_heal': 20, 'width_state': 24, 'lr': 0.0028334090884713182, 'padding_heal': 2, 'padding_state': 19, 'optimizer_type': 'lbfgs'}. Best is trial 395 with value: 0.0011172658996656537.
[I 2025-07-30 21:37:31,264] Trial 481 finished with value: 0.001443397719413042 and parameters: {'width_NN_heal': 166, 'width_NN_state': 398, 'depth_NN_heal': 5, 'depth_NN_state': 4, 'mode_heal': 64, 'mode_state': 64, 'blocks_heal': 7, 'blocks_state': 3, 'lift_act_state': <built-in function gelu>, 'block_act_state': <built-in function gelu>, 'lift_act_heal': <function tanh at 0x7ff3611b4cc0>, 'block_act_heal': <function tanh at 0x7ff3611b4cc0>, 'width_heal': 18, 'width_state': 22, 'lr': 0.002577277893625422, 'padding_heal': 3, 'padding_state': 21, 'optimizer_type': 'lbfgs'}. Best is trial 395 with value: 0.0011172658996656537.
[I 2025-07-30 21:37:36,073] Trial 482 finished with value: 0.0012533904518932104 and parameters: {'width_NN_heal': 187, 'width_NN_state': 228, 'depth_NN_heal': 5, 'depth_NN_state': 4, 'mode_heal': 60, 'mode_state': 64, 'blocks_heal': 7, 'blocks_state': 3, 'lift_act_state': <built-in function gelu>, 'block_act_state': <built-in function gelu>, 'lift_act_heal': <function tanh at 0x7ff3611b4cc0>, 'block_act_heal': <function tanh at 0x7ff3611b4cc0>, 'width_heal': 20, 'width_state': 21, 'lr': 0.002342963101987771, 'padding_heal': 3, 'padding_state': 20, 'optimizer_type': 'lbfgs'}. Best is trial 395 with value: 0.0011172658996656537.
[I 2025-07-30 21:37:41,354] Trial 483 finished with value: 0.0012475787661969662 and parameters: {'width_NN_heal': 185, 'width_NN_state': 378, 'depth_NN_heal': 5, 'depth_NN_state': 4, 'mode_heal': 60, 'mode_state': 64, 'blocks_heal': 7, 'blocks_state': 3, 'lift_act_state': <built-in function gelu>, 'block_act_state': <built-in function gelu>, 'lift_act_heal': <function tanh at 0x7ff3611b4cc0>, 'block_act_heal': <function tanh at 0x7ff3611b4cc0>, 'width_heal': 22, 'width_state': 21, 'lr': 0.0023672680499766635, 'padding_heal': 4, 'padding_state': 21, 'optimizer_type': 'lbfgs'}. Best is trial 395 with value: 0.0011172658996656537.
[I 2025-07-30 21:37:46,896] Trial 484 finished with value: 0.0010389797389507294 and parameters: {'width_NN_heal': 212, 'width_NN_state': 376, 'depth_NN_heal': 5, 'depth_NN_state': 4, 'mode_heal': 60, 'mode_state': 64, 'blocks_heal': 7, 'blocks_state': 3, 'lift_act_state': <built-in function gelu>, 'block_act_state': <built-in function gelu>, 'lift_act_heal': <function tanh at 0x7ff3611b4cc0>, 'block_act_heal': <function tanh at 0x7ff3611b4cc0>, 'width_heal': 22, 'width_state': 24, 'lr': 0.0022947591581355133, 'padding_heal': 5, 'padding_state': 21, 'optimizer_type': 'lbfgs'}. Best is trial 484 with value: 0.0010389797389507294.
[I 2025-07-30 21:37:53,002] Trial 485 finished with value: 0.0014576707035303116 and parameters: {'width_NN_heal': 218, 'width_NN_state': 410, 'depth_NN_heal': 5, 'depth_NN_state': 4, 'mode_heal': 60, 'mode_state': 64, 'blocks_heal': 7, 'blocks_state': 3, 'lift_act_state': <built-in function gelu>, 'block_act_state': <built-in function gelu>, 'lift_act_heal': <function tanh at 0x7ff3611b4cc0>, 'block_act_heal': <function tanh at 0x7ff3611b4cc0>, 'width_heal': 25, 'width_state': 25, 'lr': 0.0018969052407904203, 'padding_heal': 5, 'padding_state': 21, 'optimizer_type': 'lbfgs'}. Best is trial 484 with value: 0.0010389797389507294.
[I 2025-07-30 21:37:58,714] Trial 486 finished with value: 0.0011931014014407992 and parameters: {'width_NN_heal': 261, 'width_NN_state': 344, 'depth_NN_heal': 5, 'depth_NN_state': 4, 'mode_heal': 60, 'mode_state': 64, 'blocks_heal': 7, 'blocks_state': 3, 'lift_act_state': <built-in function gelu>, 'block_act_state': <built-in function gelu>, 'lift_act_heal': <function tanh at 0x7ff3611b4cc0>, 'block_act_heal': <function tanh at 0x7ff3611b4cc0>, 'width_heal': 22, 'width_state': 23, 'lr': 0.002201282868705875, 'padding_heal': 4, 'padding_state': 21, 'optimizer_type': 'lbfgs'}. Best is trial 484 with value: 0.0010389797389507294.
