[I 2025-07-30 22:37:27,257] Trial 1230 finished with value: 0.0015852070646360517 and parameters: {'width_NN_heal': 222, 'width_NN_state': 396, 'depth_NN_heal': 1, 'depth_NN_state': 3, 'mode_heal': 64, 'mode_state': 28, 'blocks_heal': 7, 'blocks_state': 3, 'lift_act_state': <built-in function gelu>, 'block_act_state': <built-in function gelu>, 'lift_act_heal': <function tanh at 0x7ff3611b4cc0>, 'block_act_heal': None, 'width_heal': 47, 'width_state': 24, 'lr': 0.0012238158861158544, 'padding_heal': 4, 'padding_state': 20, 'optimizer_type': 'lbfgs'}. Best is trial 1091 with value: 0.0009798490209504962.
[I 2025-07-30 22:37:31,922] Trial 1231 finished with value: 0.00199690624140203 and parameters: {'width_NN_heal': 399, 'width_NN_state': 298, 'depth_NN_heal': 2, 'depth_NN_state': 3, 'mode_heal': 60, 'mode_state': 60, 'blocks_heal': 7, 'blocks_state': 3, 'lift_act_state': <built-in function gelu>, 'block_act_state': <built-in function gelu>, 'lift_act_heal': <function tanh at 0x7ff3611b4cc0>, 'block_act_heal': None, 'width_heal': 51, 'width_state': 68, 'lr': 0.0005114146609759091, 'padding_heal': 2, 'padding_state': 18, 'optimizer_type': 'lbfgs'}. Best is trial 1091 with value: 0.0009798490209504962.
[I 2025-07-30 22:37:37,803] Trial 1232 finished with value: 0.0016932471189647913 and parameters: {'width_NN_heal': 255, 'width_NN_state': 343, 'depth_NN_heal': 2, 'depth_NN_state': 3, 'mode_heal': 64, 'mode_state': 64, 'blocks_heal': 7, 'blocks_state': 7, 'lift_act_state': <built-in function gelu>, 'block_act_state': <built-in function gelu>, 'lift_act_heal': <function tanh at 0x7ff3611b4cc0>, 'block_act_heal': None, 'width_heal': 35, 'width_state': 52, 'lr': 0.0013928595405697133, 'padding_heal': 3, 'padding_state': 19, 'optimizer_type': 'lbfgs'}. Best is trial 1091 with value: 0.0009798490209504962.
[I 2025-07-30 22:37:42,362] Trial 1233 finished with value: 0.0022449330426752567 and parameters: {'width_NN_heal': 283, 'width_NN_state': 309, 'depth_NN_heal': 2, 'depth_NN_state': 3, 'mode_heal': 60, 'mode_state': 64, 'blocks_heal': 7, 'blocks_state': 3, 'lift_act_state': <built-in function gelu>, 'block_act_state': None, 'lift_act_heal': <function tanh at 0x7ff3611b4cc0>, 'block_act_heal': None, 'width_heal': 44, 'width_state': 80, 'lr': 0.0010541277937180112, 'padding_heal': 4, 'padding_state': 17, 'optimizer_type': 'lbfgs'}. Best is trial 1091 with value: 0.0009798490209504962.
[I 2025-07-30 22:37:47,058] Trial 1234 finished with value: 0.0015225602546706796 and parameters: {'width_NN_heal': 344, 'width_NN_state': 366, 'depth_NN_heal': 2, 'depth_NN_state': 3, 'mode_heal': 64, 'mode_state': 64, 'blocks_heal': 7, 'blocks_state': 3, 'lift_act_state': <built-in function gelu>, 'block_act_state': <built-in function gelu>, 'lift_act_heal': <function tanh at 0x7ff3611b4cc0>, 'block_act_heal': None, 'width_heal': 38, 'width_state': 63, 'lr': 0.0014759071525066005, 'padding_heal': 4, 'padding_state': 18, 'optimizer_type': 'lbfgs'}. Best is trial 1091 with value: 0.0009798490209504962.
[I 2025-07-30 22:37:51,673] Trial 1235 finished with value: 0.0011850390583276749 and parameters: {'width_NN_heal': 207, 'width_NN_state': 266, 'depth_NN_heal': 2, 'depth_NN_state': 3, 'mode_heal': 60, 'mode_state': 60, 'blocks_heal': 7, 'blocks_state': 3, 'lift_act_state': <built-in function gelu>, 'block_act_state': <built-in function gelu>, 'lift_act_heal': <function tanh at 0x7ff3611b4cc0>, 'block_act_heal': None, 'width_heal': 33, 'width_state': 74, 'lr': 0.0017682010136027511, 'padding_heal': 5, 'padding_state': 19, 'optimizer_type': 'lbfgs'}. Best is trial 1091 with value: 0.0009798490209504962.
[I 2025-07-30 22:37:56,210] Trial 1236 finished with value: 0.001270358101464808 and parameters: {'width_NN_heal': 304, 'width_NN_state': 338, 'depth_NN_heal': 2, 'depth_NN_state': 3, 'mode_heal': 60, 'mode_state': 64, 'blocks_heal': 7, 'blocks_state': 3, 'lift_act_state': <built-in function gelu>, 'block_act_state': <built-in function gelu>, 'lift_act_heal': None, 'block_act_heal': None, 'width_heal': 42, 'width_state': 92, 'lr': 0.0009237876356824116, 'padding_heal': 3, 'padding_state': 15, 'optimizer_type': 'lbfgs'}. Best is trial 1091 with value: 0.0009798490209504962.
[I 2025-07-30 22:38:02,204] Trial 1237 finished with value: 0.0013073121663182974 and parameters: {'width_NN_heal': 433, 'width_NN_state': 302, 'depth_NN_heal': 5, 'depth_NN_state': 2, 'mode_heal': 64, 'mode_state': 64, 'blocks_heal': 7, 'blocks_state': 3, 'lift_act_state': <built-in function gelu>, 'block_act_state': <built-in function gelu>, 'lift_act_heal': <function tanh at 0x7ff3611b4cc0>, 'block_act_heal': None, 'width_heal': 55, 'width_state': 84, 'lr': 0.0012972817690920647, 'padding_heal': 1, 'padding_state': 17, 'optimizer_type': 'lbfgs'}. Best is trial 1091 with value: 0.0009798490209504962.
[I 2025-07-30 22:38:06,824] Trial 1238 finished with value: 0.0013183107366785407 and parameters: {'width_NN_heal': 236, 'width_NN_state': 402, 'depth_NN_heal': 2, 'depth_NN_state': 3, 'mode_heal': 60, 'mode_state': 64, 'blocks_heal': 7, 'blocks_state': 2, 'lift_act_state': <built-in function gelu>, 'block_act_state': <built-in function gelu>, 'lift_act_heal': <function tanh at 0x7ff3611b4cc0>, 'block_act_heal': None, 'width_heal': 48, 'width_state': 22, 'lr': 0.0016302496183604339, 'padding_heal': 6, 'padding_state': 16, 'optimizer_type': 'lbfgs'}. Best is trial 1091 with value: 0.0009798490209504962.
[I 2025-07-30 22:38:11,752] Trial 1239 finished with value: 0.0012102884938940406 and parameters: {'width_NN_heal': 373, 'width_NN_state': 335, 'depth_NN_heal': 2, 'depth_NN_state': 3, 'mode_heal': 64, 'mode_state': 64, 'blocks_heal': 8, 'blocks_state': 3, 'lift_act_state': <built-in function gelu>, 'block_act_state': <built-in function gelu>, 'lift_act_heal': <function tanh at 0x7ff3611b4cc0>, 'block_act_heal': None, 'width_heal': 39, 'width_state': 24, 'lr': 0.0011655641641279456, 'padding_heal': 2, 'padding_state': 20, 'optimizer_type': 'lbfgs'}. Best is trial 1091 with value: 0.0009798490209504962.
[I 2025-07-30 22:38:15,571] Trial 1240 finished with value: 0.006062754895538092 and parameters: {'width_NN_heal': 187, 'width_NN_state': 282, 'depth_NN_heal': 2, 'depth_NN_state': 3, 'mode_heal': 60, 'mode_state': 64, 'blocks_heal': 7, 'blocks_state': 1, 'lift_act_state': None, 'block_act_state': <built-in function gelu>, 'lift_act_heal': <function tanh at 0x7ff3611b4cc0>, 'block_act_heal': None, 'width_heal': 44, 'width_state': 105, 'lr': 0.0010700666936603665, 'padding_heal': 5, 'padding_state': 18, 'optimizer_type': 'lbfgs'}. Best is trial 1091 with value: 0.0009798490209504962.
[I 2025-07-30 22:38:20,045] Trial 1241 finished with value: 0.001924554817378521 and parameters: {'width_NN_heal': 324, 'width_NN_state': 254, 'depth_NN_heal': 2, 'depth_NN_state': 3, 'mode_heal': 56, 'mode_state': 44, 'blocks_heal': 7, 'blocks_state': 3, 'lift_act_state': <built-in function gelu>, 'block_act_state': <built-in function gelu>, 'lift_act_heal': <function tanh at 0x7ff3611b4cc0>, 'block_act_heal': None, 'width_heal': 36, 'width_state': 20, 'lr': 0.0017803998956631654, 'padding_heal': 3, 'padding_state': 1, 'optimizer_type': 'lbfgs'}. Best is trial 1091 with value: 0.0009798490209504962.
[I 2025-07-30 22:38:24,783] Trial 1242 finished with value: 0.001311910804361105 and parameters: {'width_NN_heal': 260, 'width_NN_state': 370, 'depth_NN_heal': 2, 'depth_NN_state': 3, 'mode_heal': 60, 'mode_state': 64, 'blocks_heal': 7, 'blocks_state': 3, 'lift_act_state': <built-in function gelu>, 'block_act_state': <built-in function gelu>, 'lift_act_heal': <function tanh at 0x7ff3611b4cc0>, 'block_act_heal': None, 'width_heal': 50, 'width_state': 68, 'lr': 0.00140561047593758, 'padding_heal': 4, 'padding_state': 16, 'optimizer_type': 'lbfgs'}. Best is trial 1091 with value: 0.0009798490209504962.
[I 2025-07-30 22:38:29,287] Trial 1243 finished with value: 0.0013640562538057566 and parameters: {'width_NN_heal': 476, 'width_NN_state': 319, 'depth_NN_heal': 2, 'depth_NN_state': 3, 'mode_heal': 64, 'mode_state': 64, 'blocks_heal': 6, 'blocks_state': 3, 'lift_act_state': <built-in function gelu>, 'block_act_state': <built-in function gelu>, 'lift_act_heal': <function tanh at 0x7ff3611b4cc0>, 'block_act_heal': None, 'width_heal': 40, 'width_state': 77, 'lr': 0.0012387071536678277, 'padding_heal': 4, 'padding_state': 17, 'optimizer_type': 'lbfgs'}. Best is trial 1091 with value: 0.0009798490209504962.
[I 2025-07-30 22:38:35,869] Trial 1244 finished with value: 0.001228492590598762 and parameters: {'width_NN_heal': 512, 'width_NN_state': 280, 'depth_NN_heal': 5, 'depth_NN_state': 3, 'mode_heal': 64, 'mode_state': 64, 'blocks_heal': 7, 'blocks_state': 3, 'lift_act_state': <built-in function gelu>, 'block_act_state': <built-in function gelu>, 'lift_act_heal': <built-in function gelu>, 'block_act_heal': None, 'width_heal': 36, 'width_state': 96, 'lr': 0.0015447243500700085, 'padding_heal': 5, 'padding_state': 18, 'optimizer_type': 'lbfgs'}. Best is trial 1091 with value: 0.0009798490209504962.
[I 2025-07-30 22:38:39,526] Trial 1245 finished with value: 0.0013920714845880866 and parameters: {'width_NN_heal': 386, 'width_NN_state': 355, 'depth_NN_heal': 1, 'depth_NN_state': 3, 'mode_heal': 60, 'mode_state': 60, 'blocks_heal': 4, 'blocks_state': 3, 'lift_act_state': <built-in function gelu>, 'block_act_state': <built-in function gelu>, 'lift_act_heal': <function tanh at 0x7ff3611b4cc0>, 'block_act_heal': None, 'width_heal': 33, 'width_state': 84, 'lr': 0.0010045451452316766, 'padding_heal': 25, 'padding_state': 17, 'optimizer_type': 'lbfgs'}. Best is trial 1091 with value: 0.0009798490209504962.
[I 2025-07-30 22:38:44,631] Trial 1246 finished with value: 0.0011553516378626227 and parameters: {'width_NN_heal': 227, 'width_NN_state': 449, 'depth_NN_heal': 2, 'depth_NN_state': 3, 'mode_heal': 64, 'mode_state': 64, 'blocks_heal': 7, 'blocks_state': 3, 'lift_act_state': <built-in function gelu>, 'block_act_state': <built-in function gelu>, 'lift_act_heal': <function tanh at 0x7ff3611b4cc0>, 'block_act_heal': None, 'width_heal': 45, 'width_state': 58, 'lr': 0.0012791810568407367, 'padding_heal': 12, 'padding_state': 19, 'optimizer_type': 'lbfgs'}. Best is trial 1091 with value: 0.0009798490209504962.
[I 2025-07-30 22:38:49,235] Trial 1247 finished with value: 0.0011783349327743053 and parameters: {'width_NN_heal': 282, 'width_NN_state': 311, 'depth_NN_heal': 2, 'depth_NN_state': 3, 'mode_heal': 60, 'mode_state': 64, 'blocks_heal': 7, 'blocks_state': 3, 'lift_act_state': <built-in function gelu>, 'block_act_state': <built-in function gelu>, 'lift_act_heal': <function tanh at 0x7ff3611b4cc0>, 'block_act_heal': None, 'width_heal': 54, 'width_state': 88, 'lr': 0.0018243200909582543, 'padding_heal': 3, 'padding_state': 18, 'optimizer_type': 'lbfgs'}. Best is trial 1091 with value: 0.0009798490209504962.
[I 2025-07-30 22:38:53,859] Trial 1248 finished with value: 0.0010518633062019944 and parameters: {'width_NN_heal': 421, 'width_NN_state': 263, 'depth_NN_heal': 2, 'depth_NN_state': 3, 'mode_heal': 56, 'mode_state': 64, 'blocks_heal': 7, 'blocks_state': 3, 'lift_act_state': <built-in function gelu>, 'block_act_state': <built-in function gelu>, 'lift_act_heal': <function tanh at 0x7ff3611b4cc0>, 'block_act_heal': None, 'width_heal': 42, 'width_state': 74, 'lr': 0.001454714522653963, 'padding_heal': 6, 'padding_state': 16, 'optimizer_type': 'lbfgs'}. Best is trial 1091 with value: 0.0009798490209504962.
[I 2025-07-30 22:38:58,390] Trial 1249 finished with value: 0.001318038091994822 and parameters: {'width_NN_heal': 388, 'width_NN_state': 256, 'depth_NN_heal': 2, 'depth_NN_state': 2, 'mode_heal': 60, 'mode_state': 64, 'blocks_heal': 7, 'blocks_state': 3, 'lift_act_state': <built-in function gelu>, 'block_act_state': <built-in function gelu>, 'lift_act_heal': <function tanh at 0x7ff3611b4cc0>, 'block_act_heal': None, 'width_heal': 38, 'width_state': 70, 'lr': 0.001546513573351788, 'padding_heal': 6, 'padding_state': 15, 'optimizer_type': 'lbfgs'}. Best is trial 1091 with value: 0.0009798490209504962.
[I 2025-07-30 22:39:03,042] Trial 1250 finished with value: 0.001969117671251297 and parameters: {'width_NN_heal': 434, 'width_NN_state': 254, 'depth_NN_heal': 2, 'depth_NN_state': 3, 'mode_heal': 56, 'mode_state': 60, 'blocks_heal': 7, 'blocks_state': 3, 'lift_act_state': <built-in function gelu>, 'block_act_state': <function tanh at 0x7ff3611b4cc0>, 'lift_act_heal': <function tanh at 0x7ff3611b4cc0>, 'block_act_heal': None, 'width_heal': 41, 'width_state': 63, 'lr': 0.0015942796570234253, 'padding_heal': 6, 'padding_state': 15, 'optimizer_type': 'lbfgs'}. Best is trial 1091 with value: 0.0009798490209504962.
[I 2025-07-30 22:39:07,482] Trial 1251 finished with value: 0.0012241534423083067 and parameters: {'width_NN_heal': 471, 'width_NN_state': 248, 'depth_NN_heal': 2, 'depth_NN_state': 3, 'mode_heal': 56, 'mode_state': 64, 'blocks_heal': 6, 'blocks_state': 3, 'lift_act_state': <built-in function gelu>, 'block_act_state': <built-in function gelu>, 'lift_act_heal': <function tanh at 0x7ff3611b4cc0>, 'block_act_heal': None, 'width_heal': 36, 'width_state': 117, 'lr': 0.001438705195223042, 'padding_heal': 6, 'padding_state': 14, 'optimizer_type': 'lbfgs'}. Best is trial 1091 with value: 0.0009798490209504962.
[I 2025-07-30 22:39:12,145] Trial 1252 finished with value: 0.0012177249882370234 and parameters: {'width_NN_heal': 430, 'width_NN_state': 276, 'depth_NN_heal': 2, 'depth_NN_state': 3, 'mode_heal': 56, 'mode_state': 60, 'blocks_heal': 7, 'blocks_state': 3, 'lift_act_state': <built-in function gelu>, 'block_act_state': <built-in function gelu>, 'lift_act_heal': <function tanh at 0x7ff3611b4cc0>, 'block_act_heal': None, 'width_heal': 39, 'width_state': 66, 'lr': 0.0016531798603154392, 'padding_heal': 6, 'padding_state': 16, 'optimizer_type': 'lbfgs'}. Best is trial 1091 with value: 0.0009798490209504962.
[I 2025-07-30 22:39:16,687] Trial 1253 finished with value: 0.0011464800918474793 and parameters: {'width_NN_heal': 438, 'width_NN_state': 262, 'depth_NN_heal': 2, 'depth_NN_state': 3, 'mode_heal': 56, 'mode_state': 64, 'blocks_heal': 7, 'blocks_state': 3, 'lift_act_state': <built-in function gelu>, 'block_act_state': <built-in function gelu>, 'lift_act_heal': <function tanh at 0x7ff3611b4cc0>, 'block_act_heal': None, 'width_heal': 34, 'width_state': 23, 'lr': 0.0017692610174040722, 'padding_heal': 6, 'padding_state': 16, 'optimizer_type': 'lbfgs'}. Best is trial 1091 with value: 0.0009798490209504962.
[I 2025-07-30 22:39:21,329] Trial 1254 finished with value: 0.001174808363430202 and parameters: {'width_NN_heal': 409, 'width_NN_state': 273, 'depth_NN_heal': 2, 'depth_NN_state': 3, 'mode_heal': 56, 'mode_state': 64, 'blocks_heal': 7, 'blocks_state': 3, 'lift_act_state': <built-in function gelu>, 'block_act_state': <built-in function gelu>, 'lift_act_heal': <function tanh at 0x7ff3611b4cc0>, 'block_act_heal': None, 'width_heal': 42, 'width_state': 72, 'lr': 0.0014797187991235847, 'padding_heal': 5, 'padding_state': 15, 'optimizer_type': 'lbfgs'}. Best is trial 1091 with value: 0.0009798490209504962.
[I 2025-07-30 22:39:27,020] Trial 1255 finished with value: 0.003985836636275053 and parameters: {'width_NN_heal': 407, 'width_NN_state': 246, 'depth_NN_heal': 5, 'depth_NN_state': 3, 'mode_heal': 56, 'mode_state': 64, 'blocks_heal': 7, 'blocks_state': 2, 'lift_act_state': <built-in function gelu>, 'block_act_state': None, 'lift_act_heal': <function tanh at 0x7ff3611b4cc0>, 'block_act_heal': None, 'width_heal': 35, 'width_state': 80, 'lr': 0.0013537262039472924, 'padding_heal': 6, 'padding_state': 15, 'optimizer_type': 'lbfgs'}. Best is trial 1091 with value: 0.0009798490209504962.
[I 2025-07-30 22:39:31,654] Trial 1256 finished with value: 0.001357913832180202 and parameters: {'width_NN_heal': 415, 'width_NN_state': 287, 'depth_NN_heal': 2, 'depth_NN_state': 3, 'mode_heal': 56, 'mode_state': 64, 'blocks_heal': 7, 'blocks_state': 3, 'lift_act_state': <built-in function gelu>, 'block_act_state': <built-in function gelu>, 'lift_act_heal': <function tanh at 0x7ff3611b4cc0>, 'block_act_heal': None, 'width_heal': 38, 'width_state': 24, 'lr': 0.0016318500953017032, 'padding_heal': 6, 'padding_state': 16, 'optimizer_type': 'lbfgs'}. Best is trial 1091 with value: 0.0009798490209504962.
[I 2025-07-30 22:39:36,509] Trial 1257 finished with value: 0.009125212207436562 and parameters: {'width_NN_heal': 490, 'width_NN_state': 289, 'depth_NN_heal': 2, 'depth_NN_state': 3, 'mode_heal': 60, 'mode_state': 64, 'blocks_heal': 8, 'blocks_state': 3, 'lift_act_state': <built-in function gelu>, 'block_act_state': <built-in function gelu>, 'lift_act_heal': <function tanh at 0x7ff3611b4cc0>, 'block_act_heal': None, 'width_heal': 32, 'width_state': 101, 'lr': 0.0001507815977750445, 'padding_heal': 5, 'padding_state': 16, 'optimizer_type': 'lbfgs'}. Best is trial 1091 with value: 0.0009798490209504962.
[I 2025-07-30 22:39:41,033] Trial 1258 finished with value: 0.013055484741926193 and parameters: {'width_NN_heal': 460, 'width_NN_state': 251, 'depth_NN_heal': 2, 'depth_NN_state': 3, 'mode_heal': 56, 'mode_state': 60, 'blocks_heal': 7, 'blocks_state': 3, 'lift_act_state': <built-in function gelu>, 'block_act_state': <built-in function gelu>, 'lift_act_heal': <function tanh at 0x7ff3611b4cc0>, 'block_act_heal': None, 'width_heal': 6, 'width_state': 26, 'lr': 0.0014685951092795752, 'padding_heal': 5, 'padding_state': 15, 'optimizer_type': 'lbfgs'}. Best is trial 1091 with value: 0.0009798490209504962.
[I 2025-07-30 22:39:45,648] Trial 1259 finished with value: 0.0011597865959629416 and parameters: {'width_NN_heal': 372, 'width_NN_state': 275, 'depth_NN_heal': 2, 'depth_NN_state': 3, 'mode_heal': 56, 'mode_state': 64, 'blocks_heal': 7, 'blocks_state': 3, 'lift_act_state': <built-in function gelu>, 'block_act_state': <built-in function gelu>, 'lift_act_heal': <function tanh at 0x7ff3611b4cc0>, 'block_act_heal': None, 'width_heal': 41, 'width_state': 54, 'lr': 0.0016973654826905186, 'padding_heal': 5, 'padding_state': 16, 'optimizer_type': 'lbfgs'}. Best is trial 1091 with value: 0.0009798490209504962.
[I 2025-07-30 22:39:50,230] Trial 1260 finished with value: 0.0014847801066935062 and parameters: {'width_NN_heal': 455, 'width_NN_state': 297, 'depth_NN_heal': 2, 'depth_NN_state': 3, 'mode_heal': 56, 'mode_state': 64, 'blocks_heal': 7, 'blocks_state': 3, 'lift_act_state': <built-in function gelu>, 'block_act_state': <built-in function gelu>, 'lift_act_heal': None, 'block_act_heal': None, 'width_heal': 33, 'width_state': 109, 'lr': 0.0018403131151892133, 'padding_heal': 5, 'padding_state': 16, 'optimizer_type': 'lbfgs'}. Best is trial 1091 with value: 0.0009798490209504962.
[I 2025-07-30 22:39:54,894] Trial 1261 finished with value: 0.0017328241374343634 and parameters: {'width_NN_heal': 394, 'width_NN_state': 261, 'depth_NN_heal': 2, 'depth_NN_state': 3, 'mode_heal': 56, 'mode_state': 64, 'blocks_heal': 7, 'blocks_state': 3, 'lift_act_state': None, 'block_act_state': <built-in function gelu>, 'lift_act_heal': <function tanh at 0x7ff3611b4cc0>, 'block_act_heal': None, 'width_heal': 37, 'width_state': 72, 'lr': 0.0013771600305556566, 'padding_heal': 27, 'padding_state': 16, 'optimizer_type': 'lbfgs'}. Best is trial 1091 with value: 0.0009798490209504962.
[I 2025-07-30 22:39:59,497] Trial 1262 finished with value: 0.0013555939076468349 and parameters: {'width_NN_heal': 362, 'width_NN_state': 303, 'depth_NN_heal': 2, 'depth_NN_state': 3, 'mode_heal': 56, 'mode_state': 64, 'blocks_heal': 7, 'blocks_state': 3, 'lift_act_state': <built-in function gelu>, 'block_act_state': <built-in function gelu>, 'lift_act_heal': <function tanh at 0x7ff3611b4cc0>, 'block_act_heal': None, 'width_heal': 43, 'width_state': 60, 'lr': 0.0015791189414296372, 'padding_heal': 5, 'padding_state': 17, 'optimizer_type': 'lbfgs'}. Best is trial 1091 with value: 0.0009798490209504962.
[I 2025-07-30 22:40:03,850] Trial 1263 finished with value: 0.0012650974094867706 and parameters: {'width_NN_heal': 428, 'width_NN_state': 242, 'depth_NN_heal': 2, 'depth_NN_state': 3, 'mode_heal': 56, 'mode_state': 64, 'blocks_heal': 7, 'blocks_state': 2, 'lift_act_state': <built-in function gelu>, 'block_act_state': <built-in function gelu>, 'lift_act_heal': <function tanh at 0x7ff3611b4cc0>, 'block_act_heal': None, 'width_heal': 39, 'width_state': 21, 'lr': 0.0014529345327677571, 'padding_heal': 6, 'padding_state': 17, 'optimizer_type': 'lbfgs'}. Best is trial 1091 with value: 0.0009798490209504962.
[I 2025-07-30 22:40:08,355] Trial 1264 finished with value: 0.00139431725256145 and parameters: {'width_NN_heal': 194, 'width_NN_state': 296, 'depth_NN_heal': 1, 'depth_NN_state': 3, 'mode_heal': 56, 'mode_state': 64, 'blocks_heal': 7, 'blocks_state': 3, 'lift_act_state': <built-in function gelu>, 'block_act_state': <built-in function gelu>, 'lift_act_heal': <function tanh at 0x7ff3611b4cc0>, 'block_act_heal': None, 'width_heal': 35, 'width_state': 79, 'lr': 0.001832514581481521, 'padding_heal': 6, 'padding_state': 14, 'optimizer_type': 'lbfgs'}. Best is trial 1091 with value: 0.0009798490209504962.
[I 2025-07-30 22:40:13,884] Trial 1265 finished with value: 0.0011630409862846136 and parameters: {'width_NN_heal': 356, 'width_NN_state': 267, 'depth_NN_heal': 5, 'depth_NN_state': 3, 'mode_heal': 56, 'mode_state': 60, 'blocks_heal': 7, 'blocks_state': 3, 'lift_act_state': <built-in function gelu>, 'block_act_state': <built-in function gelu>, 'lift_act_heal': <function tanh at 0x7ff3611b4cc0>, 'block_act_heal': None, 'width_heal': 32, 'width_state': 94, 'lr': 0.0013298835739786394, 'padding_heal': 6, 'padding_state': 16, 'optimizer_type': 'lbfgs'}. Best is trial 1091 with value: 0.0009798490209504962.
