[I 2025-07-30 21:17:45,248] Trial 248 finished with value: 0.002226551529020071 and parameters: {'width_NN_heal': 50, 'width_NN_state': 34, 'depth_NN_heal': 1, 'depth_NN_state': 6, 'mode_heal': 48, 'mode_state': 64, 'blocks_heal': 8, 'blocks_state': 5, 'lift_act_state': <function tanh at 0x7ff3611b4cc0>, 'block_act_state': <built-in function gelu>, 'lift_act_heal': <built-in function gelu>, 'block_act_heal': <built-in function gelu>, 'width_heal': 47, 'width_state': 12, 'lr': 0.0025205568592241096, 'padding_heal': 7, 'padding_state': 16, 'optimizer_type': 'adam'}. Best is trial 174 with value: 0.001268339459784329.
[I 2025-07-30 21:17:51,393] Trial 249 finished with value: 0.001620295224711299 and parameters: {'width_NN_heal': 65, 'width_NN_state': 31, 'depth_NN_heal': 7, 'depth_NN_state': 6, 'mode_heal': 48, 'mode_state': 64, 'blocks_heal': 8, 'blocks_state': 5, 'lift_act_state': <function tanh at 0x7ff3611b4cc0>, 'block_act_state': <built-in function gelu>, 'lift_act_heal': <built-in function gelu>, 'block_act_heal': <built-in function gelu>, 'width_heal': 57, 'width_state': 12, 'lr': 0.0028181731928225776, 'padding_heal': 9, 'padding_state': 15, 'optimizer_type': 'adam'}. Best is trial 174 with value: 0.001268339459784329.
[I 2025-07-30 21:17:57,343] Trial 250 finished with value: 0.001779950805939734 and parameters: {'width_NN_heal': 69, 'width_NN_state': 34, 'depth_NN_heal': 3, 'depth_NN_state': 7, 'mode_heal': 48, 'mode_state': 64, 'blocks_heal': 8, 'blocks_state': 5, 'lift_act_state': <function tanh at 0x7ff3611b4cc0>, 'block_act_state': <built-in function gelu>, 'lift_act_heal': <built-in function gelu>, 'block_act_heal': <built-in function gelu>, 'width_heal': 51, 'width_state': 13, 'lr': 0.0027535091888711487, 'padding_heal': 10, 'padding_state': 17, 'optimizer_type': 'adam'}. Best is trial 174 with value: 0.001268339459784329.
[I 2025-07-30 21:18:03,067] Trial 251 finished with value: 0.002300706459209323 and parameters: {'width_NN_heal': 53, 'width_NN_state': 29, 'depth_NN_heal': 2, 'depth_NN_state': 6, 'mode_heal': 48, 'mode_state': 64, 'blocks_heal': 8, 'blocks_state': 5, 'lift_act_state': <function tanh at 0x7ff3611b4cc0>, 'block_act_state': <built-in function gelu>, 'lift_act_heal': <built-in function gelu>, 'block_act_heal': <function tanh at 0x7ff3611b4cc0>, 'width_heal': 44, 'width_state': 15, 'lr': 0.0034632228528496544, 'padding_heal': 8, 'padding_state': 16, 'optimizer_type': 'adam'}. Best is trial 174 with value: 0.001268339459784329.
[I 2025-07-30 21:18:08,666] Trial 252 finished with value: 0.001940661808475852 and parameters: {'width_NN_heal': 57, 'width_NN_state': 23, 'depth_NN_heal': 1, 'depth_NN_state': 5, 'mode_heal': 52, 'mode_state': 60, 'blocks_heal': 8, 'blocks_state': 5, 'lift_act_state': <function tanh at 0x7ff3611b4cc0>, 'block_act_state': <built-in function gelu>, 'lift_act_heal': <built-in function gelu>, 'block_act_heal': <built-in function gelu>, 'width_heal': 54, 'width_state': 13, 'lr': 0.0020362470087065955, 'padding_heal': 7, 'padding_state': 16, 'optimizer_type': 'adam'}. Best is trial 174 with value: 0.001268339459784329.
[I 2025-07-30 21:18:12,533] Trial 253 finished with value: 0.0016651846235617995 and parameters: {'width_NN_heal': 45, 'width_NN_state': 36, 'depth_NN_heal': 2, 'depth_NN_state': 6, 'mode_heal': 52, 'mode_state': 64, 'blocks_heal': 2, 'blocks_state': 5, 'lift_act_state': <function tanh at 0x7ff3611b4cc0>, 'block_act_state': <built-in function gelu>, 'lift_act_heal': <built-in function gelu>, 'block_act_heal': <built-in function gelu>, 'width_heal': 59, 'width_state': 4, 'lr': 0.0024760879151092077, 'padding_heal': 14, 'padding_state': 17, 'optimizer_type': 'adam'}. Best is trial 174 with value: 0.001268339459784329.
[I 2025-07-30 21:18:18,554] Trial 254 finished with value: 0.0035899414215236902 and parameters: {'width_NN_heal': 41, 'width_NN_state': 27, 'depth_NN_heal': 8, 'depth_NN_state': 6, 'mode_heal': 60, 'mode_state': 64, 'blocks_heal': 8, 'blocks_state': 5, 'lift_act_state': <function tanh at 0x7ff3611b4cc0>, 'block_act_state': None, 'lift_act_heal': <built-in function gelu>, 'block_act_heal': <built-in function gelu>, 'width_heal': 36, 'width_state': 11, 'lr': 0.005160662485264821, 'padding_heal': 15, 'padding_state': 15, 'optimizer_type': 'adam'}. Best is trial 174 with value: 0.001268339459784329.
[I 2025-07-30 21:18:24,788] Trial 255 finished with value: 0.03074425831437111 and parameters: {'width_NN_heal': 9, 'width_NN_state': 171, 'depth_NN_heal': 8, 'depth_NN_state': 6, 'mode_heal': 52, 'mode_state': 60, 'blocks_heal': 8, 'blocks_state': 5, 'lift_act_state': <built-in function gelu>, 'block_act_state': <built-in function gelu>, 'lift_act_heal': <built-in function gelu>, 'block_act_heal': <built-in function gelu>, 'width_heal': 41, 'width_state': 10, 'lr': 0.0029152001575745304, 'padding_heal': 12, 'padding_state': 16, 'optimizer_type': 'adam'}. Best is trial 174 with value: 0.001268339459784329.
[I 2025-07-30 21:18:30,276] Trial 256 finished with value: 0.0015277700731530786 and parameters: {'width_NN_heal': 50, 'width_NN_state': 33, 'depth_NN_heal': 7, 'depth_NN_state': 5, 'mode_heal': 48, 'mode_state': 56, 'blocks_heal': 6, 'blocks_state': 5, 'lift_act_state': <function tanh at 0x7ff3611b4cc0>, 'block_act_state': <built-in function gelu>, 'lift_act_heal': <built-in function gelu>, 'block_act_heal': <built-in function gelu>, 'width_heal': 47, 'width_state': 7, 'lr': 0.004505901485013013, 'padding_heal': 14, 'padding_state': 17, 'optimizer_type': 'adam'}. Best is trial 174 with value: 0.001268339459784329.
[I 2025-07-30 21:18:36,460] Trial 257 finished with value: 0.0019183431286364794 and parameters: {'width_NN_heal': 39, 'width_NN_state': 30, 'depth_NN_heal': 8, 'depth_NN_state': 6, 'mode_heal': 48, 'mode_state': 64, 'blocks_heal': 8, 'blocks_state': 5, 'lift_act_state': <function tanh at 0x7ff3611b4cc0>, 'block_act_state': <built-in function gelu>, 'lift_act_heal': <built-in function gelu>, 'block_act_heal': <built-in function gelu>, 'width_heal': 17, 'width_state': 22, 'lr': 0.0036547407802900358, 'padding_heal': 8, 'padding_state': 30, 'optimizer_type': 'adam'}. Best is trial 174 with value: 0.001268339459784329.
[I 2025-07-30 21:18:42,617] Trial 258 finished with value: 0.0013204974820837379 and parameters: {'width_NN_heal': 59, 'width_NN_state': 25, 'depth_NN_heal': 8, 'depth_NN_state': 6, 'mode_heal': 40, 'mode_state': 56, 'blocks_heal': 8, 'blocks_state': 5, 'lift_act_state': <function tanh at 0x7ff3611b4cc0>, 'block_act_state': <built-in function gelu>, 'lift_act_heal': <function tanh at 0x7ff3611b4cc0>, 'block_act_heal': <built-in function gelu>, 'width_heal': 65, 'width_state': 16, 'lr': 0.0023511327186411086, 'padding_heal': 13, 'padding_state': 25, 'optimizer_type': 'adam'}. Best is trial 174 with value: 0.001268339459784329.
[I 2025-07-30 21:18:48,352] Trial 259 finished with value: 0.0019573569297790527 and parameters: {'width_NN_heal': 58, 'width_NN_state': 21, 'depth_NN_heal': 3, 'depth_NN_state': 6, 'mode_heal': 40, 'mode_state': 56, 'blocks_heal': 8, 'blocks_state': 5, 'lift_act_state': <function tanh at 0x7ff3611b4cc0>, 'block_act_state': <built-in function gelu>, 'lift_act_heal': <function tanh at 0x7ff3611b4cc0>, 'block_act_heal': <built-in function gelu>, 'width_heal': 63, 'width_state': 17, 'lr': 0.0019121953292996609, 'padding_heal': 13, 'padding_state': 30, 'optimizer_type': 'adam'}. Best is trial 174 with value: 0.001268339459784329.
[I 2025-07-30 21:18:54,523] Trial 260 finished with value: 0.0016672401688992977 and parameters: {'width_NN_heal': 64, 'width_NN_state': 25, 'depth_NN_heal': 8, 'depth_NN_state': 6, 'mode_heal': 36, 'mode_state': 56, 'blocks_heal': 8, 'blocks_state': 5, 'lift_act_state': <function tanh at 0x7ff3611b4cc0>, 'block_act_state': <built-in function gelu>, 'lift_act_heal': <function tanh at 0x7ff3611b4cc0>, 'block_act_heal': <built-in function gelu>, 'width_heal': 71, 'width_state': 15, 'lr': 0.002230081704858105, 'padding_heal': 15, 'padding_state': 25, 'optimizer_type': 'adam'}. Best is trial 174 with value: 0.001268339459784329.
[I 2025-07-30 21:19:00,729] Trial 261 finished with value: 0.001613885397091508 and parameters: {'width_NN_heal': 60, 'width_NN_state': 40, 'depth_NN_heal': 8, 'depth_NN_state': 6, 'mode_heal': 40, 'mode_state': 56, 'blocks_heal': 8, 'blocks_state': 5, 'lift_act_state': <function tanh at 0x7ff3611b4cc0>, 'block_act_state': <built-in function gelu>, 'lift_act_heal': <function tanh at 0x7ff3611b4cc0>, 'block_act_heal': <built-in function gelu>, 'width_heal': 66, 'width_state': 15, 'lr': 0.0025292551243360235, 'padding_heal': 10, 'padding_state': 23, 'optimizer_type': 'adam'}. Best is trial 174 with value: 0.001268339459784329.
[I 2025-07-30 21:19:06,814] Trial 262 finished with value: 0.0016572210006415844 and parameters: {'width_NN_heal': 53, 'width_NN_state': 73, 'depth_NN_heal': 7, 'depth_NN_state': 7, 'mode_heal': 40, 'mode_state': 60, 'blocks_heal': 8, 'blocks_state': 5, 'lift_act_state': None, 'block_act_state': <built-in function gelu>, 'lift_act_heal': <function tanh at 0x7ff3611b4cc0>, 'block_act_heal': None, 'width_heal': 60, 'width_state': 16, 'lr': 0.002393421590215813, 'padding_heal': 14, 'padding_state': 20, 'optimizer_type': 'adam'}. Best is trial 174 with value: 0.001268339459784329.
[I 2025-07-30 21:19:13,129] Trial 263 finished with value: 0.001799401012249291 and parameters: {'width_NN_heal': 49, 'width_NN_state': 100, 'depth_NN_heal': 8, 'depth_NN_state': 6, 'mode_heal': 36, 'mode_state': 56, 'blocks_heal': 8, 'blocks_state': 5, 'lift_act_state': <function tanh at 0x7ff3611b4cc0>, 'block_act_state': <built-in function gelu>, 'lift_act_heal': <function tanh at 0x7ff3611b4cc0>, 'block_act_heal': <built-in function gelu>, 'width_heal': 53, 'width_state': 14, 'lr': 0.002092349252315651, 'padding_heal': 15, 'padding_state': 14, 'optimizer_type': 'adam'}. Best is trial 174 with value: 0.001268339459784329.
[I 2025-07-30 21:19:19,156] Trial 264 finished with value: 0.0031226081773638725 and parameters: {'width_NN_heal': 70, 'width_NN_state': 37, 'depth_NN_heal': 7, 'depth_NN_state': 6, 'mode_heal': 60, 'mode_state': 56, 'blocks_heal': 8, 'blocks_state': 5, 'lift_act_state': <function tanh at 0x7ff3611b4cc0>, 'block_act_state': <function tanh at 0x7ff3611b4cc0>, 'lift_act_heal': <built-in function gelu>, 'block_act_heal': <built-in function gelu>, 'width_heal': 56, 'width_state': 18, 'lr': 0.0008808353208834972, 'padding_heal': 13, 'padding_state': 24, 'optimizer_type': 'adam'}. Best is trial 174 with value: 0.001268339459784329.
[I 2025-07-30 21:19:25,390] Trial 265 finished with value: 0.0021483751479536295 and parameters: {'width_NN_heal': 45, 'width_NN_state': 19, 'depth_NN_heal': 8, 'depth_NN_state': 6, 'mode_heal': 40, 'mode_state': 56, 'blocks_heal': 8, 'blocks_state': 5, 'lift_act_state': <function tanh at 0x7ff3611b4cc0>, 'block_act_state': <built-in function gelu>, 'lift_act_heal': <built-in function gelu>, 'block_act_heal': <built-in function gelu>, 'width_heal': 63, 'width_state': 24, 'lr': 0.0027538962709569652, 'padding_heal': 15, 'padding_state': 21, 'optimizer_type': 'lbfgs'}. Best is trial 174 with value: 0.001268339459784329.
[I 2025-07-30 21:19:31,651] Trial 266 finished with value: 0.0017284785863012075 and parameters: {'width_NN_heal': 11, 'width_NN_state': 43, 'depth_NN_heal': 8, 'depth_NN_state': 6, 'mode_heal': 40, 'mode_state': 52, 'blocks_heal': 8, 'blocks_state': 5, 'lift_act_state': <function tanh at 0x7ff3611b4cc0>, 'block_act_state': <built-in function gelu>, 'lift_act_heal': <built-in function gelu>, 'block_act_heal': <built-in function gelu>, 'width_heal': 29, 'width_state': 21, 'lr': 0.002953589780922965, 'padding_heal': 14, 'padding_state': 17, 'optimizer_type': 'adam'}. Best is trial 174 with value: 0.001268339459784329.
[I 2025-07-30 21:19:38,041] Trial 267 finished with value: 0.001612138468772173 and parameters: {'width_NN_heal': 58, 'width_NN_state': 26, 'depth_NN_heal': 8, 'depth_NN_state': 6, 'mode_heal': 40, 'mode_state': 56, 'blocks_heal': 8, 'blocks_state': 5, 'lift_act_state': <function tanh at 0x7ff3611b4cc0>, 'block_act_state': <built-in function gelu>, 'lift_act_heal': <built-in function gelu>, 'block_act_heal': <built-in function gelu>, 'width_heal': 50, 'width_state': 13, 'lr': 0.002316724656999149, 'padding_heal': 19, 'padding_state': 19, 'optimizer_type': 'adam'}. Best is trial 174 with value: 0.001268339459784329.
[I 2025-07-30 21:19:44,086] Trial 268 finished with value: 0.0018619897309690714 and parameters: {'width_NN_heal': 42, 'width_NN_state': 22, 'depth_NN_heal': 8, 'depth_NN_state': 6, 'mode_heal': 44, 'mode_state': 52, 'blocks_heal': 8, 'blocks_state': 4, 'lift_act_state': <function tanh at 0x7ff3611b4cc0>, 'block_act_state': <built-in function gelu>, 'lift_act_heal': <function tanh at 0x7ff3611b4cc0>, 'block_act_heal': <built-in function gelu>, 'width_heal': 38, 'width_state': 16, 'lr': 0.002644703858793391, 'padding_heal': 11, 'padding_state': 16, 'optimizer_type': 'adam'}. Best is trial 174 with value: 0.001268339459784329.
[I 2025-07-30 21:19:49,109] Trial 269 finished with value: 0.0016573600005358458 and parameters: {'width_NN_heal': 55, 'width_NN_state': 32, 'depth_NN_heal': 8, 'depth_NN_state': 6, 'mode_heal': 60, 'mode_state': 60, 'blocks_heal': 4, 'blocks_state': 5, 'lift_act_state': <function tanh at 0x7ff3611b4cc0>, 'block_act_state': <built-in function gelu>, 'lift_act_heal': <built-in function gelu>, 'block_act_heal': <built-in function gelu>, 'width_heal': 57, 'width_state': 11, 'lr': 0.0033600619902529666, 'padding_heal': 9, 'padding_state': 31, 'optimizer_type': 'adam'}. Best is trial 174 with value: 0.001268339459784329.
[I 2025-07-30 21:19:55,326] Trial 270 finished with value: 0.0018556347349658608 and parameters: {'width_NN_heal': 48, 'width_NN_state': 35, 'depth_NN_heal': 8, 'depth_NN_state': 6, 'mode_heal': 60, 'mode_state': 60, 'blocks_heal': 8, 'blocks_state': 5, 'lift_act_state': <function tanh at 0x7ff3611b4cc0>, 'block_act_state': <built-in function gelu>, 'lift_act_heal': <built-in function gelu>, 'block_act_heal': <built-in function gelu>, 'width_heal': 32, 'width_state': 6, 'lr': 0.0029459889812377075, 'padding_heal': 28, 'padding_state': 30, 'optimizer_type': 'adam'}. Best is trial 174 with value: 0.001268339459784329.
[I 2025-07-30 21:20:01,312] Trial 271 finished with value: 0.0016194575000554323 and parameters: {'width_NN_heal': 38, 'width_NN_state': 30, 'depth_NN_heal': 7, 'depth_NN_state': 5, 'mode_heal': 44, 'mode_state': 56, 'blocks_heal': 8, 'blocks_state': 5, 'lift_act_state': <function tanh at 0x7ff3611b4cc0>, 'block_act_state': <built-in function gelu>, 'lift_act_heal': <built-in function gelu>, 'block_act_heal': <built-in function gelu>, 'width_heal': 69, 'width_state': 14, 'lr': 0.002641633406089141, 'padding_heal': 8, 'padding_state': 31, 'optimizer_type': 'adam'}. Best is trial 174 with value: 0.001268339459784329.
[I 2025-07-30 21:20:06,818] Trial 272 finished with value: 0.018842464312911034 and parameters: {'width_NN_heal': 51, 'width_NN_state': 24, 'depth_NN_heal': 8, 'depth_NN_state': 8, 'mode_heal': 64, 'mode_state': 52, 'blocks_heal': 5, 'blocks_state': 5, 'lift_act_state': <function tanh at 0x7ff3611b4cc0>, 'block_act_state': <built-in function gelu>, 'lift_act_heal': <built-in function gelu>, 'block_act_heal': <function tanh at 0x7ff3611b4cc0>, 'width_heal': 53, 'width_state': 12, 'lr': 0.004100314129715961, 'padding_heal': 20, 'padding_state': 29, 'optimizer_type': 'adam'}. Best is trial 174 with value: 0.001268339459784329.
[I 2025-07-30 21:20:13,060] Trial 273 finished with value: 0.0018538919975981116 and parameters: {'width_NN_heal': 10, 'width_NN_state': 61, 'depth_NN_heal': 8, 'depth_NN_state': 6, 'mode_heal': 36, 'mode_state': 52, 'blocks_heal': 8, 'blocks_state': 5, 'lift_act_state': <function tanh at 0x7ff3611b4cc0>, 'block_act_state': <built-in function gelu>, 'lift_act_heal': <built-in function gelu>, 'block_act_heal': <built-in function gelu>, 'width_heal': 47, 'width_state': 20, 'lr': 0.0017675772803585855, 'padding_heal': 13, 'padding_state': 17, 'optimizer_type': 'adam'}. Best is trial 174 with value: 0.001268339459784329.
[I 2025-07-30 21:20:19,210] Trial 274 finished with value: 0.0019857825245708227 and parameters: {'width_NN_heal': 104, 'width_NN_state': 39, 'depth_NN_heal': 7, 'depth_NN_state': 6, 'mode_heal': 40, 'mode_state': 48, 'blocks_heal': 8, 'blocks_state': 5, 'lift_act_state': <function tanh at 0x7ff3611b4cc0>, 'block_act_state': <built-in function gelu>, 'lift_act_heal': <built-in function gelu>, 'block_act_heal': <built-in function gelu>, 'width_heal': 42, 'width_state': 19, 'lr': 0.0033034535974428873, 'padding_heal': 6, 'padding_state': 16, 'optimizer_type': 'adam'}. Best is trial 174 with value: 0.001268339459784329.
[I 2025-07-30 21:20:25,334] Trial 275 finished with value: 0.0015689389547333121 and parameters: {'width_NN_heal': 88, 'width_NN_state': 33, 'depth_NN_heal': 8, 'depth_NN_state': 6, 'mode_heal': 48, 'mode_state': 56, 'blocks_heal': 8, 'blocks_state': 5, 'lift_act_state': <function tanh at 0x7ff3611b4cc0>, 'block_act_state': <built-in function gelu>, 'lift_act_heal': <built-in function gelu>, 'block_act_heal': <built-in function gelu>, 'width_heal': 60, 'width_state': 9, 'lr': 0.0024203606903134283, 'padding_heal': 9, 'padding_state': 15, 'optimizer_type': 'adam'}. Best is trial 174 with value: 0.001268339459784329.
[I 2025-07-30 21:20:30,532] Trial 276 finished with value: 0.030742455273866653 and parameters: {'width_NN_heal': 35, 'width_NN_state': 27, 'depth_NN_heal': 4, 'depth_NN_state': 7, 'mode_heal': 64, 'mode_state': 52, 'blocks_heal': 7, 'blocks_state': 4, 'lift_act_state': <built-in function gelu>, 'block_act_state': None, 'lift_act_heal': <built-in function gelu>, 'block_act_heal': <built-in function gelu>, 'width_heal': 34, 'width_state': 10, 'lr': 0.0029977179578479073, 'padding_heal': 10, 'padding_state': 23, 'optimizer_type': 'adam'}. Best is trial 174 with value: 0.001268339459784329.
[I 2025-07-30 21:20:36,855] Trial 277 finished with value: 0.002270330907776952 and parameters: {'width_NN_heal': 61, 'width_NN_state': 81, 'depth_NN_heal': 8, 'depth_NN_state': 6, 'mode_heal': 52, 'mode_state': 52, 'blocks_heal': 8, 'blocks_state': 5, 'lift_act_state': <function tanh at 0x7ff3611b4cc0>, 'block_act_state': <built-in function gelu>, 'lift_act_heal': <built-in function gelu>, 'block_act_heal': <built-in function gelu>, 'width_heal': 49, 'width_state': 80, 'lr': 0.0014234111457911648, 'padding_heal': 7, 'padding_state': 27, 'optimizer_type': 'adam'}. Best is trial 174 with value: 0.001268339459784329.
[I 2025-07-30 21:20:43,142] Trial 278 finished with value: 0.001667070435360074 and parameters: {'width_NN_heal': 155, 'width_NN_state': 70, 'depth_NN_heal': 8, 'depth_NN_state': 6, 'mode_heal': 44, 'mode_state': 56, 'blocks_heal': 8, 'blocks_state': 5, 'lift_act_state': <function tanh at 0x7ff3611b4cc0>, 'block_act_state': <built-in function gelu>, 'lift_act_heal': <function tanh at 0x7ff3611b4cc0>, 'block_act_heal': <built-in function gelu>, 'width_heal': 77, 'width_state': 17, 'lr': 0.0037087383686952185, 'padding_heal': 16, 'padding_state': 32, 'optimizer_type': 'adam'}. Best is trial 174 with value: 0.001268339459784329.
[I 2025-07-30 21:20:48,226] Trial 279 finished with value: 0.003546367632225156 and parameters: {'width_NN_heal': 9, 'width_NN_state': 30, 'depth_NN_heal': 8, 'depth_NN_state': 6, 'mode_heal': 40, 'mode_state': 60, 'blocks_heal': 8, 'blocks_state': 1, 'lift_act_state': <function tanh at 0x7ff3611b4cc0>, 'block_act_state': <built-in function gelu>, 'lift_act_heal': <built-in function gelu>, 'block_act_heal': <built-in function gelu>, 'width_heal': 37, 'width_state': 13, 'lr': 0.0021871357281400485, 'padding_heal': 14, 'padding_state': 25, 'optimizer_type': 'adam'}. Best is trial 174 with value: 0.001268339459784329.
[I 2025-07-30 21:20:54,329] Trial 280 finished with value: 0.001839318429119885 and parameters: {'width_NN_heal': 44, 'width_NN_state': 37, 'depth_NN_heal': 7, 'depth_NN_state': 6, 'mode_heal': 44, 'mode_state': 48, 'blocks_heal': 8, 'blocks_state': 5, 'lift_act_state': <function tanh at 0x7ff3611b4cc0>, 'block_act_state': <built-in function gelu>, 'lift_act_heal': <built-in function gelu>, 'block_act_heal': <built-in function gelu>, 'width_heal': 25, 'width_state': 14, 'lr': 0.0026957323757735713, 'padding_heal': 8, 'padding_state': 30, 'optimizer_type': 'adam'}. Best is trial 174 with value: 0.001268339459784329.
[I 2025-07-30 21:21:00,397] Trial 281 finished with value: 0.00153104099445045 and parameters: {'width_NN_heal': 46, 'width_NN_state': 34, 'depth_NN_heal': 8, 'depth_NN_state': 6, 'mode_heal': 20, 'mode_state': 52, 'blocks_heal': 8, 'blocks_state': 5, 'lift_act_state': <function tanh at 0x7ff3611b4cc0>, 'block_act_state': <built-in function gelu>, 'lift_act_heal': None, 'block_act_heal': <built-in function gelu>, 'width_heal': 45, 'width_state': 26, 'lr': 0.0034272906702239397, 'padding_heal': 32, 'padding_state': 29, 'optimizer_type': 'adam'}. Best is trial 174 with value: 0.001268339459784329.
[I 2025-07-30 21:21:06,606] Trial 282 finished with value: 0.001648966921493411 and parameters: {'width_NN_heal': 8, 'width_NN_state': 28, 'depth_NN_heal': 7, 'depth_NN_state': 6, 'mode_heal': 48, 'mode_state': 56, 'blocks_heal': 8, 'blocks_state': 5, 'lift_act_state': <function tanh at 0x7ff3611b4cc0>, 'block_act_state': <built-in function gelu>, 'lift_act_heal': <built-in function gelu>, 'block_act_heal': <built-in function gelu>, 'width_heal': 53, 'width_state': 12, 'lr': 0.0030540789961864792, 'padding_heal': 7, 'padding_state': 31, 'optimizer_type': 'adam'}. Best is trial 174 with value: 0.001268339459784329.
