[I 2025-07-30 23:38:47,844] Trial 1950 finished with value: 0.0010681209387257695 and parameters: {'width_NN_heal': 256, 'width_NN_state': 291, 'depth_NN_heal': 2, 'depth_NN_state': 3, 'mode_heal': 64, 'mode_state': 60, 'blocks_heal': 8, 'blocks_state': 3, 'lift_act_state': <built-in function gelu>, 'block_act_state': <built-in function gelu>, 'lift_act_heal': <built-in function gelu>, 'block_act_heal': None, 'width_heal': 67, 'width_state': 104, 'lr': 0.0016749418026119486, 'padding_heal': 5, 'padding_state': 19, 'optimizer_type': 'lbfgs'}. Best is trial 1511 with value: 0.0009640019852668047.
[I 2025-07-30 23:38:52,564] Trial 1951 finished with value: 0.002709409687668085 and parameters: {'width_NN_heal': 387, 'width_NN_state': 325, 'depth_NN_heal': 2, 'depth_NN_state': 3, 'mode_heal': 64, 'mode_state': 60, 'blocks_heal': 7, 'blocks_state': 3, 'lift_act_state': <function tanh at 0x7ff3611b4cc0>, 'block_act_state': <built-in function gelu>, 'lift_act_heal': <built-in function gelu>, 'block_act_heal': None, 'width_heal': 33, 'width_state': 88, 'lr': 0.0024687921738201263, 'padding_heal': 4, 'padding_state': 16, 'optimizer_type': 'lbfgs'}. Best is trial 1511 with value: 0.0009640019852668047.
[I 2025-07-30 23:38:56,447] Trial 1952 finished with value: 0.0011657032882794738 and parameters: {'width_NN_heal': 419, 'width_NN_state': 275, 'depth_NN_heal': 2, 'depth_NN_state': 3, 'mode_heal': 64, 'mode_state': 52, 'blocks_heal': 3, 'blocks_state': 3, 'lift_act_state': <built-in function gelu>, 'block_act_state': <built-in function gelu>, 'lift_act_heal': <built-in function gelu>, 'block_act_heal': None, 'width_heal': 56, 'width_state': 113, 'lr': 0.002105855144363145, 'padding_heal': 4, 'padding_state': 18, 'optimizer_type': 'lbfgs'}. Best is trial 1511 with value: 0.0009640019852668047.
[I 2025-07-30 23:39:01,768] Trial 1953 finished with value: 0.0011326621752232313 and parameters: {'width_NN_heal': 214, 'width_NN_state': 463, 'depth_NN_heal': 2, 'depth_NN_state': 3, 'mode_heal': 64, 'mode_state': 36, 'blocks_heal': 8, 'blocks_state': 4, 'lift_act_state': <built-in function gelu>, 'block_act_state': <built-in function gelu>, 'lift_act_heal': <built-in function gelu>, 'block_act_heal': None, 'width_heal': 37, 'width_state': 128, 'lr': 0.0017541358520443107, 'padding_heal': 5, 'padding_state': 17, 'optimizer_type': 'lbfgs'}. Best is trial 1511 with value: 0.0009640019852668047.
[I 2025-07-30 23:39:06,782] Trial 1954 finished with value: 0.0011909323511645198 and parameters: {'width_NN_heal': 302, 'width_NN_state': 247, 'depth_NN_heal': 2, 'depth_NN_state': 3, 'mode_heal': 64, 'mode_state': 60, 'blocks_heal': 8, 'blocks_state': 3, 'lift_act_state': <built-in function gelu>, 'block_act_state': <built-in function gelu>, 'lift_act_heal': <built-in function gelu>, 'block_act_heal': None, 'width_heal': 51, 'width_state': 99, 'lr': 0.0016721164562848163, 'padding_heal': 3, 'padding_state': 16, 'optimizer_type': 'lbfgs'}. Best is trial 1511 with value: 0.0009640019852668047.
[I 2025-07-30 23:39:11,355] Trial 1955 finished with value: 0.0011572925141081214 and parameters: {'width_NN_heal': 466, 'width_NN_state': 337, 'depth_NN_heal': 1, 'depth_NN_state': 3, 'mode_heal': 64, 'mode_state': 60, 'blocks_heal': 7, 'blocks_state': 3, 'lift_act_state': <built-in function gelu>, 'block_act_state': <built-in function gelu>, 'lift_act_heal': <built-in function gelu>, 'block_act_heal': None, 'width_heal': 63, 'width_state': 119, 'lr': 0.0019264766807710585, 'padding_heal': 6, 'padding_state': 16, 'optimizer_type': 'lbfgs'}. Best is trial 1511 with value: 0.0009640019852668047.
[I 2025-07-30 23:39:15,988] Trial 1956 finished with value: 0.0021554159466177225 and parameters: {'width_NN_heal': 375, 'width_NN_state': 291, 'depth_NN_heal': 2, 'depth_NN_state': 3, 'mode_heal': 64, 'mode_state': 48, 'blocks_heal': 7, 'blocks_state': 3, 'lift_act_state': <built-in function gelu>, 'block_act_state': <function tanh at 0x7ff3611b4cc0>, 'lift_act_heal': <built-in function gelu>, 'block_act_heal': None, 'width_heal': 34, 'width_state': 111, 'lr': 0.0023729774433987037, 'padding_heal': 4, 'padding_state': 15, 'optimizer_type': 'lbfgs'}. Best is trial 1511 with value: 0.0009640019852668047.
[I 2025-07-30 23:39:20,532] Trial 1957 finished with value: 0.002673373557627201 and parameters: {'width_NN_heal': 409, 'width_NN_state': 306, 'depth_NN_heal': 2, 'depth_NN_state': 2, 'mode_heal': 32, 'mode_state': 40, 'blocks_heal': 7, 'blocks_state': 3, 'lift_act_state': None, 'block_act_state': <built-in function gelu>, 'lift_act_heal': None, 'block_act_heal': None, 'width_heal': 31, 'width_state': 93, 'lr': 0.0015842108671372476, 'padding_heal': 2, 'padding_state': 19, 'optimizer_type': 'adam'}. Best is trial 1511 with value: 0.0009640019852668047.
[I 2025-07-30 23:39:25,339] Trial 1958 finished with value: 0.0012655664468184114 and parameters: {'width_NN_heal': 440, 'width_NN_state': 355, 'depth_NN_heal': 2, 'depth_NN_state': 3, 'mode_heal': 64, 'mode_state': 52, 'blocks_heal': 6, 'blocks_state': 3, 'lift_act_state': <built-in function gelu>, 'block_act_state': <built-in function gelu>, 'lift_act_heal': <built-in function gelu>, 'block_act_heal': None, 'width_heal': 55, 'width_state': 105, 'lr': 0.0018387131983106204, 'padding_heal': 5, 'padding_state': 17, 'optimizer_type': 'lbfgs'}. Best is trial 1511 with value: 0.0009640019852668047.
[I 2025-07-30 23:39:30,592] Trial 1959 finished with value: 0.0013249058974906802 and parameters: {'width_NN_heal': 391, 'width_NN_state': 268, 'depth_NN_heal': 3, 'depth_NN_state': 3, 'mode_heal': 64, 'mode_state': 16, 'blocks_heal': 8, 'blocks_state': 3, 'lift_act_state': <built-in function gelu>, 'block_act_state': <built-in function gelu>, 'lift_act_heal': <built-in function gelu>, 'block_act_heal': None, 'width_heal': 38, 'width_state': 97, 'lr': 0.0021737243422580935, 'padding_heal': 3, 'padding_state': 18, 'optimizer_type': 'lbfgs'}. Best is trial 1511 with value: 0.0009640019852668047.
[I 2025-07-30 23:39:35,810] Trial 1960 finished with value: 0.001489932299591601 and parameters: {'width_NN_heal': 474, 'width_NN_state': 323, 'depth_NN_heal': 2, 'depth_NN_state': 3, 'mode_heal': 64, 'mode_state': 60, 'blocks_heal': 8, 'blocks_state': 3, 'lift_act_state': <built-in function gelu>, 'block_act_state': <built-in function gelu>, 'lift_act_heal': <built-in function gelu>, 'block_act_heal': None, 'width_heal': 50, 'width_state': 119, 'lr': 0.001592236988510301, 'padding_heal': 4, 'padding_state': 15, 'optimizer_type': 'lbfgs'}. Best is trial 1511 with value: 0.0009640019852668047.
[I 2025-07-30 23:39:40,460] Trial 1961 finished with value: 0.0016471578273922205 and parameters: {'width_NN_heal': 12, 'width_NN_state': 305, 'depth_NN_heal': 2, 'depth_NN_state': 3, 'mode_heal': 60, 'mode_state': 60, 'blocks_heal': 7, 'blocks_state': 3, 'lift_act_state': <built-in function gelu>, 'block_act_state': None, 'lift_act_heal': <built-in function gelu>, 'block_act_heal': None, 'width_heal': 59, 'width_state': 86, 'lr': 0.002013330949758229, 'padding_heal': 6, 'padding_state': 17, 'optimizer_type': 'lbfgs'}. Best is trial 1511 with value: 0.0009640019852668047.
[I 2025-07-30 23:39:46,248] Trial 1962 finished with value: 0.001210085698403418 and parameters: {'width_NN_heal': 239, 'width_NN_state': 420, 'depth_NN_heal': 2, 'depth_NN_state': 3, 'mode_heal': 64, 'mode_state': 60, 'blocks_heal': 8, 'blocks_state': 3, 'lift_act_state': <built-in function gelu>, 'block_act_state': <built-in function gelu>, 'lift_act_heal': <built-in function gelu>, 'block_act_heal': None, 'width_heal': 69, 'width_state': 110, 'lr': 0.0017764323177797043, 'padding_heal': 4, 'padding_state': 18, 'optimizer_type': 'lbfgs'}. Best is trial 1511 with value: 0.0009640019852668047.
[I 2025-07-30 23:39:51,083] Trial 1963 finished with value: 0.0012086984934285283 and parameters: {'width_NN_heal': 351, 'width_NN_state': 349, 'depth_NN_heal': 2, 'depth_NN_state': 3, 'mode_heal': 60, 'mode_state': 60, 'blocks_heal': 7, 'blocks_state': 3, 'lift_act_state': <built-in function gelu>, 'block_act_state': <built-in function gelu>, 'lift_act_heal': <built-in function gelu>, 'block_act_heal': <built-in function gelu>, 'width_heal': 53, 'width_state': 104, 'lr': 0.0015295970100373884, 'padding_heal': 5, 'padding_state': 17, 'optimizer_type': 'lbfgs'}. Best is trial 1511 with value: 0.0009640019852668047.
[I 2025-07-30 23:39:55,700] Trial 1964 finished with value: 0.0011374348541721702 and parameters: {'width_NN_heal': 303, 'width_NN_state': 280, 'depth_NN_heal': 2, 'depth_NN_state': 3, 'mode_heal': 64, 'mode_state': 32, 'blocks_heal': 7, 'blocks_state': 3, 'lift_act_state': <built-in function gelu>, 'block_act_state': <built-in function gelu>, 'lift_act_heal': <built-in function gelu>, 'block_act_heal': None, 'width_heal': 64, 'width_state': 95, 'lr': 0.0028269854623415545, 'padding_heal': 5, 'padding_state': 16, 'optimizer_type': 'lbfgs'}. Best is trial 1511 with value: 0.0009640019852668047.
[I 2025-07-30 23:40:01,166] Trial 1965 finished with value: 0.0013917639153078198 and parameters: {'width_NN_heal': 366, 'width_NN_state': 512, 'depth_NN_heal': 2, 'depth_NN_state': 3, 'mode_heal': 60, 'mode_state': 52, 'blocks_heal': 8, 'blocks_state': 2, 'lift_act_state': <built-in function gelu>, 'block_act_state': <built-in function gelu>, 'lift_act_heal': <built-in function gelu>, 'block_act_heal': None, 'width_heal': 38, 'width_state': 120, 'lr': 0.0016592495849985474, 'padding_heal': 2, 'padding_state': 14, 'optimizer_type': 'lbfgs'}. Best is trial 1511 with value: 0.0009640019852668047.
[I 2025-07-30 23:40:06,294] Trial 1966 finished with value: 0.0012073484249413013 and parameters: {'width_NN_heal': 272, 'width_NN_state': 248, 'depth_NN_heal': 3, 'depth_NN_state': 3, 'mode_heal': 60, 'mode_state': 48, 'blocks_heal': 8, 'blocks_state': 3, 'lift_act_state': <built-in function gelu>, 'block_act_state': <built-in function gelu>, 'lift_act_heal': <built-in function gelu>, 'block_act_heal': None, 'width_heal': 58, 'width_state': 114, 'lr': 0.0024300580275459565, 'padding_heal': 3, 'padding_state': 19, 'optimizer_type': 'lbfgs'}. Best is trial 1511 with value: 0.0009640019852668047.
[I 2025-07-30 23:40:11,050] Trial 1967 finished with value: 0.0015604767249897122 and parameters: {'width_NN_heal': 428, 'width_NN_state': 71, 'depth_NN_heal': 2, 'depth_NN_state': 3, 'mode_heal': 64, 'mode_state': 60, 'blocks_heal': 7, 'blocks_state': 3, 'lift_act_state': <built-in function gelu>, 'block_act_state': <built-in function gelu>, 'lift_act_heal': <built-in function gelu>, 'block_act_heal': None, 'width_heal': 48, 'width_state': 88, 'lr': 0.0018345944213529653, 'padding_heal': 4, 'padding_state': 16, 'optimizer_type': 'lbfgs'}. Best is trial 1511 with value: 0.0009640019852668047.
[I 2025-07-30 23:40:15,745] Trial 1968 finished with value: 0.0013091254513710737 and parameters: {'width_NN_heal': 470, 'width_NN_state': 329, 'depth_NN_heal': 2, 'depth_NN_state': 3, 'mode_heal': 60, 'mode_state': 60, 'blocks_heal': 7, 'blocks_state': 3, 'lift_act_state': <built-in function gelu>, 'block_act_state': <built-in function gelu>, 'lift_act_heal': <built-in function gelu>, 'block_act_heal': None, 'width_heal': 34, 'width_state': 103, 'lr': 0.002202382528593378, 'padding_heal': 3, 'padding_state': 18, 'optimizer_type': 'lbfgs'}. Best is trial 1511 with value: 0.0009640019852668047.
[I 2025-07-30 23:40:21,000] Trial 1969 finished with value: 0.0011741772759705782 and parameters: {'width_NN_heal': 397, 'width_NN_state': 372, 'depth_NN_heal': 2, 'depth_NN_state': 3, 'mode_heal': 64, 'mode_state': 52, 'blocks_heal': 8, 'blocks_state': 3, 'lift_act_state': <built-in function gelu>, 'block_act_state': <built-in function gelu>, 'lift_act_heal': <built-in function gelu>, 'block_act_heal': None, 'width_heal': 51, 'width_state': 128, 'lr': 0.0015044394273351685, 'padding_heal': 5, 'padding_state': 18, 'optimizer_type': 'lbfgs'}. Best is trial 1511 with value: 0.0009640019852668047.
[I 2025-07-30 23:40:25,701] Trial 1970 finished with value: 0.0011492930352687836 and parameters: {'width_NN_heal': 368, 'width_NN_state': 290, 'depth_NN_heal': 2, 'depth_NN_state': 3, 'mode_heal': 60, 'mode_state': 60, 'blocks_heal': 7, 'blocks_state': 3, 'lift_act_state': <built-in function gelu>, 'block_act_state': <built-in function gelu>, 'lift_act_heal': <built-in function gelu>, 'block_act_heal': None, 'width_heal': 55, 'width_state': 110, 'lr': 0.0019530406614464088, 'padding_heal': 6, 'padding_state': 15, 'optimizer_type': 'lbfgs'}. Best is trial 1511 with value: 0.0009640019852668047.
[I 2025-07-30 23:40:30,856] Trial 1971 finished with value: 0.0010876143351197243 and parameters: {'width_NN_heal': 442, 'width_NN_state': 309, 'depth_NN_heal': 2, 'depth_NN_state': 3, 'mode_heal': 60, 'mode_state': 56, 'blocks_heal': 8, 'blocks_state': 4, 'lift_act_state': <built-in function gelu>, 'block_act_state': <built-in function gelu>, 'lift_act_heal': None, 'block_act_heal': None, 'width_heal': 48, 'width_state': 97, 'lr': 0.0016350551879428985, 'padding_heal': 13, 'padding_state': 17, 'optimizer_type': 'lbfgs'}. Best is trial 1511 with value: 0.0009640019852668047.
[I 2025-07-30 23:40:35,555] Trial 1972 finished with value: 0.001049534766934812 and parameters: {'width_NN_heal': 293, 'width_NN_state': 262, 'depth_NN_heal': 2, 'depth_NN_state': 3, 'mode_heal': 64, 'mode_state': 60, 'blocks_heal': 7, 'blocks_state': 3, 'lift_act_state': <built-in function gelu>, 'block_act_state': <built-in function gelu>, 'lift_act_heal': <built-in function gelu>, 'block_act_heal': None, 'width_heal': 38, 'width_state': 87, 'lr': 0.0017645163515464456, 'padding_heal': 4, 'padding_state': 17, 'optimizer_type': 'lbfgs'}. Best is trial 1511 with value: 0.0009640019852668047.
[I 2025-07-30 23:40:40,108] Trial 1973 finished with value: 0.002531744074076414 and parameters: {'width_NN_heal': 19, 'width_NN_state': 395, 'depth_NN_heal': 2, 'depth_NN_state': 2, 'mode_heal': 36, 'mode_state': 56, 'blocks_heal': 8, 'blocks_state': 2, 'lift_act_state': <function tanh at 0x7ff3611b4cc0>, 'block_act_state': <built-in function gelu>, 'lift_act_heal': <built-in function gelu>, 'block_act_heal': None, 'width_heal': 62, 'width_state': 106, 'lr': 0.001471921515684466, 'padding_heal': 3, 'padding_state': 16, 'optimizer_type': 'lbfgs'}. Best is trial 1511 with value: 0.0009640019852668047.
[I 2025-07-30 23:40:44,795] Trial 1974 finished with value: 0.0011286253575235605 and parameters: {'width_NN_heal': 319, 'width_NN_state': 352, 'depth_NN_heal': 2, 'depth_NN_state': 3, 'mode_heal': 60, 'mode_state': 56, 'blocks_heal': 7, 'blocks_state': 3, 'lift_act_state': <built-in function gelu>, 'block_act_state': <built-in function gelu>, 'lift_act_heal': <built-in function gelu>, 'block_act_heal': None, 'width_heal': 32, 'width_state': 120, 'lr': 0.002056090856192445, 'padding_heal': 2, 'padding_state': 19, 'optimizer_type': 'lbfgs'}. Best is trial 1511 with value: 0.0009640019852668047.
[I 2025-07-30 23:40:50,186] Trial 1975 finished with value: 0.0011815826874226332 and parameters: {'width_NN_heal': 44, 'width_NN_state': 439, 'depth_NN_heal': 1, 'depth_NN_state': 3, 'mode_heal': 64, 'mode_state': 36, 'blocks_heal': 8, 'blocks_state': 3, 'lift_act_state': <built-in function gelu>, 'block_act_state': <built-in function gelu>, 'lift_act_heal': <built-in function gelu>, 'block_act_heal': None, 'width_heal': 71, 'width_state': 8, 'lr': 0.0016319235815907686, 'padding_heal': 4, 'padding_state': 15, 'optimizer_type': 'adam'}. Best is trial 1511 with value: 0.0009640019852668047.
[I 2025-07-30 23:40:55,401] Trial 1976 finished with value: 0.0020086311269551516 and parameters: {'width_NN_heal': 407, 'width_NN_state': 329, 'depth_NN_heal': 3, 'depth_NN_state': 3, 'mode_heal': 64, 'mode_state': 52, 'blocks_heal': 7, 'blocks_state': 3, 'lift_act_state': <built-in function gelu>, 'block_act_state': <function tanh at 0x7ff3611b4cc0>, 'lift_act_heal': <built-in function gelu>, 'block_act_heal': None, 'width_heal': 35, 'width_state': 22, 'lr': 0.0014742537203416457, 'padding_heal': 5, 'padding_state': 18, 'optimizer_type': 'lbfgs'}. Best is trial 1511 with value: 0.0009640019852668047.
[I 2025-07-30 23:41:00,066] Trial 1977 finished with value: 0.0011021705577149987 and parameters: {'width_NN_heal': 342, 'width_NN_state': 290, 'depth_NN_heal': 2, 'depth_NN_state': 3, 'mode_heal': 60, 'mode_state': 60, 'blocks_heal': 7, 'blocks_state': 3, 'lift_act_state': <built-in function gelu>, 'block_act_state': <built-in function gelu>, 'lift_act_heal': <built-in function gelu>, 'block_act_heal': None, 'width_heal': 52, 'width_state': 94, 'lr': 0.0025397601848744576, 'padding_heal': 6, 'padding_state': 16, 'optimizer_type': 'lbfgs'}. Best is trial 1511 with value: 0.0009640019852668047.
[I 2025-07-30 23:41:06,021] Trial 1978 finished with value: 0.01605774462223053 and parameters: {'width_NN_heal': 253, 'width_NN_state': 235, 'depth_NN_heal': 2, 'depth_NN_state': 3, 'mode_heal': 64, 'mode_state': 60, 'blocks_heal': 6, 'blocks_state': 8, 'lift_act_state': <built-in function gelu>, 'block_act_state': <built-in function gelu>, 'lift_act_heal': <built-in function gelu>, 'block_act_heal': None, 'width_heal': 57, 'width_state': 114, 'lr': 0.0018648844749764588, 'padding_heal': 5, 'padding_state': 17, 'optimizer_type': 'lbfgs'}. Best is trial 1511 with value: 0.0009640019852668047.
[I 2025-07-30 23:41:10,110] Trial 1979 finished with value: 0.0015925101470202208 and parameters: {'width_NN_heal': 395, 'width_NN_state': 267, 'depth_NN_heal': 2, 'depth_NN_state': 3, 'mode_heal': 60, 'mode_state': 60, 'blocks_heal': 5, 'blocks_state': 3, 'lift_act_state': None, 'block_act_state': <built-in function gelu>, 'lift_act_heal': <built-in function gelu>, 'block_act_heal': None, 'width_heal': 46, 'width_state': 102, 'lr': 0.0022854281261542706, 'padding_heal': 3, 'padding_state': 16, 'optimizer_type': 'lbfgs'}. Best is trial 1511 with value: 0.0009640019852668047.
[I 2025-07-30 23:41:15,169] Trial 1980 finished with value: 0.0011317984899505973 and parameters: {'width_NN_heal': 470, 'width_NN_state': 371, 'depth_NN_heal': 2, 'depth_NN_state': 3, 'mode_heal': 60, 'mode_state': 48, 'blocks_heal': 7, 'blocks_state': 3, 'lift_act_state': <built-in function gelu>, 'block_act_state': <built-in function gelu>, 'lift_act_heal': <built-in function gelu>, 'block_act_heal': None, 'width_heal': 40, 'width_state': 110, 'lr': 0.0017110536867832474, 'padding_heal': 4, 'padding_state': 20, 'optimizer_type': 'lbfgs'}. Best is trial 1511 with value: 0.0009640019852668047.
[I 2025-07-30 23:41:21,538] Trial 1981 finished with value: 0.001302500837482512 and parameters: {'width_NN_heal': 512, 'width_NN_state': 314, 'depth_NN_heal': 3, 'depth_NN_state': 3, 'mode_heal': 64, 'mode_state': 56, 'blocks_heal': 8, 'blocks_state': 3, 'lift_act_state': <built-in function gelu>, 'block_act_state': <built-in function gelu>, 'lift_act_heal': <built-in function gelu>, 'block_act_heal': None, 'width_heal': 77, 'width_state': 120, 'lr': 0.002011697639891839, 'padding_heal': 6, 'padding_state': 17, 'optimizer_type': 'lbfgs'}. Best is trial 1511 with value: 0.0009640019852668047.
[I 2025-07-30 23:41:27,134] Trial 1982 finished with value: 0.001952089020051062 and parameters: {'width_NN_heal': 369, 'width_NN_state': 475, 'depth_NN_heal': 2, 'depth_NN_state': 3, 'mode_heal': 64, 'mode_state': 60, 'blocks_heal': 8, 'blocks_state': 3, 'lift_act_state': <built-in function gelu>, 'block_act_state': None, 'lift_act_heal': <built-in function gelu>, 'block_act_heal': None, 'width_heal': 60, 'width_state': 98, 'lr': 0.001563853155228957, 'padding_heal': 1, 'padding_state': 16, 'optimizer_type': 'lbfgs'}. Best is trial 1511 with value: 0.0009640019852668047.
[I 2025-07-30 23:41:33,359] Trial 1983 finished with value: 0.0013368078507483006 and parameters: {'width_NN_heal': 222, 'width_NN_state': 419, 'depth_NN_heal': 2, 'depth_NN_state': 3, 'mode_heal': 56, 'mode_state': 52, 'blocks_heal': 7, 'blocks_state': 3, 'lift_act_state': <built-in function gelu>, 'block_act_state': <built-in function gelu>, 'lift_act_heal': <built-in function gelu>, 'block_act_heal': <built-in function gelu>, 'width_heal': 110, 'width_state': 85, 'lr': 0.0013919147909013867, 'padding_heal': 21, 'padding_state': 18, 'optimizer_type': 'lbfgs'}. Best is trial 1511 with value: 0.0009640019852668047.
[I 2025-07-30 23:41:38,149] Trial 1984 finished with value: 0.0012786869192495942 and parameters: {'width_NN_heal': 437, 'width_NN_state': 353, 'depth_NN_heal': 2, 'depth_NN_state': 3, 'mode_heal': 60, 'mode_state': 60, 'blocks_heal': 7, 'blocks_state': 3, 'lift_act_state': <built-in function gelu>, 'block_act_state': <built-in function gelu>, 'lift_act_heal': None, 'block_act_heal': None, 'width_heal': 49, 'width_state': 92, 'lr': 0.0017858282637305714, 'padding_heal': 5, 'padding_state': 16, 'optimizer_type': 'lbfgs'}. Best is trial 1511 with value: 0.0009640019852668047.
[I 2025-07-30 23:41:43,154] Trial 1985 finished with value: 0.0011430027661845088 and parameters: {'width_NN_heal': 337, 'width_NN_state': 289, 'depth_NN_heal': 2, 'depth_NN_state': 3, 'mode_heal': 60, 'mode_state': 56, 'blocks_heal': 7, 'blocks_state': 4, 'lift_act_state': <built-in function gelu>, 'block_act_state': <built-in function gelu>, 'lift_act_heal': <built-in function gelu>, 'block_act_heal': None, 'width_heal': 44, 'width_state': 128, 'lr': 0.001537377858302279, 'padding_heal': 4, 'padding_state': 17, 'optimizer_type': 'lbfgs'}. Best is trial 1511 with value: 0.0009640019852668047.
