[I 2025-07-31 00:08:58,727] Trial 2310 finished with value: 0.0014510974287986755 and parameters: {'width_NN_heal': 259, 'width_NN_state': 342, 'depth_NN_heal': 2, 'depth_NN_state': 3, 'mode_heal': 64, 'mode_state': 36, 'blocks_heal': 8, 'blocks_state': 3, 'lift_act_state': <built-in function gelu>, 'block_act_state': <built-in function gelu>, 'lift_act_heal': <function tanh at 0x7ff3611b4cc0>, 'block_act_heal': None, 'width_heal': 17, 'width_state': 21, 'lr': 0.0021979095899490168, 'padding_heal': 6, 'padding_state': 18, 'optimizer_type': 'lbfgs'}. Best is trial 1511 with value: 0.0009640019852668047.
[I 2025-07-31 00:09:03,133] Trial 2311 finished with value: 0.0020167366601526737 and parameters: {'width_NN_heal': 365, 'width_NN_state': 182, 'depth_NN_heal': 2, 'depth_NN_state': 3, 'mode_heal': 56, 'mode_state': 64, 'blocks_heal': 6, 'blocks_state': 3, 'lift_act_state': <built-in function gelu>, 'block_act_state': None, 'lift_act_heal': <built-in function gelu>, 'block_act_heal': <function tanh at 0x7ff3611b4cc0>, 'width_heal': 49, 'width_state': 121, 'lr': 0.0016120252887653354, 'padding_heal': 7, 'padding_state': 17, 'optimizer_type': 'lbfgs'}. Best is trial 1511 with value: 0.0009640019852668047.
[I 2025-07-31 00:09:07,425] Trial 2312 finished with value: 0.0014338130131363869 and parameters: {'width_NN_heal': 19, 'width_NN_state': 261, 'depth_NN_heal': 2, 'depth_NN_state': 3, 'mode_heal': 60, 'mode_state': 64, 'blocks_heal': 7, 'blocks_state': 2, 'lift_act_state': <built-in function gelu>, 'block_act_state': <built-in function gelu>, 'lift_act_heal': <built-in function gelu>, 'block_act_heal': None, 'width_heal': 29, 'width_state': 105, 'lr': 0.0013616604289513159, 'padding_heal': 3, 'padding_state': 20, 'optimizer_type': 'lbfgs'}. Best is trial 1511 with value: 0.0009640019852668047.
[I 2025-07-31 00:09:12,616] Trial 2313 finished with value: 0.004147541709244251 and parameters: {'width_NN_heal': 451, 'width_NN_state': 284, 'depth_NN_heal': 2, 'depth_NN_state': 3, 'mode_heal': 64, 'mode_state': 52, 'blocks_heal': 8, 'blocks_state': 3, 'lift_act_state': <built-in function gelu>, 'block_act_state': <built-in function gelu>, 'lift_act_heal': <function tanh at 0x7ff3611b4cc0>, 'block_act_heal': None, 'width_heal': 53, 'width_state': 26, 'lr': 0.00024130195795474835, 'padding_heal': 4, 'padding_state': 18, 'optimizer_type': 'adam'}. Best is trial 1511 with value: 0.0009640019852668047.
[I 2025-07-31 00:09:17,770] Trial 2314 finished with value: 0.0011763981310650706 and parameters: {'width_NN_heal': 391, 'width_NN_state': 410, 'depth_NN_heal': 2, 'depth_NN_state': 3, 'mode_heal': 64, 'mode_state': 64, 'blocks_heal': 7, 'blocks_state': 3, 'lift_act_state': <built-in function gelu>, 'block_act_state': <built-in function gelu>, 'lift_act_heal': <built-in function gelu>, 'block_act_heal': None, 'width_heal': 42, 'width_state': 95, 'lr': 0.0017965777004817773, 'padding_heal': 5, 'padding_state': 16, 'optimizer_type': 'lbfgs'}. Best is trial 1511 with value: 0.0009640019852668047.
[I 2025-07-31 00:09:23,837] Trial 2315 finished with value: 0.0015792095800861716 and parameters: {'width_NN_heal': 313, 'width_NN_state': 318, 'depth_NN_heal': 3, 'depth_NN_state': 3, 'mode_heal': 60, 'mode_state': 56, 'blocks_heal': 7, 'blocks_state': 7, 'lift_act_state': <built-in function gelu>, 'block_act_state': <built-in function gelu>, 'lift_act_heal': <built-in function gelu>, 'block_act_heal': None, 'width_heal': 58, 'width_state': 114, 'lr': 0.0019516058293984084, 'padding_heal': 6, 'padding_state': 19, 'optimizer_type': 'lbfgs'}. Best is trial 1511 with value: 0.0009640019852668047.
[I 2025-07-31 00:09:28,809] Trial 2316 finished with value: 0.0012087620561942458 and parameters: {'width_NN_heal': 349, 'width_NN_state': 356, 'depth_NN_heal': 2, 'depth_NN_state': 3, 'mode_heal': 56, 'mode_state': 64, 'blocks_heal': 8, 'blocks_state': 3, 'lift_act_state': <built-in function gelu>, 'block_act_state': <built-in function gelu>, 'lift_act_heal': <function tanh at 0x7ff3611b4cc0>, 'block_act_heal': None, 'width_heal': 45, 'width_state': 8, 'lr': 0.0023582448954699454, 'padding_heal': 5, 'padding_state': 17, 'optimizer_type': 'lbfgs'}. Best is trial 1511 with value: 0.0009640019852668047.
[I 2025-07-31 00:09:34,903] Trial 2317 finished with value: 0.0016288786428049207 and parameters: {'width_NN_heal': 470, 'width_NN_state': 297, 'depth_NN_heal': 5, 'depth_NN_state': 2, 'mode_heal': 60, 'mode_state': 52, 'blocks_heal': 7, 'blocks_state': 3, 'lift_act_state': <built-in function gelu>, 'block_act_state': <built-in function gelu>, 'lift_act_heal': <built-in function gelu>, 'block_act_heal': None, 'width_heal': 36, 'width_state': 128, 'lr': 0.0014750756931180646, 'padding_heal': 4, 'padding_state': 15, 'optimizer_type': 'lbfgs'}. Best is trial 1511 with value: 0.0009640019852668047.
[I 2025-07-31 00:09:40,334] Trial 2318 finished with value: 0.0010897389147430658 and parameters: {'width_NN_heal': 290, 'width_NN_state': 462, 'depth_NN_heal': 2, 'depth_NN_state': 3, 'mode_heal': 64, 'mode_state': 44, 'blocks_heal': 8, 'blocks_state': 3, 'lift_act_state': <built-in function gelu>, 'block_act_state': <built-in function gelu>, 'lift_act_heal': <built-in function gelu>, 'block_act_heal': None, 'width_heal': 51, 'width_state': 81, 'lr': 0.0016831418861005725, 'padding_heal': 3, 'padding_state': 18, 'optimizer_type': 'lbfgs'}. Best is trial 1511 with value: 0.0009640019852668047.
[I 2025-07-31 00:09:45,013] Trial 2319 finished with value: 0.0012374937068670988 and parameters: {'width_NN_heal': 413, 'width_NN_state': 266, 'depth_NN_heal': 2, 'depth_NN_state': 3, 'mode_heal': 60, 'mode_state': 56, 'blocks_heal': 7, 'blocks_state': 3, 'lift_act_state': <built-in function gelu>, 'block_act_state': <built-in function gelu>, 'lift_act_heal': <function tanh at 0x7ff3611b4cc0>, 'block_act_heal': None, 'width_heal': 56, 'width_state': 102, 'lr': 0.0012645099419126107, 'padding_heal': 2, 'padding_state': 17, 'optimizer_type': 'lbfgs'}. Best is trial 1511 with value: 0.0009640019852668047.
[I 2025-07-31 00:09:50,236] Trial 2320 finished with value: 0.0011445077834650874 and parameters: {'width_NN_heal': 341, 'width_NN_state': 371, 'depth_NN_heal': 2, 'depth_NN_state': 3, 'mode_heal': 64, 'mode_state': 60, 'blocks_heal': 8, 'blocks_state': 3, 'lift_act_state': <built-in function gelu>, 'block_act_state': <built-in function gelu>, 'lift_act_heal': <built-in function gelu>, 'block_act_heal': None, 'width_heal': 63, 'width_state': 12, 'lr': 0.0020982418493200477, 'padding_heal': 4, 'padding_state': 16, 'optimizer_type': 'lbfgs'}. Best is trial 1511 with value: 0.0009640019852668047.
[I 2025-07-31 00:09:54,876] Trial 2321 finished with value: 0.0011994473170489073 and parameters: {'width_NN_heal': 380, 'width_NN_state': 327, 'depth_NN_heal': 1, 'depth_NN_state': 4, 'mode_heal': 60, 'mode_state': 64, 'blocks_heal': 7, 'blocks_state': 3, 'lift_act_state': <built-in function gelu>, 'block_act_state': <built-in function gelu>, 'lift_act_heal': <built-in function gelu>, 'block_act_heal': None, 'width_heal': 32, 'width_state': 91, 'lr': 0.0015961195876868027, 'padding_heal': 8, 'padding_state': 16, 'optimizer_type': 'lbfgs'}. Best is trial 1511 with value: 0.0009640019852668047.
[I 2025-07-31 00:09:59,608] Trial 2322 finished with value: 0.001288924366235733 and parameters: {'width_NN_heal': 244, 'width_NN_state': 249, 'depth_NN_heal': 3, 'depth_NN_state': 3, 'mode_heal': 64, 'mode_state': 60, 'blocks_heal': 7, 'blocks_state': 3, 'lift_act_state': <function tanh at 0x7ff3611b4cc0>, 'block_act_state': <built-in function gelu>, 'lift_act_heal': <function tanh at 0x7ff3611b4cc0>, 'block_act_heal': None, 'width_heal': 47, 'width_state': 114, 'lr': 0.001876663319939169, 'padding_heal': 5, 'padding_state': 18, 'optimizer_type': 'lbfgs'}. Best is trial 1511 with value: 0.0009640019852668047.
[I 2025-07-31 00:10:04,590] Trial 2323 finished with value: 0.0010921370703727007 and parameters: {'width_NN_heal': 204, 'width_NN_state': 283, 'depth_NN_heal': 2, 'depth_NN_state': 3, 'mode_heal': 60, 'mode_state': 64, 'blocks_heal': 8, 'blocks_state': 3, 'lift_act_state': <built-in function gelu>, 'block_act_state': <built-in function gelu>, 'lift_act_heal': <built-in function gelu>, 'block_act_heal': <function tanh at 0x7ff3611b4cc0>, 'width_heal': 39, 'width_state': 108, 'lr': 0.0013512868406359046, 'padding_heal': 3, 'padding_state': 17, 'optimizer_type': 'lbfgs'}. Best is trial 1511 with value: 0.0009640019852668047.
[I 2025-07-31 00:10:09,912] Trial 2324 finished with value: 0.00143087946344167 and parameters: {'width_NN_heal': 434, 'width_NN_state': 229, 'depth_NN_heal': 2, 'depth_NN_state': 3, 'mode_heal': 64, 'mode_state': 60, 'blocks_heal': 7, 'blocks_state': 4, 'lift_act_state': <built-in function gelu>, 'block_act_state': <built-in function gelu>, 'lift_act_heal': <built-in function gelu>, 'block_act_heal': None, 'width_heal': 75, 'width_state': 87, 'lr': 0.001183936664880299, 'padding_heal': 4, 'padding_state': 19, 'optimizer_type': 'lbfgs'}. Best is trial 1511 with value: 0.0009640019852668047.
[I 2025-07-31 00:10:14,825] Trial 2325 finished with value: 0.001308903913013637 and parameters: {'width_NN_heal': 321, 'width_NN_state': 308, 'depth_NN_heal': 2, 'depth_NN_state': 3, 'mode_heal': 60, 'mode_state': 56, 'blocks_heal': 8, 'blocks_state': 3, 'lift_act_state': <built-in function gelu>, 'block_act_state': <built-in function gelu>, 'lift_act_heal': <function tanh at 0x7ff3611b4cc0>, 'block_act_heal': None, 'width_heal': 53, 'width_state': 100, 'lr': 0.0025554482947131355, 'padding_heal': 6, 'padding_state': 15, 'optimizer_type': 'lbfgs'}. Best is trial 1511 with value: 0.0009640019852668047.
[I 2025-07-31 00:10:19,940] Trial 2326 finished with value: 0.0016889304388314486 and parameters: {'width_NN_heal': 470, 'width_NN_state': 349, 'depth_NN_heal': 2, 'depth_NN_state': 3, 'mode_heal': 64, 'mode_state': 60, 'blocks_heal': 8, 'blocks_state': 3, 'lift_act_state': <built-in function gelu>, 'block_act_state': <function tanh at 0x7ff3611b4cc0>, 'lift_act_heal': <built-in function gelu>, 'block_act_heal': None, 'width_heal': 34, 'width_state': 120, 'lr': 0.0017382239125221404, 'padding_heal': 7, 'padding_state': 18, 'optimizer_type': 'lbfgs'}. Best is trial 1511 with value: 0.0009640019852668047.
[I 2025-07-31 00:10:25,334] Trial 2327 finished with value: 0.0011728948447853327 and parameters: {'width_NN_heal': 389, 'width_NN_state': 392, 'depth_NN_heal': 2, 'depth_NN_state': 3, 'mode_heal': 52, 'mode_state': 64, 'blocks_heal': 7, 'blocks_state': 3, 'lift_act_state': <built-in function gelu>, 'block_act_state': <built-in function gelu>, 'lift_act_heal': <built-in function gelu>, 'block_act_heal': None, 'width_heal': 59, 'width_state': 107, 'lr': 0.0030681098286885586, 'padding_heal': 5, 'padding_state': 17, 'optimizer_type': 'lbfgs'}. Best is trial 1511 with value: 0.0009640019852668047.
[I 2025-07-31 00:10:30,282] Trial 2328 finished with value: 0.0016960847424343228 and parameters: {'width_NN_heal': 512, 'width_NN_state': 322, 'depth_NN_heal': 2, 'depth_NN_state': 3, 'mode_heal': 56, 'mode_state': 52, 'blocks_heal': 5, 'blocks_state': 3, 'lift_act_state': None, 'block_act_state': <built-in function gelu>, 'lift_act_heal': <function tanh at 0x7ff3611b4cc0>, 'block_act_heal': None, 'width_heal': 68, 'width_state': 95, 'lr': 0.0014568597650361117, 'padding_heal': 2, 'padding_state': 28, 'optimizer_type': 'lbfgs'}. Best is trial 1511 with value: 0.0009640019852668047.
[I 2025-07-31 00:10:34,912] Trial 2329 finished with value: 0.0014837331837043166 and parameters: {'width_NN_heal': 271, 'width_NN_state': 282, 'depth_NN_heal': 2, 'depth_NN_state': 3, 'mode_heal': 60, 'mode_state': 60, 'blocks_heal': 7, 'blocks_state': 3, 'lift_act_state': <built-in function gelu>, 'block_act_state': <built-in function gelu>, 'lift_act_heal': <built-in function gelu>, 'block_act_heal': None, 'width_heal': 42, 'width_state': 120, 'lr': 0.0022287553637725184, 'padding_heal': 5, 'padding_state': 14, 'optimizer_type': 'lbfgs'}. Best is trial 1511 with value: 0.0009640019852668047.
[I 2025-07-31 00:10:39,754] Trial 2330 finished with value: 0.001608084887266159 and parameters: {'width_NN_heal': 354, 'width_NN_state': 425, 'depth_NN_heal': 2, 'depth_NN_state': 2, 'mode_heal': 60, 'mode_state': 64, 'blocks_heal': 8, 'blocks_state': 3, 'lift_act_state': <built-in function gelu>, 'block_act_state': <built-in function gelu>, 'lift_act_heal': None, 'block_act_heal': <built-in function gelu>, 'width_heal': 50, 'width_state': 111, 'lr': 0.0019642521592121674, 'padding_heal': 4, 'padding_state': 16, 'optimizer_type': 'lbfgs'}. Best is trial 1511 with value: 0.0009640019852668047.
[I 2025-07-31 00:10:44,246] Trial 2331 finished with value: 0.0010970705188810825 and parameters: {'width_NN_heal': 405, 'width_NN_state': 352, 'depth_NN_heal': 2, 'depth_NN_state': 3, 'mode_heal': 60, 'mode_state': 56, 'blocks_heal': 4, 'blocks_state': 3, 'lift_act_state': <built-in function gelu>, 'block_act_state': <built-in function gelu>, 'lift_act_heal': <built-in function gelu>, 'block_act_heal': None, 'width_heal': 38, 'width_state': 81, 'lr': 0.0015749123074345387, 'padding_heal': 23, 'padding_state': 19, 'optimizer_type': 'lbfgs'}. Best is trial 1511 with value: 0.0009640019852668047.
[I 2025-07-31 00:10:48,733] Trial 2332 finished with value: 0.0036784708499908447 and parameters: {'width_NN_heal': 292, 'width_NN_state': 304, 'depth_NN_heal': 2, 'depth_NN_state': 3, 'mode_heal': 64, 'mode_state': 48, 'blocks_heal': 7, 'blocks_state': 3, 'lift_act_state': <built-in function gelu>, 'block_act_state': None, 'lift_act_heal': <function tanh at 0x7ff3611b4cc0>, 'block_act_heal': None, 'width_heal': 15, 'width_state': 101, 'lr': 0.0018184447576997166, 'padding_heal': 3, 'padding_state': 17, 'optimizer_type': 'lbfgs'}. Best is trial 1511 with value: 0.0009640019852668047.
[I 2025-07-31 00:10:54,016] Trial 2333 finished with value: 0.0024208116810768843 and parameters: {'width_NN_heal': 449, 'width_NN_state': 24, 'depth_NN_heal': 3, 'depth_NN_state': 3, 'mode_heal': 64, 'mode_state': 60, 'blocks_heal': 8, 'blocks_state': 3, 'lift_act_state': <built-in function gelu>, 'block_act_state': <built-in function gelu>, 'lift_act_heal': <built-in function gelu>, 'block_act_heal': None, 'width_heal': 55, 'width_state': 89, 'lr': 0.0013768637232515167, 'padding_heal': 6, 'padding_state': 16, 'optimizer_type': 'adam'}. Best is trial 1511 with value: 0.0009640019852668047.
[I 2025-07-31 00:10:58,606] Trial 2334 finished with value: 0.0014582362491637468 and parameters: {'width_NN_heal': 8, 'width_NN_state': 66, 'depth_NN_heal': 2, 'depth_NN_state': 3, 'mode_heal': 60, 'mode_state': 64, 'blocks_heal': 7, 'blocks_state': 3, 'lift_act_state': <built-in function gelu>, 'block_act_state': <built-in function gelu>, 'lift_act_heal': <built-in function gelu>, 'block_act_heal': None, 'width_heal': 45, 'width_state': 114, 'lr': 0.001675347685577841, 'padding_heal': 1, 'padding_state': 10, 'optimizer_type': 'lbfgs'}. Best is trial 1511 with value: 0.0009640019852668047.
[I 2025-07-31 00:11:03,272] Trial 2335 finished with value: 0.001296910340897739 and parameters: {'width_NN_heal': 369, 'width_NN_state': 256, 'depth_NN_heal': 2, 'depth_NN_state': 4, 'mode_heal': 64, 'mode_state': 60, 'blocks_heal': 7, 'blocks_state': 3, 'lift_act_state': <built-in function gelu>, 'block_act_state': <built-in function gelu>, 'lift_act_heal': <function tanh at 0x7ff3611b4cc0>, 'block_act_heal': None, 'width_heal': 30, 'width_state': 97, 'lr': 0.002098837102079001, 'padding_heal': 20, 'padding_state': 17, 'optimizer_type': 'lbfgs'}. Best is trial 1511 with value: 0.0009640019852668047.
[I 2025-07-31 00:11:08,285] Trial 2336 finished with value: 0.0011563244042918086 and parameters: {'width_NN_heal': 332, 'width_NN_state': 330, 'depth_NN_heal': 2, 'depth_NN_state': 3, 'mode_heal': 60, 'mode_state': 64, 'blocks_heal': 7, 'blocks_state': 3, 'lift_act_state': <built-in function gelu>, 'block_act_state': <built-in function gelu>, 'lift_act_heal': <built-in function gelu>, 'block_act_heal': <function tanh at 0x7ff3611b4cc0>, 'width_heal': 62, 'width_state': 120, 'lr': 0.0015233618228130043, 'padding_heal': 4, 'padding_state': 18, 'optimizer_type': 'lbfgs'}. Best is trial 1511 with value: 0.0009640019852668047.
[I 2025-07-31 00:11:13,406] Trial 2337 finished with value: 0.0012430675560608506 and parameters: {'width_NN_heal': 415, 'width_NN_state': 387, 'depth_NN_heal': 2, 'depth_NN_state': 3, 'mode_heal': 64, 'mode_state': 60, 'blocks_heal': 6, 'blocks_state': 3, 'lift_act_state': <built-in function gelu>, 'block_act_state': <built-in function gelu>, 'lift_act_heal': <built-in function gelu>, 'block_act_heal': None, 'width_heal': 50, 'width_state': 43, 'lr': 0.0011382587647643012, 'padding_heal': 7, 'padding_state': 15, 'optimizer_type': 'lbfgs'}. Best is trial 1511 with value: 0.0009640019852668047.
[I 2025-07-31 00:11:18,277] Trial 2338 finished with value: 0.0015823066933080554 and parameters: {'width_NN_heal': 231, 'width_NN_state': 272, 'depth_NN_heal': 2, 'depth_NN_state': 3, 'mode_heal': 60, 'mode_state': 56, 'blocks_heal': 8, 'blocks_state': 3, 'lift_act_state': <built-in function gelu>, 'block_act_state': <built-in function gelu>, 'lift_act_heal': <function tanh at 0x7ff3611b4cc0>, 'block_act_heal': None, 'width_heal': 35, 'width_state': 128, 'lr': 0.0025163472192498825, 'padding_heal': 5, 'padding_state': 18, 'optimizer_type': 'lbfgs'}. Best is trial 1511 with value: 0.0009640019852668047.
[I 2025-07-31 00:11:23,039] Trial 2339 finished with value: 0.001385143375955522 and parameters: {'width_NN_heal': 376, 'width_NN_state': 294, 'depth_NN_heal': 1, 'depth_NN_state': 3, 'mode_heal': 56, 'mode_state': 64, 'blocks_heal': 8, 'blocks_state': 3, 'lift_act_state': <built-in function gelu>, 'block_act_state': <built-in function gelu>, 'lift_act_heal': <built-in function gelu>, 'block_act_heal': None, 'width_heal': 41, 'width_state': 106, 'lr': 0.0013228598180160928, 'padding_heal': 3, 'padding_state': 16, 'optimizer_type': 'lbfgs'}. Best is trial 1511 with value: 0.0009640019852668047.
[I 2025-07-31 00:11:28,085] Trial 2340 finished with value: 0.0011993430089205503 and parameters: {'width_NN_heal': 308, 'width_NN_state': 350, 'depth_NN_heal': 2, 'depth_NN_state': 3, 'mode_heal': 44, 'mode_state': 52, 'blocks_heal': 7, 'blocks_state': 4, 'lift_act_state': <built-in function gelu>, 'block_act_state': <built-in function gelu>, 'lift_act_heal': <built-in function gelu>, 'block_act_heal': None, 'width_heal': 58, 'width_state': 22, 'lr': 0.00181597665791507, 'padding_heal': 2, 'padding_state': 19, 'optimizer_type': 'lbfgs'}. Best is trial 1511 with value: 0.0009640019852668047.
[I 2025-07-31 00:11:32,780] Trial 2341 finished with value: 0.0012293538311496377 and parameters: {'width_NN_heal': 183, 'width_NN_state': 203, 'depth_NN_heal': 3, 'depth_NN_state': 3, 'mode_heal': 64, 'mode_state': 60, 'blocks_heal': 7, 'blocks_state': 3, 'lift_act_state': <built-in function gelu>, 'block_act_state': <built-in function gelu>, 'lift_act_heal': <function tanh at 0x7ff3611b4cc0>, 'block_act_heal': None, 'width_heal': 46, 'width_state': 107, 'lr': 0.0016047390953237539, 'padding_heal': 4, 'padding_state': 16, 'optimizer_type': 'lbfgs'}. Best is trial 1511 with value: 0.0009640019852668047.
[I 2025-07-31 00:11:37,940] Trial 2342 finished with value: 0.0016329697100445628 and parameters: {'width_NN_heal': 475, 'width_NN_state': 316, 'depth_NN_heal': 2, 'depth_NN_state': 3, 'mode_heal': 60, 'mode_state': 64, 'blocks_heal': 8, 'blocks_state': 3, 'lift_act_state': <built-in function gelu>, 'block_act_state': <built-in function gelu>, 'lift_act_heal': <built-in function gelu>, 'block_act_heal': None, 'width_heal': 54, 'width_state': 94, 'lr': 0.002770021061131568, 'padding_heal': 6, 'padding_state': 17, 'optimizer_type': 'lbfgs'}. Best is trial 1511 with value: 0.0009640019852668047.
[I 2025-07-31 00:11:42,295] Trial 2343 finished with value: 0.0012701147934421897 and parameters: {'width_NN_heal': 420, 'width_NN_state': 368, 'depth_NN_heal': 2, 'depth_NN_state': 3, 'mode_heal': 64, 'mode_state': 40, 'blocks_heal': 3, 'blocks_state': 3, 'lift_act_state': <built-in function gelu>, 'block_act_state': <built-in function gelu>, 'lift_act_heal': <built-in function gelu>, 'block_act_heal': None, 'width_heal': 68, 'width_state': 115, 'lr': 0.001964629862379607, 'padding_heal': 0, 'padding_state': 16, 'optimizer_type': 'lbfgs'}. Best is trial 1511 with value: 0.0009640019852668047.
[I 2025-07-31 00:11:47,138] Trial 2344 finished with value: 0.0030696135945618153 and parameters: {'width_NN_heal': 345, 'width_NN_state': 235, 'depth_NN_heal': 5, 'depth_NN_state': 3, 'mode_heal': 60, 'mode_state': 52, 'blocks_heal': 7, 'blocks_state': 1, 'lift_act_state': <function tanh at 0x7ff3611b4cc0>, 'block_act_state': <built-in function gelu>, 'lift_act_heal': <function tanh at 0x7ff3611b4cc0>, 'block_act_heal': None, 'width_heal': 37, 'width_state': 24, 'lr': 0.0022559632226315735, 'padding_heal': 5, 'padding_state': 20, 'optimizer_type': 'lbfgs'}. Best is trial 1511 with value: 0.0009640019852668047.
[I 2025-07-31 00:11:51,414] Trial 2345 finished with value: 0.0011411479208618402 and parameters: {'width_NN_heal': 28, 'width_NN_state': 268, 'depth_NN_heal': 2, 'depth_NN_state': 3, 'mode_heal': 64, 'mode_state': 64, 'blocks_heal': 7, 'blocks_state': 2, 'lift_act_state': <built-in function gelu>, 'block_act_state': <built-in function gelu>, 'lift_act_heal': <built-in function gelu>, 'block_act_heal': None, 'width_heal': 51, 'width_state': 86, 'lr': 0.001479942866311501, 'padding_heal': 4, 'padding_state': 18, 'optimizer_type': 'lbfgs'}. Best is trial 1511 with value: 0.0009640019852668047.
