[I 2025-07-30 22:17:34,557] Trial 978 finished with value: 0.0011110705090686679 and parameters: {'width_NN_heal': 402, 'width_NN_state': 298, 'depth_NN_heal': 2, 'depth_NN_state': 3, 'mode_heal': 64, 'mode_state': 64, 'blocks_heal': 7, 'blocks_state': 3, 'lift_act_state': <built-in function gelu>, 'block_act_state': <built-in function gelu>, 'lift_act_heal': <function tanh at 0x7ff3611b4cc0>, 'block_act_heal': None, 'width_heal': 37, 'width_state': 91, 'lr': 0.0013646682869367904, 'padding_heal': 3, 'padding_state': 18, 'optimizer_type': 'lbfgs'}. Best is trial 771 with value: 0.0010052043944597244.
[I 2025-07-30 22:17:39,167] Trial 979 finished with value: 0.0015397191746160388 and parameters: {'width_NN_heal': 357, 'width_NN_state': 319, 'depth_NN_heal': 2, 'depth_NN_state': 3, 'mode_heal': 64, 'mode_state': 60, 'blocks_heal': 7, 'blocks_state': 3, 'lift_act_state': <built-in function gelu>, 'block_act_state': <built-in function gelu>, 'lift_act_heal': <function tanh at 0x7ff3611b4cc0>, 'block_act_heal': None, 'width_heal': 42, 'width_state': 80, 'lr': 0.0010939229350955468, 'padding_heal': 2, 'padding_state': 19, 'optimizer_type': 'lbfgs'}. Best is trial 771 with value: 0.0010052043944597244.
[I 2025-07-30 22:17:43,842] Trial 980 finished with value: 0.0013630642788484693 and parameters: {'width_NN_heal': 475, 'width_NN_state': 276, 'depth_NN_heal': 2, 'depth_NN_state': 3, 'mode_heal': 64, 'mode_state': 64, 'blocks_heal': 7, 'blocks_state': 3, 'lift_act_state': <built-in function gelu>, 'block_act_state': <built-in function gelu>, 'lift_act_heal': <function tanh at 0x7ff3611b4cc0>, 'block_act_heal': None, 'width_heal': 41, 'width_state': 96, 'lr': 0.0009234359271299498, 'padding_heal': 3, 'padding_state': 18, 'optimizer_type': 'lbfgs'}. Best is trial 771 with value: 0.0010052043944597244.
[I 2025-07-30 22:17:48,426] Trial 981 finished with value: 0.0013467730022966862 and parameters: {'width_NN_heal': 306, 'width_NN_state': 238, 'depth_NN_heal': 2, 'depth_NN_state': 3, 'mode_heal': 64, 'mode_state': 64, 'blocks_heal': 7, 'blocks_state': 3, 'lift_act_state': <built-in function gelu>, 'block_act_state': <built-in function gelu>, 'lift_act_heal': None, 'block_act_heal': None, 'width_heal': 38, 'width_state': 86, 'lr': 0.0012428251848463035, 'padding_heal': 2, 'padding_state': 19, 'optimizer_type': 'lbfgs'}. Best is trial 771 with value: 0.0010052043944597244.
[I 2025-07-30 22:17:52,979] Trial 982 finished with value: 0.0010958294151350856 and parameters: {'width_NN_heal': 451, 'width_NN_state': 301, 'depth_NN_heal': 2, 'depth_NN_state': 3, 'mode_heal': 64, 'mode_state': 60, 'blocks_heal': 7, 'blocks_state': 3, 'lift_act_state': <built-in function gelu>, 'block_act_state': <built-in function gelu>, 'lift_act_heal': <function tanh at 0x7ff3611b4cc0>, 'block_act_heal': None, 'width_heal': 40, 'width_state': 104, 'lr': 0.0013646627526336047, 'padding_heal': 3, 'padding_state': 18, 'optimizer_type': 'lbfgs'}. Best is trial 771 with value: 0.0010052043944597244.
[I 2025-07-30 22:17:57,577] Trial 983 finished with value: 0.0012158001773059368 and parameters: {'width_NN_heal': 378, 'width_NN_state': 262, 'depth_NN_heal': 2, 'depth_NN_state': 3, 'mode_heal': 64, 'mode_state': 64, 'blocks_heal': 7, 'blocks_state': 3, 'lift_act_state': <built-in function gelu>, 'block_act_state': <built-in function gelu>, 'lift_act_heal': <function tanh at 0x7ff3611b4cc0>, 'block_act_heal': None, 'width_heal': 37, 'width_state': 78, 'lr': 0.0011460185985970608, 'padding_heal': 3, 'padding_state': 19, 'optimizer_type': 'lbfgs'}. Best is trial 771 with value: 0.0010052043944597244.
[I 2025-07-30 22:18:02,320] Trial 984 finished with value: 0.0017368939006701112 and parameters: {'width_NN_heal': 429, 'width_NN_state': 333, 'depth_NN_heal': 2, 'depth_NN_state': 3, 'mode_heal': 64, 'mode_state': 64, 'blocks_heal': 7, 'blocks_state': 3, 'lift_act_state': <built-in function gelu>, 'block_act_state': <function tanh at 0x7ff3611b4cc0>, 'lift_act_heal': <function tanh at 0x7ff3611b4cc0>, 'block_act_heal': None, 'width_heal': 45, 'width_state': 86, 'lr': 0.0013843113834627508, 'padding_heal': 1, 'padding_state': 18, 'optimizer_type': 'lbfgs'}. Best is trial 771 with value: 0.0010052043944597244.
[I 2025-07-30 22:18:06,942] Trial 985 finished with value: 0.0012480237055569887 and parameters: {'width_NN_heal': 338, 'width_NN_state': 285, 'depth_NN_heal': 2, 'depth_NN_state': 3, 'mode_heal': 64, 'mode_state': 64, 'blocks_heal': 7, 'blocks_state': 3, 'lift_act_state': <built-in function gelu>, 'block_act_state': <built-in function gelu>, 'lift_act_heal': <function tanh at 0x7ff3611b4cc0>, 'block_act_heal': None, 'width_heal': 37, 'width_state': 119, 'lr': 0.0009834049456800375, 'padding_heal': 2, 'padding_state': 18, 'optimizer_type': 'lbfgs'}. Best is trial 771 with value: 0.0010052043944597244.
[I 2025-07-30 22:18:10,694] Trial 986 finished with value: 0.0012090664822608232 and parameters: {'width_NN_heal': 326, 'width_NN_state': 362, 'depth_NN_heal': 2, 'depth_NN_state': 3, 'mode_heal': 64, 'mode_state': 64, 'blocks_heal': 3, 'blocks_state': 3, 'lift_act_state': <built-in function gelu>, 'block_act_state': <built-in function gelu>, 'lift_act_heal': <function tanh at 0x7ff3611b4cc0>, 'block_act_heal': None, 'width_heal': 40, 'width_state': 125, 'lr': 0.0011975340089694785, 'padding_heal': 3, 'padding_state': 19, 'optimizer_type': 'lbfgs'}. Best is trial 771 with value: 0.0010052043944597244.
[I 2025-07-30 22:18:15,124] Trial 987 finished with value: 0.0014257021248340607 and parameters: {'width_NN_heal': 402, 'width_NN_state': 246, 'depth_NN_heal': 1, 'depth_NN_state': 3, 'mode_heal': 64, 'mode_state': 64, 'blocks_heal': 7, 'blocks_state': 3, 'lift_act_state': None, 'block_act_state': <built-in function gelu>, 'lift_act_heal': <function tanh at 0x7ff3611b4cc0>, 'block_act_heal': None, 'width_heal': 37, 'width_state': 93, 'lr': 0.0012746005296956386, 'padding_heal': 3, 'padding_state': 18, 'optimizer_type': 'lbfgs'}. Best is trial 771 with value: 0.0010052043944597244.
[I 2025-07-30 22:18:19,732] Trial 988 finished with value: 0.001150530413724482 and parameters: {'width_NN_heal': 291, 'width_NN_state': 316, 'depth_NN_heal': 2, 'depth_NN_state': 3, 'mode_heal': 64, 'mode_state': 64, 'blocks_heal': 7, 'blocks_state': 3, 'lift_act_state': <built-in function gelu>, 'block_act_state': <built-in function gelu>, 'lift_act_heal': <function tanh at 0x7ff3611b4cc0>, 'block_act_heal': None, 'width_heal': 44, 'width_state': 82, 'lr': 0.0013909912044539736, 'padding_heal': 4, 'padding_state': 19, 'optimizer_type': 'lbfgs'}. Best is trial 771 with value: 0.0010052043944597244.
[I 2025-07-30 22:18:24,348] Trial 989 finished with value: 0.001177686033770442 and parameters: {'width_NN_heal': 367, 'width_NN_state': 269, 'depth_NN_heal': 2, 'depth_NN_state': 3, 'mode_heal': 64, 'mode_state': 64, 'blocks_heal': 7, 'blocks_state': 3, 'lift_act_state': <built-in function gelu>, 'block_act_state': <built-in function gelu>, 'lift_act_heal': <function tanh at 0x7ff3611b4cc0>, 'block_act_heal': None, 'width_heal': 41, 'width_state': 76, 'lr': 0.001423279931621343, 'padding_heal': 2, 'padding_state': 18, 'optimizer_type': 'lbfgs'}. Best is trial 771 with value: 0.0010052043944597244.
[I 2025-07-30 22:18:28,899] Trial 990 finished with value: 0.002170475199818611 and parameters: {'width_NN_heal': 299, 'width_NN_state': 296, 'depth_NN_heal': 2, 'depth_NN_state': 3, 'mode_heal': 64, 'mode_state': 60, 'blocks_heal': 7, 'blocks_state': 3, 'lift_act_state': <built-in function gelu>, 'block_act_state': None, 'lift_act_heal': <function tanh at 0x7ff3611b4cc0>, 'block_act_heal': None, 'width_heal': 36, 'width_state': 103, 'lr': 0.001238729782986152, 'padding_heal': 4, 'padding_state': 19, 'optimizer_type': 'lbfgs'}. Best is trial 771 with value: 0.0010052043944597244.
[I 2025-07-30 22:18:32,783] Trial 991 finished with value: 0.0014203430619090796 and parameters: {'width_NN_heal': 489, 'width_NN_state': 233, 'depth_NN_heal': 2, 'depth_NN_state': 3, 'mode_heal': 64, 'mode_state': 64, 'blocks_heal': 4, 'blocks_state': 3, 'lift_act_state': <built-in function gelu>, 'block_act_state': <built-in function gelu>, 'lift_act_heal': <function tanh at 0x7ff3611b4cc0>, 'block_act_heal': None, 'width_heal': 39, 'width_state': 85, 'lr': 0.0010856774922613779, 'padding_heal': 4, 'padding_state': 18, 'optimizer_type': 'lbfgs'}. Best is trial 771 with value: 0.0010052043944597244.
[I 2025-07-30 22:18:37,472] Trial 992 finished with value: 0.0012608810793608427 and parameters: {'width_NN_heal': 361, 'width_NN_state': 347, 'depth_NN_heal': 2, 'depth_NN_state': 3, 'mode_heal': 64, 'mode_state': 64, 'blocks_heal': 7, 'blocks_state': 3, 'lift_act_state': <built-in function gelu>, 'block_act_state': <built-in function gelu>, 'lift_act_heal': <function tanh at 0x7ff3611b4cc0>, 'block_act_heal': None, 'width_heal': 47, 'width_state': 91, 'lr': 0.0014172237693348111, 'padding_heal': 1, 'padding_state': 19, 'optimizer_type': 'lbfgs'}. Best is trial 771 with value: 0.0010052043944597244.
[I 2025-07-30 22:18:42,047] Trial 993 finished with value: 0.001198342302814126 and parameters: {'width_NN_heal': 317, 'width_NN_state': 259, 'depth_NN_heal': 2, 'depth_NN_state': 3, 'mode_heal': 64, 'mode_state': 64, 'blocks_heal': 7, 'blocks_state': 3, 'lift_act_state': <built-in function gelu>, 'block_act_state': <built-in function gelu>, 'lift_act_heal': <function tanh at 0x7ff3611b4cc0>, 'block_act_heal': None, 'width_heal': 42, 'width_state': 128, 'lr': 0.0010315285819578203, 'padding_heal': 3, 'padding_state': 18, 'optimizer_type': 'lbfgs'}. Best is trial 771 with value: 0.0010052043944597244.
[I 2025-07-30 22:18:45,600] Trial 994 finished with value: 0.0012358506210148335 and parameters: {'width_NN_heal': 395, 'width_NN_state': 321, 'depth_NN_heal': 2, 'depth_NN_state': 3, 'mode_heal': 64, 'mode_state': 60, 'blocks_heal': 2, 'blocks_state': 3, 'lift_act_state': <built-in function gelu>, 'block_act_state': <built-in function gelu>, 'lift_act_heal': <function tanh at 0x7ff3611b4cc0>, 'block_act_heal': None, 'width_heal': 37, 'width_state': 78, 'lr': 0.0012999607922341188, 'padding_heal': 2, 'padding_state': 18, 'optimizer_type': 'lbfgs'}. Best is trial 771 with value: 0.0010052043944597244.
[I 2025-07-30 22:18:50,071] Trial 995 finished with value: 0.0012264461256563663 and parameters: {'width_NN_heal': 338, 'width_NN_state': 291, 'depth_NN_heal': 1, 'depth_NN_state': 3, 'mode_heal': 64, 'mode_state': 64, 'blocks_heal': 7, 'blocks_state': 3, 'lift_act_state': <built-in function gelu>, 'block_act_state': <built-in function gelu>, 'lift_act_heal': <function tanh at 0x7ff3611b4cc0>, 'block_act_heal': None, 'width_heal': 36, 'width_state': 113, 'lr': 0.0014665226904221273, 'padding_heal': 4, 'padding_state': 19, 'optimizer_type': 'lbfgs'}. Best is trial 771 with value: 0.0010052043944597244.
[I 2025-07-30 22:18:54,706] Trial 996 finished with value: 0.0011207214556634426 and parameters: {'width_NN_heal': 406, 'width_NN_state': 278, 'depth_NN_heal': 2, 'depth_NN_state': 3, 'mode_heal': 64, 'mode_state': 64, 'blocks_heal': 7, 'blocks_state': 3, 'lift_act_state': <built-in function gelu>, 'block_act_state': <built-in function gelu>, 'lift_act_heal': <function tanh at 0x7ff3611b4cc0>, 'block_act_heal': None, 'width_heal': 39, 'width_state': 90, 'lr': 0.0011767874090849602, 'padding_heal': 4, 'padding_state': 18, 'optimizer_type': 'lbfgs'}. Best is trial 771 with value: 0.0010052043944597244.
[I 2025-07-30 22:18:59,178] Trial 997 finished with value: 0.0012281070230528712 and parameters: {'width_NN_heal': 23, 'width_NN_state': 376, 'depth_NN_heal': 2, 'depth_NN_state': 2, 'mode_heal': 64, 'mode_state': 60, 'blocks_heal': 7, 'blocks_state': 3, 'lift_act_state': <built-in function gelu>, 'block_act_state': <built-in function gelu>, 'lift_act_heal': <function tanh at 0x7ff3611b4cc0>, 'block_act_heal': None, 'width_heal': 47, 'width_state': 97, 'lr': 0.0013228119786078123, 'padding_heal': 3, 'padding_state': 17, 'optimizer_type': 'lbfgs'}. Best is trial 771 with value: 0.0010052043944597244.
[I 2025-07-30 22:19:03,808] Trial 998 finished with value: 0.0012192203430458903 and parameters: {'width_NN_heal': 287, 'width_NN_state': 237, 'depth_NN_heal': 2, 'depth_NN_state': 3, 'mode_heal': 64, 'mode_state': 64, 'blocks_heal': 7, 'blocks_state': 3, 'lift_act_state': <built-in function gelu>, 'block_act_state': <built-in function gelu>, 'lift_act_heal': <function tanh at 0x7ff3611b4cc0>, 'block_act_heal': None, 'width_heal': 43, 'width_state': 75, 'lr': 0.001441482866885918, 'padding_heal': 2, 'padding_state': 19, 'optimizer_type': 'lbfgs'}. Best is trial 771 with value: 0.0010052043944597244.
[I 2025-07-30 22:19:08,428] Trial 999 finished with value: 0.0013932596193626523 and parameters: {'width_NN_heal': 442, 'width_NN_state': 316, 'depth_NN_heal': 2, 'depth_NN_state': 3, 'mode_heal': 64, 'mode_state': 64, 'blocks_heal': 7, 'blocks_state': 3, 'lift_act_state': <built-in function gelu>, 'block_act_state': <built-in function gelu>, 'lift_act_heal': <function tanh at 0x7ff3611b4cc0>, 'block_act_heal': None, 'width_heal': 36, 'width_state': 84, 'lr': 0.0011968584519400159, 'padding_heal': 4, 'padding_state': 9, 'optimizer_type': 'lbfgs'}. Best is trial 771 with value: 0.0010052043944597244.
[I 2025-07-30 22:19:12,876] Trial 1000 finished with value: 0.0011532418429851532 and parameters: {'width_NN_heal': 370, 'width_NN_state': 259, 'depth_NN_heal': 2, 'depth_NN_state': 3, 'mode_heal': 64, 'mode_state': 64, 'blocks_heal': 7, 'blocks_state': 3, 'lift_act_state': <built-in function gelu>, 'block_act_state': <built-in function gelu>, 'lift_act_heal': <function tanh at 0x7ff3611b4cc0>, 'block_act_heal': None, 'width_heal': 40, 'width_state': 105, 'lr': 0.001464886269266254, 'padding_heal': 3, 'padding_state': 17, 'optimizer_type': 'lbfgs'}. Best is trial 771 with value: 0.0010052043944597244.
[I 2025-07-30 22:19:17,464] Trial 1001 finished with value: 0.001729611656628549 and parameters: {'width_NN_heal': 310, 'width_NN_state': 355, 'depth_NN_heal': 2, 'depth_NN_state': 3, 'mode_heal': 64, 'mode_state': 60, 'blocks_heal': 7, 'blocks_state': 3, 'lift_act_state': <built-in function gelu>, 'block_act_state': <built-in function gelu>, 'lift_act_heal': <function tanh at 0x7ff3611b4cc0>, 'block_act_heal': None, 'width_heal': 36, 'width_state': 74, 'lr': 0.0012638620137303811, 'padding_heal': 4, 'padding_state': 18, 'optimizer_type': 'lbfgs'}. Best is trial 771 with value: 0.0010052043944597244.
[I 2025-07-30 22:19:21,900] Trial 1002 finished with value: 0.0013985532568767667 and parameters: {'width_NN_heal': 348, 'width_NN_state': 294, 'depth_NN_heal': 2, 'depth_NN_state': 3, 'mode_heal': 64, 'mode_state': 64, 'blocks_heal': 7, 'blocks_state': 3, 'lift_act_state': <built-in function gelu>, 'block_act_state': <built-in function gelu>, 'lift_act_heal': None, 'block_act_heal': None, 'width_heal': 44, 'width_state': 114, 'lr': 0.0009203751227978646, 'padding_heal': 3, 'padding_state': 19, 'optimizer_type': 'lbfgs'}. Best is trial 771 with value: 0.0010052043944597244.
[I 2025-07-30 22:19:26,391] Trial 1003 finished with value: 0.0013080983189865947 and parameters: {'width_NN_heal': 436, 'width_NN_state': 329, 'depth_NN_heal': 1, 'depth_NN_state': 3, 'mode_heal': 60, 'mode_state': 64, 'blocks_heal': 7, 'blocks_state': 3, 'lift_act_state': <built-in function gelu>, 'block_act_state': <built-in function gelu>, 'lift_act_heal': <function tanh at 0x7ff3611b4cc0>, 'block_act_heal': None, 'width_heal': 39, 'width_state': 98, 'lr': 0.0014593186775034186, 'padding_heal': 4, 'padding_state': 18, 'optimizer_type': 'lbfgs'}. Best is trial 771 with value: 0.0010052043944597244.
[I 2025-07-30 22:19:31,048] Trial 1004 finished with value: 0.0012233649613335729 and parameters: {'width_NN_heal': 393, 'width_NN_state': 274, 'depth_NN_heal': 2, 'depth_NN_state': 3, 'mode_heal': 60, 'mode_state': 64, 'blocks_heal': 7, 'blocks_state': 3, 'lift_act_state': <built-in function gelu>, 'block_act_state': <built-in function gelu>, 'lift_act_heal': <function tanh at 0x7ff3611b4cc0>, 'block_act_heal': None, 'width_heal': 35, 'width_state': 80, 'lr': 0.0010846209498513886, 'padding_heal': 2, 'padding_state': 19, 'optimizer_type': 'lbfgs'}. Best is trial 771 with value: 0.0010052043944597244.
[I 2025-07-30 22:19:35,515] Trial 1005 finished with value: 0.0011925718281418085 and parameters: {'width_NN_heal': 291, 'width_NN_state': 396, 'depth_NN_heal': 2, 'depth_NN_state': 2, 'mode_heal': 64, 'mode_state': 64, 'blocks_heal': 7, 'blocks_state': 3, 'lift_act_state': <built-in function gelu>, 'block_act_state': <built-in function gelu>, 'lift_act_heal': <function tanh at 0x7ff3611b4cc0>, 'block_act_heal': None, 'width_heal': 42, 'width_state': 89, 'lr': 0.0013811536550504362, 'padding_heal': 3, 'padding_state': 18, 'optimizer_type': 'lbfgs'}. Best is trial 771 with value: 0.0010052043944597244.
[I 2025-07-30 22:19:40,102] Trial 1006 finished with value: 0.0020059843081980944 and parameters: {'width_NN_heal': 344, 'width_NN_state': 242, 'depth_NN_heal': 2, 'depth_NN_state': 3, 'mode_heal': 60, 'mode_state': 60, 'blocks_heal': 7, 'blocks_state': 3, 'lift_act_state': <built-in function gelu>, 'block_act_state': <function tanh at 0x7ff3611b4cc0>, 'lift_act_heal': <function tanh at 0x7ff3611b4cc0>, 'block_act_heal': None, 'width_heal': 38, 'width_state': 109, 'lr': 0.0015141002506244463, 'padding_heal': 4, 'padding_state': 17, 'optimizer_type': 'lbfgs'}. Best is trial 771 with value: 0.0010052043944597244.
[I 2025-07-30 22:19:44,724] Trial 1007 finished with value: 0.007054165005683899 and parameters: {'width_NN_heal': 498, 'width_NN_state': 308, 'depth_NN_heal': 2, 'depth_NN_state': 3, 'mode_heal': 60, 'mode_state': 64, 'blocks_heal': 7, 'blocks_state': 3, 'lift_act_state': <built-in function gelu>, 'block_act_state': <built-in function gelu>, 'lift_act_heal': <function tanh at 0x7ff3611b4cc0>, 'block_act_heal': None, 'width_heal': 35, 'width_state': 71, 'lr': 0.0013119490692901593, 'padding_heal': 3, 'padding_state': 0, 'optimizer_type': 'lbfgs'}. Best is trial 771 with value: 0.0010052043944597244.
[I 2025-07-30 22:19:49,357] Trial 1008 finished with value: 0.0010404058266431093 and parameters: {'width_NN_heal': 328, 'width_NN_state': 343, 'depth_NN_heal': 2, 'depth_NN_state': 3, 'mode_heal': 60, 'mode_state': 64, 'blocks_heal': 7, 'blocks_state': 3, 'lift_act_state': <built-in function gelu>, 'block_act_state': <built-in function gelu>, 'lift_act_heal': <function tanh at 0x7ff3611b4cc0>, 'block_act_heal': None, 'width_heal': 41, 'width_state': 77, 'lr': 0.0011713804205341944, 'padding_heal': 4, 'padding_state': 17, 'optimizer_type': 'lbfgs'}. Best is trial 771 with value: 0.0010052043944597244.
[I 2025-07-30 22:19:53,832] Trial 1009 finished with value: 0.001069256803020835 and parameters: {'width_NN_heal': 320, 'width_NN_state': 281, 'depth_NN_heal': 2, 'depth_NN_state': 3, 'mode_heal': 60, 'mode_state': 64, 'blocks_heal': 7, 'blocks_state': 3, 'lift_act_state': <built-in function gelu>, 'block_act_state': <built-in function gelu>, 'lift_act_heal': <function tanh at 0x7ff3611b4cc0>, 'block_act_heal': None, 'width_heal': 48, 'width_state': 78, 'lr': 0.0011194001549594812, 'padding_heal': 3, 'padding_state': 17, 'optimizer_type': 'lbfgs'}. Best is trial 771 with value: 0.0010052043944597244.
[I 2025-07-30 22:19:58,250] Trial 1010 finished with value: 0.0016316758701577783 and parameters: {'width_NN_heal': 320, 'width_NN_state': 322, 'depth_NN_heal': 2, 'depth_NN_state': 3, 'mode_heal': 60, 'mode_state': 64, 'blocks_heal': 7, 'blocks_state': 3, 'lift_act_state': None, 'block_act_state': <built-in function gelu>, 'lift_act_heal': <function tanh at 0x7ff3611b4cc0>, 'block_act_heal': None, 'width_heal': 48, 'width_state': 80, 'lr': 0.000990449867369675, 'padding_heal': 3, 'padding_state': 15, 'optimizer_type': 'lbfgs'}. Best is trial 771 with value: 0.0010052043944597244.
[I 2025-07-30 22:20:02,844] Trial 1011 finished with value: 0.001227780943736434 and parameters: {'width_NN_heal': 321, 'width_NN_state': 303, 'depth_NN_heal': 2, 'depth_NN_state': 3, 'mode_heal': 60, 'mode_state': 64, 'blocks_heal': 7, 'blocks_state': 3, 'lift_act_state': <built-in function gelu>, 'block_act_state': <built-in function gelu>, 'lift_act_heal': <function tanh at 0x7ff3611b4cc0>, 'block_act_heal': None, 'width_heal': 46, 'width_state': 72, 'lr': 0.0011535852954576366, 'padding_heal': 1, 'padding_state': 17, 'optimizer_type': 'lbfgs'}. Best is trial 771 with value: 0.0010052043944597244.
[I 2025-07-30 22:20:07,400] Trial 1012 finished with value: 0.002586039248853922 and parameters: {'width_NN_heal': 345, 'width_NN_state': 291, 'depth_NN_heal': 2, 'depth_NN_state': 3, 'mode_heal': 60, 'mode_state': 64, 'blocks_heal': 7, 'blocks_state': 3, 'lift_act_state': <built-in function gelu>, 'block_act_state': None, 'lift_act_heal': <function tanh at 0x7ff3611b4cc0>, 'block_act_heal': None, 'width_heal': 48, 'width_state': 76, 'lr': 0.0010279846367887099, 'padding_heal': 2, 'padding_state': 17, 'optimizer_type': 'lbfgs'}. Best is trial 771 with value: 0.0010052043944597244.
[I 2025-07-30 22:20:11,855] Trial 1013 finished with value: 0.0011820083018392324 and parameters: {'width_NN_heal': 301, 'width_NN_state': 342, 'depth_NN_heal': 2, 'depth_NN_state': 3, 'mode_heal': 64, 'mode_state': 64, 'blocks_heal': 7, 'blocks_state': 3, 'lift_act_state': <built-in function gelu>, 'block_act_state': <built-in function gelu>, 'lift_act_heal': <function tanh at 0x7ff3611b4cc0>, 'block_act_heal': None, 'width_heal': 44, 'width_state': 80, 'lr': 0.0009371593454488066, 'padding_heal': 3, 'padding_state': 17, 'optimizer_type': 'lbfgs'}. Best is trial 771 with value: 0.0010052043944597244.
