[I 2025-07-30 21:14:11,403] Trial 213 finished with value: 0.0015564835630357265 and parameters: {'width_NN_heal': 33, 'width_NN_state': 39, 'depth_NN_heal': 8, 'depth_NN_state': 6, 'mode_heal': 44, 'mode_state': 52, 'blocks_heal': 8, 'blocks_state': 5, 'lift_act_state': <function tanh at 0x7ff3611b4cc0>, 'block_act_state': <built-in function gelu>, 'lift_act_heal': <built-in function gelu>, 'block_act_heal': <built-in function gelu>, 'width_heal': 36, 'width_state': 118, 'lr': 0.0027137862831053574, 'padding_heal': 10, 'padding_state': 22, 'optimizer_type': 'adam'}. Best is trial 174 with value: 0.001268339459784329.
[I 2025-07-30 21:14:17,766] Trial 214 finished with value: 0.001457959646359086 and parameters: {'width_NN_heal': 39, 'width_NN_state': 32, 'depth_NN_heal': 8, 'depth_NN_state': 6, 'mode_heal': 48, 'mode_state': 48, 'blocks_heal': 8, 'blocks_state': 5, 'lift_act_state': <function tanh at 0x7ff3611b4cc0>, 'block_act_state': <built-in function gelu>, 'lift_act_heal': <built-in function gelu>, 'block_act_heal': <built-in function gelu>, 'width_heal': 43, 'width_state': 12, 'lr': 0.002450789012300092, 'padding_heal': 7, 'padding_state': 19, 'optimizer_type': 'adam'}. Best is trial 174 with value: 0.001268339459784329.
[I 2025-07-30 21:14:23,938] Trial 215 finished with value: 0.030739307403564453 and parameters: {'width_NN_heal': 54, 'width_NN_state': 33, 'depth_NN_heal': 4, 'depth_NN_state': 8, 'mode_heal': 48, 'mode_state': 48, 'blocks_heal': 8, 'blocks_state': 5, 'lift_act_state': <function tanh at 0x7ff3611b4cc0>, 'block_act_state': <built-in function gelu>, 'lift_act_heal': <built-in function gelu>, 'block_act_heal': <built-in function gelu>, 'width_heal': 50, 'width_state': 12, 'lr': 0.00235387853548438, 'padding_heal': 7, 'padding_state': 16, 'optimizer_type': 'adam'}. Best is trial 174 with value: 0.001268339459784329.
[I 2025-07-30 21:14:30,174] Trial 216 finished with value: 0.0016690707998350263 and parameters: {'width_NN_heal': 39, 'width_NN_state': 28, 'depth_NN_heal': 8, 'depth_NN_state': 6, 'mode_heal': 48, 'mode_state': 48, 'blocks_heal': 8, 'blocks_state': 5, 'lift_act_state': <function tanh at 0x7ff3611b4cc0>, 'block_act_state': <built-in function gelu>, 'lift_act_heal': <built-in function gelu>, 'block_act_heal': <built-in function gelu>, 'width_heal': 44, 'width_state': 14, 'lr': 0.002689639023364754, 'padding_heal': 7, 'padding_state': 20, 'optimizer_type': 'adam'}. Best is trial 174 with value: 0.001268339459784329.
[I 2025-07-30 21:14:36,474] Trial 217 finished with value: 0.0017415970796719193 and parameters: {'width_NN_heal': 47, 'width_NN_state': 30, 'depth_NN_heal': 8, 'depth_NN_state': 6, 'mode_heal': 40, 'mode_state': 44, 'blocks_heal': 8, 'blocks_state': 5, 'lift_act_state': <function tanh at 0x7ff3611b4cc0>, 'block_act_state': <built-in function gelu>, 'lift_act_heal': <built-in function gelu>, 'block_act_heal': <built-in function gelu>, 'width_heal': 56, 'width_state': 13, 'lr': 0.0024483315875530745, 'padding_heal': 8, 'padding_state': 19, 'optimizer_type': 'adam'}. Best is trial 174 with value: 0.001268339459784329.
[I 2025-07-30 21:14:42,889] Trial 218 finished with value: 0.030742699280381203 and parameters: {'width_NN_heal': 36, 'width_NN_state': 35, 'depth_NN_heal': 8, 'depth_NN_state': 6, 'mode_heal': 24, 'mode_state': 48, 'blocks_heal': 8, 'blocks_state': 5, 'lift_act_state': <built-in function gelu>, 'block_act_state': None, 'lift_act_heal': <built-in function gelu>, 'block_act_heal': <built-in function gelu>, 'width_heal': 42, 'width_state': 8, 'lr': 0.0029630333163263977, 'padding_heal': 11, 'padding_state': 19, 'optimizer_type': 'adam'}. Best is trial 174 with value: 0.001268339459784329.
[I 2025-07-30 21:14:49,149] Trial 219 finished with value: 0.001702343113720417 and parameters: {'width_NN_heal': 56, 'width_NN_state': 32, 'depth_NN_heal': 8, 'depth_NN_state': 6, 'mode_heal': 40, 'mode_state': 48, 'blocks_heal': 8, 'blocks_state': 5, 'lift_act_state': <function tanh at 0x7ff3611b4cc0>, 'block_act_state': <built-in function gelu>, 'lift_act_heal': <built-in function gelu>, 'block_act_heal': <built-in function gelu>, 'width_heal': 46, 'width_state': 15, 'lr': 0.0033638953078409385, 'padding_heal': 9, 'padding_state': 18, 'optimizer_type': 'adam'}. Best is trial 174 with value: 0.001268339459784329.
[I 2025-07-30 21:14:55,315] Trial 220 finished with value: 0.0018842775607481599 and parameters: {'width_NN_heal': 44, 'width_NN_state': 26, 'depth_NN_heal': 8, 'depth_NN_state': 6, 'mode_heal': 48, 'mode_state': 56, 'blocks_heal': 8, 'blocks_state': 5, 'lift_act_state': <function tanh at 0x7ff3611b4cc0>, 'block_act_state': <built-in function gelu>, 'lift_act_heal': <built-in function gelu>, 'block_act_heal': <built-in function gelu>, 'width_heal': 52, 'width_state': 20, 'lr': 0.003651798268292648, 'padding_heal': 6, 'padding_state': 21, 'optimizer_type': 'adam'}. Best is trial 174 with value: 0.001268339459784329.
[I 2025-07-30 21:15:01,457] Trial 221 finished with value: 0.001632512779906392 and parameters: {'width_NN_heal': 40, 'width_NN_state': 42, 'depth_NN_heal': 8, 'depth_NN_state': 6, 'mode_heal': 44, 'mode_state': 52, 'blocks_heal': 8, 'blocks_state': 5, 'lift_act_state': <function tanh at 0x7ff3611b4cc0>, 'block_act_state': <built-in function gelu>, 'lift_act_heal': <built-in function gelu>, 'block_act_heal': <built-in function gelu>, 'width_heal': 40, 'width_state': 108, 'lr': 0.003119912472311493, 'padding_heal': 5, 'padding_state': 18, 'optimizer_type': 'adam'}. Best is trial 174 with value: 0.001268339459784329.
[I 2025-07-30 21:15:07,728] Trial 222 finished with value: 0.001862947130575776 and parameters: {'width_NN_heal': 31, 'width_NN_state': 37, 'depth_NN_heal': 8, 'depth_NN_state': 6, 'mode_heal': 44, 'mode_state': 52, 'blocks_heal': 8, 'blocks_state': 5, 'lift_act_state': <function tanh at 0x7ff3611b4cc0>, 'block_act_state': <built-in function gelu>, 'lift_act_heal': <built-in function gelu>, 'block_act_heal': <built-in function gelu>, 'width_heal': 39, 'width_state': 11, 'lr': 0.0030083450021258303, 'padding_heal': 8, 'padding_state': 20, 'optimizer_type': 'adam'}. Best is trial 174 with value: 0.001268339459784329.
[I 2025-07-30 21:15:13,980] Trial 223 finished with value: 0.001767250127159059 and parameters: {'width_NN_heal': 42, 'width_NN_state': 49, 'depth_NN_heal': 8, 'depth_NN_state': 6, 'mode_heal': 44, 'mode_state': 52, 'blocks_heal': 8, 'blocks_state': 5, 'lift_act_state': <function tanh at 0x7ff3611b4cc0>, 'block_act_state': <built-in function gelu>, 'lift_act_heal': <built-in function gelu>, 'block_act_heal': <built-in function gelu>, 'width_heal': 35, 'width_state': 10, 'lr': 0.0026246888042817753, 'padding_heal': 4, 'padding_state': 17, 'optimizer_type': 'adam'}. Best is trial 174 with value: 0.001268339459784329.
[I 2025-07-30 21:15:20,299] Trial 224 finished with value: 0.0018218627665191889 and parameters: {'width_NN_heal': 61, 'width_NN_state': 32, 'depth_NN_heal': 8, 'depth_NN_state': 6, 'mode_heal': 40, 'mode_state': 44, 'blocks_heal': 8, 'blocks_state': 5, 'lift_act_state': <function tanh at 0x7ff3611b4cc0>, 'block_act_state': <built-in function gelu>, 'lift_act_heal': <built-in function gelu>, 'block_act_heal': <built-in function gelu>, 'width_heal': 43, 'width_state': 12, 'lr': 0.0032176966805424847, 'padding_heal': 7, 'padding_state': 18, 'optimizer_type': 'adam'}. Best is trial 174 with value: 0.001268339459784329.
[I 2025-07-30 21:15:26,617] Trial 225 finished with value: 0.001339065027423203 and parameters: {'width_NN_heal': 39, 'width_NN_state': 29, 'depth_NN_heal': 8, 'depth_NN_state': 6, 'mode_heal': 48, 'mode_state': 52, 'blocks_heal': 8, 'blocks_state': 5, 'lift_act_state': <function tanh at 0x7ff3611b4cc0>, 'block_act_state': <built-in function gelu>, 'lift_act_heal': <built-in function gelu>, 'block_act_heal': <built-in function gelu>, 'width_heal': 49, 'width_state': 18, 'lr': 0.002829938949588618, 'padding_heal': 14, 'padding_state': 16, 'optimizer_type': 'adam'}. Best is trial 174 with value: 0.001268339459784329.
[I 2025-07-30 21:15:32,918] Trial 226 finished with value: 0.0017375960014760494 and parameters: {'width_NN_heal': 50, 'width_NN_state': 29, 'depth_NN_heal': 8, 'depth_NN_state': 6, 'mode_heal': 48, 'mode_state': 52, 'blocks_heal': 8, 'blocks_state': 5, 'lift_act_state': <function tanh at 0x7ff3611b4cc0>, 'block_act_state': <built-in function gelu>, 'lift_act_heal': <built-in function gelu>, 'block_act_heal': <built-in function gelu>, 'width_heal': 47, 'width_state': 16, 'lr': 0.002470050805789137, 'padding_heal': 14, 'padding_state': 13, 'optimizer_type': 'adam'}. Best is trial 174 with value: 0.001268339459784329.
[I 2025-07-30 21:15:39,054] Trial 227 finished with value: 0.0023039246443659067 and parameters: {'width_NN_heal': 37, 'width_NN_state': 24, 'depth_NN_heal': 7, 'depth_NN_state': 6, 'mode_heal': 48, 'mode_state': 48, 'blocks_heal': 8, 'blocks_state': 5, 'lift_act_state': <function tanh at 0x7ff3611b4cc0>, 'block_act_state': <built-in function gelu>, 'lift_act_heal': <built-in function gelu>, 'block_act_heal': <built-in function gelu>, 'width_heal': 50, 'width_state': 20, 'lr': 0.002834208210842544, 'padding_heal': 13, 'padding_state': 28, 'optimizer_type': 'adam'}. Best is trial 174 with value: 0.001268339459784329.
[I 2025-07-30 21:15:45,291] Trial 228 finished with value: 0.0017035839846357703 and parameters: {'width_NN_heal': 28, 'width_NN_state': 27, 'depth_NN_heal': 8, 'depth_NN_state': 6, 'mode_heal': 36, 'mode_state': 52, 'blocks_heal': 8, 'blocks_state': 5, 'lift_act_state': <function tanh at 0x7ff3611b4cc0>, 'block_act_state': <built-in function gelu>, 'lift_act_heal': <built-in function gelu>, 'block_act_heal': <built-in function gelu>, 'width_heal': 57, 'width_state': 19, 'lr': 0.00216024562445798, 'padding_heal': 12, 'padding_state': 15, 'optimizer_type': 'adam'}. Best is trial 174 with value: 0.001268339459784329.
[I 2025-07-30 21:15:51,463] Trial 229 finished with value: 0.0015905475011095405 and parameters: {'width_NN_heal': 33, 'width_NN_state': 34, 'depth_NN_heal': 8, 'depth_NN_state': 6, 'mode_heal': 48, 'mode_state': 56, 'blocks_heal': 8, 'blocks_state': 5, 'lift_act_state': <function tanh at 0x7ff3611b4cc0>, 'block_act_state': <built-in function gelu>, 'lift_act_heal': <built-in function gelu>, 'block_act_heal': <built-in function gelu>, 'width_heal': 52, 'width_state': 17, 'lr': 0.0028290260408020667, 'padding_heal': 9, 'padding_state': 16, 'optimizer_type': 'adam'}. Best is trial 174 with value: 0.001268339459784329.
[I 2025-07-30 21:15:57,522] Trial 230 finished with value: 0.004058010410517454 and parameters: {'width_NN_heal': 47, 'width_NN_state': 30, 'depth_NN_heal': 7, 'depth_NN_state': 6, 'mode_heal': 52, 'mode_state': 52, 'blocks_heal': 8, 'blocks_state': 5, 'lift_act_state': None, 'block_act_state': <function tanh at 0x7ff3611b4cc0>, 'lift_act_heal': <built-in function gelu>, 'block_act_heal': <built-in function gelu>, 'width_heal': 46, 'width_state': 5, 'lr': 0.0037236669248827737, 'padding_heal': 14, 'padding_state': 29, 'optimizer_type': 'adam'}. Best is trial 174 with value: 0.001268339459784329.
[I 2025-07-30 21:16:03,694] Trial 231 finished with value: 0.0016388887306675315 and parameters: {'width_NN_heal': 39, 'width_NN_state': 39, 'depth_NN_heal': 8, 'depth_NN_state': 6, 'mode_heal': 44, 'mode_state': 52, 'blocks_heal': 8, 'blocks_state': 5, 'lift_act_state': <function tanh at 0x7ff3611b4cc0>, 'block_act_state': <built-in function gelu>, 'lift_act_heal': <built-in function gelu>, 'block_act_heal': <built-in function gelu>, 'width_heal': 40, 'width_state': 18, 'lr': 0.003292459783094818, 'padding_heal': 6, 'padding_state': 17, 'optimizer_type': 'adam'}. Best is trial 174 with value: 0.001268339459784329.
[I 2025-07-30 21:16:10,430] Trial 232 finished with value: 0.03075307607650757 and parameters: {'width_NN_heal': 44, 'width_NN_state': 338, 'depth_NN_heal': 8, 'depth_NN_state': 6, 'mode_heal': 44, 'mode_state': 52, 'blocks_heal': 8, 'blocks_state': 5, 'lift_act_state': <function tanh at 0x7ff3611b4cc0>, 'block_act_state': <built-in function gelu>, 'lift_act_heal': <built-in function gelu>, 'block_act_heal': <built-in function gelu>, 'width_heal': 37, 'width_state': 117, 'lr': 0.0029359988845156686, 'padding_heal': 7, 'padding_state': 14, 'optimizer_type': 'adam'}. Best is trial 174 with value: 0.001268339459784329.
[I 2025-07-30 21:16:16,434] Trial 233 finished with value: 0.0016554942121729255 and parameters: {'width_NN_heal': 35, 'width_NN_state': 55, 'depth_NN_heal': 5, 'depth_NN_state': 6, 'mode_heal': 48, 'mode_state': 52, 'blocks_heal': 8, 'blocks_state': 5, 'lift_act_state': <function tanh at 0x7ff3611b4cc0>, 'block_act_state': <built-in function gelu>, 'lift_act_heal': <built-in function gelu>, 'block_act_heal': <built-in function gelu>, 'width_heal': 42, 'width_state': 22, 'lr': 0.003133553426994208, 'padding_heal': 5, 'padding_state': 16, 'optimizer_type': 'adam'}. Best is trial 174 with value: 0.001268339459784329.
[I 2025-07-30 21:16:22,501] Trial 234 finished with value: 0.003221872728317976 and parameters: {'width_NN_heal': 40, 'width_NN_state': 36, 'depth_NN_heal': 8, 'depth_NN_state': 6, 'mode_heal': 44, 'mode_state': 56, 'blocks_heal': 8, 'blocks_state': 5, 'lift_act_state': <function tanh at 0x7ff3611b4cc0>, 'block_act_state': <built-in function gelu>, 'lift_act_heal': <built-in function gelu>, 'block_act_heal': <built-in function gelu>, 'width_heal': 7, 'width_state': 101, 'lr': 0.002584952168390963, 'padding_heal': 6, 'padding_state': 18, 'optimizer_type': 'adam'}. Best is trial 174 with value: 0.001268339459784329.
[I 2025-07-30 21:16:28,758] Trial 235 finished with value: 0.002034593839198351 and parameters: {'width_NN_heal': 52, 'width_NN_state': 27, 'depth_NN_heal': 8, 'depth_NN_state': 6, 'mode_heal': 40, 'mode_state': 48, 'blocks_heal': 8, 'blocks_state': 5, 'lift_act_state': <function tanh at 0x7ff3611b4cc0>, 'block_act_state': <built-in function gelu>, 'lift_act_heal': <built-in function gelu>, 'block_act_heal': None, 'width_heal': 61, 'width_state': 111, 'lr': 0.0034890244833424753, 'padding_heal': 14, 'padding_state': 19, 'optimizer_type': 'adam'}. Best is trial 174 with value: 0.001268339459784329.
[I 2025-07-30 21:16:32,868] Trial 236 finished with value: 0.0017580629792064428 and parameters: {'width_NN_heal': 43, 'width_NN_state': 45, 'depth_NN_heal': 8, 'depth_NN_state': 6, 'mode_heal': 48, 'mode_state': 64, 'blocks_heal': 1, 'blocks_state': 5, 'lift_act_state': <function tanh at 0x7ff3611b4cc0>, 'block_act_state': <built-in function gelu>, 'lift_act_heal': <built-in function gelu>, 'block_act_heal': <built-in function gelu>, 'width_heal': 50, 'width_state': 13, 'lr': 0.003994140842839851, 'padding_heal': 8, 'padding_state': 17, 'optimizer_type': 'adam'}. Best is trial 174 with value: 0.001268339459784329.
[I 2025-07-30 21:16:39,176] Trial 237 finished with value: 0.0015421250136569142 and parameters: {'width_NN_heal': 37, 'width_NN_state': 29, 'depth_NN_heal': 8, 'depth_NN_state': 6, 'mode_heal': 40, 'mode_state': 52, 'blocks_heal': 8, 'blocks_state': 5, 'lift_act_state': <function tanh at 0x7ff3611b4cc0>, 'block_act_state': <built-in function gelu>, 'lift_act_heal': <built-in function gelu>, 'block_act_heal': <built-in function gelu>, 'width_heal': 55, 'width_state': 95, 'lr': 0.0023301388568494875, 'padding_heal': 7, 'padding_state': 29, 'optimizer_type': 'adam'}. Best is trial 174 with value: 0.001268339459784329.
[I 2025-07-30 21:16:45,415] Trial 238 finished with value: 0.0017675264971330762 and parameters: {'width_NN_heal': 57, 'width_NN_state': 32, 'depth_NN_heal': 8, 'depth_NN_state': 6, 'mode_heal': 44, 'mode_state': 52, 'blocks_heal': 8, 'blocks_state': 5, 'lift_act_state': <function tanh at 0x7ff3611b4cc0>, 'block_act_state': <built-in function gelu>, 'lift_act_heal': <function tanh at 0x7ff3611b4cc0>, 'block_act_heal': <built-in function gelu>, 'width_heal': 33, 'width_state': 124, 'lr': 0.0027406556398723984, 'padding_heal': 13, 'padding_state': 28, 'optimizer_type': 'adam'}. Best is trial 174 with value: 0.001268339459784329.
[I 2025-07-30 21:16:52,033] Trial 239 finished with value: 0.03074159473180771 and parameters: {'width_NN_heal': 47, 'width_NN_state': 40, 'depth_NN_heal': 8, 'depth_NN_state': 6, 'mode_heal': 60, 'mode_state': 52, 'blocks_heal': 8, 'blocks_state': 6, 'lift_act_state': <function tanh at 0x7ff3611b4cc0>, 'block_act_state': <built-in function gelu>, 'lift_act_heal': <built-in function gelu>, 'block_act_heal': <built-in function gelu>, 'width_heal': 45, 'width_state': 18, 'lr': 0.0030461101376367604, 'padding_heal': 6, 'padding_state': 18, 'optimizer_type': 'adam'}. Best is trial 174 with value: 0.001268339459784329.
[I 2025-07-30 21:16:58,238] Trial 240 finished with value: 0.0018655279418453574 and parameters: {'width_NN_heal': 31, 'width_NN_state': 25, 'depth_NN_heal': 8, 'depth_NN_state': 6, 'mode_heal': 28, 'mode_state': 48, 'blocks_heal': 8, 'blocks_state': 5, 'lift_act_state': <function tanh at 0x7ff3611b4cc0>, 'block_act_state': <built-in function gelu>, 'lift_act_heal': <built-in function gelu>, 'block_act_heal': <built-in function gelu>, 'width_heal': 39, 'width_state': 9, 'lr': 0.003228052681932998, 'padding_heal': 15, 'padding_state': 29, 'optimizer_type': 'lbfgs'}. Best is trial 174 with value: 0.001268339459784329.
[I 2025-07-30 21:17:02,930] Trial 241 finished with value: 0.0015054133255034685 and parameters: {'width_NN_heal': 51, 'width_NN_state': 37, 'depth_NN_heal': 8, 'depth_NN_state': 6, 'mode_heal': 48, 'mode_state': 60, 'blocks_heal': 3, 'blocks_state': 5, 'lift_act_state': <function tanh at 0x7ff3611b4cc0>, 'block_act_state': <built-in function gelu>, 'lift_act_heal': <built-in function gelu>, 'block_act_heal': <built-in function gelu>, 'width_heal': 49, 'width_state': 106, 'lr': 0.0025478634717921033, 'padding_heal': 8, 'padding_state': 32, 'optimizer_type': 'adam'}. Best is trial 174 with value: 0.001268339459784329.
[I 2025-07-30 21:17:09,232] Trial 242 finished with value: 0.0013817797880619764 and parameters: {'width_NN_heal': 50, 'width_NN_state': 35, 'depth_NN_heal': 8, 'depth_NN_state': 6, 'mode_heal': 48, 'mode_state': 60, 'blocks_heal': 8, 'blocks_state': 5, 'lift_act_state': <function tanh at 0x7ff3611b4cc0>, 'block_act_state': <built-in function gelu>, 'lift_act_heal': <built-in function gelu>, 'block_act_heal': <built-in function gelu>, 'width_heal': 48, 'width_state': 100, 'lr': 0.0024901747112877934, 'padding_heal': 8, 'padding_state': 16, 'optimizer_type': 'adam'}. Best is trial 174 with value: 0.001268339459784329.
[I 2025-07-30 21:17:15,396] Trial 243 finished with value: 0.0014551643980666995 and parameters: {'width_NN_heal': 42, 'width_NN_state': 33, 'depth_NN_heal': 8, 'depth_NN_state': 6, 'mode_heal': 48, 'mode_state': 64, 'blocks_heal': 8, 'blocks_state': 5, 'lift_act_state': <function tanh at 0x7ff3611b4cc0>, 'block_act_state': <built-in function gelu>, 'lift_act_heal': <built-in function gelu>, 'block_act_heal': <built-in function gelu>, 'width_heal': 44, 'width_state': 12, 'lr': 0.002854392272523175, 'padding_heal': 9, 'padding_state': 16, 'optimizer_type': 'adam'}. Best is trial 174 with value: 0.001268339459784329.
[I 2025-07-30 21:17:21,700] Trial 244 finished with value: 0.0016365619376301765 and parameters: {'width_NN_heal': 46, 'width_NN_state': 32, 'depth_NN_heal': 8, 'depth_NN_state': 6, 'mode_heal': 48, 'mode_state': 60, 'blocks_heal': 8, 'blocks_state': 5, 'lift_act_state': <function tanh at 0x7ff3611b4cc0>, 'block_act_state': <built-in function gelu>, 'lift_act_heal': <built-in function gelu>, 'block_act_heal': <built-in function gelu>, 'width_heal': 54, 'width_state': 11, 'lr': 0.0023566213973788483, 'padding_heal': 8, 'padding_state': 15, 'optimizer_type': 'adam'}. Best is trial 174 with value: 0.001268339459784329.
[I 2025-07-30 21:17:27,441] Trial 245 finished with value: 0.0013353037647902966 and parameters: {'width_NN_heal': 57, 'width_NN_state': 35, 'depth_NN_heal': 2, 'depth_NN_state': 6, 'mode_heal': 48, 'mode_state': 64, 'blocks_heal': 8, 'blocks_state': 5, 'lift_act_state': <function tanh at 0x7ff3611b4cc0>, 'block_act_state': <built-in function gelu>, 'lift_act_heal': <built-in function gelu>, 'block_act_heal': <built-in function gelu>, 'width_heal': 45, 'width_state': 13, 'lr': 0.0028351960014545473, 'padding_heal': 10, 'padding_state': 16, 'optimizer_type': 'adam'}. Best is trial 174 with value: 0.001268339459784329.
[I 2025-07-30 21:17:33,622] Trial 246 finished with value: 0.0017225219635292888 and parameters: {'width_NN_heal': 55, 'width_NN_state': 31, 'depth_NN_heal': 7, 'depth_NN_state': 6, 'mode_heal': 48, 'mode_state': 64, 'blocks_heal': 8, 'blocks_state': 5, 'lift_act_state': <function tanh at 0x7ff3611b4cc0>, 'block_act_state': <built-in function gelu>, 'lift_act_heal': <built-in function gelu>, 'block_act_heal': <built-in function gelu>, 'width_heal': 49, 'width_state': 12, 'lr': 0.0027279009282654802, 'padding_heal': 9, 'padding_state': 16, 'optimizer_type': 'adam'}. Best is trial 174 with value: 0.001268339459784329.
[I 2025-07-30 21:17:39,558] Trial 247 finished with value: 0.0016486612148582935 and parameters: {'width_NN_heal': 62, 'width_NN_state': 28, 'depth_NN_heal': 4, 'depth_NN_state': 6, 'mode_heal': 52, 'mode_state': 64, 'blocks_heal': 8, 'blocks_state': 5, 'lift_act_state': <function tanh at 0x7ff3611b4cc0>, 'block_act_state': <built-in function gelu>, 'lift_act_heal': <built-in function gelu>, 'block_act_heal': <built-in function gelu>, 'width_heal': 43, 'width_state': 14, 'lr': 0.0022052453823980193, 'padding_heal': 9, 'padding_state': 14, 'optimizer_type': 'adam'}. Best is trial 174 with value: 0.001268339459784329.
