[I 2025-07-30 23:23:28,123] Trial 1770 finished with value: 0.0011690823594108224 and parameters: {'width_NN_heal': 345, 'width_NN_state': 380, 'depth_NN_heal': 2, 'depth_NN_state': 3, 'mode_heal': 64, 'mode_state': 36, 'blocks_heal': 8, 'blocks_state': 3, 'lift_act_state': <built-in function gelu>, 'block_act_state': <built-in function gelu>, 'lift_act_heal': <built-in function gelu>, 'block_act_heal': None, 'width_heal': 48, 'width_state': 128, 'lr': 0.0014293112276023974, 'padding_heal': 4, 'padding_state': 18, 'optimizer_type': 'lbfgs'}. Best is trial 1511 with value: 0.0009640019852668047.
[I 2025-07-30 23:23:33,163] Trial 1771 finished with value: 0.0012682101223617792 and parameters: {'width_NN_heal': 14, 'width_NN_state': 316, 'depth_NN_heal': 2, 'depth_NN_state': 3, 'mode_heal': 56, 'mode_state': 36, 'blocks_heal': 8, 'blocks_state': 3, 'lift_act_state': <built-in function gelu>, 'block_act_state': <built-in function gelu>, 'lift_act_heal': <built-in function gelu>, 'block_act_heal': None, 'width_heal': 61, 'width_state': 86, 'lr': 0.0016529039739296995, 'padding_heal': 7, 'padding_state': 17, 'optimizer_type': 'lbfgs'}. Best is trial 1511 with value: 0.0009640019852668047.
[I 2025-07-30 23:23:38,266] Trial 1772 finished with value: 0.0010528366547077894 and parameters: {'width_NN_heal': 466, 'width_NN_state': 282, 'depth_NN_heal': 2, 'depth_NN_state': 3, 'mode_heal': 60, 'mode_state': 56, 'blocks_heal': 8, 'blocks_state': 3, 'lift_act_state': <built-in function gelu>, 'block_act_state': <built-in function gelu>, 'lift_act_heal': <built-in function gelu>, 'block_act_heal': None, 'width_heal': 51, 'width_state': 128, 'lr': 0.0020057126310542048, 'padding_heal': 4, 'padding_state': 16, 'optimizer_type': 'lbfgs'}. Best is trial 1511 with value: 0.0009640019852668047.
[I 2025-07-30 23:23:43,211] Trial 1773 finished with value: 0.001244588871486485 and parameters: {'width_NN_heal': 378, 'width_NN_state': 343, 'depth_NN_heal': 2, 'depth_NN_state': 3, 'mode_heal': 64, 'mode_state': 32, 'blocks_heal': 8, 'blocks_state': 3, 'lift_act_state': <built-in function gelu>, 'block_act_state': <built-in function gelu>, 'lift_act_heal': <built-in function gelu>, 'block_act_heal': None, 'width_heal': 44, 'width_state': 113, 'lr': 0.0013534225892969424, 'padding_heal': 6, 'padding_state': 15, 'optimizer_type': 'lbfgs'}. Best is trial 1511 with value: 0.0009640019852668047.
[I 2025-07-30 23:23:49,329] Trial 1774 finished with value: 0.01616571843624115 and parameters: {'width_NN_heal': 413, 'width_NN_state': 251, 'depth_NN_heal': 2, 'depth_NN_state': 7, 'mode_heal': 60, 'mode_state': 40, 'blocks_heal': 8, 'blocks_state': 4, 'lift_act_state': <built-in function gelu>, 'block_act_state': <built-in function gelu>, 'lift_act_heal': <built-in function gelu>, 'block_act_heal': None, 'width_heal': 53, 'width_state': 120, 'lr': 0.001777995931499352, 'padding_heal': 7, 'padding_state': 18, 'optimizer_type': 'lbfgs'}. Best is trial 1511 with value: 0.0009640019852668047.
[I 2025-07-30 23:23:54,441] Trial 1775 finished with value: 0.0013826487120240927 and parameters: {'width_NN_heal': 351, 'width_NN_state': 512, 'depth_NN_heal': 2, 'depth_NN_state': 3, 'mode_heal': 60, 'mode_state': 36, 'blocks_heal': 6, 'blocks_state': 3, 'lift_act_state': <built-in function gelu>, 'block_act_state': <built-in function gelu>, 'lift_act_heal': <built-in function gelu>, 'block_act_heal': None, 'width_heal': 48, 'width_state': 107, 'lr': 0.0015770968467955756, 'padding_heal': 3, 'padding_state': 16, 'optimizer_type': 'lbfgs'}. Best is trial 1511 with value: 0.0009640019852668047.
[I 2025-07-30 23:23:59,809] Trial 1776 finished with value: 0.0011612533126026392 and parameters: {'width_NN_heal': 476, 'width_NN_state': 298, 'depth_NN_heal': 2, 'depth_NN_state': 3, 'mode_heal': 64, 'mode_state': 56, 'blocks_heal': 8, 'blocks_state': 3, 'lift_act_state': <built-in function gelu>, 'block_act_state': <built-in function gelu>, 'lift_act_heal': <built-in function gelu>, 'block_act_heal': None, 'width_heal': 57, 'width_state': 128, 'lr': 0.0024720598165115667, 'padding_heal': 11, 'padding_state': 17, 'optimizer_type': 'lbfgs'}. Best is trial 1511 with value: 0.0009640019852668047.
[I 2025-07-30 23:24:04,421] Trial 1777 finished with value: 0.0013497609179466963 and parameters: {'width_NN_heal': 383, 'width_NN_state': 366, 'depth_NN_heal': 2, 'depth_NN_state': 2, 'mode_heal': 60, 'mode_state': 36, 'blocks_heal': 8, 'blocks_state': 2, 'lift_act_state': <built-in function gelu>, 'block_act_state': <built-in function gelu>, 'lift_act_heal': <built-in function gelu>, 'block_act_heal': None, 'width_heal': 45, 'width_state': 96, 'lr': 0.002188033301142984, 'padding_heal': 8, 'padding_state': 18, 'optimizer_type': 'lbfgs'}. Best is trial 1511 with value: 0.0009640019852668047.
[I 2025-07-30 23:24:09,081] Trial 1778 finished with value: 0.0017319535836577415 and parameters: {'width_NN_heal': 441, 'width_NN_state': 432, 'depth_NN_heal': 1, 'depth_NN_state': 1, 'mode_heal': 64, 'mode_state': 36, 'blocks_heal': 8, 'blocks_state': 3, 'lift_act_state': <built-in function gelu>, 'block_act_state': <built-in function gelu>, 'lift_act_heal': <built-in function gelu>, 'block_act_heal': None, 'width_heal': 63, 'width_state': 106, 'lr': 0.0014408007714459391, 'padding_heal': 5, 'padding_state': 15, 'optimizer_type': 'lbfgs'}. Best is trial 1511 with value: 0.0009640019852668047.
[I 2025-07-30 23:24:13,966] Trial 1779 finished with value: 0.0028007705695927143 and parameters: {'width_NN_heal': 403, 'width_NN_state': 328, 'depth_NN_heal': 2, 'depth_NN_state': 3, 'mode_heal': 60, 'mode_state': 36, 'blocks_heal': 8, 'blocks_state': 3, 'lift_act_state': <built-in function gelu>, 'block_act_state': <built-in function gelu>, 'lift_act_heal': None, 'block_act_heal': None, 'width_heal': 15, 'width_state': 114, 'lr': 0.001880588843675712, 'padding_heal': 5, 'padding_state': 17, 'optimizer_type': 'lbfgs'}. Best is trial 1511 with value: 0.0009640019852668047.
[I 2025-07-30 23:24:18,900] Trial 1780 finished with value: 0.0016883036587387323 and parameters: {'width_NN_heal': 346, 'width_NN_state': 262, 'depth_NN_heal': 2, 'depth_NN_state': 3, 'mode_heal': 64, 'mode_state': 56, 'blocks_heal': 8, 'blocks_state': 3, 'lift_act_state': <built-in function gelu>, 'block_act_state': <function tanh at 0x7ff3611b4cc0>, 'lift_act_heal': <built-in function gelu>, 'block_act_heal': None, 'width_heal': 56, 'width_state': 119, 'lr': 0.0016269753365967126, 'padding_heal': 3, 'padding_state': 16, 'optimizer_type': 'lbfgs'}. Best is trial 1511 with value: 0.0009640019852668047.
[I 2025-07-30 23:24:24,466] Trial 1781 finished with value: 0.0011321130441501737 and parameters: {'width_NN_heal': 430, 'width_NN_state': 403, 'depth_NN_heal': 2, 'depth_NN_state': 3, 'mode_heal': 56, 'mode_state': 40, 'blocks_heal': 8, 'blocks_state': 3, 'lift_act_state': <built-in function gelu>, 'block_act_state': <built-in function gelu>, 'lift_act_heal': <built-in function gelu>, 'block_act_heal': None, 'width_heal': 49, 'width_state': 85, 'lr': 0.0013749399481060359, 'padding_heal': 4, 'padding_state': 17, 'optimizer_type': 'lbfgs'}. Best is trial 1511 with value: 0.0009640019852668047.
[I 2025-07-30 23:24:29,515] Trial 1782 finished with value: 0.0018485115142539144 and parameters: {'width_NN_heal': 364, 'width_NN_state': 304, 'depth_NN_heal': 2, 'depth_NN_state': 3, 'mode_heal': 60, 'mode_state': 32, 'blocks_heal': 8, 'blocks_state': 3, 'lift_act_state': <built-in function gelu>, 'block_act_state': <built-in function gelu>, 'lift_act_heal': <built-in function gelu>, 'block_act_heal': <built-in function gelu>, 'width_heal': 42, 'width_state': 93, 'lr': 0.0017180145110138887, 'padding_heal': 6, 'padding_state': 18, 'optimizer_type': 'lbfgs'}. Best is trial 1511 with value: 0.0009640019852668047.
[I 2025-07-30 23:24:34,960] Trial 1783 finished with value: 0.001233471091836691 and parameters: {'width_NN_heal': 394, 'width_NN_state': 351, 'depth_NN_heal': 2, 'depth_NN_state': 3, 'mode_heal': 64, 'mode_state': 36, 'blocks_heal': 8, 'blocks_state': 3, 'lift_act_state': <built-in function gelu>, 'block_act_state': <built-in function gelu>, 'lift_act_heal': <built-in function gelu>, 'block_act_heal': None, 'width_heal': 60, 'width_state': 104, 'lr': 0.002060362546936474, 'padding_heal': 27, 'padding_state': 16, 'optimizer_type': 'lbfgs'}. Best is trial 1511 with value: 0.0009640019852668047.
[I 2025-07-30 23:24:40,151] Trial 1784 finished with value: 0.0012525479542091489 and parameters: {'width_NN_heal': 476, 'width_NN_state': 273, 'depth_NN_heal': 2, 'depth_NN_state': 3, 'mode_heal': 60, 'mode_state': 40, 'blocks_heal': 8, 'blocks_state': 3, 'lift_act_state': <built-in function gelu>, 'block_act_state': <built-in function gelu>, 'lift_act_heal': <built-in function gelu>, 'block_act_heal': None, 'width_heal': 52, 'width_state': 114, 'lr': 0.0015093588628546078, 'padding_heal': 4, 'padding_state': 14, 'optimizer_type': 'lbfgs'}. Best is trial 1511 with value: 0.0009640019852668047.
[I 2025-07-30 23:24:45,107] Trial 1785 finished with value: 0.0018045237520709634 and parameters: {'width_NN_heal': 333, 'width_NN_state': 383, 'depth_NN_heal': 2, 'depth_NN_state': 3, 'mode_heal': 64, 'mode_state': 56, 'blocks_heal': 8, 'blocks_state': 3, 'lift_act_state': <built-in function gelu>, 'block_act_state': None, 'lift_act_heal': <built-in function gelu>, 'block_act_heal': None, 'width_heal': 47, 'width_state': 100, 'lr': 0.001865596005514586, 'padding_heal': 5, 'padding_state': 17, 'optimizer_type': 'lbfgs'}. Best is trial 1511 with value: 0.0009640019852668047.
[I 2025-07-30 23:24:51,255] Trial 1786 finished with value: 0.004565144889056683 and parameters: {'width_NN_heal': 422, 'width_NN_state': 321, 'depth_NN_heal': 5, 'depth_NN_state': 3, 'mode_heal': 60, 'mode_state': 40, 'blocks_heal': 8, 'blocks_state': 3, 'lift_act_state': <built-in function gelu>, 'block_act_state': <built-in function gelu>, 'lift_act_heal': <built-in function gelu>, 'block_act_heal': None, 'width_heal': 4, 'width_state': 108, 'lr': 0.001680555855949452, 'padding_heal': 3, 'padding_state': 18, 'optimizer_type': 'lbfgs'}. Best is trial 1511 with value: 0.0009640019852668047.
[I 2025-07-30 23:24:55,453] Trial 1787 finished with value: 0.002073775278404355 and parameters: {'width_NN_heal': 372, 'width_NN_state': 288, 'depth_NN_heal': 2, 'depth_NN_state': 3, 'mode_heal': 56, 'mode_state': 52, 'blocks_heal': 5, 'blocks_state': 3, 'lift_act_state': None, 'block_act_state': <built-in function gelu>, 'lift_act_heal': <built-in function gelu>, 'block_act_heal': None, 'width_heal': 55, 'width_state': 121, 'lr': 0.0023102834204547667, 'padding_heal': 10, 'padding_state': 16, 'optimizer_type': 'lbfgs'}. Best is trial 1511 with value: 0.0009640019852668047.
[I 2025-07-30 23:24:58,754] Trial 1788 finished with value: 0.001459649414755404 and parameters: {'width_NN_heal': 339, 'width_NN_state': 345, 'depth_NN_heal': 2, 'depth_NN_state': 3, 'mode_heal': 40, 'mode_state': 36, 'blocks_heal': 1, 'blocks_state': 3, 'lift_act_state': <built-in function gelu>, 'block_act_state': <built-in function gelu>, 'lift_act_heal': <built-in function gelu>, 'block_act_heal': None, 'width_heal': 44, 'width_state': 92, 'lr': 0.0013544405453627178, 'padding_heal': 6, 'padding_state': 15, 'optimizer_type': 'adam'}. Best is trial 1511 with value: 0.0009640019852668047.
[I 2025-07-30 23:25:04,052] Trial 1789 finished with value: 0.0011678595328703523 and parameters: {'width_NN_heal': 437, 'width_NN_state': 457, 'depth_NN_heal': 2, 'depth_NN_state': 3, 'mode_heal': 36, 'mode_state': 52, 'blocks_heal': 6, 'blocks_state': 3, 'lift_act_state': <built-in function gelu>, 'block_act_state': <built-in function gelu>, 'lift_act_heal': <built-in function gelu>, 'block_act_heal': None, 'width_heal': 50, 'width_state': 112, 'lr': 0.001593394236164988, 'padding_heal': 5, 'padding_state': 20, 'optimizer_type': 'lbfgs'}. Best is trial 1511 with value: 0.0009640019852668047.
[I 2025-07-30 23:25:08,956] Trial 1790 finished with value: 0.0011188145726919174 and parameters: {'width_NN_heal': 387, 'width_NN_state': 256, 'depth_NN_heal': 1, 'depth_NN_state': 3, 'mode_heal': 64, 'mode_state': 56, 'blocks_heal': 8, 'blocks_state': 3, 'lift_act_state': <built-in function gelu>, 'block_act_state': <built-in function gelu>, 'lift_act_heal': <built-in function gelu>, 'block_act_heal': None, 'width_heal': 54, 'width_state': 86, 'lr': 0.0019991518299072968, 'padding_heal': 3, 'padding_state': 17, 'optimizer_type': 'lbfgs'}. Best is trial 1511 with value: 0.0009640019852668047.
[I 2025-07-30 23:25:15,498] Trial 1791 finished with value: 0.0016021772753447294 and parameters: {'width_NN_heal': 467, 'width_NN_state': 312, 'depth_NN_heal': 2, 'depth_NN_state': 3, 'mode_heal': 60, 'mode_state': 56, 'blocks_heal': 8, 'blocks_state': 7, 'lift_act_state': <built-in function gelu>, 'block_act_state': <built-in function gelu>, 'lift_act_heal': <built-in function gelu>, 'block_act_heal': None, 'width_heal': 62, 'width_state': 103, 'lr': 0.0017958861022370732, 'padding_heal': 4, 'padding_state': 19, 'optimizer_type': 'lbfgs'}. Best is trial 1511 with value: 0.0009640019852668047.
[I 2025-07-30 23:25:19,810] Trial 1792 finished with value: 0.0019289078190922737 and parameters: {'width_NN_heal': 365, 'width_NN_state': 375, 'depth_NN_heal': 2, 'depth_NN_state': 3, 'mode_heal': 64, 'mode_state': 52, 'blocks_heal': 6, 'blocks_state': 3, 'lift_act_state': <built-in function gelu>, 'block_act_state': <built-in function gelu>, 'lift_act_heal': None, 'block_act_heal': None, 'width_heal': 13, 'width_state': 121, 'lr': 0.001480245147160617, 'padding_heal': 9, 'padding_state': 16, 'optimizer_type': 'lbfgs'}. Best is trial 1511 with value: 0.0009640019852668047.
[I 2025-07-30 23:25:24,880] Trial 1793 finished with value: 0.0010932511650025845 and parameters: {'width_NN_heal': 404, 'width_NN_state': 283, 'depth_NN_heal': 2, 'depth_NN_state': 3, 'mode_heal': 60, 'mode_state': 60, 'blocks_heal': 8, 'blocks_state': 3, 'lift_act_state': <built-in function gelu>, 'block_act_state': <built-in function gelu>, 'lift_act_heal': <built-in function gelu>, 'block_act_heal': None, 'width_heal': 42, 'width_state': 97, 'lr': 0.0026063061268478526, 'padding_heal': 4, 'padding_state': 17, 'optimizer_type': 'lbfgs'}. Best is trial 1511 with value: 0.0009640019852668047.
[I 2025-07-30 23:25:29,654] Trial 1794 finished with value: 0.0011749505065381527 and parameters: {'width_NN_heal': 342, 'width_NN_state': 414, 'depth_NN_heal': 2, 'depth_NN_state': 3, 'mode_heal': 60, 'mode_state': 52, 'blocks_heal': 4, 'blocks_state': 4, 'lift_act_state': <built-in function gelu>, 'block_act_state': <built-in function gelu>, 'lift_act_heal': <built-in function gelu>, 'block_act_heal': None, 'width_heal': 47, 'width_state': 111, 'lr': 0.0016797826078498773, 'padding_heal': 7, 'padding_state': 18, 'optimizer_type': 'lbfgs'}. Best is trial 1511 with value: 0.0009640019852668047.
[I 2025-07-30 23:25:34,994] Trial 1795 finished with value: 0.0010773675749078393 and parameters: {'width_NN_heal': 431, 'width_NN_state': 332, 'depth_NN_heal': 2, 'depth_NN_state': 3, 'mode_heal': 64, 'mode_state': 32, 'blocks_heal': 8, 'blocks_state': 3, 'lift_act_state': <built-in function gelu>, 'block_act_state': <built-in function gelu>, 'lift_act_heal': <built-in function gelu>, 'block_act_heal': None, 'width_heal': 57, 'width_state': 128, 'lr': 0.0021784032307215237, 'padding_heal': 4, 'padding_state': 17, 'optimizer_type': 'lbfgs'}. Best is trial 1511 with value: 0.0009640019852668047.
[I 2025-07-30 23:25:39,970] Trial 1796 finished with value: 0.001283424673601985 and parameters: {'width_NN_heal': 376, 'width_NN_state': 305, 'depth_NN_heal': 2, 'depth_NN_state': 3, 'mode_heal': 60, 'mode_state': 56, 'blocks_heal': 8, 'blocks_state': 3, 'lift_act_state': <built-in function gelu>, 'block_act_state': <built-in function gelu>, 'lift_act_heal': <built-in function gelu>, 'block_act_heal': None, 'width_heal': 50, 'width_state': 104, 'lr': 0.0013604758428501563, 'padding_heal': 6, 'padding_state': 15, 'optimizer_type': 'lbfgs'}. Best is trial 1511 with value: 0.0009640019852668047.
[I 2025-07-30 23:25:44,967] Trial 1797 finished with value: 0.001148636220023036 and parameters: {'width_NN_heal': 22, 'width_NN_state': 370, 'depth_NN_heal': 2, 'depth_NN_state': 3, 'mode_heal': 56, 'mode_state': 40, 'blocks_heal': 8, 'blocks_state': 3, 'lift_act_state': <built-in function gelu>, 'block_act_state': <built-in function gelu>, 'lift_act_heal': <built-in function gelu>, 'block_act_heal': None, 'width_heal': 45, 'width_state': 116, 'lr': 0.0015388739616827454, 'padding_heal': 5, 'padding_state': 16, 'optimizer_type': 'lbfgs'}. Best is trial 1511 with value: 0.0009640019852668047.
[I 2025-07-30 23:25:49,968] Trial 1798 finished with value: 0.0012407234171405435 and parameters: {'width_NN_heal': 329, 'width_NN_state': 255, 'depth_NN_heal': 2, 'depth_NN_state': 3, 'mode_heal': 24, 'mode_state': 56, 'blocks_heal': 8, 'blocks_state': 3, 'lift_act_state': <built-in function gelu>, 'block_act_state': <built-in function gelu>, 'lift_act_heal': <built-in function gelu>, 'block_act_heal': None, 'width_heal': 53, 'width_state': 84, 'lr': 0.00188292188604135, 'padding_heal': 3, 'padding_state': 15, 'optimizer_type': 'lbfgs'}. Best is trial 1511 with value: 0.0009640019852668047.
[I 2025-07-30 23:25:55,279] Trial 1799 finished with value: 0.0012800954282283783 and parameters: {'width_NN_heal': 481, 'width_NN_state': 344, 'depth_NN_heal': 2, 'depth_NN_state': 3, 'mode_heal': 64, 'mode_state': 60, 'blocks_heal': 8, 'blocks_state': 3, 'lift_act_state': <built-in function gelu>, 'block_act_state': <built-in function gelu>, 'lift_act_heal': <built-in function gelu>, 'block_act_heal': None, 'width_heal': 40, 'width_state': 93, 'lr': 0.001688785751573294, 'padding_heal': 8, 'padding_state': 18, 'optimizer_type': 'lbfgs'}. Best is trial 1511 with value: 0.0009640019852668047.
[I 2025-07-30 23:26:00,310] Trial 1800 finished with value: 0.0034760257694870234 and parameters: {'width_NN_heal': 415, 'width_NN_state': 16, 'depth_NN_heal': 2, 'depth_NN_state': 3, 'mode_heal': 60, 'mode_state': 12, 'blocks_heal': 8, 'blocks_state': 3, 'lift_act_state': <built-in function gelu>, 'block_act_state': <built-in function gelu>, 'lift_act_heal': <built-in function gelu>, 'block_act_heal': None, 'width_heal': 59, 'width_state': 100, 'lr': 0.0015120659286945717, 'padding_heal': 4, 'padding_state': 17, 'optimizer_type': 'lbfgs'}. Best is trial 1511 with value: 0.0009640019852668047.
[I 2025-07-30 23:26:04,930] Trial 1801 finished with value: 0.001473132986575365 and parameters: {'width_NN_heal': 392, 'width_NN_state': 284, 'depth_NN_heal': 2, 'depth_NN_state': 3, 'mode_heal': 64, 'mode_state': 60, 'blocks_heal': 6, 'blocks_state': 3, 'lift_act_state': <built-in function gelu>, 'block_act_state': <function tanh at 0x7ff3611b4cc0>, 'lift_act_heal': <built-in function gelu>, 'block_act_heal': None, 'width_heal': 43, 'width_state': 119, 'lr': 0.002065050368605977, 'padding_heal': 5, 'padding_state': 27, 'optimizer_type': 'lbfgs'}. Best is trial 1511 with value: 0.0009640019852668047.
[I 2025-07-30 23:26:09,915] Trial 1802 finished with value: 0.0012924062320962548 and parameters: {'width_NN_heal': 356, 'width_NN_state': 314, 'depth_NN_heal': 2, 'depth_NN_state': 3, 'mode_heal': 60, 'mode_state': 36, 'blocks_heal': 8, 'blocks_state': 3, 'lift_act_state': <built-in function gelu>, 'block_act_state': <built-in function gelu>, 'lift_act_heal': <built-in function gelu>, 'block_act_heal': None, 'width_heal': 50, 'width_state': 107, 'lr': 0.0013284513215904028, 'padding_heal': 6, 'padding_state': 20, 'optimizer_type': 'lbfgs'}. Best is trial 1511 with value: 0.0009640019852668047.
[I 2025-07-30 23:26:15,844] Trial 1803 finished with value: 0.0013574818149209023 and parameters: {'width_NN_heal': 506, 'width_NN_state': 397, 'depth_NN_heal': 2, 'depth_NN_state': 3, 'mode_heal': 64, 'mode_state': 56, 'blocks_heal': 8, 'blocks_state': 3, 'lift_act_state': <built-in function gelu>, 'block_act_state': <built-in function gelu>, 'lift_act_heal': <built-in function gelu>, 'block_act_heal': <built-in function gelu>, 'width_heal': 47, 'width_state': 19, 'lr': 0.00186612140197015, 'padding_heal': 24, 'padding_state': 19, 'optimizer_type': 'lbfgs'}. Best is trial 1511 with value: 0.0009640019852668047.
[I 2025-07-30 23:26:19,506] Trial 1804 finished with value: 0.0012682252563536167 and parameters: {'width_NN_heal': 455, 'width_NN_state': 271, 'depth_NN_heal': 2, 'depth_NN_state': 3, 'mode_heal': 60, 'mode_state': 60, 'blocks_heal': 3, 'blocks_state': 2, 'lift_act_state': <built-in function gelu>, 'block_act_state': <built-in function gelu>, 'lift_act_heal': <built-in function gelu>, 'block_act_heal': None, 'width_heal': 62, 'width_state': 112, 'lr': 0.0014622000996798031, 'padding_heal': 3, 'padding_state': 16, 'optimizer_type': 'lbfgs'}. Best is trial 1511 with value: 0.0009640019852668047.
[I 2025-07-30 23:26:25,555] Trial 1805 finished with value: 0.0012485220795497298 and parameters: {'width_NN_heal': 326, 'width_NN_state': 351, 'depth_NN_heal': 5, 'depth_NN_state': 3, 'mode_heal': 60, 'mode_state': 60, 'blocks_heal': 8, 'blocks_state': 3, 'lift_act_state': <built-in function gelu>, 'block_act_state': <built-in function gelu>, 'lift_act_heal': None, 'block_act_heal': None, 'width_heal': 55, 'width_state': 98, 'lr': 0.001720497340759259, 'padding_heal': 4, 'padding_state': 18, 'optimizer_type': 'lbfgs'}. Best is trial 1511 with value: 0.0009640019852668047.
