[I 2025-07-30 22:49:08,750] Trial 1374 finished with value: 0.0012755896896123886 and parameters: {'width_NN_heal': 426, 'width_NN_state': 480, 'depth_NN_heal': 2, 'depth_NN_state': 3, 'mode_heal': 64, 'mode_state': 60, 'blocks_heal': 6, 'blocks_state': 3, 'lift_act_state': <built-in function gelu>, 'block_act_state': <built-in function gelu>, 'lift_act_heal': <built-in function gelu>, 'block_act_heal': None, 'width_heal': 60, 'width_state': 101, 'lr': 0.001316986735751835, 'padding_heal': 5, 'padding_state': 15, 'optimizer_type': 'lbfgs'}. Best is trial 1091 with value: 0.0009798490209504962.
[I 2025-07-30 22:49:13,269] Trial 1375 finished with value: 0.00929879117757082 and parameters: {'width_NN_heal': 403, 'width_NN_state': 307, 'depth_NN_heal': 2, 'depth_NN_state': 2, 'mode_heal': 64, 'mode_state': 56, 'blocks_heal': 7, 'blocks_state': 3, 'lift_act_state': <built-in function gelu>, 'block_act_state': <built-in function gelu>, 'lift_act_heal': <built-in function gelu>, 'block_act_heal': None, 'width_heal': 56, 'width_state': 96, 'lr': 0.009790430490514368, 'padding_heal': 3, 'padding_state': 16, 'optimizer_type': 'lbfgs'}. Best is trial 1091 with value: 0.0009798490209504962.
[I 2025-07-30 22:49:18,060] Trial 1376 finished with value: 0.0010283217998221517 and parameters: {'width_NN_heal': 354, 'width_NN_state': 334, 'depth_NN_heal': 2, 'depth_NN_state': 3, 'mode_heal': 64, 'mode_state': 60, 'blocks_heal': 7, 'blocks_state': 3, 'lift_act_state': <built-in function gelu>, 'block_act_state': <built-in function gelu>, 'lift_act_heal': <built-in function gelu>, 'block_act_heal': None, 'width_heal': 52, 'width_state': 95, 'lr': 0.0017054172324482751, 'padding_heal': 4, 'padding_state': 16, 'optimizer_type': 'lbfgs'}. Best is trial 1091 with value: 0.0009798490209504962.
[I 2025-07-30 22:49:22,756] Trial 1377 finished with value: 0.0012846438912674785 and parameters: {'width_NN_heal': 341, 'width_NN_state': 411, 'depth_NN_heal': 1, 'depth_NN_state': 3, 'mode_heal': 64, 'mode_state': 60, 'blocks_heal': 7, 'blocks_state': 3, 'lift_act_state': <built-in function gelu>, 'block_act_state': <built-in function gelu>, 'lift_act_heal': <built-in function gelu>, 'block_act_heal': None, 'width_heal': 64, 'width_state': 94, 'lr': 0.001401082399235328, 'padding_heal': 3, 'padding_state': 13, 'optimizer_type': 'lbfgs'}. Best is trial 1091 with value: 0.0009798490209504962.
[I 2025-07-30 22:49:27,700] Trial 1378 finished with value: 0.001247514272108674 and parameters: {'width_NN_heal': 332, 'width_NN_state': 372, 'depth_NN_heal': 2, 'depth_NN_state': 3, 'mode_heal': 64, 'mode_state': 56, 'blocks_heal': 7, 'blocks_state': 3, 'lift_act_state': <built-in function gelu>, 'block_act_state': <built-in function gelu>, 'lift_act_heal': <built-in function gelu>, 'block_act_heal': None, 'width_heal': 54, 'width_state': 98, 'lr': 0.0012559150615992914, 'padding_heal': 5, 'padding_state': 14, 'optimizer_type': 'lbfgs'}. Best is trial 1091 with value: 0.0009798490209504962.
[I 2025-07-30 22:49:33,065] Trial 1379 finished with value: 0.0011321008205413818 and parameters: {'width_NN_heal': 349, 'width_NN_state': 453, 'depth_NN_heal': 2, 'depth_NN_state': 3, 'mode_heal': 64, 'mode_state': 60, 'blocks_heal': 7, 'blocks_state': 3, 'lift_act_state': <built-in function gelu>, 'block_act_state': <built-in function gelu>, 'lift_act_heal': <built-in function gelu>, 'block_act_heal': None, 'width_heal': 59, 'width_state': 104, 'lr': 0.0015316676992079721, 'padding_heal': 3, 'padding_state': 15, 'optimizer_type': 'lbfgs'}. Best is trial 1091 with value: 0.0009798490209504962.
[I 2025-07-30 22:49:37,769] Trial 1380 finished with value: 0.0019957071635872126 and parameters: {'width_NN_heal': 369, 'width_NN_state': 358, 'depth_NN_heal': 2, 'depth_NN_state': 3, 'mode_heal': 64, 'mode_state': 60, 'blocks_heal': 7, 'blocks_state': 3, 'lift_act_state': <built-in function gelu>, 'block_act_state': <built-in function gelu>, 'lift_act_heal': <built-in function gelu>, 'block_act_heal': None, 'width_heal': 12, 'width_state': 95, 'lr': 0.0013131548337040936, 'padding_heal': 4, 'padding_state': 16, 'optimizer_type': 'lbfgs'}. Best is trial 1091 with value: 0.0009798490209504962.
[I 2025-07-30 22:49:42,865] Trial 1381 finished with value: 0.0010628234595060349 and parameters: {'width_NN_heal': 321, 'width_NN_state': 338, 'depth_NN_heal': 2, 'depth_NN_state': 3, 'mode_heal': 64, 'mode_state': 60, 'blocks_heal': 7, 'blocks_state': 3, 'lift_act_state': <built-in function gelu>, 'block_act_state': <built-in function gelu>, 'lift_act_heal': <built-in function gelu>, 'block_act_heal': None, 'width_heal': 53, 'width_state': 108, 'lr': 0.0015530586400345247, 'padding_heal': 5, 'padding_state': 14, 'optimizer_type': 'lbfgs'}. Best is trial 1091 with value: 0.0009798490209504962.
[I 2025-07-30 22:49:47,302] Trial 1382 finished with value: 0.002054724609479308 and parameters: {'width_NN_heal': 317, 'width_NN_state': 332, 'depth_NN_heal': 2, 'depth_NN_state': 3, 'mode_heal': 64, 'mode_state': 56, 'blocks_heal': 5, 'blocks_state': 3, 'lift_act_state': <built-in function gelu>, 'block_act_state': <function tanh at 0x7ff3611b4cc0>, 'lift_act_heal': <built-in function gelu>, 'block_act_heal': None, 'width_heal': 60, 'width_state': 114, 'lr': 0.0017622265998181621, 'padding_heal': 5, 'padding_state': 13, 'optimizer_type': 'lbfgs'}. Best is trial 1091 with value: 0.0009798490209504962.
[I 2025-07-30 22:49:52,435] Trial 1383 finished with value: 0.001595277339220047 and parameters: {'width_NN_heal': 316, 'width_NN_state': 325, 'depth_NN_heal': 2, 'depth_NN_state': 3, 'mode_heal': 64, 'mode_state': 56, 'blocks_heal': 7, 'blocks_state': 3, 'lift_act_state': <built-in function gelu>, 'block_act_state': <built-in function gelu>, 'lift_act_heal': <built-in function gelu>, 'block_act_heal': None, 'width_heal': 62, 'width_state': 120, 'lr': 0.0016249692115922444, 'padding_heal': 5, 'padding_state': 15, 'optimizer_type': 'lbfgs'}. Best is trial 1091 with value: 0.0009798490209504962.
[I 2025-07-30 22:49:57,662] Trial 1384 finished with value: 0.001452303840778768 and parameters: {'width_NN_heal': 325, 'width_NN_state': 394, 'depth_NN_heal': 2, 'depth_NN_state': 3, 'mode_heal': 64, 'mode_state': 60, 'blocks_heal': 7, 'blocks_state': 3, 'lift_act_state': <built-in function gelu>, 'block_act_state': <built-in function gelu>, 'lift_act_heal': <built-in function gelu>, 'block_act_heal': None, 'width_heal': 55, 'width_state': 108, 'lr': 0.0016233045427859762, 'padding_heal': 5, 'padding_state': 13, 'optimizer_type': 'lbfgs'}. Best is trial 1091 with value: 0.0009798490209504962.
[I 2025-07-30 22:50:02,787] Trial 1385 finished with value: 0.0011006053537130356 and parameters: {'width_NN_heal': 326, 'width_NN_state': 353, 'depth_NN_heal': 2, 'depth_NN_state': 3, 'mode_heal': 64, 'mode_state': 60, 'blocks_heal': 7, 'blocks_state': 3, 'lift_act_state': <built-in function gelu>, 'block_act_state': <built-in function gelu>, 'lift_act_heal': <built-in function gelu>, 'block_act_heal': None, 'width_heal': 58, 'width_state': 127, 'lr': 0.0016427942828756267, 'padding_heal': 5, 'padding_state': 14, 'optimizer_type': 'lbfgs'}. Best is trial 1091 with value: 0.0009798490209504962.
[I 2025-07-30 22:50:07,942] Trial 1386 finished with value: 0.00122900924179703 and parameters: {'width_NN_heal': 337, 'width_NN_state': 295, 'depth_NN_heal': 2, 'depth_NN_state': 3, 'mode_heal': 64, 'mode_state': 56, 'blocks_heal': 7, 'blocks_state': 3, 'lift_act_state': <built-in function gelu>, 'block_act_state': <built-in function gelu>, 'lift_act_heal': <built-in function gelu>, 'block_act_heal': None, 'width_heal': 67, 'width_state': 114, 'lr': 0.0017337613906024296, 'padding_heal': 5, 'padding_state': 14, 'optimizer_type': 'lbfgs'}. Best is trial 1091 with value: 0.0009798490209504962.
[I 2025-07-30 22:50:13,429] Trial 1387 finished with value: 0.001365440315566957 and parameters: {'width_NN_heal': 301, 'width_NN_state': 327, 'depth_NN_heal': 2, 'depth_NN_state': 3, 'mode_heal': 64, 'mode_state': 56, 'blocks_heal': 8, 'blocks_state': 3, 'lift_act_state': <built-in function gelu>, 'block_act_state': <built-in function gelu>, 'lift_act_heal': <built-in function gelu>, 'block_act_heal': None, 'width_heal': 54, 'width_state': 111, 'lr': 0.0015142223680228916, 'padding_heal': 5, 'padding_state': 13, 'optimizer_type': 'lbfgs'}. Best is trial 1091 with value: 0.0009798490209504962.
[I 2025-07-30 22:50:17,900] Trial 1388 finished with value: 0.009999312460422516 and parameters: {'width_NN_heal': 349, 'width_NN_state': 378, 'depth_NN_heal': 2, 'depth_NN_state': 3, 'mode_heal': 64, 'mode_state': 60, 'blocks_heal': 7, 'blocks_state': 3, 'lift_act_state': None, 'block_act_state': None, 'lift_act_heal': <built-in function gelu>, 'block_act_heal': None, 'width_heal': 52, 'width_state': 107, 'lr': 0.0017551110409320838, 'padding_heal': 5, 'padding_state': 13, 'optimizer_type': 'lbfgs'}. Best is trial 1091 with value: 0.0009798490209504962.
[I 2025-07-30 22:50:22,632] Trial 1389 finished with value: 0.0013265676097944379 and parameters: {'width_NN_heal': 295, 'width_NN_state': 288, 'depth_NN_heal': 2, 'depth_NN_state': 3, 'mode_heal': 64, 'mode_state': 60, 'blocks_heal': 7, 'blocks_state': 3, 'lift_act_state': <built-in function gelu>, 'block_act_state': <built-in function gelu>, 'lift_act_heal': <built-in function gelu>, 'block_act_heal': None, 'width_heal': 59, 'width_state': 103, 'lr': 0.0014458658555361146, 'padding_heal': 4, 'padding_state': 12, 'optimizer_type': 'lbfgs'}. Best is trial 1091 with value: 0.0009798490209504962.
[I 2025-07-30 22:50:27,352] Trial 1390 finished with value: 0.0011123360600322485 and parameters: {'width_NN_heal': 369, 'width_NN_state': 350, 'depth_NN_heal': 2, 'depth_NN_state': 3, 'mode_heal': 64, 'mode_state': 60, 'blocks_heal': 7, 'blocks_state': 3, 'lift_act_state': <built-in function gelu>, 'block_act_state': <built-in function gelu>, 'lift_act_heal': <built-in function gelu>, 'block_act_heal': None, 'width_heal': 52, 'width_state': 100, 'lr': 0.0018433995220912191, 'padding_heal': 5, 'padding_state': 15, 'optimizer_type': 'lbfgs'}. Best is trial 1091 with value: 0.0009798490209504962.
[I 2025-07-30 22:50:32,348] Trial 1391 finished with value: 0.0012551763793453574 and parameters: {'width_NN_heal': 333, 'width_NN_state': 327, 'depth_NN_heal': 2, 'depth_NN_state': 3, 'mode_heal': 64, 'mode_state': 60, 'blocks_heal': 7, 'blocks_state': 3, 'lift_act_state': <built-in function gelu>, 'block_act_state': <built-in function gelu>, 'lift_act_heal': <built-in function gelu>, 'block_act_heal': None, 'width_heal': 62, 'width_state': 119, 'lr': 0.0015858309445359387, 'padding_heal': 4, 'padding_state': 14, 'optimizer_type': 'lbfgs'}. Best is trial 1091 with value: 0.0009798490209504962.
[I 2025-07-30 22:50:37,156] Trial 1392 finished with value: 0.0013544999528676271 and parameters: {'width_NN_heal': 301, 'width_NN_state': 401, 'depth_NN_heal': 2, 'depth_NN_state': 3, 'mode_heal': 64, 'mode_state': 60, 'blocks_heal': 6, 'blocks_state': 3, 'lift_act_state': <built-in function gelu>, 'block_act_state': <built-in function gelu>, 'lift_act_heal': <built-in function gelu>, 'block_act_heal': None, 'width_heal': 57, 'width_state': 108, 'lr': 0.001479484101429588, 'padding_heal': 5, 'padding_state': 13, 'optimizer_type': 'lbfgs'}. Best is trial 1091 with value: 0.0009798490209504962.
[I 2025-07-30 22:50:40,992] Trial 1393 finished with value: 0.0013866731896996498 and parameters: {'width_NN_heal': 380, 'width_NN_state': 299, 'depth_NN_heal': 2, 'depth_NN_state': 3, 'mode_heal': 64, 'mode_state': 60, 'blocks_heal': 3, 'blocks_state': 3, 'lift_act_state': <built-in function gelu>, 'block_act_state': <built-in function gelu>, 'lift_act_heal': <built-in function gelu>, 'block_act_heal': None, 'width_heal': 52, 'width_state': 95, 'lr': 0.001606220083164214, 'padding_heal': 4, 'padding_state': 14, 'optimizer_type': 'lbfgs'}. Best is trial 1091 with value: 0.0009798490209504962.
[I 2025-07-30 22:50:45,957] Trial 1394 finished with value: 0.0015804272843524814 and parameters: {'width_NN_heal': 341, 'width_NN_state': 364, 'depth_NN_heal': 2, 'depth_NN_state': 3, 'mode_heal': 64, 'mode_state': 56, 'blocks_heal': 7, 'blocks_state': 3, 'lift_act_state': <built-in function gelu>, 'block_act_state': <built-in function gelu>, 'lift_act_heal': <built-in function gelu>, 'block_act_heal': None, 'width_heal': 52, 'width_state': 105, 'lr': 0.000638688928184165, 'padding_heal': 4, 'padding_state': 14, 'optimizer_type': 'lbfgs'}. Best is trial 1091 with value: 0.0009798490209504962.
[I 2025-07-30 22:50:50,501] Trial 1395 finished with value: 0.0012711226008832455 and parameters: {'width_NN_heal': 311, 'width_NN_state': 312, 'depth_NN_heal': 2, 'depth_NN_state': 2, 'mode_heal': 64, 'mode_state': 60, 'blocks_heal': 7, 'blocks_state': 3, 'lift_act_state': <built-in function gelu>, 'block_act_state': <built-in function gelu>, 'lift_act_heal': <built-in function gelu>, 'block_act_heal': None, 'width_heal': 56, 'width_state': 115, 'lr': 0.0017812234168300826, 'padding_heal': 5, 'padding_state': 14, 'optimizer_type': 'lbfgs'}. Best is trial 1091 with value: 0.0009798490209504962.
[I 2025-07-30 22:50:55,053] Trial 1396 finished with value: 0.00431707501411438 and parameters: {'width_NN_heal': 382, 'width_NN_state': 12, 'depth_NN_heal': 1, 'depth_NN_state': 3, 'mode_heal': 64, 'mode_state': 60, 'blocks_heal': 7, 'blocks_state': 3, 'lift_act_state': <built-in function gelu>, 'block_act_state': <built-in function gelu>, 'lift_act_heal': <built-in function gelu>, 'block_act_heal': None, 'width_heal': 51, 'width_state': 128, 'lr': 0.0014056898325307521, 'padding_heal': 6, 'padding_state': 15, 'optimizer_type': 'lbfgs'}. Best is trial 1091 with value: 0.0009798490209504962.
[I 2025-07-30 22:51:00,335] Trial 1397 finished with value: 0.0010771912056952715 and parameters: {'width_NN_heal': 348, 'width_NN_state': 438, 'depth_NN_heal': 2, 'depth_NN_state': 3, 'mode_heal': 64, 'mode_state': 60, 'blocks_heal': 7, 'blocks_state': 3, 'lift_act_state': <built-in function gelu>, 'block_act_state': <built-in function gelu>, 'lift_act_heal': <built-in function gelu>, 'block_act_heal': None, 'width_heal': 51, 'width_state': 99, 'lr': 0.0015968470932430456, 'padding_heal': 4, 'padding_state': 15, 'optimizer_type': 'lbfgs'}. Best is trial 1091 with value: 0.0009798490209504962.
[I 2025-07-30 22:51:05,260] Trial 1398 finished with value: 0.0015095517737790942 and parameters: {'width_NN_heal': 393, 'width_NN_state': 338, 'depth_NN_heal': 2, 'depth_NN_state': 3, 'mode_heal': 64, 'mode_state': 60, 'blocks_heal': 7, 'blocks_state': 3, 'lift_act_state': <built-in function gelu>, 'block_act_state': <built-in function gelu>, 'lift_act_heal': <built-in function gelu>, 'block_act_heal': None, 'width_heal': 56, 'width_state': 108, 'lr': 0.0014575998474837695, 'padding_heal': 4, 'padding_state': 11, 'optimizer_type': 'lbfgs'}. Best is trial 1091 with value: 0.0009798490209504962.
[I 2025-07-30 22:51:09,869] Trial 1399 finished with value: 0.002452820772305131 and parameters: {'width_NN_heal': 302, 'width_NN_state': 14, 'depth_NN_heal': 2, 'depth_NN_state': 3, 'mode_heal': 64, 'mode_state': 60, 'blocks_heal': 7, 'blocks_state': 3, 'lift_act_state': <built-in function gelu>, 'block_act_state': <built-in function gelu>, 'lift_act_heal': <built-in function gelu>, 'block_act_heal': None, 'width_heal': 50, 'width_state': 94, 'lr': 0.0018002371755047556, 'padding_heal': 5, 'padding_state': 15, 'optimizer_type': 'lbfgs'}. Best is trial 1091 with value: 0.0009798490209504962.
[I 2025-07-30 22:51:14,314] Trial 1400 finished with value: 0.001614788663573563 and parameters: {'width_NN_heal': 349, 'width_NN_state': 284, 'depth_NN_heal': 2, 'depth_NN_state': 1, 'mode_heal': 64, 'mode_state': 56, 'blocks_heal': 7, 'blocks_state': 3, 'lift_act_state': <built-in function gelu>, 'block_act_state': <built-in function gelu>, 'lift_act_heal': <built-in function gelu>, 'block_act_heal': None, 'width_heal': 64, 'width_state': 118, 'lr': 0.0015745771661112734, 'padding_heal': 4, 'padding_state': 11, 'optimizer_type': 'lbfgs'}. Best is trial 1091 with value: 0.0009798490209504962.
[I 2025-07-30 22:51:19,491] Trial 1401 finished with value: 0.0013247892493382096 and parameters: {'width_NN_heal': 368, 'width_NN_state': 392, 'depth_NN_heal': 2, 'depth_NN_state': 3, 'mode_heal': 64, 'mode_state': 60, 'blocks_heal': 7, 'blocks_state': 3, 'lift_act_state': <built-in function gelu>, 'block_act_state': <built-in function gelu>, 'lift_act_heal': <built-in function gelu>, 'block_act_heal': None, 'width_heal': 59, 'width_state': 101, 'lr': 0.0013929359640423103, 'padding_heal': 6, 'padding_state': 12, 'optimizer_type': 'lbfgs'}. Best is trial 1091 with value: 0.0009798490209504962.
[I 2025-07-30 22:51:24,122] Trial 1402 finished with value: 0.0013114070752635598 and parameters: {'width_NN_heal': 323, 'width_NN_state': 318, 'depth_NN_heal': 2, 'depth_NN_state': 3, 'mode_heal': 64, 'mode_state': 60, 'blocks_heal': 7, 'blocks_state': 3, 'lift_act_state': <built-in function gelu>, 'block_act_state': <built-in function gelu>, 'lift_act_heal': <built-in function gelu>, 'block_act_heal': None, 'width_heal': 54, 'width_state': 95, 'lr': 0.001698693157357889, 'padding_heal': 5, 'padding_state': 14, 'optimizer_type': 'lbfgs'}. Best is trial 1091 with value: 0.0009798490209504962.
[I 2025-07-30 22:51:29,154] Trial 1403 finished with value: 0.0011666928185150027 and parameters: {'width_NN_heal': 412, 'width_NN_state': 348, 'depth_NN_heal': 2, 'depth_NN_state': 3, 'mode_heal': 64, 'mode_state': 60, 'blocks_heal': 7, 'blocks_state': 3, 'lift_act_state': <built-in function gelu>, 'block_act_state': <built-in function gelu>, 'lift_act_heal': <built-in function gelu>, 'block_act_heal': None, 'width_heal': 50, 'width_state': 112, 'lr': 0.0018953160802404482, 'padding_heal': 4, 'padding_state': 15, 'optimizer_type': 'lbfgs'}. Best is trial 1091 with value: 0.0009798490209504962.
[I 2025-07-30 22:51:34,237] Trial 1404 finished with value: 0.0018738688668236136 and parameters: {'width_NN_heal': 295, 'width_NN_state': 292, 'depth_NN_heal': 2, 'depth_NN_state': 3, 'mode_heal': 64, 'mode_state': 60, 'blocks_heal': 8, 'blocks_state': 3, 'lift_act_state': <built-in function gelu>, 'block_act_state': <function tanh at 0x7ff3611b4cc0>, 'lift_act_heal': <built-in function gelu>, 'block_act_heal': None, 'width_heal': 69, 'width_state': 102, 'lr': 0.0014700271064187864, 'padding_heal': 5, 'padding_state': 11, 'optimizer_type': 'lbfgs'}. Best is trial 1091 with value: 0.0009798490209504962.
[I 2025-07-30 22:51:39,024] Trial 1405 finished with value: 0.0014387140981853008 and parameters: {'width_NN_heal': 453, 'width_NN_state': 382, 'depth_NN_heal': 2, 'depth_NN_state': 3, 'mode_heal': 64, 'mode_state': 60, 'blocks_heal': 7, 'blocks_state': 3, 'lift_act_state': <built-in function gelu>, 'block_act_state': <built-in function gelu>, 'lift_act_heal': <built-in function gelu>, 'block_act_heal': None, 'width_heal': 54, 'width_state': 94, 'lr': 0.0013332449499223365, 'padding_heal': 3, 'padding_state': 3, 'optimizer_type': 'lbfgs'}. Best is trial 1091 with value: 0.0009798490209504962.
[I 2025-07-30 22:51:43,606] Trial 1406 finished with value: 0.0011291994014754891 and parameters: {'width_NN_heal': 390, 'width_NN_state': 280, 'depth_NN_heal': 1, 'depth_NN_state': 3, 'mode_heal': 64, 'mode_state': 60, 'blocks_heal': 7, 'blocks_state': 3, 'lift_act_state': <built-in function gelu>, 'block_act_state': <built-in function gelu>, 'lift_act_heal': <built-in function gelu>, 'block_act_heal': None, 'width_heal': 57, 'width_state': 105, 'lr': 0.0015644557978701124, 'padding_heal': 6, 'padding_state': 16, 'optimizer_type': 'lbfgs'}. Best is trial 1091 with value: 0.0009798490209504962.
[I 2025-07-30 22:51:48,380] Trial 1407 finished with value: 0.001148687326349318 and parameters: {'width_NN_heal': 332, 'width_NN_state': 333, 'depth_NN_heal': 2, 'depth_NN_state': 3, 'mode_heal': 64, 'mode_state': 56, 'blocks_heal': 7, 'blocks_state': 3, 'lift_act_state': <built-in function gelu>, 'block_act_state': <built-in function gelu>, 'lift_act_heal': <built-in function gelu>, 'block_act_heal': None, 'width_heal': 50, 'width_state': 115, 'lr': 0.0017847512963832786, 'padding_heal': 4, 'padding_state': 16, 'optimizer_type': 'lbfgs'}. Best is trial 1091 with value: 0.0009798490209504962.
[I 2025-07-30 22:51:52,995] Trial 1408 finished with value: 0.0011630323715507984 and parameters: {'width_NN_heal': 361, 'width_NN_state': 312, 'depth_NN_heal': 2, 'depth_NN_state': 3, 'mode_heal': 64, 'mode_state': 60, 'blocks_heal': 7, 'blocks_state': 3, 'lift_act_state': <built-in function gelu>, 'block_act_state': <built-in function gelu>, 'lift_act_heal': <built-in function gelu>, 'block_act_heal': None, 'width_heal': 50, 'width_state': 120, 'lr': 0.0012252993621591917, 'padding_heal': 5, 'padding_state': 16, 'optimizer_type': 'lbfgs'}. Best is trial 1091 with value: 0.0009798490209504962.
[I 2025-07-30 22:51:57,621] Trial 1409 finished with value: 0.0029391555581241846 and parameters: {'width_NN_heal': 403, 'width_NN_state': 10, 'depth_NN_heal': 2, 'depth_NN_state': 3, 'mode_heal': 64, 'mode_state': 40, 'blocks_heal': 7, 'blocks_state': 3, 'lift_act_state': None, 'block_act_state': <built-in function gelu>, 'lift_act_heal': <built-in function gelu>, 'block_act_heal': None, 'width_heal': 61, 'width_state': 92, 'lr': 0.0013978164639470406, 'padding_heal': 3, 'padding_state': 13, 'optimizer_type': 'lbfgs'}. Best is trial 1091 with value: 0.0009798490209504962.
