[I 2025-07-31 00:11:56,270] Trial 2346 finished with value: 0.0011523452121764421 and parameters: {'width_NN_heal': 269, 'width_NN_state': 299, 'depth_NN_heal': 2, 'depth_NN_state': 3, 'mode_heal': 60, 'mode_state': 60, 'blocks_heal': 8, 'blocks_state': 3, 'lift_act_state': <built-in function gelu>, 'block_act_state': <built-in function gelu>, 'lift_act_heal': <built-in function gelu>, 'block_act_heal': None, 'width_heal': 33, 'width_state': 100, 'lr': 0.001231759053454175, 'padding_heal': 3, 'padding_state': 17, 'optimizer_type': 'lbfgs'}. Best is trial 1511 with value: 0.0009640019852668047.
[I 2025-07-31 00:12:03,035] Trial 2347 finished with value: 0.0013592391042038798 and parameters: {'width_NN_heal': 452, 'width_NN_state': 476, 'depth_NN_heal': 2, 'depth_NN_state': 4, 'mode_heal': 56, 'mode_state': 64, 'blocks_heal': 7, 'blocks_state': 3, 'lift_act_state': <built-in function gelu>, 'block_act_state': <built-in function gelu>, 'lift_act_heal': <function tanh at 0x7ff3611b4cc0>, 'block_act_heal': None, 'width_heal': 63, 'width_state': 105, 'lr': 0.0017153673563336052, 'padding_heal': 5, 'padding_state': 15, 'optimizer_type': 'lbfgs'}. Best is trial 1511 with value: 0.0009640019852668047.
[I 2025-07-31 00:12:09,424] Trial 2348 finished with value: 0.001642524846829474 and parameters: {'width_NN_heal': 388, 'width_NN_state': 408, 'depth_NN_heal': 3, 'depth_NN_state': 3, 'mode_heal': 64, 'mode_state': 60, 'blocks_heal': 8, 'blocks_state': 3, 'lift_act_state': <built-in function gelu>, 'block_act_state': <function tanh at 0x7ff3611b4cc0>, 'lift_act_heal': <built-in function gelu>, 'block_act_heal': <function tanh at 0x7ff3611b4cc0>, 'width_heal': 44, 'width_state': 121, 'lr': 0.0014220041792085446, 'padding_heal': 12, 'padding_state': 19, 'optimizer_type': 'lbfgs'}. Best is trial 1511 with value: 0.0009640019852668047.
[I 2025-07-31 00:12:13,932] Trial 2349 finished with value: 0.0013144321274012327 and parameters: {'width_NN_heal': 319, 'width_NN_state': 343, 'depth_NN_heal': 2, 'depth_NN_state': 2, 'mode_heal': 60, 'mode_state': 52, 'blocks_heal': 7, 'blocks_state': 3, 'lift_act_state': <built-in function gelu>, 'block_act_state': <built-in function gelu>, 'lift_act_heal': <built-in function gelu>, 'block_act_heal': None, 'width_heal': 40, 'width_state': 91, 'lr': 0.0020981622811172616, 'padding_heal': 8, 'padding_state': 16, 'optimizer_type': 'lbfgs'}. Best is trial 1511 with value: 0.0009640019852668047.
[I 2025-07-31 00:12:18,999] Trial 2350 finished with value: 0.0050836969166994095 and parameters: {'width_NN_heal': 420, 'width_NN_state': 317, 'depth_NN_heal': 2, 'depth_NN_state': 3, 'mode_heal': 60, 'mode_state': 56, 'blocks_heal': 8, 'blocks_state': 2, 'lift_act_state': <built-in function gelu>, 'block_act_state': <built-in function gelu>, 'lift_act_heal': <function tanh at 0x7ff3611b4cc0>, 'block_act_heal': None, 'width_heal': 59, 'width_state': 80, 'lr': 0.008241363620490248, 'padding_heal': 4, 'padding_state': 14, 'optimizer_type': 'lbfgs'}. Best is trial 1511 with value: 0.0009640019852668047.
[I 2025-07-31 00:12:23,563] Trial 2351 finished with value: 0.0013070902787148952 and parameters: {'width_NN_heal': 363, 'width_NN_state': 281, 'depth_NN_heal': 2, 'depth_NN_state': 3, 'mode_heal': 64, 'mode_state': 48, 'blocks_heal': 7, 'blocks_state': 3, 'lift_act_state': <built-in function gelu>, 'block_act_state': <built-in function gelu>, 'lift_act_heal': <built-in function gelu>, 'block_act_heal': None, 'width_heal': 48, 'width_state': 112, 'lr': 0.001063944614450378, 'padding_heal': 5, 'padding_state': 23, 'optimizer_type': 'adam'}. Best is trial 1511 with value: 0.0009640019852668047.
[I 2025-07-31 00:12:28,716] Trial 2352 finished with value: 0.0016513634473085403 and parameters: {'width_NN_heal': 475, 'width_NN_state': 374, 'depth_NN_heal': 2, 'depth_NN_state': 3, 'mode_heal': 60, 'mode_state': 64, 'blocks_heal': 8, 'blocks_state': 3, 'lift_act_state': None, 'block_act_state': <built-in function gelu>, 'lift_act_heal': <built-in function gelu>, 'block_act_heal': <built-in function gelu>, 'width_heal': 54, 'width_state': 98, 'lr': 0.001842752520631932, 'padding_heal': 2, 'padding_state': 17, 'optimizer_type': 'lbfgs'}. Best is trial 1511 with value: 0.0009640019852668047.
[I 2025-07-31 00:12:33,196] Trial 2353 finished with value: 0.0014216449344530702 and parameters: {'width_NN_heal': 340, 'width_NN_state': 317, 'depth_NN_heal': 2, 'depth_NN_state': 3, 'mode_heal': 64, 'mode_state': 64, 'blocks_heal': 7, 'blocks_state': 3, 'lift_act_state': <built-in function gelu>, 'block_act_state': <built-in function gelu>, 'lift_act_heal': None, 'block_act_heal': None, 'width_heal': 36, 'width_state': 121, 'lr': 0.0016415753261195241, 'padding_heal': 7, 'padding_state': 18, 'optimizer_type': 'lbfgs'}. Best is trial 1511 with value: 0.0009640019852668047.
[I 2025-07-31 00:12:37,449] Trial 2354 finished with value: 0.002254124963656068 and parameters: {'width_NN_heal': 392, 'width_NN_state': 248, 'depth_NN_heal': 2, 'depth_NN_state': 3, 'mode_heal': 60, 'mode_state': 60, 'blocks_heal': 6, 'blocks_state': 3, 'lift_act_state': <built-in function gelu>, 'block_act_state': None, 'lift_act_heal': <function tanh at 0x7ff3611b4cc0>, 'block_act_heal': None, 'width_heal': 31, 'width_state': 110, 'lr': 0.0023494264192274127, 'padding_heal': 3, 'padding_state': 16, 'optimizer_type': 'lbfgs'}. Best is trial 1511 with value: 0.0009640019852668047.
[I 2025-07-31 00:12:41,976] Trial 2355 finished with value: 0.0009757576626725495 and parameters: {'width_NN_heal': 409, 'width_NN_state': 338, 'depth_NN_heal': 2, 'depth_NN_state': 3, 'mode_heal': 64, 'mode_state': 60, 'blocks_heal': 5, 'blocks_state': 3, 'lift_act_state': <built-in function gelu>, 'block_act_state': <built-in function gelu>, 'lift_act_heal': <built-in function gelu>, 'block_act_heal': None, 'width_heal': 57, 'width_state': 128, 'lr': 0.0012953877323210225, 'padding_heal': 6, 'padding_state': 17, 'optimizer_type': 'lbfgs'}. Best is trial 1511 with value: 0.0009640019852668047.
[I 2025-07-31 00:12:46,531] Trial 2356 finished with value: 0.0013104830868542194 and parameters: {'width_NN_heal': 432, 'width_NN_state': 296, 'depth_NN_heal': 2, 'depth_NN_state': 3, 'mode_heal': 64, 'mode_state': 60, 'blocks_heal': 5, 'blocks_state': 3, 'lift_act_state': <built-in function gelu>, 'block_act_state': <built-in function gelu>, 'lift_act_heal': <built-in function gelu>, 'block_act_heal': None, 'width_heal': 59, 'width_state': 125, 'lr': 0.0011779289778630776, 'padding_heal': 7, 'padding_state': 17, 'optimizer_type': 'lbfgs'}. Best is trial 1511 with value: 0.0009640019852668047.
[I 2025-07-31 00:12:50,494] Trial 2357 finished with value: 0.0012120796600356698 and parameters: {'width_NN_heal': 412, 'width_NN_state': 277, 'depth_NN_heal': 2, 'depth_NN_state': 3, 'mode_heal': 64, 'mode_state': 60, 'blocks_heal': 3, 'blocks_state': 3, 'lift_act_state': <built-in function gelu>, 'block_act_state': <built-in function gelu>, 'lift_act_heal': <built-in function gelu>, 'block_act_heal': None, 'width_heal': 64, 'width_state': 128, 'lr': 0.001061792022796629, 'padding_heal': 7, 'padding_state': 18, 'optimizer_type': 'lbfgs'}. Best is trial 1511 with value: 0.0009640019852668047.
[I 2025-07-31 00:12:54,105] Trial 2358 finished with value: 0.002070487244054675 and parameters: {'width_NN_heal': 447, 'width_NN_state': 298, 'depth_NN_heal': 2, 'depth_NN_state': 1, 'mode_heal': 64, 'mode_state': 60, 'blocks_heal': 4, 'blocks_state': 3, 'lift_act_state': <built-in function gelu>, 'block_act_state': <built-in function gelu>, 'lift_act_heal': <built-in function gelu>, 'block_act_heal': None, 'width_heal': 58, 'width_state': 123, 'lr': 0.0010794236117679257, 'padding_heal': 9, 'padding_state': 18, 'optimizer_type': 'lbfgs'}. Best is trial 1511 with value: 0.0009640019852668047.
[I 2025-07-31 00:12:58,650] Trial 2359 finished with value: 0.0010919439373537898 and parameters: {'width_NN_heal': 397, 'width_NN_state': 328, 'depth_NN_heal': 2, 'depth_NN_state': 3, 'mode_heal': 64, 'mode_state': 60, 'blocks_heal': 5, 'blocks_state': 3, 'lift_act_state': <built-in function gelu>, 'block_act_state': <built-in function gelu>, 'lift_act_heal': <built-in function gelu>, 'block_act_heal': None, 'width_heal': 62, 'width_state': 122, 'lr': 0.0012070140632897152, 'padding_heal': 6, 'padding_state': 17, 'optimizer_type': 'lbfgs'}. Best is trial 1511 with value: 0.0009640019852668047.
[I 2025-07-31 00:13:03,086] Trial 2360 finished with value: 0.0014343548100441694 and parameters: {'width_NN_heal': 446, 'width_NN_state': 262, 'depth_NN_heal': 2, 'depth_NN_state': 1, 'mode_heal': 64, 'mode_state': 60, 'blocks_heal': 6, 'blocks_state': 4, 'lift_act_state': <built-in function gelu>, 'block_act_state': <built-in function gelu>, 'lift_act_heal': <built-in function gelu>, 'block_act_heal': None, 'width_heal': 58, 'width_state': 121, 'lr': 0.00125342015780523, 'padding_heal': 6, 'padding_state': 18, 'optimizer_type': 'lbfgs'}. Best is trial 1511 with value: 0.0009640019852668047.
[I 2025-07-31 00:13:07,374] Trial 2361 finished with value: 0.0010782164754346013 and parameters: {'width_NN_heal': 378, 'width_NN_state': 306, 'depth_NN_heal': 2, 'depth_NN_state': 3, 'mode_heal': 64, 'mode_state': 60, 'blocks_heal': 5, 'blocks_state': 3, 'lift_act_state': <built-in function gelu>, 'block_act_state': <built-in function gelu>, 'lift_act_heal': <built-in function gelu>, 'block_act_heal': None, 'width_heal': 55, 'width_state': 122, 'lr': 0.0013029353881456587, 'padding_heal': 8, 'padding_state': 17, 'optimizer_type': 'lbfgs'}. Best is trial 1511 with value: 0.0009640019852668047.
[I 2025-07-31 00:13:12,805] Trial 2362 finished with value: 0.0010943968081846833 and parameters: {'width_NN_heal': 419, 'width_NN_state': 285, 'depth_NN_heal': 2, 'depth_NN_state': 3, 'mode_heal': 64, 'mode_state': 56, 'blocks_heal': 8, 'blocks_state': 3, 'lift_act_state': <built-in function gelu>, 'block_act_state': <built-in function gelu>, 'lift_act_heal': <built-in function gelu>, 'block_act_heal': None, 'width_heal': 67, 'width_state': 127, 'lr': 0.0011476285022393707, 'padding_heal': 7, 'padding_state': 18, 'optimizer_type': 'lbfgs'}. Best is trial 1511 with value: 0.0009640019852668047.
[I 2025-07-31 00:13:17,617] Trial 2363 finished with value: 0.0011224144836887717 and parameters: {'width_NN_heal': 512, 'width_NN_state': 328, 'depth_NN_heal': 2, 'depth_NN_state': 3, 'mode_heal': 64, 'mode_state': 60, 'blocks_heal': 5, 'blocks_state': 3, 'lift_act_state': <built-in function gelu>, 'block_act_state': <built-in function gelu>, 'lift_act_heal': <built-in function gelu>, 'block_act_heal': None, 'width_heal': 55, 'width_state': 119, 'lr': 0.0012515718671721186, 'padding_heal': 8, 'padding_state': 17, 'optimizer_type': 'lbfgs'}. Best is trial 1511 with value: 0.0009640019852668047.
[I 2025-07-31 00:13:22,061] Trial 2364 finished with value: 0.0011391706066206098 and parameters: {'width_NN_heal': 374, 'width_NN_state': 257, 'depth_NN_heal': 2, 'depth_NN_state': 3, 'mode_heal': 64, 'mode_state': 60, 'blocks_heal': 6, 'blocks_state': 3, 'lift_act_state': <built-in function gelu>, 'block_act_state': <built-in function gelu>, 'lift_act_heal': <built-in function gelu>, 'block_act_heal': None, 'width_heal': 61, 'width_state': 119, 'lr': 0.0011597424788670607, 'padding_heal': 7, 'padding_state': 17, 'optimizer_type': 'lbfgs'}. Best is trial 1511 with value: 0.0009640019852668047.
[I 2025-07-31 00:13:26,174] Trial 2365 finished with value: 0.001144046662375331 and parameters: {'width_NN_heal': 413, 'width_NN_state': 333, 'depth_NN_heal': 2, 'depth_NN_state': 3, 'mode_heal': 64, 'mode_state': 56, 'blocks_heal': 2, 'blocks_state': 3, 'lift_act_state': <built-in function gelu>, 'block_act_state': <built-in function gelu>, 'lift_act_heal': <built-in function gelu>, 'block_act_heal': None, 'width_heal': 70, 'width_state': 122, 'lr': 0.0013016813666768769, 'padding_heal': 7, 'padding_state': 18, 'optimizer_type': 'lbfgs'}. Best is trial 1511 with value: 0.0009640019852668047.
[I 2025-07-31 00:13:30,305] Trial 2366 finished with value: 0.00121024448890239 and parameters: {'width_NN_heal': 470, 'width_NN_state': 298, 'depth_NN_heal': 2, 'depth_NN_state': 3, 'mode_heal': 64, 'mode_state': 60, 'blocks_heal': 4, 'blocks_state': 3, 'lift_act_state': <built-in function gelu>, 'block_act_state': <built-in function gelu>, 'lift_act_heal': <built-in function gelu>, 'block_act_heal': None, 'width_heal': 54, 'width_state': 119, 'lr': 0.0012966977568768482, 'padding_heal': 6, 'padding_state': 16, 'optimizer_type': 'lbfgs'}. Best is trial 1511 with value: 0.0009640019852668047.
[I 2025-07-31 00:13:34,854] Trial 2367 finished with value: 0.0012503054458647966 and parameters: {'width_NN_heal': 356, 'width_NN_state': 280, 'depth_NN_heal': 2, 'depth_NN_state': 3, 'mode_heal': 64, 'mode_state': 60, 'blocks_heal': 5, 'blocks_state': 3, 'lift_act_state': <function tanh at 0x7ff3611b4cc0>, 'block_act_state': <built-in function gelu>, 'lift_act_heal': <built-in function gelu>, 'block_act_heal': None, 'width_heal': 63, 'width_state': 114, 'lr': 0.0010878088874150843, 'padding_heal': 14, 'padding_state': 19, 'optimizer_type': 'lbfgs'}. Best is trial 1511 with value: 0.0009640019852668047.
[I 2025-07-31 00:13:38,911] Trial 2368 finished with value: 0.0012797859963029623 and parameters: {'width_NN_heal': 389, 'width_NN_state': 230, 'depth_NN_heal': 2, 'depth_NN_state': 3, 'mode_heal': 64, 'mode_state': 56, 'blocks_heal': 5, 'blocks_state': 3, 'lift_act_state': <built-in function gelu>, 'block_act_state': <built-in function gelu>, 'lift_act_heal': <built-in function gelu>, 'block_act_heal': None, 'width_heal': 53, 'width_state': 114, 'lr': 0.001341100923823699, 'padding_heal': 6, 'padding_state': 16, 'optimizer_type': 'lbfgs'}. Best is trial 1511 with value: 0.0009640019852668047.
[I 2025-07-31 00:13:43,619] Trial 2369 finished with value: 0.001146645867265761 and parameters: {'width_NN_heal': 442, 'width_NN_state': 311, 'depth_NN_heal': 2, 'depth_NN_state': 3, 'mode_heal': 64, 'mode_state': 60, 'blocks_heal': 6, 'blocks_state': 3, 'lift_act_state': <built-in function gelu>, 'block_act_state': <built-in function gelu>, 'lift_act_heal': <built-in function gelu>, 'block_act_heal': None, 'width_heal': 58, 'width_state': 127, 'lr': 0.0013909228653861795, 'padding_heal': 7, 'padding_state': 18, 'optimizer_type': 'adam'}. Best is trial 1511 with value: 0.0009640019852668047.
[I 2025-07-31 00:13:47,660] Trial 2370 finished with value: 0.0011715720174834132 and parameters: {'width_NN_heal': 398, 'width_NN_state': 326, 'depth_NN_heal': 2, 'depth_NN_state': 3, 'mode_heal': 64, 'mode_state': 60, 'blocks_heal': 3, 'blocks_state': 3, 'lift_act_state': <built-in function gelu>, 'block_act_state': <built-in function gelu>, 'lift_act_heal': <built-in function gelu>, 'block_act_heal': None, 'width_heal': 51, 'width_state': 114, 'lr': 0.0014071283752535972, 'padding_heal': 8, 'padding_state': 16, 'optimizer_type': 'lbfgs'}. Best is trial 1511 with value: 0.0009640019852668047.
[I 2025-07-31 00:13:50,966] Trial 2371 finished with value: 0.0014557491522282362 and parameters: {'width_NN_heal': 474, 'width_NN_state': 273, 'depth_NN_heal': 1, 'depth_NN_state': 3, 'mode_heal': 64, 'mode_state': 60, 'blocks_heal': 2, 'blocks_state': 3, 'lift_act_state': <built-in function gelu>, 'block_act_state': <built-in function gelu>, 'lift_act_heal': <built-in function gelu>, 'block_act_heal': None, 'width_heal': 65, 'width_state': 122, 'lr': 0.0012376360748920243, 'padding_heal': 7, 'padding_state': 17, 'optimizer_type': 'lbfgs'}. Best is trial 1511 with value: 0.0009640019852668047.
[I 2025-07-31 00:13:55,519] Trial 2372 finished with value: 0.0021059114951640368 and parameters: {'width_NN_heal': 349, 'width_NN_state': 346, 'depth_NN_heal': 2, 'depth_NN_state': 3, 'mode_heal': 64, 'mode_state': 60, 'blocks_heal': 6, 'blocks_state': 3, 'lift_act_state': <built-in function gelu>, 'block_act_state': <function tanh at 0x7ff3611b4cc0>, 'lift_act_heal': <built-in function gelu>, 'block_act_heal': None, 'width_heal': 57, 'width_state': 128, 'lr': 0.001083761292261506, 'padding_heal': 6, 'padding_state': 17, 'optimizer_type': 'lbfgs'}. Best is trial 1511 with value: 0.0009640019852668047.
[I 2025-07-31 00:13:58,721] Trial 2373 finished with value: 0.0017687516519799829 and parameters: {'width_NN_heal': 427, 'width_NN_state': 292, 'depth_NN_heal': 2, 'depth_NN_state': 1, 'mode_heal': 64, 'mode_state': 56, 'blocks_heal': 2, 'blocks_state': 3, 'lift_act_state': None, 'block_act_state': <built-in function gelu>, 'lift_act_heal': <built-in function gelu>, 'block_act_heal': None, 'width_heal': 72, 'width_state': 127, 'lr': 0.0013843113262348523, 'padding_heal': 6, 'padding_state': 15, 'optimizer_type': 'lbfgs'}. Best is trial 1511 with value: 0.0009640019852668047.
[I 2025-07-31 00:14:02,961] Trial 2374 finished with value: 0.001231715315952897 and parameters: {'width_NN_heal': 373, 'width_NN_state': 248, 'depth_NN_heal': 2, 'depth_NN_state': 3, 'mode_heal': 64, 'mode_state': 56, 'blocks_heal': 6, 'blocks_state': 3, 'lift_act_state': <built-in function gelu>, 'block_act_state': <built-in function gelu>, 'lift_act_heal': <built-in function gelu>, 'block_act_heal': None, 'width_heal': 59, 'width_state': 115, 'lr': 0.0012037226414267604, 'padding_heal': 6, 'padding_state': 18, 'optimizer_type': 'lbfgs'}. Best is trial 1511 with value: 0.0009640019852668047.
[I 2025-07-31 00:14:07,005] Trial 2375 finished with value: 0.0013126448029652238 and parameters: {'width_NN_heal': 470, 'width_NN_state': 310, 'depth_NN_heal': 2, 'depth_NN_state': 3, 'mode_heal': 16, 'mode_state': 60, 'blocks_heal': 4, 'blocks_state': 2, 'lift_act_state': <built-in function gelu>, 'block_act_state': <built-in function gelu>, 'lift_act_heal': <built-in function gelu>, 'block_act_heal': None, 'width_heal': 51, 'width_state': 128, 'lr': 0.0014608710347799236, 'padding_heal': 7, 'padding_state': 17, 'optimizer_type': 'lbfgs'}. Best is trial 1511 with value: 0.0009640019852668047.
[I 2025-07-31 00:14:11,454] Trial 2376 finished with value: 0.0010190390748903155 and parameters: {'width_NN_heal': 413, 'width_NN_state': 340, 'depth_NN_heal': 2, 'depth_NN_state': 3, 'mode_heal': 64, 'mode_state': 60, 'blocks_heal': 4, 'blocks_state': 3, 'lift_act_state': <built-in function gelu>, 'block_act_state': <built-in function gelu>, 'lift_act_heal': <built-in function gelu>, 'block_act_heal': None, 'width_heal': 55, 'width_state': 112, 'lr': 0.0013140205865303561, 'padding_heal': 2, 'padding_state': 19, 'optimizer_type': 'lbfgs'}. Best is trial 1511 with value: 0.0009640019852668047.
[I 2025-07-31 00:14:15,892] Trial 2377 finished with value: 0.0012193128932267427 and parameters: {'width_NN_heal': 455, 'width_NN_state': 362, 'depth_NN_heal': 2, 'depth_NN_state': 3, 'mode_heal': 64, 'mode_state': 60, 'blocks_heal': 4, 'blocks_state': 3, 'lift_act_state': <built-in function gelu>, 'block_act_state': <built-in function gelu>, 'lift_act_heal': <built-in function gelu>, 'block_act_heal': None, 'width_heal': 49, 'width_state': 117, 'lr': 0.0012071523222903907, 'padding_heal': 3, 'padding_state': 19, 'optimizer_type': 'lbfgs'}. Best is trial 1511 with value: 0.0009640019852668047.
[I 2025-07-31 00:14:20,404] Trial 2378 finished with value: 0.0020186076872050762 and parameters: {'width_NN_heal': 440, 'width_NN_state': 351, 'depth_NN_heal': 2, 'depth_NN_state': 3, 'mode_heal': 64, 'mode_state': 60, 'blocks_heal': 4, 'blocks_state': 4, 'lift_act_state': <built-in function gelu>, 'block_act_state': None, 'lift_act_heal': <built-in function gelu>, 'block_act_heal': None, 'width_heal': 52, 'width_state': 114, 'lr': 0.0010579001466252615, 'padding_heal': 1, 'padding_state': 19, 'optimizer_type': 'lbfgs'}. Best is trial 1511 with value: 0.0009640019852668047.
[I 2025-07-31 00:14:24,794] Trial 2379 finished with value: 0.0013299440033733845 and parameters: {'width_NN_heal': 481, 'width_NN_state': 369, 'depth_NN_heal': 2, 'depth_NN_state': 3, 'mode_heal': 64, 'mode_state': 60, 'blocks_heal': 4, 'blocks_state': 3, 'lift_act_state': <built-in function gelu>, 'block_act_state': <built-in function gelu>, 'lift_act_heal': <built-in function gelu>, 'block_act_heal': None, 'width_heal': 48, 'width_state': 122, 'lr': 0.0011256898133653334, 'padding_heal': 1, 'padding_state': 19, 'optimizer_type': 'lbfgs'}. Best is trial 1511 with value: 0.0009640019852668047.
[I 2025-07-31 00:14:29,615] Trial 2380 finished with value: 0.0011637761490419507 and parameters: {'width_NN_heal': 432, 'width_NN_state': 353, 'depth_NN_heal': 2, 'depth_NN_state': 3, 'mode_heal': 64, 'mode_state': 60, 'blocks_heal': 6, 'blocks_state': 3, 'lift_act_state': <built-in function gelu>, 'block_act_state': <built-in function gelu>, 'lift_act_heal': <built-in function gelu>, 'block_act_heal': None, 'width_heal': 50, 'width_state': 113, 'lr': 0.0011871255753792003, 'padding_heal': 2, 'padding_state': 19, 'optimizer_type': 'lbfgs'}. Best is trial 1511 with value: 0.0009640019852668047.
[I 2025-07-31 00:14:34,073] Trial 2381 finished with value: 0.0011307725217193365 and parameters: {'width_NN_heal': 417, 'width_NN_state': 381, 'depth_NN_heal': 2, 'depth_NN_state': 3, 'mode_heal': 64, 'mode_state': 60, 'blocks_heal': 4, 'blocks_state': 3, 'lift_act_state': <built-in function gelu>, 'block_act_state': <built-in function gelu>, 'lift_act_heal': <built-in function gelu>, 'block_act_heal': None, 'width_heal': 54, 'width_state': 121, 'lr': 0.001049570407502411, 'padding_heal': 1, 'padding_state': 19, 'optimizer_type': 'lbfgs'}. Best is trial 1511 with value: 0.0009640019852668047.
