[I 2025-07-30 21:49:39,649] Trial 623 finished with value: 0.0012838513357564807 and parameters: {'width_NN_heal': 125, 'width_NN_state': 340, 'depth_NN_heal': 4, 'depth_NN_state': 3, 'mode_heal': 52, 'mode_state': 64, 'blocks_heal': 7, 'blocks_state': 3, 'lift_act_state': <built-in function gelu>, 'block_act_state': <built-in function gelu>, 'lift_act_heal': <function tanh at 0x7ff3611b4cc0>, 'block_act_heal': <function tanh at 0x7ff3611b4cc0>, 'width_heal': 21, 'width_state': 31, 'lr': 0.0018864328862446954, 'padding_heal': 2, 'padding_state': 19, 'optimizer_type': 'lbfgs'}. Best is trial 484 with value: 0.0010389797389507294.
[I 2025-07-30 21:49:44,499] Trial 624 finished with value: 0.0011883366387337446 and parameters: {'width_NN_heal': 185, 'width_NN_state': 258, 'depth_NN_heal': 5, 'depth_NN_state': 4, 'mode_heal': 60, 'mode_state': 64, 'blocks_heal': 7, 'blocks_state': 3, 'lift_act_state': <built-in function gelu>, 'block_act_state': <built-in function gelu>, 'lift_act_heal': <function tanh at 0x7ff3611b4cc0>, 'block_act_heal': <function tanh at 0x7ff3611b4cc0>, 'width_heal': 24, 'width_state': 26, 'lr': 0.0029271521374705555, 'padding_heal': 1, 'padding_state': 21, 'optimizer_type': 'lbfgs'}. Best is trial 484 with value: 0.0010389797389507294.
[I 2025-07-30 21:49:49,408] Trial 625 finished with value: 0.0011590393260121346 and parameters: {'width_NN_heal': 118, 'width_NN_state': 305, 'depth_NN_heal': 4, 'depth_NN_state': 4, 'mode_heal': 60, 'mode_state': 64, 'blocks_heal': 7, 'blocks_state': 3, 'lift_act_state': <built-in function gelu>, 'block_act_state': <built-in function gelu>, 'lift_act_heal': <function tanh at 0x7ff3611b4cc0>, 'block_act_heal': <function tanh at 0x7ff3611b4cc0>, 'width_heal': 29, 'width_state': 34, 'lr': 0.0024872236557776815, 'padding_heal': 4, 'padding_state': 21, 'optimizer_type': 'lbfgs'}. Best is trial 484 with value: 0.0010389797389507294.
[I 2025-07-30 21:49:54,508] Trial 626 finished with value: 0.001424493151716888 and parameters: {'width_NN_heal': 115, 'width_NN_state': 367, 'depth_NN_heal': 4, 'depth_NN_state': 4, 'mode_heal': 60, 'mode_state': 60, 'blocks_heal': 7, 'blocks_state': 3, 'lift_act_state': <built-in function gelu>, 'block_act_state': <function tanh at 0x7ff3611b4cc0>, 'lift_act_heal': <function tanh at 0x7ff3611b4cc0>, 'block_act_heal': <function tanh at 0x7ff3611b4cc0>, 'width_heal': 33, 'width_state': 35, 'lr': 0.0023388822626184903, 'padding_heal': 5, 'padding_state': 22, 'optimizer_type': 'lbfgs'}. Best is trial 484 with value: 0.0010389797389507294.
[I 2025-07-30 21:49:59,457] Trial 627 finished with value: 0.001169230556115508 and parameters: {'width_NN_heal': 107, 'width_NN_state': 309, 'depth_NN_heal': 4, 'depth_NN_state': 5, 'mode_heal': 60, 'mode_state': 64, 'blocks_heal': 7, 'blocks_state': 3, 'lift_act_state': <built-in function gelu>, 'block_act_state': <built-in function gelu>, 'lift_act_heal': <function tanh at 0x7ff3611b4cc0>, 'block_act_heal': <function tanh at 0x7ff3611b4cc0>, 'width_heal': 30, 'width_state': 33, 'lr': 0.0024929622656122107, 'padding_heal': 5, 'padding_state': 21, 'optimizer_type': 'lbfgs'}. Best is trial 484 with value: 0.0010389797389507294.
[I 2025-07-30 21:50:05,876] Trial 628 finished with value: 0.015814485028386116 and parameters: {'width_NN_heal': 122, 'width_NN_state': 327, 'depth_NN_heal': 4, 'depth_NN_state': 4, 'mode_heal': 56, 'mode_state': 64, 'blocks_heal': 7, 'blocks_state': 8, 'lift_act_state': <built-in function gelu>, 'block_act_state': <built-in function gelu>, 'lift_act_heal': <function tanh at 0x7ff3611b4cc0>, 'block_act_heal': <function tanh at 0x7ff3611b4cc0>, 'width_heal': 28, 'width_state': 38, 'lr': 0.0020907405369745813, 'padding_heal': 6, 'padding_state': 22, 'optimizer_type': 'lbfgs'}. Best is trial 484 with value: 0.0010389797389507294.
[I 2025-07-30 21:50:11,651] Trial 629 finished with value: 0.0018963492475450039 and parameters: {'width_NN_heal': 134, 'width_NN_state': 433, 'depth_NN_heal': 4, 'depth_NN_state': 4, 'mode_heal': 60, 'mode_state': 60, 'blocks_heal': 7, 'blocks_state': 3, 'lift_act_state': <built-in function gelu>, 'block_act_state': None, 'lift_act_heal': <function tanh at 0x7ff3611b4cc0>, 'block_act_heal': <function tanh at 0x7ff3611b4cc0>, 'width_heal': 27, 'width_state': 41, 'lr': 0.0022339916573477048, 'padding_heal': 4, 'padding_state': 21, 'optimizer_type': 'lbfgs'}. Best is trial 484 with value: 0.0010389797389507294.
[I 2025-07-30 21:50:16,587] Trial 630 finished with value: 0.0015575283905491233 and parameters: {'width_NN_heal': 114, 'width_NN_state': 298, 'depth_NN_heal': 4, 'depth_NN_state': 4, 'mode_heal': 60, 'mode_state': 64, 'blocks_heal': 7, 'blocks_state': 3, 'lift_act_state': <built-in function gelu>, 'block_act_state': <built-in function gelu>, 'lift_act_heal': <function tanh at 0x7ff3611b4cc0>, 'block_act_heal': <function tanh at 0x7ff3611b4cc0>, 'width_heal': 33, 'width_state': 31, 'lr': 0.002624193010946092, 'padding_heal': 4, 'padding_state': 21, 'optimizer_type': 'lbfgs'}. Best is trial 484 with value: 0.0010389797389507294.
[I 2025-07-30 21:50:21,493] Trial 631 finished with value: 0.0010926069226115942 and parameters: {'width_NN_heal': 134, 'width_NN_state': 349, 'depth_NN_heal': 4, 'depth_NN_state': 4, 'mode_heal': 56, 'mode_state': 60, 'blocks_heal': 7, 'blocks_state': 3, 'lift_act_state': <built-in function gelu>, 'block_act_state': <built-in function gelu>, 'lift_act_heal': <function tanh at 0x7ff3611b4cc0>, 'block_act_heal': <function tanh at 0x7ff3611b4cc0>, 'width_heal': 28, 'width_state': 34, 'lr': 0.0018928815253961714, 'padding_heal': 6, 'padding_state': 20, 'optimizer_type': 'lbfgs'}. Best is trial 484 with value: 0.0010389797389507294.
[I 2025-07-30 21:50:26,613] Trial 632 finished with value: 0.0012159625766798854 and parameters: {'width_NN_heal': 132, 'width_NN_state': 367, 'depth_NN_heal': 4, 'depth_NN_state': 4, 'mode_heal': 52, 'mode_state': 60, 'blocks_heal': 7, 'blocks_state': 3, 'lift_act_state': <built-in function gelu>, 'block_act_state': <built-in function gelu>, 'lift_act_heal': <function tanh at 0x7ff3611b4cc0>, 'block_act_heal': <function tanh at 0x7ff3611b4cc0>, 'width_heal': 28, 'width_state': 34, 'lr': 0.0019804796073077525, 'padding_heal': 6, 'padding_state': 22, 'optimizer_type': 'lbfgs'}. Best is trial 484 with value: 0.0010389797389507294.
[I 2025-07-30 21:50:31,667] Trial 633 finished with value: 0.0018174536526203156 and parameters: {'width_NN_heal': 121, 'width_NN_state': 342, 'depth_NN_heal': 4, 'depth_NN_state': 5, 'mode_heal': 56, 'mode_state': 60, 'blocks_heal': 7, 'blocks_state': 3, 'lift_act_state': None, 'block_act_state': <built-in function gelu>, 'lift_act_heal': <function tanh at 0x7ff3611b4cc0>, 'block_act_heal': <function tanh at 0x7ff3611b4cc0>, 'width_heal': 31, 'width_state': 37, 'lr': 0.0017186670796376627, 'padding_heal': 6, 'padding_state': 21, 'optimizer_type': 'lbfgs'}. Best is trial 484 with value: 0.0010389797389507294.
[I 2025-07-30 21:50:36,571] Trial 634 finished with value: 0.0012920836452394724 and parameters: {'width_NN_heal': 140, 'width_NN_state': 298, 'depth_NN_heal': 4, 'depth_NN_state': 4, 'mode_heal': 56, 'mode_state': 60, 'blocks_heal': 7, 'blocks_state': 3, 'lift_act_state': <built-in function gelu>, 'block_act_state': <built-in function gelu>, 'lift_act_heal': <function tanh at 0x7ff3611b4cc0>, 'block_act_heal': <function tanh at 0x7ff3611b4cc0>, 'width_heal': 30, 'width_state': 32, 'lr': 0.0015927511969144415, 'padding_heal': 4, 'padding_state': 20, 'optimizer_type': 'lbfgs'}. Best is trial 484 with value: 0.0010389797389507294.
[I 2025-07-30 21:50:42,410] Trial 635 finished with value: 0.01993800699710846 and parameters: {'width_NN_heal': 144, 'width_NN_state': 320, 'depth_NN_heal': 3, 'depth_NN_state': 4, 'mode_heal': 56, 'mode_state': 60, 'blocks_heal': 7, 'blocks_state': 7, 'lift_act_state': <built-in function gelu>, 'block_act_state': <built-in function gelu>, 'lift_act_heal': <function tanh at 0x7ff3611b4cc0>, 'block_act_heal': <function tanh at 0x7ff3611b4cc0>, 'width_heal': 4, 'width_state': 34, 'lr': 0.0006571110516930043, 'padding_heal': 2, 'padding_state': 21, 'optimizer_type': 'lbfgs'}. Best is trial 484 with value: 0.0010389797389507294.
[I 2025-07-30 21:50:47,285] Trial 636 finished with value: 0.0030850120820105076 and parameters: {'width_NN_heal': 124, 'width_NN_state': 279, 'depth_NN_heal': 4, 'depth_NN_state': 5, 'mode_heal': 56, 'mode_state': 60, 'blocks_heal': 7, 'blocks_state': 3, 'lift_act_state': <built-in function gelu>, 'block_act_state': <built-in function gelu>, 'lift_act_heal': <function tanh at 0x7ff3611b4cc0>, 'block_act_heal': <function tanh at 0x7ff3611b4cc0>, 'width_heal': 6, 'width_state': 29, 'lr': 0.001790140354962919, 'padding_heal': 3, 'padding_state': 22, 'optimizer_type': 'lbfgs'}. Best is trial 484 with value: 0.0010389797389507294.
[I 2025-07-30 21:50:52,233] Trial 637 finished with value: 0.0011794688180088997 and parameters: {'width_NN_heal': 107, 'width_NN_state': 350, 'depth_NN_heal': 4, 'depth_NN_state': 4, 'mode_heal': 56, 'mode_state': 60, 'blocks_heal': 7, 'blocks_state': 3, 'lift_act_state': <built-in function gelu>, 'block_act_state': <built-in function gelu>, 'lift_act_heal': <function tanh at 0x7ff3611b4cc0>, 'block_act_heal': <function tanh at 0x7ff3611b4cc0>, 'width_heal': 26, 'width_state': 37, 'lr': 0.0019468778505700595, 'padding_heal': 1, 'padding_state': 20, 'optimizer_type': 'lbfgs'}. Best is trial 484 with value: 0.0010389797389507294.
[I 2025-07-30 21:50:56,979] Trial 638 finished with value: 0.0012251728912815452 and parameters: {'width_NN_heal': 132, 'width_NN_state': 311, 'depth_NN_heal': 4, 'depth_NN_state': 4, 'mode_heal': 56, 'mode_state': 60, 'blocks_heal': 7, 'blocks_state': 3, 'lift_act_state': <built-in function gelu>, 'block_act_state': <built-in function gelu>, 'lift_act_heal': <function tanh at 0x7ff3611b4cc0>, 'block_act_heal': <function tanh at 0x7ff3611b4cc0>, 'width_heal': 28, 'width_state': 41, 'lr': 0.0025199788641606788, 'padding_heal': 5, 'padding_state': 21, 'optimizer_type': 'lbfgs'}. Best is trial 484 with value: 0.0010389797389507294.
[I 2025-07-30 21:51:01,870] Trial 639 finished with value: 0.001256719813682139 and parameters: {'width_NN_heal': 119, 'width_NN_state': 268, 'depth_NN_heal': 4, 'depth_NN_state': 4, 'mode_heal': 52, 'mode_state': 60, 'blocks_heal': 7, 'blocks_state': 3, 'lift_act_state': <built-in function gelu>, 'block_act_state': <built-in function gelu>, 'lift_act_heal': <function tanh at 0x7ff3611b4cc0>, 'block_act_heal': <function tanh at 0x7ff3611b4cc0>, 'width_heal': 29, 'width_state': 35, 'lr': 0.0015197684659767126, 'padding_heal': 6, 'padding_state': 20, 'optimizer_type': 'lbfgs'}. Best is trial 484 with value: 0.0010389797389507294.
[I 2025-07-30 21:51:06,829] Trial 640 finished with value: 0.0013254752848297358 and parameters: {'width_NN_heal': 149, 'width_NN_state': 285, 'depth_NN_heal': 3, 'depth_NN_state': 5, 'mode_heal': 56, 'mode_state': 60, 'blocks_heal': 7, 'blocks_state': 3, 'lift_act_state': <built-in function gelu>, 'block_act_state': <built-in function gelu>, 'lift_act_heal': <function tanh at 0x7ff3611b4cc0>, 'block_act_heal': <function tanh at 0x7ff3611b4cc0>, 'width_heal': 26, 'width_state': 31, 'lr': 0.0018451264050813878, 'padding_heal': 4, 'padding_state': 22, 'optimizer_type': 'lbfgs'}. Best is trial 484 with value: 0.0010389797389507294.
[I 2025-07-30 21:51:11,820] Trial 641 finished with value: 0.0011466798605397344 and parameters: {'width_NN_heal': 136, 'width_NN_state': 324, 'depth_NN_heal': 4, 'depth_NN_state': 4, 'mode_heal': 56, 'mode_state': 60, 'blocks_heal': 7, 'blocks_state': 2, 'lift_act_state': <built-in function gelu>, 'block_act_state': <built-in function gelu>, 'lift_act_heal': <function tanh at 0x7ff3611b4cc0>, 'block_act_heal': <function tanh at 0x7ff3611b4cc0>, 'width_heal': 32, 'width_state': 33, 'lr': 0.00273853085622307, 'padding_heal': 4, 'padding_state': 21, 'optimizer_type': 'lbfgs'}. Best is trial 484 with value: 0.0010389797389507294.
[I 2025-07-30 21:51:17,252] Trial 642 finished with value: 0.0012337652733549476 and parameters: {'width_NN_heal': 130, 'width_NN_state': 391, 'depth_NN_heal': 4, 'depth_NN_state': 4, 'mode_heal': 56, 'mode_state': 60, 'blocks_heal': 7, 'blocks_state': 2, 'lift_act_state': <built-in function gelu>, 'block_act_state': <built-in function gelu>, 'lift_act_heal': <function tanh at 0x7ff3611b4cc0>, 'block_act_heal': <function tanh at 0x7ff3611b4cc0>, 'width_heal': 32, 'width_state': 32, 'lr': 0.0021156728886089792, 'padding_heal': 5, 'padding_state': 20, 'optimizer_type': 'lbfgs'}. Best is trial 484 with value: 0.0010389797389507294.
[I 2025-07-30 21:51:22,002] Trial 643 finished with value: 0.0013367547653615475 and parameters: {'width_NN_heal': 110, 'width_NN_state': 340, 'depth_NN_heal': 4, 'depth_NN_state': 3, 'mode_heal': 56, 'mode_state': 60, 'blocks_heal': 7, 'blocks_state': 3, 'lift_act_state': <built-in function gelu>, 'block_act_state': <built-in function gelu>, 'lift_act_heal': <function tanh at 0x7ff3611b4cc0>, 'block_act_heal': None, 'width_heal': 31, 'width_state': 29, 'lr': 0.002677445348741228, 'padding_heal': 4, 'padding_state': 21, 'optimizer_type': 'lbfgs'}. Best is trial 484 with value: 0.0010389797389507294.
[I 2025-07-30 21:51:26,940] Trial 644 finished with value: 0.0014798562042415142 and parameters: {'width_NN_heal': 158, 'width_NN_state': 322, 'depth_NN_heal': 4, 'depth_NN_state': 4, 'mode_heal': 56, 'mode_state': 60, 'blocks_heal': 7, 'blocks_state': 2, 'lift_act_state': <built-in function gelu>, 'block_act_state': <built-in function gelu>, 'lift_act_heal': <function tanh at 0x7ff3611b4cc0>, 'block_act_heal': <function tanh at 0x7ff3611b4cc0>, 'width_heal': 34, 'width_state': 38, 'lr': 0.002463273451032403, 'padding_heal': 4, 'padding_state': 19, 'optimizer_type': 'lbfgs'}. Best is trial 484 with value: 0.0010389797389507294.
[I 2025-07-30 21:51:32,463] Trial 645 finished with value: 0.0013712404761463404 and parameters: {'width_NN_heal': 120, 'width_NN_state': 356, 'depth_NN_heal': 4, 'depth_NN_state': 5, 'mode_heal': 56, 'mode_state': 60, 'blocks_heal': 7, 'blocks_state': 2, 'lift_act_state': <built-in function gelu>, 'block_act_state': <built-in function gelu>, 'lift_act_heal': <function tanh at 0x7ff3611b4cc0>, 'block_act_heal': <function tanh at 0x7ff3611b4cc0>, 'width_heal': 29, 'width_state': 33, 'lr': 0.00228564229915203, 'padding_heal': 5, 'padding_state': 22, 'optimizer_type': 'lbfgs'}. Best is trial 484 with value: 0.0010389797389507294.
[I 2025-07-30 21:51:37,264] Trial 646 finished with value: 0.0013122300151735544 and parameters: {'width_NN_heal': 135, 'width_NN_state': 302, 'depth_NN_heal': 4, 'depth_NN_state': 3, 'mode_heal': 52, 'mode_state': 56, 'blocks_heal': 7, 'blocks_state': 3, 'lift_act_state': <built-in function gelu>, 'block_act_state': <built-in function gelu>, 'lift_act_heal': <function tanh at 0x7ff3611b4cc0>, 'block_act_heal': <function tanh at 0x7ff3611b4cc0>, 'width_heal': 31, 'width_state': 34, 'lr': 0.0027242259645283047, 'padding_heal': 3, 'padding_state': 20, 'optimizer_type': 'lbfgs'}. Best is trial 484 with value: 0.0010389797389507294.
[I 2025-07-30 21:51:42,167] Trial 647 finished with value: 0.0012036074185743928 and parameters: {'width_NN_heal': 104, 'width_NN_state': 377, 'depth_NN_heal': 4, 'depth_NN_state': 4, 'mode_heal': 56, 'mode_state': 60, 'blocks_heal': 7, 'blocks_state': 2, 'lift_act_state': <built-in function gelu>, 'block_act_state': <built-in function gelu>, 'lift_act_heal': <function tanh at 0x7ff3611b4cc0>, 'block_act_heal': <function tanh at 0x7ff3611b4cc0>, 'width_heal': 33, 'width_state': 30, 'lr': 0.0016920021388167155, 'padding_heal': 6, 'padding_state': 21, 'optimizer_type': 'lbfgs'}. Best is trial 484 with value: 0.0010389797389507294.
[I 2025-07-30 21:51:47,092] Trial 648 finished with value: 0.002863945672288537 and parameters: {'width_NN_heal': 196, 'width_NN_state': 322, 'depth_NN_heal': 4, 'depth_NN_state': 4, 'mode_heal': 52, 'mode_state': 60, 'blocks_heal': 7, 'blocks_state': 1, 'lift_act_state': <built-in function gelu>, 'block_act_state': <function tanh at 0x7ff3611b4cc0>, 'lift_act_heal': <function tanh at 0x7ff3611b4cc0>, 'block_act_heal': <function tanh at 0x7ff3611b4cc0>, 'width_heal': 27, 'width_state': 28, 'lr': 0.0024424069611726266, 'padding_heal': 4, 'padding_state': 21, 'optimizer_type': 'lbfgs'}. Best is trial 484 with value: 0.0010389797389507294.
[I 2025-07-30 21:51:52,156] Trial 649 finished with value: 0.001445089466869831 and parameters: {'width_NN_heal': 150, 'width_NN_state': 289, 'depth_NN_heal': 4, 'depth_NN_state': 5, 'mode_heal': 56, 'mode_state': 60, 'blocks_heal': 7, 'blocks_state': 3, 'lift_act_state': <built-in function gelu>, 'block_act_state': <built-in function gelu>, 'lift_act_heal': <function tanh at 0x7ff3611b4cc0>, 'block_act_heal': <function tanh at 0x7ff3611b4cc0>, 'width_heal': 29, 'width_state': 44, 'lr': 0.0020390821519429476, 'padding_heal': 5, 'padding_state': 20, 'optimizer_type': 'lbfgs'}. Best is trial 484 with value: 0.0010389797389507294.
[I 2025-07-30 21:51:57,114] Trial 650 finished with value: 0.0012557253940030932 and parameters: {'width_NN_heal': 176, 'width_NN_state': 343, 'depth_NN_heal': 4, 'depth_NN_state': 4, 'mode_heal': 56, 'mode_state': 60, 'blocks_heal': 7, 'blocks_state': 2, 'lift_act_state': <built-in function gelu>, 'block_act_state': <built-in function gelu>, 'lift_act_heal': <function tanh at 0x7ff3611b4cc0>, 'block_act_heal': <function tanh at 0x7ff3611b4cc0>, 'width_heal': 25, 'width_state': 35, 'lr': 0.0028255928516424307, 'padding_heal': 4, 'padding_state': 19, 'optimizer_type': 'lbfgs'}. Best is trial 484 with value: 0.0010389797389507294.
[I 2025-07-30 21:52:01,342] Trial 651 finished with value: 0.0017232302343472838 and parameters: {'width_NN_heal': 119, 'width_NN_state': 269, 'depth_NN_heal': 4, 'depth_NN_state': 4, 'mode_heal': 56, 'mode_state': 60, 'blocks_heal': 7, 'blocks_state': 1, 'lift_act_state': <built-in function gelu>, 'block_act_state': <built-in function gelu>, 'lift_act_heal': <function tanh at 0x7ff3611b4cc0>, 'block_act_heal': <function tanh at 0x7ff3611b4cc0>, 'width_heal': 27, 'width_state': 37, 'lr': 0.0021504157108621713, 'padding_heal': 6, 'padding_state': 21, 'optimizer_type': 'lbfgs'}. Best is trial 484 with value: 0.0010389797389507294.
[I 2025-07-30 21:52:06,171] Trial 652 finished with value: 0.0022154466714709997 and parameters: {'width_NN_heal': 205, 'width_NN_state': 309, 'depth_NN_heal': 4, 'depth_NN_state': 4, 'mode_heal': 52, 'mode_state': 56, 'blocks_heal': 7, 'blocks_state': 3, 'lift_act_state': <built-in function gelu>, 'block_act_state': None, 'lift_act_heal': <function tanh at 0x7ff3611b4cc0>, 'block_act_heal': <function tanh at 0x7ff3611b4cc0>, 'width_heal': 13, 'width_state': 31, 'lr': 0.0025855157689680408, 'padding_heal': 3, 'padding_state': 20, 'optimizer_type': 'lbfgs'}. Best is trial 484 with value: 0.0010389797389507294.
[I 2025-07-30 21:52:10,730] Trial 653 finished with value: 0.0012470376677811146 and parameters: {'width_NN_heal': 141, 'width_NN_state': 290, 'depth_NN_heal': 4, 'depth_NN_state': 4, 'mode_heal': 56, 'mode_state': 60, 'blocks_heal': 7, 'blocks_state': 2, 'lift_act_state': <built-in function gelu>, 'block_act_state': <built-in function gelu>, 'lift_act_heal': <function tanh at 0x7ff3611b4cc0>, 'block_act_heal': <function tanh at 0x7ff3611b4cc0>, 'width_heal': 25, 'width_state': 39, 'lr': 0.0023136148873590056, 'padding_heal': 5, 'padding_state': 22, 'optimizer_type': 'lbfgs'}. Best is trial 484 with value: 0.0010389797389507294.
[I 2025-07-30 21:52:15,918] Trial 654 finished with value: 0.004033735487610102 and parameters: {'width_NN_heal': 161, 'width_NN_state': 361, 'depth_NN_heal': 4, 'depth_NN_state': 5, 'mode_heal': 60, 'mode_state': 56, 'blocks_heal': 7, 'blocks_state': 3, 'lift_act_state': None, 'block_act_state': <built-in function gelu>, 'lift_act_heal': <function tanh at 0x7ff3611b4cc0>, 'block_act_heal': <function tanh at 0x7ff3611b4cc0>, 'width_heal': 24, 'width_state': 28, 'lr': 0.002886090028493359, 'padding_heal': 3, 'padding_state': 22, 'optimizer_type': 'lbfgs'}. Best is trial 484 with value: 0.0010389797389507294.
[I 2025-07-30 21:52:20,545] Trial 655 finished with value: 0.001131368800997734 and parameters: {'width_NN_heal': 130, 'width_NN_state': 259, 'depth_NN_heal': 4, 'depth_NN_state': 4, 'mode_heal': 56, 'mode_state': 64, 'blocks_heal': 7, 'blocks_state': 2, 'lift_act_state': <built-in function gelu>, 'block_act_state': <built-in function gelu>, 'lift_act_heal': <function tanh at 0x7ff3611b4cc0>, 'block_act_heal': <function tanh at 0x7ff3611b4cc0>, 'width_heal': 29, 'width_state': 36, 'lr': 0.001896178592302643, 'padding_heal': 7, 'padding_state': 20, 'optimizer_type': 'lbfgs'}. Best is trial 484 with value: 0.0010389797389507294.
[I 2025-07-30 21:52:25,080] Trial 656 finished with value: 0.0017860718071460724 and parameters: {'width_NN_heal': 123, 'width_NN_state': 255, 'depth_NN_heal': 4, 'depth_NN_state': 4, 'mode_heal': 56, 'mode_state': 60, 'blocks_heal': 7, 'blocks_state': 2, 'lift_act_state': <built-in function gelu>, 'block_act_state': <built-in function gelu>, 'lift_act_heal': <function tanh at 0x7ff3611b4cc0>, 'block_act_heal': <function tanh at 0x7ff3611b4cc0>, 'width_heal': 32, 'width_state': 36, 'lr': 0.0016140618960882405, 'padding_heal': 6, 'padding_state': 20, 'optimizer_type': 'lbfgs'}. Best is trial 484 with value: 0.0010389797389507294.
