[I 2025-07-30 21:26:49,679] Trial 351 finished with value: 0.0019190727034583688 and parameters: {'width_NN_heal': 60, 'width_NN_state': 138, 'depth_NN_heal': 6, 'depth_NN_state': 4, 'mode_heal': 28, 'mode_state': 64, 'blocks_heal': 6, 'blocks_state': 4, 'lift_act_state': <function tanh at 0x7ff3611b4cc0>, 'block_act_state': <built-in function gelu>, 'lift_act_heal': <function tanh at 0x7ff3611b4cc0>, 'block_act_heal': <function tanh at 0x7ff3611b4cc0>, 'width_heal': 70, 'width_state': 73, 'lr': 0.0040438873237552695, 'padding_heal': 17, 'padding_state': 24, 'optimizer_type': 'adam'}. Best is trial 295 with value: 0.0012392300413921475.
[I 2025-07-30 21:26:54,688] Trial 352 finished with value: 0.016364241018891335 and parameters: {'width_NN_heal': 54, 'width_NN_state': 149, 'depth_NN_heal': 6, 'depth_NN_state': 4, 'mode_heal': 28, 'mode_state': 64, 'blocks_heal': 6, 'blocks_state': 4, 'lift_act_state': <function tanh at 0x7ff3611b4cc0>, 'block_act_state': <built-in function gelu>, 'lift_act_heal': <function tanh at 0x7ff3611b4cc0>, 'block_act_heal': <function tanh at 0x7ff3611b4cc0>, 'width_heal': 56, 'width_state': 77, 'lr': 0.00448152972281765, 'padding_heal': 18, 'padding_state': 25, 'optimizer_type': 'adam'}. Best is trial 295 with value: 0.0012392300413921475.
[I 2025-07-30 21:26:59,658] Trial 353 finished with value: 0.001600201241672039 and parameters: {'width_NN_heal': 69, 'width_NN_state': 155, 'depth_NN_heal': 6, 'depth_NN_state': 4, 'mode_heal': 28, 'mode_state': 64, 'blocks_heal': 6, 'blocks_state': 4, 'lift_act_state': <function tanh at 0x7ff3611b4cc0>, 'block_act_state': <built-in function gelu>, 'lift_act_heal': <function tanh at 0x7ff3611b4cc0>, 'block_act_heal': <function tanh at 0x7ff3611b4cc0>, 'width_heal': 62, 'width_state': 69, 'lr': 0.004092695473896772, 'padding_heal': 17, 'padding_state': 24, 'optimizer_type': 'lbfgs'}. Best is trial 295 with value: 0.0012392300413921475.
[I 2025-07-30 21:27:04,578] Trial 354 finished with value: 0.00164904841221869 and parameters: {'width_NN_heal': 54, 'width_NN_state': 130, 'depth_NN_heal': 5, 'depth_NN_state': 4, 'mode_heal': 28, 'mode_state': 64, 'blocks_heal': 6, 'blocks_state': 4, 'lift_act_state': <function tanh at 0x7ff3611b4cc0>, 'block_act_state': <built-in function gelu>, 'lift_act_heal': <function tanh at 0x7ff3611b4cc0>, 'block_act_heal': <function tanh at 0x7ff3611b4cc0>, 'width_heal': 52, 'width_state': 76, 'lr': 0.004572393782354463, 'padding_heal': 18, 'padding_state': 24, 'optimizer_type': 'adam'}. Best is trial 295 with value: 0.0012392300413921475.
[I 2025-07-30 21:27:09,352] Trial 355 finished with value: 0.0013396765571087599 and parameters: {'width_NN_heal': 60, 'width_NN_state': 129, 'depth_NN_heal': 6, 'depth_NN_state': 4, 'mode_heal': 28, 'mode_state': 64, 'blocks_heal': 5, 'blocks_state': 4, 'lift_act_state': <function tanh at 0x7ff3611b4cc0>, 'block_act_state': <built-in function gelu>, 'lift_act_heal': <function tanh at 0x7ff3611b4cc0>, 'block_act_heal': <function tanh at 0x7ff3611b4cc0>, 'width_heal': 55, 'width_state': 17, 'lr': 0.003808746868762336, 'padding_heal': 19, 'padding_state': 23, 'optimizer_type': 'adam'}. Best is trial 295 with value: 0.0012392300413921475.
[I 2025-07-30 21:27:14,352] Trial 356 finished with value: 0.0021229104604572058 and parameters: {'width_NN_heal': 68, 'width_NN_state': 144, 'depth_NN_heal': 6, 'depth_NN_state': 5, 'mode_heal': 28, 'mode_state': 64, 'blocks_heal': 6, 'blocks_state': 4, 'lift_act_state': None, 'block_act_state': <built-in function gelu>, 'lift_act_heal': <function tanh at 0x7ff3611b4cc0>, 'block_act_heal': <function tanh at 0x7ff3611b4cc0>, 'width_heal': 58, 'width_state': 80, 'lr': 0.0037408886987999462, 'padding_heal': 16, 'padding_state': 23, 'optimizer_type': 'adam'}. Best is trial 295 with value: 0.0012392300413921475.
[I 2025-07-30 21:27:18,992] Trial 357 finished with value: 0.0026669835206121206 and parameters: {'width_NN_heal': 63, 'width_NN_state': 16, 'depth_NN_heal': 6, 'depth_NN_state': 4, 'mode_heal': 32, 'mode_state': 64, 'blocks_heal': 5, 'blocks_state': 4, 'lift_act_state': <function tanh at 0x7ff3611b4cc0>, 'block_act_state': <function tanh at 0x7ff3611b4cc0>, 'lift_act_heal': <function tanh at 0x7ff3611b4cc0>, 'block_act_heal': <function tanh at 0x7ff3611b4cc0>, 'width_heal': 65, 'width_state': 17, 'lr': 0.00403926427378538, 'padding_heal': 18, 'padding_state': 25, 'optimizer_type': 'adam'}. Best is trial 295 with value: 0.0012392300413921475.
[I 2025-07-30 21:27:23,841] Trial 358 finished with value: 0.0014735154109075665 and parameters: {'width_NN_heal': 77, 'width_NN_state': 137, 'depth_NN_heal': 5, 'depth_NN_state': 3, 'mode_heal': 28, 'mode_state': 64, 'blocks_heal': 6, 'blocks_state': 4, 'lift_act_state': <function tanh at 0x7ff3611b4cc0>, 'block_act_state': <built-in function gelu>, 'lift_act_heal': <function tanh at 0x7ff3611b4cc0>, 'block_act_heal': <function tanh at 0x7ff3611b4cc0>, 'width_heal': 50, 'width_state': 15, 'lr': 0.003679773483568829, 'padding_heal': 19, 'padding_state': 24, 'optimizer_type': 'adam'}. Best is trial 295 with value: 0.0012392300413921475.
[I 2025-07-30 21:27:28,846] Trial 359 finished with value: 0.0016195528442040086 and parameters: {'width_NN_heal': 64, 'width_NN_state': 118, 'depth_NN_heal': 6, 'depth_NN_state': 4, 'mode_heal': 28, 'mode_state': 60, 'blocks_heal': 6, 'blocks_state': 4, 'lift_act_state': <function tanh at 0x7ff3611b4cc0>, 'block_act_state': <built-in function gelu>, 'lift_act_heal': <function tanh at 0x7ff3611b4cc0>, 'block_act_heal': <function tanh at 0x7ff3611b4cc0>, 'width_heal': 54, 'width_state': 68, 'lr': 0.004894356154395727, 'padding_heal': 17, 'padding_state': 23, 'optimizer_type': 'adam'}. Best is trial 295 with value: 0.0012392300413921475.
[I 2025-07-30 21:27:33,869] Trial 360 finished with value: 0.0013517223997041583 and parameters: {'width_NN_heal': 58, 'width_NN_state': 141, 'depth_NN_heal': 6, 'depth_NN_state': 4, 'mode_heal': 28, 'mode_state': 64, 'blocks_heal': 6, 'blocks_state': 4, 'lift_act_state': <function tanh at 0x7ff3611b4cc0>, 'block_act_state': <built-in function gelu>, 'lift_act_heal': <function tanh at 0x7ff3611b4cc0>, 'block_act_heal': <function tanh at 0x7ff3611b4cc0>, 'width_heal': 47, 'width_state': 14, 'lr': 0.0042918509183116705, 'padding_heal': 16, 'padding_state': 23, 'optimizer_type': 'adam'}. Best is trial 295 with value: 0.0012392300413921475.
[I 2025-07-30 21:27:38,882] Trial 361 finished with value: 0.0014067544834688306 and parameters: {'width_NN_heal': 59, 'width_NN_state': 158, 'depth_NN_heal': 6, 'depth_NN_state': 4, 'mode_heal': 28, 'mode_state': 64, 'blocks_heal': 6, 'blocks_state': 4, 'lift_act_state': <function tanh at 0x7ff3611b4cc0>, 'block_act_state': <built-in function gelu>, 'lift_act_heal': <function tanh at 0x7ff3611b4cc0>, 'block_act_heal': <function tanh at 0x7ff3611b4cc0>, 'width_heal': 46, 'width_state': 14, 'lr': 0.004342144018502991, 'padding_heal': 16, 'padding_state': 22, 'optimizer_type': 'adam'}. Best is trial 295 with value: 0.0012392300413921475.
[I 2025-07-30 21:27:43,893] Trial 362 finished with value: 0.001443378860130906 and parameters: {'width_NN_heal': 58, 'width_NN_state': 161, 'depth_NN_heal': 6, 'depth_NN_state': 4, 'mode_heal': 28, 'mode_state': 64, 'blocks_heal': 6, 'blocks_state': 4, 'lift_act_state': <function tanh at 0x7ff3611b4cc0>, 'block_act_state': <built-in function gelu>, 'lift_act_heal': <function tanh at 0x7ff3611b4cc0>, 'block_act_heal': <function tanh at 0x7ff3611b4cc0>, 'width_heal': 46, 'width_state': 13, 'lr': 0.0044023882432021695, 'padding_heal': 16, 'padding_state': 22, 'optimizer_type': 'adam'}. Best is trial 295 with value: 0.0012392300413921475.
[I 2025-07-30 21:27:49,044] Trial 363 finished with value: 0.006203605327755213 and parameters: {'width_NN_heal': 57, 'width_NN_state': 173, 'depth_NN_heal': 6, 'depth_NN_state': 5, 'mode_heal': 28, 'mode_state': 64, 'blocks_heal': 6, 'blocks_state': 4, 'lift_act_state': <function tanh at 0x7ff3611b4cc0>, 'block_act_state': <built-in function gelu>, 'lift_act_heal': <function tanh at 0x7ff3611b4cc0>, 'block_act_heal': <function tanh at 0x7ff3611b4cc0>, 'width_heal': 48, 'width_state': 16, 'lr': 0.004714464468936334, 'padding_heal': 16, 'padding_state': 21, 'optimizer_type': 'adam'}. Best is trial 295 with value: 0.0012392300413921475.
[I 2025-07-30 21:27:54,052] Trial 364 finished with value: 0.016995761543512344 and parameters: {'width_NN_heal': 47, 'width_NN_state': 188, 'depth_NN_heal': 6, 'depth_NN_state': 4, 'mode_heal': 28, 'mode_state': 64, 'blocks_heal': 6, 'blocks_state': 4, 'lift_act_state': <function tanh at 0x7ff3611b4cc0>, 'block_act_state': <built-in function gelu>, 'lift_act_heal': <function tanh at 0x7ff3611b4cc0>, 'block_act_heal': <function tanh at 0x7ff3611b4cc0>, 'width_heal': 48, 'width_state': 15, 'lr': 0.004038456111426047, 'padding_heal': 16, 'padding_state': 23, 'optimizer_type': 'adam'}. Best is trial 295 with value: 0.0012392300413921475.
[I 2025-07-30 21:27:58,441] Trial 365 finished with value: 0.0013511216966435313 and parameters: {'width_NN_heal': 60, 'width_NN_state': 138, 'depth_NN_heal': 6, 'depth_NN_state': 4, 'mode_heal': 28, 'mode_state': 64, 'blocks_heal': 4, 'blocks_state': 4, 'lift_act_state': <function tanh at 0x7ff3611b4cc0>, 'block_act_state': <built-in function gelu>, 'lift_act_heal': <function tanh at 0x7ff3611b4cc0>, 'block_act_heal': <function tanh at 0x7ff3611b4cc0>, 'width_heal': 15, 'width_state': 14, 'lr': 0.0037481086159551666, 'padding_heal': 17, 'padding_state': 23, 'optimizer_type': 'lbfgs'}. Best is trial 295 with value: 0.0012392300413921475.
[I 2025-07-30 21:28:02,493] Trial 366 finished with value: 0.015635162591934204 and parameters: {'width_NN_heal': 60, 'width_NN_state': 140, 'depth_NN_heal': 6, 'depth_NN_state': 4, 'mode_heal': 28, 'mode_state': 64, 'blocks_heal': 3, 'blocks_state': 4, 'lift_act_state': <function tanh at 0x7ff3611b4cc0>, 'block_act_state': <built-in function gelu>, 'lift_act_heal': <function tanh at 0x7ff3611b4cc0>, 'block_act_heal': <function tanh at 0x7ff3611b4cc0>, 'width_heal': 15, 'width_state': 13, 'lr': 0.0037770778785524805, 'padding_heal': 17, 'padding_state': 23, 'optimizer_type': 'adam'}. Best is trial 295 with value: 0.0012392300413921475.
[I 2025-07-30 21:28:07,427] Trial 367 finished with value: 0.001465831883251667 and parameters: {'width_NN_heal': 54, 'width_NN_state': 129, 'depth_NN_heal': 6, 'depth_NN_state': 4, 'mode_heal': 32, 'mode_state': 64, 'blocks_heal': 6, 'blocks_state': 4, 'lift_act_state': <function tanh at 0x7ff3611b4cc0>, 'block_act_state': <built-in function gelu>, 'lift_act_heal': <function tanh at 0x7ff3611b4cc0>, 'block_act_heal': <function tanh at 0x7ff3611b4cc0>, 'width_heal': 15, 'width_state': 14, 'lr': 0.005262897317236127, 'padding_heal': 17, 'padding_state': 24, 'optimizer_type': 'lbfgs'}. Best is trial 295 with value: 0.0012392300413921475.
[I 2025-07-30 21:28:11,647] Trial 368 finished with value: 0.0015250366413965821 and parameters: {'width_NN_heal': 137, 'width_NN_state': 151, 'depth_NN_heal': 6, 'depth_NN_state': 2, 'mode_heal': 28, 'mode_state': 64, 'blocks_heal': 4, 'blocks_state': 4, 'lift_act_state': <function tanh at 0x7ff3611b4cc0>, 'block_act_state': <built-in function gelu>, 'lift_act_heal': <function tanh at 0x7ff3611b4cc0>, 'block_act_heal': <function tanh at 0x7ff3611b4cc0>, 'width_heal': 50, 'width_state': 16, 'lr': 0.004413551289501426, 'padding_heal': 16, 'padding_state': 22, 'optimizer_type': 'lbfgs'}. Best is trial 295 with value: 0.0012392300413921475.
[I 2025-07-30 21:28:16,033] Trial 369 finished with value: 0.016441449522972107 and parameters: {'width_NN_heal': 57, 'width_NN_state': 151, 'depth_NN_heal': 6, 'depth_NN_state': 4, 'mode_heal': 28, 'mode_state': 64, 'blocks_heal': 4, 'blocks_state': 4, 'lift_act_state': <function tanh at 0x7ff3611b4cc0>, 'block_act_state': <built-in function gelu>, 'lift_act_heal': <function tanh at 0x7ff3611b4cc0>, 'block_act_heal': <function tanh at 0x7ff3611b4cc0>, 'width_heal': 45, 'width_state': 15, 'lr': 0.003673687262224038, 'padding_heal': 18, 'padding_state': 24, 'optimizer_type': 'lbfgs'}. Best is trial 295 with value: 0.0012392300413921475.
[I 2025-07-30 21:28:20,416] Trial 370 finished with value: 0.0154898501932621 and parameters: {'width_NN_heal': 61, 'width_NN_state': 134, 'depth_NN_heal': 6, 'depth_NN_state': 4, 'mode_heal': 28, 'mode_state': 64, 'blocks_heal': 4, 'blocks_state': 4, 'lift_act_state': <function tanh at 0x7ff3611b4cc0>, 'block_act_state': <built-in function gelu>, 'lift_act_heal': <function tanh at 0x7ff3611b4cc0>, 'block_act_heal': <function tanh at 0x7ff3611b4cc0>, 'width_heal': 10, 'width_state': 17, 'lr': 0.004935549827056798, 'padding_heal': 16, 'padding_state': 23, 'optimizer_type': 'lbfgs'}. Best is trial 295 with value: 0.0012392300413921475.
[I 2025-07-30 21:28:24,780] Trial 371 finished with value: 0.016901396214962006 and parameters: {'width_NN_heal': 71, 'width_NN_state': 184, 'depth_NN_heal': 6, 'depth_NN_state': 4, 'mode_heal': 28, 'mode_state': 64, 'blocks_heal': 4, 'blocks_state': 4, 'lift_act_state': <function tanh at 0x7ff3611b4cc0>, 'block_act_state': <built-in function gelu>, 'lift_act_heal': <function tanh at 0x7ff3611b4cc0>, 'block_act_heal': <function tanh at 0x7ff3611b4cc0>, 'width_heal': 13, 'width_state': 14, 'lr': 0.004298603897524132, 'padding_heal': 17, 'padding_state': 23, 'optimizer_type': 'lbfgs'}. Best is trial 295 with value: 0.0012392300413921475.
[I 2025-07-30 21:28:29,740] Trial 372 finished with value: 0.0015755200292915106 and parameters: {'width_NN_heal': 50, 'width_NN_state': 120, 'depth_NN_heal': 6, 'depth_NN_state': 4, 'mode_heal': 28, 'mode_state': 64, 'blocks_heal': 6, 'blocks_state': 4, 'lift_act_state': <built-in function gelu>, 'block_act_state': None, 'lift_act_heal': <function tanh at 0x7ff3611b4cc0>, 'block_act_heal': <function tanh at 0x7ff3611b4cc0>, 'width_heal': 52, 'width_state': 63, 'lr': 0.0035938294569050405, 'padding_heal': 18, 'padding_state': 22, 'optimizer_type': 'lbfgs'}. Best is trial 295 with value: 0.0012392300413921475.
[I 2025-07-30 21:28:34,710] Trial 373 finished with value: 0.0021175232250243425 and parameters: {'width_NN_heal': 52, 'width_NN_state': 144, 'depth_NN_heal': 6, 'depth_NN_state': 4, 'mode_heal': 32, 'mode_state': 64, 'blocks_heal': 6, 'blocks_state': 4, 'lift_act_state': <function tanh at 0x7ff3611b4cc0>, 'block_act_state': <built-in function gelu>, 'lift_act_heal': <function tanh at 0x7ff3611b4cc0>, 'block_act_heal': <function tanh at 0x7ff3611b4cc0>, 'width_heal': 20, 'width_state': 16, 'lr': 0.003966756072040249, 'padding_heal': 16, 'padding_state': 24, 'optimizer_type': 'lbfgs'}. Best is trial 295 with value: 0.0012392300413921475.
[I 2025-07-30 21:28:40,107] Trial 374 finished with value: 0.00943042803555727 and parameters: {'width_NN_heal': 232, 'width_NN_state': 215, 'depth_NN_heal': 6, 'depth_NN_state': 4, 'mode_heal': 28, 'mode_state': 64, 'blocks_heal': 6, 'blocks_state': 4, 'lift_act_state': <function tanh at 0x7ff3611b4cc0>, 'block_act_state': <built-in function gelu>, 'lift_act_heal': <function tanh at 0x7ff3611b4cc0>, 'block_act_heal': <function tanh at 0x7ff3611b4cc0>, 'width_heal': 55, 'width_state': 15, 'lr': 0.004668015751527111, 'padding_heal': 17, 'padding_state': 23, 'optimizer_type': 'lbfgs'}. Best is trial 295 with value: 0.0012392300413921475.
[I 2025-07-30 21:28:44,520] Trial 375 finished with value: 0.004612519405782223 and parameters: {'width_NN_heal': 104, 'width_NN_state': 164, 'depth_NN_heal': 6, 'depth_NN_state': 4, 'mode_heal': 32, 'mode_state': 64, 'blocks_heal': 4, 'blocks_state': 4, 'lift_act_state': <function tanh at 0x7ff3611b4cc0>, 'block_act_state': <built-in function gelu>, 'lift_act_heal': <function tanh at 0x7ff3611b4cc0>, 'block_act_heal': <function tanh at 0x7ff3611b4cc0>, 'width_heal': 47, 'width_state': 73, 'lr': 0.005274172507000553, 'padding_heal': 19, 'padding_state': 22, 'optimizer_type': 'adam'}. Best is trial 295 with value: 0.0012392300413921475.
[I 2025-07-30 21:28:49,348] Trial 376 finished with value: 0.030742906033992767 and parameters: {'width_NN_heal': 60, 'width_NN_state': 126, 'depth_NN_heal': 6, 'depth_NN_state': 3, 'mode_heal': 28, 'mode_state': 60, 'blocks_heal': 6, 'blocks_state': 4, 'lift_act_state': <function tanh at 0x7ff3611b4cc0>, 'block_act_state': <built-in function gelu>, 'lift_act_heal': <function tanh at 0x7ff3611b4cc0>, 'block_act_heal': <function tanh at 0x7ff3611b4cc0>, 'width_heal': 8, 'width_state': 128, 'lr': 0.004234058963413681, 'padding_heal': 18, 'padding_state': 24, 'optimizer_type': 'adam'}. Best is trial 295 with value: 0.0012392300413921475.
[I 2025-07-30 21:28:54,350] Trial 377 finished with value: 0.0062532746233046055 and parameters: {'width_NN_heal': 56, 'width_NN_state': 141, 'depth_NN_heal': 5, 'depth_NN_state': 5, 'mode_heal': 28, 'mode_state': 64, 'blocks_heal': 6, 'blocks_state': 4, 'lift_act_state': <function tanh at 0x7ff3611b4cc0>, 'block_act_state': <built-in function gelu>, 'lift_act_heal': <function tanh at 0x7ff3611b4cc0>, 'block_act_heal': <function tanh at 0x7ff3611b4cc0>, 'width_heal': 51, 'width_state': 14, 'lr': 0.0035666655768826065, 'padding_heal': 18, 'padding_state': 25, 'optimizer_type': 'adam'}. Best is trial 295 with value: 0.0012392300413921475.
[I 2025-07-30 21:28:59,325] Trial 378 finished with value: 0.0029378128238022327 and parameters: {'width_NN_heal': 66, 'width_NN_state': 156, 'depth_NN_heal': 6, 'depth_NN_state': 4, 'mode_heal': 32, 'mode_state': 64, 'blocks_heal': 6, 'blocks_state': 4, 'lift_act_state': <function tanh at 0x7ff3611b4cc0>, 'block_act_state': <built-in function gelu>, 'lift_act_heal': <function tanh at 0x7ff3611b4cc0>, 'block_act_heal': <function tanh at 0x7ff3611b4cc0>, 'width_heal': 61, 'width_state': 17, 'lr': 0.003916339751841898, 'padding_heal': 17, 'padding_state': 24, 'optimizer_type': 'adam'}. Best is trial 295 with value: 0.0012392300413921475.
[I 2025-07-30 21:29:05,756] Trial 379 finished with value: 0.016852475702762604 and parameters: {'width_NN_heal': 84, 'width_NN_state': 115, 'depth_NN_heal': 6, 'depth_NN_state': 8, 'mode_heal': 64, 'mode_state': 64, 'blocks_heal': 6, 'blocks_state': 8, 'lift_act_state': <function tanh at 0x7ff3611b4cc0>, 'block_act_state': <built-in function gelu>, 'lift_act_heal': <function tanh at 0x7ff3611b4cc0>, 'block_act_heal': <function tanh at 0x7ff3611b4cc0>, 'width_heal': 12, 'width_state': 13, 'lr': 0.004742413134616044, 'padding_heal': 17, 'padding_state': 23, 'optimizer_type': 'lbfgs'}. Best is trial 295 with value: 0.0012392300413921475.
[I 2025-07-30 21:29:09,886] Trial 380 finished with value: 0.0017905663698911667 and parameters: {'width_NN_heal': 48, 'width_NN_state': 129, 'depth_NN_heal': 6, 'depth_NN_state': 4, 'mode_heal': 28, 'mode_state': 60, 'blocks_heal': 3, 'blocks_state': 4, 'lift_act_state': <function tanh at 0x7ff3611b4cc0>, 'block_act_state': <built-in function gelu>, 'lift_act_heal': <function tanh at 0x7ff3611b4cc0>, 'block_act_heal': <function tanh at 0x7ff3611b4cc0>, 'width_heal': 55, 'width_state': 78, 'lr': 0.0054533496415091, 'padding_heal': 19, 'padding_state': 26, 'optimizer_type': 'adam'}. Best is trial 295 with value: 0.0012392300413921475.
[I 2025-07-30 21:29:14,542] Trial 381 finished with value: 0.0017155138775706291 and parameters: {'width_NN_heal': 52, 'width_NN_state': 110, 'depth_NN_heal': 3, 'depth_NN_state': 5, 'mode_heal': 32, 'mode_state': 64, 'blocks_heal': 6, 'blocks_state': 4, 'lift_act_state': None, 'block_act_state': <built-in function gelu>, 'lift_act_heal': <function tanh at 0x7ff3611b4cc0>, 'block_act_heal': None, 'width_heal': 59, 'width_state': 7, 'lr': 0.003452975627487401, 'padding_heal': 16, 'padding_state': 25, 'optimizer_type': 'adam'}. Best is trial 295 with value: 0.0012392300413921475.
[I 2025-07-30 21:29:18,966] Trial 382 finished with value: 0.001676438725553453 and parameters: {'width_NN_heal': 62, 'width_NN_state': 22, 'depth_NN_heal': 6, 'depth_NN_state': 4, 'mode_heal': 28, 'mode_state': 64, 'blocks_heal': 4, 'blocks_state': 4, 'lift_act_state': <function tanh at 0x7ff3611b4cc0>, 'block_act_state': <built-in function gelu>, 'lift_act_heal': <function tanh at 0x7ff3611b4cc0>, 'block_act_heal': <function tanh at 0x7ff3611b4cc0>, 'width_heal': 46, 'width_state': 15, 'lr': 0.004298970070680158, 'padding_heal': 18, 'padding_state': 23, 'optimizer_type': 'adam'}. Best is trial 295 with value: 0.0012392300413921475.
[I 2025-07-30 21:29:23,928] Trial 383 finished with value: 0.001302426098845899 and parameters: {'width_NN_heal': 90, 'width_NN_state': 124, 'depth_NN_heal': 6, 'depth_NN_state': 4, 'mode_heal': 64, 'mode_state': 64, 'blocks_heal': 6, 'blocks_state': 4, 'lift_act_state': <function tanh at 0x7ff3611b4cc0>, 'block_act_state': <built-in function gelu>, 'lift_act_heal': <function tanh at 0x7ff3611b4cc0>, 'block_act_heal': <function tanh at 0x7ff3611b4cc0>, 'width_heal': 18, 'width_state': 8, 'lr': 0.003881094351750898, 'padding_heal': 15, 'padding_state': 21, 'optimizer_type': 'adam'}. Best is trial 295 with value: 0.0012392300413921475.
[I 2025-07-30 21:29:28,885] Trial 384 finished with value: 0.0021179085597395897 and parameters: {'width_NN_heal': 90, 'width_NN_state': 145, 'depth_NN_heal': 6, 'depth_NN_state': 4, 'mode_heal': 64, 'mode_state': 60, 'blocks_heal': 6, 'blocks_state': 4, 'lift_act_state': <function tanh at 0x7ff3611b4cc0>, 'block_act_state': <function tanh at 0x7ff3611b4cc0>, 'lift_act_heal': <function tanh at 0x7ff3611b4cc0>, 'block_act_heal': <function tanh at 0x7ff3611b4cc0>, 'width_heal': 66, 'width_state': 8, 'lr': 0.0038555269572607747, 'padding_heal': 15, 'padding_state': 21, 'optimizer_type': 'adam'}. Best is trial 295 with value: 0.0012392300413921475.
