[I 2025-07-30 21:55:12,066] Trial 691 finished with value: 0.0013900833437219262 and parameters: {'width_NN_heal': 123, 'width_NN_state': 391, 'depth_NN_heal': 4, 'depth_NN_state': 3, 'mode_heal': 52, 'mode_state': 64, 'blocks_heal': 7, 'blocks_state': 2, 'lift_act_state': <built-in function gelu>, 'block_act_state': <built-in function gelu>, 'lift_act_heal': <function tanh at 0x7ff3611b4cc0>, 'block_act_heal': <function tanh at 0x7ff3611b4cc0>, 'width_heal': 29, 'width_state': 30, 'lr': 0.001987791764008531, 'padding_heal': 6, 'padding_state': 19, 'optimizer_type': 'lbfgs'}. Best is trial 484 with value: 0.0010389797389507294.
[I 2025-07-30 21:55:17,804] Trial 692 finished with value: 0.00195641303434968 and parameters: {'width_NN_heal': 179, 'width_NN_state': 440, 'depth_NN_heal': 4, 'depth_NN_state': 4, 'mode_heal': 56, 'mode_state': 64, 'blocks_heal': 7, 'blocks_state': 2, 'lift_act_state': <built-in function gelu>, 'block_act_state': <function tanh at 0x7ff3611b4cc0>, 'lift_act_heal': <function tanh at 0x7ff3611b4cc0>, 'block_act_heal': <function tanh at 0x7ff3611b4cc0>, 'width_heal': 27, 'width_state': 32, 'lr': 0.0017144391859424965, 'padding_heal': 8, 'padding_state': 18, 'optimizer_type': 'lbfgs'}. Best is trial 484 with value: 0.0010389797389507294.
[I 2025-07-30 21:55:22,489] Trial 693 finished with value: 0.0027226493693888187 and parameters: {'width_NN_heal': 151, 'width_NN_state': 368, 'depth_NN_heal': 4, 'depth_NN_state': 4, 'mode_heal': 56, 'mode_state': 64, 'blocks_heal': 7, 'blocks_state': 2, 'lift_act_state': None, 'block_act_state': <built-in function gelu>, 'lift_act_heal': <function tanh at 0x7ff3611b4cc0>, 'block_act_heal': <function tanh at 0x7ff3611b4cc0>, 'width_heal': 30, 'width_state': 27, 'lr': 0.0021133652609482763, 'padding_heal': 5, 'padding_state': 20, 'optimizer_type': 'lbfgs'}. Best is trial 484 with value: 0.0010389797389507294.
[I 2025-07-30 21:55:27,127] Trial 694 finished with value: 0.0013966835103929043 and parameters: {'width_NN_heal': 141, 'width_NN_state': 332, 'depth_NN_heal': 3, 'depth_NN_state': 4, 'mode_heal': 56, 'mode_state': 60, 'blocks_heal': 7, 'blocks_state': 2, 'lift_act_state': <built-in function gelu>, 'block_act_state': <built-in function gelu>, 'lift_act_heal': <function tanh at 0x7ff3611b4cc0>, 'block_act_heal': <function tanh at 0x7ff3611b4cc0>, 'width_heal': 28, 'width_state': 34, 'lr': 0.0014562506045295946, 'padding_heal': 6, 'padding_state': 21, 'optimizer_type': 'lbfgs'}. Best is trial 484 with value: 0.0010389797389507294.
[I 2025-07-30 21:55:31,845] Trial 695 finished with value: 0.0014003608375787735 and parameters: {'width_NN_heal': 113, 'width_NN_state': 377, 'depth_NN_heal': 4, 'depth_NN_state': 4, 'mode_heal': 56, 'mode_state': 64, 'blocks_heal': 7, 'blocks_state': 1, 'lift_act_state': <built-in function gelu>, 'block_act_state': <built-in function gelu>, 'lift_act_heal': <function tanh at 0x7ff3611b4cc0>, 'block_act_heal': <function tanh at 0x7ff3611b4cc0>, 'width_heal': 32, 'width_state': 30, 'lr': 0.001923509571302087, 'padding_heal': 7, 'padding_state': 20, 'optimizer_type': 'lbfgs'}. Best is trial 484 with value: 0.0010389797389507294.
[I 2025-07-30 21:55:37,364] Trial 696 finished with value: 0.001272123889066279 and parameters: {'width_NN_heal': 134, 'width_NN_state': 441, 'depth_NN_heal': 4, 'depth_NN_state': 4, 'mode_heal': 56, 'mode_state': 60, 'blocks_heal': 7, 'blocks_state': 2, 'lift_act_state': <built-in function gelu>, 'block_act_state': <built-in function gelu>, 'lift_act_heal': <function tanh at 0x7ff3611b4cc0>, 'block_act_heal': <function tanh at 0x7ff3611b4cc0>, 'width_heal': 25, 'width_state': 39, 'lr': 0.0021687610627723476, 'padding_heal': 5, 'padding_state': 19, 'optimizer_type': 'lbfgs'}. Best is trial 484 with value: 0.0010389797389507294.
[I 2025-07-30 21:55:41,088] Trial 697 finished with value: 0.0016960230423137546 and parameters: {'width_NN_heal': 170, 'width_NN_state': 294, 'depth_NN_heal': 4, 'depth_NN_state': 4, 'mode_heal': 56, 'mode_state': 60, 'blocks_heal': 3, 'blocks_state': 2, 'lift_act_state': <built-in function gelu>, 'block_act_state': None, 'lift_act_heal': <function tanh at 0x7ff3611b4cc0>, 'block_act_heal': <function tanh at 0x7ff3611b4cc0>, 'width_heal': 27, 'width_state': 34, 'lr': 0.0018572121035694347, 'padding_heal': 6, 'padding_state': 22, 'optimizer_type': 'lbfgs'}. Best is trial 484 with value: 0.0010389797389507294.
[I 2025-07-30 21:55:45,938] Trial 698 finished with value: 0.0018270759610459208 and parameters: {'width_NN_heal': 156, 'width_NN_state': 348, 'depth_NN_heal': 4, 'depth_NN_state': 4, 'mode_heal': 52, 'mode_state': 56, 'blocks_heal': 7, 'blocks_state': 1, 'lift_act_state': <built-in function gelu>, 'block_act_state': <built-in function gelu>, 'lift_act_heal': <function tanh at 0x7ff3611b4cc0>, 'block_act_heal': <function tanh at 0x7ff3611b4cc0>, 'width_heal': 29, 'width_state': 25, 'lr': 0.0022016496327317532, 'padding_heal': 5, 'padding_state': 18, 'optimizer_type': 'lbfgs'}. Best is trial 484 with value: 0.0010389797389507294.
[I 2025-07-30 21:55:50,489] Trial 699 finished with value: 0.0016582866664975882 and parameters: {'width_NN_heal': 125, 'width_NN_state': 320, 'depth_NN_heal': 4, 'depth_NN_state': 4, 'mode_heal': 56, 'mode_state': 64, 'blocks_heal': 7, 'blocks_state': 2, 'lift_act_state': <built-in function gelu>, 'block_act_state': <built-in function gelu>, 'lift_act_heal': <function tanh at 0x7ff3611b4cc0>, 'block_act_heal': <function tanh at 0x7ff3611b4cc0>, 'width_heal': 26, 'width_state': 52, 'lr': 0.001789452039115527, 'padding_heal': 4, 'padding_state': 21, 'optimizer_type': 'lbfgs'}. Best is trial 484 with value: 0.0010389797389507294.
[I 2025-07-30 21:55:56,118] Trial 700 finished with value: 0.001284671714529395 and parameters: {'width_NN_heal': 105, 'width_NN_state': 424, 'depth_NN_heal': 4, 'depth_NN_state': 4, 'mode_heal': 56, 'mode_state': 64, 'blocks_heal': 7, 'blocks_state': 2, 'lift_act_state': <built-in function gelu>, 'block_act_state': <built-in function gelu>, 'lift_act_heal': <function tanh at 0x7ff3611b4cc0>, 'block_act_heal': <function tanh at 0x7ff3611b4cc0>, 'width_heal': 33, 'width_state': 31, 'lr': 0.0020103936819360715, 'padding_heal': 6, 'padding_state': 20, 'optimizer_type': 'lbfgs'}. Best is trial 484 with value: 0.0010389797389507294.
[I 2025-07-30 21:56:00,652] Trial 701 finished with value: 0.001309890765696764 and parameters: {'width_NN_heal': 131, 'width_NN_state': 285, 'depth_NN_heal': 4, 'depth_NN_state': 4, 'mode_heal': 56, 'mode_state': 64, 'blocks_heal': 7, 'blocks_state': 2, 'lift_act_state': <built-in function gelu>, 'block_act_state': <built-in function gelu>, 'lift_act_heal': <function tanh at 0x7ff3611b4cc0>, 'block_act_heal': <function tanh at 0x7ff3611b4cc0>, 'width_heal': 25, 'width_state': 43, 'lr': 0.002246098983605829, 'padding_heal': 5, 'padding_state': 21, 'optimizer_type': 'lbfgs'}. Best is trial 484 with value: 0.0010389797389507294.
[I 2025-07-30 21:56:05,550] Trial 702 finished with value: 0.0014893000479787588 and parameters: {'width_NN_heal': 150, 'width_NN_state': 363, 'depth_NN_heal': 4, 'depth_NN_state': 4, 'mode_heal': 56, 'mode_state': 60, 'blocks_heal': 7, 'blocks_state': 2, 'lift_act_state': <built-in function gelu>, 'block_act_state': <built-in function gelu>, 'lift_act_heal': <function tanh at 0x7ff3611b4cc0>, 'block_act_heal': <function tanh at 0x7ff3611b4cc0>, 'width_heal': 23, 'width_state': 28, 'lr': 0.0016076818530139398, 'padding_heal': 7, 'padding_state': 20, 'optimizer_type': 'lbfgs'}. Best is trial 484 with value: 0.0010389797389507294.
[I 2025-07-30 21:56:10,595] Trial 703 finished with value: 0.016767796128988266 and parameters: {'width_NN_heal': 189, 'width_NN_state': 310, 'depth_NN_heal': 4, 'depth_NN_state': 5, 'mode_heal': 56, 'mode_state': 64, 'blocks_heal': 7, 'blocks_state': 2, 'lift_act_state': <built-in function gelu>, 'block_act_state': <built-in function gelu>, 'lift_act_heal': <function tanh at 0x7ff3611b4cc0>, 'block_act_heal': <function tanh at 0x7ff3611b4cc0>, 'width_heal': 30, 'width_state': 36, 'lr': 0.00018809087021490493, 'padding_heal': 4, 'padding_state': 21, 'optimizer_type': 'lbfgs'}. Best is trial 484 with value: 0.0010389797389507294.
[I 2025-07-30 21:56:15,452] Trial 704 finished with value: 0.0012080444721505046 and parameters: {'width_NN_heal': 115, 'width_NN_state': 340, 'depth_NN_heal': 4, 'depth_NN_state': 4, 'mode_heal': 52, 'mode_state': 60, 'blocks_heal': 7, 'blocks_state': 3, 'lift_act_state': <built-in function gelu>, 'block_act_state': <built-in function gelu>, 'lift_act_heal': <function tanh at 0x7ff3611b4cc0>, 'block_act_heal': <function tanh at 0x7ff3611b4cc0>, 'width_heal': 27, 'width_state': 47, 'lr': 0.0020246029371122276, 'padding_heal': 5, 'padding_state': 18, 'optimizer_type': 'lbfgs'}. Best is trial 484 with value: 0.0010389797389507294.
[I 2025-07-30 21:56:20,235] Trial 705 finished with value: 0.0010518304770812392 and parameters: {'width_NN_heal': 175, 'width_NN_state': 271, 'depth_NN_heal': 4, 'depth_NN_state': 3, 'mode_heal': 56, 'mode_state': 64, 'blocks_heal': 7, 'blocks_state': 3, 'lift_act_state': <built-in function gelu>, 'block_act_state': <built-in function gelu>, 'lift_act_heal': <function tanh at 0x7ff3611b4cc0>, 'block_act_heal': None, 'width_heal': 35, 'width_state': 26, 'lr': 0.0023292206707162724, 'padding_heal': 4, 'padding_state': 19, 'optimizer_type': 'lbfgs'}. Best is trial 484 with value: 0.0010389797389507294.
[I 2025-07-30 21:56:24,939] Trial 706 finished with value: 0.0011930365581065416 and parameters: {'width_NN_heal': 174, 'width_NN_state': 290, 'depth_NN_heal': 4, 'depth_NN_state': 2, 'mode_heal': 56, 'mode_state': 64, 'blocks_heal': 7, 'blocks_state': 3, 'lift_act_state': <built-in function gelu>, 'block_act_state': <built-in function gelu>, 'lift_act_heal': <function tanh at 0x7ff3611b4cc0>, 'block_act_heal': None, 'width_heal': 37, 'width_state': 26, 'lr': 0.0022001607705450076, 'padding_heal': 4, 'padding_state': 18, 'optimizer_type': 'lbfgs'}. Best is trial 484 with value: 0.0010389797389507294.
[I 2025-07-30 21:56:29,194] Trial 707 finished with value: 0.0022864281199872494 and parameters: {'width_NN_heal': 181, 'width_NN_state': 316, 'depth_NN_heal': 4, 'depth_NN_state': 1, 'mode_heal': 56, 'mode_state': 64, 'blocks_heal': 7, 'blocks_state': 2, 'lift_act_state': <built-in function gelu>, 'block_act_state': <built-in function gelu>, 'lift_act_heal': <function tanh at 0x7ff3611b4cc0>, 'block_act_heal': None, 'width_heal': 33, 'width_state': 25, 'lr': 0.00234582841286104, 'padding_heal': 5, 'padding_state': 19, 'optimizer_type': 'lbfgs'}. Best is trial 484 with value: 0.0010389797389507294.
[I 2025-07-30 21:56:33,869] Trial 708 finished with value: 0.0013489681296050549 and parameters: {'width_NN_heal': 162, 'width_NN_state': 391, 'depth_NN_heal': 4, 'depth_NN_state': 2, 'mode_heal': 52, 'mode_state': 64, 'blocks_heal': 7, 'blocks_state': 3, 'lift_act_state': <built-in function gelu>, 'block_act_state': <built-in function gelu>, 'lift_act_heal': <function tanh at 0x7ff3611b4cc0>, 'block_act_heal': None, 'width_heal': 35, 'width_state': 27, 'lr': 0.0017017093514444745, 'padding_heal': 4, 'padding_state': 19, 'optimizer_type': 'lbfgs'}. Best is trial 484 with value: 0.0010389797389507294.
[I 2025-07-30 21:56:38,557] Trial 709 finished with value: 0.0013239783002063632 and parameters: {'width_NN_heal': 184, 'width_NN_state': 271, 'depth_NN_heal': 4, 'depth_NN_state': 2, 'mode_heal': 56, 'mode_state': 64, 'blocks_heal': 7, 'blocks_state': 3, 'lift_act_state': <built-in function gelu>, 'block_act_state': <built-in function gelu>, 'lift_act_heal': <function tanh at 0x7ff3611b4cc0>, 'block_act_heal': None, 'width_heal': 36, 'width_state': 29, 'lr': 0.0020175600678022424, 'padding_heal': 4, 'padding_state': 19, 'optimizer_type': 'lbfgs'}. Best is trial 484 with value: 0.0010389797389507294.
[I 2025-07-30 21:56:43,172] Trial 710 finished with value: 0.00108803971670568 and parameters: {'width_NN_heal': 170, 'width_NN_state': 337, 'depth_NN_heal': 4, 'depth_NN_state': 3, 'mode_heal': 52, 'mode_state': 64, 'blocks_heal': 7, 'blocks_state': 3, 'lift_act_state': <built-in function gelu>, 'block_act_state': <built-in function gelu>, 'lift_act_heal': <function tanh at 0x7ff3611b4cc0>, 'block_act_heal': None, 'width_heal': 32, 'width_state': 25, 'lr': 0.0022588256588213936, 'padding_heal': 5, 'padding_state': 22, 'optimizer_type': 'lbfgs'}. Best is trial 484 with value: 0.0010389797389507294.
[I 2025-07-30 21:56:47,895] Trial 711 finished with value: 0.0013075132155790925 and parameters: {'width_NN_heal': 168, 'width_NN_state': 347, 'depth_NN_heal': 4, 'depth_NN_state': 3, 'mode_heal': 52, 'mode_state': 64, 'blocks_heal': 7, 'blocks_state': 3, 'lift_act_state': <built-in function gelu>, 'block_act_state': <built-in function gelu>, 'lift_act_heal': <function tanh at 0x7ff3611b4cc0>, 'block_act_heal': None, 'width_heal': 31, 'width_state': 24, 'lr': 0.001839197798471701, 'padding_heal': 6, 'padding_state': 22, 'optimizer_type': 'lbfgs'}. Best is trial 484 with value: 0.0010389797389507294.
[I 2025-07-30 21:56:52,793] Trial 712 finished with value: 0.0011660869931802154 and parameters: {'width_NN_heal': 195, 'width_NN_state': 392, 'depth_NN_heal': 3, 'depth_NN_state': 3, 'mode_heal': 60, 'mode_state': 64, 'blocks_heal': 7, 'blocks_state': 3, 'lift_act_state': <built-in function gelu>, 'block_act_state': <built-in function gelu>, 'lift_act_heal': <function tanh at 0x7ff3611b4cc0>, 'block_act_heal': None, 'width_heal': 34, 'width_state': 25, 'lr': 0.0021261185457443136, 'padding_heal': 5, 'padding_state': 22, 'optimizer_type': 'lbfgs'}. Best is trial 484 with value: 0.0010389797389507294.
[I 2025-07-30 21:56:57,523] Trial 713 finished with value: 0.0011307303793728352 and parameters: {'width_NN_heal': 179, 'width_NN_state': 286, 'depth_NN_heal': 4, 'depth_NN_state': 3, 'mode_heal': 60, 'mode_state': 64, 'blocks_heal': 7, 'blocks_state': 3, 'lift_act_state': <built-in function gelu>, 'block_act_state': <built-in function gelu>, 'lift_act_heal': <function tanh at 0x7ff3611b4cc0>, 'block_act_heal': None, 'width_heal': 29, 'width_state': 26, 'lr': 0.001989465285220906, 'padding_heal': 6, 'padding_state': 22, 'optimizer_type': 'lbfgs'}. Best is trial 484 with value: 0.0010389797389507294.
[I 2025-07-30 21:57:02,222] Trial 714 finished with value: 0.0016859893221408129 and parameters: {'width_NN_heal': 181, 'width_NN_state': 269, 'depth_NN_heal': 4, 'depth_NN_state': 3, 'mode_heal': 60, 'mode_state': 64, 'blocks_heal': 7, 'blocks_state': 3, 'lift_act_state': None, 'block_act_state': <built-in function gelu>, 'lift_act_heal': <function tanh at 0x7ff3611b4cc0>, 'block_act_heal': <function tanh at 0x7ff3611b4cc0>, 'width_heal': 30, 'width_state': 26, 'lr': 0.0019965859219005294, 'padding_heal': 6, 'padding_state': 22, 'optimizer_type': 'lbfgs'}. Best is trial 484 with value: 0.0010389797389507294.
[I 2025-07-30 21:57:06,912] Trial 715 finished with value: 0.0020271027460694313 and parameters: {'width_NN_heal': 222, 'width_NN_state': 286, 'depth_NN_heal': 4, 'depth_NN_state': 2, 'mode_heal': 60, 'mode_state': 64, 'blocks_heal': 7, 'blocks_state': 3, 'lift_act_state': <built-in function gelu>, 'block_act_state': <function tanh at 0x7ff3611b4cc0>, 'lift_act_heal': <function tanh at 0x7ff3611b4cc0>, 'block_act_heal': None, 'width_heal': 35, 'width_state': 26, 'lr': 0.0018378706238080975, 'padding_heal': 8, 'padding_state': 22, 'optimizer_type': 'lbfgs'}. Best is trial 484 with value: 0.0010389797389507294.
[I 2025-07-30 21:57:11,624] Trial 716 finished with value: 0.0010735683608800173 and parameters: {'width_NN_heal': 192, 'width_NN_state': 261, 'depth_NN_heal': 4, 'depth_NN_state': 3, 'mode_heal': 60, 'mode_state': 64, 'blocks_heal': 7, 'blocks_state': 3, 'lift_act_state': <built-in function gelu>, 'block_act_state': <built-in function gelu>, 'lift_act_heal': <function tanh at 0x7ff3611b4cc0>, 'block_act_heal': None, 'width_heal': 29, 'width_state': 27, 'lr': 0.001719654298381247, 'padding_heal': 5, 'padding_state': 17, 'optimizer_type': 'lbfgs'}. Best is trial 484 with value: 0.0010389797389507294.
[I 2025-07-30 21:57:16,331] Trial 717 finished with value: 0.0012424723245203495 and parameters: {'width_NN_heal': 194, 'width_NN_state': 270, 'depth_NN_heal': 4, 'depth_NN_state': 3, 'mode_heal': 60, 'mode_state': 64, 'blocks_heal': 7, 'blocks_state': 3, 'lift_act_state': <built-in function gelu>, 'block_act_state': <built-in function gelu>, 'lift_act_heal': <function tanh at 0x7ff3611b4cc0>, 'block_act_heal': None, 'width_heal': 32, 'width_state': 27, 'lr': 0.0014817562989802927, 'padding_heal': 7, 'padding_state': 19, 'optimizer_type': 'lbfgs'}. Best is trial 484 with value: 0.0010389797389507294.
[I 2025-07-30 21:57:21,056] Trial 718 finished with value: 0.001100255991332233 and parameters: {'width_NN_heal': 206, 'width_NN_state': 300, 'depth_NN_heal': 4, 'depth_NN_state': 3, 'mode_heal': 60, 'mode_state': 64, 'blocks_heal': 7, 'blocks_state': 3, 'lift_act_state': <built-in function gelu>, 'block_act_state': <built-in function gelu>, 'lift_act_heal': <function tanh at 0x7ff3611b4cc0>, 'block_act_heal': None, 'width_heal': 30, 'width_state': 27, 'lr': 0.001660134316043214, 'padding_heal': 5, 'padding_state': 17, 'optimizer_type': 'lbfgs'}. Best is trial 484 with value: 0.0010389797389507294.
[I 2025-07-30 21:57:25,767] Trial 719 finished with value: 0.0024789953604340553 and parameters: {'width_NN_heal': 240, 'width_NN_state': 261, 'depth_NN_heal': 4, 'depth_NN_state': 3, 'mode_heal': 60, 'mode_state': 64, 'blocks_heal': 7, 'blocks_state': 3, 'lift_act_state': <built-in function gelu>, 'block_act_state': None, 'lift_act_heal': <function tanh at 0x7ff3611b4cc0>, 'block_act_heal': None, 'width_heal': 31, 'width_state': 27, 'lr': 0.0016638887048468151, 'padding_heal': 6, 'padding_state': 17, 'optimizer_type': 'lbfgs'}. Best is trial 484 with value: 0.0010389797389507294.
[I 2025-07-30 21:57:30,387] Trial 720 finished with value: 0.001074314583092928 and parameters: {'width_NN_heal': 214, 'width_NN_state': 289, 'depth_NN_heal': 4, 'depth_NN_state': 3, 'mode_heal': 60, 'mode_state': 64, 'blocks_heal': 7, 'blocks_state': 3, 'lift_act_state': <built-in function gelu>, 'block_act_state': <built-in function gelu>, 'lift_act_heal': <function tanh at 0x7ff3611b4cc0>, 'block_act_heal': None, 'width_heal': 34, 'width_state': 24, 'lr': 0.0015903251717682395, 'padding_heal': 5, 'padding_state': 22, 'optimizer_type': 'lbfgs'}. Best is trial 484 with value: 0.0010389797389507294.
[I 2025-07-30 21:57:35,089] Trial 721 finished with value: 0.0011090812040492892 and parameters: {'width_NN_heal': 222, 'width_NN_state': 279, 'depth_NN_heal': 4, 'depth_NN_state': 3, 'mode_heal': 60, 'mode_state': 64, 'blocks_heal': 7, 'blocks_state': 3, 'lift_act_state': <built-in function gelu>, 'block_act_state': <built-in function gelu>, 'lift_act_heal': <function tanh at 0x7ff3611b4cc0>, 'block_act_heal': None, 'width_heal': 36, 'width_state': 24, 'lr': 0.0014525488335593684, 'padding_heal': 6, 'padding_state': 17, 'optimizer_type': 'lbfgs'}. Best is trial 484 with value: 0.0010389797389507294.
[I 2025-07-30 21:57:39,765] Trial 722 finished with value: 0.0011560285929590464 and parameters: {'width_NN_heal': 212, 'width_NN_state': 259, 'depth_NN_heal': 4, 'depth_NN_state': 3, 'mode_heal': 60, 'mode_state': 64, 'blocks_heal': 7, 'blocks_state': 3, 'lift_act_state': <built-in function gelu>, 'block_act_state': <built-in function gelu>, 'lift_act_heal': <function tanh at 0x7ff3611b4cc0>, 'block_act_heal': None, 'width_heal': 32, 'width_state': 25, 'lr': 0.0013568792792349577, 'padding_heal': 7, 'padding_state': 17, 'optimizer_type': 'lbfgs'}. Best is trial 484 with value: 0.0010389797389507294.
[I 2025-07-30 21:57:44,540] Trial 723 finished with value: 0.001221756567247212 and parameters: {'width_NN_heal': 237, 'width_NN_state': 283, 'depth_NN_heal': 4, 'depth_NN_state': 3, 'mode_heal': 60, 'mode_state': 64, 'blocks_heal': 7, 'blocks_state': 3, 'lift_act_state': <built-in function gelu>, 'block_act_state': <built-in function gelu>, 'lift_act_heal': <function tanh at 0x7ff3611b4cc0>, 'block_act_heal': None, 'width_heal': 35, 'width_state': 24, 'lr': 0.0016431708876025444, 'padding_heal': 6, 'padding_state': 16, 'optimizer_type': 'lbfgs'}. Best is trial 484 with value: 0.0010389797389507294.
[I 2025-07-30 21:57:49,302] Trial 724 finished with value: 0.0011973746586591005 and parameters: {'width_NN_heal': 209, 'width_NN_state': 293, 'depth_NN_heal': 4, 'depth_NN_state': 3, 'mode_heal': 60, 'mode_state': 64, 'blocks_heal': 7, 'blocks_state': 3, 'lift_act_state': <built-in function gelu>, 'block_act_state': <built-in function gelu>, 'lift_act_heal': <function tanh at 0x7ff3611b4cc0>, 'block_act_heal': None, 'width_heal': 39, 'width_state': 24, 'lr': 0.001534290450166745, 'padding_heal': 6, 'padding_state': 16, 'optimizer_type': 'lbfgs'}. Best is trial 484 with value: 0.0010389797389507294.
[I 2025-07-30 21:57:53,986] Trial 725 finished with value: 0.0015387684106826782 and parameters: {'width_NN_heal': 229, 'width_NN_state': 252, 'depth_NN_heal': 4, 'depth_NN_state': 3, 'mode_heal': 60, 'mode_state': 64, 'blocks_heal': 7, 'blocks_state': 3, 'lift_act_state': <built-in function gelu>, 'block_act_state': <built-in function gelu>, 'lift_act_heal': <function tanh at 0x7ff3611b4cc0>, 'block_act_heal': None, 'width_heal': 36, 'width_state': 24, 'lr': 0.0012433512720401016, 'padding_heal': 7, 'padding_state': 17, 'optimizer_type': 'lbfgs'}. Best is trial 484 with value: 0.0010389797389507294.
