[I 2025-07-30 21:57:58,767] Trial 726 finished with value: 0.0010704710148274899 and parameters: {'width_NN_heal': 252, 'width_NN_state': 280, 'depth_NN_heal': 4, 'depth_NN_state': 3, 'mode_heal': 60, 'mode_state': 64, 'blocks_heal': 7, 'blocks_state': 3, 'lift_act_state': <built-in function gelu>, 'block_act_state': <built-in function gelu>, 'lift_act_heal': <function tanh at 0x7ff3611b4cc0>, 'block_act_heal': None, 'width_heal': 37, 'width_state': 24, 'lr': 0.0014653507100213388, 'padding_heal': 5, 'padding_state': 17, 'optimizer_type': 'lbfgs'}. Best is trial 484 with value: 0.0010389797389507294.
[I 2025-07-30 21:58:03,581] Trial 727 finished with value: 0.0011515356600284576 and parameters: {'width_NN_heal': 275, 'width_NN_state': 291, 'depth_NN_heal': 4, 'depth_NN_state': 3, 'mode_heal': 60, 'mode_state': 64, 'blocks_heal': 7, 'blocks_state': 3, 'lift_act_state': <built-in function gelu>, 'block_act_state': <built-in function gelu>, 'lift_act_heal': <function tanh at 0x7ff3611b4cc0>, 'block_act_heal': None, 'width_heal': 35, 'width_state': 23, 'lr': 0.0013811038322242687, 'padding_heal': 5, 'padding_state': 17, 'optimizer_type': 'lbfgs'}. Best is trial 484 with value: 0.0010389797389507294.
[I 2025-07-30 21:58:08,218] Trial 728 finished with value: 0.001226726919412613 and parameters: {'width_NN_heal': 247, 'width_NN_state': 333, 'depth_NN_heal': 4, 'depth_NN_state': 3, 'mode_heal': 60, 'mode_state': 64, 'blocks_heal': 7, 'blocks_state': 3, 'lift_act_state': <built-in function gelu>, 'block_act_state': <built-in function gelu>, 'lift_act_heal': <function tanh at 0x7ff3611b4cc0>, 'block_act_heal': None, 'width_heal': 34, 'width_state': 24, 'lr': 0.0014213239385919894, 'padding_heal': 5, 'padding_state': 17, 'optimizer_type': 'lbfgs'}. Best is trial 484 with value: 0.0010389797389507294.
[I 2025-07-30 21:58:12,860] Trial 729 finished with value: 0.0011103566503152251 and parameters: {'width_NN_heal': 227, 'width_NN_state': 283, 'depth_NN_heal': 3, 'depth_NN_state': 3, 'mode_heal': 60, 'mode_state': 64, 'blocks_heal': 7, 'blocks_state': 3, 'lift_act_state': <built-in function gelu>, 'block_act_state': <built-in function gelu>, 'lift_act_heal': <function tanh at 0x7ff3611b4cc0>, 'block_act_heal': None, 'width_heal': 38, 'width_state': 22, 'lr': 0.0011585523642964296, 'padding_heal': 5, 'padding_state': 17, 'optimizer_type': 'lbfgs'}. Best is trial 484 with value: 0.0010389797389507294.
[I 2025-07-30 21:58:17,260] Trial 730 finished with value: 0.0012864957097917795 and parameters: {'width_NN_heal': 240, 'width_NN_state': 306, 'depth_NN_heal': 1, 'depth_NN_state': 3, 'mode_heal': 60, 'mode_state': 64, 'blocks_heal': 7, 'blocks_state': 3, 'lift_act_state': <built-in function gelu>, 'block_act_state': <built-in function gelu>, 'lift_act_heal': None, 'block_act_heal': None, 'width_heal': 37, 'width_state': 21, 'lr': 0.0012235065490173375, 'padding_heal': 5, 'padding_state': 17, 'optimizer_type': 'lbfgs'}. Best is trial 484 with value: 0.0010389797389507294.
[I 2025-07-30 21:58:21,847] Trial 731 finished with value: 0.001378456363454461 and parameters: {'width_NN_heal': 224, 'width_NN_state': 273, 'depth_NN_heal': 2, 'depth_NN_state': 3, 'mode_heal': 60, 'mode_state': 64, 'blocks_heal': 7, 'blocks_state': 3, 'lift_act_state': <built-in function gelu>, 'block_act_state': <built-in function gelu>, 'lift_act_heal': <function tanh at 0x7ff3611b4cc0>, 'block_act_heal': None, 'width_heal': 39, 'width_state': 23, 'lr': 0.0012937209208968984, 'padding_heal': 5, 'padding_state': 17, 'optimizer_type': 'lbfgs'}. Best is trial 484 with value: 0.0010389797389507294.
[I 2025-07-30 21:58:26,404] Trial 732 finished with value: 0.0011615200201049447 and parameters: {'width_NN_heal': 250, 'width_NN_state': 364, 'depth_NN_heal': 3, 'depth_NN_state': 3, 'mode_heal': 60, 'mode_state': 64, 'blocks_heal': 7, 'blocks_state': 3, 'lift_act_state': <built-in function gelu>, 'block_act_state': <built-in function gelu>, 'lift_act_heal': <function tanh at 0x7ff3611b4cc0>, 'block_act_heal': None, 'width_heal': 34, 'width_state': 22, 'lr': 0.0011661740717921764, 'padding_heal': 5, 'padding_state': 17, 'optimizer_type': 'lbfgs'}. Best is trial 484 with value: 0.0010389797389507294.
[I 2025-07-30 21:58:31,072] Trial 733 finished with value: 0.0011171220103278756 and parameters: {'width_NN_heal': 272, 'width_NN_state': 309, 'depth_NN_heal': 3, 'depth_NN_state': 3, 'mode_heal': 60, 'mode_state': 64, 'blocks_heal': 7, 'blocks_state': 3, 'lift_act_state': <built-in function gelu>, 'block_act_state': <built-in function gelu>, 'lift_act_heal': <function tanh at 0x7ff3611b4cc0>, 'block_act_heal': None, 'width_heal': 38, 'width_state': 24, 'lr': 0.001455190902333736, 'padding_heal': 5, 'padding_state': 17, 'optimizer_type': 'lbfgs'}. Best is trial 484 with value: 0.0010389797389507294.
[I 2025-07-30 21:58:35,720] Trial 734 finished with value: 0.0012400745181366801 and parameters: {'width_NN_heal': 253, 'width_NN_state': 285, 'depth_NN_heal': 3, 'depth_NN_state': 3, 'mode_heal': 60, 'mode_state': 64, 'blocks_heal': 7, 'blocks_state': 3, 'lift_act_state': <built-in function gelu>, 'block_act_state': <built-in function gelu>, 'lift_act_heal': <function tanh at 0x7ff3611b4cc0>, 'block_act_heal': None, 'width_heal': 39, 'width_state': 24, 'lr': 0.0013836777595304598, 'padding_heal': 5, 'padding_state': 16, 'optimizer_type': 'lbfgs'}. Best is trial 484 with value: 0.0010389797389507294.
[I 2025-07-30 21:58:40,416] Trial 735 finished with value: 0.001273985835723579 and parameters: {'width_NN_heal': 278, 'width_NN_state': 341, 'depth_NN_heal': 3, 'depth_NN_state': 3, 'mode_heal': 60, 'mode_state': 64, 'blocks_heal': 7, 'blocks_state': 3, 'lift_act_state': <built-in function gelu>, 'block_act_state': <built-in function gelu>, 'lift_act_heal': <function tanh at 0x7ff3611b4cc0>, 'block_act_heal': None, 'width_heal': 38, 'width_state': 22, 'lr': 0.0011994759343842364, 'padding_heal': 6, 'padding_state': 17, 'optimizer_type': 'lbfgs'}. Best is trial 484 with value: 0.0010389797389507294.
[I 2025-07-30 21:58:44,936] Trial 736 finished with value: 0.00120936194434762 and parameters: {'width_NN_heal': 256, 'width_NN_state': 251, 'depth_NN_heal': 3, 'depth_NN_state': 3, 'mode_heal': 60, 'mode_state': 64, 'blocks_heal': 7, 'blocks_state': 3, 'lift_act_state': <built-in function gelu>, 'block_act_state': <built-in function gelu>, 'lift_act_heal': <function tanh at 0x7ff3611b4cc0>, 'block_act_heal': None, 'width_heal': 40, 'width_state': 25, 'lr': 0.0011424820411154992, 'padding_heal': 5, 'padding_state': 15, 'optimizer_type': 'lbfgs'}. Best is trial 484 with value: 0.0010389797389507294.
[I 2025-07-30 21:58:49,617] Trial 737 finished with value: 0.0013092746958136559 and parameters: {'width_NN_heal': 270, 'width_NN_state': 305, 'depth_NN_heal': 3, 'depth_NN_state': 3, 'mode_heal': 60, 'mode_state': 64, 'blocks_heal': 7, 'blocks_state': 3, 'lift_act_state': <built-in function gelu>, 'block_act_state': <built-in function gelu>, 'lift_act_heal': <function tanh at 0x7ff3611b4cc0>, 'block_act_heal': None, 'width_heal': 37, 'width_state': 22, 'lr': 0.0010634163832238153, 'padding_heal': 5, 'padding_state': 16, 'optimizer_type': 'lbfgs'}. Best is trial 484 with value: 0.0010389797389507294.
[I 2025-07-30 21:58:54,296] Trial 738 finished with value: 0.0012928893556818366 and parameters: {'width_NN_heal': 290, 'width_NN_state': 266, 'depth_NN_heal': 3, 'depth_NN_state': 3, 'mode_heal': 60, 'mode_state': 64, 'blocks_heal': 7, 'blocks_state': 3, 'lift_act_state': <built-in function gelu>, 'block_act_state': <built-in function gelu>, 'lift_act_heal': <function tanh at 0x7ff3611b4cc0>, 'block_act_heal': None, 'width_heal': 36, 'width_state': 24, 'lr': 0.0009831516708917816, 'padding_heal': 6, 'padding_state': 16, 'optimizer_type': 'lbfgs'}. Best is trial 484 with value: 0.0010389797389507294.
[I 2025-07-30 21:58:58,947] Trial 739 finished with value: 0.001972865778952837 and parameters: {'width_NN_heal': 234, 'width_NN_state': 239, 'depth_NN_heal': 3, 'depth_NN_state': 3, 'mode_heal': 60, 'mode_state': 64, 'blocks_heal': 7, 'blocks_state': 3, 'lift_act_state': <built-in function gelu>, 'block_act_state': <function tanh at 0x7ff3611b4cc0>, 'lift_act_heal': <function tanh at 0x7ff3611b4cc0>, 'block_act_heal': None, 'width_heal': 37, 'width_state': 26, 'lr': 0.0014228265307519468, 'padding_heal': 6, 'padding_state': 17, 'optimizer_type': 'lbfgs'}. Best is trial 484 with value: 0.0010389797389507294.
[I 2025-07-30 21:59:03,570] Trial 740 finished with value: 0.001282579731196165 and parameters: {'width_NN_heal': 218, 'width_NN_state': 347, 'depth_NN_heal': 3, 'depth_NN_state': 3, 'mode_heal': 60, 'mode_state': 64, 'blocks_heal': 7, 'blocks_state': 3, 'lift_act_state': <built-in function gelu>, 'block_act_state': <built-in function gelu>, 'lift_act_heal': <function tanh at 0x7ff3611b4cc0>, 'block_act_heal': None, 'width_heal': 39, 'width_state': 21, 'lr': 0.001487188107601136, 'padding_heal': 5, 'padding_state': 15, 'optimizer_type': 'lbfgs'}. Best is trial 484 with value: 0.0010389797389507294.
[I 2025-07-30 21:59:08,586] Trial 741 finished with value: 0.001307018450461328 and parameters: {'width_NN_heal': 221, 'width_NN_state': 422, 'depth_NN_heal': 3, 'depth_NN_state': 3, 'mode_heal': 60, 'mode_state': 64, 'blocks_heal': 7, 'blocks_state': 3, 'lift_act_state': <built-in function gelu>, 'block_act_state': <built-in function gelu>, 'lift_act_heal': <function tanh at 0x7ff3611b4cc0>, 'block_act_heal': None, 'width_heal': 41, 'width_state': 24, 'lr': 0.0008575145056111435, 'padding_heal': 4, 'padding_state': 17, 'optimizer_type': 'lbfgs'}. Best is trial 484 with value: 0.0010389797389507294.
[I 2025-07-30 21:59:13,038] Trial 742 finished with value: 0.009841449558734894 and parameters: {'width_NN_heal': 204, 'width_NN_state': 289, 'depth_NN_heal': 2, 'depth_NN_state': 3, 'mode_heal': 60, 'mode_state': 64, 'blocks_heal': 7, 'blocks_state': 3, 'lift_act_state': None, 'block_act_state': None, 'lift_act_heal': <function tanh at 0x7ff3611b4cc0>, 'block_act_heal': None, 'width_heal': 35, 'width_state': 22, 'lr': 0.0012761117587204917, 'padding_heal': 5, 'padding_state': 17, 'optimizer_type': 'lbfgs'}. Best is trial 484 with value: 0.0010389797389507294.
[I 2025-07-30 21:59:17,775] Trial 743 finished with value: 0.0014189406065270305 and parameters: {'width_NN_heal': 258, 'width_NN_state': 324, 'depth_NN_heal': 3, 'depth_NN_state': 3, 'mode_heal': 60, 'mode_state': 64, 'blocks_heal': 7, 'blocks_state': 3, 'lift_act_state': <built-in function gelu>, 'block_act_state': <built-in function gelu>, 'lift_act_heal': <function tanh at 0x7ff3611b4cc0>, 'block_act_heal': None, 'width_heal': 36, 'width_state': 26, 'lr': 0.001503004598632775, 'padding_heal': 6, 'padding_state': 14, 'optimizer_type': 'lbfgs'}. Best is trial 484 with value: 0.0010389797389507294.
[I 2025-07-30 21:59:22,415] Trial 744 finished with value: 0.0011743690120056272 and parameters: {'width_NN_heal': 225, 'width_NN_state': 271, 'depth_NN_heal': 3, 'depth_NN_state': 3, 'mode_heal': 60, 'mode_state': 64, 'blocks_heal': 7, 'blocks_state': 3, 'lift_act_state': <built-in function gelu>, 'block_act_state': <built-in function gelu>, 'lift_act_heal': <function tanh at 0x7ff3611b4cc0>, 'block_act_heal': None, 'width_heal': 33, 'width_state': 23, 'lr': 0.0015389685976042258, 'padding_heal': 5, 'padding_state': 17, 'optimizer_type': 'lbfgs'}. Best is trial 484 with value: 0.0010389797389507294.
[I 2025-07-30 21:59:27,107] Trial 745 finished with value: 0.0012232461012899876 and parameters: {'width_NN_heal': 206, 'width_NN_state': 381, 'depth_NN_heal': 3, 'depth_NN_state': 3, 'mode_heal': 60, 'mode_state': 64, 'blocks_heal': 7, 'blocks_state': 3, 'lift_act_state': <built-in function gelu>, 'block_act_state': <built-in function gelu>, 'lift_act_heal': <function tanh at 0x7ff3611b4cc0>, 'block_act_heal': None, 'width_heal': 38, 'width_state': 26, 'lr': 0.0013935016397213624, 'padding_heal': 4, 'padding_state': 18, 'optimizer_type': 'lbfgs'}. Best is trial 484 with value: 0.0010389797389507294.
[I 2025-07-30 21:59:31,761] Trial 746 finished with value: 0.001098502310924232 and parameters: {'width_NN_heal': 234, 'width_NN_state': 304, 'depth_NN_heal': 3, 'depth_NN_state': 3, 'mode_heal': 60, 'mode_state': 64, 'blocks_heal': 7, 'blocks_state': 3, 'lift_act_state': <built-in function gelu>, 'block_act_state': <built-in function gelu>, 'lift_act_heal': <function tanh at 0x7ff3611b4cc0>, 'block_act_heal': None, 'width_heal': 33, 'width_state': 25, 'lr': 0.0014784605880424424, 'padding_heal': 4, 'padding_state': 17, 'optimizer_type': 'lbfgs'}. Best is trial 484 with value: 0.0010389797389507294.
[I 2025-07-30 21:59:36,284] Trial 747 finished with value: 0.0012700282968580723 and parameters: {'width_NN_heal': 238, 'width_NN_state': 306, 'depth_NN_heal': 3, 'depth_NN_state': 3, 'mode_heal': 60, 'mode_state': 64, 'blocks_heal': 7, 'blocks_state': 3, 'lift_act_state': <built-in function gelu>, 'block_act_state': <built-in function gelu>, 'lift_act_heal': None, 'block_act_heal': None, 'width_heal': 34, 'width_state': 25, 'lr': 0.0013540344099088261, 'padding_heal': 4, 'padding_state': 15, 'optimizer_type': 'lbfgs'}. Best is trial 484 with value: 0.0010389797389507294.
[I 2025-07-30 21:59:41,002] Trial 748 finished with value: 0.0012578959576785564 and parameters: {'width_NN_heal': 268, 'width_NN_state': 323, 'depth_NN_heal': 3, 'depth_NN_state': 3, 'mode_heal': 60, 'mode_state': 64, 'blocks_heal': 7, 'blocks_state': 3, 'lift_act_state': <built-in function gelu>, 'block_act_state': <built-in function gelu>, 'lift_act_heal': <function tanh at 0x7ff3611b4cc0>, 'block_act_heal': None, 'width_heal': 33, 'width_state': 27, 'lr': 0.0013159304932252546, 'padding_heal': 4, 'padding_state': 16, 'optimizer_type': 'lbfgs'}. Best is trial 484 with value: 0.0010389797389507294.
[I 2025-07-30 21:59:45,742] Trial 749 finished with value: 0.001195317949168384 and parameters: {'width_NN_heal': 318, 'width_NN_state': 362, 'depth_NN_heal': 3, 'depth_NN_state': 3, 'mode_heal': 60, 'mode_state': 64, 'blocks_heal': 7, 'blocks_state': 3, 'lift_act_state': <built-in function gelu>, 'block_act_state': <built-in function gelu>, 'lift_act_heal': <function tanh at 0x7ff3611b4cc0>, 'block_act_heal': None, 'width_heal': 36, 'width_state': 24, 'lr': 0.0015133003665175674, 'padding_heal': 5, 'padding_state': 16, 'optimizer_type': 'lbfgs'}. Best is trial 484 with value: 0.0010389797389507294.
[I 2025-07-30 21:59:50,410] Trial 750 finished with value: 0.0011859126389026642 and parameters: {'width_NN_heal': 234, 'width_NN_state': 285, 'depth_NN_heal': 3, 'depth_NN_state': 3, 'mode_heal': 60, 'mode_state': 64, 'blocks_heal': 7, 'blocks_state': 3, 'lift_act_state': <built-in function gelu>, 'block_act_state': <built-in function gelu>, 'lift_act_heal': <function tanh at 0x7ff3611b4cc0>, 'block_act_heal': None, 'width_heal': 41, 'width_state': 21, 'lr': 0.001690083851366542, 'padding_heal': 5, 'padding_state': 17, 'optimizer_type': 'lbfgs'}. Best is trial 484 with value: 0.0010389797389507294.
[I 2025-07-30 21:59:55,106] Trial 751 finished with value: 0.0011821456719189882 and parameters: {'width_NN_heal': 285, 'width_NN_state': 303, 'depth_NN_heal': 3, 'depth_NN_state': 3, 'mode_heal': 60, 'mode_state': 64, 'blocks_heal': 7, 'blocks_state': 3, 'lift_act_state': <built-in function gelu>, 'block_act_state': <built-in function gelu>, 'lift_act_heal': <function tanh at 0x7ff3611b4cc0>, 'block_act_heal': None, 'width_heal': 37, 'width_state': 28, 'lr': 0.0014607094561720226, 'padding_heal': 6, 'padding_state': 18, 'optimizer_type': 'lbfgs'}. Best is trial 484 with value: 0.0010389797389507294.
[I 2025-07-30 21:59:59,728] Trial 752 finished with value: 0.0011696694418787956 and parameters: {'width_NN_heal': 216, 'width_NN_state': 337, 'depth_NN_heal': 3, 'depth_NN_state': 3, 'mode_heal': 60, 'mode_state': 64, 'blocks_heal': 7, 'blocks_state': 3, 'lift_act_state': <built-in function gelu>, 'block_act_state': <built-in function gelu>, 'lift_act_heal': <function tanh at 0x7ff3611b4cc0>, 'block_act_heal': None, 'width_heal': 32, 'width_state': 23, 'lr': 0.0011271283208432533, 'padding_heal': 4, 'padding_state': 17, 'optimizer_type': 'lbfgs'}. Best is trial 484 with value: 0.0010389797389507294.
[I 2025-07-30 22:00:04,299] Trial 753 finished with value: 0.001104652532376349 and parameters: {'width_NN_heal': 198, 'width_NN_state': 261, 'depth_NN_heal': 3, 'depth_NN_state': 3, 'mode_heal': 60, 'mode_state': 64, 'blocks_heal': 7, 'blocks_state': 3, 'lift_act_state': <built-in function gelu>, 'block_act_state': <built-in function gelu>, 'lift_act_heal': <function tanh at 0x7ff3611b4cc0>, 'block_act_heal': None, 'width_heal': 34, 'width_state': 26, 'lr': 0.0015520959240909885, 'padding_heal': 5, 'padding_state': 17, 'optimizer_type': 'lbfgs'}. Best is trial 484 with value: 0.0010389797389507294.
[I 2025-07-30 22:00:08,996] Trial 754 finished with value: 0.0012355414219200611 and parameters: {'width_NN_heal': 248, 'width_NN_state': 253, 'depth_NN_heal': 3, 'depth_NN_state': 3, 'mode_heal': 60, 'mode_state': 64, 'blocks_heal': 7, 'blocks_state': 3, 'lift_act_state': <built-in function gelu>, 'block_act_state': <built-in function gelu>, 'lift_act_heal': <function tanh at 0x7ff3611b4cc0>, 'block_act_heal': None, 'width_heal': 39, 'width_state': 24, 'lr': 0.0015826684027722526, 'padding_heal': 4, 'padding_state': 16, 'optimizer_type': 'lbfgs'}. Best is trial 484 with value: 0.0010389797389507294.
[I 2025-07-30 22:00:13,669] Trial 755 finished with value: 0.0012963308254256845 and parameters: {'width_NN_heal': 199, 'width_NN_state': 236, 'depth_NN_heal': 3, 'depth_NN_state': 3, 'mode_heal': 60, 'mode_state': 64, 'blocks_heal': 7, 'blocks_state': 3, 'lift_act_state': <built-in function gelu>, 'block_act_state': <built-in function gelu>, 'lift_act_heal': <function tanh at 0x7ff3611b4cc0>, 'block_act_heal': None, 'width_heal': 35, 'width_state': 25, 'lr': 0.0013525540716362889, 'padding_heal': 6, 'padding_state': 17, 'optimizer_type': 'lbfgs'}. Best is trial 484 with value: 0.0010389797389507294.
[I 2025-07-30 22:00:18,262] Trial 756 finished with value: 0.0012084597256034613 and parameters: {'width_NN_heal': 219, 'width_NN_state': 282, 'depth_NN_heal': 3, 'depth_NN_state': 3, 'mode_heal': 60, 'mode_state': 64, 'blocks_heal': 7, 'blocks_state': 3, 'lift_act_state': <built-in function gelu>, 'block_act_state': <built-in function gelu>, 'lift_act_heal': <function tanh at 0x7ff3611b4cc0>, 'block_act_heal': None, 'width_heal': 34, 'width_state': 22, 'lr': 0.0015312009570349104, 'padding_heal': 5, 'padding_state': 16, 'optimizer_type': 'lbfgs'}. Best is trial 484 with value: 0.0010389797389507294.
[I 2025-07-30 22:00:22,944] Trial 757 finished with value: 0.0012103241169825196 and parameters: {'width_NN_heal': 204, 'width_NN_state': 258, 'depth_NN_heal': 3, 'depth_NN_state': 3, 'mode_heal': 60, 'mode_state': 64, 'blocks_heal': 7, 'blocks_state': 3, 'lift_act_state': <built-in function gelu>, 'block_act_state': <built-in function gelu>, 'lift_act_heal': <function tanh at 0x7ff3611b4cc0>, 'block_act_heal': None, 'width_heal': 38, 'width_state': 27, 'lr': 0.0016072988641609985, 'padding_heal': 4, 'padding_state': 17, 'optimizer_type': 'lbfgs'}. Best is trial 484 with value: 0.0010389797389507294.
[I 2025-07-30 22:00:27,539] Trial 758 finished with value: 0.0016339601716026664 and parameters: {'width_NN_heal': 243, 'width_NN_state': 273, 'depth_NN_heal': 3, 'depth_NN_state': 3, 'mode_heal': 60, 'mode_state': 12, 'blocks_heal': 7, 'blocks_state': 3, 'lift_act_state': <built-in function gelu>, 'block_act_state': <built-in function gelu>, 'lift_act_heal': <function tanh at 0x7ff3611b4cc0>, 'block_act_heal': None, 'width_heal': 32, 'width_state': 25, 'lr': 0.0011896947144117525, 'padding_heal': 6, 'padding_state': 15, 'optimizer_type': 'lbfgs'}. Best is trial 484 with value: 0.0010389797389507294.
[I 2025-07-30 22:00:32,197] Trial 759 finished with value: 0.0011620844015851617 and parameters: {'width_NN_heal': 262, 'width_NN_state': 246, 'depth_NN_heal': 3, 'depth_NN_state': 3, 'mode_heal': 60, 'mode_state': 64, 'blocks_heal': 7, 'blocks_state': 3, 'lift_act_state': <built-in function gelu>, 'block_act_state': <built-in function gelu>, 'lift_act_heal': <function tanh at 0x7ff3611b4cc0>, 'block_act_heal': None, 'width_heal': 37, 'width_state': 26, 'lr': 0.0013035921252670297, 'padding_heal': 5, 'padding_state': 17, 'optimizer_type': 'lbfgs'}. Best is trial 484 with value: 0.0010389797389507294.
[I 2025-07-30 22:00:36,887] Trial 760 finished with value: 0.0011993740918114781 and parameters: {'width_NN_heal': 224, 'width_NN_state': 291, 'depth_NN_heal': 3, 'depth_NN_state': 3, 'mode_heal': 60, 'mode_state': 64, 'blocks_heal': 7, 'blocks_state': 3, 'lift_act_state': <built-in function gelu>, 'block_act_state': <built-in function gelu>, 'lift_act_heal': <function tanh at 0x7ff3611b4cc0>, 'block_act_heal': None, 'width_heal': 33, 'width_state': 20, 'lr': 0.0010562425813507614, 'padding_heal': 4, 'padding_state': 16, 'optimizer_type': 'lbfgs'}. Best is trial 484 with value: 0.0010389797389507294.
[I 2025-07-30 22:00:41,429] Trial 761 finished with value: 0.0012822517892345786 and parameters: {'width_NN_heal': 196, 'width_NN_state': 220, 'depth_NN_heal': 3, 'depth_NN_state': 3, 'mode_heal': 60, 'mode_state': 64, 'blocks_heal': 7, 'blocks_state': 3, 'lift_act_state': <built-in function gelu>, 'block_act_state': <built-in function gelu>, 'lift_act_heal': <function tanh at 0x7ff3611b4cc0>, 'block_act_heal': None, 'width_heal': 40, 'width_state': 22, 'lr': 0.0014942585708314477, 'padding_heal': 5, 'padding_state': 17, 'optimizer_type': 'lbfgs'}. Best is trial 484 with value: 0.0010389797389507294.
