[I 2025-07-30 21:32:24,233] Trial 419 finished with value: 0.0057557811960577965 and parameters: {'width_NN_heal': 79, 'width_NN_state': 112, 'depth_NN_heal': 6, 'depth_NN_state': 4, 'mode_heal': 64, 'mode_state': 28, 'blocks_heal': 7, 'blocks_state': 2, 'lift_act_state': <function tanh at 0x7ff3611b4cc0>, 'block_act_state': None, 'lift_act_heal': <function tanh at 0x7ff3611b4cc0>, 'block_act_heal': <function tanh at 0x7ff3611b4cc0>, 'width_heal': 22, 'width_state': 17, 'lr': 0.004652785706826565, 'padding_heal': 3, 'padding_state': 23, 'optimizer_type': 'lbfgs'}. Best is trial 395 with value: 0.0011172658996656537.
[I 2025-07-30 21:32:29,468] Trial 420 finished with value: 0.002371487207710743 and parameters: {'width_NN_heal': 75, 'width_NN_state': 117, 'depth_NN_heal': 6, 'depth_NN_state': 4, 'mode_heal': 64, 'mode_state': 24, 'blocks_heal': 7, 'blocks_state': 4, 'lift_act_state': <function tanh at 0x7ff3611b4cc0>, 'block_act_state': <built-in function gelu>, 'lift_act_heal': <function tanh at 0x7ff3611b4cc0>, 'block_act_heal': <function tanh at 0x7ff3611b4cc0>, 'width_heal': 14, 'width_state': 17, 'lr': 0.00394886960284048, 'padding_heal': 0, 'padding_state': 22, 'optimizer_type': 'lbfgs'}. Best is trial 395 with value: 0.0011172658996656537.
[I 2025-07-30 21:32:34,458] Trial 421 finished with value: 0.0013692810898646712 and parameters: {'width_NN_heal': 78, 'width_NN_state': 108, 'depth_NN_heal': 6, 'depth_NN_state': 4, 'mode_heal': 64, 'mode_state': 64, 'blocks_heal': 7, 'blocks_state': 3, 'lift_act_state': <built-in function gelu>, 'block_act_state': <built-in function gelu>, 'lift_act_heal': <function tanh at 0x7ff3611b4cc0>, 'block_act_heal': <function tanh at 0x7ff3611b4cc0>, 'width_heal': 21, 'width_state': 16, 'lr': 0.0043054257612405, 'padding_heal': 2, 'padding_state': 21, 'optimizer_type': 'lbfgs'}. Best is trial 395 with value: 0.0011172658996656537.
[I 2025-07-30 21:32:39,444] Trial 422 finished with value: 0.0018649155972525477 and parameters: {'width_NN_heal': 72, 'width_NN_state': 110, 'depth_NN_heal': 6, 'depth_NN_state': 4, 'mode_heal': 64, 'mode_state': 24, 'blocks_heal': 7, 'blocks_state': 3, 'lift_act_state': <built-in function gelu>, 'block_act_state': <built-in function gelu>, 'lift_act_heal': <function tanh at 0x7ff3611b4cc0>, 'block_act_heal': <function tanh at 0x7ff3611b4cc0>, 'width_heal': 21, 'width_state': 16, 'lr': 0.004245049981897152, 'padding_heal': 1, 'padding_state': 21, 'optimizer_type': 'lbfgs'}. Best is trial 395 with value: 0.0011172658996656537.
[I 2025-07-30 21:32:44,121] Trial 423 finished with value: 0.002381365979090333 and parameters: {'width_NN_heal': 82, 'width_NN_state': 121, 'depth_NN_heal': 6, 'depth_NN_state': 4, 'mode_heal': 64, 'mode_state': 24, 'blocks_heal': 7, 'blocks_state': 2, 'lift_act_state': None, 'block_act_state': <built-in function gelu>, 'lift_act_heal': <function tanh at 0x7ff3611b4cc0>, 'block_act_heal': <function tanh at 0x7ff3611b4cc0>, 'width_heal': 23, 'width_state': 19, 'lr': 0.004795606546513517, 'padding_heal': 2, 'padding_state': 20, 'optimizer_type': 'lbfgs'}. Best is trial 395 with value: 0.0011172658996656537.
[I 2025-07-30 21:32:49,088] Trial 424 finished with value: 0.0013807263458147645 and parameters: {'width_NN_heal': 81, 'width_NN_state': 106, 'depth_NN_heal': 6, 'depth_NN_state': 4, 'mode_heal': 64, 'mode_state': 32, 'blocks_heal': 7, 'blocks_state': 3, 'lift_act_state': <built-in function gelu>, 'block_act_state': <built-in function gelu>, 'lift_act_heal': <function tanh at 0x7ff3611b4cc0>, 'block_act_heal': <function tanh at 0x7ff3611b4cc0>, 'width_heal': 21, 'width_state': 15, 'lr': 0.004126290057045802, 'padding_heal': 1, 'padding_state': 21, 'optimizer_type': 'lbfgs'}. Best is trial 395 with value: 0.0011172658996656537.
[I 2025-07-30 21:32:54,074] Trial 425 finished with value: 0.001439357060007751 and parameters: {'width_NN_heal': 94, 'width_NN_state': 124, 'depth_NN_heal': 6, 'depth_NN_state': 4, 'mode_heal': 64, 'mode_state': 64, 'blocks_heal': 7, 'blocks_state': 3, 'lift_act_state': <built-in function gelu>, 'block_act_state': <built-in function gelu>, 'lift_act_heal': <function tanh at 0x7ff3611b4cc0>, 'block_act_heal': <function tanh at 0x7ff3611b4cc0>, 'width_heal': 26, 'width_state': 18, 'lr': 0.005267223304796332, 'padding_heal': 0, 'padding_state': 23, 'optimizer_type': 'lbfgs'}. Best is trial 395 with value: 0.0011172658996656537.
[I 2025-07-30 21:32:59,060] Trial 426 finished with value: 0.001129299052990973 and parameters: {'width_NN_heal': 69, 'width_NN_state': 151, 'depth_NN_heal': 6, 'depth_NN_state': 4, 'mode_heal': 64, 'mode_state': 64, 'blocks_heal': 7, 'blocks_state': 3, 'lift_act_state': <built-in function gelu>, 'block_act_state': <built-in function gelu>, 'lift_act_heal': <function tanh at 0x7ff3611b4cc0>, 'block_act_heal': <function tanh at 0x7ff3611b4cc0>, 'width_heal': 20, 'width_state': 16, 'lr': 0.004544131670929243, 'padding_heal': 2, 'padding_state': 22, 'optimizer_type': 'lbfgs'}. Best is trial 395 with value: 0.0011172658996656537.
[I 2025-07-30 21:33:04,067] Trial 427 finished with value: 0.0013288919581100345 and parameters: {'width_NN_heal': 70, 'width_NN_state': 159, 'depth_NN_heal': 6, 'depth_NN_state': 4, 'mode_heal': 64, 'mode_state': 64, 'blocks_heal': 7, 'blocks_state': 3, 'lift_act_state': <built-in function gelu>, 'block_act_state': <built-in function gelu>, 'lift_act_heal': <function tanh at 0x7ff3611b4cc0>, 'block_act_heal': <function tanh at 0x7ff3611b4cc0>, 'width_heal': 24, 'width_state': 17, 'lr': 0.003738740212686508, 'padding_heal': 2, 'padding_state': 23, 'optimizer_type': 'lbfgs'}. Best is trial 395 with value: 0.0011172658996656537.
[I 2025-07-30 21:33:09,103] Trial 428 finished with value: 0.0012984521454200149 and parameters: {'width_NN_heal': 69, 'width_NN_state': 173, 'depth_NN_heal': 6, 'depth_NN_state': 4, 'mode_heal': 64, 'mode_state': 64, 'blocks_heal': 7, 'blocks_state': 3, 'lift_act_state': <built-in function gelu>, 'block_act_state': <built-in function gelu>, 'lift_act_heal': <function tanh at 0x7ff3611b4cc0>, 'block_act_heal': <function tanh at 0x7ff3611b4cc0>, 'width_heal': 23, 'width_state': 16, 'lr': 0.0036614892298853447, 'padding_heal': 1, 'padding_state': 23, 'optimizer_type': 'lbfgs'}. Best is trial 395 with value: 0.0011172658996656537.
[I 2025-07-30 21:33:14,110] Trial 429 finished with value: 0.0013535800389945507 and parameters: {'width_NN_heal': 71, 'width_NN_state': 151, 'depth_NN_heal': 6, 'depth_NN_state': 4, 'mode_heal': 64, 'mode_state': 64, 'blocks_heal': 7, 'blocks_state': 3, 'lift_act_state': <built-in function gelu>, 'block_act_state': <function tanh at 0x7ff3611b4cc0>, 'lift_act_heal': <function tanh at 0x7ff3611b4cc0>, 'block_act_heal': <function tanh at 0x7ff3611b4cc0>, 'width_heal': 23, 'width_state': 16, 'lr': 0.0037031127319299686, 'padding_heal': 1, 'padding_state': 24, 'optimizer_type': 'lbfgs'}. Best is trial 395 with value: 0.0011172658996656537.
[I 2025-07-30 21:33:19,145] Trial 430 finished with value: 0.0014701763866469264 and parameters: {'width_NN_heal': 69, 'width_NN_state': 194, 'depth_NN_heal': 6, 'depth_NN_state': 4, 'mode_heal': 64, 'mode_state': 64, 'blocks_heal': 7, 'blocks_state': 3, 'lift_act_state': <built-in function gelu>, 'block_act_state': <function tanh at 0x7ff3611b4cc0>, 'lift_act_heal': <function tanh at 0x7ff3611b4cc0>, 'block_act_heal': <function tanh at 0x7ff3611b4cc0>, 'width_heal': 25, 'width_state': 17, 'lr': 0.0035116879274072216, 'padding_heal': 1, 'padding_state': 24, 'optimizer_type': 'lbfgs'}. Best is trial 395 with value: 0.0011172658996656537.
[I 2025-07-30 21:33:24,097] Trial 431 finished with value: 0.0016111992299556732 and parameters: {'width_NN_heal': 68, 'width_NN_state': 167, 'depth_NN_heal': 6, 'depth_NN_state': 4, 'mode_heal': 64, 'mode_state': 20, 'blocks_heal': 7, 'blocks_state': 3, 'lift_act_state': <built-in function gelu>, 'block_act_state': <function tanh at 0x7ff3611b4cc0>, 'lift_act_heal': <function tanh at 0x7ff3611b4cc0>, 'block_act_heal': <function tanh at 0x7ff3611b4cc0>, 'width_heal': 23, 'width_state': 18, 'lr': 0.0036370301283856297, 'padding_heal': 0, 'padding_state': 24, 'optimizer_type': 'lbfgs'}. Best is trial 395 with value: 0.0011172658996656537.
[I 2025-07-30 21:33:29,143] Trial 432 finished with value: 0.0015301037346944213 and parameters: {'width_NN_heal': 73, 'width_NN_state': 229, 'depth_NN_heal': 6, 'depth_NN_state': 4, 'mode_heal': 64, 'mode_state': 64, 'blocks_heal': 7, 'blocks_state': 3, 'lift_act_state': <built-in function gelu>, 'block_act_state': <function tanh at 0x7ff3611b4cc0>, 'lift_act_heal': <function tanh at 0x7ff3611b4cc0>, 'block_act_heal': <function tanh at 0x7ff3611b4cc0>, 'width_heal': 26, 'width_state': 16, 'lr': 0.0034108649250584678, 'padding_heal': 1, 'padding_state': 12, 'optimizer_type': 'lbfgs'}. Best is trial 395 with value: 0.0011172658996656537.
[I 2025-07-30 21:33:34,146] Trial 433 finished with value: 0.0015067355707287788 and parameters: {'width_NN_heal': 67, 'width_NN_state': 168, 'depth_NN_heal': 6, 'depth_NN_state': 4, 'mode_heal': 64, 'mode_state': 16, 'blocks_heal': 7, 'blocks_state': 3, 'lift_act_state': <built-in function gelu>, 'block_act_state': <function tanh at 0x7ff3611b4cc0>, 'lift_act_heal': <function tanh at 0x7ff3611b4cc0>, 'block_act_heal': <function tanh at 0x7ff3611b4cc0>, 'width_heal': 23, 'width_state': 19, 'lr': 0.0038357032223593087, 'padding_heal': 1, 'padding_state': 24, 'optimizer_type': 'lbfgs'}. Best is trial 395 with value: 0.0011172658996656537.
[I 2025-07-30 21:33:39,080] Trial 434 finished with value: 0.0015828796895220876 and parameters: {'width_NN_heal': 65, 'width_NN_state': 169, 'depth_NN_heal': 6, 'depth_NN_state': 4, 'mode_heal': 64, 'mode_state': 64, 'blocks_heal': 7, 'blocks_state': 3, 'lift_act_state': <built-in function gelu>, 'block_act_state': <built-in function gelu>, 'lift_act_heal': <function tanh at 0x7ff3611b4cc0>, 'block_act_heal': <function tanh at 0x7ff3611b4cc0>, 'width_heal': 24, 'width_state': 17, 'lr': 0.003356153250876217, 'padding_heal': 0, 'padding_state': 23, 'optimizer_type': 'lbfgs'}. Best is trial 395 with value: 0.0011172658996656537.
[I 2025-07-30 21:33:44,352] Trial 435 finished with value: 0.016298484057188034 and parameters: {'width_NN_heal': 75, 'width_NN_state': 180, 'depth_NN_heal': 6, 'depth_NN_state': 8, 'mode_heal': 64, 'mode_state': 64, 'blocks_heal': 7, 'blocks_state': 3, 'lift_act_state': <built-in function gelu>, 'block_act_state': <function tanh at 0x7ff3611b4cc0>, 'lift_act_heal': <function tanh at 0x7ff3611b4cc0>, 'block_act_heal': None, 'width_heal': 20, 'width_state': 15, 'lr': 0.003654869748359166, 'padding_heal': 2, 'padding_state': 24, 'optimizer_type': 'lbfgs'}. Best is trial 395 with value: 0.0011172658996656537.
[I 2025-07-30 21:33:49,343] Trial 436 finished with value: 0.001468484872020781 and parameters: {'width_NN_heal': 71, 'width_NN_state': 151, 'depth_NN_heal': 6, 'depth_NN_state': 4, 'mode_heal': 64, 'mode_state': 64, 'blocks_heal': 7, 'blocks_state': 3, 'lift_act_state': <built-in function gelu>, 'block_act_state': <built-in function gelu>, 'lift_act_heal': <function tanh at 0x7ff3611b4cc0>, 'block_act_heal': <function tanh at 0x7ff3611b4cc0>, 'width_heal': 22, 'width_state': 16, 'lr': 0.00324861727088938, 'padding_heal': 1, 'padding_state': 23, 'optimizer_type': 'lbfgs'}. Best is trial 395 with value: 0.0011172658996656537.
[I 2025-07-30 21:33:54,428] Trial 437 finished with value: 0.001693972502835095 and parameters: {'width_NN_heal': 65, 'width_NN_state': 153, 'depth_NN_heal': 6, 'depth_NN_state': 4, 'mode_heal': 64, 'mode_state': 64, 'blocks_heal': 7, 'blocks_state': 3, 'lift_act_state': <built-in function gelu>, 'block_act_state': <function tanh at 0x7ff3611b4cc0>, 'lift_act_heal': <function tanh at 0x7ff3611b4cc0>, 'block_act_heal': <function tanh at 0x7ff3611b4cc0>, 'width_heal': 27, 'width_state': 17, 'lr': 0.0038030622976788745, 'padding_heal': 2, 'padding_state': 24, 'optimizer_type': 'lbfgs'}. Best is trial 395 with value: 0.0011172658996656537.
[I 2025-07-30 21:33:59,063] Trial 438 finished with value: 0.003597182920202613 and parameters: {'width_NN_heal': 73, 'width_NN_state': 154, 'depth_NN_heal': 6, 'depth_NN_state': 1, 'mode_heal': 64, 'mode_state': 28, 'blocks_heal': 7, 'blocks_state': 3, 'lift_act_state': None, 'block_act_state': <function tanh at 0x7ff3611b4cc0>, 'lift_act_heal': <function tanh at 0x7ff3611b4cc0>, 'block_act_heal': <function tanh at 0x7ff3611b4cc0>, 'width_heal': 20, 'width_state': 20, 'lr': 0.004027733602847294, 'padding_heal': 0, 'padding_state': 23, 'optimizer_type': 'lbfgs'}. Best is trial 395 with value: 0.0011172658996656537.
[I 2025-07-30 21:34:04,125] Trial 439 finished with value: 0.001467283582314849 and parameters: {'width_NN_heal': 66, 'width_NN_state': 184, 'depth_NN_heal': 6, 'depth_NN_state': 4, 'mode_heal': 64, 'mode_state': 64, 'blocks_heal': 7, 'blocks_state': 3, 'lift_act_state': <built-in function gelu>, 'block_act_state': <function tanh at 0x7ff3611b4cc0>, 'lift_act_heal': <function tanh at 0x7ff3611b4cc0>, 'block_act_heal': <function tanh at 0x7ff3611b4cc0>, 'width_heal': 23, 'width_state': 18, 'lr': 0.003599559260378867, 'padding_heal': 2, 'padding_state': 23, 'optimizer_type': 'lbfgs'}. Best is trial 395 with value: 0.0011172658996656537.
[I 2025-07-30 21:34:08,968] Trial 440 finished with value: 0.0013546914560720325 and parameters: {'width_NN_heal': 81, 'width_NN_state': 158, 'depth_NN_heal': 4, 'depth_NN_state': 4, 'mode_heal': 64, 'mode_state': 64, 'blocks_heal': 7, 'blocks_state': 3, 'lift_act_state': <built-in function gelu>, 'block_act_state': <built-in function gelu>, 'lift_act_heal': <function tanh at 0x7ff3611b4cc0>, 'block_act_heal': <function tanh at 0x7ff3611b4cc0>, 'width_heal': 21, 'width_state': 15, 'lr': 0.004137886110509659, 'padding_heal': 1, 'padding_state': 22, 'optimizer_type': 'lbfgs'}. Best is trial 395 with value: 0.0011172658996656537.
[I 2025-07-30 21:34:13,609] Trial 441 finished with value: 0.0016082674264907837 and parameters: {'width_NN_heal': 62, 'width_NN_state': 149, 'depth_NN_heal': 2, 'depth_NN_state': 4, 'mode_heal': 36, 'mode_state': 64, 'blocks_heal': 7, 'blocks_state': 3, 'lift_act_state': <built-in function gelu>, 'block_act_state': <function tanh at 0x7ff3611b4cc0>, 'lift_act_heal': <function tanh at 0x7ff3611b4cc0>, 'block_act_heal': <function tanh at 0x7ff3611b4cc0>, 'width_heal': 19, 'width_state': 15, 'lr': 0.00429107696603155, 'padding_heal': 1, 'padding_state': 22, 'optimizer_type': 'lbfgs'}. Best is trial 395 with value: 0.0011172658996656537.
[I 2025-07-30 21:34:18,421] Trial 442 finished with value: 0.0012048028875142336 and parameters: {'width_NN_heal': 85, 'width_NN_state': 168, 'depth_NN_heal': 4, 'depth_NN_state': 4, 'mode_heal': 64, 'mode_state': 64, 'blocks_heal': 7, 'blocks_state': 3, 'lift_act_state': <built-in function gelu>, 'block_act_state': <built-in function gelu>, 'lift_act_heal': <function tanh at 0x7ff3611b4cc0>, 'block_act_heal': <function tanh at 0x7ff3611b4cc0>, 'width_heal': 20, 'width_state': 16, 'lr': 0.0033922712745052827, 'padding_heal': 2, 'padding_state': 22, 'optimizer_type': 'lbfgs'}. Best is trial 395 with value: 0.0011172658996656537.
[I 2025-07-30 21:34:23,361] Trial 443 finished with value: 0.001286354847252369 and parameters: {'width_NN_heal': 87, 'width_NN_state': 168, 'depth_NN_heal': 5, 'depth_NN_state': 4, 'mode_heal': 36, 'mode_state': 64, 'blocks_heal': 7, 'blocks_state': 3, 'lift_act_state': <built-in function gelu>, 'block_act_state': <built-in function gelu>, 'lift_act_heal': <function tanh at 0x7ff3611b4cc0>, 'block_act_heal': <function tanh at 0x7ff3611b4cc0>, 'width_heal': 21, 'width_state': 15, 'lr': 0.003209731267080653, 'padding_heal': 2, 'padding_state': 22, 'optimizer_type': 'lbfgs'}. Best is trial 395 with value: 0.0011172658996656537.
[I 2025-07-30 21:34:28,305] Trial 444 finished with value: 0.001263996004126966 and parameters: {'width_NN_heal': 95, 'width_NN_state': 180, 'depth_NN_heal': 5, 'depth_NN_state': 4, 'mode_heal': 64, 'mode_state': 64, 'blocks_heal': 7, 'blocks_state': 3, 'lift_act_state': <built-in function gelu>, 'block_act_state': <built-in function gelu>, 'lift_act_heal': <function tanh at 0x7ff3611b4cc0>, 'block_act_heal': <function tanh at 0x7ff3611b4cc0>, 'width_heal': 19, 'width_state': 15, 'lr': 0.0031874939718396084, 'padding_heal': 2, 'padding_state': 22, 'optimizer_type': 'lbfgs'}. Best is trial 395 with value: 0.0011172658996656537.
[I 2025-07-30 21:34:33,249] Trial 445 finished with value: 0.00139454600866884 and parameters: {'width_NN_heal': 87, 'width_NN_state': 213, 'depth_NN_heal': 5, 'depth_NN_state': 4, 'mode_heal': 36, 'mode_state': 64, 'blocks_heal': 7, 'blocks_state': 3, 'lift_act_state': <built-in function gelu>, 'block_act_state': <built-in function gelu>, 'lift_act_heal': <function tanh at 0x7ff3611b4cc0>, 'block_act_heal': <function tanh at 0x7ff3611b4cc0>, 'width_heal': 19, 'width_state': 15, 'lr': 0.003272479418593675, 'padding_heal': 2, 'padding_state': 22, 'optimizer_type': 'lbfgs'}. Best is trial 395 with value: 0.0011172658996656537.
[I 2025-07-30 21:34:38,106] Trial 446 finished with value: 0.0011642040917649865 and parameters: {'width_NN_heal': 141, 'width_NN_state': 203, 'depth_NN_heal': 5, 'depth_NN_state': 4, 'mode_heal': 64, 'mode_state': 64, 'blocks_heal': 7, 'blocks_state': 3, 'lift_act_state': <built-in function gelu>, 'block_act_state': <built-in function gelu>, 'lift_act_heal': <function tanh at 0x7ff3611b4cc0>, 'block_act_heal': <function tanh at 0x7ff3611b4cc0>, 'width_heal': 20, 'width_state': 16, 'lr': 0.003022726743299659, 'padding_heal': 2, 'padding_state': 21, 'optimizer_type': 'lbfgs'}. Best is trial 395 with value: 0.0011172658996656537.
[I 2025-07-30 21:34:42,883] Trial 447 finished with value: 0.0012359068496152759 and parameters: {'width_NN_heal': 141, 'width_NN_state': 193, 'depth_NN_heal': 5, 'depth_NN_state': 4, 'mode_heal': 64, 'mode_state': 64, 'blocks_heal': 7, 'blocks_state': 3, 'lift_act_state': <built-in function gelu>, 'block_act_state': <built-in function gelu>, 'lift_act_heal': <function tanh at 0x7ff3611b4cc0>, 'block_act_heal': <function tanh at 0x7ff3611b4cc0>, 'width_heal': 20, 'width_state': 16, 'lr': 0.003107431145857485, 'padding_heal': 3, 'padding_state': 21, 'optimizer_type': 'lbfgs'}. Best is trial 395 with value: 0.0011172658996656537.
[I 2025-07-30 21:34:47,802] Trial 448 finished with value: 0.001278874697163701 and parameters: {'width_NN_heal': 165, 'width_NN_state': 208, 'depth_NN_heal': 5, 'depth_NN_state': 4, 'mode_heal': 64, 'mode_state': 64, 'blocks_heal': 7, 'blocks_state': 3, 'lift_act_state': <built-in function gelu>, 'block_act_state': <built-in function gelu>, 'lift_act_heal': <function tanh at 0x7ff3611b4cc0>, 'block_act_heal': <function tanh at 0x7ff3611b4cc0>, 'width_heal': 20, 'width_state': 16, 'lr': 0.0030634632595739728, 'padding_heal': 2, 'padding_state': 20, 'optimizer_type': 'lbfgs'}. Best is trial 395 with value: 0.0011172658996656537.
[I 2025-07-30 21:34:52,704] Trial 449 finished with value: 0.001151371281594038 and parameters: {'width_NN_heal': 186, 'width_NN_state': 241, 'depth_NN_heal': 5, 'depth_NN_state': 4, 'mode_heal': 64, 'mode_state': 64, 'blocks_heal': 7, 'blocks_state': 3, 'lift_act_state': <built-in function gelu>, 'block_act_state': <built-in function gelu>, 'lift_act_heal': <function tanh at 0x7ff3611b4cc0>, 'block_act_heal': <function tanh at 0x7ff3611b4cc0>, 'width_heal': 20, 'width_state': 16, 'lr': 0.003070599732962766, 'padding_heal': 2, 'padding_state': 20, 'optimizer_type': 'lbfgs'}. Best is trial 395 with value: 0.0011172658996656537.
[I 2025-07-30 21:34:57,597] Trial 450 finished with value: 0.0013740190770477057 and parameters: {'width_NN_heal': 198, 'width_NN_state': 236, 'depth_NN_heal': 5, 'depth_NN_state': 4, 'mode_heal': 64, 'mode_state': 64, 'blocks_heal': 7, 'blocks_state': 3, 'lift_act_state': <built-in function gelu>, 'block_act_state': <built-in function gelu>, 'lift_act_heal': <function tanh at 0x7ff3611b4cc0>, 'block_act_heal': <function tanh at 0x7ff3611b4cc0>, 'width_heal': 20, 'width_state': 16, 'lr': 0.0030831943969022464, 'padding_heal': 2, 'padding_state': 20, 'optimizer_type': 'lbfgs'}. Best is trial 395 with value: 0.0011172658996656537.
[I 2025-07-30 21:35:02,478] Trial 451 finished with value: 0.0012136305449530482 and parameters: {'width_NN_heal': 166, 'width_NN_state': 198, 'depth_NN_heal': 5, 'depth_NN_state': 4, 'mode_heal': 64, 'mode_state': 64, 'blocks_heal': 7, 'blocks_state': 3, 'lift_act_state': <built-in function gelu>, 'block_act_state': <built-in function gelu>, 'lift_act_heal': <function tanh at 0x7ff3611b4cc0>, 'block_act_heal': <function tanh at 0x7ff3611b4cc0>, 'width_heal': 19, 'width_state': 16, 'lr': 0.0031762577231375824, 'padding_heal': 3, 'padding_state': 21, 'optimizer_type': 'lbfgs'}. Best is trial 395 with value: 0.0011172658996656537.
[I 2025-07-30 21:35:07,399] Trial 452 finished with value: 0.001168814953416586 and parameters: {'width_NN_heal': 164, 'width_NN_state': 246, 'depth_NN_heal': 5, 'depth_NN_state': 4, 'mode_heal': 64, 'mode_state': 64, 'blocks_heal': 7, 'blocks_state': 3, 'lift_act_state': <built-in function gelu>, 'block_act_state': <built-in function gelu>, 'lift_act_heal': <function tanh at 0x7ff3611b4cc0>, 'block_act_heal': <function tanh at 0x7ff3611b4cc0>, 'width_heal': 21, 'width_state': 16, 'lr': 0.003059024019466044, 'padding_heal': 3, 'padding_state': 20, 'optimizer_type': 'lbfgs'}. Best is trial 395 with value: 0.0011172658996656537.
