[I 2025-07-30 21:38:04,464] Trial 487 finished with value: 0.0013589611044153571 and parameters: {'width_NN_heal': 257, 'width_NN_state': 348, 'depth_NN_heal': 5, 'depth_NN_state': 4, 'mode_heal': 60, 'mode_state': 64, 'blocks_heal': 7, 'blocks_state': 3, 'lift_act_state': <built-in function gelu>, 'block_act_state': <built-in function gelu>, 'lift_act_heal': <function tanh at 0x7ff3611b4cc0>, 'block_act_heal': <function tanh at 0x7ff3611b4cc0>, 'width_heal': 22, 'width_state': 23, 'lr': 0.00219896769225751, 'padding_heal': 5, 'padding_state': 20, 'optimizer_type': 'lbfgs'}. Best is trial 484 with value: 0.0010389797389507294.
[I 2025-07-30 21:38:09,842] Trial 488 finished with value: 0.0017557991668581963 and parameters: {'width_NN_heal': 186, 'width_NN_state': 382, 'depth_NN_heal': 5, 'depth_NN_state': 4, 'mode_heal': 60, 'mode_state': 64, 'blocks_heal': 7, 'blocks_state': 3, 'lift_act_state': <built-in function gelu>, 'block_act_state': <built-in function gelu>, 'lift_act_heal': <function tanh at 0x7ff3611b4cc0>, 'block_act_heal': <function tanh at 0x7ff3611b4cc0>, 'width_heal': 24, 'width_state': 23, 'lr': 0.002321347391658229, 'padding_heal': 4, 'padding_state': 21, 'optimizer_type': 'lbfgs'}. Best is trial 484 with value: 0.0010389797389507294.
[I 2025-07-30 21:38:14,915] Trial 489 finished with value: 0.0010968537535518408 and parameters: {'width_NN_heal': 208, 'width_NN_state': 329, 'depth_NN_heal': 4, 'depth_NN_state': 4, 'mode_heal': 60, 'mode_state': 64, 'blocks_heal': 7, 'blocks_state': 3, 'lift_act_state': <built-in function gelu>, 'block_act_state': <built-in function gelu>, 'lift_act_heal': <function tanh at 0x7ff3611b4cc0>, 'block_act_heal': <function tanh at 0x7ff3611b4cc0>, 'width_heal': 22, 'width_state': 22, 'lr': 0.0023684059083591185, 'padding_heal': 4, 'padding_state': 21, 'optimizer_type': 'lbfgs'}. Best is trial 484 with value: 0.0010389797389507294.
[I 2025-07-30 21:38:20,390] Trial 490 finished with value: 0.0013066581450402737 and parameters: {'width_NN_heal': 262, 'width_NN_state': 358, 'depth_NN_heal': 4, 'depth_NN_state': 4, 'mode_heal': 60, 'mode_state': 64, 'blocks_heal': 7, 'blocks_state': 3, 'lift_act_state': <built-in function gelu>, 'block_act_state': <built-in function gelu>, 'lift_act_heal': <function tanh at 0x7ff3611b4cc0>, 'block_act_heal': <function tanh at 0x7ff3611b4cc0>, 'width_heal': 23, 'width_state': 26, 'lr': 0.0019880618468975687, 'padding_heal': 4, 'padding_state': 21, 'optimizer_type': 'lbfgs'}. Best is trial 484 with value: 0.0010389797389507294.
[I 2025-07-30 21:38:26,755] Trial 491 finished with value: 0.0020820023491978645 and parameters: {'width_NN_heal': 329, 'width_NN_state': 422, 'depth_NN_heal': 4, 'depth_NN_state': 4, 'mode_heal': 60, 'mode_state': 64, 'blocks_heal': 7, 'blocks_state': 3, 'lift_act_state': <built-in function gelu>, 'block_act_state': <built-in function gelu>, 'lift_act_heal': <function tanh at 0x7ff3611b4cc0>, 'block_act_heal': <function tanh at 0x7ff3611b4cc0>, 'width_heal': 20, 'width_state': 24, 'lr': 0.002107656345867827, 'padding_heal': 5, 'padding_state': 21, 'optimizer_type': 'lbfgs'}. Best is trial 484 with value: 0.0010389797389507294.
[I 2025-07-30 21:38:31,902] Trial 492 finished with value: 0.0012993537820875645 and parameters: {'width_NN_heal': 205, 'width_NN_state': 323, 'depth_NN_heal': 5, 'depth_NN_state': 4, 'mode_heal': 60, 'mode_state': 64, 'blocks_heal': 7, 'blocks_state': 3, 'lift_act_state': <built-in function gelu>, 'block_act_state': <built-in function gelu>, 'lift_act_heal': <function tanh at 0x7ff3611b4cc0>, 'block_act_heal': None, 'width_heal': 22, 'width_state': 21, 'lr': 0.0023140506754374757, 'padding_heal': 4, 'padding_state': 19, 'optimizer_type': 'lbfgs'}. Best is trial 484 with value: 0.0010389797389507294.
[I 2025-07-30 21:38:36,721] Trial 493 finished with value: 0.001223537023179233 and parameters: {'width_NN_heal': 188, 'width_NN_state': 232, 'depth_NN_heal': 4, 'depth_NN_state': 4, 'mode_heal': 60, 'mode_state': 64, 'blocks_heal': 7, 'blocks_state': 3, 'lift_act_state': <built-in function gelu>, 'block_act_state': <built-in function gelu>, 'lift_act_heal': <function tanh at 0x7ff3611b4cc0>, 'block_act_heal': <function tanh at 0x7ff3611b4cc0>, 'width_heal': 19, 'width_state': 23, 'lr': 0.0021581008032321948, 'padding_heal': 4, 'padding_state': 20, 'optimizer_type': 'lbfgs'}. Best is trial 484 with value: 0.0010389797389507294.
[I 2025-07-30 21:38:41,829] Trial 494 finished with value: 0.0017215232364833355 and parameters: {'width_NN_heal': 236, 'width_NN_state': 361, 'depth_NN_heal': 4, 'depth_NN_state': 4, 'mode_heal': 60, 'mode_state': 64, 'blocks_heal': 7, 'blocks_state': 2, 'lift_act_state': <built-in function gelu>, 'block_act_state': <built-in function gelu>, 'lift_act_heal': <function tanh at 0x7ff3611b4cc0>, 'block_act_heal': <function tanh at 0x7ff3611b4cc0>, 'width_heal': 17, 'width_state': 24, 'lr': 0.0017294599326447984, 'padding_heal': 4, 'padding_state': 21, 'optimizer_type': 'lbfgs'}. Best is trial 484 with value: 0.0010389797389507294.
[I 2025-07-30 21:38:47,689] Trial 495 finished with value: 0.0011653933906927705 and parameters: {'width_NN_heal': 215, 'width_NN_state': 444, 'depth_NN_heal': 4, 'depth_NN_state': 4, 'mode_heal': 60, 'mode_state': 64, 'blocks_heal': 7, 'blocks_state': 3, 'lift_act_state': <built-in function gelu>, 'block_act_state': <built-in function gelu>, 'lift_act_heal': <function tanh at 0x7ff3611b4cc0>, 'block_act_heal': <function tanh at 0x7ff3611b4cc0>, 'width_heal': 18, 'width_state': 23, 'lr': 0.002290445454922907, 'padding_heal': 5, 'padding_state': 19, 'optimizer_type': 'lbfgs'}. Best is trial 484 with value: 0.0010389797389507294.
[I 2025-07-30 21:38:52,434] Trial 496 finished with value: 0.0016031555132940412 and parameters: {'width_NN_heal': 213, 'width_NN_state': 275, 'depth_NN_heal': 4, 'depth_NN_state': 4, 'mode_heal': 60, 'mode_state': 64, 'blocks_heal': 7, 'blocks_state': 3, 'lift_act_state': <built-in function gelu>, 'block_act_state': <built-in function gelu>, 'lift_act_heal': <function tanh at 0x7ff3611b4cc0>, 'block_act_heal': <function tanh at 0x7ff3611b4cc0>, 'width_heal': 16, 'width_state': 26, 'lr': 0.002032189125003256, 'padding_heal': 5, 'padding_state': 19, 'optimizer_type': 'lbfgs'}. Best is trial 484 with value: 0.0010389797389507294.
[I 2025-07-30 21:38:57,254] Trial 497 finished with value: 0.0013981672236695886 and parameters: {'width_NN_heal': 139, 'width_NN_state': 324, 'depth_NN_heal': 4, 'depth_NN_state': 4, 'mode_heal': 60, 'mode_state': 64, 'blocks_heal': 7, 'blocks_state': 3, 'lift_act_state': <built-in function gelu>, 'block_act_state': <built-in function gelu>, 'lift_act_heal': <function tanh at 0x7ff3611b4cc0>, 'block_act_heal': <function tanh at 0x7ff3611b4cc0>, 'width_heal': 18, 'width_state': 24, 'lr': 0.0017993086432605719, 'padding_heal': 3, 'padding_state': 19, 'optimizer_type': 'lbfgs'}. Best is trial 484 with value: 0.0010389797389507294.
[I 2025-07-30 21:39:03,409] Trial 498 finished with value: 0.00122911820653826 and parameters: {'width_NN_heal': 242, 'width_NN_state': 511, 'depth_NN_heal': 4, 'depth_NN_state': 4, 'mode_heal': 60, 'mode_state': 64, 'blocks_heal': 7, 'blocks_state': 3, 'lift_act_state': <built-in function gelu>, 'block_act_state': <built-in function gelu>, 'lift_act_heal': <function tanh at 0x7ff3611b4cc0>, 'block_act_heal': <function tanh at 0x7ff3611b4cc0>, 'width_heal': 19, 'width_state': 22, 'lr': 0.0022194012075006995, 'padding_heal': 5, 'padding_state': 18, 'optimizer_type': 'lbfgs'}. Best is trial 484 with value: 0.0010389797389507294.
[I 2025-07-30 21:39:09,461] Trial 499 finished with value: 0.002807514974847436 and parameters: {'width_NN_heal': 252, 'width_NN_state': 466, 'depth_NN_heal': 4, 'depth_NN_state': 4, 'mode_heal': 60, 'mode_state': 64, 'blocks_heal': 7, 'blocks_state': 3, 'lift_act_state': <built-in function gelu>, 'block_act_state': None, 'lift_act_heal': <function tanh at 0x7ff3611b4cc0>, 'block_act_heal': <function tanh at 0x7ff3611b4cc0>, 'width_heal': 18, 'width_state': 23, 'lr': 0.0020397595063875685, 'padding_heal': 5, 'padding_state': 18, 'optimizer_type': 'lbfgs'}. Best is trial 484 with value: 0.0010389797389507294.
[I 2025-07-30 21:39:15,087] Trial 500 finished with value: 0.0020369214471429586 and parameters: {'width_NN_heal': 229, 'width_NN_state': 438, 'depth_NN_heal': 4, 'depth_NN_state': 4, 'mode_heal': 60, 'mode_state': 64, 'blocks_heal': 7, 'blocks_state': 3, 'lift_act_state': <built-in function gelu>, 'block_act_state': <built-in function gelu>, 'lift_act_heal': <function tanh at 0x7ff3611b4cc0>, 'block_act_heal': <function tanh at 0x7ff3611b4cc0>, 'width_heal': 16, 'width_state': 29, 'lr': 0.002187338971735869, 'padding_heal': 5, 'padding_state': 18, 'optimizer_type': 'lbfgs'}. Best is trial 484 with value: 0.0010389797389507294.
[I 2025-07-30 21:39:20,026] Trial 501 finished with value: 0.0013459017500281334 and parameters: {'width_NN_heal': 276, 'width_NN_state': 245, 'depth_NN_heal': 4, 'depth_NN_state': 4, 'mode_heal': 60, 'mode_state': 64, 'blocks_heal': 7, 'blocks_state': 3, 'lift_act_state': <built-in function gelu>, 'block_act_state': <built-in function gelu>, 'lift_act_heal': <function tanh at 0x7ff3611b4cc0>, 'block_act_heal': <function tanh at 0x7ff3611b4cc0>, 'width_heal': 19, 'width_state': 23, 'lr': 0.002184686188508983, 'padding_heal': 4, 'padding_state': 20, 'optimizer_type': 'lbfgs'}. Best is trial 484 with value: 0.0010389797389507294.
[I 2025-07-30 21:39:25,578] Trial 502 finished with value: 0.0015050668735057116 and parameters: {'width_NN_heal': 131, 'width_NN_state': 450, 'depth_NN_heal': 4, 'depth_NN_state': 4, 'mode_heal': 60, 'mode_state': 64, 'blocks_heal': 7, 'blocks_state': 3, 'lift_act_state': <built-in function gelu>, 'block_act_state': <built-in function gelu>, 'lift_act_heal': <function tanh at 0x7ff3611b4cc0>, 'block_act_heal': <function tanh at 0x7ff3611b4cc0>, 'width_heal': 17, 'width_state': 20, 'lr': 0.0024847004270637605, 'padding_heal': 3, 'padding_state': 18, 'optimizer_type': 'lbfgs'}. Best is trial 484 with value: 0.0010389797389507294.
[I 2025-07-30 21:39:32,161] Trial 503 finished with value: 0.0011795214377343655 and parameters: {'width_NN_heal': 303, 'width_NN_state': 504, 'depth_NN_heal': 4, 'depth_NN_state': 4, 'mode_heal': 60, 'mode_state': 64, 'blocks_heal': 7, 'blocks_state': 3, 'lift_act_state': <built-in function gelu>, 'block_act_state': <built-in function gelu>, 'lift_act_heal': <function tanh at 0x7ff3611b4cc0>, 'block_act_heal': <function tanh at 0x7ff3611b4cc0>, 'width_heal': 19, 'width_state': 27, 'lr': 0.002420655479428777, 'padding_heal': 5, 'padding_state': 19, 'optimizer_type': 'lbfgs'}. Best is trial 484 with value: 0.0010389797389507294.
[I 2025-07-30 21:39:38,584] Trial 504 finished with value: 0.0012893493985757232 and parameters: {'width_NN_heal': 282, 'width_NN_state': 512, 'depth_NN_heal': 4, 'depth_NN_state': 4, 'mode_heal': 60, 'mode_state': 64, 'blocks_heal': 7, 'blocks_state': 2, 'lift_act_state': <built-in function gelu>, 'block_act_state': <built-in function gelu>, 'lift_act_heal': <function tanh at 0x7ff3611b4cc0>, 'block_act_heal': <function tanh at 0x7ff3611b4cc0>, 'width_heal': 21, 'width_state': 28, 'lr': 0.0018387767505868326, 'padding_heal': 5, 'padding_state': 19, 'optimizer_type': 'lbfgs'}. Best is trial 484 with value: 0.0010389797389507294.
[I 2025-07-30 21:39:43,375] Trial 505 finished with value: 0.0010981621453538537 and parameters: {'width_NN_heal': 150, 'width_NN_state': 264, 'depth_NN_heal': 4, 'depth_NN_state': 4, 'mode_heal': 60, 'mode_state': 64, 'blocks_heal': 7, 'blocks_state': 3, 'lift_act_state': <built-in function gelu>, 'block_act_state': <built-in function gelu>, 'lift_act_heal': <function tanh at 0x7ff3611b4cc0>, 'block_act_heal': <function tanh at 0x7ff3611b4cc0>, 'width_heal': 18, 'width_state': 24, 'lr': 0.0022733101469827144, 'padding_heal': 5, 'padding_state': 20, 'optimizer_type': 'lbfgs'}. Best is trial 484 with value: 0.0010389797389507294.
[I 2025-07-30 21:39:49,776] Trial 506 finished with value: 0.0015839483821764588 and parameters: {'width_NN_heal': 288, 'width_NN_state': 475, 'depth_NN_heal': 4, 'depth_NN_state': 4, 'mode_heal': 60, 'mode_state': 64, 'blocks_heal': 7, 'blocks_state': 3, 'lift_act_state': <built-in function gelu>, 'block_act_state': <built-in function gelu>, 'lift_act_heal': <function tanh at 0x7ff3611b4cc0>, 'block_act_heal': <function tanh at 0x7ff3611b4cc0>, 'width_heal': 17, 'width_state': 27, 'lr': 0.00212423643229583, 'padding_heal': 5, 'padding_state': 20, 'optimizer_type': 'lbfgs'}. Best is trial 484 with value: 0.0010389797389507294.
[I 2025-07-30 21:39:54,508] Trial 507 finished with value: 0.007489117793738842 and parameters: {'width_NN_heal': 239, 'width_NN_state': 240, 'depth_NN_heal': 4, 'depth_NN_state': 4, 'mode_heal': 60, 'mode_state': 64, 'blocks_heal': 7, 'blocks_state': 3, 'lift_act_state': <built-in function gelu>, 'block_act_state': <built-in function gelu>, 'lift_act_heal': <function tanh at 0x7ff3611b4cc0>, 'block_act_heal': <function tanh at 0x7ff3611b4cc0>, 'width_heal': 5, 'width_state': 25, 'lr': 0.0019141150656911282, 'padding_heal': 5, 'padding_state': 20, 'optimizer_type': 'lbfgs'}. Best is trial 484 with value: 0.0010389797389507294.
[I 2025-07-30 21:39:59,331] Trial 508 finished with value: 0.0012500034645199776 and parameters: {'width_NN_heal': 214, 'width_NN_state': 208, 'depth_NN_heal': 4, 'depth_NN_state': 4, 'mode_heal': 60, 'mode_state': 64, 'blocks_heal': 7, 'blocks_state': 3, 'lift_act_state': <built-in function gelu>, 'block_act_state': <built-in function gelu>, 'lift_act_heal': <function tanh at 0x7ff3611b4cc0>, 'block_act_heal': <function tanh at 0x7ff3611b4cc0>, 'width_heal': 20, 'width_state': 25, 'lr': 0.0020922132824812314, 'padding_heal': 4, 'padding_state': 20, 'optimizer_type': 'lbfgs'}. Best is trial 484 with value: 0.0010389797389507294.
[I 2025-07-30 21:40:04,996] Trial 509 finished with value: 0.0013714710948988795 and parameters: {'width_NN_heal': 126, 'width_NN_state': 497, 'depth_NN_heal': 4, 'depth_NN_state': 4, 'mode_heal': 60, 'mode_state': 64, 'blocks_heal': 7, 'blocks_state': 3, 'lift_act_state': <built-in function gelu>, 'block_act_state': <built-in function gelu>, 'lift_act_heal': <function tanh at 0x7ff3611b4cc0>, 'block_act_heal': <function tanh at 0x7ff3611b4cc0>, 'width_heal': 18, 'width_state': 23, 'lr': 0.002513570893273419, 'padding_heal': 3, 'padding_state': 21, 'optimizer_type': 'lbfgs'}. Best is trial 484 with value: 0.0010389797389507294.
[I 2025-07-30 21:40:10,019] Trial 510 finished with value: 0.002165862126275897 and parameters: {'width_NN_heal': 376, 'width_NN_state': 227, 'depth_NN_heal': 4, 'depth_NN_state': 4, 'mode_heal': 56, 'mode_state': 64, 'blocks_heal': 7, 'blocks_state': 3, 'lift_act_state': <built-in function gelu>, 'block_act_state': <built-in function gelu>, 'lift_act_heal': <function tanh at 0x7ff3611b4cc0>, 'block_act_heal': <function tanh at 0x7ff3611b4cc0>, 'width_heal': 21, 'width_state': 27, 'lr': 0.0015510012527846391, 'padding_heal': 3, 'padding_state': 21, 'optimizer_type': 'lbfgs'}. Best is trial 484 with value: 0.0010389797389507294.
[I 2025-07-30 21:40:14,846] Trial 511 finished with value: 0.0012844441225752234 and parameters: {'width_NN_heal': 198, 'width_NN_state': 291, 'depth_NN_heal': 4, 'depth_NN_state': 4, 'mode_heal': 60, 'mode_state': 60, 'blocks_heal': 7, 'blocks_state': 3, 'lift_act_state': <built-in function gelu>, 'block_act_state': <built-in function gelu>, 'lift_act_heal': <function tanh at 0x7ff3611b4cc0>, 'block_act_heal': <function tanh at 0x7ff3611b4cc0>, 'width_heal': 18, 'width_state': 22, 'lr': 0.0023062024625090717, 'padding_heal': 4, 'padding_state': 20, 'optimizer_type': 'lbfgs'}. Best is trial 484 with value: 0.0010389797389507294.
[I 2025-07-30 21:40:19,616] Trial 512 finished with value: 0.0012491762172430754 and parameters: {'width_NN_heal': 309, 'width_NN_state': 199, 'depth_NN_heal': 4, 'depth_NN_state': 4, 'mode_heal': 60, 'mode_state': 64, 'blocks_heal': 7, 'blocks_state': 3, 'lift_act_state': <built-in function gelu>, 'block_act_state': <built-in function gelu>, 'lift_act_heal': <function tanh at 0x7ff3611b4cc0>, 'block_act_heal': None, 'width_heal': 16, 'width_state': 22, 'lr': 0.0022907319711210294, 'padding_heal': 5, 'padding_state': 21, 'optimizer_type': 'lbfgs'}. Best is trial 484 with value: 0.0010389797389507294.
[I 2025-07-30 21:40:24,355] Trial 513 finished with value: 0.0011934083886444569 and parameters: {'width_NN_heal': 149, 'width_NN_state': 250, 'depth_NN_heal': 4, 'depth_NN_state': 4, 'mode_heal': 60, 'mode_state': 64, 'blocks_heal': 7, 'blocks_state': 3, 'lift_act_state': <built-in function gelu>, 'block_act_state': <built-in function gelu>, 'lift_act_heal': <function tanh at 0x7ff3611b4cc0>, 'block_act_heal': <function tanh at 0x7ff3611b4cc0>, 'width_heal': 20, 'width_state': 25, 'lr': 0.002444517291869867, 'padding_heal': 3, 'padding_state': 20, 'optimizer_type': 'lbfgs'}. Best is trial 484 with value: 0.0010389797389507294.
[I 2025-07-30 21:40:29,236] Trial 514 finished with value: 0.0017566245514899492 and parameters: {'width_NN_heal': 145, 'width_NN_state': 259, 'depth_NN_heal': 4, 'depth_NN_state': 4, 'mode_heal': 60, 'mode_state': 64, 'blocks_heal': 7, 'blocks_state': 3, 'lift_act_state': <built-in function gelu>, 'block_act_state': <built-in function gelu>, 'lift_act_heal': <function tanh at 0x7ff3611b4cc0>, 'block_act_heal': <function tanh at 0x7ff3611b4cc0>, 'width_heal': 25, 'width_state': 26, 'lr': 0.0024714509454329516, 'padding_heal': 3, 'padding_state': 20, 'optimizer_type': 'lbfgs'}. Best is trial 484 with value: 0.0010389797389507294.
[I 2025-07-30 21:40:34,052] Trial 515 finished with value: 0.0018478053389117122 and parameters: {'width_NN_heal': 147, 'width_NN_state': 250, 'depth_NN_heal': 4, 'depth_NN_state': 4, 'mode_heal': 60, 'mode_state': 64, 'blocks_heal': 7, 'blocks_state': 3, 'lift_act_state': <built-in function gelu>, 'block_act_state': <built-in function gelu>, 'lift_act_heal': <function tanh at 0x7ff3611b4cc0>, 'block_act_heal': <function tanh at 0x7ff3611b4cc0>, 'width_heal': 20, 'width_state': 23, 'lr': 0.0019353138036519947, 'padding_heal': 2, 'padding_state': 19, 'optimizer_type': 'lbfgs'}. Best is trial 484 with value: 0.0010389797389507294.
[I 2025-07-30 21:40:39,700] Trial 516 finished with value: 0.0012746185529977083 and parameters: {'width_NN_heal': 176, 'width_NN_state': 422, 'depth_NN_heal': 4, 'depth_NN_state': 4, 'mode_heal': 60, 'mode_state': 60, 'blocks_heal': 7, 'blocks_state': 3, 'lift_act_state': <built-in function gelu>, 'block_act_state': <built-in function gelu>, 'lift_act_heal': <function tanh at 0x7ff3611b4cc0>, 'block_act_heal': <function tanh at 0x7ff3611b4cc0>, 'width_heal': 21, 'width_state': 24, 'lr': 0.002359643517129343, 'padding_heal': 4, 'padding_state': 18, 'optimizer_type': 'lbfgs'}. Best is trial 484 with value: 0.0010389797389507294.
[I 2025-07-30 21:40:44,495] Trial 517 finished with value: 0.007086094468832016 and parameters: {'width_NN_heal': 125, 'width_NN_state': 226, 'depth_NN_heal': 4, 'depth_NN_state': 4, 'mode_heal': 56, 'mode_state': 64, 'blocks_heal': 7, 'blocks_state': 3, 'lift_act_state': <built-in function gelu>, 'block_act_state': <built-in function gelu>, 'lift_act_heal': <function tanh at 0x7ff3611b4cc0>, 'block_act_heal': <function tanh at 0x7ff3611b4cc0>, 'width_heal': 19, 'width_state': 30, 'lr': 0.0008176133122264094, 'padding_heal': 3, 'padding_state': 20, 'optimizer_type': 'lbfgs'}. Best is trial 484 with value: 0.0010389797389507294.
[I 2025-07-30 21:40:49,346] Trial 518 finished with value: 0.0011538153048604727 and parameters: {'width_NN_heal': 201, 'width_NN_state': 282, 'depth_NN_heal': 4, 'depth_NN_state': 4, 'mode_heal': 60, 'mode_state': 64, 'blocks_heal': 7, 'blocks_state': 3, 'lift_act_state': <built-in function gelu>, 'block_act_state': <built-in function gelu>, 'lift_act_heal': <function tanh at 0x7ff3611b4cc0>, 'block_act_heal': <function tanh at 0x7ff3611b4cc0>, 'width_heal': 17, 'width_state': 25, 'lr': 0.002112154160464328, 'padding_heal': 5, 'padding_state': 19, 'optimizer_type': 'lbfgs'}. Best is trial 484 with value: 0.0010389797389507294.
[I 2025-07-30 21:40:54,158] Trial 519 finished with value: 0.0014932905323803425 and parameters: {'width_NN_heal': 198, 'width_NN_state': 301, 'depth_NN_heal': 4, 'depth_NN_state': 4, 'mode_heal': 56, 'mode_state': 60, 'blocks_heal': 7, 'blocks_state': 3, 'lift_act_state': <built-in function gelu>, 'block_act_state': <built-in function gelu>, 'lift_act_heal': <function tanh at 0x7ff3611b4cc0>, 'block_act_heal': <function tanh at 0x7ff3611b4cc0>, 'width_heal': 17, 'width_state': 25, 'lr': 0.002126916106944925, 'padding_heal': 5, 'padding_state': 20, 'optimizer_type': 'lbfgs'}. Best is trial 484 with value: 0.0010389797389507294.
[I 2025-07-30 21:40:58,690] Trial 520 finished with value: 0.0014877405483275652 and parameters: {'width_NN_heal': 208, 'width_NN_state': 197, 'depth_NN_heal': 4, 'depth_NN_state': 4, 'mode_heal': 60, 'mode_state': 64, 'blocks_heal': 7, 'blocks_state': 2, 'lift_act_state': <built-in function gelu>, 'block_act_state': <built-in function gelu>, 'lift_act_heal': <function tanh at 0x7ff3611b4cc0>, 'block_act_heal': <function tanh at 0x7ff3611b4cc0>, 'width_heal': 15, 'width_state': 28, 'lr': 0.0018753981084572192, 'padding_heal': 2, 'padding_state': 21, 'optimizer_type': 'lbfgs'}. Best is trial 484 with value: 0.0010389797389507294.
