[I 2025-07-30 22:23:06,706] Trial 1050 finished with value: 0.0016091724392026663 and parameters: {'width_NN_heal': 375, 'width_NN_state': 358, 'depth_NN_heal': 2, 'depth_NN_state': 3, 'mode_heal': 60, 'mode_state': 60, 'blocks_heal': 7, 'blocks_state': 3, 'lift_act_state': None, 'block_act_state': <built-in function gelu>, 'lift_act_heal': <function tanh at 0x7ff3611b4cc0>, 'block_act_heal': None, 'width_heal': 47, 'width_state': 83, 'lr': 0.0011362803226780199, 'padding_heal': 3, 'padding_state': 19, 'optimizer_type': 'lbfgs'}. Best is trial 771 with value: 0.0010052043944597244.
[I 2025-07-30 22:23:11,302] Trial 1051 finished with value: 0.0012307922588661313 and parameters: {'width_NN_heal': 321, 'width_NN_state': 314, 'depth_NN_heal': 2, 'depth_NN_state': 3, 'mode_heal': 60, 'mode_state': 64, 'blocks_heal': 7, 'blocks_state': 3, 'lift_act_state': <built-in function gelu>, 'block_act_state': <built-in function gelu>, 'lift_act_heal': <function tanh at 0x7ff3611b4cc0>, 'block_act_heal': None, 'width_heal': 38, 'width_state': 74, 'lr': 0.000992623269782864, 'padding_heal': 22, 'padding_state': 18, 'optimizer_type': 'lbfgs'}. Best is trial 771 with value: 0.0010052043944597244.
[I 2025-07-30 22:23:15,958] Trial 1052 finished with value: 0.002053821925073862 and parameters: {'width_NN_heal': 462, 'width_NN_state': 275, 'depth_NN_heal': 2, 'depth_NN_state': 3, 'mode_heal': 60, 'mode_state': 64, 'blocks_heal': 7, 'blocks_state': 3, 'lift_act_state': <built-in function gelu>, 'block_act_state': <function tanh at 0x7ff3611b4cc0>, 'lift_act_heal': <function tanh at 0x7ff3611b4cc0>, 'block_act_heal': None, 'width_heal': 44, 'width_state': 92, 'lr': 0.0011958879375054317, 'padding_heal': 4, 'padding_state': 17, 'optimizer_type': 'lbfgs'}. Best is trial 771 with value: 0.0010052043944597244.
[I 2025-07-30 22:23:20,194] Trial 1053 finished with value: 0.0011773380683735013 and parameters: {'width_NN_heal': 335, 'width_NN_state': 386, 'depth_NN_heal': 2, 'depth_NN_state': 3, 'mode_heal': 60, 'mode_state': 60, 'blocks_heal': 4, 'blocks_state': 3, 'lift_act_state': <built-in function gelu>, 'block_act_state': <built-in function gelu>, 'lift_act_heal': <function tanh at 0x7ff3611b4cc0>, 'block_act_heal': None, 'width_heal': 40, 'width_state': 78, 'lr': 0.001368160320281404, 'padding_heal': 4, 'padding_state': 17, 'optimizer_type': 'lbfgs'}. Best is trial 771 with value: 0.0010052043944597244.
[I 2025-07-30 22:23:24,848] Trial 1054 finished with value: 0.0010617743246257305 and parameters: {'width_NN_heal': 297, 'width_NN_state': 340, 'depth_NN_heal': 2, 'depth_NN_state': 3, 'mode_heal': 64, 'mode_state': 64, 'blocks_heal': 7, 'blocks_state': 3, 'lift_act_state': <built-in function gelu>, 'block_act_state': <built-in function gelu>, 'lift_act_heal': <function tanh at 0x7ff3611b4cc0>, 'block_act_heal': None, 'width_heal': 46, 'width_state': 100, 'lr': 0.0012369891890903707, 'padding_heal': 3, 'padding_state': 19, 'optimizer_type': 'lbfgs'}. Best is trial 771 with value: 0.0010052043944597244.
[I 2025-07-30 22:23:29,887] Trial 1055 finished with value: 0.0013750584330409765 and parameters: {'width_NN_heal': 276, 'width_NN_state': 420, 'depth_NN_heal': 2, 'depth_NN_state': 3, 'mode_heal': 64, 'mode_state': 64, 'blocks_heal': 7, 'blocks_state': 3, 'lift_act_state': <built-in function gelu>, 'block_act_state': <built-in function gelu>, 'lift_act_heal': <function tanh at 0x7ff3611b4cc0>, 'block_act_heal': None, 'width_heal': 50, 'width_state': 111, 'lr': 0.001391636856374929, 'padding_heal': 2, 'padding_state': 15, 'optimizer_type': 'lbfgs'}. Best is trial 771 with value: 0.0010052043944597244.
[I 2025-07-30 22:23:34,655] Trial 1056 finished with value: 0.00199236162006855 and parameters: {'width_NN_heal': 297, 'width_NN_state': 375, 'depth_NN_heal': 2, 'depth_NN_state': 3, 'mode_heal': 64, 'mode_state': 64, 'blocks_heal': 7, 'blocks_state': 3, 'lift_act_state': <built-in function gelu>, 'block_act_state': None, 'lift_act_heal': <function tanh at 0x7ff3611b4cc0>, 'block_act_heal': None, 'width_heal': 50, 'width_state': 122, 'lr': 0.0012414807708131953, 'padding_heal': 4, 'padding_state': 18, 'optimizer_type': 'lbfgs'}. Best is trial 771 with value: 0.0010052043944597244.
[I 2025-07-30 22:23:39,234] Trial 1057 finished with value: 0.0012029091594740748 and parameters: {'width_NN_heal': 288, 'width_NN_state': 349, 'depth_NN_heal': 2, 'depth_NN_state': 3, 'mode_heal': 64, 'mode_state': 64, 'blocks_heal': 7, 'blocks_state': 3, 'lift_act_state': <built-in function gelu>, 'block_act_state': <built-in function gelu>, 'lift_act_heal': <function tanh at 0x7ff3611b4cc0>, 'block_act_heal': None, 'width_heal': 45, 'width_state': 106, 'lr': 0.0014345045890905989, 'padding_heal': 1, 'padding_state': 17, 'optimizer_type': 'lbfgs'}. Best is trial 771 with value: 0.0010052043944597244.
[I 2025-07-30 22:23:43,835] Trial 1058 finished with value: 0.002360098296776414 and parameters: {'width_NN_heal': 271, 'width_NN_state': 442, 'depth_NN_heal': 2, 'depth_NN_state': 3, 'mode_heal': 64, 'mode_state': 64, 'blocks_heal': 7, 'blocks_state': 1, 'lift_act_state': <built-in function gelu>, 'block_act_state': <built-in function gelu>, 'lift_act_heal': <function tanh at 0x7ff3611b4cc0>, 'block_act_heal': None, 'width_heal': 37, 'width_state': 102, 'lr': 0.0011214102624035696, 'padding_heal': 3, 'padding_state': 19, 'optimizer_type': 'lbfgs'}. Best is trial 771 with value: 0.0010052043944597244.
[I 2025-07-30 22:23:48,421] Trial 1059 finished with value: 0.0012631143908947706 and parameters: {'width_NN_heal': 311, 'width_NN_state': 321, 'depth_NN_heal': 2, 'depth_NN_state': 3, 'mode_heal': 64, 'mode_state': 64, 'blocks_heal': 7, 'blocks_state': 3, 'lift_act_state': <built-in function gelu>, 'block_act_state': <built-in function gelu>, 'lift_act_heal': <function tanh at 0x7ff3611b4cc0>, 'block_act_heal': None, 'width_heal': 38, 'width_state': 116, 'lr': 0.0013698582528717783, 'padding_heal': 4, 'padding_state': 18, 'optimizer_type': 'lbfgs'}. Best is trial 771 with value: 0.0010052043944597244.
[I 2025-07-30 22:23:53,042] Trial 1060 finished with value: 0.0012172500137239695 and parameters: {'width_NN_heal': 262, 'width_NN_state': 350, 'depth_NN_heal': 2, 'depth_NN_state': 3, 'mode_heal': 64, 'mode_state': 64, 'blocks_heal': 7, 'blocks_state': 3, 'lift_act_state': <built-in function gelu>, 'block_act_state': <built-in function gelu>, 'lift_act_heal': <function tanh at 0x7ff3611b4cc0>, 'block_act_heal': None, 'width_heal': 48, 'width_state': 69, 'lr': 0.001031868579663235, 'padding_heal': 2, 'padding_state': 14, 'optimizer_type': 'lbfgs'}. Best is trial 771 with value: 0.0010052043944597244.
[I 2025-07-30 22:23:57,736] Trial 1061 finished with value: 0.00183643598575145 and parameters: {'width_NN_heal': 305, 'width_NN_state': 389, 'depth_NN_heal': 2, 'depth_NN_state': 3, 'mode_heal': 64, 'mode_state': 64, 'blocks_heal': 7, 'blocks_state': 3, 'lift_act_state': <built-in function gelu>, 'block_act_state': <built-in function gelu>, 'lift_act_heal': <function tanh at 0x7ff3611b4cc0>, 'block_act_heal': None, 'width_heal': 46, 'width_state': 98, 'lr': 0.0012866415927645363, 'padding_heal': 3, 'padding_state': 4, 'optimizer_type': 'lbfgs'}. Best is trial 771 with value: 0.0010052043944597244.
[I 2025-07-30 22:24:02,043] Trial 1062 finished with value: 0.002075968775898218 and parameters: {'width_NN_heal': 277, 'width_NN_state': 344, 'depth_NN_heal': 1, 'depth_NN_state': 1, 'mode_heal': 64, 'mode_state': 64, 'blocks_heal': 7, 'blocks_state': 3, 'lift_act_state': <built-in function gelu>, 'block_act_state': <built-in function gelu>, 'lift_act_heal': <function tanh at 0x7ff3611b4cc0>, 'block_act_heal': None, 'width_heal': 41, 'width_state': 109, 'lr': 0.0014365070935137393, 'padding_heal': 4, 'padding_state': 16, 'optimizer_type': 'lbfgs'}. Best is trial 771 with value: 0.0010052043944597244.
[I 2025-07-30 22:24:06,653] Trial 1063 finished with value: 0.0012509922962635756 and parameters: {'width_NN_heal': 327, 'width_NN_state': 374, 'depth_NN_heal': 2, 'depth_NN_state': 3, 'mode_heal': 64, 'mode_state': 64, 'blocks_heal': 7, 'blocks_state': 3, 'lift_act_state': <built-in function gelu>, 'block_act_state': <built-in function gelu>, 'lift_act_heal': <function tanh at 0x7ff3611b4cc0>, 'block_act_heal': None, 'width_heal': 37, 'width_state': 94, 'lr': 0.0012303590195081144, 'padding_heal': 3, 'padding_state': 19, 'optimizer_type': 'lbfgs'}. Best is trial 771 with value: 0.0010052043944597244.
[I 2025-07-30 22:24:11,246] Trial 1064 finished with value: 0.0019961379002779722 and parameters: {'width_NN_heal': 270, 'width_NN_state': 54, 'depth_NN_heal': 2, 'depth_NN_state': 3, 'mode_heal': 64, 'mode_state': 64, 'blocks_heal': 7, 'blocks_state': 3, 'lift_act_state': <built-in function gelu>, 'block_act_state': <built-in function gelu>, 'lift_act_heal': <function tanh at 0x7ff3611b4cc0>, 'block_act_heal': None, 'width_heal': 41, 'width_state': 118, 'lr': 0.0014757789878499167, 'padding_heal': 4, 'padding_state': 17, 'optimizer_type': 'lbfgs'}. Best is trial 771 with value: 0.0010052043944597244.
[I 2025-07-30 22:24:15,995] Trial 1065 finished with value: 0.0010446843225508928 and parameters: {'width_NN_heal': 432, 'width_NN_state': 327, 'depth_NN_heal': 2, 'depth_NN_state': 3, 'mode_heal': 64, 'mode_state': 64, 'blocks_heal': 7, 'blocks_state': 3, 'lift_act_state': <built-in function gelu>, 'block_act_state': <built-in function gelu>, 'lift_act_heal': <function tanh at 0x7ff3611b4cc0>, 'block_act_heal': None, 'width_heal': 46, 'width_state': 102, 'lr': 0.0011398083784860073, 'padding_heal': 2, 'padding_state': 18, 'optimizer_type': 'lbfgs'}. Best is trial 771 with value: 0.0010052043944597244.
[I 2025-07-30 22:24:21,259] Trial 1066 finished with value: 0.001196029013954103 and parameters: {'width_NN_heal': 484, 'width_NN_state': 395, 'depth_NN_heal': 2, 'depth_NN_state': 3, 'mode_heal': 64, 'mode_state': 64, 'blocks_heal': 7, 'blocks_state': 3, 'lift_act_state': <built-in function gelu>, 'block_act_state': <built-in function gelu>, 'lift_act_heal': <function tanh at 0x7ff3611b4cc0>, 'block_act_heal': None, 'width_heal': 47, 'width_state': 102, 'lr': 0.0009391299798240871, 'padding_heal': 1, 'padding_state': 17, 'optimizer_type': 'lbfgs'}. Best is trial 771 with value: 0.0010052043944597244.
[I 2025-07-30 22:24:26,061] Trial 1067 finished with value: 0.0013105344260111451 and parameters: {'width_NN_heal': 448, 'width_NN_state': 359, 'depth_NN_heal': 2, 'depth_NN_state': 3, 'mode_heal': 64, 'mode_state': 64, 'blocks_heal': 7, 'blocks_state': 3, 'lift_act_state': <built-in function gelu>, 'block_act_state': <built-in function gelu>, 'lift_act_heal': <function tanh at 0x7ff3611b4cc0>, 'block_act_heal': None, 'width_heal': 49, 'width_state': 107, 'lr': 0.0010937797920314064, 'padding_heal': 0, 'padding_state': 18, 'optimizer_type': 'lbfgs'}. Best is trial 771 with value: 0.0010052043944597244.
[I 2025-07-30 22:24:31,499] Trial 1068 finished with value: 0.0016717964317649603 and parameters: {'width_NN_heal': 430, 'width_NN_state': 335, 'depth_NN_heal': 2, 'depth_NN_state': 2, 'mode_heal': 64, 'mode_state': 64, 'blocks_heal': 7, 'blocks_state': 6, 'lift_act_state': <built-in function gelu>, 'block_act_state': <built-in function gelu>, 'lift_act_heal': None, 'block_act_heal': None, 'width_heal': 46, 'width_state': 117, 'lr': 0.0009788698778915891, 'padding_heal': 29, 'padding_state': 17, 'optimizer_type': 'lbfgs'}. Best is trial 771 with value: 0.0010052043944597244.
[I 2025-07-30 22:24:36,786] Trial 1069 finished with value: 0.0012024386087432504 and parameters: {'width_NN_heal': 455, 'width_NN_state': 409, 'depth_NN_heal': 2, 'depth_NN_state': 3, 'mode_heal': 64, 'mode_state': 64, 'blocks_heal': 7, 'blocks_state': 3, 'lift_act_state': <built-in function gelu>, 'block_act_state': <built-in function gelu>, 'lift_act_heal': <function tanh at 0x7ff3611b4cc0>, 'block_act_heal': None, 'width_heal': 51, 'width_state': 127, 'lr': 0.0008686652270458249, 'padding_heal': 1, 'padding_state': 16, 'optimizer_type': 'lbfgs'}. Best is trial 771 with value: 0.0010052043944597244.
[I 2025-07-30 22:24:41,718] Trial 1070 finished with value: 0.0011381322983652353 and parameters: {'width_NN_heal': 473, 'width_NN_state': 330, 'depth_NN_heal': 2, 'depth_NN_state': 3, 'mode_heal': 64, 'mode_state': 64, 'blocks_heal': 7, 'blocks_state': 3, 'lift_act_state': <built-in function gelu>, 'block_act_state': <built-in function gelu>, 'lift_act_heal': <function tanh at 0x7ff3611b4cc0>, 'block_act_heal': None, 'width_heal': 51, 'width_state': 99, 'lr': 0.0011085065738679252, 'padding_heal': 2, 'padding_state': 18, 'optimizer_type': 'lbfgs'}. Best is trial 771 with value: 0.0010052043944597244.
[I 2025-07-30 22:24:46,718] Trial 1071 finished with value: 0.00130914815235883 and parameters: {'width_NN_heal': 512, 'width_NN_state': 378, 'depth_NN_heal': 2, 'depth_NN_state': 3, 'mode_heal': 64, 'mode_state': 64, 'blocks_heal': 7, 'blocks_state': 3, 'lift_act_state': <built-in function gelu>, 'block_act_state': <built-in function gelu>, 'lift_act_heal': <function tanh at 0x7ff3611b4cc0>, 'block_act_heal': None, 'width_heal': 45, 'width_state': 111, 'lr': 0.0010481124209777786, 'padding_heal': 1, 'padding_state': 18, 'optimizer_type': 'lbfgs'}. Best is trial 771 with value: 0.0010052043944597244.
[I 2025-07-30 22:24:51,296] Trial 1072 finished with value: 0.0035228286869823933 and parameters: {'width_NN_heal': 421, 'width_NN_state': 328, 'depth_NN_heal': 2, 'depth_NN_state': 3, 'mode_heal': 64, 'mode_state': 64, 'blocks_heal': 7, 'blocks_state': 3, 'lift_act_state': None, 'block_act_state': <function tanh at 0x7ff3611b4cc0>, 'lift_act_heal': <function tanh at 0x7ff3611b4cc0>, 'block_act_heal': None, 'width_heal': 37, 'width_state': 101, 'lr': 0.0011714272547779475, 'padding_heal': 2, 'padding_state': 16, 'optimizer_type': 'lbfgs'}. Best is trial 771 with value: 0.0010052043944597244.
[I 2025-07-30 22:24:56,552] Trial 1073 finished with value: 0.0014160084538161755 and parameters: {'width_NN_heal': 394, 'width_NN_state': 436, 'depth_NN_heal': 2, 'depth_NN_state': 3, 'mode_heal': 64, 'mode_state': 64, 'blocks_heal': 7, 'blocks_state': 3, 'lift_act_state': <built-in function gelu>, 'block_act_state': <built-in function gelu>, 'lift_act_heal': <function tanh at 0x7ff3611b4cc0>, 'block_act_heal': None, 'width_heal': 44, 'width_state': 105, 'lr': 0.0011709577533360648, 'padding_heal': 2, 'padding_state': 17, 'optimizer_type': 'lbfgs'}. Best is trial 771 with value: 0.0010052043944597244.
[I 2025-07-30 22:25:01,910] Trial 1074 finished with value: 0.0016438839957118034 and parameters: {'width_NN_heal': 418, 'width_NN_state': 478, 'depth_NN_heal': 2, 'depth_NN_state': 3, 'mode_heal': 64, 'mode_state': 64, 'blocks_heal': 7, 'blocks_state': 3, 'lift_act_state': <built-in function gelu>, 'block_act_state': <built-in function gelu>, 'lift_act_heal': <function tanh at 0x7ff3611b4cc0>, 'block_act_heal': None, 'width_heal': 35, 'width_state': 98, 'lr': 0.0010053562291361517, 'padding_heal': 2, 'padding_state': 18, 'optimizer_type': 'lbfgs'}. Best is trial 771 with value: 0.0010052043944597244.
[I 2025-07-30 22:25:06,580] Trial 1075 finished with value: 0.0011557667749002576 and parameters: {'width_NN_heal': 385, 'width_NN_state': 353, 'depth_NN_heal': 2, 'depth_NN_state': 3, 'mode_heal': 64, 'mode_state': 64, 'blocks_heal': 7, 'blocks_state': 3, 'lift_act_state': <built-in function gelu>, 'block_act_state': <built-in function gelu>, 'lift_act_heal': <function tanh at 0x7ff3611b4cc0>, 'block_act_heal': None, 'width_heal': 39, 'width_state': 117, 'lr': 0.001266171418450561, 'padding_heal': 1, 'padding_state': 17, 'optimizer_type': 'lbfgs'}. Best is trial 771 with value: 0.0010052043944597244.
[I 2025-07-30 22:25:11,079] Trial 1076 finished with value: 0.0012736381031572819 and parameters: {'width_NN_heal': 476, 'width_NN_state': 313, 'depth_NN_heal': 1, 'depth_NN_state': 3, 'mode_heal': 64, 'mode_state': 64, 'blocks_heal': 7, 'blocks_state': 3, 'lift_act_state': <built-in function gelu>, 'block_act_state': <built-in function gelu>, 'lift_act_heal': <function tanh at 0x7ff3611b4cc0>, 'block_act_heal': None, 'width_heal': 36, 'width_state': 68, 'lr': 0.0011225112652515966, 'padding_heal': 4, 'padding_state': 16, 'optimizer_type': 'lbfgs'}. Best is trial 771 with value: 0.0010052043944597244.
[I 2025-07-30 22:25:16,904] Trial 1077 finished with value: 0.0018501896411180496 and parameters: {'width_NN_heal': 423, 'width_NN_state': 314, 'depth_NN_heal': 2, 'depth_NN_state': 3, 'mode_heal': 64, 'mode_state': 64, 'blocks_heal': 7, 'blocks_state': 7, 'lift_act_state': <built-in function gelu>, 'block_act_state': <built-in function gelu>, 'lift_act_heal': <function tanh at 0x7ff3611b4cc0>, 'block_act_heal': None, 'width_heal': 39, 'width_state': 108, 'lr': 0.0014981742934950244, 'padding_heal': 3, 'padding_state': 15, 'optimizer_type': 'lbfgs'}. Best is trial 771 with value: 0.0010052043944597244.
[I 2025-07-30 22:25:21,380] Trial 1078 finished with value: 0.003170887939631939 and parameters: {'width_NN_heal': 264, 'width_NN_state': 361, 'depth_NN_heal': 2, 'depth_NN_state': 2, 'mode_heal': 64, 'mode_state': 64, 'blocks_heal': 7, 'blocks_state': 3, 'lift_act_state': <built-in function gelu>, 'block_act_state': None, 'lift_act_heal': <function tanh at 0x7ff3611b4cc0>, 'block_act_heal': None, 'width_heal': 42, 'width_state': 92, 'lr': 0.0012873226671733771, 'padding_heal': 2, 'padding_state': 18, 'optimizer_type': 'lbfgs'}. Best is trial 771 with value: 0.0010052043944597244.
[I 2025-07-30 22:25:26,181] Trial 1079 finished with value: 0.0010574678890407085 and parameters: {'width_NN_heal': 394, 'width_NN_state': 306, 'depth_NN_heal': 2, 'depth_NN_state': 3, 'mode_heal': 64, 'mode_state': 64, 'blocks_heal': 7, 'blocks_state': 3, 'lift_act_state': <built-in function gelu>, 'block_act_state': <built-in function gelu>, 'lift_act_heal': <function tanh at 0x7ff3611b4cc0>, 'block_act_heal': None, 'width_heal': 53, 'width_state': 72, 'lr': 0.001085457435073861, 'padding_heal': 4, 'padding_state': 17, 'optimizer_type': 'lbfgs'}. Best is trial 771 with value: 0.0010052043944597244.
[I 2025-07-30 22:25:29,484] Trial 1080 finished with value: 0.001461673527956009 and parameters: {'width_NN_heal': 293, 'width_NN_state': 338, 'depth_NN_heal': 2, 'depth_NN_state': 3, 'mode_heal': 64, 'mode_state': 60, 'blocks_heal': 1, 'blocks_state': 3, 'lift_act_state': <built-in function gelu>, 'block_act_state': <built-in function gelu>, 'lift_act_heal': <function tanh at 0x7ff3611b4cc0>, 'block_act_heal': None, 'width_heal': 52, 'width_state': 69, 'lr': 0.0009258399226373536, 'padding_heal': 4, 'padding_state': 16, 'optimizer_type': 'lbfgs'}. Best is trial 771 with value: 0.0010052043944597244.
[I 2025-07-30 22:25:34,641] Trial 1081 finished with value: 0.0011585814645513892 and parameters: {'width_NN_heal': 374, 'width_NN_state': 392, 'depth_NN_heal': 2, 'depth_NN_state': 3, 'mode_heal': 16, 'mode_state': 64, 'blocks_heal': 7, 'blocks_state': 3, 'lift_act_state': <built-in function gelu>, 'block_act_state': <built-in function gelu>, 'lift_act_heal': <function tanh at 0x7ff3611b4cc0>, 'block_act_heal': None, 'width_heal': 55, 'width_state': 72, 'lr': 0.0010465323968064037, 'padding_heal': 4, 'padding_state': 17, 'optimizer_type': 'lbfgs'}. Best is trial 771 with value: 0.0010052043944597244.
[I 2025-07-30 22:25:39,702] Trial 1082 finished with value: 0.0010582515969872475 and parameters: {'width_NN_heal': 450, 'width_NN_state': 358, 'depth_NN_heal': 2, 'depth_NN_state': 3, 'mode_heal': 64, 'mode_state': 64, 'blocks_heal': 7, 'blocks_state': 3, 'lift_act_state': <built-in function gelu>, 'block_act_state': <built-in function gelu>, 'lift_act_heal': <function tanh at 0x7ff3611b4cc0>, 'block_act_heal': None, 'width_heal': 53, 'width_state': 75, 'lr': 0.0008833598045600741, 'padding_heal': 4, 'padding_state': 17, 'optimizer_type': 'lbfgs'}. Best is trial 771 with value: 0.0010052043944597244.
[I 2025-07-30 22:25:45,204] Trial 1083 finished with value: 0.0011809031711891294 and parameters: {'width_NN_heal': 444, 'width_NN_state': 388, 'depth_NN_heal': 2, 'depth_NN_state': 3, 'mode_heal': 64, 'mode_state': 60, 'blocks_heal': 7, 'blocks_state': 3, 'lift_act_state': <built-in function gelu>, 'block_act_state': <built-in function gelu>, 'lift_act_heal': <function tanh at 0x7ff3611b4cc0>, 'block_act_heal': None, 'width_heal': 54, 'width_state': 72, 'lr': 0.0008226893340530804, 'padding_heal': 4, 'padding_state': 16, 'optimizer_type': 'lbfgs'}. Best is trial 771 with value: 0.0010052043944597244.
[I 2025-07-30 22:25:50,660] Trial 1084 finished with value: 0.0012305930722504854 and parameters: {'width_NN_heal': 452, 'width_NN_state': 410, 'depth_NN_heal': 2, 'depth_NN_state': 3, 'mode_heal': 64, 'mode_state': 64, 'blocks_heal': 7, 'blocks_state': 3, 'lift_act_state': <built-in function gelu>, 'block_act_state': <built-in function gelu>, 'lift_act_heal': <function tanh at 0x7ff3611b4cc0>, 'block_act_heal': None, 'width_heal': 52, 'width_state': 66, 'lr': 0.0009270236288914341, 'padding_heal': 4, 'padding_state': 15, 'optimizer_type': 'lbfgs'}. Best is trial 771 with value: 0.0010052043944597244.
[I 2025-07-30 22:25:55,388] Trial 1085 finished with value: 0.0014003707328811288 and parameters: {'width_NN_heal': 269, 'width_NN_state': 363, 'depth_NN_heal': 2, 'depth_NN_state': 3, 'mode_heal': 64, 'mode_state': 64, 'blocks_heal': 7, 'blocks_state': 3, 'lift_act_state': <built-in function gelu>, 'block_act_state': <built-in function gelu>, 'lift_act_heal': <function tanh at 0x7ff3611b4cc0>, 'block_act_heal': None, 'width_heal': 53, 'width_state': 75, 'lr': 0.000748987925904649, 'padding_heal': 4, 'padding_state': 16, 'optimizer_type': 'lbfgs'}. Best is trial 771 with value: 0.0010052043944597244.
